created_at,full_text,lang,user_name
Tue Jul 02 18:17:16 +0000 2019,"We aren’t farmers, but we work with them every day. Together, we can make a difference around #cleanwater through programs like #AgWaterChallenge from @CeresNews @World_Wildlife and regional programs from @nature_org.  Learn more in our CSR report https://t.co/ftT4hZPLbb https://t.co/RZXD13pKoS",en,ADM
Mon Jul 01 16:18:02 +0000 2019,"ADM Biopolis colleagues recently opened their labs to families during the annual Expociència in Valencia, Spain, helping kids learn to build a model cell – and an early interest in science. #Futureleaders #STEMeducation https://t.co/6bYKzTRiep",en,ADM
Fri Jun 28 14:15:54 +0000 2019,"ADM to Release Second Quarter Financial Results Aug. 1, 2019 https://t.co/hMixcp9NjG",en,ADM
Wed Jun 26 14:23:57 +0000 2019,What do consumers think about #stevia in 2019? Our latest study found that 75% of people are aware of stevia AND consider it a #cleanlabel ingredient. Learn more here. https://t.co/HhyiHR0uQS https://t.co/dfvrJb6IGD,en,ADM
Tue Jun 25 14:52:18 +0000 2019,"More than 815 million people worldwide struggle with hunger. Preventing #postharvestloss can help make a difference, and we’re proud of the success @PHL_Institute has seen since we partnered with @ACESIllinois to establish it in 2011. Learn more here https://t.co/ftT4hZPLbb https://t.co/v6eXq4PkTt",en,ADM
Mon Jun 24 15:56:31 +0000 2019,"Andrew Kuehnert, a 10-year employee of ADM and 5th gen dairy farmer, got the chance of a lifetime as he was selected by the American Dairy Association Indiana to present a bottle of milk to the winning driver of this year’s #Indy500 race. #WinnersDrinkMilk https://t.co/MrrYStBCT6 https://t.co/7A9b7EM8Mx",en,ADM
Fri Jun 21 14:01:36 +0000 2019,"ADM’s recently acquired Neovia business in Mexico is big into pet food – and helping make a difference. Neovia’s dog food brand Ganador has been a long-term sponsor of @BocalanMexico, an organization that helps integrate people with disabilities through the assistance of dogs. https://t.co/RgQfesb3s4",en,ADM
Thu Jun 20 08:33:07 +0000 2019,#TBT. We celebrate the women in STEM who have played critical roles over more than a century of ADM’s success. Sunday’s International Women in Engineering Day highlights how they continue to lead at the heart of ADM’s business and geographical growth. #INWED19 https://t.co/j8IkkNF0Ax,en,ADM
Tue Jun 18 17:05:27 +0000 2019,Personalized nutrition is the next horizon of healthy eating. Today ADM’s President of Health &amp; Wellness Vikram Luthar is sharing perspectives on both the challenges and opportunities ahead at @foodtechinvest #futurefoodtech https://t.co/wbVyfNr7zx,en,ADM
Tue Jun 18 14:11:30 +0000 2019,"#Sustainability in motion. In 2018, ADM used 4M gallons of biodiesel vs standard fuel to power our river vessels – a benefit equal to taking 8,500 cars off the road for a year. And we know even more is possible. Learn more about our CSR efforts here https://t.co/ftT4hZPLbb https://t.co/P3zxxEA2A1",en,ADM
Mon Jun 17 13:37:07 +0000 2019,"In celebration of #FathersDay, Chris Boerm, ADM transportation president and father of two, shares his personal reasons for wanting to help #ClosetheGenderGap @p4parity https://t.co/1AobU69HDf",en,ADM
Fri Jun 14 21:19:15 +0000 2019,"Food engineering students from University of Munich attended an in-depth tour of our product development &amp; application labs in Heidelberg, Germany this week. A chance to discover the fascinating world behind products they consume every day. Inspiring tomorrow’s #foodtechnologists https://t.co/6TTBzeV9nJ",en,ADM
Tue Jun 11 13:45:09 +0000 2019,Priorities matter. ADM’s #sustainability efforts map directly to the 5 United Nations @SustDev #GlobalGoals where we deliver the strongest contribution. Download our latest CSR report to follow our journey https://t.co/ftT4hZPLbb https://t.co/9dNs9l7KFZ,en,ADM
Fri Jun 07 14:58:42 +0000 2019,"Since 2012, ADM has saved 2 billion gallons of water throughout our operations, and we’re always looking at ways to do more. Celebrating #WorldOceansDay through water conservation. #TogetherWeCan #everydropcounts https://t.co/pznndPPEe0",en,ADM
Tue Jun 04 21:55:50 +0000 2019,Reducing sugar in food and beverages is a challenge for developers. Find out more about more about ADM’s innovative solutions by visiting our booth this week at #IFT19 or downloading a copy of our latest white paper here https://t.co/cLdFvJx0uU https://t.co/nwbo6ROe8o,en,ADM
Tue Jun 04 14:52:00 +0000 2019,"We’ve found that the more we focus, the better we are at keeping ourselves and our colleagues safe. That’s why our annual Global Safety and Health Week celebrations are so important – we’re continuing to see the results. #safetyisalwaysfirst https://t.co/hsTKhaVhg4",en,ADM
Mon Jun 03 17:46:06 +0000 2019,".@IFT is all about sharing our expertise − and innovative solutions − around key consumer trends like #cleanlabel #glutenfree #healthwellness #plantbased #sugarreduction. If you can’t make it to the show, learn more at https://t.co/pPPCj4FEsZ. #IFT19 https://t.co/d9BiS0pyC4",en,ADM
Wed May 29 15:23:03 +0000 2019,"ADM creates new business unit, Ag Services &amp; Oilseeds, led by Greg Morris to accelerate value creation https://t.co/f21MXDyjo5 https://t.co/Z9vtwdbu1l",en,ADM
Fri May 24 14:34:26 +0000 2019,"As part of a volunteer event to start the summer, ADM interns packed more than 55,000 meals for Feed My Starving Children. The meals include an ADM ingredient to bolster the protein content and make them more nutritious. @fmsc_org https://t.co/08OW9ofrgC",en,ADM
Tue May 21 09:20:30 +0000 2019,"#Innovation comes in many formats. @neovia_group in Vietnam has recently developed the “Three Standards” model — a comprehensive aquaculture solution that aims to support farmers in managing their farming processes, reducing risks and achieving the highest productivity https://t.co/OZClOYECUj",en,ADM
Mon May 20 13:38:01 +0000 2019,"“Since my early career, diversity has been one of the core values I uphold.” Hans Christian Jensen, Director, Global Ocean Freight, presented @WISTAInt ’s 10-year celebration event last week in Geneva, Switzerland, highlighting the importance of diversity in the freight industry https://t.co/XRKuzh8Jdj",en,ADM
Fri May 17 13:36:55 +0000 2019,"Technology and innovation will play a vital role in shaping the future of farming. @Neovia_group colleagues and partner companies gathered in Paris this week to discuss smart farming at @VivaTech, where industry leaders and startups celebrate innovation https://t.co/ieOywTXMd4",en,ADM
Thu May 16 14:22:36 +0000 2019,ADM Chairman and CEO Juan Luciano discussed the company’s strategy and future keys to success with @BMO analyst Ken Zaslow at BMO’s Farm to Market Conference yesterday. Listen to the replay at https://t.co/JM6984NJSX. https://t.co/OG0k72WOhe,en,ADM
Wed May 15 18:57:31 +0000 2019,We’re focused on helping customers find the latest #cleanlabel #innovations to reduce sugar. ADM’s SweetRight™ Edge replaces the sweetness of sugar up to 15% better than other stevia products and eliminates the need for masking and bitterness blocking. https://t.co/Z6ji5aVT0j https://t.co/6PjPKBEO9A,en,ADM
Tue May 14 16:12:35 +0000 2019,Hunger doesn't take a vacation. That's why 70 colleagues from ADM Erlanger teamed up with @Go_Pantry to provide 270 meal boxes for kids facing food insecurity during the summer break. Follow @ADMcares for more stories. https://t.co/SAW0fldlv6,en,ADM
Mon May 13 14:07:07 +0000 2019,"Charlie Hatch, plant manager at our Atkinson flour mill in
Minneapolis, gave @StarTribune an exclusive tour of the facility, which was
originally built in 1915 and is still producing 1 million pounds of flour a day
for customers. https://t.co/JtEWXjvvRk",en,ADM
Fri May 10 09:56:22 +0000 2019,"Congratulations to Daniel Ramón Vidal from ADM Biopolis in Spain for achieving the “NutraChampion” award at this year’s #NIAwards19 awards at Geneva’s #VFE19, honoring his outstanding contribution to the development of food science and biotechnology. https://t.co/7KMA5zYR9u",en,ADM
Thu May 09 19:24:58 +0000 2019,"This week, Chairman and CEO Juan Luciano and Nutrition President Vince Macciocchi joined ADM colleagues to celebrate the completion of an extensive upgrade project at our Nutrition facility in Beijing – in traditional local style, of course. #celebration #庆典 https://t.co/iK6K41YwcI",en,ADM
Thu May 09 13:23:17 +0000 2019,"This week at @iffa_Frankfurt, ADM’s protein specialists showcased a plant-based tasting menu that took an innovative spin on favorite dishes. Visitors tasted plant-based concepts replicating popular meat dishes from chicken nuggets to pulled meat. #IFFA2019 https://t.co/50fS2I0saR",en,ADM
Tue May 07 14:58:07 +0000 2019,"We started with 25,000 square feet of office space and transformed into a cutting-edge Food Application Center that houses all of our food R&amp;D under one roof. Get an inside look from our Chief Technology Officer Todd Werpy. https://t.co/xV3e8ih0cV",en,ADM
Mon May 06 15:36:11 +0000 2019,"Not one, but two associations have honored ADM Milling for our impressive safety record in 2018. Thanks @IAOMillers and @AmericanBakers for recognizing the strides we’ve made on our #safety journey. https://t.co/rzaQSj679I https://t.co/b1iPjt1iOS",en,ADM
Fri May 03 16:10:58 +0000 2019,"Today, we’re delighted to welcome colleagues from the Ziegler group into team ADM. Based in Germany, Ziegler is major European provider of citrus solutions, a refreshing addition to our expanding portfolio! https://t.co/H4Pwf9RkZv",en,ADM
Thu May 02 16:09:59 +0000 2019,"It looks like a science fair, but this was no academic exercise. Earlier this week, dozens of researchers at ADM shared posters and demos about their latest customer-focused innovations at ADM’s annual R&amp;D Innovation Day. #innovation #customersfirst https://t.co/a43diOQ6SM",en,ADM
Wed May 01 16:34:27 +0000 2019,"ADM Chairman and CEO Juan Luciano gave a business update today at the company’s 96th Annual Stockholders’ Meeting, where new director Dr. Lei Zhang Schiltz was also officially welcomed to the Board. https://t.co/qbOyVQXrc9 https://t.co/qBx7VMds0K",en,ADM
Mon Apr 29 14:29:42 +0000 2019,ADM Chairman and CEO Juan Luciano to present at BMO Capital Markets 2019 Farm to Market Conference May 15 at 2:10 p.m. https://t.co/QiTIrEbuhM,en,ADM
Fri Apr 26 11:09:40 +0000 2019,"ADM Reports First Quarter Earnings of $0.41 per Share, $0.46 per Share on an Adjusted Basis https://t.co/UvaF2KPSL0",en,ADM
Thu Apr 25 16:03:44 +0000 2019,"They don't just work together--they saved a life together. When a colleague experienced a cardiac event, this ADM team performed CPR and used an AED, saving his life. Thank you to @RedCrossCSIL for honoring their efforts, and for teaching so many how to save lives. https://t.co/zDEm38RVFa",en,ADM
Wed Apr 24 15:00:43 +0000 2019,"Separating grain is a challenge for smallholder farmers without the right technology. Through an ADM Cares grant, we've improving lives for African farmers with @PHL_Institute and @tropicalsoylab , helping grow their yields and profits. Learn more: https://t.co/4TkEPqSwqG https://t.co/XS8bFktG3k",en,ADM
Mon Apr 22 20:10:39 +0000 2019,"On #EarthDay, we’re talking about waste. Here’s how we're working to send less to landfills. https://t.co/AHUSFtaf3J",en,ADM
Fri Apr 19 14:08:15 +0000 2019,"Congratulations to ADM's Annemarie Keemink for being named the first female president in the 100-year history of @nofota , the Netherlands Oils, Fats and Oilseeds Trade Association. #celebratingwomeninleadership https://t.co/8WSyAFq1mw",en,ADM
Thu Apr 18 18:35:25 +0000 2019,"Up to one in seven people experiences migraines. Published research demonstrates that a 14-strain live culture could reduce frequency, severity and duration of both chronic and episodic head discomfort. Learn more at https://t.co/OJre9gBJaq https://t.co/toxubimKGN",en,ADM
Tue Apr 16 19:18:04 +0000 2019,@kmillard We’d like to learn more about your concern. Please email us at media@adm.com.,en,ADM
Tue Apr 09 16:22:39 +0000 2019,"Three hundred meters of lush vegetation enclose our ADM terminal in Santos, Brazil. Known as the big green wall, it reduces emissions, heat and aridity in the terminal, and adds a colorful, natural view that brightens up the neighborhood. #innovationinbloom https://t.co/M5rid9NGpE",en,ADM
Fri Apr 05 14:40:59 +0000 2019,ADM will report first quarter earnings April 26. https://t.co/0b0IvKw0Os,en,ADM
Thu Apr 04 15:54:12 +0000 2019,".@NeoviaMexico VP of Livestock and Aquaculture Jorge González shared deep industry knowledge @femeleche , the national milk forum in México City. At this event and always, we’re working to better understand the evolving needs of our customers. https://t.co/Yax1TIZoVt",en,ADM
Wed Apr 03 18:07:49 +0000 2019,"This 197-foot tower is part of our new livestock feed facility in Quincy, Illinois. It's the fourth cutting-edge Animal Nutrition production facility we’ve opened in the US since 2016 to better meet our customers’ growing needs. #innovation https://t.co/m2V1XjoCMB https://t.co/EowasHxWag",en,ADM
Tue Apr 02 20:02:41 +0000 2019,RT @FuelsAmerica: New report from @SecretarySonny @USDA: “further evidence that biofuels from America's heartland reduce greenhouse gases e…,en,ADM
Tue Apr 02 15:59:51 +0000 2019,"Are you looking to perfect your pitch? For two decades, ADM’s Bob Bloom has worked with startups in product development. We asked for his best advice @Foodbytes by Rabobank’s pitch contest in San Francisco last week. https://t.co/R5jiCeDAjt",en,ADM
Mon Apr 01 16:09:31 +0000 2019,"ADM colleagues near Memphis, TN teamed up with non-profit @LLandW and area college students to remove 14,300 pounds of debris from Lake McKellar after record flooding. https://t.co/coy6GIwQUk",en,ADM
Fri Mar 29 17:34:54 +0000 2019,"Proud that Victoria de la Huerga, our vp of Investor Relations and ADM Ventures, was named to the @DiversityIL Illinois Power 50, recognizing extraordinary women in leadership roles statewide. https://t.co/49R6uUK59d",en,ADM
Thu Mar 28 16:28:45 +0000 2019,"It's not just where we work. It's where we live. As flood waters in Nebraska recede, ADM volunteers from Columbus, Fremont, Wisner and Lincoln haul home items, clear mud and debris and provide emotional support to neighbors impacted by the floods. @ADMCares https://t.co/mpzLhS6p5M",en,ADM
Wed Mar 27 14:17:57 +0000 2019,"Mark Hankins from @ADMupdates took part in a valuable discussion with @COFCOINTL and @WeAreLDC today at the #ftcommodities summit, describing our project with Bunge and @Cargill to modernize and digitalize the post-transaction trading process. @ftlive https://t.co/vTj5JBiJfi",en,ADM
Tue Mar 26 14:22:18 +0000 2019,"What do we need to secure the future of ag and food? Scale, innovation and new business models, says ADM Origination President Stefano Rettore, speaking today at #FTcommodities Annual Summit. https://t.co/QWgUxFaOr1",en,ADM
Mon Mar 25 14:53:56 +0000 2019,"ADM is one of the world’s largest millers of flour, backed by more than a century of experience. New to our bag of tricks, our USDA-certified organic flours deliver high-quality performance and consistency—for great bakes, every time. Learn more at https://t.co/Zl7gqKM3rt https://t.co/giESwlGZgo",en,ADM
Fri Mar 22 14:38:26 +0000 2019,"ADM’s Board is ready to lead the company into a bright future with new nominee Lei Zhang Schlitz and a new committee on corporate citizenship, led by Board member Suzan Harrison. https://t.co/7x9lojqcIo https://t.co/hdpTRLLgjs",en,ADM
Thu Mar 21 14:13:09 +0000 2019,"Sustainable practices are integral to the work we do every day. Learn more at about our commitment to no deforestation, no peat, no exploitation: https://t.co/FLmMchQUoj #InternationalDayofForests #IntlForestDay https://t.co/bGyO0XLcGw",en,ADM
Wed Mar 20 14:43:44 +0000 2019,"Our hearts go out to those in the Midwest devastated by flooding. We’re working hard to get things back up and running at full speed at facilities like this one in Columbus, NE. Thank you @RedCross for doing the same for these communities as a whole. https://t.co/JjWI7hFnyL",en,ADM
Mon Mar 18 16:28:29 +0000 2019,"Worldwide, ADM produces enough #biodiesel to remove 5.8 million metric tons of carbon dioxide emissions every year – the equivalent of taking 1.2 million cars off the road. #NationalBiodieselDay #BiodieselDay https://t.co/iJDXXtBeiU",en,ADM
Fri Mar 15 12:22:03 +0000 2019,"Recipe for a global citrus business -- Step one: last month’s addition of North American citrus leader Florida Chemical Company. Step two: our new agreement to acquire the Ziegler Group, a European citrus flavor pioneer. https://t.co/FUWnmhkolw https://t.co/a8MrTRZ2Xd",en,ADM
Thu Mar 14 13:42:49 +0000 2019,"At ADM, everything we do starts with the hard work of farmers. From the food we produce for people and animals, to the biofuels and industrial products we create, it all starts in the fields. We celebrate the farmers who help make it possible. #AgDay19 #NationalAgDay https://t.co/6waJhj9H81",en,ADM
Tue Mar 12 13:24:45 +0000 2019,"Our European bottled-oils joint venture, EOL, is working to help restore and protect nesting and feeding grounds of Polish storks. Look for the campaign on bottles of Wielkopolski brand oil, now on store shelves in Poland. https://t.co/Xlz68yciQD",en,ADM
Fri Mar 08 12:24:38 +0000 2019,"On #InternationalWomensDay, hundreds of ADM colleagues around the world are rallying behind the #BalanceforBetter movement. We’re proud to stand with @p4parity as we work to #CloseTheGenderGap and elevate women to corporate leadership positions. #IWD2019 https://t.co/YoB7Wyfhse",en,ADM
Thu Mar 07 17:49:19 +0000 2019,"ADM products turn up in some unexpected places – even at airports during icy weather. Our propylene glycol is a key component of deicer for aircraft – and it’s bio-based, providing a greener alternative to the petroleum-based product. Learn more: https://t.co/c4K0WkmvjU https://t.co/Hg6TvvblHs",en,ADM
Wed Mar 06 15:44:55 +0000 2019,"It was inspiring to see more than 600 high school students attend this year’s @WCFOA conference in Decatur. Thank you @ILAgriWomen for helping to educate, encourage and empower women to take on the challenges facing the ag industry. #WCFA19 #WomenChangingtheFaceofAg https://t.co/LI9ip0llMa",en,ADM
Tue Mar 05 18:10:56 +0000 2019,"Proud to the launch GrainBridge, LLC, our new digital technology joint venture with @Cargill to support farmer efficiency and profitability. Farmers deserve the best technology to manage their businesses, and GrainBridge will be there to provide it. https://t.co/J13qg4MBxP https://t.co/q2rfLJVJnA",en,ADM
Fri Mar 01 18:53:38 +0000 2019,"We're thrilled to complete our acquisition of Florida Chemical Company, strengthening our best-in-class array of natural, clean-label food and beverage products and solutions. https://t.co/Uiu4ZLVezZ",en,ADM
Wed Feb 27 20:18:01 +0000 2019,"When partners across the ag supply chain work together, real change can happen. ADM is proud to be a founding member of a new consortium working to improve soil health and water conservation around the world. https://t.co/x08KIlBlf2 https://t.co/n1gcMsPMae",en,ADM
Wed Feb 27 15:23:05 +0000 2019,"Thanks to an @ADMcares grant, the ADM @PHL_Institute @Illinois_Alma and @GuluVarsity are helping Ugandan farmers prevent crop loss through training videos. Read more: https://t.co/Lxf7SJxSVj https://t.co/e8D5LzBmT3",en,ADM
Fri Feb 22 20:21:07 +0000 2019,"In Lishui, Nanjing, China, kids have a new and convenient room to immerse themselves in the world of STEM. The @ADMcares Reading Room opened recently with a great collection of STEM books. https://t.co/DG6O58fBWb",en,ADM
Fri Feb 22 16:56:13 +0000 2019,"RT @ChicagoCouncil: We're back with @jtownsendbailey, Alison Taylor @ADMupdates, and @jacobbunge talking about sustainable food systems. 🌾🌾…",en,ADM
Thu Feb 21 20:43:08 +0000 2019,"Happy #NationalFFAWeek! For more than 55 years, ADM has supported @NationalFFA , which helps students lead and prepares them for successful careers in global agriculture and related industries. We’re proud to support through our volunteers and @ADMcares grants. https://t.co/x7qL5QXQYU",en,ADM
Fri Feb 15 17:53:21 +0000 2019,"RT @NationalCorn: Today and every day, we #ToastToFarmers. Thank you for sustainably feeding and fueling a growing world. @CoorsLight https…",en,ADM
Fri Feb 15 17:23:46 +0000 2019,"Thanks to an @ADMcares grant, 7th and 8th graders in Columbia, Illinois are growing produce in a ""pinkhouse,"" or an indoor garden featuring pink and red lights. We're happy to instill a love of #ageducation, and develop ""pink thumbs!"" https://t.co/2u0LgT0URk",en,ADM
Thu Feb 14 15:33:13 +0000 2019,"At our Chocolate Applications Center in Berlin, Germany, the sweet treat goes well beyond #ValentinesDay . Some trends ADM experts are seeing in 2019? Sugar reduction, vegan solutions, colorful sensations, and new, premium flavors #innovation #yummy https://t.co/oWvRmulWNy",en,ADM
Mon Feb 11 15:36:25 +0000 2019,"Around the world, more than 47% of our colleagues in science and R&amp;D based roles are female. We’re happy to celebrate @UNESCO #IDWGS2019 and are proud of our many talented #WomenInSTEM #WomenInScience https://t.co/v1j1eeNcYS",en,ADM
Fri Feb 08 19:14:46 +0000 2019,"@wxnewsdesk This video was taken aboard an ARTCO tow boat traveling on the Mississippi River near Clarksville, Missouri. #yestv",en,ADM
Fri Feb 08 17:24:45 +0000 2019,"Wintry weather brings cold temps, icy roads – and sometimes even icy rivers! Thanks to our colleagues who keep products moving for our customers rain or shine. https://t.co/DhluXE9mda",en,ADM
Thu Feb 07 20:06:26 +0000 2019,"How do you deliver more food in the next 40 years than the world has produced in the last 10,000? Innovation. Learn why this naturally found fertilizer from our partner @siriusminerals is a true game changer for farmers. https://t.co/SB41IX1DTh",en,ADM
Tue Feb 05 19:47:52 +0000 2019,Today we announced 4Q earnings. Listen to the full replay from this morning’s webcast here: https://t.co/JM6984NJSX https://t.co/PByFiU4gXM,en,ADM
Fri Feb 01 19:52:21 +0000 2019,"We completed the acquisition of @neovia_group , creating a premier global leader in animal nutrition with our combined capabilities. We’re excited to welcome 8,000 new colleagues – and a wide range of new resources, technologies &amp; expertise - to #TeamADM https://t.co/XObhBfGGAe https://t.co/Bgg54vILzr",en,ADM
Thu Jan 31 15:51:27 +0000 2019,We recognize and celebrate the importance of a diverse workplace. We’re proud to have joined @p4parity and committed to achieving gender parity in our leadership by 2030. Find out more: https://t.co/ecN5KiiCFX #CloseTheGenderGap #Paradigm4Parity https://t.co/JdpDUxu2hO,en,ADM
Thu Jan 24 16:17:32 +0000 2019,"Check out our NAHQ in Decatur #2009vs2019. In that time, we’ve also expanded our footprint to serve customers in 110 new countries and added a growing nutrition business that features an unmatched ingredient portfolio. #MoretoCome #10YearChallenge #GlowUp https://t.co/R4gyoNR13c",en,ADM
Tue Jan 22 20:01:53 +0000 2019,"We're honored to be named a #MostAdmired company in the food production industry by @FortuneMagazine for the 11th year in a row. Thankful to our customers, colleagues and partners for their continued support! https://t.co/YWlAnQYDSm https://t.co/4MQVUEeLH8",en,ADM
Mon Jan 21 16:36:33 +0000 2019,"We honor #MLKDay by celebrating workplace diversity and recognizing we have further to go. Through Together We Grow, we’re working collectively to change American agriculture by building a more skilled, diverse and inclusive workforce. https://t.co/o9CbcOu7FH",en,ADM
Fri Jan 18 15:32:45 +0000 2019,"These kids in Carapicuíba, Brazil, recently learned about the correct disposal of cooking oil, thanks to an ADM-sponsored program. They brought in their used oil to the #schools, who sold it to #recyclers, funding additional education @ADMCares https://t.co/PTjpg1t9Sz",en,ADM
Thu Jan 17 14:26:29 +0000 2019,"We’re delighted to announce we’ve signed an agreement to acquire the remaining 50% of our UK-based joint venture with Invivo, @Gleadells Ltd., expanding our origination, storage and destination marketing footprint for farmers and customers in the UK. https://t.co/E1EyJSdlrn https://t.co/nXLKfgSqhP",en,ADM
Wed Jan 16 14:57:08 +0000 2019,"We’re proud to announce a long-term partnership with General Starch Limited, a leading tapioca starch producer located in Thailand. These non-GMO specialty tapioca starches can be used in a wide range of food and industrial applications. https://t.co/R1OdehKnU1 https://t.co/CZL8wNGXRf",en,ADM
Tue Jan 15 15:55:35 +0000 2019,ADM will report fourth quarter earnings Feb 5. https://t.co/m2x2YW0hkI,en,ADM
Mon Jan 14 17:12:13 +0000 2019,"We’ve long been passionate advocates for @JAGnational , with ADM chief HR officer Mike D’Ambrose serving on the board. Today, @Forbes features “the country's most effective drop-out prevention program.” @ADMcares https://t.co/HG9HEdjZGZ",en,ADM
Fri Jan 11 14:00:22 +0000 2019,"We’ve got mint. We’ve got vanilla. Now, we’re once again expanding our already unrivaled nutrition portfolio by adding natural citrus flavors through an agreement to purchase Florida Chemical Company. https://t.co/Sgbq346Akr https://t.co/QoZ9SqGgCM",en,ADM
Thu Jan 10 17:04:52 +0000 2019,"When you hear the words “lasers” and “3D,” you probably don’t think of cake. But as ADM Scientist Mark Floerke explains, we’re working with 3D imaging technology to improve the customer experience and deliver data and insights, while increasing safety and efficiency. https://t.co/KGuIQjTAdr",en,ADM
