created_at,full_text,lang,user_name
Fri Jan 04 16:07:48 +0000 2019,"When the traditional house-moving method of transporting by truck was not a viable option, ADM transportation teams helped move this house by barge up the Mississippi river earlier this month. Learn how we move more at https://t.co/m6QywvRD1z https://t.co/jTtu9RNwn5",en,ADM
Thu Dec 27 15:38:45 +0000 2018,"#TBT 1938: What's the secret to this Irish Setter's glossy coat? ADM ingredients, of course! Learn how we're still innovating in animal nutrition, 80 years later. https://t.co/M6IyPXqs3J https://t.co/4AUBMIxLbU",en,ADM
Fri Dec 21 19:42:50 +0000 2018,"ADM volunteers pack baskets filled with food for families in need. Our support of the @SalvationArmyUS will help #feed thousands this #holiday season in Decatur, as part of @ADMcares ' ongoing efforts to provide hunger relief here and around the world. https://t.co/QpO8sRbdXt",en,ADM
Thu Dec 20 09:07:42 +0000 2018,".@COFCOINTL is partnering with ADM, Bunge, @Cargill and @WeAreLDC to standardize and digitize global ag commodity shipping transactions. Excited about working together to increase efficiency for customers and benefit the entire industry. https://t.co/XHkAnxwr2k https://t.co/Ql8izlQR6I",en,ADM
Tue Dec 18 16:13:47 +0000 2018,"ADM is passionate about bringing partners together to promote workplace diversity in ag through the Together We Grow consortium we created, which is now award-winning thanks to Profiles in Diversity Journal! https://t.co/Q0qymjPZw9",en,ADM
Thu Dec 13 19:24:17 +0000 2018,"Since acquiring WILD Flavors in 2014, ADM has evolved into a total solutions ingredient provider to the #food and #beverage industry. Now part of our Nutrition business, WILD Flavors is helping customers #innovate and get to market faster. https://t.co/uMUrONrhPI",en,ADM
Wed Dec 12 17:02:44 +0000 2018,"We welcomed 400 new colleagues to our South American team with the acquisition of certain assets of Algar Agro in Brazil. We’re excited to grow our crush, oil refining and bottling business, adding origination and storage capabilities. Bem-vindo à família! https://t.co/MSmnjrzLFE",en,ADM
Fri Dec 07 21:07:06 +0000 2018,"It was a full house at our year-end forum in Decatur, with thousands more participating in the event online. As we head into #2019, we’re focused on our strategy, #inspired and #determined. https://t.co/9GvqqFqJV9",en,ADM
Wed Dec 05 20:47:48 +0000 2018,"We’re proud to be part of the #ReworkAmerica Business Network, a group of U.S. businesses working together to accelerate the development and adoption of innovative #hiring and #training practices. Learn more at https://t.co/Y5NtRcpwwz https://t.co/vIoL4UXNwH",en,ADM
Fri Nov 30 19:46:29 +0000 2018,ADM’s Angie Shaw helps fight hunger by packing boxes of food. Increasing food security is a strategic focus area for ADM Cares globally. Thank you to Angie and to all of ADM’s volunteers who help feed the world. https://t.co/HJUK1T0Uxg,en,ADM
Thu Nov 15 20:42:32 +0000 2018,Thank you @FieldtoMarket for honoring us for outstanding sustainability leadership for our work with @GeneralMills and @AgribleInc in the Southern Plains Wheat Fieldprint® Project. Learn more: https://t.co/exOu4szLJg https://t.co/EitKj4tFeF,en,ADM
Fri Nov 09 18:23:56 +0000 2018,"We’re in #LasVegas at the #SSWExpo, highlighting ADM’s extensive portfolio of on-trend ingredients for food, drinks and supplements. We’re showcasing our ever-expanding portfolio of health and wellness ingredients, plant-based proteins and sweetening solutions. @SupplySide #ssw18 https://t.co/wmy9CCMMer",en,ADM
Thu Nov 08 21:24:12 +0000 2018,ADM directors declare cash dividend https://t.co/wn32qyH6AK,en,ADM
Tue Nov 06 19:49:06 +0000 2018,Listen to the replay of today’s earnings webcast here https://t.co/sEMbanIhHO https://t.co/djSrr5PUY2,en,ADM
Tue Nov 06 12:13:47 +0000 2018,ADM reports third quarter 2018 earnings today https://t.co/tIdfdR8NCt,en,ADM
Fri Nov 02 14:33:54 +0000 2018,"Our elevator in Lincoln, Nebraska has a beautiful new look! We partnered with @Spreetail, who combed through hundreds of submissions from local artists, selecting 13 pieces which represent the natural, cultural and agricultural background of Lincoln and the state of Nebraska. https://t.co/qdNJo2dfYL",en,ADM
Thu Nov 01 20:00:42 +0000 2018,"ADM is proud to have been named a leader among Fortune
50 companies in diversity at the board and executive levels by The Rising
Tides, a consulting firm focused on improving the workplace for women and
minorities. https://t.co/ypHe3qIyVO https://t.co/kdKj4XQIGa",en,ADM
Tue Oct 30 15:56:49 +0000 2018,"“Farmers deserve the convenience of technology that gives them the power to make quick, effective and fact-based grain marketing decisions,”-Wes Uhlmeyer, ADM Grain president. Excited to partner with @Cargill on this comprehensive tool that will help farmers improve profitability https://t.co/FU4rtl6dq4",en,ADM
Fri Oct 26 18:44:04 +0000 2018,"ADM is dedicated to growing #STEM programs in schools around the world. This week, students @MtZionSchools toured New York City without ever leaving the classroom, thanks to virtual reality tools made possible by @ADMcares
https://t.co/MB3g4TppCs",en,ADM
Thu Oct 25 11:13:52 +0000 2018,"ADM, Bunge, @Cargill and @WeAreLDC seek to modernizeglobal agricultural commodity trade operations. https://t.co/5hKC0KGGks https://t.co/mnY9NLhecv",en,ADM
Mon Oct 22 18:08:49 +0000 2018,"Recently, ADM showcased our natural flavors, plant-based proteins and sweetening solutions at #FiAsia2018 in #Jakarta, Indonesia, the largest event for food and beverage professionals in the region. Thanks to those who dropped by our booth! https://t.co/R2wcASCUOg",en,ADM
Fri Oct 19 13:36:17 +0000 2018,"ADM is proud to support the WSOY Community Food Drive, which brought in more than 1.5 million pounds of food donations in just one day! This will help increase food security in Macon County and the surrounding area @NowDecatur @ADMCares https://t.co/HliF2aVyV4",en,ADM
Thu Oct 18 20:22:59 +0000 2018,"With 4 decades of experience in food and beverage product development, ADM’s Bob Bloom mentored food, food tech and ag tech startups before the pitch contest at #FoodBytes in NYC. Bob helped teams by refining their pitches and value propositions #innovation @FoodBytes https://t.co/pZ3jJx5RcA",en,ADM
Wed Oct 17 19:27:19 +0000 2018,"“Participating in the #AgWater Challenge presents us with a great opportunity to influence growing practices and make a tangible difference in water conservation practices for years to come”-Alison Taylor, ADM Chief Sustainability Officer https://t.co/anmm7mDxuQ",en,ADM
Tue Oct 16 15:29:50 +0000 2018,"ADM to Release Third Quarter Financial Results November 6, 2018 https://t.co/7WTKps90Ra",en,ADM
Fri Oct 12 13:50:13 +0000 2018,"We were honored to have Jamaican Prime Minister @AndrewHolnessJM, other dignitaries, and community members join us to mark the 50th year of operation of the ADM-Jamaica Flour Mills. Today, we are Jamaica’s first-call solution provider for food, animal feed and specialty needs. https://t.co/8DjcuJq7De",en,ADM
Wed Oct 10 14:31:53 +0000 2018,"It’s been a busy start to #CPhIWW for the ADM team. We’ve been showcasing our extended Health &amp; Wellness offering, which includes our bioactives portfolio and highly purified, injectable-grade vegetable oils. https://t.co/hm9MTiEI2h https://t.co/q52oS6p9lt",en,ADM
Tue Oct 09 18:08:39 +0000 2018,"Yesterday, we cut the ribbon at our modernized flour mill in Enid, Oklahoma. The newly renovated mill is equipped with advanced technology to deliver great value, faster service, and the very highest quality for our customers. https://t.co/Ol3tH6Zu9H",en,ADM
Thu Oct 04 18:52:52 +0000 2018,"#TBT: This 1939 National Oilseed Processors Association image showcases the small but mighty soybean’s many purposes. Today, ADM processes more than 155,000 metrics tons of oilseeds daily for food, animal feed, industrial and energy uses. https://t.co/dUUwm9kULK",en,ADM
Fri Sep 28 19:44:16 +0000 2018,ADM’s Ross Windham encouraged poultry science students @TAMU to consider careers outside of traditional production and processing. Learn more about the diverse experiences ADM offers at https://t.co/T9WYIEvn0J https://t.co/5b723hghcD,en,ADM
Wed Sep 26 16:09:19 +0000 2018,Congrats to ADM’s Alix Dowling and Camille Batiste for receiving 2018 “Women Worth Watching” awards from Profiles in Diversity Journal  #womenleaders #TeamADM https://t.co/0nfGySR8mD https://t.co/gX6FnHrjPo,en,ADM
Tue Sep 25 19:36:13 +0000 2018,"We’re serious about #FoodSafety at ADM. And you can be too, with these 4 tips to protect yourself and loved ones from #FoodPoisoning @CDCgov #FoodSafetyMonth 
https://t.co/crkwktDXIM",en,ADM
Mon Sep 24 18:36:20 +0000 2018,".@Golden_Peanut employs 1,100 colleagues across three continents, processing thousands of tons of nuts each year. But their golden number is 5.7 million: the number of work hours since Golden’s last lost-time injury. Congrats to the GPTN team! https://t.co/8ieXa1ydry",en,ADM
Fri Sep 21 16:40:46 +0000 2018,We’re proud to partner with grassroots organizations like The 363© Days Food Program to help fight back against hunger in communities across the globe. https://t.co/UL3iXJiCVt,en,ADM
Wed Sep 19 13:25:44 +0000 2018,"For #NationalFarmSafetyWeek, ADM’s Jason Eardley spoke with @FFA students at Maroa-Forsyth High School about grain bin dangers, providing tips on staying safe and how ADM can help farmers. https://t.co/dekp2OQnwr",en,ADM
Wed Sep 12 14:08:40 +0000 2018,"Congrats to the ADM Milling team in Charlotte, North Carolina! They were recognized for the fourth consecutive year by Mecklenburg County’s Land Use &amp; Environmental Services Agency for their commitment to environmental compliance and stewardship. #teamadm https://t.co/A7qt2r9ZSV",en,ADM
Tue Sep 11 13:37:19 +0000 2018,"At the @NASDAnews annual meeting in Hartford, Connecticut, ADM’s Case McGee spoke about a crisis in ag talent and the solution. #ExploringOurRoots https://t.co/T7qMfB0p6O",en,ADM
Mon Sep 10 17:50:33 +0000 2018,"ADM’s Mark Matlock spoke on a panel at #GoodFoodConference
about innovations across the value chain for plant-based meat #plantbased
@GoodFoodInst @UCBerkeley https://t.co/gjZmYXFdIh",en,ADM
Fri Sep 07 18:45:47 +0000 2018,We’re helping grow the future of agriculture. An @ADMCares grant will make @4H programming available to all K-8 students in Macon County. https://t.co/MDTS7YjTI2,en,ADM
Thu Sep 06 13:36:12 +0000 2018,ADM vegetable oil is helping to repave roads in Decatur. ADM’s Greg Webb spoke with Agribusiness Today’s David Brown about how we’re innovating @wandtvnews #sustainable #innovation https://t.co/iQrIQ8JJWG,en,ADM
Fri Aug 24 13:39:26 +0000 2018,"We’ve completed our acquisition of Rodelle, adding a great vanilla brand and the most extensive vertically integrated supply chain in the vanilla industry to our portfolio. https://t.co/V8jPgjqQHq",en,ADM
Fri Aug 17 14:19:00 +0000 2018,"We celebrated the opening of our new Technical Innovation Center and regional office in Shanghai, China. The state-of-the-art facility will support development of innovative, on-trend, nutritious products to meet growing food and beverage demand in the Asia-Pacific region. https://t.co/ohv7VCE2mc",en,ADM
Thu Aug 16 13:35:20 +0000 2018,"We’re excited to announce the acquisition of two new oilseeds facilities in Brazil, further strengthening our South American and global footprint https://t.co/UGGJrqIG8t https://t.co/ArbDTIDKAo",en,ADM
Wed Aug 15 18:36:48 +0000 2018,"Probiotics International Limited has officially joined ADM. Learn more about its innovative, research-based selection of probiotics products here https://t.co/s0tHRKGLaS",en,ADM
Fri Aug 10 18:46:09 +0000 2018,"ADM recycled more than 180 tons of composite materials during exterior renovations to our North American headquarters building. The scraps are now headed for new uses, such as new roads or new aluminum or glass products. https://t.co/tUoHNALj1J",en,ADM
Thu Aug 09 13:53:41 +0000 2018,"Military Friendly® is the standard that measures an institution's commitment, effort and success in creating sustainable and meaningful benefit for the military community. We’re honored to be included on VIQTORY’s @Mil_Friendly Employer list for the fifth consecutive year. https://t.co/qHssvgA7ba",en,ADM
Thu Aug 02 16:52:13 +0000 2018,Congratulations @AccessDecatur and @DecaturEDC for ranking first in the U.S. for Agricultural Bioscience Employment according to @BizFacilities! ADM’s operations in Decatur — and our people there — have been instrumental to our company’s success for generations. https://t.co/gsSy5SHwsX,en,ADM
Thu Aug 02 14:10:24 +0000 2018,ADM directors declare cash dividend https://t.co/Ux6cmgMvrX,en,ADM
Wed Aug 01 14:10:24 +0000 2018,Thank you to @SustainBrands for highlighting our team effort with @andeannaturals and @kashifoods to improve lives and sustainable quinoa production in South America https://t.co/YqLBu2VFWV,en,ADM
Tue Jul 31 11:07:18 +0000 2018,ADM reports second quarter 2018 earnings today https://t.co/owfMQDHqoF,en,ADM
Fri Jul 27 18:05:54 +0000 2018,"Congrats to David Martin, ADM audit analyst, and Erin Rockafellow, ADM research manager. They’re among the @heraldandreview 20 people under 40 making a difference in Central Illinois #TeamADM https://t.co/M9aEpeaKTl",en,ADM
Thu Jul 26 16:22:42 +0000 2018,"On #NationalInternDay, ADM would like to thank the 132 interns representing 39 different universities who joined #TeamADM this summer at 76 locations across North America. Meet the next generation of ag leadership! https://t.co/8yQf3yNHSj",en,ADM
Tue Jul 24 19:54:18 +0000 2018,"ADM is proud to join the @VetRecruting VetFriendly Jobs Initiative, a partnership that aims to help 100,000 U.S. military veterans and spouses find employment by 2020. Learn more about our commitment at https://t.co/83qfNT91tS. https://t.co/vyG5P0NoOM",en,ADM
Mon Jul 23 17:32:06 +0000 2018,ADM adds an unparalleled range of certified organic and natural vanilla ingredients to our comprehensive flavor portfolio with agreement to acquire Rodelle.  https://t.co/uneREujguM https://t.co/fBetQnZ3f9,en,ADM
Thu Jul 19 18:40:44 +0000 2018,"ADM partners with @GlobalOmnium and @AguasdeValencia on the BACTIWATER project, aiming to recover and protect the biological systems of wastewater treatment plants. https://t.co/t57sYwa1Xo https://t.co/s7tOubHeJV",en,ADM
Wed Jul 18 20:01:35 +0000 2018,"Food developers and ADM ingredient advisers connected @IFT '18 this week to discuss ADM's extensive portfolio of ingredients and solutions, and sample on-trend food and beverage products. ADM's ""Say Cheese, Tea!"" beverage, a crowd favorite, included a printed edible selfie #ift18 https://t.co/Ph5WkZzfbn",en,ADM
Wed Jul 11 16:56:31 +0000 2018,ADM CIO Kristy Folkwein has been named to the @ConstellationR Business Transformation 150. We’re proud of the work Kristy and her team are doing to help us advance our strategy and win in the digital age. https://t.co/OcjUAWnhny https://t.co/egSrkllbgh,en,ADM
Tue Jul 10 14:18:38 +0000 2018,"ADM to Release Second Quarter Financial Results July 31, 2018 https://t.co/SBBm3pwDaE",en,ADM
Fri Jul 06 19:29:12 +0000 2018,"This peregrine falcon family calls our East plant grain elevator in Decatur, Ill., home, and helps scare away pigeons and other pests. We are happy to work with the @IlinoisRaptorC to help these birds thrive again in this area. https://t.co/MSzYg7BNU9",en,ADM
Mon Jul 02 12:02:30 +0000 2018,Listen to today’s investor call at 8 a.m. U.S. CST to learn more about our proposed acquisition of Neovia and how it will help drive our entire integrated nutrition platform forward. A replay will also be available. https://t.co/JM6984NJSX,en,ADM
Mon Jul 02 10:21:42 +0000 2018,"ADM announces proposed acquisition of Neovia, a
premier global leader in value-added animal nutrition solutions https://t.co/K2gtPCULF8 https://t.co/nTNW89kKKO",en,ADM
Fri Jun 29 10:24:03 +0000 2018,"ADM has reached an agreement to acquire Probiotics
International Limited, a UK-based provider of probiotic supplements for human, pet and production animal use. https://t.co/LhWAjbcST2 https://t.co/2EyXXw6jlp",en,ADM
Mon Jun 25 15:11:03 +0000 2018,"Innovation is central to the growth of our business. Last week, our R&amp;D teams hosted an expo at our research center in Decatur, Illinois, to present examples of our recent successes and some of the promising projects and technologies we have in our development pipeline. https://t.co/yyyS8v5Y1W",en,ADM
Thu Jun 21 20:38:54 +0000 2018,ADM and @DuPontBiobased are developing new enzyme-based tools to help fuel ethanol producers get more out of existing feedstocks. https://t.co/hJ28vjEX8o,en,ADM
Wed Jun 20 20:15:07 +0000 2018,"Yesterday, @GovRicketts helped us celebrate the opening of our new livestock feed facility in Columbus, Nebraska. This facility is a great example of our continued investment to ensure we are the go-to partner for animal feed customers around the globe https://t.co/7nt3gD7c2S https://t.co/czu4nMp2KA",en,ADM
Thu May 31 19:59:26 +0000 2018,We have never had any affiliation or sponsorship with Full Frontal w/ Samantha Bee or with TBS. We can only assume the mention of our company earlier this month was a joke.,en,ADM
Wed May 23 20:09:15 +0000 2018,"We were happy to host @Byers_Brian and @JeffDaly3 from WSOY-AM yesterday as they broadcast live from our offices to celebrate the renovation of our North American headquarters building in Decatur, Illinois https://t.co/yz7HpMFbhJ",en,ADM
Mon May 14 15:34:56 +0000 2018,"Ray Young, ADM’s CFO, will present at the BMO Farm to Market Conference on May 16 in NYC. Catch the ADM presentation live at 2:50 p.m. ET at https://t.co/sEMbanIhHO",en,ADM
Thu May 10 16:03:51 +0000 2018,"ADM chefs at our newly expanded food innovation center in Cranbury, New Jersey, are always eager to showcase our vast ingredient portfolio and what we can do for customers. Learn more about our nutrition solutions at https://t.co/wjDEU6p16m. https://t.co/8WBOnt0aCn",en,ADM
Mon May 07 21:28:06 +0000 2018,"Today, ADM celebrated the opening of our new pet food and livestock premix facility in Effingham, IL. The facility's state-of-the-art production technology will allow us to customize animal nutrition products to meet our customers’ needs. https://t.co/GgHmraqU6x https://t.co/KW3XdBeggk",en,ADM
Fri May 04 14:41:20 +0000 2018,"Thank you, @Forbes, for naming ADM as one of America’s Best Employers in 2018! We are honored to be listed among the top large companies for the second consecutive year. https://t.co/2tLpxHCnJM",en,ADM
Thu May 03 18:23:48 +0000 2018,"Today, ADM held its 95th Annual Stockholders’ Meeting, declaring a cash dividend of 33.5 cents per share and electing Michael S. Burke as the newest member of ADM’s board of directors. https://t.co/yBKGNcFvBr",en,ADM
Wed May 02 20:44:05 +0000 2018,"At ADM, environmental responsibility and sustainable practices are integral to the work we do every day. Read about our sustainability efforts in the ADM 2017 Corporate Sustainability Report.  https://t.co/q9Vo7w8S48",en,ADM
Tue May 01 18:45:00 +0000 2018,Listen to the replay of today’s earnings webcast here https://t.co/sEMbanIhHO https://t.co/tNyxtm42Ks,en,ADM
Tue May 01 11:06:23 +0000 2018,ADM reported first quarter 2018 earnings today https://t.co/pgrW8vHaFn,en,ADM
Mon Apr 30 20:57:47 +0000 2018,"“This new, innovative product will help customers replace plastics with materials that are more environmentally friendly, better performing and cost efficient."" - Todd Werpy, ADM Chief Technology Officer 

Excited to partner with @DuPontBiobased! https://t.co/viNrcKk9yO",en,ADM
Tue Apr 24 19:36:23 +0000 2018,"Ben Bard, ADM’s Chief Compliance Officer, has been named to @complianceweek's 2018 Top Minds. He embodies the characteristics we seek in our leaders, and we’re proud he’s being recognized for his work to build a world-class compliance team at ADM.  https://t.co/EFTGWgnyxt",en,ADM
Mon Apr 23 20:28:33 +0000 2018,"ADM Chairman and CEO Juan Luciano helped celebrate the opening of our new research lab in @CityofDavis, where we will be working to develop new enzymes for the fast-growing health and wellness and animal nutrition markets. https://t.co/kAGRxVoUrH https://t.co/7QysBAHY9a",en,ADM
Thu Apr 19 13:42:46 +0000 2018,"“We’re proud of our team’s ongoing commitment to cultivating a talented, diverse workforce at ADM, and throughout the ag and food industries.” - Greg Morris, president of ADM’s Oilseeds business unit and the company’s diversity champion https://t.co/KqCwLLoZ21",en,ADM
Tue Apr 17 15:09:33 +0000 2018,"Yesterday, we hosted @NationalFFA officers and @DPS61Decatur students at our North American headquarters in Decatur, Ill. Great chance to talk about the wide range of career options in food and agriculture. Excited about the next generation of ag leaders! #ItStartsWithAg https://t.co/T134h4bkdJ",en,ADM
Fri Apr 13 19:12:37 +0000 2018,"Congratulations to the 2018 Milling Operative of the Year, Mike Wiechman, a member of the ADM Milling team. https://t.co/8H7RzNqdVJ",en,ADM
Tue Apr 10 15:07:05 +0000 2018,"ADM to Release First Quarter Financial Results May 1, 2018 https://t.co/fWVagnJKgq",en,ADM
Fri Apr 06 21:01:48 +0000 2018,"Chris Cuddy, Pres. of ADM’s Carbohydrate Solutions business, discussed global business strategy today @MillikinTabor. Thanks @MillikinU for hosting a great event. https://t.co/jNA826Z1kU",en,ADM
Fri Mar 23 18:12:29 +0000 2018,ADM Board nominates Michael S. Burke for election to join board in May https://t.co/Eh3XwCWj7H https://t.co/Pvhuih0LML,en,ADM
Fri Mar 23 15:20:24 +0000 2018,Sustainable practices are critical for the future of the food and ag industry. ADM is proud to support #RacetoZero as part of our sustainability journey https://t.co/o7BKLJHID9 https://t.co/recZbAICQb,en,ADM
Tue Mar 20 21:17:28 +0000 2018,"“Today we celebrate National Agriculture Day, but truly every day is National Agriculture Day” – Greg Webb, ADM VP of Government Relations at the annual Ag Day Breakfast hosted by @Macon_CFB https://t.co/21ugLCqZdf",en,ADM
Mon Mar 12 18:17:15 +0000 2018,ADM has been headquartered in Illinois since 1969. We’re #illinoisproud and honored to be up for an #ILtop200 award. Vote by 3/16! https://t.co/gPmiYOWw2p https://t.co/5bpTLeW3jd,en,ADM
Thu Mar 01 14:32:36 +0000 2018,ADM continues to expand its global sweeteners and starches footprint with Aston corn wet mill joint venture https://t.co/8475u2MzlZ,en,ADM
Mon Feb 26 14:09:58 +0000 2018,We announced a new JV with @Cargill today to expand our capabilities in Egypt and better meet customer demand for soybean oil and meal in the region https://t.co/7olz9TPlh8,en,ADM
Tue Feb 06 19:22:38 +0000 2018,Listen to the full replay of today’s webcast here https://t.co/JM6984NJSX https://t.co/zOs9fIjKpS,en,ADM
Tue Feb 06 13:00:13 +0000 2018,ADM increases dividend by 4.7 percent https://t.co/mYBSvO4qfl,en,ADM
Tue Feb 06 12:06:34 +0000 2018,ADM reports fourth quarter 2017 earnings today https://t.co/UubY8EHkGX,en,ADM
Fri Feb 02 19:58:52 +0000 2018,ADM was recognized as an Industry Mover in @RobecoSAM's 2018 Sustainability Yearbook https://t.co/qtzAeC8518 https://t.co/yn0VHfqBqe,en,ADM
Wed Jan 24 18:45:50 +0000 2018,Thanks to @EDBsg for helping us celebrate the opening of our new Innovation Center in Singapore! https://t.co/ay8TW4zDcj https://t.co/XkzYe6zPPR,en,ADM
Mon Jan 22 17:57:15 +0000 2018,Proud to be named one of @FortuneMagazine #MostAdmired Companies for the 10th year in a row https://t.co/gVvZLwM80U,en,ADM
Thu Jan 18 15:12:44 +0000 2018,ADM and Vland Enter Joint Development Agreement for Feed Enzyme Technology https://t.co/rw1TqyLA2E,en,ADM
Tue Jan 16 17:02:36 +0000 2018,"ADM to Release Fourth Quarter Financial Results Feb. 6, 2018 https://t.co/6Wr8ucGBPO",en,ADM
Mon Dec 11 15:35:58 +0000 2017,"ADM Reaches Agreement to Sell Bolivian Oilseeds Operations
https://t.co/PfIQCVxWmk",en,ADM
Thu Nov 02 16:14:29 +0000 2017,ADM Directors Declare Cash Dividend https://t.co/v5sjOg5Izo,en,ADM
Tue Oct 31 11:11:45 +0000 2017,"ADM Reports Third Quarter Earnings of $0.34 per Share, $0.45 per Share on an Adjusted Basis https://t.co/j2Qda6hZGn",en,ADM
Mon Oct 02 14:16:03 +0000 2017,Statement: ADM is not bidding on Unilever's spreads business.,en,ADM
Thu Sep 14 15:05:35 +0000 2017,"ADM Announces Personalized Nutrition Collaboration with Mayo Clinic 
https://t.co/yEHX1Amv4D",en,ADM
Fri Aug 25 14:12:15 +0000 2017,ADM Appoints New Corporate Treasurer https://t.co/sHzXOTtpC0,en,ADM
Thu Aug 03 15:15:55 +0000 2017,ADM Directors Declare Cash Dividend https://t.co/J3hvhXSP4c,en,ADM
Tue Aug 01 11:08:06 +0000 2017,"ADM Reports Second Quarter Earnings of $0.48 per Share, $0.57 per Share on an Adjusted Basis https://t.co/3YWDsMvqJk",en,ADM
Wed Jul 19 13:33:39 +0000 2017,ADM Expands Destination Marketing Capabilities with Completion of Industries Centers Acquisition https://t.co/BlRMVI4VrH,en,ADM
Tue Jul 11 15:34:27 +0000 2017,"ADM to Release Second Quarter Financial Results Aug. 1, 2017 https://t.co/y9O406GQAK",en,ADM
Mon Jul 03 14:59:03 +0000 2017,ADM Completes Acquisition of Chamtor https://t.co/79jW4prfRh https://t.co/QfQV13hyTo,en,ADM
Wed Jun 21 13:42:44 +0000 2017,"ADM Opens New Silo for its First Harvest in Silistra, Bulgaria https://t.co/axBXYCEhjr",en,ADM
Wed Jun 14 15:11:20 +0000 2017,ADM Enters Specialty Feed Ingredient Collaboration with Anco https://t.co/SlCy4gU80Q https://t.co/8lgK64KWT6,en,ADM
Tue Jun 13 15:14:31 +0000 2017,ADM Joins New Business Diversity and Inclusion Collaboration https://t.co/plvnaPSYjM,en,ADM
Fri Jun 02 14:26:33 +0000 2017,ADM to Construct New Flour Mill in Illinois https://t.co/mYwNGPupm5,en,ADM
