created_at,full_text,lang,user_name
Mon May 22 15:44:54 +0000 2017,"ADM Celebrates Expansion, Modernization at Brazilian Port of Santos https://t.co/rJNDWqlPWt",en,ADM
Mon May 08 11:33:16 +0000 2017,ADM Expands Destination Marketing Footprint with Acquisition of Majority Stake in Israeli Merchandiser https://t.co/DzGDNEqUkR,en,ADM
Fri May 05 16:19:31 +0000 2017,ADM Praises ITC for Preliminary Vote in Favor of Countervailing and Antidumping Duties on Imported Biodiesel https://t.co/UgzlUC2TTb,en,ADM
Tue May 02 11:03:06 +0000 2017,"ADM Reports First Quarter Earnings of $0.59 per Share, $0.60 per Share on an Adjusted Basis https://t.co/VsRGMw6lNJ",en,ADM
Wed Apr 26 15:05:09 +0000 2017,ADM to Present at BMO Capital Markets 2017 Farm to Market Conference https://t.co/1DLiEhtDEX,en,ADM
Tue Apr 11 16:07:59 +0000 2017,"ADM to Release First Quarter Financial Results May 2, 2017 https://t.co/9gsEnUaHnC",en,ADM
Tue Mar 28 17:52:55 +0000 2017,RT @ADMcares: ADM is proud to partner with @WFP to provide life-saving food and nutrition relief in #EastAfrica. #FacingFamine https://t.co…,en,ADM
Mon Mar 27 15:05:10 +0000 2017,ADM Adds to European Sweetener and Starch Footprint with Proposed Acquisition of Chamtor https://t.co/aoV4qrJhLk,en,ADM
Fri Mar 24 15:05:38 +0000 2017,ADM Board of Directors Nominates Suzan F. Harrison to Board https://t.co/W4ItLIZDY0,en,ADM
Mon Mar 20 16:32:55 +0000 2017,"In NGFA Keynote Address, Luciano Discusses How U.S. Grain Industry Can Continue to Lead in Feeding the World https://t.co/bLa3y2mItC",en,ADM
Mon Mar 13 15:04:38 +0000 2017,"ADM to Expand Animal Nutrition Capabilities with New Facilities in Xiangtan and Nanjing, China https://t.co/olVHv2XQm5",en,ADM
Thu Feb 16 19:41:18 +0000 2017,Ninth year in a row among @FortuneMagazine #MostAdmired. Proud. #TeamADM #FeedingYourFoodBusiness https://t.co/xzgrQdvMXK,en,ADM
Tue Feb 07 12:10:39 +0000 2017,ADM Directors Declare Cash Dividend https://t.co/pVmFrU6i9o,en,ADM
Tue Feb 07 12:02:59 +0000 2017,"ADM Reports Fourth Quarter Earnings of $0.73 per Share, $0.75 per Share on an Adjusted Basis https://t.co/Jhs2GdY7Wg",en,ADM
Mon Jan 30 21:20:21 +0000 2017,ADM Reaches Agreement for Sale of Crop Risk Services Business to Validus https://t.co/N25cvEdem9,en,ADM
Tue Jan 17 16:06:01 +0000 2017,"ADM to Release Fourth Quarter Financial Results Feb. 7, 2017 https://t.co/yqygn5MvT1",en,ADM
Tue Jan 10 20:16:15 +0000 2017,ADM Invests in Expansion of Pet Food Business with Purchase of Crosswind Industries https://t.co/edEa9d0sVA,en,ADM
Mon Dec 12 13:03:29 +0000 2016,"ADM to Expand Grind Capacity, Sweeteners and Starches Capabilities at Turkey and Bulgaria Corn Facilities https://t.co/KfHQnx0zf8",en,ADM
Fri Dec 09 21:08:15 +0000 2016,RT @DuPontBiobased: Honored to win @PlattsGEA Breakthrough Solution of the Year award w/ @ADMupdates for FDME platform tech. #PlattsGEA htt…,en,ADM
Thu Dec 01 21:01:33 +0000 2016,ADM Announces Sale of Stake in GrainCorp https://t.co/73x7yYTOwE,en,ADM
Tue Nov 22 20:03:05 +0000 2016,"ADM Contributes More Than $390,000 to Local Food Banks https://t.co/NDKFIFlyN4",en,ADM
Wed Nov 16 20:46:12 +0000 2016,Statement from ADM Chairman and CEO Juan Luciano on the Passing of Dwayne O. Andreas https://t.co/rQKOxG17Kx https://t.co/mTpHbUy3kD,en,ADM
Fri Nov 11 16:01:57 +0000 2016,ADM Recognized for Military Veteran Mentoring and Hiring Program https://t.co/leu9Xp6fQy,en,ADM
Wed Nov 02 20:18:59 +0000 2016,"ADM Directors Declare Cash Dividend
https://t.co/oG90ZjGtCE",en,ADM
Tue Nov 01 11:03:46 +0000 2016,"ADM Reports Third Quarter Earnings of $0.58 per Share, $0.59 per Share on an Adjusted Basis https://t.co/Hsa2n2gxlV",en,ADM
Wed Oct 12 18:12:18 +0000 2016,RT @DiversityIL: Congrats to @ADMUpdates on being ranked #1 for diversity in CHI! We commend you for being great diversity champions!https:…,en,ADM
Tue Aug 30 21:49:20 +0000 2016,RT @IALtGov: .@ADMupdates is a trusted partner in value-added agriculture in our state &amp; across the world #FarmProgressShow https://t.co/Rt…,en,ADM
Wed Aug 10 18:23:25 +0000 2016,Best of luck to the finalists in the last round of competition. https://t.co/TaK9RfZFQz,en,ADM
Wed Aug 03 18:32:04 +0000 2016,ADM Directors Declare Cash Dividend https://t.co/i3fjQsfsrE,en,ADM
Tue Aug 02 11:01:44 +0000 2016,"ADM Reports Second Quarter Earnings of $0.48 per Share,$0.41 per Share on an Adjusted Basis https://t.co/iOvMCj2V1b",en,ADM
Wed Jul 13 15:03:29 +0000 2016,ADM Lead Director Donald E. Felsinger Named 2016 Director of the Year by National Association of Corporate Directors https://t.co/VLZrSYUgee,en,ADM
Tue Jul 12 15:16:41 +0000 2016,"ADM to Release Second Quarter Financial Results Aug. 2, 2016 https://t.co/KN0peVThto",en,ADM
Wed Jul 06 15:08:23 +0000 2016,"ADM Highlights Energy, Water Reductions in New Corporate Sustainability Report https://t.co/UMUNzqCeqM",en,ADM
Wed Jun 15 18:51:28 +0000 2016,RT @FI_Challenge: Top 10 semi-finalists for the 2016 Food Innovation Challenge! Congratulations to all! https://t.co/fi6Xdc57E1 https://t.c…,en,ADM
Mon Jun 13 15:02:02 +0000 2016,We’re celebrating a decade of improvement on our journey to zero during our 10th annual Global Safety &amp; Health Week. https://t.co/4xgCP0P47x,en,ADM
Thu May 26 15:04:33 +0000 2016,ADM Donation to Aid in Alberta Wildfire Relief https://t.co/3epl5uCvWl,en,ADM
Wed May 25 19:07:09 +0000 2016,ADM Advances Strategy with Completion of Brazilian Sugar Ethanol Sale https://t.co/0GMOfAnub5,en,ADM
Mon May 16 15:59:29 +0000 2016,ADM Adds to South American Ingredient Capabilities with Full Ownership Acquisition of Amazon Flavors https://t.co/OP3rWmDYnW,en,ADM
Thu May 05 17:04:17 +0000 2016,"ADM Elects Directors at Annual Meeting, Declares Cash Dividend https://t.co/PIlT33Hz8N",en,ADM
Wed May 04 15:09:12 +0000 2016,ADM to Present at BMO Capital Markets 2016 Farm to Market Conference https://t.co/FQOqKEMLHI,en,ADM
Tue May 03 11:01:18 +0000 2016,ADM Reports First Quarter Adjusted Earnings of $0.42 per Share https://t.co/DMePT21Uov,en,ADM
Fri Apr 22 15:03:50 +0000 2016,RT @FI_Challenge: ADM is a proud sponsor of the Food Innovation Challenge! https://t.co/VVPfyriqCJ  #FoodInnovation https://t.co/CASb1zIIOA,en,ADM
Fri Apr 22 15:02:37 +0000 2016,ADM Celebrates Earth Day with Launch of Sustainability Progress Tracker  https://t.co/e2xzdN04rX,en,ADM
Tue Apr 19 19:23:11 +0000 2016,"ADM Celebrates Opening New Food Business Incubator that Seeks to Spur Innovation, Expand Economic Opportunity in IL https://t.co/akSvCq05yw",en,ADM
Tue Apr 12 15:03:24 +0000 2016,"ADM to Release First Quarter Financial Results May 3, 2016  https://t.co/lnYucorOrA",en,ADM
Tue Apr 05 15:02:36 +0000 2016,"ADM Expanding, Modernizing Brazilian Port https://t.co/wQcxsUzIEa",en,ADM
Thu Mar 31 20:44:04 +0000 2016,"ADM Reaches Agreement to Sell Brazilian Sugar Ethanol Operations
https://t.co/gZTXX3d9ll",en,ADM
Mon Mar 28 15:17:08 +0000 2016,ADM Board of Directors Nominates Debra A. Sandler to Board  https://t.co/YcAFtxliHn,en,ADM
Thu Mar 24 14:44:27 +0000 2016,Luciano Lauds Argentine Government’s Recent Reforms; Urges Continued U.S. Support as Macri Admin. Advances Agenda https://t.co/edbmU3a5eW,en,ADM
Fri Feb 19 18:31:09 +0000 2016,Proud to be named Most Admired Company in the food production industry for 2nd year in a row by @FortuneMagazine https://t.co/1mfcfp35pV,en,ADM
Mon Feb 08 13:55:39 +0000 2016,ADM Further Expands Global Sweetener Footprint with Purchase of Moroccan Processing Facility https://t.co/T1N3Fg07yU,en,ADM
Tue Feb 02 15:20:45 +0000 2016,"ADM Enhances Plant Protein, Gluten-Free Ingredient Portfolio with Purchase of Harvest Innovations https://t.co/XiM4g2h004",en,ADM
Tue Feb 02 12:01:17 +0000 2016,ADM Reports Fourth Quarter Adjusted Earnings of $0.61 per Share https://t.co/7ggcDKKgvQ,en,ADM
Tue Jan 26 16:03:53 +0000 2016,ADM to Present at 2016 CAGNY Conference https://t.co/zUQLo1Xc8g,en,ADM
Tue Jan 19 15:15:35 +0000 2016,DuPont Industrial Biosciences and ADM Announce Breakthrough Platform Technology for Long Sought-After Molecule https://t.co/3xMZL4W9Sq,en,ADM
Tue Jan 12 16:08:16 +0000 2016,"ADM to Release Fourth Quarter Financial Results Feb. 2, 2016 https://t.co/tfRdpiUuol",en,ADM
Mon Dec 14 13:12:52 +0000 2015,ADM Expands EMEA Supply Chain Footprint with Investment in Medsofts Group https://t.co/NDsBjSWd66,en,ADM
Thu Dec 10 14:32:39 +0000 2015,Olenex to Become a Full-Function Joint Venture https://t.co/DYjArBrwdN,en,ADM
Mon Nov 23 17:42:58 +0000 2015,"ADM Helps Feed Those in Need with Nearly $360,000 in Contributions to Local Food Banks https://t.co/k3HAhbNyoL",en,ADM
Wed Nov 04 20:13:18 +0000 2015,ADM Directors Declare Cash Dividend https://t.co/p3Qe7ohJah,en,ADM
Tue Nov 03 12:01:44 +0000 2015,ADM Reports Third Quarter Adjusted Earnings of $0.60 per Share https://t.co/o5WiHNkQzB,en,ADM
Mon Nov 02 13:24:07 +0000 2015,ADM Strengthens Global Sweetener Footprint with Completion of Eaststarch Acquisition https://t.co/oGeQVgYNOS,en,ADM
Fri Oct 16 16:35:15 +0000 2015,"ADM Completes Sale of Global Cocoa Business 
http://t.co/L0WHr97Urw",en,ADM
Tue Oct 13 15:07:17 +0000 2015,"ADM to Release Third Quarter Financial Results on Nov. 3, 2015 http://t.co/XGAL7iufJM",en,ADM
Thu Oct 01 13:31:19 +0000 2015,ADM to Acquire Eatem Foods Company http://t.co/MzwFsaj4mI,en,ADM
Fri Sep 25 19:27:49 +0000 2015,Today’s launch of Midwest Inland Port with @DecaturEDC shows how Decatur’s @city_limitless http://t.co/iA3qPdd2Qx http://t.co/KDcLMM4rne,en,ADM
Thu Sep 24 19:07:26 +0000 2015,ICYMI @GovSteveBeshear helped us open our new IT center in Erlanger today @ThinkKentucky. http://t.co/U0pqfuhhRx http://t.co/QIPxT4V7h9,en,ADM
Thu Sep 24 17:09:54 +0000 2015,@GovSteveBeshear helped us open our new IT center in Erlanger today @ThinkKentucky . http://t.co/U0pqfuhhRx http://t.co/SAtHqzd9ir,en,ADM
Wed Sep 16 14:35:53 +0000 2015,ADM Announces New East Coast Flavor Creation and Customer Innovation Facility http://t.co/jbTGhCmbUL,en,ADM
Wed Sep 02 19:25:26 +0000 2015,Another great live show with @maxarmstrong and Orion MT @byers_brian: @FPShow @WGNRadio great crowd #FarmProgressShow http://t.co/K0U7niegxv,en,ADM
Wed Sep 02 16:59:14 +0000 2015,"RT @ADMcares: Our rural communities just got a little safer! ADM Cares announced a $75,000 grant to @PAFSafetyDays during the @FPShow today!",en,ADM
Tue Aug 04 11:03:19 +0000 2015,ADM Reports Second Quarter Adjusted Earnings of $0.60 per Share http://t.co/kycN24xNmm,en,ADM
Mon Aug 03 10:06:29 +0000 2015,ADM Completes Sale of Global Chocolate Business http://t.co/TObGLOROxx,en,ADM
Wed Jul 15 19:02:36 +0000 2015,We are proud to show our support for @LLandW today with a little sweat and a big donation! http://t.co/B6A9hQLTn4 http://t.co/5nb2kUTXek,en,ADM
Tue Jul 14 15:09:01 +0000 2015,"ADM to Release Second Quarter Financial Results on Aug. 4, 2015 http://t.co/gnnV0DKCUM",en,ADM
Wed Jul 01 19:16:59 +0000 2015,ADM and QLF Form Liquid Feed Joint Venture http://t.co/zdFSEES8Eb,en,ADM
Wed Jul 01 12:02:59 +0000 2015,Archer Daniels Midland Company Announces Results of Offers to Purchase Certain Outstanding Debentures http://t.co/5GblUV99sp,en,ADM
Fri Jun 05 18:01:24 +0000 2015,ADM’s Responsible Soy Standard in Brazil provides European customers with sustainably sourced protein meal. http://t.co/reg7r6uwyb,en,ADM
Fri Jun 05 17:01:43 +0000 2015,We’re committed to building traceable and transparent ag supply chains that protect the world’s forests. http://t.co/ZspOIutcRd,en,ADM
Fri Jun 05 14:01:51 +0000 2015,We’re helping improve the quality of crops and the lives of farmers who grow them. http://t.co/NomGuEFEXw,en,ADM
Thu Jun 04 17:01:31 +0000 2015,No Deforestation: It’s our policy. Learn more: http://t.co/ZspOIutcRd,en,ADM
Thu Jun 04 14:01:21 +0000 2015,"We already surpassed our 2018 goal of a 15% production-adjusted reduction in water. Now, we’re going further. http://t.co/1d0ec8p0sC",en,ADM
Wed Jun 03 17:01:29 +0000 2015,"Since 2010, we’ve reduced by 17.3% the energy ADM uses to serve vital needs. Learn how: http://t.co/oE3GjP10rF",en,ADM
Wed Jun 03 14:02:28 +0000 2015,"We’re reducing energy use, emissions and water use per unit of production. http://t.co/jNZ1fXSE6O",en,ADM
Tue Jun 02 17:01:34 +0000 2015,ADM teams are committed to water efficiency. Learn more: http://t.co/1d0ec8GBka,en,ADM
Tue Jun 02 15:24:56 +0000 2015,ADM Expands Specialty Ingredient Footprint with Acquisition of California Processing Facility http://t.co/ZHOhHpXlAP,en,ADM
Tue Jun 02 14:01:59 +0000 2015,"We’ve targeted 15% reductions in energy use, water use and emissions by 2020. Check out our progress: http://t.co/jNZ1fXSE6O",en,ADM
Mon Jun 01 17:01:13 +0000 2015,We’ve cut emissions per unit of production 8.6% since 2010.  Here’s how: http://t.co/dJyqO78Vbh,en,ADM
Mon Jun 01 14:50:09 +0000 2015,Archer Daniels Midland Company Announces Tender Offers for Certain Outstanding Debentures http://t.co/AsZpPHUod3,en,ADM
Mon Jun 01 14:01:41 +0000 2015,"Using less energy and water, reducing emissions: We’re on it. http://t.co/jNZ1fXSE6O",en,ADM
Fri May 29 17:01:20 +0000 2015,No drop in the bucket: We’ve reduced water consumption almost 20% since 2008 on a production-adjusted basis. http://t.co/1d0ec8p0sC,en,ADM
Fri May 29 14:02:03 +0000 2015,Two ADM sweetener terminals no longer send any waste to landfills. Learn how they did it. http://t.co/CZbhL5G6I4,en,ADM
Thu May 28 17:02:20 +0000 2015,How’re we doing at reducing our carbon footprint? Here’s the scoop. http://t.co/dJyqO78Vbh,en,ADM
Thu May 28 14:02:14 +0000 2015,We aim to protect the world’s forests while serving vital needs. http://t.co/ZspOIutcRd,en,ADM
Wed May 27 17:01:01 +0000 2015,"In 2014, our operations improvements saved enough energy to power 71,520 U.S. homes. http://t.co/oE3GjP10rF",en,ADM
Wed May 27 15:25:28 +0000 2015,ADM Reports Significant Progress toward Environmental Goals in New Corporate Responsibility Report http://t.co/uM9JjfEN4F,en,ADM
Wed May 27 14:00:47 +0000 2015,Our new Corporate Responsibility report is now online. Check it out: http://t.co/5BqBX4HJjV,en,ADM
Sun May 17 23:07:55 +0000 2015,ADM Grows Sweetener Business in China with Agreement to Purchase Meiweiyuan Biotechnology http://t.co/bMykqbb1NS,en,ADM
Thu May 07 21:04:34 +0000 2015,"ADM Elects Directors at Annual Meeting, Declares Cash Dividend http://t.co/9w0ZEp1iHe",en,ADM
Tue May 05 14:28:29 +0000 2015,ADM to Acquire Full Ownership of Black Sea Export Terminals http://t.co/0UePY3dx08,en,ADM
Tue May 05 14:19:53 +0000 2015,ADM to Construct Feed Plants in China and Minnesota http://t.co/pFCMv6ntT8,en,ADM
Tue May 05 11:02:10 +0000 2015,ADM Reports First Quarter Adjusted Earnings of $0.77 per Share http://t.co/PgsQ51ZkCA,en,ADM
Fri May 01 19:35:21 +0000 2015,"ADM Contributes $50,000 to @RedCross to Support Nepal Earthquake Relief http://t.co/HXwFDQmdqA",en,ADM
Fri May 01 15:25:10 +0000 2015,ADM Announces Management Appointment http://t.co/8ulEYrsKBk,en,ADM
Thu Apr 30 19:03:47 +0000 2015,ADM to Present at BMO Capital Markets 2015 Farm to Market Conference http://t.co/sSvZlsshev,en,ADM
Mon Apr 27 15:02:40 +0000 2015,ADM Oilseeds Plants in North Dakota and Ontario to Increase Processing Flexibility http://t.co/3E842lqYI9,en,ADM
Wed Apr 22 15:04:17 +0000 2015,ADM Crop Risk Services Achieves Milestone in Plans for Innovative Aerial Drone Technology http://t.co/enc5x2ei3S,en,ADM
Tue Apr 21 06:11:14 +0000 2015,"ADM Expands Corn Processing Footprint w/ Acquisition of Facilities in BG &amp; TR, Increase of Ownership in HU Facility http://t.co/0IQLeKs8nw",en,ADM
Tue Apr 14 15:15:05 +0000 2015,"ADM to Release First Quarter Financial Results on May 5, 2015 http://t.co/Soz26dhqbn",en,ADM
Thu Apr 09 21:12:33 +0000 2015,ADM Announces Management Appointment http://t.co/0mtNucKjVk,en,ADM
Wed Apr 08 15:11:06 +0000 2015,Launch of ARTCO Stevedoring Offers Customers Unmatched Service on Lower Mississippi http://t.co/S04GbAiTlK,en,ADM
Mon Mar 30 11:51:37 +0000 2015,ADM Reaches Agreement to Acquire AOR N.V. http://t.co/JjdeI87LSc,en,ADM
Fri Mar 27 21:36:08 +0000 2015,ADM celebrates 90 years on @nyse. Began as 2 guys crushing linseed in Minn. Now: 33k with customers in 140 countries. http://t.co/CO5uwpKr2u,en,ADM
Fri Mar 27 15:05:09 +0000 2015,ADM Announces Appointments in Corn Business Unit http://t.co/FBZrtUmgfz,en,ADM
Mon Mar 02 19:13:49 +0000 2015,ADM Announces Management Appointments http://t.co/KuwLSMKjZ1,en,ADM
Fri Feb 20 16:02:08 +0000 2015,Fortune Magazine Ranks ADM Most Admired Food Production Company http://t.co/3COIcI7JLX,en,ADM
Tue Feb 03 15:25:07 +0000 2015,ADM to Sell 50 Percent Stake in Northern Brazil Export Terminal http://t.co/qW1r7sVXSA,en,ADM
Tue Feb 03 12:02:46 +0000 2015,ADM Reports Strong Adjusted Fourth Quarter 2014 Earnings of $1.00 per Share http://t.co/arw7ltc9Yt,en,ADM
Tue Jan 27 20:32:33 +0000 2015,ADM to Present at 2015 CAGNY Conference http://t.co/9ULoIthBlx,en,ADM
Tue Jan 13 16:05:08 +0000 2015,"ADM to Release Fourth Quarter Financial Results on Feb. 3, 2015 http://t.co/zZeYKwNgAB",en,ADM
Fri Dec 19 15:07:24 +0000 2014,ADM Participates in U.S.-China Joint Commission on Commerce and Trade Meeting http://t.co/4juwC9DWc6,en,ADM
Wed Dec 17 17:22:39 +0000 2014,ADM Completes Sale of South American Fertilizer Business http://t.co/Tn6IiQxutS,en,ADM
Mon Dec 15 23:34:24 +0000 2014,ADM to Sell Global Cocoa Business to Olam http://t.co/P2FciQnZ2j,en,ADM
Thu Dec 11 16:56:32 +0000 2014,"ADM to Establish Tech Center in Erlanger, Kentucky http://t.co/H2n2Uvg4pi",en,ADM
Wed Dec 03 22:47:29 +0000 2014,ADM Outlines Strategy to Accelerate Growth of Returns and EVA http://t.co/QxR0yQ6lcS,en,ADM
Tue Nov 18 17:04:31 +0000 2014,ADM Completes Acquisition of Specialty Commodities Inc. http://t.co/iakMfUE93B,en,ADM
Mon Nov 17 16:06:21 +0000 2014,ADM to Host Investor Day on Dec. 3 http://t.co/5dWSrmNUTf,en,ADM
Wed Nov 12 15:03:04 +0000 2014,"ADM Opens First Phase of Integrated Food-Ingredient Plant in Tianjin, China http://t.co/vBOdwnLEcV",en,ADM
Thu Nov 06 05:14:37 +0000 2014,ADM Names Juan Luciano Next CEO; Pat Woertz Remains Chairman http://t.co/Wg8HLVJvr9,en,ADM
Tue Nov 04 12:04:53 +0000 2014,ADM Reports Adjusted Third Quarter 2014 Earnings of $0.81 per Share http://t.co/yR1QwSQt6w,en,ADM
Fri Oct 31 20:34:19 +0000 2014,"Golden Peanut Changes Name to Golden Peanut and Tree Nuts, Acquires Harrell Nut Company http://t.co/yPbhI4Yf1M",en,ADM
Fri Oct 31 20:33:36 +0000 2014,"Golden Peanut Changes Name to Golden Peanut and Tree Nuts, Acquires Harrell Nut Company http://t.co/3OWQBE12XF",en,ADM
Thu Oct 16 15:07:59 +0000 2014,ADM supports World Food Day every day. One example: Last week ADM and colleagues donated &gt;100 tons to #WSOYFoodDrive. #WFD2014,en,ADM
Tue Oct 14 15:04:58 +0000 2014,"ADM to Release Third Quarter Financial Results on Nov. 4, 2014 http://t.co/WHqaIRkY8D",en,ADM
Mon Oct 13 16:34:35 +0000 2014,ADM to Acquire Specialty Commodities Inc. http://t.co/cQjnBc0MQZ,en,ADM
Thu Oct 09 18:23:39 +0000 2014,RT @cafnr: Ribbon cut on the ADM Center for Agricultural Development! $1M gift means great things for students. @ADMupdates http://t.co/BZ2…,en,ADM
Tue Sep 30 15:48:08 +0000 2014,Marubeni and ADM Bolster Export Joint Venture in U.S. Pacific Northwest http://t.co/lzlvRsYVnw,en,ADM
Wed Sep 10 15:05:10 +0000 2014,ADM R&amp;D Leader Receives Innovation Award http://t.co/A9WVocy6Yf,en,ADM
Tue Sep 02 13:18:51 +0000 2014,ADM Announces Sale of Global Chocolate Business http://t.co/FlwwdPFifv,en,ADM
Thu Aug 28 18:37:11 +0000 2014,Watch live as we cut the ribbon on our Global HQ &amp; Customer Center w @ChicagosMayor http://t.co/ewwUZljmHw,en,ADM
Wed Aug 27 14:59:03 +0000 2014,"Stop by the @PAFSafetyDays ag safety area in the ADM tent, Lot 234 during @FPShow for tips on #farmsafety. #FPS14",en,ADM
Tue Aug 26 20:29:46 +0000 2014,RT @FFAfoundation: @ADMupdates marks 55 years in giving to @nationalffa http://t.co/dfgpwcT8C3…,en,ADM
Tue Aug 26 15:15:55 +0000 2014,"We're hosting Iowa Ag Sec @Northey4IowaAG on stage today w @maxarmstrong &amp; Orion. Check them out at the ADM tent, lot 234 @FPShow. #FPS14",en,ADM
Mon Aug 25 17:02:40 +0000 2014,ADM is proud to be at the Farm Progress Show. Stop by our tent at Lot 234. #FPS14,en,ADM
Mon Aug 25 15:07:40 +0000 2014,ADM Opens Global Headquarters and Customer Center in Chicago http://t.co/Pp9AyHrtLf,en,ADM
Thu Aug 21 14:22:29 +0000 2014,ADM Announces Management Appointment http://t.co/zySgwbQlqp,en,ADM
Mon Aug 18 19:06:07 +0000 2014,First Loaded Ship Departs New ADM Port Terminal in Northern Brazil http://t.co/17VyDMP9ge,en,ADM
Fri Aug 15 15:03:11 +0000 2014,ADM to Present at Barclays Back-to-School Consumer Conference http://t.co/C3nWRn11bw,en,ADM
Tue Aug 12 16:41:46 +0000 2014,RT @YWCAClintonIowa: We're EXCITED about the new fitness class equipment we've got coming in thanks to ADM &amp; the ADM Cares grant! Come See …,en,ADM
Wed Aug 06 21:18:04 +0000 2014,ADM Directors Declare Cash Dividend http://t.co/QKaVCkhG07,en,ADM
Tue Aug 05 11:04:08 +0000 2014,ADM Reports Adjusted Second Quarter 2014 Earnings of $0.77 per Share http://t.co/UGneuxQrSF,en,ADM
Tue Jul 08 17:05:35 +0000 2014,"ADM to Release Second Quarter Financial Results on Aug. 5, 2014 http://t.co/w81m23DqVI",en,ADM
Mon Jul 07 06:45:22 +0000 2014,ADM Expands Food-Ingredient Offering with Acquisition of WILD Flavors http://t.co/kNcqJITeKI,en,ADM
Wed Jun 11 21:03:57 +0000 2014,ADM Expands Presence in Asia-Pacific to Serve Growing Market http://t.co/4tebxwDHBt,en,ADM
Wed Jun 11 19:15:54 +0000 2014,ADM to Highlight Wide Range of Food Ingredients at IFT 2014 http://t.co/p3E0IR1Y9Q,en,ADM
Fri Jun 06 10:03:46 +0000 2014,ADM Completes Acquisition of Remaining Stake of Toepfer International http://t.co/Dcd2ZyNppN,en,ADM
Tue May 27 14:04:49 +0000 2014,ADM Joins World Cocoa Foundation’s CocoaAction Sustainability Strategy http://t.co/oR2vhFexLh,en,ADM
Thu May 22 15:03:47 +0000 2014,"ADM’s Returns Strategy Showing Early Results, Luciano Says http://t.co/X5LnCrwK5F",en,ADM
Mon May 19 13:40:13 +0000 2014,"ADM Building Sweetener and Soluble-Fiber Manufacturing Complex in Tianjin, China http://t.co/RrdFvx8Mq9",en,ADM
Mon May 12 14:03:11 +0000 2014,ADM Announces Plans to Expand Availability of Sustainable Palm Oil http://t.co/ohmqfnWZQp,en,ADM
Wed May 07 20:51:11 +0000 2014,ADM Announces Management Appointments http://t.co/msBkG3F5L9,en,ADM
Thu May 01 15:36:08 +0000 2014,"ADM Elects Directors at Annual Meeting, Declares Cash Dividend http://t.co/Re2ZysOycb",en,ADM
Wed Apr 30 19:29:27 +0000 2014,ADM to Present at BMO Capital Markets 2014 Farm to Market Conference http://t.co/YmR9frt9Yb,en,ADM
Tue Apr 29 11:04:53 +0000 2014,ADM Reports Adjusted First Quarter 2014 Earnings of $0.55 per Share http://t.co/avwhP8RU7M,en,ADM
Tue Apr 15 17:19:32 +0000 2014,ADM Announces Significant Actions in Ongoing Portfolio Management http://t.co/ORvK5HA8XD,en,ADM
Tue Apr 08 17:16:03 +0000 2014,"ADM to Release First Quarter Financial Results on April 29, 2014 http://t.co/kVMD1ILmo6",en,ADM
Tue Mar 25 15:01:14 +0000 2014,"Today, the US celebrates #NationalAgDay. Every day, ADM is proud to partner with farmers worldwide as we connect the harvest to the home.",en,ADM
Wed Mar 12 12:04:47 +0000 2014,"ADM to Build Specialty Protein Plant in Campo Grande, Brazil http://t.co/2xLvy3U1ZF",en,ADM
Tue Mar 11 16:51:52 +0000 2014,ADM Appoints Boerm to Lead Grain Group http://t.co/IhjB51fQYq,en,ADM
Tue Mar 11 16:48:22 +0000 2014,ADM Announces Management Appointments http://t.co/5duMYtOUPs,en,ADM
Thu Feb 27 19:20:48 +0000 2014,Great to catch up with #CNNHero of The Year Chad Pregracke today. We’re so proud to partner with @LLandW. http://t.co/5i25tXD3Rm,en,ADM
Tue Feb 25 15:11:00 +0000 2014,ADM Names Juan R. Luciano President http://t.co/sCmDNpKoAw,es,ADM
Thu Feb 06 16:02:48 +0000 2014,ADM to Present at Bank of America Merrill Lynch 2014 Global Agriculture Conference http://t.co/g3qbGyWTFT,en,ADM
Tue Feb 04 12:02:54 +0000 2014,ADM Reports Strong Adjusted Fourth Quarter 2013 Earnings of $0.95 per Share http://t.co/tL0qABBoQl,en,ADM
Tue Jan 14 16:03:12 +0000 2014,"ADM to Release Fourth Quarter Financial Results on Feb. 4, 2014 http://t.co/ZBaRcna7Gq",en,ADM
Fri Jan 03 16:02:40 +0000 2014,ADM Names Chief Compliance Officer http://t.co/oINfUlanOj,en,ADM
Fri Dec 20 22:04:09 +0000 2013,ADM Reaches FCPA Settlement http://t.co/ci0fWPHRsl,en,ADM
Fri Dec 20 18:04:40 +0000 2013,We’re supporting @LLandW as they work to clean U.S. inland waterways. http://t.co/HWAiT7d7yq,en,ADM
Thu Dec 19 18:04:41 +0000 2013,"Zero incidents, Zero injuries is our goal. #GlobalSafety See how we’re doing: http://t.co/MMEPuaXz8Q",en,ADM
Thu Dec 19 16:01:57 +0000 2013,Results at a glance: a two-page PDF of ADM’s 2013 corporate responsibility highlights. http://t.co/GWuusjPSq8,en,ADM
Wed Dec 18 18:04:22 +0000 2013,ADM and @PHL_Institute are helping farmers in the developing world preserve their crops: http://t.co/DkQfTzbOo8,en,ADM
Wed Dec 18 13:16:22 +0000 2013,ADM to Establish Global Headquarters in Chicago http://t.co/BNHZLYv3DZ,en,ADM
Tue Dec 17 18:03:58 +0000 2013,Feeding the world using less water per unit of production: that’s our goal. http://t.co/W6NQ0QHwGW,en,ADM
Mon Dec 16 18:03:31 +0000 2013,Feeding the world while working to shrink our carbon footprint.  See how we’re doing it http://t.co/nMXCXTWfze,en,ADM
Mon Dec 16 17:45:55 +0000 2013,ADM’s Board of Directors Votes to Increase Common Stock Dividend by 26 Percent http://t.co/qIMygT6kiZ,en,ADM
Fri Dec 13 18:03:44 +0000 2013,ADM’s 10 new tugboats are helping us minimize our environmental impact http://t.co/1hBmCOVlxk,en,ADM
Thu Dec 12 18:03:56 +0000 2013,"Sustainable ag., education, environment, hunger relief…just some of the areas we support through ADM Cares. http://t.co/rUzwMWCr2h",en,ADM
Wed Dec 11 18:03:06 +0000 2013,"Using 15% less energy per unit of production: It’s our 2020 goal, and we’re well on our way. http://t.co/mVNwADtgLc",en,ADM
