created_at,full_text,lang,user_name
Fri Aug 25 03:38:55 +0000 2017,@HotmailHowe Thanks for informing us! Will have that reposted in a bit. Here's the link for your reference https://t.co/M8wwqSrYl7 😉,en,Agilent Technologies
Thu Aug 24 19:30:08 +0000 2017,Video: A Robust LC-QQQ #Metabolomics Platform for Polar #MetaboliteProfiling https://t.co/cYk3ldaZU5 https://t.co/LBEg3wlkmd,en,Agilent Technologies
Thu Aug 24 18:54:33 +0000 2017,Agilent Technologies to Present at Morgan Stanley Global Healthcare Conference https://t.co/fPx7ksQnup,en,Agilent Technologies
Thu Aug 24 10:42:02 +0000 2017,RT @sutcliffeob: The final checkout is complete. All systems are operational! Our new @Agilent GC-MS system is ready for deployment. #harmr…,en,Agilent Technologies
Wed Aug 23 15:42:42 +0000 2017,My Eclipse Adventure: Agilent’s blog writer travels to the solar eclipse. Read more at https://t.co/pgHbLWe4Is https://t.co/sSriHtOGYg,en,Agilent Technologies
Tue Aug 22 19:00:08 +0000 2017,"Dr. Johnny Mitchell, President @ESCLabSciences talks about his experience using the Agilent Intuvo GC 9000 https://t.co/qkJLU3n0Fr https://t.co/WRgCwXefAk",en,Agilent Technologies
Tue Aug 22 14:37:06 +0000 2017,My Eclipse Adventure: Agilent’s blog writer travels to the solar eclipse. Read more at https://t.co/QhI8Rtbrcr,en,Agilent Technologies
Tue Aug 22 12:58:33 +0000 2017,RT @sutcliffeob: Installation Day! Our @Agilent GCMS grows #MANDRAKE @MMUsste research &amp; drug testing/analysis capability for #harmreductio…,en,Agilent Technologies
Mon Aug 21 14:34:04 +0000 2017,Agilent is helping ensure the safety of your eggs. Find out how at https://t.co/puk0WPb5UO https://t.co/jIqMsnZuRC,en,Agilent Technologies
Sat Aug 19 21:55:07 +0000 2017,Video tutorial: Fundamentals of SPE #SamplePreparation https://t.co/8ZyllrsYIu #sampleprep 👩‍🔬👨‍🔬 https://t.co/QcW8GoYvR1 https://t.co/6ZefkH2QZJ,en,Agilent Technologies
Sat Aug 19 02:00:05 +0000 2017,"GC Troubleshooting Video Series: Replacing Your Liner, Septum &amp; O-Ring. https://t.co/rjRQtHlNue https://t.co/cTqi97QV0p",en,Agilent Technologies
Sat Aug 19 01:19:02 +0000 2017,RT @CellPressNews: Read the free #Immunometabolism papers current shaping the field. Sponsored by @Agilent  https://t.co/TJeh7JtR7O https:/…,en,Agilent Technologies
Thu Aug 17 14:39:32 +0000 2017,Agilent and the solar eclipse. Read more at https://t.co/QtaAMb5eIi https://t.co/zzyrGs8CjP,en,Agilent Technologies
Wed Aug 16 19:30:06 +0000 2017,Video: Troubleshooting &amp; Maintenance of #ICPMS - the right way to clean and condition your interface cones https://t.co/WMdyRwsKrO https://t.co/Od7TnmdKGo,en,Agilent Technologies
Tue Aug 15 23:43:27 +0000 2017,RT @UChicagoGenes: Are you looking for something to do this Thursday in Chicago? Come check out @Agilent's #NGSonTAP with us! https://t.co/…,en,Agilent Technologies
Tue Aug 15 20:24:03 +0000 2017,Agilent Technologies Reports Third-Quarter Fiscal Year 2017 Financial Results https://t.co/gOwZfXyarE,en,Agilent Technologies
Tue Aug 15 14:33:26 +0000 2017,Can Alzheimer’s be reversed? Read more at https://t.co/hyD8KLXjPJ https://t.co/PP5U8YqYG6,en,Agilent Technologies
Sun Aug 13 04:00:05 +0000 2017,Video: how Agilent OneNeb Series 2 nebulizer utilize Flow Blurring nebulization for better sensitivity &amp; precision https://t.co/uh18oB92v8 https://t.co/Pn9j5h991p,en,Agilent Technologies
Sat Aug 12 14:30:06 +0000 2017,"Video: Troubleshooting &amp; Maintenance of #ICPMS - inspect torch, bonnet, shield plate, &amp; RF coil https://t.co/dR2UqXxWfI https://t.co/eYy7YOtLLs",en,Agilent Technologies
Thu Aug 10 14:33:38 +0000 2017,Health experts report a Salmonella outbreak in a popular fruit. Find out more at https://t.co/qsO7epxiRO https://t.co/a6dULD7XHM,en,Agilent Technologies
Thu Aug 10 01:39:39 +0000 2017,RT @OlivierHumphrey: The @Agilent 8900 ICP-MS Triple Quad and HPLC system in action #PhD #speciation #iodine @BritGeoSurvey https://t.co/hF…,en,Agilent Technologies
Wed Aug 09 21:30:07 +0000 2017,See how this little game changer is reshaping the future of #MassSpec - #Ultivo https://t.co/YjZ0XguAtm https://t.co/tPZpPrhges,en,Agilent Technologies
Wed Aug 09 13:05:15 +0000 2017,RT @OlivierHumphrey: Running iodine speciation analysis on the Agilent 8900 ICP-MS Triple Quad today @BritGeoSurvey @Agilent https://t.co/5…,en,Agilent Technologies
Tue Aug 08 14:35:56 +0000 2017,Agilent helps scientists identify actual color in a dinosaur fossil. Read more at https://t.co/LO4HbidLez https://t.co/PQT2G6xa2n,en,Agilent Technologies
Sun Aug 06 03:00:07 +0000 2017,Refresher Tutorial Video: Fundamentals of GC https://t.co/erecROlLaQ #chromatography https://t.co/4Pv4IyqSkL https://t.co/IjmIKxxtai,en,Agilent Technologies
Fri Aug 04 17:30:06 +0000 2017,Video:Troubleshooting &amp; Maintenance of #ICPMS- tips to help prevent failures &amp; avoid costly downtime / sample reruns https://t.co/VULZPexei6 https://t.co/pDxVtiRBvu,en,Agilent Technologies
Thu Aug 03 14:32:10 +0000 2017,How safe is the air you breathe on an airplane?  Find out at https://t.co/wyn8MgXIVO https://t.co/hB6Ep4IiEx,en,Agilent Technologies
Wed Aug 02 16:30:09 +0000 2017,Trailer: Prof Enke &amp; Prof Yost discuss the evolution of the triple quad &amp; the future for #MassSpec https://t.co/XzZ8K4tS3N https://t.co/0YPUs10Ks9,en,Agilent Technologies
Wed Aug 02 08:35:49 +0000 2017,RT @HallmarkTTRI: Agilent is hosting an Emerging Scientist Forum at the Florey on Sept 1st! Abstracts due on Friday. https://t.co/anbBB9UXi…,en,Agilent Technologies
Wed Aug 02 01:15:05 +0000 2017,#AgilentIntuvo #gaschromatograph &amp; oil-free #vacuumpumps are setting the green standard 🌱for #GCMS https://t.co/LgdSCPaSso https://t.co/upJbd5Z2nR,en,Agilent Technologies
Tue Aug 01 14:32:06 +0000 2017,Who killed Oetzi the Iceman?  Find out more at https://t.co/O0DzTayZXQ https://t.co/11w8zpvzFl,en,Agilent Technologies
Tue Aug 01 13:51:53 +0000 2017,New global research shows that lab managers seek better workflow systems to increase productivity &amp; throughput https://t.co/eVajMb0b6y https://t.co/SavWwWjCSw,en,Agilent Technologies
Sun Jul 30 13:27:54 +0000 2017,RT @ChemistryWorld: Watch our on-demand webinar from @Agilent exploring emerging trends and technologies in forensic toxicology https://t.c…,en,Agilent Technologies
Sun Jul 30 12:00:09 +0000 2017,"Working @ Agilent Technologies Waldbronn, Germany  https://t.co/G20moJNbLx https://t.co/KMHSKojCF1",en,Agilent Technologies
Sun Jul 30 04:15:55 +0000 2017,RT @monikasy81: 2nd challenging Day #ICPMSworkshop with #perlantechnologies @Agilent @AgilentLife #7900icpms #icpms https://t.co/28cP2jqJ0t,en,Agilent Technologies
Sun Jul 30 03:39:28 +0000 2017,Video: Troubleshooting &amp; Maintenance of #ICPMS - accurate standard &amp; sample prep https://t.co/7EuIlb1Rxv https://t.co/bVwNFiU8sT,en,Agilent Technologies
Fri Jul 28 15:06:34 +0000 2017,Agilent Technologies to Host Webcast of Third-Quarter Fiscal Year 2017 Financial Results Conference Call https://t.co/OcIGi0Pxzi,en,Agilent Technologies
Fri Jul 28 13:30:07 +0000 2017,Agilent brings #HPLC2017 to you! Watch our latest video. The Revolutionary Triple Quadrupole #Ultivo #MassSpec https://t.co/4cLobvlBV1 https://t.co/4ouZ4E4h1A,en,Agilent Technologies
Thu Jul 27 22:35:08 +0000 2017,"RT @ChemistryWorld: Available now! @Agilent examine the latest tools, trends and technologies in forensic toxicology:   https://t.co/F2NZdd…",en,Agilent Technologies
Thu Jul 27 22:34:13 +0000 2017,RT @ctcornelison: New GCMS from @Agilent installed today. Looking forward all the great data. #bioinnovation https://t.co/jDspDyNEsB,en,Agilent Technologies
Thu Jul 27 14:31:55 +0000 2017,Is sugar an addictive drug? Find out more at https://t.co/UJ1Wgr1zBz https://t.co/TKNOQcZXdV,en,Agilent Technologies
Thu Jul 27 14:26:41 +0000 2017,RT @CobaltLight1: Announcing the date for the 2nd International Pharmaceutical Seminar on Transmission Raman Spectroscopy @Agilent https://…,en,Agilent Technologies
Thu Jul 27 10:05:45 +0000 2017,RT @_pbnkelly: I may now be cursed by the Native American Chumash but hey at least my samples look pretty 👩‍🔬😍 #RealTimeChem #totallycursed…,en,Agilent Technologies
Thu Jul 27 07:53:42 +0000 2017,RT @LC_GC: Bigger is not always better! #Agilent tackling space issues in labs with their new MS system the Ultivo Triple Quadrupole LC-MS…,en,Agilent Technologies
Thu Jul 27 07:48:03 +0000 2017,RT @FGC_JLee: Table top ftir is adorable. Also thanks for the goggles. #foodpro2017 #Agilent https://t.co/VlLsBw9Hoj,en,Agilent Technologies
Thu Jul 27 03:13:25 +0000 2017,RT @SuzeNorth: Thanks to all WinC sponsors for their ongoing support @Agilent @pofip @CSIROnews #raci100 #SupportWinC https://t.co/AcrDygYx…,en,Agilent Technologies
Thu Jul 27 00:42:03 +0000 2017,RT @UF_ICBR: Thanks @Agilent for a great lunch and learn! https://t.co/Ns2ABQasC8,en,Agilent Technologies
Thu Jul 27 00:41:12 +0000 2017,RT @BusinessTimes: Agilent to invest S$85m over 5 years in #Singapore https://t.co/TxD0rUUysk https://t.co/Qq4tMt17Rm,en,Agilent Technologies
Tue Jul 25 14:34:31 +0000 2017,Scientists need to develop better methods to ensure water safety. Read more at https://t.co/LC1WQyP2ZW https://t.co/suvwf3K2Tq,en,Agilent Technologies
Tue Jul 25 08:09:33 +0000 2017,Agilent Technologies Introduces Real-Time PCR System for Clinical Diagnostics in Europe https://t.co/wxlKrpu8RP,ro,Agilent Technologies
Tue Jul 25 03:53:50 +0000 2017,RT @massspecpro: A look back at the birth of the triple quash (from @Agilent) https://t.co/8BOMB1HKRP,en,Agilent Technologies
Mon Jul 24 21:03:02 +0000 2017,Agilent Acquires Powerful Next Generation Sequencing IP Portfolio https://t.co/d5sroEuJLJ,en,Agilent Technologies
Sat Jul 22 03:20:32 +0000 2017,"@chrissykoestler DM us your concerns, will try our best to attend to it :)",en,Agilent Technologies
Fri Jul 21 10:00:40 +0000 2017,"Agilent opens a new Customer and Technology Center in Waldbronn, Germany 🇩🇪 https://t.co/uol2PoUe1p https://t.co/CXnfQfvcyG",en,Agilent Technologies
Thu Jul 20 14:36:18 +0000 2017,Agilent announces a revolutionary mass spectrometer. Get the details at https://t.co/nzb4GHME6F https://t.co/mfMJ8Hay8M,en,Agilent Technologies
Tue Jul 18 22:47:34 +0000 2017,Hans E. Bishop to Join Agilent's Board of Directors https://t.co/XgNDJOr9se,en,Agilent Technologies
Tue Jul 18 15:34:05 +0000 2017,Agilent Technologies Presents Thought Leader Award to Dr. Ram Sasisekharan https://t.co/id3mKTdAeq,en,Agilent Technologies
Tue Jul 18 14:34:41 +0000 2017,Agilent opens a new Customer and Technology Center in Germany. Read more at https://t.co/EuD2O4ddVe https://t.co/GqGIj9r3Ch,en,Agilent Technologies
Tue Jul 18 00:43:32 +0000 2017,RT @sutcliffeob: More #Spice sample testing by #MANDRAKE @MMUsste #harmreduction @Agilent @marie_earle @GMPCityCentre @MMUOutofit @ChiefIns…,en,Agilent Technologies
Mon Jul 17 15:47:34 +0000 2017,Agilent Technologies Introduces New High-Sensitivity NGS Target Enrichment Solution https://t.co/nBDGRSRitZ,en,Agilent Technologies
Sun Jul 16 12:08:17 +0000 2017,RT @MargaretBrisbin: Anyone else LOVE the smell of a fresh bioanalyzer chip? Is that normal? #gradschoolproblems #phdlife @Agilent #science…,en,Agilent Technologies
Thu Jul 13 14:35:35 +0000 2017,"How much is a kilogram? Sorry, that is incorrect…Read more at https://t.co/bJh41Zp8Nb https://t.co/doHfriwLnP",en,Agilent Technologies
Thu Jul 13 12:20:01 +0000 2017,RT @sutcliffeob: New @Agilent GC-MS instrument to enhance #MANDRAKE @MMUsste research &amp; drug testing/analysis capabilities for #harmreducti…,en,Agilent Technologies
Thu Jul 13 01:57:31 +0000 2017,RT @igemchalmers: Thx for the cool package 🔬 @Agilent https://t.co/DVbJkXhGkk,en,Agilent Technologies
Wed Jul 12 20:00:33 +0000 2017,"Agilent Technologies Opens New Customer &amp; Technology Center in Waldbronn, Germany https://t.co/MA8ug9lweF",en,Agilent Technologies
Tue Jul 11 14:33:05 +0000 2017,Wonder Women of Science: What two milestones for women happened this month? Find out at https://t.co/QSfcLX9U2Y https://t.co/f2vKb0JNYq,en,Agilent Technologies
Mon Jul 10 15:42:05 +0000 2017,Agilent Technologies Presents Early Career Professor Award to Dr. Gary Patti https://t.co/E0PiP5Ozln,en,Agilent Technologies
Fri Jul 07 12:54:05 +0000 2017,"Agilent Technologies Acquires Raman Spectroscopy Innovator, Cobalt Light Systems https://t.co/hwOnqn61ux",en,Agilent Technologies
Thu Jul 06 14:37:17 +0000 2017,A  ticking clock for the environment. Read more at https://t.co/tmDXcNWb9U https://t.co/53b0PVUcWA,en,Agilent Technologies
Tue Jul 04 14:52:33 +0000 2017,What the trees can tell us.  Read more at https://t.co/7jERFUtNuA https://t.co/Dwvt5JULqw,en,Agilent Technologies
Mon Jul 03 13:44:10 +0000 2017,RT @ChemistryWorld: Register to view our free on-demand webinar on emerging trends and technologies in forensic toxicology from @Agilent ht…,en,Agilent Technologies
Fri Jun 30 19:54:05 +0000 2017,"#Ultivo address issues found in analysis labs, yet is easy for the non-expert MS user to operate #MassSpectrometer https://t.co/TphzwbggQ5 https://t.co/WF1qAx8R3c",en,Agilent Technologies
Fri Jun 30 18:00:58 +0000 2017,"Pushing the boundaries of innovation. Check out our #Ultivo Triple Quad LC/MS, unveiled at #ASMS2017! https://t.co/fGa36AXzCd #massspec https://t.co/qR7jzbMyUO",en,Agilent Technologies
Fri Jun 30 14:34:35 +0000 2017,What are the safest ways to barbecue? Find out at https://t.co/MJe5xbDqTf https://t.co/Na1A2En8xG,en,Agilent Technologies
Thu Jun 29 12:56:05 +0000 2017,"Missed us at #ASMS2017? Click on the link for our presentations, posters, and our NEW product launches https://t.co/HLPkyyjJsi https://t.co/ym1xY1ep5Z",en,Agilent Technologies
Thu Jun 29 10:16:18 +0000 2017,RT @KrisLaukens: Aida on the big Brisbane conference stage to receive her @Agilent award at #metsoc2017. Well done! @biominaBE @UAntwerpMat…,en,Agilent Technologies
Thu Jun 29 07:42:15 +0000 2017,In need of something powerfully small yet remarkably powerful - Meet #Ultivo our innovation in #MassSpectrometer https://t.co/6a6IyBqkn2 https://t.co/gx2mcy5tBg,en,Agilent Technologies
Wed Jun 28 14:40:54 +0000 2017,"RT @StephenHabay: Hey @Agilent, look what we got today! New GC-FID w/ autosampler. Can't wait to get it fired up! #summerresearch https://t…",en,Agilent Technologies
Tue Jun 27 14:33:47 +0000 2017,Can french fries be fatal? Find out at https://t.co/sgprFCEuJk https://t.co/nInGSM8k4C,en,Agilent Technologies
Sun Jun 25 15:35:05 +0000 2017,Live Webinar: Want to know what all the excitement is about? Join the #Ultivo #MassSpec webinar on June 28 https://t.co/Vsc1jmqMsP https://t.co/GoIeR5zxC5,en,Agilent Technologies
Thu Jun 22 14:36:12 +0000 2017,A recent discovery about prostate cancer in african-american men. Read more at https://t.co/G3c0TyFWZa https://t.co/Z0rDWQHgoE,en,Agilent Technologies
Thu Jun 22 11:56:43 +0000 2017,Thank you for visiting us in #HPLC2017 #Prague 👋🏼. Next stop - #Korea for the next HPLC gathering! https://t.co/rKvf9nkz6p,en,Agilent Technologies
Thu Jun 22 07:47:54 +0000 2017,@Ferrumvita Thanks for the #shoutout! 👩‍🔬👨‍🔬,en,Agilent Technologies
Thu Jun 22 06:25:32 +0000 2017,Last day at #HPLC2017 #Prague 😱... have you stopped by booth P1 yet? https://t.co/xQoCgXFWCm,en,Agilent Technologies
Wed Jun 21 09:56:41 +0000 2017,Joining the #NationalSelfieDay 🤳🏼  Cheese 😁 from team Agilent in #HPLC2017 #Prague booth P1 https://t.co/IRxxmp977e,en,Agilent Technologies
Wed Jun 21 08:48:11 +0000 2017,Have you seen our Revolutionary Triple Quadrupole #MassSpectrometer? Hint .. it is small. Come by and check out the new #ultivo at #HPLC2017 https://t.co/nQdixc0Pw5,en,Agilent Technologies
Tue Jun 20 09:13:16 +0000 2017,OingOing... calling all LC experts at  #HPLC2017 #Prague 🙋. Give your LC knowledge a spin &amp; win the Agilent wheel of fortune at booth P1 https://t.co/D0n2bAT4vS,en,Agilent Technologies
Tue Jun 20 07:30:49 +0000 2017,Good Morning #HPLC2017. Have you've seen our brand NEW PURIFICATION TEAM? We are at booth P1 #WeLiveEfficiency https://t.co/c9VNN5OB4u,en,Agilent Technologies
Mon Jun 19 15:36:04 +0000 2017,Agilent Technologies Unveils New Analytical and Purification Solutions at HPLC 2017 https://t.co/IlnHRFPgoM,en,Agilent Technologies
Mon Jun 19 11:01:15 +0000 2017,Questions??? Ask our experts at #HPLC2017 #Prague. Sign up for a live software demo at booth P1. https://t.co/QldQJapRFn,en,Agilent Technologies
Mon Jun 19 08:10:06 +0000 2017,Spin &amp; Win at #HPLC2017 #Prague. Turn the Agilent Wheel of fortune &amp; be in running to win a speaker at booth P1 https://t.co/f5tYyq1uCl,en,Agilent Technologies
Mon Jun 19 07:00:20 +0000 2017,"Good Morning #Prague, we are happy to welcome you at our #HPLC2017 booth P1. Come say Hi!!!!!!!!!!!!!!!!!!! 🙋‍♂️🙋 https://t.co/PIKb6m03Lx",en,Agilent Technologies
Fri Jun 16 09:17:33 +0000 2017,Agilent Technologies Announces Expanded Use of Cancer Diagnostic in Europe https://t.co/GGdRqnxnbD,en,Agilent Technologies
Thu Jun 15 14:33:16 +0000 2017,The incredible story of vulcanized rubber. Read more at https://t.co/Lo1sljF0b8 https://t.co/SwOFcW8UTy,en,Agilent Technologies
Wed Jun 14 12:52:42 +0000 2017,RT @GASanalysis2017: Thank you @Agilent Technologies https://t.co/RJImFMUghJ,en,Agilent Technologies
Tue Jun 13 14:32:47 +0000 2017,Should you drink coffee while pregnant? Read more at https://t.co/tBqEeOBlF4 https://t.co/44Bdfdo1D0,en,Agilent Technologies
Sun Jun 11 23:25:34 +0000 2017,RT @ICAVS9: @Agilent getting set up for #ICAVS9! https://t.co/CUuf1Q7Fh5,en,Agilent Technologies
Fri Jun 09 10:02:31 +0000 2017,Video: Agilent CEO Announces Revolutionary Triple Quadrupole #MassSpectrometer https://t.co/eNuzUd41Uc https://t.co/qHHrWQCRaC,en,Agilent Technologies
Thu Jun 08 15:19:38 +0000 2017,Congrats Dr @Elisa_Carr . That's one fancy cake! 🎂 https://t.co/HRARxxD0DB,en,Agilent Technologies
Thu Jun 08 14:37:24 +0000 2017,When mummies speak. Read more at https://t.co/n5JM4ZmP2y https://t.co/2DLjWERfcP,en,Agilent Technologies
Thu Jun 08 11:05:04 +0000 2017,RT @tudorguy: Setting up Cr speciation on our new @Agilent HPLC system coupled to an 8900 https://t.co/t4CYJCuCKv,en,Agilent Technologies
Thu Jun 08 02:53:22 +0000 2017,cmx_pics's video at the Agilent #ASMS2017 photobooth https://t.co/sAbvpTLGZ1,en,Agilent Technologies
Thu Jun 08 02:44:19 +0000 2017,@pklork01 the results are in!!! #ASMS2017 thanks for voting 😊 https://t.co/ycDOjzQvyi,en,Agilent Technologies
Thu Jun 08 02:41:32 +0000 2017,"Thank you for voting in the Agilent #ASMS2017 suite! $25,000 will go to Alzheimer's research. Yay! 🎉 https://t.co/pdOTwvT7qj",en,Agilent Technologies
Thu Jun 08 00:06:35 +0000 2017,Do you put the PRO in PROtein? Come by the Agilent #ASMS2017 suite for your PRO shirt. 🙋🙋‍♂️ https://t.co/Uc4zJcPf16,en,Agilent Technologies
Wed Jun 07 23:24:47 +0000 2017,New trivia tonight at Agilent #ASMS2017 suite. Come by to win an Amazon Echo! https://t.co/EW0zjzT5VF,en,Agilent Technologies
Wed Jun 07 22:32:05 +0000 2017,"Stop by Agilent's Hospitality Suite at #ASMS2017 later, &amp; chill out at our glam photo booth https://t.co/Dlx9HvZ2xS",en,Agilent Technologies
Wed Jun 07 15:04:35 +0000 2017,Agilent Technologies Global Lab Manager Survey Reveals Key Insights https://t.co/L9quQ08Q01,en,Agilent Technologies
Wed Jun 07 12:59:41 +0000 2017,RT @PREMIERBiosoft: Visit @Agilent booth#600 &amp; hospitality suite to learn more about automated lipid #identification with SFC workflows usi…,en,Agilent Technologies
Wed Jun 07 04:09:27 +0000 2017,RT @VATVSLPR: Having a good time at hospitality suites #ASMS2017 https://t.co/cxeJRcnoTR,en,Agilent Technologies
Wed Jun 07 03:17:37 +0000 2017,@tayres805 Come to the booth @ #ASMS2107!!! 😄,en,Agilent Technologies
Wed Jun 07 02:55:35 +0000 2017,Here's a trivia for #asms2017 &amp; win an Apple TV? 🧐 https://t.co/HJFKZTspC8,en,Agilent Technologies
Wed Jun 07 00:47:37 +0000 2017,"Fun is what we have at the #ASMS2017 Agilent suite, join us! 🐯 https://t.co/HSp2ZqhUQ4",en,Agilent Technologies
Tue Jun 06 15:07:34 +0000 2017,Agilent Technologies Introduces New GC/Q-TOF System Enabling Greater Exploration of Unknown Chemical Samples https://t.co/Vm4RqKflSC,en,Agilent Technologies
Tue Jun 06 14:34:20 +0000 2017,"Seven decades after D-Day, Agilent looks at a lasting legacy of war.  Read more at https://t.co/cV0sshAofq https://t.co/f2NKyW0zfZ",en,Agilent Technologies
Tue Jun 06 14:25:06 +0000 2017,"#ASMS2017 Breakfast On Us! join us tomorrow at 7am - All about #gaschromatography
https://t.co/JyqUmlt8Xs #agilentintuvo https://t.co/6JAJjXKhU0",en,Agilent Technologies
Tue Jun 06 11:28:23 +0000 2017,Good morning #ASMS2017! Follow the 🦁tiger paw to Agilent breakfast meeting &amp; learn about our new Ultivo #MassSpec https://t.co/R6D7eYGi4q,en,Agilent Technologies
Tue Jun 06 04:32:52 +0000 2017,RT @playcirvin: @UHClearLake checking out Advanced Science Instrumentation Lab's #massspectrometer #UHCLSTEMCon2017 #sciencerocks https://t…,en,Agilent Technologies
Tue Jun 06 03:35:28 +0000 2017,Tomorrow!!! Breakfast ☕️🥪on us and learn all about our brand new Ultivo Triple Quadrupole LC/MS  #ASMS2017 #massspec https://t.co/vsfWb6Ke8B,en,Agilent Technologies
Tue Jun 06 01:13:28 +0000 2017,🐯at #ASMS2017 Visit Agilent's Hospitality Suite to get one! https://t.co/zI8y03MUM0,en,Agilent Technologies
Tue Jun 06 00:57:13 +0000 2017,"Introducing ... the brand new Agilent Triple Quadrupole #MassSpectrometer, Ultivo. All happening at #ASMS2017 #massspec 🥃🎉 https://t.co/PTfQAb6fs1",en,Agilent Technologies
Tue Jun 06 00:19:06 +0000 2017,RT @pklork01: Unveiling of the new @Agilent Ultivo triple quad #MassSpec system. They promise to keep performance while decreasing footprin…,en,Agilent Technologies
Mon Jun 05 21:04:33 +0000 2017,@pklork01 your vote counts! 💪🏼 #ASMS2017 https://t.co/KpBGDPYhwA,en,Agilent Technologies
Mon Jun 05 20:46:17 +0000 2017,👋🏼Come by Agilent #ASMS2017 suite tonight to vote for your favorite charity! https://t.co/akmNOXu8H9,en,Agilent Technologies
Mon Jun 05 17:49:04 +0000 2017,Agilent Technologies Announces Revolutionary Triple Quadrupole Mass Spectrometer https://t.co/627uCAzEEV,en,Agilent Technologies
Mon Jun 05 15:35:09 +0000 2017,"With ASCO well underway, take a look at 20 years of major advances in lung cancer diagnosis and treatment. Learn: https://t.co/WiyQBJ7rne",en,Agilent Technologies
Mon Jun 05 14:29:40 +0000 2017,@pklork01 I agree on the tacos portion 🌮,en,Agilent Technologies
Mon Jun 05 11:45:06 +0000 2017,"Missed today's #ASMS2017 Breakfast Session, join us tomorrow again at 7am https://t.co/R7nW07fdUp https://t.co/nQScMpQss7",en,Agilent Technologies
Mon Jun 05 11:41:30 +0000 2017,Good morning #ASMS2017! Great morning to talk protein over breakfast. 🍳 https://t.co/HzJWeewviy,en,Agilent Technologies
Mon Jun 05 02:01:18 +0000 2017,"⚡️ “Agilent @ #ASMS2017 ” 👩‍🔬👨‍🔬

https://t.co/t4FRKT7Mg4",et,Agilent Technologies
Mon Jun 05 00:53:49 +0000 2017,Coming up tomorrow #ASMS2017 Monday Breakfast Session 🥞: Put the pro in protein characterization. Join us! https://t.co/Gfx1hpvbgj https://t.co/tret9H4sPX,en,Agilent Technologies
Sun Jun 04 06:15:07 +0000 2017,metabolomics_lab's photo https://t.co/4JffcbdtzN,lt,Agilent Technologies
Sun Jun 04 01:02:59 +0000 2017,RT @pklork01: Very good and easy to follow talk by Gary Patti on stable isotope tracing. Great research and insightful examples. @Agilent #…,en,Agilent Technologies
Sat Jun 03 23:49:15 +0000 2017,RT @pklork01: @Agilent You're very welcome. I really like the quality of the talks. The event is great. Thank you!,en,Agilent Technologies
Sat Jun 03 23:30:24 +0000 2017,@pklork01 Thanks for coming to our event &amp; tweeting!!! Keep them coming!!!! 👩🏻‍🔬👨🏻‍🔬 #ASMS2017,en,Agilent Technologies
Sat Jun 03 23:10:53 +0000 2017,"RT @pklork01: Can I just say, kudos to @Agilent for choosing to donate $25K to charity instead of spending it on free, useless, giveaway cr…",en,Agilent Technologies
Sat Jun 03 23:10:13 +0000 2017,Thank you all for coming at the Agilent Innovation Symposium #ASMS2017 #standingroomonly 🎉 https://t.co/RNtj9z5p7x,en,Agilent Technologies
Sat Jun 03 22:11:00 +0000 2017,RT @pklork01: Love the GC Intuvo from @Agilent. Really nice update to a really well established technology. #ASMS2017,en,Agilent Technologies
Sat Jun 03 22:10:54 +0000 2017,RT @pklork01: At @Agilent Users' Meeting. Waiting for the keynote speaker presentation. #ASMS2017 https://t.co/IUvk5HQzDH,en,Agilent Technologies
Sat Jun 03 21:37:54 +0000 2017,Agilent Innovation Symposium at #ASMS2017 registration is open! Step right up!!! 😁 https://t.co/FqKmv7EikA,en,Agilent Technologies
Sat Jun 03 13:05:04 +0000 2017,#AgilentIntuvo #gaschromatograph &amp; oil-free #vacuumpumps are setting the green standard 🌱for #GCMS https://t.co/ANVYhti4pH https://t.co/TtlrH2QzUJ,en,Agilent Technologies
Fri Jun 02 15:06:34 +0000 2017,Agilent Technologies and Agendia Sign Agreement on Molecular Cancer Diagnostics https://t.co/Hd7cLrRdKb,en,Agilent Technologies
Fri Jun 02 14:35:47 +0000 2017,Celebrate the new era of #massspec Monday night 8PM in our #ASMS2017 suite. See you there! #MassSpectrometry https://t.co/29jSH7a35z https://t.co/aH1heNdbsr,en,Agilent Technologies
Fri Jun 02 01:19:09 +0000 2017,@Sulaiman_dk Join us this Sat night for our Innovation Symposium? maybe? #MassSpec #massspectrometry https://t.co/LuUcpG6LhL,en,Agilent Technologies
Fri Jun 02 01:18:46 +0000 2017,@katamandj Join us this Sat night for our Innovation Symposium? maybe? #MassSpec #massspectrometry https://t.co/LuUcpG6LhL,en,Agilent Technologies
Fri Jun 02 01:13:12 +0000 2017,@nrvinueza @PurdueChemistry Join us this Sat night for our Innovation Symposium? maybe? #MassSpec #massspectrometry https://t.co/LuUcpG6LhL,en,Agilent Technologies
