created_at,full_text,lang,user_name
Mon Feb 25 16:18:18 +0000 2013,Agilent Technologies Collaborating with Florida International University to Identify and Characterize Designer Drugs http://t.co/jARi7Lfeqx,en,Agilent Technologies
Mon Feb 25 16:18:17 +0000 2013,Agilent Technologies Introduces Wireless Communications Test Set with Integrated Multiport Adapter for... http://t.co/JMsxUOPLkz,en,Agilent Technologies
Thu Feb 21 17:19:49 +0000 2013,"Agilent and Sera Prognostics work together for fetal, maternal health. Read @ http://t.co/q7adsh3ziD.",en,Agilent Technologies
Thu Feb 21 17:18:07 +0000 2013,Agilent and Sera Prognostics have formed a strategic collaboration to develop proteomic assays for the early... http://t.co/H4D2DyYNRW,en,Agilent Technologies
Thu Feb 21 16:24:03 +0000 2013,Agilent Technologies Announces Host Adapter for MIPI Alliance DigRF v4 RFICs http://t.co/gQuMLqBUIl,en,Agilent Technologies
Thu Feb 21 16:24:02 +0000 2013,Agilent Technologies Introduces HaloPlex Exome Kits and SureCall Software http://t.co/oFk3IrjIEu,en,Agilent Technologies
Wed Feb 20 16:29:07 +0000 2013,Agilent Technologies and University of Washington Collaborate to Build High-Tech RF and Microwave Teaching Laboratory http://t.co/qf03WqVX,en,Agilent Technologies
Wed Feb 20 16:29:06 +0000 2013,Agilent Technologies Launches Genomic DNA ScreenTape http://t.co/iqsoXnPz,lt,Agilent Technologies
Wed Feb 20 16:29:05 +0000 2013,Agilent Technologies Introduces SureSelect Strand-Specific RNA Library Preparation Kit http://t.co/pKCgNo0b,en,Agilent Technologies
Wed Feb 20 16:29:04 +0000 2013,Agilent Technologies Announces Webcasts for Investment Community http://t.co/HfRbLNfD,en,Agilent Technologies
Wed Feb 20 16:29:03 +0000 2013,Agilent Technologies Launches Versatile Benchtop Boundary Scan Analyzer for Electronic Test http://t.co/lIIITwM5,en,Agilent Technologies
Wed Feb 20 16:29:02 +0000 2013,Agilent Technologies Introduces Expanded Mobile Measurement Portfolio for Multiple Field-Based Applications http://t.co/hYwJ4Jk9,en,Agilent Technologies
Wed Feb 20 12:43:58 +0000 2013,Learn how to achieve conformance to #NFC test standards in our FREE webcast http://t.co/TSoyazzL.,en,Agilent Technologies
Tue Feb 19 16:57:45 +0000 2013,"Agilent expands in the mobile measurement market, introducing analytical technologies designed for on-site field use .http://t.co/FhI4YfEe",en,Agilent Technologies
Tue Feb 19 16:54:10 +0000 2013,"Agilent expands its presence in the mobile measurement market, introducing analytical technologies designed for... http://t.co/zjXLkKBu",en,Agilent Technologies
Mon Feb 18 16:11:02 +0000 2013,Agilent Technologies Introduces Industry's First Universal Flash Storage Protocol-Decoding Software for Oscilloscopes http://t.co/ZgHCPREb,ro,Agilent Technologies
Fri Feb 15 16:12:32 +0000 2013,"Dako Receives FDA Approval for Fast, Accurate, Nontoxic FISH Assay for Cancer Diagnostics http://t.co/k0qvUzXb",en,Agilent Technologies
Thu Feb 14 21:17:01 +0000 2013,Agilent Technologies Reports First-Quarter 2013 Results http://t.co/yNEbiXrt,en,Agilent Technologies
Thu Feb 14 17:02:35 +0000 2013,Innovative! Agilent’s new conservation module provides customers relief from global helium shortage. Read at http://t.co/KsPUWnUm.,en,Agilent Technologies
Thu Feb 14 17:00:36 +0000 2013,Innovative! Agilent’s new conservation module provides customers relief from global helium shortage. Read more at... http://t.co/wiqGC74j,en,Agilent Technologies
Thu Feb 14 16:29:02 +0000 2013,Agilent Technologies' Newest SystemVue Software Release Accelerates MIMO Radar and Wireless/4G Design http://t.co/ziD17x0E,ro,Agilent Technologies
Thu Feb 14 16:29:02 +0000 2013,Agilent Technologies Introduces Industry's Most Comprehensive Compliance Testing for Energy-Efficient Ethernet... http://t.co/Pu8Lc76B,en,Agilent Technologies
Tue Feb 12 17:02:18 +0000 2013,"Dako, part of Agilent, has entered into a collaboration agreement with Pfizer in the field of companion diagnostics. http://t.co/xhFZPfnM.",en,Agilent Technologies
Tue Feb 12 17:00:26 +0000 2013,"Dako, part of Agilent, has entered into a collaboration agreement with Pfizer in the field of companion... http://t.co/t6rfTzC1",en,Agilent Technologies
Tue Feb 12 16:19:31 +0000 2013,Dako to Collaborate with Pfizer on Companion Diagnostics http://t.co/Y2IIREwX,en,Agilent Technologies
Tue Feb 12 16:19:31 +0000 2013,Agilent Technologies and Sera Prognostics Enter Strategic Partnership to Develop Proteomic Assays for Fetal and... http://t.co/GVXnbdda,en,Agilent Technologies
Mon Feb 11 18:08:58 +0000 2013,"Agilent Technologies and Ameritox Form Collaboration, Aim to Advance Analysis of Medication Monitoring http://t.co/R1EThgmu",en,Agilent Technologies
Mon Feb 11 18:09:02 +0000 2013,Agilent Technologies to Demonstrate Innovative 4G Test Solutions at Mobile World Congress http://t.co/zD1kHL5l,en,Agilent Technologies
Fri Feb 08 18:39:16 +0000 2013,Agilent announces industry's highest-performance real-time spectrum analyzers. Read more at http://t.co/SVU9VVLi. http://t.co/A58KQU9U,en,Agilent Technologies
Fri Feb 08 16:15:32 +0000 2013,Agilent Technologies Announces Industry's Highest-Performance Real-Time Spectrum Analyzers http://t.co/qQJbtanm,en,Agilent Technologies
Wed Feb 06 16:11:36 +0000 2013,Agilent’s new designer drug testing application is the only resource of its kind. Read more at http://t.co/LpTxeWUr.,en,Agilent Technologies
Wed Feb 06 16:07:54 +0000 2013,Innovative new resource! Agilent’s new designer drug testing application is the only resource of its kind. Read... http://t.co/2WYbBYpd,en,Agilent Technologies
Tue Feb 05 08:14:03 +0000 2013,"Agilent Technologies Introduces Updated Designer Drug and Oral Fluid Compendiums, Plus Expanded Drug Compound... http://t.co/nSjvNzvk",en,Agilent Technologies
Tue Feb 05 08:14:02 +0000 2013,Agilent Technologies Expands Compatibility and Capabilities of Atomic Force Microscope for Nanoscale Life Science... http://t.co/Ap2zq6uO,en,Agilent Technologies
Tue Feb 05 08:14:02 +0000 2013,Agilent Technologies Commits $90 Million Gift of Software to Georgia Institute of Technologies http://t.co/qSGa5r3a,en,Agilent Technologies
Mon Feb 04 16:27:05 +0000 2013,We LIKE this! Agilent makes milestone software donation to Georgia Institute of Technology that includes Agilent... http://t.co/KX8r8IAi,en,Agilent Technologies
Mon Feb 04 14:03:08 +0000 2013,Agilent Technologies Introduces Next-Generation Gas Chromatograph and GC/MSD Series publishing http://t.co/cULEOGXq,en,Agilent Technologies
Mon Feb 04 14:03:07 +0000 2013,Agilent Technologies to Demonstrate New Solutions Enabling Tests from Prototype Validation to Inline High-Volume... http://t.co/zSjELsmP,en,Agilent Technologies
Mon Feb 04 14:03:06 +0000 2013,Agilent Technologies to Host Webcast of First-Quarter Fiscal 2013 Financial Results Conference Call http://t.co/7Xx9IPPt,en,Agilent Technologies
Mon Feb 04 14:03:05 +0000 2013,Agilent Technologies and SiSoft Introduce Pre-Standard IBIS-AMI Modeling Guide http://t.co/sCBAjZPN,en,Agilent Technologies
Mon Feb 04 14:03:04 +0000 2013,Agilent Technologies and Alcatel-Lucent Bell Labs Collaborate to Demonstrate Record-Breaking Optical Signaling http://t.co/TRAD94X2,en,Agilent Technologies
Mon Feb 04 14:03:04 +0000 2013,Agilent Technologies Introduces Industry's Lowest-Priced USB 2.0 Signal-Quality Test Option http://t.co/7t4Ohymw,en,Agilent Technologies
Mon Feb 04 14:03:03 +0000 2013,Agilent Technologies Introduces Enhanced Solution for PCI Express(r) 3.0 Receiver Characterization http://t.co/5DCqy0Z9,en,Agilent Technologies
Mon Feb 04 14:03:03 +0000 2013,Agilent Technologies Introduces Industry's Highest Performance Mixed Signal Oscilloscope http://t.co/UIybrNnz,en,Agilent Technologies
Mon Feb 04 14:03:02 +0000 2013,Agilent Technologies Unveils Single-Box Arbitrary Waveform Generator Support for HDMI and MHL Sink Tests http://t.co/3teA8cHJ,en,Agilent Technologies
Mon Feb 04 14:03:02 +0000 2013,Agilent Technologies to Showcase Bit Error Ratio Tester at DesignCon http://t.co/hoMNwUA9,en,Agilent Technologies
Mon Feb 04 14:02:37 +0000 2013,Agilent Technologies Introduces User-Friendly Chromatography and Spectroscopy Catalog http://t.co/5VNMuVzr,en,Agilent Technologies
Mon Feb 04 14:02:37 +0000 2013,Agilent Technologies Introduces World's Fastest USB Thermocouple Power Sensors with Best Linearity and Accuracy http://t.co/73n1DnOT,en,Agilent Technologies
Mon Feb 04 14:02:36 +0000 2013,Agilent Technologies Announces Third NanoMeasure Scientific Symposium http://t.co/2alfBvla,en,Agilent Technologies
Mon Feb 04 14:02:35 +0000 2013,Agilent Technologies Introduces Benchtop Digital Multimeter Designed to Turbocharge Electronic Test and Measurement... http://t.co/Hibw2GKX,en,Agilent Technologies
Mon Feb 04 14:02:35 +0000 2013,Backgrounder - Sports Doping - The Inescapable Truth http://t.co/fxcG2lT6,en,Agilent Technologies
Mon Feb 04 14:02:34 +0000 2013,Agilent Technologies Authorizes New Share Repurchase Program and Increases Quarterly Dividend http://t.co/EcwQmxXO,en,Agilent Technologies
Mon Feb 04 14:02:34 +0000 2013,Agilent Technologies to Demonstrate Newest High-Speed Digital Design and Test Solutions at DesignCon http://t.co/Ljf5yqej,en,Agilent Technologies
Mon Feb 04 14:02:33 +0000 2013,"Agilent Technologies Introduces Dissolution Exchange, a Web-based Resource for the Pharma Industry http://t.co/bhYliMdi",en,Agilent Technologies
Mon Feb 04 14:02:33 +0000 2013,Agilent Technologies Introduces Only Secure Central Data Storage and Operations Management Solution Tailored to... http://t.co/7Ihl9BZw,en,Agilent Technologies
Mon Feb 04 14:02:32 +0000 2013,Dako Enters Collaboration with Eli Lilly and Company for Development of Companion Diagnostics http://t.co/IcRfYCPT,en,Agilent Technologies
Fri Feb 01 15:38:51 +0000 2013,Truly innovative! Agilent named to Booz and Co.’s 2012 Innovators List. Read@ http://t.co/f91xIl65. http://t.co/dzE5U6LF,en,Agilent Technologies
Fri Feb 01 15:32:44 +0000 2013,Truly innovative! Agilent named to Booz and Co.’s 2012 Innovators List. Read more @ http://t.co/lghecun1. http://t.co/22RQBBnp,en,Agilent Technologies
Thu Jan 31 22:40:36 +0000 2013,Agilent  to host webcast of first-quarter fiscal 2013 financial results conference call. Read more @ http://t.co/ekZjFkRj.,en,Agilent Technologies
Wed Jan 30 21:29:36 +0000 2013,Agilent wins big in Test &amp; Measurement World’s annual “Best of Test” awards. Read @ http://t.co/sEAEt8Jj..,en,Agilent Technologies
Wed Jan 30 21:26:05 +0000 2013,Award winning products! Agilent wins big in Test &amp; Measurement World’s annual “Best of Test” awards. Read more @... http://t.co/bznw60ap,en,Agilent Technologies
Tue Jan 29 17:42:12 +0000 2013,Agilent and Alcatel-Lucent Bell Labs Collaborate to Demonstrate Record-Breaking Optical Signaling. Read @ http://t.co/3T8dztz5.,en,Agilent Technologies
Mon Jan 28 18:59:50 +0000 2013,"Agilent Technologies Introduces Industry's Highest Performance Mixed Signal Oscilloscope, Read more at http://t.co/tE3PG9ND..",en,Agilent Technologies
Fri Jan 25 15:42:09 +0000 2013,Great Innovation! Agilent plays key role in data storage breakthrough. Read more at  http://t.co/B6wozBo3.. http://t.co/040oeh4f,en,Agilent Technologies
Fri Jan 25 15:41:34 +0000 2013,Great Innovation! Agilent plays key role in data storage breakthrough; DNA could become the high-density storage... http://t.co/RZS0NsVL,en,Agilent Technologies
Thu Jan 24 20:59:52 +0000 2013,Agilent Technologies to Showcase Bit Error Ratio Tester at DesignCon. Read more at http://t.co/rb7jJR8V.,en,Agilent Technologies
Thu Jan 24 18:59:52 +0000 2013,Agilent Unveils Single-Box Arbitrary Waveform Generator Support for HDMI and MHL Sink Tests. Read more at   http://t.co/dzT0KV3u,en,Agilent Technologies
Thu Jan 24 17:25:55 +0000 2013,Agilent  Introduces User-Friendly Chromatography and Spectroscopy Catalog. Read @ http://t.co/IctIL7Qt.,en,Agilent Technologies
Wed Jan 23 20:59:53 +0000 2013,Agilent Technologies announces Third NanoMeasure Scientific Symposium/ For more information http://t.co/1Q7WONNW.,en,Agilent Technologies
Wed Jan 23 18:35:53 +0000 2013,Great recognition!  Agilent ranks among Global 100 Most Sustainable Corporations in the World. Read more at... http://t.co/jrCjG6ZC,en,Agilent Technologies
Wed Jan 23 17:59:53 +0000 2013,Agilent Introduces World's Fastest USB Thermocouple Power Sensors with Best Linearity and Accuracy. Read more at http://t.co/QqxJAZKI.,en,Agilent Technologies
Wed Jan 23 17:12:55 +0000 2013,Agilent  Introduces Benchtop Digital Multimeter  to Turbocharge Electronic Test and Measurement Applications. Read @ http://t.co/nB6BWgLw.,en,Agilent Technologies
Thu Jan 17 15:44:19 +0000 2013,"Dako, an Agilent company, enters collaboration with Eli Lilly and Company to develop companion diagnostics for... http://t.co/PZeItvIk",en,Agilent Technologies
Wed Jan 16 17:15:37 +0000 2013,Thanks to our employees for making Agilent a great place to work! http://t.co/eM83C33r,en,Agilent Technologies
Wed Jan 16 16:26:12 +0000 2013,Involved in #LTE ecosystem development? Join @Agilent at the free Wireless Symposium - UK &amp; Finland. http://t.co/TnlE7UDQ #mobile,en,Agilent Technologies
Wed Jan 09 17:44:39 +0000 2013,Out of this world! Agilent equipment is being used to test soil and air for life on Mars. For information on how... http://t.co/pzIkCvIO,en,Agilent Technologies
Thu Jan 03 18:36:48 +0000 2013,A great start to the new year! Agilent affirms its technology leadership with the introduction of the industry's... http://t.co/oSwnpU5p,en,Agilent Technologies
Wed Dec 19 16:28:42 +0000 2012,Season’s Greetings from our family to yours! http://t.co/zreZnbi2,en,Agilent Technologies
Wed Dec 12 22:30:56 +0000 2012,People love working at Agilent and here's the proof! Thanks to all  our fantastic employees for creating a... http://t.co/UNGop613,en,Agilent Technologies
Tue Dec 11 22:17:48 +0000 2012,"Don’t forget to register for Agilent live webcast on radar pulse measurements THURS, Dec 13 at 10 am CET. Sign up now http://t.co/0NgeOpri.",en,Agilent Technologies
Mon Dec 10 20:35:08 +0000 2012,Don’t forget to register for our free live #webcast on #Calibration TOMORROW at 16:00 CET. Sign up now at http://t.co/2W8k56a2.,en,Agilent Technologies
Mon Dec 10 17:06:36 +0000 2012,Agilent microarrays were used in groundbreaking prenatal research study published in New England Journal of... http://t.co/Stmm35If,en,Agilent Technologies
Thu Dec 06 19:46:32 +0000 2012,"Agilent Technologies Announces New Version of Intelligent System Emulation Technology, Emulating Waters Alliance LC... http://t.co/BvJ3flNR",en,Agilent Technologies
Wed Dec 05 16:13:17 +0000 2012,"Agilent Technologies Ships New ADS Software to Further Advance Single-, Multi-Technology Design of RF Power Amplifiers http://t.co/Ktdbioyx",en,Agilent Technologies
Tue Dec 04 16:15:02 +0000 2012,WiCell Teams with Agilent Technologies to Offer High-Resolution CGH+SNP Microarray Service http://t.co/MDN3Y1cm,en,Agilent Technologies
Mon Dec 03 16:13:03 +0000 2012,Agilent Technologies Announces New Webcast on Calibration Service for Test and Measurement Equipment http://t.co/fUGxxCS3,en,Agilent Technologies
Fri Nov 30 17:42:01 +0000 2012,Agilent Technologies Introduces Basic Spectrum Analyzer for Budget-Driven Applications http://t.co/Yiz5Vh3h,en,Agilent Technologies
Fri Nov 30 16:31:02 +0000 2012,Agilent Technologies Adds Wireless Connectivity to Clamp Meters http://t.co/cQPVukKp,en,Agilent Technologies
Wed Nov 28 17:16:43 +0000 2012,Agilent test equipment is out of this world! For more information about Agilent test equipment optimized for... http://t.co/6ymROL0r,en,Agilent Technologies
Wed Nov 28 17:13:08 +0000 2012,"Agilent webcast: Calibration Traceability and Standards Compliance, Dec 13 http://t.co/Zf7iXOuQ.",en,Agilent Technologies
Wed Nov 28 16:45:18 +0000 2012,Agilent Technologies Introduces MIPI(TM) UniPro and LLI Protocol Decoders for Infiniium Oscilloscopes http://t.co/Jyicc2yJ,ca,Agilent Technologies
Wed Nov 28 16:45:17 +0000 2012,Agilent Technologies Extends High-Performance Noise-Figure Measurement Technique to 50 GHz http://t.co/tDco1Hjk,ro,Agilent Technologies
Tue Nov 27 16:07:32 +0000 2012,"Agilent Technologies Opens PicoCafé, a Unique Online Forum for Atomic Force Microscope Users http://t.co/axOhccKv",en,Agilent Technologies
Thu Nov 22 02:15:02 +0000 2012,Agilent Technologies to Present at Credit Suisse Technology Conference http://t.co/Y80LDOdj,en,Agilent Technologies
Tue Nov 20 22:15:01 +0000 2012,Agilent Technologies Recognized by Frost &amp; Sullivan for Outstanding Customer Service in Brazil http://t.co/hifaPyzd,en,Agilent Technologies
Tue Nov 20 15:34:45 +0000 2012,Turkey with a side of antibiotics? Agilent QuEChERS tests the safety of food before it’s served at your table.... http://t.co/sxWYpoaD,en,Agilent Technologies
Tue Nov 20 15:33:02 +0000 2012,"Agilent Technologies Opens New X-ray Diffraction Manufacturing Facility in Wroclaw, Poland http://t.co/3KjXlAX1",en,Agilent Technologies
Mon Nov 19 23:08:37 +0000 2012,Great end to the fiscal year. We like this! http://t.co/cumKwVKS,en,Agilent Technologies
Mon Nov 19 21:10:32 +0000 2012,Agilent Technologies Reports Fourth-Quarter 2012 Results http://t.co/G5z0uhM4,ca,Agilent Technologies
Mon Nov 19 16:31:20 +0000 2012,Don’t forget to register for our free #webcast on Transponder test set validation TOMORROW at 10:00 CET. Sign up now http://t.co/TTMrJNSx.,en,Agilent Technologies
Sat Nov 17 00:33:03 +0000 2012,Agilent Technologies Announces Cash Dividend of 10 Cents per Share http://t.co/PHecJJUC,en,Agilent Technologies
Fri Nov 16 16:32:03 +0000 2012,Agilent Technologies to Present at Conference on Wireless Connectivity in Medical Devices http://t.co/yhXwaMNd,en,Agilent Technologies
Fri Nov 16 16:32:02 +0000 2012,Agilent Technologies Ships Newest GoldenGate Software Release for RFIC Designers http://t.co/Qu76Vvpq,ro,Agilent Technologies
Thu Nov 15 16:15:31 +0000 2012,Agilent Technologies Ships Newest EMPro Software Release for Analyzing 3-D Electromagnetic Effects http://t.co/lF68jJfg,en,Agilent Technologies
Wed Nov 14 21:50:02 +0000 2012,Agilent Technologies Appoints Ron Nersesian President and Chief Operating Officer http://t.co/IfF2jIZB,en,Agilent Technologies
Wed Nov 14 16:28:02 +0000 2012,Agilent Technologies and Notre Dame Team Up http://t.co/afgdoyq4,en,Agilent Technologies
Wed Nov 14 16:11:02 +0000 2012,Agilent Technologies and Notre Dame Team Up http://t.co/yINhod4Z,en,Agilent Technologies
Tue Nov 13 16:57:22 +0000 2012,Agilent redefines the oscilloscope experience with the InfiniiVision 4000 X-Series which establishes unprecedented... http://t.co/3SWZuz1f,en,Agilent Technologies
Tue Nov 13 16:04:32 +0000 2012,Agilent Technologies Redefines the Oscilloscope Experience with the InfiniiVision 4000 X-Series http://t.co/wzR2sy73,en,Agilent Technologies
Mon Nov 12 16:11:02 +0000 2012,Agilent Technologies Introduces High-Precision PXI Frequency Reference Module for Electronic Measurements http://t.co/INlBcKyR,en,Agilent Technologies
Mon Nov 12 16:11:01 +0000 2012,Agilent Technologies Introduces Highly Sensitive Evaporative Light-Scattering Detectors http://t.co/P7jf2jda,en,Agilent Technologies
Thu Nov 08 20:04:01 +0000 2012,Agilent Technologies Introduces SureSelect Human All-Exon UTRs for Next-Generation Sequencing http://t.co/mRpdHOIx,en,Agilent Technologies
Wed Nov 07 16:13:18 +0000 2012,Agilent Technologies and Roche Establish Agreement to Provide Continued Service and Support to Roche NimbleGen... http://t.co/2kfod8qs,en,Agilent Technologies
Wed Nov 07 16:13:17 +0000 2012,Agilent Technologies Announces Expansion of Hermon Labs' Acoustic Wireless Handset Conformance Test Solution http://t.co/tnAfR1hy,en,Agilent Technologies
Tue Nov 06 18:05:04 +0000 2012,"Agilent continues to partner with great schools, we LIKE this! http://t.co/A2bVsv76",en,Agilent Technologies
Tue Nov 06 16:21:01 +0000 2012,Agilent Technologies and Bangor University Celebrate £2 Million Investment in Teaching Lab for Electronic Engineering http://t.co/QrWvEK7q,en,Agilent Technologies
Tue Nov 06 16:15:54 +0000 2012,"Learn how interrogation pulses to/from transponders can be measured accurately; #Agilent #webcast, Nov 20 10 am CET http://t.co/tZpvHoY2.",en,Agilent Technologies
Mon Nov 05 17:43:02 +0000 2012,Agilent Technologies to Host Webcast of Fourth-Quarter Fiscal 2012 Financial Results Conference Call http://t.co/0i7ghVqR,en,Agilent Technologies
Mon Nov 05 17:43:02 +0000 2012,Agilent Technologies Introduces Electrical Redriver Modeling Solution to Solve Key Challenges in Designing... http://t.co/aqbt0KUH,en,Agilent Technologies
Thu Nov 01 21:35:25 +0000 2012,"Agilent introduces the game-changing Encore Multispan Liquid Handling System, featuring an array of unique... http://t.co/j2vfPtFw",en,Agilent Technologies
Thu Nov 01 21:32:36 +0000 2012,"Agilent introduces the game-changing Encore Multispan Liquid Handling System, featuring an array of unique... http://t.co/zJ6i5tYr",en,Agilent Technologies
Thu Nov 01 15:20:04 +0000 2012,Agilent Technologies Introduces Game-Changing Solution for Advanced Liquid Handling and Sample-Preparation Automation http://t.co/sT2oaCvb,en,Agilent Technologies
Thu Nov 01 15:20:03 +0000 2012,Agilent Technologies Releases New Software for X-Series Signal Analyzers http://t.co/JyZzVJFA,en,Agilent Technologies
Thu Nov 01 15:20:02 +0000 2012,Agilent Technologies Announces Precision Low-Noise Power Source for Electronics Industry and Research http://t.co/b46qkTjz,en,Agilent Technologies
Thu Nov 01 15:20:01 +0000 2012,Agilent Technologies to Display Test Innovations at Electronica http://t.co/oAhd99ya,en,Agilent Technologies
Tue Oct 30 15:13:33 +0000 2012,"Agilent Technologies and Spain's Centre for Omic Sciences to Collaborate on Integrated Systems Biology Research,... http://t.co/kIvgoBoe",en,Agilent Technologies
Mon Oct 29 22:07:50 +0000 2012,"Agilent continues to get young minds excited about bio-science, engineering, technology, nature and other... http://t.co/b7hsZdlB",en,Agilent Technologies
Mon Oct 29 15:24:03 +0000 2012,Agilent Technologies and Association of Laboratory Managers Honor Geoffrey Kamau with 2012 Distinguished Service Award http://t.co/dZdHJcfq,en,Agilent Technologies
Mon Oct 29 15:24:02 +0000 2012,Agilent Technologies and the University of Leeds Open Terahertz Measurement Research Lab http://t.co/TxngXLwl,en,Agilent Technologies
Mon Oct 29 15:24:01 +0000 2012,Agilent Technologies Expands Capabilities of Handheld Spectrum Analyzers for Enhanced In-Field Use http://t.co/qnAJ4lf6,en,Agilent Technologies
Fri Oct 26 15:17:32 +0000 2012,Agilent Technologies' and PREMIER Biosoft's Platforms Work Together to Advance Lipidomics Research http://t.co/0iYscAV1,en,Agilent Technologies
Wed Oct 24 16:51:00 +0000 2012,"Agilent helps life-science labs optimize, automate and streamline procedures to increase speed-to-results. Learn... http://t.co/d92PVYq6",en,Agilent Technologies
Wed Oct 24 15:21:33 +0000 2012,Agilent Technologies Announces Webcast Series on Calibration Service http://t.co/JMRgNb4S,en,Agilent Technologies
Tue Oct 23 15:47:02 +0000 2012,Agilent Technologies to Demonstrate Next-Generation Test and Measurement Solutions at MILCOM http://t.co/93y9Lkn2,en,Agilent Technologies
Tue Oct 23 15:47:02 +0000 2012,Agilent Technologies to Demonstrate Newest 3-D EM Software Release at European Microwave Week http://t.co/7nAQ9m1s,en,Agilent Technologies
Mon Oct 22 21:05:44 +0000 2012,"Learn the key concepts of relevant calibration standards in a series of free webcasts, starting November. Sign up now http://t.co/HR9UAxXx.",en,Agilent Technologies
Mon Oct 22 15:31:03 +0000 2012,Agilent Technologies Launches myAgilent Personalized Web Portal for Electronic Measurement http://t.co/gBmhdwnz,en,Agilent Technologies
Mon Oct 22 15:31:02 +0000 2012,Agilent Technologies to Demonstrate High-Speed Digital Design Solutions at EPEPS http://t.co/4O6thO2q,en,Agilent Technologies
Wed Oct 17 15:24:03 +0000 2012,Agilent Technologies Awards 2012 Russell Varian Prize for Innovation in Nuclear Magnetic Resonance to Ray Freeman... http://t.co/vE86ZQec,en,Agilent Technologies
Wed Oct 17 15:24:02 +0000 2012,Agilent Technologies Adds Low-Cost Signal Analyzer Frequency Options for Essential Characterization up to 26.5 GHz http://t.co/ot2Dlai1,en,Agilent Technologies
Wed Oct 17 15:24:02 +0000 2012,Agilent Technologies to Demonstrate Newest Microwave and RF Design and Test Solutions at European Microwave Week http://t.co/8b88jbop,en,Agilent Technologies
Mon Oct 15 15:00:36 +0000 2012,Agilent Technologies to Demonstrate LTE and WLAN Test and Measurement Solutions at 4G World http://t.co/auZUV2QR,en,Agilent Technologies
Thu Oct 11 15:32:18 +0000 2012,Agilent Technologies and University of Houston to Advance Petroleum Research http://t.co/LANmowur,en,Agilent Technologies
Wed Oct 10 15:25:17 +0000 2012,Agilent Technologies Continues to Enhance Connectivity Software for Electronic Test Instruments http://t.co/979xtkPx,ca,Agilent Technologies
Wed Oct 10 15:25:17 +0000 2012,Agilent Technologies to Demonstrate Automotive Functional Test System at Expo http://t.co/JOaRCsUh,en,Agilent Technologies
Mon Oct 08 16:42:54 +0000 2012,We already knew this ... here's the proof! http://t.co/x1KdjiAz,en,Agilent Technologies
Mon Oct 08 15:03:31 +0000 2012,"Agilent Technologies Introduces SureDesign, Simplifying the Creation of Custom SureSelect/HaloPlex DNA Sequencing... http://t.co/flZZn0vV",en,Agilent Technologies
Fri Oct 05 14:16:10 +0000 2012,"With winter just around the corner, Agilent introduces handheld digital multimeter designed for extreme winter... http://t.co/oWHQrqGJ",en,Agilent Technologies
Wed Oct 03 15:32:06 +0000 2012,Agilent Technologies Unveils ADS 2012 Software http://t.co/7sWE3ETY,en,Agilent Technologies
