created_at,full_text,lang,user_name
Wed Feb 17 18:05:04 +0000 2016,Agilent Technologies Scientist Wins Young Investigator Award https://t.co/jr6XoKaGWU,en,Agilent Technologies
Tue Feb 16 21:10:06 +0000 2016,Agilent Technologies Reports First-Quarter 2016 Results https://t.co/kY1aAK9BXU,en,Agilent Technologies
Tue Feb 16 15:53:16 +0000 2016,Agilent and the science of art conservation. Read more at https://t.co/LoGZQpXxxv https://t.co/4CACY9ypOE,en,Agilent Technologies
Thu Feb 11 16:24:05 +0000 2016,Agilent Technologies and 10x Genomics Announce Collaboration to Develop a Premium Exome https://t.co/Pc2sWO56JQ,en,Agilent Technologies
Thu Feb 11 16:24:04 +0000 2016,Agilent Technologies Announces Early Access to Custom guideRNA for Functional Genomics https://t.co/Jf5jeETRE2,en,Agilent Technologies
Thu Feb 11 15:47:58 +0000 2016,The state of worldwide obesity. Read more at https://t.co/hGg2ZC9YWM https://t.co/zM5YCAyUj9,en,Agilent Technologies
Wed Feb 10 16:11:01 +0000 2016,@murathc Can you private message your contact information so that we can contact you directly?,en,Agilent Technologies
Wed Feb 10 16:09:59 +0000 2016,@4130chromo @RECrossland Great set-up!,en,Agilent Technologies
Tue Feb 09 15:42:53 +0000 2016,The devastating effect of sports-related brain injury. Read more at https://t.co/Oqs0DEGH4H https://t.co/qTNR5126gJ,en,Agilent Technologies
Thu Feb 04 15:37:49 +0000 2016,Accolades for an Agilent employee. Read more at https://t.co/Mx9TCR2Rkv https://t.co/gmz17lJGDY,en,Agilent Technologies
Tue Feb 02 15:43:50 +0000 2016,An Agilent complementary diagnostics test is approved for melanoma. Get the details at https://t.co/jwe69ixd1S https://t.co/U7rSQ5ESTD,en,Agilent Technologies
Mon Feb 01 18:35:31 +0000 2016,Sample reliability and data analysis: How to overcome the challenge. Read at https://t.co/SzxX7foedL,en,Agilent Technologies
Thu Jan 28 15:12:07 +0000 2016,Agilent Lauded for its Leadership in Sustainability.  Read about it at https://t.co/XEXtUwEzDa https://t.co/EoNzktovTE,en,Agilent Technologies
Wed Jan 27 16:30:05 +0000 2016,Agilent Technologies Wins Award for Innovation in Liquid Chromatography https://t.co/pnhSC1d2c8,en,Agilent Technologies
Tue Jan 26 21:12:44 +0000 2016,Agilent Technologies to Host Webcast of First-Quarter Fiscal Year 2016 Financial Results Conference Call https://t.co/XQpRVRl0Pw,en,Agilent Technologies
Tue Jan 26 15:50:04 +0000 2016,Agilent Technologies Showcases New Solutions at Biopharmaceutical Symposium https://t.co/Zert4wuDAG,en,Agilent Technologies
Tue Jan 26 15:33:53 +0000 2016,What is your risk of lead poisoning?  Find out at https://t.co/qeUo9jYMjH https://t.co/vSPk8C9QIU,en,Agilent Technologies
Mon Jan 25 14:27:03 +0000 2016,"Dako, an Agilent Technologies Company, Announces Expanded FDA Approval of Complementary Diagnostic Test to Include… https://t.co/blrANMiIPn",en,Agilent Technologies
Thu Jan 21 15:38:19 +0000 2016,A new mosquito-borne virus warning. Get the details at https://t.co/wMDb5ln7Tp https://t.co/Vm2Td0qcxv,en,Agilent Technologies
Tue Jan 19 16:16:04 +0000 2016,Agilent Technologies Extends Agreement with PerkinElmer on Bioanalyzer Chips https://t.co/O6ZfkHvH1f,en,Agilent Technologies
Tue Jan 19 16:06:45 +0000 2016,What is the best jelly flavor to go with peanut butter? Read more at https://t.co/dp7FlzAivM https://t.co/SaQTVqPl3i,en,Agilent Technologies
Thu Jan 14 15:51:05 +0000 2016,Giant viruses are thawing out in the Arctic. Read more at https://t.co/rfov2CWdyN https://t.co/1L1mWGez4Y,en,Agilent Technologies
Wed Jan 13 22:44:13 +0000 2016,"@jeff_stubbs Yes, we can do that! Thanks and great work!",en,Agilent Technologies
Tue Jan 12 18:02:55 +0000 2016,"@jeff_stubbs Jeff, we would love to use one of your images of our products in lego form for our internal newsletter. Can we?",en,Agilent Technologies
Tue Jan 12 15:38:54 +0000 2016,Scientists link depression and brain inflammation. Read more at https://t.co/YkpuZizKYI https://t.co/8YvIfzuexZ,en,Agilent Technologies
Mon Jan 11 16:28:33 +0000 2016,Seahorse Bioscience XF Technology Reaches 500th Citation in Cancer Research https://t.co/Ig7wDrZomP,en,Agilent Technologies
Thu Jan 07 15:41:34 +0000 2016,How Agilent and forensic DNA helped solve a murder. Read more at https://t.co/3g6YvCxMPu https://t.co/MpiEouiEvN,en,Agilent Technologies
Wed Jan 06 22:17:03 +0000 2016,"Agilent Technologies Names Michael Tang Senior Vice President, General Counsel and Secretary https://t.co/f8q5P1uqrj",en,Agilent Technologies
Tue Jan 05 20:03:03 +0000 2016,Agilent Technologies to Present at 34th Annual J.P. Morgan Healthcare Conference https://t.co/AhIKZOM2B1,en,Agilent Technologies
Tue Jan 05 15:47:32 +0000 2016,How do you cure a hangover? Read more at https://t.co/HNze9UTI7r https://t.co/9PjXtqwJji,en,Agilent Technologies
Thu Dec 17 15:36:10 +0000 2015,A Gift for You: the Agilent 2016 Calendar! Download it now at https://t.co/KtYmzMXttc https://t.co/D7aRHIj89N,en,Agilent Technologies
Wed Dec 16 16:41:43 +0000 2015,@Interchim_ Thanks!,en,Agilent Technologies
Tue Dec 15 15:58:37 +0000 2015,Agilent celebrates 30 years of chemistries and supplies. Read more at https://t.co/iBl3ozLfD2 https://t.co/Dpt6Ck3iOn,en,Agilent Technologies
Thu Dec 10 15:50:07 +0000 2015,"Agilent's Seahorse receives a 2015 ""Top 10"" Innovation Award! Read more @ https://t.co/S7ErxET4T6 https://t.co/LKYYiAyBgJ",en,Agilent Technologies
Wed Dec 09 16:21:03 +0000 2015,Agilent Technologies Presents Thought Leader Award to Human Microbiome Expert Jeffrey Gordon https://t.co/PKj5ovDJmS,en,Agilent Technologies
Tue Dec 08 15:32:31 +0000 2015,Agilent is recognized (again) as a best employer!  Read all about it at https://t.co/Z4inNyRkhy https://t.co/e9HUDl6JH6,en,Agilent Technologies
Fri Dec 04 01:18:02 +0000 2015,Seahorse Executive Jay Teich Receives SFRBM CEO Innovator Award https://t.co/wIpdFLXu8s,en,Agilent Technologies
Thu Dec 03 21:50:33 +0000 2015,Seahorse XF Cell Energy Phenotype Test Kit Receives Top 10 Innovation Award from The Scientist https://t.co/GmFPKtsHKg,en,Agilent Technologies
Thu Dec 03 15:40:29 +0000 2015,Learn about the man who unlocked the secret of DNA.  Find out at https://t.co/Ip4KTfUeQc https://t.co/ZzjjbvcYOP,en,Agilent Technologies
Tue Dec 01 16:11:04 +0000 2015,Agilent Technologies Presents 2015 Early Career Professor Award to Dr. Mitchell Guttman of Caltech https://t.co/kUePFPHcRC,en,Agilent Technologies
Tue Dec 01 14:47:24 +0000 2015,Agilent people have been recognized for their scientific achievements!  Find out more at https://t.co/dLi42D10io https://t.co/E2xyLTXkz4,en,Agilent Technologies
Tue Nov 24 15:55:38 +0000 2015,Happy Thanksgiving! Let's give thanks for cranberries. Read more at https://t.co/24oMM0UXqv https://t.co/GRTiq2aSZo,en,Agilent Technologies
Thu Nov 19 21:15:14 +0000 2015,Agilent Technologies Increases Cash Dividend to 11.5 Cents per Share https://t.co/ak7rXkrV9h,en,Agilent Technologies
Wed Nov 18 22:47:38 +0000 2015,Agilent expands its footprint in Germany. Read more at https://t.co/z9IXl3gCkV https://t.co/RXmiRljnhA,en,Agilent Technologies
Tue Nov 17 16:05:33 +0000 2015,"Happy Birthday, Stanford University! Read more at https://t.co/fucK2jnf8V https://t.co/dkZAdQuZvb",en,Agilent Technologies
Mon Nov 16 21:19:33 +0000 2015,Agilent Technologies Reports Fourth-Quarter 2015 Results https://t.co/ZPgHZSA7G5,ca,Agilent Technologies
Thu Nov 12 15:35:26 +0000 2015,What's in a sandwich? Find out at https://t.co/jXzGSW1GFL https://t.co/DKCpzoosUk,en,Agilent Technologies
Tue Nov 10 16:01:16 +0000 2015,Did you know? Agilent offers laboratory relocation services. Read more at https://t.co/qF1PZgHumz https://t.co/3UURAUB20r,en,Agilent Technologies
Thu Nov 05 16:19:04 +0000 2015,Agilent Technologies Signs Instrument Control Exchange Agreement with Thermo Fisher Scientific https://t.co/E6Qy7OuCbY,en,Agilent Technologies
Thu Nov 05 15:32:06 +0000 2015,"Who was ""the woman behind the atomic bomb""?  Find out at https://t.co/xEiG6Q3JpV https://t.co/cOgoIeqMd8",en,Agilent Technologies
Tue Nov 03 16:32:42 +0000 2015,Agilent Technologies Showcases Innovations in Food Analysis at International Symposium in Prague https://t.co/tiArBW7qwR,en,Agilent Technologies
Tue Nov 03 15:32:50 +0000 2015,Agilent acquires Seahorse Bioscience.  Learn about our exciting new capabilities at https://t.co/5tpQ8ZYMhz https://t.co/XtyRy4HHyJ,en,Agilent Technologies
Mon Nov 02 16:14:23 +0000 2015,A. Barry Rand Retires from Agilent Technologies Board of Directors https://t.co/gp9QhaLQMU,en,Agilent Technologies
Mon Nov 02 13:42:04 +0000 2015,"Agilent Technologies Completes Acquisition of Seahorse Bioscience, Industry Leader in Tools for Measuring Cell… https://t.co/rUhu4rmtBx",en,Agilent Technologies
Thu Oct 29 14:32:47 +0000 2015,Agilent helps candy taste better!  Find out how at https://t.co/H4Ld7iu6Xl https://t.co/4w9ncV4oue,en,Agilent Technologies
Wed Oct 28 15:57:27 +0000 2015,Congratulations Ron! https://t.co/L9vHRv9y7x,en,Agilent Technologies
Wed Oct 28 15:53:33 +0000 2015,Congratulations Monika! https://t.co/hUYBRz9dMq,fr,Agilent Technologies
Tue Oct 27 22:48:32 +0000 2015,Agilent Technologies to Host Webcast of Fourth-Quarter Fiscal Year 2015 Financial Results Conference Call https://t.co/NAkytLK6Og,en,Agilent Technologies
Tue Oct 27 15:08:08 +0000 2015,Agilent aids the disease fight in Sub-Saharan Africa.  Find out how at https://t.co/G0mpsDRCwK https://t.co/vUcrRge760,en,Agilent Technologies
Mon Oct 26 16:27:02 +0000 2015,Agilent Technologies Introduces Industry's Most Sensitive GC/MSD System at Conference in China https://t.co/2dAd0Fa6Pb,en,Agilent Technologies
Wed Oct 21 15:46:08 +0000 2015,@alok7667  Thanks for your feedback. We will forward this our product mgmt. Great customers like you help make our products better!,en,Agilent Technologies
Wed Oct 21 14:50:21 +0000 2015,"Agilent is helping to make the ""future"" happen today! Read more at  https://t.co/8qcvkC45Eg https://t.co/AcjIagcUoF",en,Agilent Technologies
Mon Oct 19 15:11:03 +0000 2015,Agilent Technologies Introduces 4200 TapeStation System for Next-Generation Sequencing http://t.co/v47jlH044t,en,Agilent Technologies
Mon Oct 19 14:41:57 +0000 2015,Learn by doing. Read more at http://t.co/wLSkRLjyW4 http://t.co/57m84VFX48,en,Agilent Technologies
Thu Oct 15 14:38:07 +0000 2015,The unique patent of Henry Blair. Read more at http://t.co/iJoE4LKgVt http://t.co/TrJe8hLAuU,en,Agilent Technologies
Tue Oct 13 21:36:38 +0000 2015,@KammasMurphy Done! You can now private message your contact information,en,Agilent Technologies
Tue Oct 13 15:16:27 +0000 2015,In praise of Artemisinin and Avermectin. Read more at http://t.co/cPe83oITPe http://t.co/FItxMvYpoF,en,Agilent Technologies
Fri Oct 09 19:33:34 +0000 2015,"Dako, an Agilent Technologies Company, Announces FDA Approval of New Test for Lung Cancer Patients http://t.co/Q1g4U09xLY",en,Agilent Technologies
Fri Oct 09 14:51:51 +0000 2015,@KammasMurphy Private message me with your contact information and I'll see what we can set-up!,en,Agilent Technologies
Thu Oct 08 21:43:54 +0000 2015,RT @Cancer_bio: #Cancer News: Agilent Technologies Shares Vision for Precision Genomics at ASHG 2015: Agilent Technologies Inc... http://t.…,en,Agilent Technologies
Thu Oct 08 21:42:29 +0000 2015,@Foren3ic_Steph Thank you for choosing Agilent! https://t.co/PgF2coJ4MY,en,Agilent Technologies
Thu Oct 08 21:30:27 +0000 2015,@eegarcia78 Thanks Elisa! We love our customers! https://t.co/oZUSQZfPl2,en,Agilent Technologies
Thu Oct 08 14:44:02 +0000 2015,What color is your dinosaur? Find out at http://t.co/eOKJXuJS0j http://t.co/9a5zRUanNI,en,Agilent Technologies
Wed Oct 07 15:17:31 +0000 2015,@Foren3ic_Steph Thanks for using Agilent equipment! https://t.co/gArnfCmZbx,en,Agilent Technologies
Wed Oct 07 15:15:04 +0000 2015,Agilent Technologies Shares Vision for Precision Genomics at ASHG 2015 http://t.co/a7jehseRjr,en,Agilent Technologies
Tue Oct 06 15:18:05 +0000 2015,"Agilent Technologies Enhances Curriculum with Anywhere, Anytime Courses for Improved Laboratory Operations http://t.co/xCqUmsg7qu",en,Agilent Technologies
Tue Oct 06 15:06:26 +0000 2015,He discovered an entire area of the periodic table. Read more at http://t.co/bLCXewub50 http://t.co/Mlv21s9Xes,en,Agilent Technologies
Fri Oct 02 19:42:22 +0000 2015,"Dako, an Agilent Technologies Company, Announces FDA Approval of New Companion Diagnostic for Lung Cancer http://t.co/NuROPTnj2J",en,Agilent Technologies
Thu Oct 01 15:21:15 +0000 2015,Agilent Technologies Redesigns Sulfur and Nitrogen Chemiluminescence Detectors http://t.co/oFRtdvJWGj,en,Agilent Technologies
Thu Oct 01 14:36:53 +0000 2015,Agilent and the search for life on Mars! Read all about it at http://t.co/GvF24Q9w7h http://t.co/N779ZvklYc,en,Agilent Technologies
Tue Sep 29 17:43:39 +0000 2015,"Agilent University, learning solutions to help you realize the full potential of your Agilent lab instrumentation. https://t.co/cmlBxCQAex",en,Agilent Technologies
Tue Sep 29 14:55:55 +0000 2015,"New links between alcohol, smoking and cancer. Read more at http://t.co/FBQtuJA2pz http://t.co/6hhQgeuoJj",en,Agilent Technologies
Thu Sep 24 14:32:17 +0000 2015,Agilent enables breakthrough in heart disease and diabetics research. Read more at http://t.co/t6dp9kmBCp http://t.co/6wr6bW9dMo,en,Agilent Technologies
Wed Sep 23 15:11:34 +0000 2015,Agilent Technologies Announces Opening of Life Science Research Center at Carleton University http://t.co/n0WqEcD0V5,en,Agilent Technologies
Tue Sep 22 22:11:04 +0000 2015,@rckstdy_ Happy Anniversary!,en,Agilent Technologies
Tue Sep 22 22:10:00 +0000 2015,@CongressBasel @BaselLSW Thanks for the warm welcome!,en,Agilent Technologies
Tue Sep 22 17:53:26 +0000 2015,RT @hamishin: Love your HPLC and GC @Agilent XOXO,en,Agilent Technologies
Tue Sep 22 17:53:08 +0000 2015,RT @JordiLabs: Sign up for @jordilabs Dr. Mark Jordi's E&amp;L Webinar with @AgilentChem &amp; @Agilent tomorrow: http://t.co/VrQPceDvRx,en,Agilent Technologies
Tue Sep 22 14:38:58 +0000 2015,A new method for detecting environmental contaminants in sewage. Read more at http://t.co/fHBkHizoWm http://t.co/tKQnUv9X8c,en,Agilent Technologies
Thu Sep 17 15:16:35 +0000 2015,The man who discovered vitamin C. Read more at http://t.co/IaAmiyVurv http://t.co/j62uMvItME,en,Agilent Technologies
Wed Sep 16 20:54:03 +0000 2015,Agilent Technologies Announces Cash Dividend of 10 Cents per Share http://t.co/aKLgxVYi1V,en,Agilent Technologies
Tue Sep 15 22:08:18 +0000 2015,"Sue H. Rataj, Former Energy Executive, to Join Agilent Technologies Board of Directors http://t.co/MTR8ehZH8x",en,Agilent Technologies
Tue Sep 15 15:12:52 +0000 2015,Is it getting hotter around here? Find out at http://t.co/e931kiDsIz http://t.co/pP8ePsbIwr,en,Agilent Technologies
Thu Sep 10 15:08:04 +0000 2015,Agilent helps test Traditional Chinese Medicine. Find out more at http://t.co/7rZobGx2mf http://t.co/UpuaQxkmqH,en,Agilent Technologies
Wed Sep 09 20:11:03 +0000 2015,"Agilent Technologies to Acquire Seahorse Bioscience, Industry Leader in Tools for Measuring Cell Metabolism http://t.co/v5J2Co6OSk",en,Agilent Technologies
Tue Sep 08 15:04:58 +0000 2015,Agilent has been recognized for its flexible work schedule.  Read more at http://t.co/kyKJGHimMw http://t.co/22VcNVQruX,en,Agilent Technologies
Thu Sep 03 15:11:38 +0000 2015,Do you know what isotopes are used for? Find out at http://t.co/PlMH53sS6C http://t.co/gI1e27vjfZ,en,Agilent Technologies
Wed Sep 02 20:36:21 +0000 2015,Agilent Technologies No Longer to Include Orders in Financial Reporting http://t.co/sSW1T2A8ew,en,Agilent Technologies
Tue Sep 01 15:51:47 +0000 2015,@Sydney_iGEM Thank you for choosing Agilent!,en,Agilent Technologies
Tue Sep 01 15:03:09 +0000 2015,Agilent and the return of the woolly mammoth. Read more @ http://t.co/lUj5gz02HI http://t.co/2AijbNS0mE,en,Agilent Technologies
Thu Aug 27 15:05:41 +0000 2015,Algae blooms are getting worse. Read more @ http://t.co/7xetzmTEuq http://t.co/PyNhDONrpc,en,Agilent Technologies
Wed Aug 26 15:23:03 +0000 2015,Agilent Technologies Collaborating with Weill Cornell Medical College to Advance Research in ALS http://t.co/A98wDZO0Qk,en,Agilent Technologies
Tue Aug 25 15:25:57 +0000 2015,@syafiqnawi We are happy that you picked Agilent!,en,Agilent Technologies
Tue Aug 25 15:06:58 +0000 2015,Agilent partners for cutting-edge cancer research. Read more @ http://t.co/5ZJynb8i59 http://t.co/qZtdUTgcWN,en,Agilent Technologies
Thu Aug 20 15:16:12 +0000 2015,Agilent and the California drought. Read more @ http://t.co/c0GbX7QU6m http://t.co/PuWqGvO8FY,en,Agilent Technologies
Tue Aug 18 15:05:47 +0000 2015,Have you ever wondered where smear-proof lipstick came from? Find out @ http://t.co/m69rDxkEjt http://t.co/NMx7eazjBC,en,Agilent Technologies
Tue Aug 18 14:58:48 +0000 2015,"@Flangie501 Glad you liked it, wish we had more to share!",en,Agilent Technologies
Mon Aug 17 20:12:32 +0000 2015,Agilent Technologies Reports Third-Quarter 2015 Results http://t.co/A7df3UhRyC,en,Agilent Technologies
Fri Aug 14 16:35:50 +0000 2015,@Mooniac What is the issue that you are trying to resolve? How we help you?,en,Agilent Technologies
Thu Aug 13 15:05:19 +0000 2015,"How ""Agilent"" got its name. Read more @ http://t.co/9NYqVMtLUx http://t.co/SbClI7KtSV",en,Agilent Technologies
Wed Aug 12 15:44:47 +0000 2015,@KanyeSW Is there an issue that we can assist you with?,en,Agilent Technologies
Tue Aug 11 15:20:03 +0000 2015,Agilent Announces New Sample-Preparation Product for Food Testing http://t.co/TaESQXsihc,en,Agilent Technologies
Tue Aug 11 15:05:58 +0000 2015,Ernst Laqueur pioneered insulin and hormones… but at what cost? Find out @ http://t.co/MeggKFJqCK http://t.co/bWWzuErizM,en,Agilent Technologies
Thu Aug 06 15:18:15 +0000 2015,The story of F&amp;M Scientific. Read more @ http://t.co/qKEtw00NoS http://t.co/u5TUYxoDTN,en,Agilent Technologies
Tue Aug 04 15:37:20 +0000 2015,RT @ChaseMazur: We look forward to unpacking our new @Agilent 6495. We'll be applying mass spec to clinical research here at @WeillCornell!,en,Agilent Technologies
Tue Aug 04 15:03:45 +0000 2015,Agilent celebrates 50 years in analytical! Read more @ http://t.co/3x1h6rN349 http://t.co/tYQpN3JVbK,en,Agilent Technologies
Thu Jul 30 15:07:50 +0000 2015,New Agilent consumable product breaks sales record. Get the details @ http://t.co/dDdprCzwp4 http://t.co/ZIiCzHt3Ro,en,Agilent Technologies
Thu Jul 30 15:03:33 +0000 2015,Agilent Technologies to Host Webcast of Third-Quarter Fiscal Year 2015 Financial Results Conference Call http://t.co/NxCdYEM0vb,en,Agilent Technologies
Tue Jul 28 15:09:45 +0000 2015,Scientists have discovered a sixth basic taste. Read more @ http://t.co/DeC6qiIJer http://t.co/ut9ZC6lIKx,en,Agilent Technologies
Thu Jul 23 15:07:32 +0000 2015,RT @berkeleyscience: ThankYou @Agilent for sponsoring the Hall's #TeenInternship  this Summer! http://t.co/ABNi9cym3o http://t.co/h3BQc0LkmM,en,Agilent Technologies
Thu Jul 23 15:04:14 +0000 2015,Agilent and the decline of the woolly mammoth. Read more @ http://t.co/13KPgjb9ZG http://t.co/pPcGRYqqSH,en,Agilent Technologies
Tue Jul 21 15:58:33 +0000 2015,RT @atticusMB: Agilent and A*STAR to develop glycan analysis methods more suited to commercial setting http://t.co/nBjeAICEHU via @BioPharm…,en,Agilent Technologies
Tue Jul 21 15:52:22 +0000 2015,@UCDavisResearch @ucdavisCAES A great partnership with UC Davis on new technology to meet the challenges of the day.,en,Agilent Technologies
Tue Jul 21 15:03:38 +0000 2015,Ensuring safer dairy products in China. Read more @ http://t.co/9bWtW3LGZM http://t.co/VvkTDhtr3v,en,Agilent Technologies
Thu Jul 16 15:08:22 +0000 2015,Who Invented the Laser? Find out @ http://t.co/FDEDVtJIAF http://t.co/RUT68Lotij,en,Agilent Technologies
Wed Jul 15 15:49:54 +0000 2015,@ekolka I am sorry you are experiencing issues. Please DM me w/your tele #/email to have one of our Support Specialists contact you. Thanks,en,Agilent Technologies
Wed Jul 15 15:06:34 +0000 2015,Agilent Technologies Presents Thought Leader Award to Renowned Systems Pharmacologist Lawrence Lesko http://t.co/UUnWRoi2IB,en,Agilent Technologies
Tue Jul 14 15:15:34 +0000 2015,Can Agilent help save the rhinoceros? Find out @ http://t.co/iRNqE7THAw http://t.co/DgB6OiMXu7,en,Agilent Technologies
Thu Jul 09 15:07:57 +0000 2015,Were you inspired by television's Mr. Wizard? Read more @ http://t.co/Wzog5UuJb6 http://t.co/h60NqpPcKr,en,Agilent Technologies
Tue Jul 07 15:01:40 +0000 2015,Agilent Enlarges Our View of Individual Cells.  Read more at http://t.co/t7OBpnkhPw http://t.co/0pKZ7amuTT,en,Agilent Technologies
Thu Jul 02 15:03:16 +0000 2015,Agilent analyzes the safety of your fireworks.  Find out more at http://t.co/fYf8MU4S8O http://t.co/WJnmeHjydd,en,Agilent Technologies
Tue Jun 30 15:04:47 +0000 2015,Have you washed your hands today? Read why at http://t.co/bDKNagZdu0 http://t.co/rou49npWjp,en,Agilent Technologies
Thu Jun 25 16:27:03 +0000 2015,The Rosetta comet landing mission is back online! Read more @ http://t.co/jJAGIhMB4r http://t.co/lzHWAi39xo,en,Agilent Technologies
Tue Jun 23 15:17:06 +0000 2015,Agilent Technologies Launches New Products for Analyzing Biotherapeutics http://t.co/jtvehFEtE7,en,Agilent Technologies
Tue Jun 23 15:08:33 +0000 2015,Agilent helps uncover a link between microRNAs and prostate cancer. Read more @ http://t.co/NFzA5MaIWW http://t.co/SaXGm0IYoM,en,Agilent Technologies
Mon Jun 22 15:28:04 +0000 2015,Agilent Technologies Introduces New Autosampler for 1290 Infinity II LC System http://t.co/v0FG3Dg3ve,en,Agilent Technologies
Thu Jun 18 15:10:06 +0000 2015,Agilent cuts through big data in biology. Read more @ http://t.co/DnlLDT9VlJ http://t.co/LmtW8fBxZg,en,Agilent Technologies
Tue Jun 16 15:10:30 +0000 2015,Barbara McClintock pioneered the field of cytogenetics… and was ridiculed. Read more @ http://t.co/tfg7SCVGqE http://t.co/256kBcwH7X,en,Agilent Technologies
Mon Jun 15 15:59:08 +0000 2015,Our customers love our products! Thanks @Foren3ic_Steph! https://t.co/hWwac4Oga0,en,Agilent Technologies
Thu Jun 11 17:10:04 +0000 2015,Agilent Technologies and Waters Corporation Formalize Instrument Control Exchange http://t.co/b4kW2NvhBL,en,Agilent Technologies
Thu Jun 11 15:04:46 +0000 2015,Agilent helps researchers study Post-Traumatic Stress Disorder. Read more @ http://t.co/AUXYczTIM4 http://t.co/KOK9VN40bd,en,Agilent Technologies
Tue Jun 09 15:41:04 +0000 2015,Agilent Technologies Presents Thought Leader Award to Environmental Researcher Dr. Arturo Keller of U.C. Santa… http://t.co/6188l2Z9xj,en,Agilent Technologies
Tue Jun 09 15:13:44 +0000 2015,Agilent helps unlock the origins of language. Read more @ http://t.co/zaiz7T6iEL http://t.co/ABgtUZ8pP5,en,Agilent Technologies
Mon Jun 08 15:39:04 +0000 2015,"Agilent Technologies Launches Updated Gene Expression Microarrays for Human, Mouse and Rat Models http://t.co/8MGl5r3PiK",en,Agilent Technologies
Mon Jun 08 15:06:52 +0000 2015,Agilent recognized as one of the 25 best tech companies to work for in America. Read more @ http://t.co/UjfjtXojMZ http://t.co/hdbHzA7p1G,en,Agilent Technologies
Thu Jun 04 15:16:34 +0000 2015,Agilent Technologies Releases New Target-Enrichment Solutions for Disease Research http://t.co/KKRbHFf88C,en,Agilent Technologies
Thu Jun 04 15:12:07 +0000 2015,Agilent is partnering with pharma to help your immune system fight cancer. Read more @ http://t.co/yqwRHkKu0f http://t.co/81DmGvZzP9,en,Agilent Technologies
Tue Jun 02 15:19:47 +0000 2015,He invented the blood bank… then wasn't allowed to donate. Read more @ http://t.co/0in4aPQbcV http://t.co/rBavSXuOuS,en,Agilent Technologies
Mon Jun 01 23:35:34 +0000 2015,Agilent Technologies Raises Standard for Routine Elemental Analysis with New ICP-MS System http://t.co/M2icfHHXTl,en,Agilent Technologies
Mon Jun 01 19:44:35 +0000 2015,Agilent Technologies to Present at Goldman Sachs 36th Annual Global Healthcare Conference http://t.co/q4LL0yWE25,en,Agilent Technologies
Mon Jun 01 18:37:07 +0000 2015,Agilent Technologies Launches Its Most Robust Triple Quadrupole Mass Spectrometer http://t.co/xxs529nEeT,en,Agilent Technologies
Mon Jun 01 17:17:53 +0000 2015,Watch Agilent President and CEO Mike McMullen ring the opening bell of the NYSE @ http://t.co/7Lo1FyviUu. http://t.co/YMeS75lEkf,en,Agilent Technologies
Thu May 28 15:33:03 +0000 2015,"Agilent Technologies to Focus on ""Powerful Partnerships, Inspiring Results"" at ASMS 2015 http://t.co/69vEQzdsJn",en,Agilent Technologies
Thu May 28 15:27:34 +0000 2015,Can Algae Help Clean the Environment? Read more @ http://t.co/qY5LzB9JmW http://t.co/AqeMfDUk6C,en,Agilent Technologies
Thu May 28 12:48:09 +0000 2015,Agilent Technologies Authorizes New Share Repurchase Program http://t.co/FbGDl4qK6z,en,Agilent Technologies
Wed May 27 15:35:56 +0000 2015,@giancarlo2000 We love your new cup!,en,Agilent Technologies
Tue May 26 15:13:15 +0000 2015,What's killing our bees? Agilent has the answer! Find out @ http://t.co/bBBaUVcSh8 http://t.co/iyuW3k0NFa,en,Agilent Technologies
Thu May 21 15:13:39 +0000 2015,Do you know the amazing story behind evaporated milk? Find out @ http://t.co/ZHoKcvDzcu http://t.co/PiRqwGBYeG,en,Agilent Technologies
Wed May 20 20:13:16 +0000 2015,Agilent Technologies Announces Cash Dividend of 10 Cents per Share http://t.co/XTik263ojL,en,Agilent Technologies
Tue May 19 17:57:06 +0000 2015,Agilent Technologies Advances Solutions to Drive Better Outcomes for Customers http://t.co/eP0Sg8OqQJ,en,Agilent Technologies
Tue May 19 15:14:15 +0000 2015,Great shirt!@TheEricTownsend https://t.co/cwoUWAARr5,en,Agilent Technologies
Tue May 19 15:06:50 +0000 2015,Agilent improves instrument resolution and sensitivity by 5X! Get the details @ http://t.co/BNpjRth2vX http://t.co/v0GfxoueZ9,en,Agilent Technologies
Mon May 18 20:11:34 +0000 2015,Agilent Technologies Reports Second-Quarter 2015 Results http://t.co/P2xM1izZFm,ca,Agilent Technologies
