created_at,full_text,lang,user_name
Thu Dec 19 21:57:00 +0000 2019,"@joanlu13 Hello Joan, please email us at CSU@aig.com so we can assist you with your account as soon as possible",en,AIG
Thu Dec 19 21:56:35 +0000 2019,"@OhGreenPop Gina, what product are you inquiring about?",en,AIG
Thu Dec 19 16:33:10 +0000 2019,"@OhGreenPop Hello Gina, please email us at GCMS@aig.com so we can assist you as soon as possible.",en,AIG
Thu Dec 19 15:34:21 +0000 2019,"@PragmaticAndy Hello Andy, we are very sorry to hear of your frustration. Please email us directly at CSU@aig.com for us to assist you directly as soon as possible.",en,AIG
Thu Dec 19 14:15:48 +0000 2019,"@Niamh_1989 Hello Niamh, please email us at GCMS@aig.com so we can assist you as soon as possible.",en,AIG
Wed Dec 18 15:40:29 +0000 2019,"AIG CEO Brian Duperreault and AIG’s Board of Directors are pleased to announce Peter Zaffino has been named President of AIG, while continuing as Global Chief Operating Officer and Chief Executive Officer of General Insurance. https://t.co/gdBnZOKLdQ",en,AIG
Wed Dec 18 15:03:33 +0000 2019,"@CherylALeonard Hi Cheryl, we are sorry to hear of your frustration. Please email us directly at CSU@aig.com so we can assist you with your concern.",en,AIG
Mon Dec 16 20:52:30 +0000 2019,"@SelenaCoppock Hi Selena, If you have any additional questions or concerns, please contact us at 1-800-826-1300 or socialmedia@travelguard.com. We are available to discuss our coverage and policy info anytime. Thank you.",en,AIG
Fri Dec 13 20:53:20 +0000 2019,"@uuminette Hi, Please contact us at 1-800-826-1300 for questions about your policy. Otherwise, you may email your policy/claim number and contact details (full name, phone, email address) to socialmedia@travelguard.com for further assistance. Thank you.",en,AIG
Fri Dec 13 14:39:02 +0000 2019,"@Kevinaura12 Hello Kevin, please email us at GCMS@aig.com so we can assist you with your claim in Kenya as soon as possible.",en,AIG
Thu Dec 12 16:48:29 +0000 2019,"@JCMedlong Hi, If you have any additional questions, please contact us at 1-800-826-1300 or socialmedia@travelguard.com. We are sorry to hear your feelings on this and available to discuss our coverage or policy info anytime. Thank you.",en,AIG
Wed Dec 11 16:54:31 +0000 2019,"@Iqra5280 Hi, Please contact us at 1-800-826-1300 or socialmedia@travelguard.com with any questions regarding your claim. Thank you.",en,AIG
Wed Dec 11 16:54:00 +0000 2019,"@searching1205 Hi Anim, we are sorry to hear of your frustration. Please email us directly at CSU@aig.com so we can assist you with your concern.",en,AIG
Wed Dec 11 16:30:04 +0000 2019,AIG Travel President &amp; CEO Jeff Rutledge speaks with the International Travel &amp; Health Insurance Journal (ITIJ) about the new technologies that are changing the travel insurance industry. Read the interview here: https://t.co/6FUrZaF0US,en,AIG
Tue Dec 10 22:10:35 +0000 2019,"@Iqra5280 Hi, We are sorry that our decision is not more favorable to you. Our Claims Department is available to talk through it if you have additional questions or concerns. Please contact us at 1-800-826-1300 or socialmedia@travelguard.com. Thank you.",en,AIG
Tue Dec 10 19:17:00 +0000 2019,"RT @AIGemea: In what’s become an AIG tradition, @ChoirOvation  led our BeingYou@AIG Pop-up Choir through a festive medley of Christmas hits…",en,AIG
Tue Dec 10 18:40:51 +0000 2019,"@CoghillNicola Hi, We are sorry to hear about the frustration you've experienced. If you have additional questions or concerns, please contact us at 1-800-826-1300 or socialmedia@travelguard.com so we can assist. Thank you",en,AIG
Tue Dec 10 18:40:00 +0000 2019,"@shadowcatsd Hello, we are very sorry to hear of your frustration. Please email us at CSU@aig.com so we can assist you with your claim as soon as possible.",en,AIG
Tue Dec 10 18:39:41 +0000 2019,"@RALPHMO41231270 Hello Ralph, please email us at GCMS@aig.com instead so we can assist you as soon as possible.",en,AIG
Tue Dec 10 17:37:17 +0000 2019,Congratulations to AIG’s Alessa Quane for being featured on this year’s IBA Hot 100 for her leadership and notable contributions to the insurance industry. 🏆 🏅 https://t.co/iUVckfm3vV,en,AIG
Mon Dec 09 20:08:15 +0000 2019,"Speaking to AIG’s Government Affairs and Public Policy team last month at the U.S. National Archives, our CEO Brian Duperreault stressed the importance of working collaboratively with government officials around the world to address key industry topics. #insurance #publicpolicy https://t.co/Iptt1uo6jj",en,AIG
Mon Dec 09 20:07:27 +0000 2019,"RT @BusInsMagazine: We are pleased to honor Benedetta Cossarini with @AIGinsurance, as a 2019 Woman to Watch #EMEA. Click through and learn…",en,AIG
Mon Dec 09 18:13:37 +0000 2019,"@mrjpcardona Hi, If you have any additional questions or concerns, please contact us at 1-800-826-1300 or socialmedia@travelguard.com. We are sorry to hear your feelings on this and are available to discuss our coverage and policy info anytime. Thank you.",en,AIG
Mon Dec 09 16:01:11 +0000 2019,"@EmmiOi2 Hello Emmanuel, please email us at GCMS@aig.com so we can look into your claim.",en,AIG
Fri Dec 06 21:08:00 +0000 2019,"@Rashidwo1 Hi Rashid, please email us at CSU@aig.com and we would be happy to assist you.",en,AIG
Fri Dec 06 18:42:04 +0000 2019,"@Tworth23 Hi, thank you for reaching out to us. You may call our sales department, Monday–Saturday, 6 AM to 4:30 PM Pacific Standard Time and can be reached directly at 800-888-2452.",en,AIG
Fri Dec 06 18:41:20 +0000 2019,"@neal_bec Hi Bec, We are happy to hear of your positive experience with AIG.  Have a great day!",en,AIG
Fri Dec 06 02:19:59 +0000 2019,"@ReisaMiller Hi Reisa, we are sorry to hear of your frustration. Please email us directly at CSU@aig.com so we can assist you with your concern.",en,AIG
Thu Dec 05 21:18:01 +0000 2019,"@Tworth23 Hi Tworth23, please visit our website https://t.co/bdssF3ssXW for the contact information regarding your policy.",en,AIG
Thu Dec 05 20:33:12 +0000 2019,"@myscotchclub Hi, We are sorry to hear your frustration. Please email your claim/policy number and contact details (full name associated with claim, phone, email) to socialmedia@travelguard.com so that we can look into it. You can also reach us at 1-800-826-1300. Thank you.",en,AIG
Thu Dec 05 20:32:32 +0000 2019,"@Tworth23 Hello, please email us at CSU@aig.com and we would be happy to assist you.",en,AIG
Thu Dec 05 18:11:02 +0000 2019,"At last month's #IAIS Annual Meeting, members came to an agreement on a new ICS standard. AIG's Tom Leonardi acknowledges this critical milestone, and offers thoughts on what should come next. https://t.co/j4zDXfFuRl",en,AIG
Wed Dec 04 20:45:14 +0000 2019,"@Aliceresponde Gracias por comunicarse con nosotros, envíenos un correo electrónico a GCMS@aig.com para obtener más ayuda.",es,AIG
Wed Dec 04 19:30:57 +0000 2019,"@AM_STAIR_DESIGN Hi, we are sorry to hear of your frustration. Please email us directly at CSU@aig.com so we can assist you with your policy",en,AIG
Tue Dec 03 21:46:27 +0000 2019,"Today, we’re recognizing our 600+ colleagues who foster an inclusive workplace for employees with disabilities by hosting conversations to reduce stigma &amp; raise awareness of their challenges as part of AIG’s eight global disAbilities &amp; Allies ERGs. #WorldDisabilityDay #IDPWP2019 https://t.co/dRLH8PowjQ",en,AIG
Tue Dec 03 15:46:42 +0000 2019,"RT @paulwalsh2609: “People are struggling with cyber because it’s not really a peril, it’s a threat and it can manifest itself in many diff…",en,AIG
Mon Dec 02 18:42:03 +0000 2019,It’s important to ask questions &amp; develop a plan to get to where you want to be. That’s the advice U.S. Air Force veteran &amp; AIG Associate Underwriter Eric Schmidt shared with veterans exploring corporate careers at a recent event cohosted by AIG &amp; ACP. #ProudPartners #ACPthanks https://t.co/yRUaTwkWrS,en,AIG
Mon Dec 02 18:02:10 +0000 2019,"@sharmaop_ggn Hello, please email us at GCMS@aig.com so we can assist you with your policy.",en,AIG
Mon Dec 02 18:02:00 +0000 2019,"@ejbean_ Hello Emma, please email us at GCMS@aig.com so we can assist you with your car insurance policy with us.",en,AIG
Wed Nov 27 14:54:05 +0000 2019,"@KhozaCebo Hello, please email us at GCMS@aig.com so we can assist you as soon as possible.",en,AIG
Mon Nov 25 22:14:25 +0000 2019,AIG announced the sale of a majority interest in run-off reinsurer Fortitude Re — another important step in our strategy to efficiently manage our legacy liabilities. https://t.co/qFOXwaVGRp,en,AIG
Mon Nov 25 16:22:52 +0000 2019,"@madelont Hi, we are sorry to hear about the frustration you've experienced. Would you mind emailing your contact info (full name associated with policy/email/phone) to socialmedia@travelguard.com so we can look into it? Thank you",en,AIG
Fri Nov 22 19:57:00 +0000 2019,"@JEpstein87 Hi, If you have any additional questions or concerns, please contact us at 1-800-826-1300 or socialmedia@travelguard.com. We are sorry to hear your feelings on this and are available to discuss our coverage and policy info anytime.",en,AIG
Fri Nov 22 19:54:21 +0000 2019,"@seanbrowneHunts Hi Sean, We request for our customers to properly file claim forms and supply required documents so that we can make coverage decisions under the terms and conditions of the policy. Please contact us 1-800-826-1300 or socialmedia@travelguard.com with any additional questions.",en,AIG
Fri Nov 22 15:50:00 +0000 2019,@SwtRochester Thank you Susie for reaching out to us. Please email us at CSU@aig.com so we can assist you further with your concern.,en,AIG
Fri Nov 22 14:35:57 +0000 2019,"@jacnthebox1 Hello Jacky, we are very sorry to hear of your frustration. Please email us at CSU@aig.com so we can assist you as soon as possible.",en,AIG
Wed Nov 20 14:08:41 +0000 2019,@CsarH8 Merci de nous contacter. Contactez-nous au via l’adresse email GCMS@aig.com pour plus d'assistance.,fr,AIG
Tue Nov 19 16:22:27 +0000 2019,"@StudioShuffle Hi, Because the Description of Coverage varies based on the plan purchased, coverage varies, too. If you have any additional questions or concerns, please contact us at 1-800-826-4919 or socialmedia@travelguard.com. Thank you.",en,AIG
Tue Nov 19 16:22:22 +0000 2019,"@gahl Hi Gaul, please email us at GCMS@aig.com so we can assist you.",en,AIG
Tue Nov 19 16:22:22 +0000 2019,"@LyndsayM12 Hi Lyndsay, we are sorry to hear you feel this way. We aren’t able to know the details of your situation over social media, but please email your claim number and contact information to socialmedia@travelguard.com so we can look into it. Thank you.",en,AIG
Mon Nov 18 17:27:36 +0000 2019,"AIG CEO Brian Duperreault recently attended the #PwCInsurance Summit to discuss progress in positioning AIG as a leading global insurer, the important role reinsurance plays in reducing volatility in the current risk landscape &amp; the importance of Bermuda as an innovation center. https://t.co/V5e5jNbRok",en,AIG
Mon Nov 18 16:06:00 +0000 2019,"@bkalar09 Hello Brian, thank you for reaching out to us. Please email us at CSU@aig.com so we can assist you further with your concern.",en,AIG
Mon Nov 18 16:06:00 +0000 2019,"@O_No_More Hello, we are sorry to hear about your experience. Please email us at CSU@aig.com so we can assist you with your concern.",en,AIG
Mon Nov 18 16:06:00 +0000 2019,"@blazed383 Hello, we are sorry to hear of your frustration. Please email us directly at CSU@aig.com so we can assist you with your concern as soon as possible",en,AIG
Mon Nov 18 16:05:45 +0000 2019,"@dougfisher Hello Doug, thank you for reaching out to us. If you have any further questions or concerns, please email us at CSU@aig.com.",en,AIG
Sat Nov 16 15:56:00 +0000 2019,"RT @AIGemea: Just a few days to go until this year's #fermaforum. Check out our video of Thomas Lillelund, CEO of AIG Europe to find out mo…",en,AIG
Fri Nov 15 21:07:40 +0000 2019,"@blazed383 Hi, If you have any additional questions or concerns, please contact us at 1-800-826-1300 or socialmedia@travelguard.com. We are sorry to hear your feelings on this and are available to discuss our coverage and policy info anytime.",en,AIG
Fri Nov 15 21:07:40 +0000 2019,"@kuriosara Hi, We are sorry that our coverage decision is not more favorable towards you. If you have additional questions or concerns, please contact us at 1-800-826-1300 or at socialmedia@travelguard.com. Thank you",en,AIG
Fri Nov 15 19:45:59 +0000 2019,Congratulations to Duncan Ellis for being named one of @RiskInsurance's 2020 Insurance Executives to Watch. He sat down with the magazine’s Editor-in-Chief to discuss his move to AIG and the changing rate market for property coverage. #underwriting https://t.co/2djG54OwKJ,en,AIG
Fri Nov 15 15:26:02 +0000 2019,"RT @AIGemea: We’re delighted that AIG’s Benedetta Cossarini — #AIGIberia General Manager — is an EMEA @BusInsMagazine #WomenToWatch winner,…",en,AIG
Fri Nov 15 15:22:13 +0000 2019,"@StudioShuffle Hi, If you have any additional questions, please contact us at 1-800-826-1300 or socialmedia@travelguard.com. We are sorry to hear your feelings on this and available to discuss our coverage or policy info anytime.",en,AIG
Fri Nov 15 14:59:14 +0000 2019,"@BillMendocino Hi Bill, please email us at CSU@aig.com and we would be happy to assist you with your life insurance policy.",en,AIG
Thu Nov 14 14:56:05 +0000 2019,"@BocchiniSonia Hello Sonia, we are sorry to hear of your frustration. Please email us directly at CSU@aig.com for us to assist you directly  regarding your claim.",en,AIG
Wed Nov 13 19:35:00 +0000 2019,"""AIG believes P&amp;C policies globally should be clear about the cyber coverage they provide,"" says AIG's Head of Cyber Risk, Tracie Grella. Learn more: https://t.co/ID7eEnV8Er",en,AIG
Tue Nov 12 21:29:38 +0000 2019,"@snrbarlow Hi, Because the Description of Coverage varies based on the plan purchased, coverage varies, too. We are sorry that our decision is not more favorable to you. If you have any additional questions, please contact us at 1-800-826-1300 or socialmedia@travelguard.com. Thank you.",en,AIG
Mon Nov 11 21:50:57 +0000 2019,We're proud to join other leading companies in expanding the applicant pool and lessening the talent gap in the #cybersecurity industry. 🤝 https://t.co/RvmA1XfhvG,en,AIG
Mon Nov 11 21:36:00 +0000 2019,"@EdasunDostale Hi Edasun, Please visit https://t.co/helArUh8p9 for information on AIG's Travel Guard flight insurance options with Expedia. Should you have additional questions please call 1-855-266-4973 or email socialmedia@travelguard.com. Thank you",en,AIG
Mon Nov 11 21:36:00 +0000 2019,"@vskrzypek Hi, If you have additional questions or concerns, please contact us at 1-800-826-1300 or socialmedia@travelguard.com. Thank you.",en,AIG
Mon Nov 11 20:10:26 +0000 2019,"@snrbarlow Hi, We are sorry that our decision is not more favorable to you. Because the Description of Coverage varies based on the plan purchased, coverage varies, too. If you have any additional questions, please contact us at 1-800-826-1300. Thank you.",en,AIG
Fri Nov 08 21:30:15 +0000 2019,"@KFCSA With so many honeymoons to come, we see lots of travel in the future for the lovely couple! We'd love to make sure they travel with peace of mind and R10 000 worth of travel insurance from AIG South Africa FSP 15805.
#KFCProposal #TravelSafe",en,AIG
Fri Nov 08 16:10:05 +0000 2019,"@WingersSo Hi, Because the Description of Coverage varies based on the plan purchased, coverage varies, too. We are sorry that our decision is not more favorable to you. If you have any additional questions, please contact us at socialmedia@travelguard.com or 1-866-478-8222. Thank you.",en,AIG
Thu Nov 07 22:30:27 +0000 2019,"RT @ABIR_Bermuda: A few #Bermuda #insurance market leaders attending ⁦@PwC⁩ 2019 #Insurance Summit. ⁦@AIGinsurance⁩ Cathy Duffy, ⁦@Lloydsof…",en,AIG
Thu Nov 07 20:31:49 +0000 2019,"@CTJDorsey Hi, Please email your policy/claim number, contact info (full name associated with policy/email/phone), and nature of your inquiry to socialmedia@travelguard.com so we can further assist. Otherwise, feel free to call 1-866-478-8222 Thank you",en,AIG
Thu Nov 07 18:25:56 +0000 2019,"A season to remember. Congratulations to all the New Zealand Rugby teams on an incredible year. Every day, we strive for teamwork, integrity, and performing at the highest level—all characteristics at the heart of New Zealand Rugby and AIG. 🤝 https://t.co/alPHqeorAM",en,AIG
Thu Nov 07 18:24:20 +0000 2019,"RT @ftlive: Robert Armstrong sits down with AIG CEO Brian Duperreault to talk about the turnaround, company culture, and the value of reins…",en,AIG
Thu Nov 07 14:55:48 +0000 2019,"@jyvendl Hi Jo, we are sorry to hear of your frustration. Please email us at CSU@aig.com so we can assist you with your concern.",en,AIG
Thu Nov 07 12:40:00 +0000 2019,"RT @AIGemea: Our staff in Scotland took a trip down memory lane last week, at AIG’s Glasgow Generations ERG awareness event

Special thanks…",en,AIG
Wed Nov 06 20:26:00 +0000 2019,"@snrbarlow Hi, Please check the status of your claim online at: https://t.co/dG3LtpV6Zf or call 1-866-478-8222 for further assistance. Thank you.",en,AIG
Wed Nov 06 19:06:08 +0000 2019,"RT @SPGlobalRatings: This morning at the 2019 Bermuda Reinsurance Conference, Keynote Speaker, Brian Duperreault, President &amp; CEO of @AIGin…",en,AIG
Wed Nov 06 19:01:01 +0000 2019,"Surround yourself with those who support you and give you the recognition you deserve. AIG General Counsel Lucy Fato shared this advice at the @SetonHallLaw Women in #Leadership Networking Event where she was introduced by Elaine Rocha, AIG Investments COO &amp; #SetonHallLaw alum. https://t.co/bVCPV4Yfsl",en,AIG
Wed Nov 06 17:15:00 +0000 2019,"@Margie88096203 Hi Margie, We are sorry that our decision is not more favorable to you. Because the Description of Coverage varies based on the plan purchased, coverage varies, too. If you have any additional questions or concerns, please contact us socialmedia@travelguard.com. Thank you.",en,AIG
Wed Nov 06 17:14:55 +0000 2019,"@CTJDorsey Hi, we are sorry to hear about the frustration you've experienced. Would you mind emailing your policy/claim number, contact info (full name associated with policy/email/phone), and nature of your inquiry to socialmedia@travelguard.com so we can look into it? Thank you",en,AIG
Tue Nov 05 18:19:09 +0000 2019,"Congratulations to AIG’s CRO Alessa Quane who was awarded the Stuart A. Klugman Distinguished Alumni Award from @DrakeUniversity for her notable career as an actuary, mentorship of graduates in the industry and community outreach. 🏆 🙌 https://t.co/h72k53iGNO",en,AIG
Tue Nov 05 15:24:32 +0000 2019,"@The_Mrs_Kcp Hello Kacey, we are sorry to hear of your frustration. Please email us directly at CSU@aig.com so we can assist you with your concern as soon as possible.",en,AIG
Tue Nov 05 15:24:32 +0000 2019,"@PrisesaNazarita Hello Cess, please email us directly at CSU@aig.com and we would be happy to assist you with your concern.",en,AIG
Tue Nov 05 15:24:32 +0000 2019,"@pagetrimble Hi Page, we are sorry to hear of your frustration. Please email us directly at CSU@aig.com so we can assist you with your policy as soon as possible.",en,AIG
Mon Nov 04 21:58:43 +0000 2019,"RT @AIGemea: Great &amp; deserved recognition for AIG UK COO Geoff Godwin, in at No 42 on @OUTstandingiB’s list of 100 LGBT+ Executives!

Go he…",en,AIG
Mon Nov 04 21:58:00 +0000 2019,"RT @LegalExecutives: What's the best way to build strong, influential advisory relationships with clients? Lucy Fato, GC of @AIGinsurance o…",en,AIG
Fri Nov 01 15:16:56 +0000 2019,"@pianopop77 Hi, Please email your policy number, contact details (full name/phone/email), and a description of what you are seeking assistance with to socialmedia@travelguard.com so we can look into it. We apologize for the wait time. Thank you",en,AIG
Fri Nov 01 15:16:56 +0000 2019,"@RtHonDBarber Hello Darren, thank you for reaching out to us. Please email us at CSU@aig.com so we can help you directly.",en,AIG
Fri Nov 01 12:30:00 +0000 2019,"Our 3Q19 results are in line with our expectations, particularly in General Insurance, which demonstrated a significant improvement over the prior-year quarter. Life and Retirement continued to produce solid results. Join today's webcast at 9am ET: https://t.co/8tvhpLmz1s",en,AIG
Wed Oct 30 15:08:16 +0000 2019,"@YorgeyGirdy Hi, If you have additional questions or concerns, please contact us at socialmedia@travelguard.com. Thank you.",en,AIG
Fri Oct 25 19:01:52 +0000 2019,RT @GCH_Charity: Have you spotted our spooktacular hospital decorations?! 👻🎃 Huge thanks to our corporate volunteers from AIG and HSBC for…,en,AIG
Thu Oct 24 19:04:27 +0000 2019,"@triciaspellman1 Hello Tricia, we are sorry to hear of your frustration. Please email us at CSU@aig.com so we can assist you with your concern as soon as possible.",en,AIG
Thu Oct 24 11:04:00 +0000 2019,"RT @AIGemea: Kristof deBremme, AIG Global Head of Marine, discusses need for business to make a compelling case on the importance of rules-…",en,AIG
Wed Oct 23 13:34:05 +0000 2019,"RT @AIGemea: Last week in Brussels, the AIG Global Trade Series brought together policy-makers, business leaders, &amp; experts from think-tank…",en,AIG
Tue Oct 22 16:17:04 +0000 2019,Our AIG Canada colleagues made a return visit to help support the animals under the care of the Toronto Humane Society. #THSCorporateTeamDay #LifeatAIG https://t.co/pbDmJczWO8,en,AIG
Mon Oct 21 20:24:30 +0000 2019,"@S_gallego_057 Hello Steven, please email us at CSU@aig.com so we can assist you with your concern.",en,AIG
Sun Oct 20 11:43:00 +0000 2019,"RT @AIGemea: AIG's Bob Gagliardi &amp; Scot Reynolds highlight the advantages of “rent-a-captive” structures

The benefits of Cell Captives htt…",en,AIG
Sat Oct 19 15:44:00 +0000 2019,"RT @AIGemea: AIG’s Mark Camillo, Brian Botkin &amp;  Nuno Antunes share their views on creating a cross-border cyber policy, modelling risk wit…",en,AIG
Fri Oct 18 17:13:53 +0000 2019,"RT @AIGemea: While the climate case for renewables is undeniable and the economic case is becoming increasingly compelling, clean energy do…",en,AIG
Fri Oct 18 16:40:08 +0000 2019,@LilyoftheCoast We are very sorry to learn of your loss. Please contact us at 1-800-826-1300 or socialmedia@travelguard.com for further assistance. Thank you.,en,AIG
Fri Oct 18 16:40:01 +0000 2019,"@thinkrudy760 Hi Rudy, If you have additional questions or concerns, please contact us at socialmedia@travelguard.com. Thank you.",en,AIG
Thu Oct 17 19:03:59 +0000 2019,"@The_Obserwer Hi, Please email your policy/claim number and contact details (full name associated with claim/phone/email) to socialmedia@travelguard.com so we can further assist. Thank you.",en,AIG
Thu Oct 17 16:49:52 +0000 2019,"@LilyoftheCoast We are very sorry to learn of your loss.  If you have any additional questions or concerns, please contact us at 1-866-478-8222 or submit your request on the contact us form found here https://t.co/UR05X3V647. Thank you.",en,AIG
Thu Oct 17 11:59:00 +0000 2019,"RT @AIGemea: Speaking in Vienna last week, Lisa Sun, CEO, AIG China discussed BRI 2.0, the recent recalibration of the Belt &amp; Road Initiati…",en,AIG
Wed Oct 16 19:29:27 +0000 2019,"RT @AIGemea: Brian Botkin, AIG Financial Lines, joined a panel of leading experts last week to discuss financing &amp; insuring #BRI projects.…",en,AIG
Wed Oct 16 16:25:01 +0000 2019,"Our colleagues’ contributions have shaped who we are today and who we will become in the future. We’re honored to recognize our two longest-tenured employees, Ros McWhirter and Rebecca Hill, who have each been with us for 50+ years #LifeatAIG #EmployeeRecognition #MoreThan50Years https://t.co/BnnNeDO2R5",en,AIG
Tue Oct 15 17:22:40 +0000 2019,"Stay engaged and work towards the opportunities you want to pursue instead of waiting for them to be handed to you. That’s the advice panelists shared at a recent #HispanicHeritageMonth event co-hosted by AIG, Guy Carpenter, Marsh, Barclays and PwC. https://t.co/ypaPtMj7Re",en,AIG
Tue Oct 15 15:05:58 +0000 2019,"@on_lwd Hello Lisa, we are sorry to hear of your frustration. Please email us at CSU@aig.com so we can assist you regarding your claim as soon as possible.",en,AIG
Tue Oct 15 13:26:58 +0000 2019,"@smishychat Hello Anne, thank you for reaching out to us. Please email us at CSU@aig.com so we can remove your home email address from our contact list.",en,AIG
Mon Oct 14 19:48:50 +0000 2019,RT @jdickler: This week's @OnTheMoney with @sharon_epperson: Elder financial abuse is a multibillion-dollar problem (h/t Jennifer VanderVee…,en,AIG
Mon Oct 14 19:46:28 +0000 2019,"@Germurfturlough Hello, please contact us at GCMS@aig.com for assistance.",en,AIG
Mon Oct 14 15:02:53 +0000 2019,"@pavlos06 Hello, please accept our condolences for the passing of your grandfather. Please email us at CSU@aig.com so we can assist you as soon as possible.",en,AIG
Mon Oct 14 14:59:23 +0000 2019,"@kengheorge Hello Ken, we are sorry to hear of your experience. Please email us at GCMS@aig.com so we can assist you as soon as possible.",en,AIG
Fri Oct 11 21:03:05 +0000 2019,"@MrsBundrige Hello Mrs Bundrige, thank you for reaching out to us on Twitter. Please email us at CSU@aig.com so we can assist you with your concern as soon as possible.",en,AIG
Fri Oct 11 20:30:42 +0000 2019,RT @NYHomeless: We’re proud to recognize @AIGinsurance as our featured sponsor for the month of October. Thank you for helping us provide m…,en,AIG
Thu Oct 10 22:09:01 +0000 2019,Recognizing our past by ringing in our future at the @NYSE. #ClosingBell #StockMarket $AIG https://t.co/w9HoOuIY0R,en,AIG
