created_at,full_text,lang,user_name
Wed Nov 30 13:59:32 +0000 2016,"@edgarmartinezq Hola, te invitamos a escribirnos a wilson.sanchez@aig.com. Un integrante de nuestro equipo te dará el apoyo que necesites.",es,AIG
Tue Nov 29 18:49:20 +0000 2016,"@RochelleLWill Hi Rochelle, thanks for bringing this situation to our attention. Please email GCRS@aig.com ASAP and we will assist you.",en,AIG
Tue Nov 29 17:30:25 +0000 2016,This entrepreneur believes that the key to being innovative is having an open mind. Hear why: #GivingTuesday https://t.co/pQafZHM7X3,en,AIG
Tue Nov 29 17:10:51 +0000 2016,#GivingTuesday: Hear this entrepreneur's advice on leveraging innovation https://t.co/ic3cjgWDde,en,AIG
Tue Nov 29 16:45:26 +0000 2016,Hear how Patrick and his teammates used innovation in their award winning project at the AIG-sponsored Enactus World Cup #GivingTuesday https://t.co/k5EvBMV0Oz,en,AIG
Tue Nov 29 16:30:03 +0000 2016,By partnering with Enactus we're working toward creating a more sustainable future. Find out how: https://t.co/NF10XZdD2y #GivingTuesday https://t.co/l0Sv75WSZi,en,AIG
Tue Nov 29 15:02:23 +0000 2016,For #GivingTuesday we wanted to congratulate the 2016 Enactus World Cup winner! Hear what inspires them to innovate. https://t.co/DtTykz8Kbl https://t.co/P7sg5JktwS,en,AIG
Tue Nov 29 14:25:01 +0000 2016,#GivingTuesday: RT to support @Enactus students! See how this partnership can help create a better world for you: https://t.co/bPprBIqhQr https://t.co/rhQiqyQ1K5,en,AIG
Mon Nov 28 21:21:31 +0000 2016,"@WeTheConsumers Hello, please email us at GCRS@aig.com so we can advise on our options for homeowners.",en,AIG
Mon Nov 28 21:21:01 +0000 2016,"@eschne Hi Erik, we are sorry to hear of your situation. Please email us at GCRS@aig.com and we will contact you directly.",en,AIG
Mon Nov 28 19:26:01 +0000 2016,Discover how our diversity helps our people achieve success: https://t.co/0wDwOTVl1I https://t.co/xHi5fSpPxF,en,AIG
Mon Nov 28 16:57:10 +0000 2016,RT @PALNewYork: Big thanks to @AIGinsurance volunteers like Antionette &amp; daughter Jordan who took part in #FamilyVolunteerDay at PAL Harlem…,en,AIG
Mon Nov 28 14:33:01 +0000 2016,This #GivingTuesday we're honored to make a difference in the lives of others by partnering with @Enactus! https://t.co/nbmKvs1apz https://t.co/NTZpVUw5u5,en,AIG
Sun Nov 27 14:42:01 +0000 2016,"Together with Microsoft, we’re advancing cybersecurity in cloud computing. Learn more on this development: https://t.co/CmWX1ZUw5P https://t.co/te6TCpvuZ1",en,AIG
Sat Nov 26 14:15:02 +0000 2016,For #GivingTuesday we're sharing photos from @Enactus World Cup. RT to support creating good in the world! https://t.co/etfWs1ulBH https://t.co/5JhDta0Wi8,en,AIG
Fri Nov 25 17:13:01 +0000 2016,Great way to give thanks is to give back. Our employees are passionate about giving back to communities. Learn how: https://t.co/6XUtuJGcSE https://t.co/tkOXO0gR6V,en,AIG
Fri Nov 25 13:45:02 +0000 2016,"Innovation is central to what we do at AIG, which is why we're showcasing @Enactus this #GivingTuesday. Learn more: https://t.co/77It7vK3b9 https://t.co/yceirDTK4v",en,AIG
Thu Nov 24 19:55:01 +0000 2016,The average cost of a cyber breach was $3.79M in 2015. Explore how to mitigate cyber risks: https://t.co/1NqrzT0Pi7 https://t.co/RFouuJUprm,en,AIG
Thu Nov 24 14:02:01 +0000 2016,"From everyone at AIG, wishing you a happy and safe #Thanksgiving holiday! https://t.co/RQuuk5ZdhP",en,AIG
Wed Nov 23 17:37:38 +0000 2016,"@thatgrandmalife Hi Michelle, please contact us right away at our email GCRS@aig.com so we can assist you.",en,AIG
Wed Nov 23 17:16:58 +0000 2016,"@alexenlared Lamentamos lo sucedido, tu caso será atendido por email o puedes contactarnos al 01800 001 1300 y te atenderemos rápidamente.",es,AIG
Wed Nov 23 16:43:00 +0000 2016,Watch to learn how we're using robotics and automation to streamline the claims process: https://t.co/dtrKroq31e https://t.co/prXKLTftZf,en,AIG
Wed Nov 23 14:32:00 +0000 2016,RT @AIGemea: Proud to support @green4girls and encourage the next generation of future female #STEM leaders #g4gAIG,en,AIG
Wed Nov 23 13:58:39 +0000 2016,"@brp_runner28 Hi Briana, thanks for reaching out to us here. Please contact us at our email GCRS@aig.com so we can assist ASAP.",en,AIG
Tue Nov 22 22:05:33 +0000 2016,@Jds44415788 We are sorry to hear of your experience. Please contact us right away at our email GCRS@aig.com so we can assist you.,en,AIG
Tue Nov 22 19:15:02 +0000 2016,IoT helps a leading power company repair devices through the cloud instead of in the field. See how: https://t.co/uL6rJGk7An https://t.co/GJS0EiQbat,en,AIG
Tue Nov 22 15:33:02 +0000 2016,"Mark your calendars! 11/29 is fast approaching. Tell us, how will you give back on #GivingTuesday? https://t.co/mZ865alluK",en,AIG
Tue Nov 22 15:17:01 +0000 2016,"@CFOofHome Hi Rhonda, please email us at GCRS@aig.com so we can assist you with your password reset ASAP.",en,AIG
Tue Nov 22 15:04:26 +0000 2016,RT @holmesreport: #PRovoke16 Recap David May @AIGinsurance discusses the limitations of data https://t.co/8Ln039thwi https://t.co/Urp2gngAGd,en,AIG
Mon Nov 21 16:42:00 +0000 2016,RT @AIGemea: AIG Report: How do European #shareholder #classactions differ from those in the US? https://t.co/rz9KL6r1ck,en,AIG
Mon Nov 21 14:41:02 +0000 2016,"RT @AIGemea: Proud to support @EndeavourFund and provide opportunity for wounded, injured &amp; sick veterans to play wheelchair rugby with #Ma…",en,AIG
Mon Nov 21 13:59:02 +0000 2016,"See the pros and cons of the sharing economy, and learn how it's changing the way we travel: https://t.co/UNRnLUIPSG https://t.co/yw1bORX3Ji",en,AIG
Sat Nov 19 14:05:01 +0000 2016,Are you cyber secure? Start by rotating passwords regularly. Learn 9 more tips to help mitigate cyber risk now: https://t.co/9pfW2Tr4Ai https://t.co/AW4680IELj,en,AIG
Fri Nov 18 20:49:00 +0000 2016,"@StevenDAmbra Hi Steven, do you mind emailing GCRS@aig.com with more information about this call? We need more information to investigate.",en,AIG
Fri Nov 18 19:27:02 +0000 2016,See how our team in Japan earned a rating of 'Gold' in Japan’s first corporate #LGBT index: https://t.co/8sTLMYS3lU https://t.co/mSHU4Ehpns,en,AIG
Fri Nov 18 16:08:42 +0000 2016,"@MayerPacaDr Hi Mayer, please contact us at our email GCRS@aig.com ASAP so we can look into your situation and investigate.",en,AIG
Fri Nov 18 15:38:01 +0000 2016,"@DianePardes Hi Diane, no problem! Please email us at GCRS@aig.com so we can assist you with your Whirlpool warranty.",en,AIG
Fri Nov 18 15:38:01 +0000 2016,"@StevenDAmbra Hi Steven, thanks for the information. We will investigate.",en,AIG
Fri Nov 18 10:33:01 +0000 2016,AIG Japan’s First Women’s Development Program Class Participants Celebrate Their Final Graduation. Read more: https://t.co/mGN3AlNpyl https://t.co/lZDcc2Q7Ja,en,AIG
Thu Nov 17 17:00:32 +0000 2016,"@CindyInChicago Hello Cindy, no problem. Please contact us at our email GCRS@aig.com and we would be happy to assist you directly.",en,AIG
Thu Nov 17 17:00:18 +0000 2016,"@PaulKuharskyNFL Hi Paul, we're sorry to hear of your frustration. Please contact our email GCRS@aig.com so we can assist with your warranty",en,AIG
Thu Nov 17 16:52:01 +0000 2016,"Learn 5 tips to help women travel more safely, for business or pleasure: https://t.co/0qhzveuqkM https://t.co/VFXZ1pTJbl",en,AIG
Thu Nov 17 15:26:00 +0000 2016,"RT @Armanini1: @AIGinsurance Lex Baugh explains IoT Safety Dividend (every 15 seconds, 1 worker dies and 150 are injured) #GEMM16 https://t…",en,AIG
Wed Nov 16 21:22:01 +0000 2016,Prepare. Protect. Recover. These earthquake tips can help business in all three stages: https://t.co/QiabtdAOMf https://t.co/H8gYXP5wrX,en,AIG
Wed Nov 16 16:14:02 +0000 2016,How can we help get your claim paid more quickly and with less work? Find out here: https://t.co/A1GU3RGfTx https://t.co/dHECcpel59,en,AIG
Tue Nov 15 16:40:35 +0000 2016,@sculltec Hello. Drone insurance is offered in AIG UK. For more information: https://t.co/b1F47D45Ii or Contact: https://t.co/DUnAu9Z9le,en,AIG
Tue Nov 15 16:40:28 +0000 2016,@iamsmithy please send your claim number to socialmedia@travelguard.com and we will be in touch. Thank you.,en,AIG
Tue Nov 15 16:11:01 +0000 2016,These 5 tips can help you practice sustainability and save money while traveling:  https://t.co/urfqXG48GR https://t.co/uPtlbymAAZ,en,AIG
Mon Nov 14 23:45:02 +0000 2016,"This sale is a step forward in achieving AIG’s global strategy around clients, capabilities &amp; market opportunities: https://t.co/KMDd4htIqQ https://t.co/RMhxFqxP0F",en,AIG
Mon Nov 14 23:15:01 +0000 2016,We are focusing on growing the consumer &amp;  commercial property casualty insurance segment in Japan: https://t.co/LJaDoJajjH https://t.co/IIRL3riv5R,en,AIG
Mon Nov 14 23:12:34 +0000 2016,"Today we are announcing that AIG has agreed to sell its AIG Fuji Life Insurance Company, Ltd. (AFLI) to FWD Group: https://t.co/D5oIkLEYdz https://t.co/kSnSke9No8",en,AIG
Mon Nov 14 15:53:02 +0000 2016,We recognize talent. See how you can grow your skills and build your career with us: https://t.co/jska8zm6VC https://t.co/8PQDhpzcBW,en,AIG
Sat Nov 12 15:20:02 +0000 2016,"If working with a financial carrier, ask questions to ensure your clients' needs are met: https://t.co/3AKv4o7q68 https://t.co/s9XA1SUXqO",en,AIG
Fri Nov 11 18:53:56 +0000 2016,"@donmafelstroh Hi Manuel, please email GCRS@aig.com right away so we can look to resolve the issue regarding your policy in Colombia.",en,AIG
Fri Nov 11 18:48:02 +0000 2016,Our employees help each other to meet goals and reach their full potential. Find out how: https://t.co/lsCqKr68A0 https://t.co/r3j84Q99RW,en,AIG
Fri Nov 11 15:34:04 +0000 2016,"Hear how Carson Lyons, our Vice President for Aerospace, thinks innovation can help to enhance business operations: https://t.co/kPPV9HuueE https://t.co/IOZhmTtmik",en,AIG
Fri Nov 11 14:38:38 +0000 2016,"@_Paunae Yes, no problem. Please call us at 1-855-393-2244 (if located in U.S.)  or email us at GCRS@aig.com and we'll contact you directly",en,AIG
Fri Nov 11 14:01:01 +0000 2016,"AIG UK won two top prizes at the 2016 Insurance Insider awards ceremony, held at Old Billingsgate: https://t.co/MASSyFUkRc https://t.co/q6yi83g085",en,AIG
Thu Nov 10 22:17:01 +0000 2016,"@totorhogie Hello, please email us at GCRS@aig.com so we can see if we can make updates to your payment deadlines.",en,AIG
Wed Nov 09 21:36:01 +0000 2016,A major heavy machinery manufacturer is bringing farming into the IoT age. See how IoT is changing agriculture: https://t.co/oz7mxkZwCU https://t.co/B0L5qowjbN,en,AIG
Wed Nov 09 17:09:01 +0000 2016,@turnstile_blues Yes. Please reach out to 817.826.7132.  Thank you.,en,AIG
Wed Nov 09 17:08:35 +0000 2016,"@maccabeem Hi Maccabee, thanks for letting us know - please email us at GCRS@aig.com so we can assist you right away.",en,AIG
Tue Nov 08 23:51:31 +0000 2016,@arqnohikari Thank you for the note! We value our customers and are glad to hear that you are satisfied with your experience.,en,AIG
Tue Nov 08 21:02:02 +0000 2016,"Couture is far from ordinary, so average insurance may not protect it. See how we’re creating a new solution: https://t.co/vWsrkRrWEQ https://t.co/DmqAkCyoga",en,AIG
Mon Nov 07 21:33:02 +0000 2016,Here's how we used advanced analytics to help a major hotel chain reduce their lost costs: https://t.co/8oDxObKrbg https://t.co/vFYpGiNoi0,en,AIG
Sat Nov 05 14:56:02 +0000 2016,"Find out from Carson Lyons, our Vice President for Aerospace, how drones can help businesses: https://t.co/gK69uGewqX https://t.co/gyrozBrg3K",en,AIG
Fri Nov 04 21:07:01 +0000 2016,"When you collect one-of-a-kind couture, how can you protect it? Learn more here: https://t.co/MGOJRtCFzN https://t.co/AsYIheMyqq",en,AIG
Fri Nov 04 20:29:52 +0000 2016,"@fairlenb Hello Fairlen, please email us at GCRS@aig.com so we can assist you right away with your current situation.",en,AIG
Fri Nov 04 19:11:37 +0000 2016,RT @AIGRugby: Proud to announce the extension of this award-winning partnership! https://t.co/aCWVykXvmS,en,AIG
Fri Nov 04 17:16:13 +0000 2016,"Our Pro Bono Program has partnered with 100+ organizations, donating over 8K hours in 10 cities. Learn more: https://t.co/shKZDisQI8 https://t.co/tIFfmk2b8w",en,AIG
Thu Nov 03 15:59:01 +0000 2016,@ryan_not_brian sorry you're frustrated. We are happy to clarify coverage boundaries in our description of coverage anytime. 800.826.1300,en,AIG
Thu Nov 03 13:40:01 +0000 2016,"@totorhogie Hi, please contact us at our email GCRS@aig.com and we would be happy to assist you with your policy.",en,AIG
Wed Nov 02 21:34:58 +0000 2016,"@MayerPacaDr Hi Mayer, thanks for reaching out to us. Please email us at GCRS@aig.com and we will reach out to you directly to assist you.",en,AIG
Wed Nov 02 13:13:01 +0000 2016,What does Matt love about his job? Building partnerships &amp; seeing new perspectives. Learn more about roles at AIG: https://t.co/FTNWOlhzta https://t.co/u2zzHNErjf,en,AIG
Tue Nov 01 21:03:01 +0000 2016,"@stephmyra Hi Stephane, please email us at GCRS@aig.com so we can assist you with your policy ASAP.",en,AIG
Tue Nov 01 16:16:01 +0000 2016,Having a plan in place before an earthquake can help to improve one's safety. Learn how: https://t.co/mCL0e0p6Gt https://t.co/D7tKj0OSUO,en,AIG
Mon Oct 31 18:18:03 +0000 2016,"@TDJohnson89 Hi Todd, thanks for reaching out. Please contact us at our email GCRS@aig.com and we will be happy to look into your warranty.",en,AIG
Mon Oct 31 18:14:37 +0000 2016,"@jeh4278 Hi Jim, please email us at GCRS@aig.com so we can help you with your claim regarding your Whirlpool Appl policy  ASAP.",en,AIG
Mon Oct 31 18:14:01 +0000 2016,"@leafseeker Hi, we are sorry to hear of your frustration. Please email us at GCRS@aig.com and we will be happy to assist you.",en,AIG
Mon Oct 31 13:56:01 +0000 2016,Today's financial risks are complex. Learn how to help protect your firm's financial health: https://t.co/jNs2Y7mAIb https://t.co/nQKS8QNz89,en,AIG
Sun Oct 30 16:41:01 +0000 2016,Live in a tornado-prone area? Check out these tips to help successfully weather a storm. https://t.co/KftIrArXsc https://t.co/w9KDZJvr1R,en,AIG
Sat Oct 29 16:35:01 +0000 2016,"Prior to storm season, identify and address vulnerabilities to help stay safer. Learn how: https://t.co/dXnABAtfqw https://t.co/K6ivMOXdPM",en,AIG
Fri Oct 28 21:50:01 +0000 2016,Owners of couture may worry about keeping items pristine. Here’s how we can help bring peace of mind: https://t.co/cqLxW3MHv7 https://t.co/ocnSCQzAsW,en,AIG
Fri Oct 28 17:58:01 +0000 2016,"At the 2016 CLIO Sports Awards, AIG won a Gold Award for the Haka 360 Experience. Learn more: https://t.co/7uMRjjUQQG https://t.co/1TE3xywWLI",en,AIG
Fri Oct 28 14:42:01 +0000 2016,"New efficiency, predictive analytics, and better troubleshooting. See how IoT can drive results for your business: https://t.co/Okv4LPMVr9 https://t.co/Tbfgy7mZCj",en,AIG
Thu Oct 27 14:37:02 +0000 2016,"@nrmps4 Hi Natalie, Please have your mother contact us at our email GCRS@aig.com and we would be happy to assist her.",en,AIG
Thu Oct 27 12:31:01 +0000 2016,"Social networks are new, but crowdsourcing has long history. An example of crowdsourcing from 1714 may surprise you: https://t.co/uTe1S2Eh7b https://t.co/3zbQ3lWeRO",en,AIG
Wed Oct 26 21:43:01 +0000 2016,See how we're helping people preserve the long-term value of their collectible garments &amp; accessories: https://t.co/Yby8J7oZCR https://t.co/0nRVZ5bHBY,en,AIG
Wed Oct 26 15:10:02 +0000 2016,"Some trucks you see on the road may be safer and more efficient, thanks to IoT technologies. See the possibilities: https://t.co/LbNC5QZICx https://t.co/2u9x1E4LWB",en,AIG
Tue Oct 25 23:36:01 +0000 2016,"Watch this video to meet Simone, and find out why she feels collaboration is AIG’s strength: https://t.co/5zBgBs7ayz https://t.co/u1jiEwHDZC",en,AIG
Tue Oct 25 21:45:23 +0000 2016,"RT @holmesreport: Julia Pawling @AIGinsurance adds ""you also have to question the methodology for creating the data"" #PRovoke16 #USElection…",en,AIG
Tue Oct 25 19:03:36 +0000 2016,"RT @holmesreport: David May @AIGinsurance continues ""but most people will use data to reaffirm their opinion regardless of the source"" #PRo…",en,AIG
Mon Oct 24 20:26:40 +0000 2016,"@MayerPacaDr Hi Mayer, thank you for bringing this to our attention. Please email us at GCRS@aig.com so we can assist you right away.",en,AIG
Mon Oct 24 20:26:37 +0000 2016,"@_lubrimaster Hi, no problem - please email us at GCRS@aig.com and we would be happy to assist you with renewing your insurance policy.",en,AIG
Mon Oct 24 20:12:02 +0000 2016,We're working together to innovate insurance. Watch this video to see how our Innovation Boot Camps work: https://t.co/IjbE4nGLq4 https://t.co/yqo7Es2dOU,en,AIG
Mon Oct 24 16:56:01 +0000 2016,Find out how we are leveraging crowdsourcing to help build a safer future: https://t.co/RNdsbijF59 https://t.co/hyX3WtFDit,en,AIG
Mon Oct 24 16:01:48 +0000 2016,RT @AIGRugby: The @AllBlacks have broken the world record!! #NZLvAUS https://t.co/1SlXL7hxbu,en,AIG
Sat Oct 22 17:38:01 +0000 2016,High fashion is crafted by highly skilled hands. Here's how couture owners can better protect this craftsmanship: https://t.co/7zmvZA1FKU https://t.co/AEjutUuafB,en,AIG
Fri Oct 21 23:18:01 +0000 2016,Communication and collaboration are necessary when you want to harness IoT. Here’s why: https://t.co/SoRFf20zbs https://t.co/zeBQzmMlto,en,AIG
Fri Oct 21 13:40:01 +0000 2016,The Insurance Post named our UK team Commercial Lines Claims Team of the Year. See why expert service is in our DNA: https://t.co/p21iMMe0Fc https://t.co/1B23V7PClH,en,AIG
Thu Oct 20 18:51:28 +0000 2016,@zuipoh Hello. Please email us at GCRS@aig.com and so we can look into your claim.,en,AIG
Thu Oct 20 18:45:14 +0000 2016,"Find out more about steps you can take to prepare for a hurricane, tornado or tropical storm. Watch the webinar now: https://t.co/pgkBIAf6CD https://t.co/Vph5vwhytZ",en,AIG
Thu Oct 20 15:16:25 +0000 2016,"@Data_Writer Hi Joe, we are sorry to hear of your experience. Please email us at GCRS@aig.com so we can reach out to you directly to assist.",en,AIG
Thu Oct 20 13:45:06 +0000 2016,"To boost your cyber security, avoid sharing personal information online. Get more tips here: https://t.co/dLrfuHg57c #cybersecuritymonth https://t.co/JyzjrSsBZO",en,AIG
Wed Oct 19 21:10:43 +0000 2016,"@elenagoldina7 Hi Elena, no problem - please email us at GCRS@aig.com and we would be happy to assist you with creating your online account.",en,AIG
Wed Oct 19 19:46:01 +0000 2016,Could crowdsourcing help researchers gather insights into cancer more rapidly? Find out here: https://t.co/9VFpWtQaA7 https://t.co/FlwVrpZvSJ,en,AIG
Wed Oct 19 14:02:02 +0000 2016,IoT tech is bringing new connectivity and efficiency to the world’s maritime industry. Learn how: https://t.co/4rUdQiuALJ https://t.co/M97bcF90cW,en,AIG
Tue Oct 18 22:41:32 +0000 2016,"@MarisDavis Hi, please contact us at our email GCRS@aig.com so we can look into your premium charge.",en,AIG
Tue Oct 18 12:47:16 +0000 2016,Fairfax will become our main strategic multinational network partner serving our global clients in certain countries https://t.co/fFTvYWdt7x https://t.co/JnHNjrvbmz,en,AIG
Tue Oct 18 12:36:57 +0000 2016,We are focusing our resources in markets where we are able to provide market leading products. Learn more: https://t.co/4rthJkpgIR,en,AIG
Tue Oct 18 12:35:02 +0000 2016,AIG is creating a simplified organization positioning us to achieve our global strategy. Learn more here: https://t.co/EFJZfzGZTE https://t.co/KkkZrhWvG2,en,AIG
Mon Oct 17 21:06:31 +0000 2016,@praveenmpkl2 Thanks for reaching out. Pls email your claim number to socialmedia@travelguard.com so we can look into it.,en,AIG
Mon Oct 17 21:06:31 +0000 2016,"@valuepointorg Hello, please contact us at our email GCRS@aig.com so we can assist you with your policy.",en,AIG
Mon Oct 17 18:43:01 +0000 2016,"Personal cyber risks can take many forms, from phishing to bullying. Find our advice here: https://t.co/1J4yazYtlc #cybersecuritymonth https://t.co/nxtr1VWoSh",en,AIG
Mon Oct 17 17:22:01 +0000 2016,Proactive protection is key to maintain your couture and designer fashion collections. Learn how we can help: https://t.co/aHo8Srwoku https://t.co/PA0Cavf0Cq,en,AIG
Mon Oct 17 13:21:01 +0000 2016,"@leedwane Hi Lee, thanks for reaching out. Please contact us at our email GCRS@aig.com so we can help.",en,AIG
Mon Oct 17 13:14:30 +0000 2016,"@Jaianand1407 Hello, please contact us at our email GCRS@aig.com so we can help you right away with your claim inquiry.",en,AIG
Mon Oct 17 13:14:03 +0000 2016,"@RanbirBisht Hello Ranbir, please contact us at our email GCRS@aig.com so we can help you with your claim in Ireland.",en,AIG
Mon Oct 17 12:00:03 +0000 2016,Cyberattacks can be costly. See how you can help prepare your company to overcome cyber risks: https://t.co/tAfaaGRx3N #cybersecuritymonth https://t.co/eFov1SpRqA,en,AIG
Sat Oct 15 18:08:01 +0000 2016,Hoping your company can sponsor a sports team? Learn how you can develop a partnership: https://t.co/6j2yOQClxC https://t.co/7rBjWTDOAl,en,AIG
Fri Oct 14 19:02:01 +0000 2016,"As it begins to transform the world, IoT tech is helping companies transform their business models. Discover how: https://t.co/4dT4U4a5Cq https://t.co/wD3SexJgV3",en,AIG
Fri Oct 14 12:49:01 +0000 2016,AIG Global Head of Sponsorship Daniel Glantz recognized at @LeadersBiz #Under40Awards in London. Read more: https://t.co/ZVC4GpULYa https://t.co/mSt7xcOs1r,en,AIG
Thu Oct 13 21:37:01 +0000 2016,Interested to learn how crowdsourcing is changing the world? Learn more here: https://t.co/p4AoiRuFWW https://t.co/TOdCBhIxSC,en,AIG
Thu Oct 13 21:32:00 +0000 2016,"@jerry_odhiambo Hi Jerry,  please contact us at our email GCRS@aig.com so we can look to possibly resolve your claim ASAP.",en,AIG
Thu Oct 13 16:27:01 +0000 2016,Our employees see a world of possibilities. Hear why they're excited about what this can mean: https://t.co/MRfg7NGAnG https://t.co/Z67gaI1dyO,en,AIG
Wed Oct 12 20:07:01 +0000 2016,Learn how we are creating a culture of innovation: https://t.co/lgkmIa1dgH https://t.co/Tqoy65aSrN,en,AIG
Wed Oct 12 16:49:02 +0000 2016,These 5 simple tips can help enhance your business' cybersecurity: https://t.co/6jRl9V59xc https://t.co/mUI5MS3WC9,en,AIG
Tue Oct 11 20:55:28 +0000 2016,"@rdr_id Hello, please contact us at our email GCRS@aig.com so we can assist you with your purchase if needed.",en,AIG
Tue Oct 11 20:29:01 +0000 2016,How do collectors of couture and designer clothing protect these investments? Find out here: https://t.co/SLPrXYFTIu https://t.co/vjRI5AnepS,en,AIG
Tue Oct 11 13:58:01 +0000 2016,How can companies quickly improve their operations? The Internet of Things can help. Find out more here: https://t.co/xuebZ11MoB https://t.co/GR1MB3L4ge,en,AIG
Fri Oct 07 22:35:01 +0000 2016,"From solving problems in medicine to helping governments, here’s how crowdsourcing is changing the world: https://t.co/4hwO6QnPnw https://t.co/sZaqwn2mJB",en,AIG
Fri Oct 07 16:33:01 +0000 2016,"CFO Magazine just named our Chief Financial Officer, Sid Sankaran, a CFO to Watch in 2017. Find out why: https://t.co/o24vojmpOu https://t.co/WhmbbVF2Tt",en,AIG
Fri Oct 07 13:06:01 +0000 2016,IoT wearables can help improve workers’ safety in danger zones such as construction sites. Find out how: https://t.co/rzmLKBvdQS https://t.co/ceuQVnoUQh,en,AIG
Thu Oct 06 20:50:41 +0000 2016,"@BiblicalBowhntr Hi Rustin, please contact us at our email GCRS@aig.com so we can look to possibly expedite your claim.",en,AIG
Thu Oct 06 20:50:01 +0000 2016,Coming to work should inspire you. Discover why these employees chose our firm: https://t.co/A0wUXxSrdw https://t.co/UwU2FvYLpj,en,AIG
Wed Oct 05 21:14:00 +0000 2016,"@marknewton1985 Hi Mark, we are sorry to hear of your frustration. Please contact us at our email GCRS@aig.com &amp; we would be happy to assist",en,AIG
Wed Oct 05 16:22:01 +0000 2016,Does your couture collection have the right protection? You might be surprised. Find out more: https://t.co/HY0McBt1vT https://t.co/qvd8GpfIaG,en,AIG
Tue Oct 04 21:04:01 +0000 2016,"@KyleTreasure Hi Kyle, please contact us at our email GCRS@aig.com and we would be happy to contact you directly.",en,AIG
Tue Oct 04 20:07:01 +0000 2016,The rise of #IoT will dramatically transform the industries of today. Learn how. https://t.co/elLVzdJdYL https://t.co/eZJmOTQCUO,en,AIG
Tue Oct 04 15:47:01 +0000 2016,Find out how governments are leveraging crowdsourcing to create change: https://t.co/Z4CrEZ6fp7 https://t.co/uJ65XYwWyn,en,AIG
Tue Oct 04 14:22:01 +0000 2016,"@sundishine2 Great to hear, Sundi! Thanks for joining us.",en,AIG
Tue Oct 04 14:22:01 +0000 2016,"@deanpeters Hi Dean, thanks for reaching out. Please contact us at our email GCRS@aig.com so we can assist with your death certificate query",en,AIG
Tue Oct 04 14:21:32 +0000 2016,"@Scabsaver Hi Zo, please contact us at our email GCRS@aig.com so we can look into the quote that you were priced.",en,AIG
Tue Oct 04 14:21:31 +0000 2016,"@mike34747 Hi Mike, No problem - please contact us at our email GCRS@aig.com and we would be happy to assist you with your claim.",en,AIG
Tue Oct 04 14:21:31 +0000 2016,@gm_richards Please contact us at our email GCRS@aig.com and we will be happy to assist you with your payment.,en,AIG
Mon Oct 03 20:36:01 +0000 2016,Here's how technology is helping our teams pay your claims faster &amp; enhance sustainability: https://t.co/HSrvKfUxcJ https://t.co/io7kOjrI74,en,AIG
Mon Oct 03 12:45:02 +0000 2016,The impact of a cyber breach on your business may go far beyond losing data. Find out more: https://t.co/KpNE127RMD #cybersecuritymonth https://t.co/90oOoFwRPJ,en,AIG
Sun Oct 02 19:51:01 +0000 2016,A big thank you to our employees for giving to @NYHomeless via @DoughnutPlantNY purchases. Learn more ways we give: https://t.co/yy9PYrtOsr https://t.co/9Vt5TJZUqa,en,AIG
