created_at,full_text,lang,user_name
Thu Nov 30 14:29:02 +0000 2017,"“We are delighted to offer New York’s first fixed annuity with a guaranteed living benefit,” said Bryan Pinsky, Senior Vice President, Individual Retirement at AIG. Find out more: https://t.co/f8Wq05GegO https://t.co/pzdb0hc1JJ",en,AIG
Wed Nov 29 16:19:10 +0000 2017,@josh_odgers Thanks for reaching out. Pls email your claim number to socialmedia@travelguard.com so we can look into it.,en,AIG
Wed Nov 29 14:00:04 +0000 2017,"The WannaCry malware attack affected over 29K firms across China. Now, we’re seeing a significant increase in demand for cyber protection: https://t.co/lXPfeM5rmw https://t.co/hp8INGGDxt",en,AIG
Tue Nov 28 22:00:01 +0000 2017,Volunteering is an impactful way to make a difference on #GivingTuesday. Our colleagues can use two days of Volunteer Time Off per year to help their local communities. https://t.co/BK5qdyaVGw,en,AIG
Tue Nov 28 20:00:03 +0000 2017,"Our colleague, Helen, regularly volunteers at a cage free, no kill animal shelter for cats and kittens rescued from the streets of New York and from kill shelters. This year, the shelter has found forever homes for over 275 cats and kittens. #GivingTuesday https://t.co/LVfXliEabJ",en,AIG
Tue Nov 28 18:00:03 +0000 2017,"Our colleague, Alexandria, used her Volunteer Time Off to advocate and fight the stigma of animal shelters and encourage people to adopt, not shop for pets. “Volunteering is a rewarding and fun way to give back,” she said. #GivingTuesday https://t.co/NxhsvBGjFT",en,AIG
Tue Nov 28 16:15:05 +0000 2017,"Cyber threats are designed to spread indiscriminately, making any one person or institution a potential victim if improperly prepared. https://t.co/Yw17vcwEhS https://t.co/dhSyy25QJ9",en,AIG
Tue Nov 28 13:23:22 +0000 2017,RT @AIGIreland: We are delighted to have won the double last night at the 2017 Irish Sponsorship Awards! Best Sponsorship Brand and Best Sp…,en,AIG
Tue Nov 28 13:00:02 +0000 2017,"Our colleague, Elizabeth, traveled to South Africa to help rehabilitate orphan baby baboons. Her hard work and care ensured that they are ready to be introduced to their new surrogate families. #GivingTuesday https://t.co/xDnOEL9ZE9",en,AIG
Mon Nov 27 22:21:45 +0000 2017,"Hackers use ransomware to destroy data, leaving companies unable to operate and resulting in a loss of revenue. Learn how hackers are disrupting supply chains: https://t.co/OBihP4M9if https://t.co/LDNpOA4Tq9",en,AIG
Mon Nov 27 21:15:21 +0000 2017,It's #CyberMonday! Check out these quick tips to ensure you shop for the best deals safely today. https://t.co/kTx5Yks5sS https://t.co/EtlEABxFxH,en,AIG
Mon Nov 27 15:26:53 +0000 2017,"@DarrylGibney Hi Darryl, please contact us at our email GCRS@aig.com for assistance with providing a copy of your driver's license.",en,AIG
Mon Nov 27 15:23:31 +0000 2017,"@davemcgrath123 We are sorry to learn that this happened to you but happy to learn you recieved a refund. If you have additional questions we are available anytime at  0800 655 722
or traveladminnz@aig.com",en,AIG
Mon Nov 27 15:23:01 +0000 2017,@NjmEngelbrecht Sorry to learn of your frustration. Happy to assist with questions or concerns anytime at 1.800.826.1300.,en,AIG
Mon Nov 27 15:00:03 +0000 2017,Our people worked with @taprootfound to provide advice to 9 non-profits and help them work more effectively to achieve their goals. Check out the other volunteer activities we've participated in over the year! #GivingTuesday https://t.co/UfnCXVPa77 https://t.co/LbQFinp6mZ,en,AIG
Sun Nov 26 23:00:01 +0000 2017,Be cyber secure when shopping online tomorrow. Check out these quick tricks to ensure you shop for the best deals safely. https://t.co/LleifU0QnG https://t.co/8QNBQGOOCt,en,AIG
Sat Nov 25 18:00:03 +0000 2017,Be mindful of cybersecurity threats this Cyber Monday. https://t.co/kTx5Yks5sS https://t.co/8D04koXF8C,en,AIG
Sat Nov 25 18:00:02 +0000 2017,"Our partnership with @enactus helps us use the power of entrepreneurial action to transform lives and shape a better, more sustainable world. #GivingTuesday https://t.co/KNHsId8Yrs",en,AIG
Fri Nov 24 18:00:15 +0000 2017,"Thank you to our team in Puerto Rico, who have been tirelessly helping the community rebuild in the aftermath of Hurricane Maria. https://t.co/YmUvgmxD8D",en,AIG
Fri Nov 24 13:00:02 +0000 2017,What makes the biggest difference when protecting yourself or your company from a cyberattack? Find out: https://t.co/9Igg9zpvpJ https://t.co/9RyLaUH7p0,en,AIG
Thu Nov 23 20:00:32 +0000 2017,"This Thanksgiving, we’re thankful for our AIG teammates who banded together to help each other and our clients in the face of natural disasters. From all of us at AIG, we wish you and your family a happy and safe holiday. https://t.co/TRtgY6072o",en,AIG
Thu Nov 23 18:00:03 +0000 2017,"Whether it’s football or rugby, Thanksgiving day sports are a must! The @AllBlacks spent time coaching rugby skills and drills to kids at our Rugby Family Day in London. How are you spending time outside today? https://t.co/oO355QZqcI",en,AIG
Thu Nov 23 15:00:07 +0000 2017,Our colleagues prepared and served Thanksgiving dinner to the homeless community with @NYCRescue. We’re thankful for our people and their willingness to care for others. #GivingTuesday https://t.co/CKkFZeDQSi,en,AIG
Wed Nov 22 20:00:04 +0000 2017,"By the end of the year, our people will have packed more than 200K meals with @Rise2030, helping feed over 1.6K people in over six countries. #GivingTuesday https://t.co/gJnzLcvYO0",en,AIG
Wed Nov 22 18:00:06 +0000 2017,"Congratulations to Julia Pawling, on AIG’s Brand Marketing team, one of Gramercy Institute’s 20 Rising Stars in Financial Marketing. https://t.co/EVYEnoLYU8 https://t.co/RYidC9Qs3j",en,AIG
Wed Nov 22 15:16:01 +0000 2017,@ach0w Thanks for the suggestion. We will pass this along to the appropriate team for review.,en,AIG
Wed Nov 22 13:30:02 +0000 2017,Europe’s new 2018 regulations will protect consumers’ data in ways that may affect you and your business. Increase your cyberawareness now: https://t.co/Xe8KaYY1dV https://t.co/B1d5cx7AgW,en,AIG
Tue Nov 21 21:30:01 +0000 2017,"Our people are joining the #GivingTuesday movement, donating their time and talents to help each other and their communities. Check out our volunteer efforts over the past year: https://t.co/boy1DUOuKu https://t.co/glWkvSCVYH",en,AIG
Tue Nov 21 20:00:04 +0000 2017,Recent cyberattacks have wreaked havoc inside and outside the workplace. Find out how you can better prepare yourself and your business: https://t.co/w9PVbXtRB3 https://t.co/yjysblsNNv,en,AIG
Tue Nov 21 16:03:00 +0000 2017,"@icpspain Hi, please email us directly at GCRS@aig.com so we can assist you.",en,AIG
Mon Nov 20 20:00:02 +0000 2017,"The integration of machine-learning into our digital infrastructure is positively impacting our people and the industry, and we’re just getting started. Read about our #CIO100 award win and how we’re strengthening our technology: https://t.co/a0BmPbJu4t https://t.co/ixlouz8tQD",en,AIG
Mon Nov 20 14:28:50 +0000 2017,"@Zarful Hello, please email us at GCRS@aig.com and we will be happy to assist you with your auto claim.",en,AIG
Mon Nov 20 13:15:01 +0000 2017,"Over the year, we've witnessed dramatic data breaches and cyberattacks that have impacted the entire U.S., and they aren't slowing down. Is your business ready? https://t.co/qPnETpRl8p https://t.co/ZeCxkdPAIt",en,AIG
Sun Nov 19 15:00:04 +0000 2017,"The world’s “fastest game on grass” returns to the iconic @fenwaypark with the AIG Fenway Hurling Classic and Irish Festival, featuring four of the most prominent Hurling teams in the world vying for the Player’s Champions Cup. #AIGFenwayHurling https://t.co/JAOIYkdi4M",en,AIG
Sat Nov 18 18:00:02 +0000 2017,A national study found that tolerance of insurance fraud is one reason that the crime persists. Public awareness may help deter fraudsters and keep everyone’s premium costs down. Report insurance fraud when you see it. #fraudweek https://t.co/MZwJEE5e1Q https://t.co/gYKZuj4rOJ,en,AIG
Sat Nov 18 16:00:06 +0000 2017,RT @fenwaypark: #AIGFenwayHurling is back this Sunday! 4 teams. 1 🏆 https://t.co/rh2zcclP1q,en,AIG
Fri Nov 17 20:00:04 +0000 2017,"Outstanding leadership in the STEM fields earned Rose Marie Glazer, VP, Corporate Secretary and Deputy General Counsel at AIG, the honor as one of the 20 Most Influential Hispanics in Technology. https://t.co/50WdI03py3 https://t.co/6of8UjPynM",en,AIG
Fri Nov 17 18:01:01 +0000 2017,The right tools and techniques can dramatically reduce your vulnerability to cyberattacks. Find out how: https://t.co/5MSHmKj2C8 https://t.co/E3emHuSd4V,en,AIG
Fri Nov 17 14:15:01 +0000 2017,"“It’s in everybody’s best interest to be diligent and combat fraud,” Tim Gladura, AIG’s Head of Global Claims Services. Learning about these crimes and speaking up can help create a safer, more honest environment in your business and community. #fraudweek https://t.co/T9Kf6HPios https://t.co/UgGlh4L8uf",en,AIG
Thu Nov 16 21:30:04 +0000 2017,"3-D laser technology can help construction companies mitigate high-risk scenarios. Tom Grandmaison, AIG Energy and Construction Lead, discusses how innovative tech is helping fuel the construction industry: https://t.co/ZnSaQ8OkWb https://t.co/6q9mXyHtfz",en,AIG
Thu Nov 16 20:05:01 +0000 2017,"As cyber risk expands, so does our coverage. See how our policies can help you address increased cyber exposure. https://t.co/myimNVrIQu https://t.co/YxeSeRfgsd",en,AIG
Thu Nov 16 18:00:04 +0000 2017,"Our people helped deliver more than 150K meals to our NYC neighbors, and we’re not stopping there. Discover the other ways we’ve been working with @NYHomeless  to give back to the community: https://t.co/I42V1JxPtZ https://t.co/R0MdWpVoAs",en,AIG
Thu Nov 16 16:16:04 +0000 2017,Join us for the @nyutandon Cybersecurity Lecture Series to hear an expert panel discuss hacking of electoral systems and how major political parties deal with cybersecurity issues. #TechInService2Society https://t.co/2vqSF37UZr https://t.co/v8ySuGZ4t1,en,AIG
Thu Nov 16 13:15:01 +0000 2017,Did you know? The most common form of insurance fraud is misrepresentation of losses. See how we’re using data science and advanced analytics to help detect and deter fraudsters. #fraudweek https://t.co/qshV7tAsOa https://t.co/mFgnrXGqIy,en,AIG
Wed Nov 15 18:00:03 +0000 2017,"We’ve seen an 87% jump in interest in cyber insurance information in Greater China. Our two new cyber insurance products are designed to address key cyber risks in Asia, such as data breaches and social engineering fraud. https://t.co/IstrF2nDom https://t.co/aiDjR81a1E",en,AIG
Wed Nov 15 17:08:45 +0000 2017,@jpadmen12 we are sorry to hear about the frustration you've experienced. We'd like to learn more at socialmedia@travelguard.com.,en,AIG
Wed Nov 15 16:20:02 +0000 2017,We're proud to help communities in Japan rebuild and protect against future disasters: https://t.co/emuopkAgpq https://t.co/qWpE8e5T66,en,AIG
Tue Nov 14 20:00:03 +0000 2017,"Listen to the music that drives the world’s number one rugby team to success. The @AllBlacks collaborated with @AppleMusic to deliver five exclusive playlists, curated by the players themselves, for their fans. https://t.co/AkqgLrcZva https://t.co/tUs4x26jJc",en,AIG
Tue Nov 14 19:01:00 +0000 2017,"@EdmonRakipi Hello Edmon, we are sorry to hear of your frustration, please email us at GCRS@aig.com so we can assist you.",en,AIG
Tue Nov 14 18:00:05 +0000 2017,Fraud costs affect premiums. That’s why we’re participating in Fraud Awareness Week with educational events around the globe. #fraudweek https://t.co/8MZ0Znm0Xe https://t.co/uhm1kzMIBm,en,AIG
Mon Nov 13 20:00:02 +0000 2017,Come check out the experiences that put AIG on @Glassdoor's 2017 list of Cool Companies Hiring Interns. https://t.co/AYwlQszGFD https://t.co/xgcHj7AgXG,en,AIG
Mon Nov 13 16:00:09 +0000 2017,Pro Bono work helps people and businesses grow. Learn about our employees' volunteer efforts in the community: https://t.co/aBOSILWoZE https://t.co/POvXxikB6o,en,AIG
Mon Nov 13 16:00:08 +0000 2017,"Volunteers planted trees to rebuild the Tohoku forests in Japan, creating barriers to protect from future disasters. https://t.co/xzZBWqsCMm https://t.co/s2FBQzxcSI",en,AIG
Fri Nov 10 22:47:52 +0000 2017,@GOTHATAWAY Please contact us at our email GCRS@aig.com and we will be happy to assist you.,en,AIG
Fri Nov 10 20:00:03 +0000 2017,Businesses in Asia-Pacific may be vulnerable to cyberattacks. Find out why. https://t.co/1Ul2CS4z17 https://t.co/mKpnbKpVPS,en,AIG
Fri Nov 10 15:45:00 +0000 2017,@MEBirt3 We are so glad things turned out well for you and are happy to have been of assistance. Thanks for sharing! Happy and safe future travels to you!,en,AIG
Thu Nov 09 21:00:02 +0000 2017,We're partnering with @ACPUSA to mentor returning military personnel after they leave the service. https://t.co/HiNMCyXumT https://t.co/u8WHck5Djz,en,AIG
Thu Nov 09 18:57:06 +0000 2017,"@BlakeHanna9 Hi Blake, please email us directly at GCRS@aig.com and we will be happy to look into your issue and provide possible resolution.",en,AIG
Thu Nov 09 15:30:01 +0000 2017,What happens online can have very real consequences offline. Learn more: https://t.co/IVBQ26jIj5 https://t.co/qKAauzykJp,en,AIG
Thu Nov 09 11:24:00 +0000 2017,RT @AIGemea: Anthony Baldwin &amp; team celebrate winning Global Programme Initiative of the Year at @ComRiskOnline Awards #erma17 #Blockchain…,en,AIG
Wed Nov 08 18:26:59 +0000 2017,"“We are really excited to partner with @PIMCO” Todd Solash, President, Individual Retirement. Find out more: https://t.co/964AV0HPyn https://t.co/TgR2dThZ4o",en,AIG
Wed Nov 08 18:00:02 +0000 2017,"Jeff Rutledge, CEO of AIG Travel, dissects the impact of geopolitical events on travel risk with @skift: https://t.co/Zn1UUiRVHV https://t.co/QS8XtS20gs",en,AIG
Wed Nov 08 16:30:01 +0000 2017,178 million IoT devices can be hacked in the 10 largest US cities alone—see the most vulnerable systems. https://t.co/K7VsLHg5i6 https://t.co/jj5Wv8lA6i,en,AIG
Wed Nov 08 15:50:01 +0000 2017,"@Coach__Kerr Hi Bill, please email us directly at GCRS@aig.com so we can assist you with your life insurance claim.",en,AIG
Tue Nov 07 20:00:02 +0000 2017,Take steps to lower your risk of a cyber attack by making a few simple changes. Find out how to stay protected: https://t.co/jynAPrJBcD https://t.co/dZuvfpcpbO,en,AIG
Tue Nov 07 16:00:03 +0000 2017,Our team in Nashville assembled health kits for local community members with @nashvillecares. https://t.co/QOhveVKMbQ,en,AIG
Mon Nov 06 20:00:07 +0000 2017,AIG can help get your family life insurance benefits while you’re still living. Learn how. https://t.co/P8NRzCVGLM https://t.co/lfRIbLDLV2,en,AIG
Mon Nov 06 14:34:29 +0000 2017,RT @AIGemea: An inspiring morning trying out Goalball with the @allblacks @EndeavourFund @RNIB @teaminsightltd - a wonderful team building…,en,AIG
Mon Nov 06 13:30:02 +0000 2017,Education is an important part of cybersecurity. Learn how you can do more to inform yourself and those around you: https://t.co/Q4gji8tV1U https://t.co/Ngg8QiPhPt,en,AIG
Fri Nov 03 19:30:01 +0000 2017,Our teams in Mexico were recognized for their meaningful initiatives that give back to the community. Read more: https://t.co/HuqoJtKS32 https://t.co/R73jLWoQxi,en,AIG
Fri Nov 03 16:30:01 +0000 2017,"See how new EU laws may expand cyber risk awareness, and find out how your business can prepare for change. https://t.co/6ito2ma77h https://t.co/VnvnQcPaEy",en,AIG
Fri Nov 03 14:03:01 +0000 2017,"@loveyposh Hi, once the team learns more about the type of policy you are inquiring towards, they should be able to provide a number to call",en,AIG
Thu Nov 02 20:30:04 +0000 2017,"Q3 earnings: ""We will continue to execute on our strategy to better position AIG for long term profitable growth.” https://t.co/M5THGVKGkx https://t.co/abDDwPMbvM",en,AIG
Thu Nov 02 18:02:00 +0000 2017,"@loveyposh Hi, we're sorry to hear about this. Please email us at GCRS@aig.com right away so we can assist you and your dad.",en,AIG
Thu Nov 02 14:30:01 +0000 2017,Are you or your business vulnerable to a cyberattack? Find out: https://t.co/iDUqii28IE https://t.co/hB7DuYgt1l,en,AIG
Thu Nov 02 12:43:01 +0000 2017,RT @AIGemea: Read our new article from Carol Barton on global programmes. #multinational #captivereview https://t.co/XHz3XHUhqW https://t.c…,en,AIG
Wed Nov 01 19:08:01 +0000 2017,Our people are passionate about making a difference. Learn how we help them give back to communities: https://t.co/RlRhBLNayq https://t.co/zpfpASC1lg,en,AIG
Wed Nov 01 16:15:01 +0000 2017,Keep an eye out for phishing attacks that could install malware on your computer. Learn how to stay protected: https://t.co/hoXW5veZOX https://t.co/3vx7rFbsTi,en,AIG
Wed Nov 01 13:27:01 +0000 2017,"We've joined @SaveSavings, dedicated to protecting Americans' retirement savings as Congress plans #taxreform. https://t.co/NmyoNVpibV https://t.co/fc6SJYUsvR",en,AIG
Tue Oct 31 20:30:00 +0000 2017,"We can't help protect you against zombies, vampires, werewolves or Frankenstein attacks. Just everything else! https://t.co/U8XexXV2Mb",en,AIG
Tue Oct 31 15:00:02 +0000 2017,"AIG's nimble, cross-cultural teams allow us to think globally and respond locally. That's the power of diversity. https://t.co/ypxe8uT62k",en,AIG
Mon Oct 30 20:48:08 +0000 2017,"Introducing Blackboard, our new technology-focused subsidiary, formerly Hamilton USA. Read the announcement now: https://t.co/8YhH97O6v6 https://t.co/zJPvXH5e3B",en,AIG
Mon Oct 30 20:32:09 +0000 2017,"@nycgirlinphx Hello, please email us directly at GCRS@aig.com and we would be happy to assist you with your account.",en,AIG
Mon Oct 30 18:59:39 +0000 2017,"In an increasingly connected world, how can individuals and companies mitigate cyber risks? https://t.co/rVqLZYnrBM https://t.co/ZOxtMWUOg7",en,AIG
Mon Oct 30 14:31:04 +0000 2017,"@andrei_nastasie Hi Andrei, please advise on your specific query so we can direct you to the right place.",en,AIG
Mon Oct 30 13:00:09 +0000 2017,Travel Guard offers trip insurance so you can travel confidently and return dreaming of your next great adventure. https://t.co/jvvokkNaEj https://t.co/rTmgzJ42wT,en,AIG
Fri Oct 27 18:08:01 +0000 2017,"Risk managers can take action to uncover, measure, and respond to IoT risks today. Learn more: https://t.co/AZjyFoVBdW https://t.co/Mno1HxeF7T",en,AIG
Fri Oct 27 17:09:29 +0000 2017,Hackers can gain access to their victims' computers using social media. Learn how to stay protected: https://t.co/juqun8AJCZ https://t.co/S7CS5MyeDt,en,AIG
Fri Oct 27 15:00:05 +0000 2017,"AIG volunteers cheered on 40k runners at the London Marathon, in support of mental health awareness. #HeadsTogether https://t.co/OUFzuDrEnm https://t.co/IzL3Soc4rt",en,AIG
Fri Oct 27 13:03:00 +0000 2017,"RT @herjusticenyc: We joined Tanya Kent, former Junior Advisory Board member and @AIGinsurance Associate General Counsel, at AIG's October…",en,AIG
Thu Oct 26 21:47:28 +0000 2017,"@SamGoodhind So great to hear, Sam!",en,AIG
Thu Oct 26 18:30:02 +0000 2017,The rise of cyber risk and more sophisticated attacks call for world-class response plans. Is your business ready? https://t.co/Gm4iYORgvU https://t.co/Xv6DN0Xlnp,en,AIG
Wed Oct 25 18:00:03 +0000 2017,"We’re hiring! Our community is growing, and we want more talented, innovative thinkers. Check out new opportunities: https://t.co/Cc2rUn04DQ",en,AIG
Wed Oct 25 15:30:01 +0000 2017,We’re a proud sponsor of the Nashville Heart Walk where our people &amp; families support the life-saving work of the @American_Heart. https://t.co/bNBkMioa4f,en,AIG
Tue Oct 24 20:59:09 +0000 2017,"@_Fluff__ Hi Rafa, please email us at GCRS@aig.com right away so we can assist you.",en,AIG
Tue Oct 24 19:00:05 +0000 2017,The road to retirement can have many hurdles. Read about how life insurance can help tackle 6 retirement challenges: https://t.co/m75bo1sp7z https://t.co/hbqec6S3Ks,en,AIG
Tue Oct 24 14:30:01 +0000 2017,"“Nothing is more important than helping individuals in need,"" says Eric Kobrick. Read about AIG's Pro Bono Program: https://t.co/dWUPEnWvjl https://t.co/8IRvaqTh4h",en,AIG
Tue Oct 24 13:12:32 +0000 2017,"RT @doubleicf: In celebration of #IICFWeekofGiving @AIGinsurance volunteers packed 10,000+ meals for the world’s most vulnerable population…",en,AIG
Mon Oct 23 19:32:01 +0000 2017,Many families are unsure of what to expect when buying #lifeinsurance for the first time. Explore what’s needed: https://t.co/J0jvxdFdih https://t.co/4eYkt1Yxt4,en,AIG
Mon Oct 23 18:00:05 +0000 2017,Is your life insurance taxable? Here are some facts you'll want to know about your potential tax liability. https://t.co/JMvqh5eb7o https://t.co/m3v1MGHGG4,en,AIG
Mon Oct 23 15:20:32 +0000 2017,"@RobWolfe Hello Rob, Thank you for your interest in our life insurance product. Please email us at GCRS@aig.com for further assistance.",en,AIG
Mon Oct 23 15:00:03 +0000 2017,See how our partnership with Junior Achievement is bringing financial literacy to our next generation of leaders. https://t.co/qQQclaObDi https://t.co/nrTUS0VT31,en,AIG
Sat Oct 21 17:43:01 +0000 2017,RT @AIGemea Could #drones be the answer to combating #insurancefraud? Read our blog #fermaforum https://t.co/1ZyffSVe1D https://t.co/mYIDnhbH1E,en,AIG
Sat Oct 21 13:34:00 +0000 2017,RT @AIGemea: Latest AIG article: ‘#MandA insurance is taking off’ – read more from @raconteur. #mergers https://t.co/6zDfbi2ePu https://t.c…,en,AIG
Fri Oct 20 17:30:02 +0000 2017,Efficient teamwork and risk expertise earned AIG Brazil the Best Professional Liability Insurer title this year. https://t.co/TXLSVY4VkY https://t.co/dX7OsjpTHP,en,AIG
Fri Oct 20 14:46:32 +0000 2017,"@AbbyLeighTaylor Hi Abby, if you want to send us a private message to request assistance, please email us directly at GCRS@aig.com",en,AIG
Fri Oct 20 14:00:04 +0000 2017,"Our people donate about 3,000 hours per year in pro bono work. AIG hosted an event for its pro bono partners to share their causes. https://t.co/nVk9PzXg7v",en,AIG
Thu Oct 19 20:00:02 +0000 2017,"“At AIG, diversity and inclusion are values fully integrated into our culture."" - Jeremy Johnson, President of U.S. Commercial #DiveInFest https://t.co/vcPvAc6e0L",en,AIG
Thu Oct 19 18:00:04 +0000 2017,A serious health condition may not mean automatic denial for a life insurance policy. Learn more about the options. https://t.co/cGzDWx82KM https://t.co/tAHyxhZBxA,en,AIG
Thu Oct 19 14:54:46 +0000 2017,"@yopihans Hello, thanks for reaching out. Please email GCRS@aig.com and we will be happy to assist you with your issue regarding your claim.",en,AIG
Thu Oct 19 14:30:02 +0000 2017,"Our employees packed 2,000 hygiene kits with basic necessities for those impacted by #HurricaneMaria in partnership with @IMC_Worldwide https://t.co/cteASZmN8C",en,AIG
Thu Oct 19 10:44:00 +0000 2017,RT @AIGemea: Julien Combeau has been at #fermaforum. Read his blog on how #bigdata &amp; #analytics can transform #riskmanagement: https://t.co…,en,AIG
Wed Oct 18 15:00:02 +0000 2017,"“Recognizing that many clients had lost everything, AIG waived deductibles on auto claims,” recounts AIG Mexico Claims Manager Jorge Duran. https://t.co/AnMO4Blsmp",en,AIG
Wed Oct 18 12:31:09 +0000 2017,AIG offers its award-winning Travel Guard insurance products and services to @united travelers on https://t.co/RZ5Zd5OuLh https://t.co/gE3lK47e3M,en,AIG
Wed Oct 18 11:11:00 +0000 2017,"RT @AIGemea: Learn how our Claims team works with Client Risk Solutions from George Stratts, Property &amp; Specialty Risks President. Stand1-3…",en,AIG
Wed Oct 18 10:08:00 +0000 2017,"RT @AIGemea: CEO UK &amp; AEL Anthony Baldwin, Anita Kwasniewski, Client &amp; Broker Events, &amp; Exec Assistant Jenny Kemp sporting #fermafashion at…",en,AIG
Tue Oct 17 17:00:13 +0000 2017,"Our diverse teams bring the innovative risk management solutions of the future to our customers, today. https://t.co/mLG8UOswVL",en,AIG
Tue Oct 17 15:45:01 +0000 2017,"RT @AIGemea: Marco Dalle Vacche, GM Italy &amp; MD South Europe, says #fermaforum is a great opportunity for us as an insurer to meet with our…",en,AIG
Tue Oct 17 13:50:05 +0000 2017,"AIG's drones safely assess damage from natural disasters like this earthquake site in Mexico City, where no one was hurt. https://t.co/CgpLpSh3rq",en,AIG
Tue Oct 17 10:53:00 +0000 2017,RT @AIGemea: Hilary Browne: 4th industrial revolution is exciting for insurers &amp; risk managers in terms of understanding &amp; preventing risk…,en,AIG
Mon Oct 16 20:00:03 +0000 2017,Are you getting security from your employer's life insurance? It may be time to take a look at your needs. https://t.co/wQQEUC6NnH https://t.co/AtLAUMY1BM,en,AIG
Mon Oct 16 19:25:11 +0000 2017,Learn how we're helping deliver insurance solutions to the underserved through our involvement with Blue Marble. https://t.co/nTZ21Vr2Zb https://t.co/GEMEiRAbTJ,en,AIG
Mon Oct 16 14:56:41 +0000 2017,@Leogal1 We are very sorry to hear of your current situation. Please contact us at our email GCRS@aig.com so we can assist you,en,AIG
Mon Oct 16 14:56:07 +0000 2017,"@Cori_Eile Hi, we are sorry to hear of your situation. Please email GCRS@aig.com so we can look into this right away and assist you.",en,AIG
Mon Oct 16 14:30:03 +0000 2017,Our employees are volunteering around the country in celebration of @doubleicf Week of Giving. #insurancegivesback https://t.co/x2O7SjqB3N,en,AIG
Mon Oct 16 13:20:12 +0000 2017,RT @AIGemea: Last month we inspired young women in a Design Hackathon. Watch our short video https://t.co/txCTY1ioue @green4girls @southban…,en,AIG
Mon Oct 16 11:00:01 +0000 2017,The European Risk Management Forum has kicked off! See our #FERMAForum portal for the latest risk management trends. https://t.co/yLBUAJxDP8 https://t.co/o19jSeyywz,en,AIG
