created_at,full_text,lang,user_name
Thu Nov 29 16:40:04 +0000 2018,"Thanks to AIG’s Carlo Crudele, Ed Dandridge, Elias Habayeb, Sid Medappa, Naohiro Mouri &amp; Kenneth Riegler for cultivating #DiversityandInclusion at the GOOD (Guys Overcoming Obstacles to Diversity) Guys Panel hosted by the NY Women &amp; Allies Employee Resource Group. https://t.co/HAByii0cWS",en,AIG
Thu Nov 29 15:20:00 +0000 2018,@mobashah At this juncture we do not offer a micro insurance product in Malaysia.,en,AIG
Thu Nov 29 15:20:00 +0000 2018,"@Tylerfjames1551 Hello Tyler, please email us at CSU@aig.com so we can direct you to the closest office based on your needs.",en,AIG
Wed Nov 28 22:32:00 +0000 2018,@RodgersTeam We are sorry that our coverage decision is not more favorable towards you. Our travel insurance claims department is happy to talk through coverage/policy nuances. Please contact us anytime at 1-800-826-1300. Thank you.,en,AIG
Wed Nov 28 22:28:40 +0000 2018,"@dinamorica Hi Dina, Thank you for reaching out and apologies for the delay. Please email your full name, claim/policy number and contact details to socialmedia@travelguard.com so that we can help with your travel insurance claim question.",en,AIG
Wed Nov 28 20:18:45 +0000 2018,RT @EBNmagazine: How employers are encouraging workers to dig deeper on Giving Tuesday https://t.co/gueHbmQ1YS,en,AIG
Wed Nov 28 18:32:30 +0000 2018,"#Brexit, #NAFTA, #WTO reform, #USChina relations. These are a few developments that are affecting how governments work together. Read Tom Leonardi’s take on why a collaborative #GlobalTrade environment is important to AIG &amp; the business of insurance.",en,AIG
Wed Nov 28 15:30:01 +0000 2018,"Art enriches our lives. AIG’s New York disAbilities &amp; Allies Employee Resource Group, consulted the Access Program of the Metropolitan Museum of Art, and several schools and organizations to open an art exhibit showcasing the talents of the differently-abled.#diversity #inclusion https://t.co/67oBYpLMug",en,AIG
Tue Nov 27 21:29:36 +0000 2018,"“You have to think about diversity. It will be the game changer,” said Vievette Henry, AIG’s Global HR Organizational Effectiveness Lead, while speaking to insurance leaders about diversity and inclusion efforts at the recent #eifDublin event. https://t.co/hiMoFJqq9z",en,AIG
Tue Nov 27 20:57:23 +0000 2018,RT @AIGemea: AIG’s Simon Gallimore writes ‘Manufacturers are facing a whole heap of other threats that they could easily lose sight of with…,en,AIG
Tue Nov 27 17:13:59 +0000 2018,"@imnotsanele Hello, we are sorry to hear of your frustration. Please email us at CSU@aig.com so we can discuss your policy and assist.",en,AIG
Tue Nov 27 14:15:01 +0000 2018,"This #GivingTuesday marks 430,000 meals that our colleagues in the U.S., London and Manila helped pack with @Rise2030 in 2018. We’re inspired by how our AIG community is dedicated to giving back &amp; doing good. #LifeatAIG https://t.co/BwXadyClOu",en,AIG
Mon Nov 26 16:26:26 +0000 2018,"@sts5017 Hi Sean, Sorry to hear your frustration. We’d like to learn more. Please email your travel insurance claim # and/or policy number to socialmedia@travelguard.com so that we can look into it. You may also call us anytime at 1-800-826-1300. Thank you.",en,AIG
Sun Nov 25 17:28:59 +0000 2018,"@davide_cossu Hello Davide, please email us at CSU@aig.com so we can take you off of our mailing lists.",en,AIG
Tue Nov 20 22:21:13 +0000 2018,"@mcdamman Thank you for reaching out. So that we can better assist you, please send your name and request to socialmedia@travelguard.com and we will be in touch. Thank you.",en,AIG
Fri Nov 16 21:12:33 +0000 2018,"RT @AIGIreland: Ahead of tomorrow’s big match, @IrishRugby V @AllBlacks, @ryan_crotty tries his best to show us how he scored his last minu…",en,AIG
Fri Nov 16 17:33:29 +0000 2018,"Each November, AIG celebrates Veterans Month to thank those who’ve served for their valiant dedication. We’re honored to see our people &amp; their families being appreciated at last Sunday’s football game at MetLife Stadium during #SalutetoService Week. 🏈 🎖 https://t.co/hv1AebN28P",en,AIG
Fri Nov 16 17:33:18 +0000 2018,"@StellarCopy Hello Caryn, thank you for reaching out to us here on Twitter. Please email us at CSU@aig.com right away so we can assist you with your cancellation request.",en,AIG
Thu Nov 15 21:45:00 +0000 2018,The AIG story began in Shanghai in 1919 and it continued last week in #Shanghai when AIG CEO Brian Duperreault attended the 30th annual IBLAC event to offer his recommendations on supporting the financial opening of the Belt &amp; Road Initiative: https://t.co/of9D3qSDHn https://t.co/EUsTZVa251,en,AIG
Thu Nov 15 17:07:00 +0000 2018,We're proud of our AIG team in Hong Kong for supporting #WomenintheWorkplace! 🙌 💪 #celebratewomenAIGHKEX https://t.co/Zj6RQgHSs9,en,AIG
Thu Nov 15 15:24:47 +0000 2018,"@Samiamclay Hello Sam, we are sorry to hear of your frustration, please email us at CSU@aig.com so we can assist you right away.",en,AIG
Wed Nov 14 18:16:56 +0000 2018,"@KreativKonzepts Hi Jenilee, we are sorry that our coverage decision is not more favorable towards you. Our Claims Department is happy to talk through it if you have questions or concerns. Please contact us at 1-800 826-1300.",en,AIG
Wed Nov 14 15:36:00 +0000 2018,"@WerthIrene Hello Irene, please email us at CSU@aig.com so we can assist you right away.",en,AIG
Mon Nov 12 16:27:01 +0000 2018,"@Quita_450 Hello Julie, thank you for bringing this to our attention. Please email us at CSU@aigcom so we can look into this for your mother.",en,AIG
Mon Nov 12 14:25:00 +0000 2018,"This #veteransday, we’d like to thank our military &amp; celebrate our partnership with @ACPUSA which helps veterans transition to civilian life. It’s how AIG employee Susan Dorgan met, mentored and befriended Air Force Lieutenant Colonel Maren Calvert. https://t.co/0RP3LDEghh 🎖 https://t.co/oFiDZCmAqn",en,AIG
Wed Nov 07 19:18:23 +0000 2018,"@MummyMoo2011 Hello Claire, if you email us at CSU@aig.com we would be happy to follow up with you.",en,AIG
Tue Nov 06 20:55:53 +0000 2018,"We’re thrilled to have won General Insurance Company of the Year at the 22nd Asia Insurance Industry Awards, where AIG was recognized for its outstanding performance in product innovation, client relationships &amp; business growth. Thank you @AIReDaily for this honor. https://t.co/4apmO6K72N",en,AIG
Fri Nov 02 18:57:00 +0000 2018,"@K_MFletcher Hello Katie, thank you for bringing this situation to our attention. Please email us at CSU@aig.com right away so we can look into this ASAP.",en,AIG
Thu Nov 01 11:00:01 +0000 2018,Learn about AIG’s results on today’s webcast at 8am ET. Join here: https://t.co/LxE05JlaRc,en,AIG
Wed Oct 31 21:13:27 +0000 2018,"@BenefitWriters Hello Diane, we are sorry to hear of your frustration. Please contact us right away at our email CSU@aig.com for assistance.",en,AIG
Wed Oct 31 21:00:01 +0000 2018,AIG announced third quarter results today. Hear more on tomorrow’s conference call at 8am ET: https://t.co/M4gbtDXACw,en,AIG
Tue Oct 30 20:30:53 +0000 2018,"@_feldy Hello David, please email us at CSU@aig.com and we will be happy to assist you.",en,AIG
Tue Oct 30 19:30:00 +0000 2018,"We’re proud to be a part of the nationwide movement in #Ireland that is encouraging people and the media to embrace women’s #sports and increase attendance, participation and media coverage by 2020. #20x20 🏀⚽️✊ https://t.co/AnnBjEDQIR",en,AIG
Tue Oct 30 18:15:01 +0000 2018,The inability to access credit means African farmers can’t reliably get supplies like seed &amp; fertilizer. We’re part of a group that offers low cost insurance to give them a safety net for unexpected events. Learn more in our article with @WPBrandStudio:,en,AIG
Tue Oct 30 14:39:12 +0000 2018,"@neemaam Hello Neema, please visit us here https://t.co/aNhVyTjJxH",en,AIG
Tue Oct 30 13:07:00 +0000 2018,RT @CNBCi: Retiring in a down market can mean two-thirds less money for rest of your life: AIG Retirement CEO https://t.co/v0qvKRQZLu,en,AIG
Mon Oct 29 15:10:00 +0000 2018,"@HuMrLvR24 Hello Melanie, please email us at CSU@aig.com and we will be happy to assist you and your husband.",en,AIG
Mon Oct 29 14:33:37 +0000 2018,"@RaneeSClark Hello Ranee, please email us at CSU@aig.com so we can look into your login for your life insurance policy right away.",en,AIG
Mon Oct 29 14:31:00 +0000 2018,"@omgwtfbbqdurian Hello, please email us at CSU@aig.com and we will be happy to look into your claim as soon as possible.",en,AIG
Fri Oct 26 14:30:00 +0000 2018,"RT @AIGemea: AIG stands proudly behind ‘Insuring Women’s Futures’. 

Addressing the systemic challenges to women’s financial security throu…",en,AIG
Fri Oct 26 13:36:32 +0000 2018,"RT @AIGemea: We’re proud &amp; delighted to see our COO Geoff Godwin coming in at #18 on the @OUTstandingiB @FT Leading 100 LGBT Executives.

C…",en,AIG
Thu Oct 25 21:03:35 +0000 2018,"@LoriSan1 Hello Lori, please email us at CSU@aig.com right away so we can assist you with your warranty.",en,AIG
Wed Oct 24 21:15:18 +0000 2018,"As this year's Harlem Educational Activities Fund gala honoree, AIG CEO Brian Duperreault expressed admiration for @HEAFNYC for ""inspiring intellectual growth by showing what is possible, and also fostering collegiality and leadership.""💡🙌 #inspiration #problemsolvers https://t.co/IuTEwfaa6J",en,AIG
Tue Oct 23 20:29:47 +0000 2018,"The #cybersecurity threat is real. Just ask Liam Pomfret, AIG’s Southeast Asia Cyber Lead, who reports in Strategic Risk that AIG has seen a 20% increase in #cyber claims in the region in the last year. What are you doing to prepare for the #risk? 🔒 https://t.co/XQ1AZUEkOD",en,AIG
Mon Oct 22 18:12:58 +0000 2018,RT @AIGemea: Thrilled to welcome local students yesterday at our #g4gAIG Design Hackathon! The girls had great ideas for future inventions…,en,AIG
Fri Oct 19 15:21:27 +0000 2018,"@warriorsworld Because the Description of Coverage varies based on the plan purchased, coverage varies, too. We are happy to talk through the nuances anytime at 1-800-826-1300",en,AIG
Thu Oct 18 22:22:25 +0000 2018,AIG’s Tom Leonardi sat down with U.K. Ambassador @KimDarroch yesterday to talk about how the U.S. &amp; U.K. are laying the groundwork for Free Trade Agreement negotiations post Brexit. Thanks to @USCSI for organizing. #insurance #tradepolicy #negotiation #trading https://t.co/eUJsbZ1iem,en,AIG
Tue Oct 16 20:47:09 +0000 2018,"@scottjf8 Hi Scott, thank you for your feedback, we will pass this on to the appropriate team. Please email us at CSU@aig.com for assistance.",en,AIG
Tue Oct 16 17:23:00 +0000 2018,AIG gives its employees 2 paid days off each year to volunteer. Carrie Elliott used hers to build a school in Uganda. 👏 🏅 Watch her story.  #volunteer #LifeatAIG,en,AIG
Tue Oct 16 14:55:01 +0000 2018,"“Overcoming stereotypes is a part of the journey at every career stage,” said AIG’s Ed Dandridge at our Latino Network event. Joined by @MarshGlobal &amp; @GuyCarpenter, Denise Sanchez summed it up: “Bring your “A” game, but don’t lose yourself in the process.” #hispanicheritagemonth https://t.co/yLOCDFFcgt",en,AIG
Mon Oct 15 17:04:01 +0000 2018,"@Steve_Kraus9 Hi Stephen, we are sorry to hear of your frustration. Please email us right away at CSU@aig.com so we can look into this.",en,AIG
Mon Oct 15 17:04:01 +0000 2018,"@RDubya1898 Hello Richard, we are sorry to hear of your frustration. Please email us at CSU@aig.com to discuss further.",en,AIG
Fri Oct 12 14:20:07 +0000 2018,"@comrade_chef Hello Comrade, please email us at CSU@aig.com so we can look into your claim.",en,AIG
Thu Oct 11 19:35:30 +0000 2018,"@chrisdarling We are sorry to hear you feel this way. We aren’t able to know the details of your situation over social media, but if you would like to talk through coverage, a claim or policy information please reach out to us at https://t.co/4NArQnzULZ.",en,AIG
Thu Oct 11 17:55:53 +0000 2018,"@baseballscot Hello, please email us at CSU@aig.com so we can assist you with your claim.",en,AIG
Wed Oct 10 20:20:00 +0000 2018,"@jdaye16 Hi Julia, please email us at CSU@aig.com for assistance.",en,AIG
Wed Oct 10 12:17:00 +0000 2018,"RT @AIGemea: As we enter a complex &amp; fast-changing era in international trade, Father of the House of Commons, Kenneth Clarke CH QC, spoke…",en,AIG
Tue Oct 09 21:26:01 +0000 2018,"Hurricane #Michael is expected to produce heavy rainfall &amp; incredibly strong winds in Florida. While you prepare yourself &amp; your family, please keep our claims assistance phone number on hand so we can assist in getting you the help you need after the storm: 877-244-0304 https://t.co/B1sQyRAHsE",en,AIG
Tue Oct 09 17:48:01 +0000 2018,Thanks for leading the charge with us!  🌈 https://t.co/o4iPnKJnQo,en,AIG
Tue Oct 09 17:46:57 +0000 2018,AIG’s Tom Leonardi writes about how the insurance regulatory landscape has evolved over the past ten years and what this has meant for our industry. https://t.co/9EfMlgznYT https://t.co/e3pyO397kz,en,AIG
Tue Oct 09 17:28:32 +0000 2018,"@amitks01 Hello Amit, please email us at CSU@aig.com so we can assist you with your policy.",en,AIG
Tue Oct 09 17:28:32 +0000 2018,"@AndreaEBaltazar Hello Andrea, we are very sorry to hear of the frustration you are having with resetting your password. Please email us at CSU@aig.com and we will assist you right away.",en,AIG
Tue Oct 09 17:28:31 +0000 2018,"@Sharion1972 Hello, please email us at CSU@aig.com so we can assist you with your check.",en,AIG
Mon Oct 08 13:50:52 +0000 2018,"@alneaimi Hello Ahmed, please email us at CSU@aig.com for assistance with your claim.",en,AIG
Fri Oct 05 15:50:46 +0000 2018,"@MikeTaillard Hello Mike, please email us at CSU@aig.com so we can look into this situation as soon as possible.",en,AIG
Fri Oct 05 15:50:15 +0000 2018,"@trogers4110 Hello Taylor, please email us at CSU@aig.com so we can look into your worker's compensation file.",en,AIG
Thu Oct 04 21:44:27 +0000 2018,‍⚖️ https://t.co/zltEw2Fddl,und,AIG
Wed Oct 03 21:43:33 +0000 2018,"Adopting new technology can be challenging, said @Gaurav_D_Garg, CEO of AIG Personal Insurance at this week’s #InsureTechConnect Conference. He went on to discuss the importance of proofs of concepts between companies and tech providers. https://t.co/4YxGtOnBSD",en,AIG
Wed Oct 03 17:27:32 +0000 2018,"@CahillTennis Hello Ciaran, please email us CSU@aig.com so we can assist you with your renewal quote.",en,AIG
Wed Oct 03 14:19:34 +0000 2018,@Jockedformen Sorry to hear your frustration. We’d like to learn more. Please email your claim/policy number to socialmedia@travelguard.com so that we can look into it. Thank you.,en,AIG
Wed Oct 03 14:19:03 +0000 2018,"@hayethere We are sorry to hear you feel this way. We aren’t able to know the details of your situation over social media, but if you would like to talk through coverage, a claim or policy information please reach out to us at https://t.co/6gX10FI75a.",en,AIG
Tue Oct 02 15:01:17 +0000 2018,"@TonyInga Hello Tony, please email us at CSU@aig.com so we can assist you.",en,AIG
Tue Oct 02 15:01:17 +0000 2018,"@rhino81uk Hello Steve, we are sorry to hear you are facing this issue on our website. Please email us at CSU@aig.com so we can look into this further.",en,AIG
Tue Oct 02 14:48:04 +0000 2018,"@lolpert Hi Ilana, thank you for bringing this to our attention. Please email us at CSU@aig.com so we can look into this further.",en,AIG
Tue Oct 02 14:47:38 +0000 2018,"@dean_anonym Hello Dean, please email us at CSU@aig.com for assistance.",en,AIG
Tue Oct 02 14:47:38 +0000 2018,"@ChefLindaGreen1 Hi Linda, we will contact you at the phone number that you've provided: 504 344-7218",en,AIG
Tue Oct 02 14:47:38 +0000 2018,"@PoojaLawStudent Hello Pooja, please email us right away at CSU@aig.com so we can look into your payments.",en,AIG
Tue Oct 02 14:47:09 +0000 2018,"@slothmuffin17 Hi Nicole, please email us at CSU@aig.com so we can assist you.",en,AIG
Thu Sep 27 20:00:02 +0000 2018,We’re glad to have been a part of the @DiveInFest in Bermuda! 🤗 #time4inclusion #diveinfest https://t.co/jocz3gml6r,en,AIG
Thu Sep 27 18:40:26 +0000 2018,RT @gomezacebopombo: Nuestro socio director Carlos Rueda abre el #DiveInFest hablando de políticas de diversidad en el sector #seguros y ju…,es,AIG
Thu Sep 27 18:39:59 +0000 2018,"RT @Vidya_India: Dive-in celebrations with @AIGinsurance at their office in #Gurugram As a part of the event, a session on personal hygiene…",en,AIG
Thu Sep 27 18:06:54 +0000 2018,@natalalleycat We are sorry to hear about your frustration. If there’s anything we can help with or talk through with you please call 1.800.826.1300 or email socialmedia@travelguard.com Thank you.,en,AIG
Wed Sep 26 21:08:00 +0000 2018,We're excited to welcome Lou Levinson to the team! 🙌 https://t.co/LPnuPPLCQa,en,AIG
Wed Sep 26 20:52:58 +0000 2018,"@JermZeFrazia Hi Jeremy, we're sorry to hear of your frustration. Please email us directly at CSU@aig.com so we can help you.",en,AIG
Wed Sep 26 20:52:58 +0000 2018,"@SameerChittapur Hi Sameer, please contact us directly at CSU@aig.com so we can help you with your policy.",en,AIG
Wed Sep 26 14:38:18 +0000 2018,We thoughtfully design development programs for our employees so they’re able to advance in their careers. Thank you @Forbes for recognizing us as one of the top 100 companies named “America’s Best Employers for New Graduates”! 🎓 https://t.co/vyJcHrnxEU https://t.co/N4KSZCXftO,en,AIG
Tue Sep 25 22:34:29 +0000 2018,"@DianetteWells Hi Dianette, we're sorry to hear of your frustration. Please contact us directly at CSU@aig.com if you need assistance.",en,AIG
Tue Sep 25 16:27:02 +0000 2018,"When you’re passionate about your career, your job doesn’t feel like ""just a job”. As we build our Internal Audit team in Charlotte, we’re grateful to have Chief Auditor Naohiro Mouri lead the team with his enthusiasm &amp; love for auditing. Hear his advice: https://t.co/uJXSwAB4Vj https://t.co/7GUkYtX9ti",en,AIG
Mon Sep 24 21:23:20 +0000 2018,AIG is proud to be a founding member of the Board of Directors for @alincome. Check out the Alliance's #MNF commercial tonight about the importance of protected lifetime income in retirement. https://t.co/ow2qHEiXIp #retireyourrisk 🏈 🍿 https://t.co/oRWpnvHVto,en,AIG
Mon Sep 24 20:26:57 +0000 2018,"@dizwire Hi, please email us directly at CSU@aig.com so we can better assist you.",en,AIG
Mon Sep 24 15:58:00 +0000 2018,"@wordsareloaded Hi Mike, we're sorry to hear of your frustration. Please email us directly at CSU@aig.com so we can help you with your policy.",en,AIG
Mon Sep 24 15:55:05 +0000 2018,"@AmeenaRojee Hi Ameena, please email us directly at CSU@aig.com so we can help you with your case.",en,AIG
Fri Sep 21 16:18:59 +0000 2018,"@sangamp3313 Hello Sangam, please email us at CSU@aig.com so we can look into this right away.",en,AIG
Fri Sep 21 14:48:55 +0000 2018,@bonjourrachel Thank you for the feedback. If you have anymore detailed information feel free to pass it along to socialmedia@travelguard.com. Thanks!,en,AIG
Fri Sep 21 14:48:55 +0000 2018,@3ateeji Sorry to hear your frustration. We’d like to learn more. Please email your claim/policy number to socialmedia@travelguard.com so that we can look into it. Thank you.,en,AIG
Fri Sep 21 14:12:27 +0000 2018,@shannonward2369 Thanks for reaching out. Happy to assist with insurance questions anytime at 1.800.826.1300.,en,AIG
Fri Sep 21 14:12:01 +0000 2018,"@diber10 Hello Dylan, please email us at CSU@aig.com so we can assist you.",en,AIG
Thu Sep 20 14:22:57 +0000 2018,"@shannonward2369 Because the Description of Coverage varies based on the plan purchased, coverage varies, too. We are sorry that our decision is not more favorable to you. We are happy to talk through coverage/policy nuances. Please contact us at 1.800.826.1300.",en,AIG
Wed Sep 19 16:39:42 +0000 2018,@britmorgankelly We are sorry to hear about your frustration. If there’s anything we can help with or talk through with you please call 1.800.826.1300 or email socialmedia@travelguard.com Thank you.,en,AIG
Wed Sep 19 16:39:00 +0000 2018,"@maulikn Hello Maulik, please email us at CSU@aig.com so we can assist you with your policy.",en,AIG
Wed Sep 19 16:39:00 +0000 2018,"@johnRejman Hello Eric, please accept our condolences for the loss of your father.  Please email us at CSU@aigcom so we can assist you right away.",en,AIG
Wed Sep 19 16:38:41 +0000 2018,"@Crikey_Egad Hello, please email us at CSU@aig.com for assistance.",en,AIG
Wed Sep 19 14:57:13 +0000 2018,"#HurricaneFlorence may be over, but our work continues to help get business clients back up and running. Our property claims promise to you: after coverage is confirmed, we will advance up to 50% of the agreed estimated loss within 7 days. Submit a claim: https://t.co/LvN6f6IIO6 https://t.co/srttZOsmYE",en,AIG
Mon Sep 17 20:15:00 +0000 2018,"@ejithoughts We apologize for the long wait time. Occasionally, we experience a large call volume due to large events. Should you still need assistance, pls email your claim/policy no. to socialmedia@travelguard.com and we will arrange a call back or contact us at 1.800.826.1300. Thank you.",en,AIG
Mon Sep 17 14:49:03 +0000 2018,"@CiaranHaran Hello Ciaran, we are sorry to hear that. If you have any questions, please email us at CSU@aig.com.",en,AIG
Mon Sep 17 14:49:02 +0000 2018,"@TurrDurr Hello Terry, thank you for bringing this to our attention. Please email us at CSU@aig.com so we can assist you with your renewal.",en,AIG
Mon Sep 17 14:49:01 +0000 2018,"@LaurenPaz2 Because the Description of Coverage varies based on the plan purchased, coverage varies, too. We are happy to talk through the nuances anytime at 1.800.826.1300.",en,AIG
Mon Sep 17 14:48:32 +0000 2018,@MermaidxSimone Coverage varies depending upon the plan that is purchased. We are happy to talk through plan differences. We are happy to discuss plan differences anytime at 1.800.826.1300.,en,AIG
Mon Sep 17 14:48:32 +0000 2018,@katvalleratrvl Thanks for sharing!,en,AIG
Fri Sep 14 21:58:38 +0000 2018,"AIG’s Command Center in Charlotte has field engineers &amp; claims adjusters standing by to assist clients affected by #HurricaneFlorence. Using satellite imagery, we’re ready to deploy resources to impacted areas once it's safe. For assistance: 877-244-0304. https://t.co/vfZsKpRWfD",en,AIG
Fri Sep 14 17:40:00 +0000 2018,"@KDotMeekBron Hello, please email us at CSU@aig.com and we would be happy to look into this for you.",en,AIG
Fri Sep 14 17:40:00 +0000 2018,"@ChefLindaGreen1 Hello, please visit us here and contact us at the appropriate number: https://t.co/GeoiRa9jqD",en,AIG
Fri Sep 14 17:39:26 +0000 2018,"@im_justagurl Great to hear, Shelli. Thank you for choosing to work with us.",en,AIG
Fri Sep 14 14:34:13 +0000 2018,"@MeryCevallosC Hello, we are sorry to hear of your frustration. Please email us at CSU@aig.com so we can assist you.",en,AIG
Thu Sep 13 21:48:33 +0000 2018,@ChefLindaGreen1 Please contact us at our phone +1 855-393-2244 (U.S.) for assistance.,en,AIG
Wed Sep 12 20:02:25 +0000 2018,"@ChefLindaGreen1 Hello, thank you for bringing this situation to our attention. Please email us at CSU@aig.com so we can look into this as soon as possible.",en,AIG
Wed Sep 12 17:30:38 +0000 2018,"Jana Greer, President &amp; CEO of Retirement at AIG, wants to see more households have reliable retirement income beyond Social Security. That’s why she and AIG are proud to be one of the founding members of the Alliance for Lifetime Income. https://t.co/gOLPdbLlJa",en,AIG
Wed Sep 12 17:15:12 +0000 2018,"@lbucks17 Hi Lauren, we are sorry to hear of your frustration. We are escalating your request to our team now.",en,AIG
Wed Sep 12 14:13:00 +0000 2018,"AIG's Tom Leonardi participated in the Annual International Insurance Regulatory Issues Dialogue, where he discussed regulatory challenges that hinder reinsurers' ability to increase disaster resilience. Thank you Bermuda Monetary Authority &amp; @ABIR_Bermuda for hosting. https://t.co/sFHNjwvteG",en,AIG
Tue Sep 11 22:39:37 +0000 2018,"@lilMizzH Hello Helena,  please email us at CSU@aig.com so we can look into this matter urgently.",en,AIG
Tue Sep 11 22:34:54 +0000 2018,"We’re actively monitoring #HurricaneFlorence. Visit our site for steps to take during and after the storm. For claims assistance, call 877-244-0304. https://t.co/5i3jst2y5w https://t.co/o3xWlWhGqA",en,AIG
Tue Sep 11 22:20:01 +0000 2018,"@sdperkins614 Hello, please email us right away to CSU@aig.com",en,AIG
Tue Sep 11 22:10:28 +0000 2018,RT @YouTalkInsNEWS: Read @AIGemea whitepaper on #Email Account Breach Precautions  https://t.co/lWmWx77lcD #insurance #CyberSecurity https:…,en,AIG
Tue Sep 11 17:33:43 +0000 2018,"We’ve insured about 3K M&amp;A transactions globally, helping clients confidently negotiate fair deals. We’ve learned from our claims experience, says AIG Global Head of M&amp;A Insurance Mary Duffy. And now we’re sharing our insights in our 3rd M&amp;A Claims Report. https://t.co/ZYBviw5jPt https://t.co/7s7u4cafrO",en,AIG
Tue Sep 11 15:14:16 +0000 2018,"AIG Retirement President and CEO Jana Greer's op-ed in @thehill supports bipartisan legislation to provide a more secure #retirement, including access to protected lifetime income. #RESA #ProtectYourRetirement",en,AIG
Tue Sep 11 14:51:02 +0000 2018,"@ndekei_Mburu Hello Ndekei, we are sorry to hear of your frustration. Please email us at CSU@aig.com so we can assist you.",en,AIG
Tue Sep 11 14:51:00 +0000 2018,"@atkins_inc We are sorry to hear you feel this way. We aren’t able to know the details of your situation over social media, but if you would like to talk through coverage, a claim or policy information please reach out to us at 1.800.826.1300.",en,AIG
