created_at,full_text,lang,user_name
Thu Dec 19 19:08:14 +0000 2019,Happy Holidays from Applied Materials!❄️⛄ https://t.co/px5ksVTGVO,en,Applied Materials
Thu Dec 19 00:01:58 +0000 2019,"RT @OphirGottlieb: 🚨🚨🚨
Our One-on-One Interview with the Incomparable Gary Dickerson, CEO of $AMAT 
-
Applied Materials' (AMAT) CEO - 'The…",en,Applied Materials
Tue Dec 17 22:14:02 +0000 2019,Congrats to Applied's Ted Hanson on your recognition among @IDGWorld's Ones to Watch for 2020!👏 https://t.co/cAMzDxpEc0 https://t.co/vs2A1eGbWy,en,Applied Materials
Tue Dec 10 22:05:00 +0000 2019,RT @Applied4Good: We're so proud to support @2ndharvest and the meaningful work they do in our community! #AppliedFightsHunger https://t.co…,en,Applied Materials
Mon Dec 09 17:13:50 +0000 2019,"How will #AI applications influence the future of logic scaling? Find out tomorrow at #IEDM2019 where Applied's Regina Freed will moderate a panel with Facebook, IBM, Intel, Stanford and TSMC. Read Regina’s latest blog for a preview: https://t.co/oMhppv3pAu.",en,Applied Materials
Thu Nov 21 23:48:37 +0000 2019,"RT @Applied4Good: Once again, we were 💯 wowed by the innovative social impact projects and individuals honored @TheTechInteract's #TechforG…",en,Applied Materials
Thu Nov 21 00:27:33 +0000 2019,"We are committed to operating our business in an environmentally and socially responsible manner, and are honored to be named among @ibdinvestors first annual Top #ESG50 Companies!🌎🏆 https://t.co/qucVWHxior",en,Applied Materials
Mon Nov 11 19:15:03 +0000 2019,"This #VeteransDay, we honor and thank our military veteran employees and those currently serving for your commitment and sacrifice. https://t.co/AUsKT9GPiK",en,Applied Materials
Fri Nov 08 20:09:35 +0000 2019,"📣We're excited to open the doors of the META Center &amp; invite the industry to collaborate w/ us to accelerate innovation, from materials to systems! SVP of New Markets &amp; Alliances Steve Ghanayem sums up our 3-part series &amp; explains where #codesign happens. https://t.co/9Lv9fdaf0W",en,Applied Materials
Thu Nov 07 18:42:05 +0000 2019,"What is “#codesign” and why is it essential for #AI and #machinelearning? Find out in part 2 of our blog series, where Applied's Buvna Ayyagari-Sangamalli outlines the winning formula for fueling the next era of computing. https://t.co/qqVJJ9bHX4",en,Applied Materials
Tue Oct 29 22:15:50 +0000 2019,Congrats to our Chairman Emeritus Jim Morgan on this well-deserved recognition. Your visionary leadership and contributions to our industry and society inspire us all! https://t.co/6OYCGzM6v1,en,Applied Materials
Mon Oct 28 18:11:18 +0000 2019,"What does success look like in the next decade? In part 1 of our blog series, Applied's Ellie Yieh shares the industry's “New Playbook” and why increased collaboration across the ecosystem is critical to accelerating innovation in the AI Era. https://t.co/yXQ14wP7JX",en,Applied Materials
Tue Oct 15 22:37:21 +0000 2019,"As we celebrate Applied’s 40th anniversary in Japan, we’re thankful to our employees, customers and suppliers for your collaboration, contributions and commitment over the years that continue to make possible the technology shaping the future. https://t.co/iosNLiSFaO",en,Applied Materials
Mon Oct 14 21:36:08 +0000 2019,RT @AppliedGarage: What will it take for quantum technology to move from lab to fab? Read our latest blog to learn how advancements in mate…,en,Applied Materials
Fri Oct 11 17:23:14 +0000 2019,"RT @Applied4Good: Today, we’re celebrating #DayoftheGirl – check out our new blog to learn how employees at Applied are encouraging girls t…",en,Applied Materials
Mon Oct 07 17:08:41 +0000 2019,Materials and integration schemes are changing rapidly. Applied's Niranjan Khasgiwale explains why our engineers are putting “eyes” inside systems and chambers to provide real-time monitoring and control on every wafer. https://t.co/YefeeUQjj1,en,Applied Materials
Fri Oct 04 17:25:50 +0000 2019,Happy #ManufacturingDay! Thank you to all of our employees who strive to make possible the technology shaping the future. #MFGDay19 https://t.co/lnLoYhiKWF,en,Applied Materials
Tue Oct 01 22:48:50 +0000 2019,"Congrats to our CTO, Om Nalamasu, on his recognition as a recipient of the Distinguished Alumnus of the Year from @HydUniv! https://t.co/rqomapLPgO",en,Applied Materials
Mon Sep 30 21:14:40 +0000 2019,"Great read on how companies like us are helping chipmakers improve IC production w/ #machinelearning. Says Applied's Rafi Benami: “We’ve had automatic detect classification in the field for many years now. In the last few years, we’ve added capabilities using machine learning.” https://t.co/vDuL7HYA6g",en,Applied Materials
Sat Sep 28 00:13:59 +0000 2019,RT @Applied4Good: This just in: our Hispanics in Partnership employee resource group and @HFSVpage hosted university #STEM students @ our S…,en,Applied Materials
Wed Sep 25 17:20:50 +0000 2019,RT @RedWhiteBlueDot: U.S. companies such as @Applied4tech have been leading innovation in the semiconductor industry here in Singapore and…,en,Applied Materials
Wed Sep 25 17:20:30 +0000 2019,We are honored to receive the Distinguished Partner in Progress Award. Thanks to our employees for making this possible. We look forward to building upon our success in Singapore! https://t.co/uyahAr4ylG,en,Applied Materials
Wed Sep 18 18:10:41 +0000 2019,RT @Applied_VC: Want to get an inside look into the mind of a #VC looking at the future of #AI? Applied Ventures' Michael Stewart's gives h…,en,Applied Materials
Tue Sep 10 23:07:48 +0000 2019,We are honored to have our CEO Gary Dickerson rank among @Forbes' list of America's Most Innovative Leaders! https://t.co/9GEjLL9efE,en,Applied Materials
Tue Sep 10 20:10:45 +0000 2019,Applied's Kevin Moraes said the biggest manufacturing challenge for #MRAM has to do with the complexity of the stack and the number of layers needed—in excess of 30. https://t.co/d8OSLijsgE,en,Applied Materials
Tue Aug 27 20:04:26 +0000 2019,The AI Era is here to stay! Applied's Selim Nahas explains how  we are developing AI-based systems to enable higher-quality decision-making. https://t.co/6xvtPzOexU https://t.co/YEIOLumdl7,en,Applied Materials
Thu Aug 22 22:53:13 +0000 2019,Missed #AIDesignForum but still curious about the opportunities and challenges of AI? Our CEO Gary Dickerson explains the AI paradox in his video keynote here: https://t.co/Lkq3xICOjF,en,Applied Materials
Mon Aug 19 17:57:32 +0000 2019,Bringing foldable phones to market requires overcoming some tough engineering obstacles. Applied’s Kerry Cunningham explains how we are helping solve these challenges with our expertise in materials engineering and display technology. https://t.co/tzVX3AOtwM https://t.co/nVHJMfzjue,en,Applied Materials
Wed Jul 31 23:18:58 +0000 2019,Going to the Flash Memory Summit in Santa Clara next week? Be sure to come hear Applied’s Kevin Moraes and Mahendra Pakala present on emerging memory technologies for the AI Era. https://t.co/LOKOyU4OqC,en,Applied Materials
Wed Jul 24 21:00:08 +0000 2019,News Alert: Yvonne McGill Joins Applied Materials Board of Directors. https://t.co/eNtfNFIudi https://t.co/q9kYDzzNWf,en,Applied Materials
Mon Jul 22 22:28:55 +0000 2019,It's a bird...it's a plane...it's Silicon Carbide—the superhero of Silicon! Applied's Llew Vaughan-Edmunds shares the potential for SiC to accelerate power semiconductors for energy-efficient chips and help make the world a better place. https://t.co/7Olc6T6hwG,en,Applied Materials
Tue Jul 16 21:23:57 +0000 2019,Thank you to our employees for helping us make @indeed's list of the 2019 Top-Rated Workplaces! 🎉 #TopRatedIndeed https://t.co/Z8tvFTfaT1,en,Applied Materials
Tue Jul 16 16:22:08 +0000 2019,"Check out our latest blog for highlights from the #AIDesignForum, where industry thought leaders and tech experts shared insights and identified opportunities for collaboration to enable more efficient computing for the AI Era https://t.co/EeLK1A7R7G",en,Applied Materials
Tue Jul 09 23:49:22 +0000 2019,"⚡️ “#AIDesignForum returns to explore the future of computing!”

https://t.co/IkrTxWeUiL",en,Applied Materials
Tue Jul 09 23:25:37 +0000 2019,Our CTO Om Nalamasu kicks off a VC panel at #SEMICONWest on driving growth in new industry inflections. https://t.co/gk2K8CkkbV,en,Applied Materials
Tue Jul 09 23:02:57 +0000 2019,PR (Chidi) Chidambaram from @Qualcomm closes out #AIDesignForum by explaining what it will take to develop the 5G AI era and opportunities to improve power efficiency with in-memory computing. https://t.co/0bla58HaXm,en,Applied Materials
Tue Jul 09 21:36:34 +0000 2019,Renée St. Amant from @Arm says ML has opened the door to many vectors of innovation. We need to expand our frame across the stack and also into the future to help create what’s possible. #AIDesignForum https://t.co/apZKE7GHD7,en,Applied Materials
Tue Jul 09 21:03:07 +0000 2019,"RT @stshank: For chipmakers pursuing next-gen memory and storage technology like MRAM, ReRAM, and PCRAM, @Applied4Tech has some new deposit…",en,Applied Materials
Tue Jul 09 21:02:31 +0000 2019,"Jeff Bier from @EmbeddedVision said the convergence of big data, deep learning and specialized processors is creating a once-in-a-generation opportunity. If you aren’t already thinking about how to benefit from this sea of change in tech, then now is the time. #AIDesignForum https://t.co/NlMLv53faP",en,Applied Materials
Tue Jul 09 20:52:11 +0000 2019,Afternoon tech presentations at #AIDesignForum are happening now! Cliff Young from @GoogleAI explains why collaborating across the ecosystem is crucial to accelerating the roadmap for creating even more valuable TPUs. https://t.co/BalCPVrFEr,en,Applied Materials
Tue Jul 09 20:01:24 +0000 2019,"Our CEO Gary Dickerson gave insights at #AIDesignForum on why new computing approaches are needed to unlock the value of big data, and how the industry won’t get there by doing what we’ve done in the past. We need to drive innovation in very different ways! https://t.co/gyDSMSNKo3",en,Applied Materials
Tue Jul 09 18:24:25 +0000 2019,"Victor Peng, CEO of @XilinxInc, shared how the next wave of advanced computing is all about architecture and distributed adaptable platforms that will meet the needs of future innovators. #AIDesignForum https://t.co/TXyDcEJ6Tj",en,Applied Materials
Tue Jul 09 17:39:33 +0000 2019,"Heard at #AIDesignForum: @LisaSu, CEO of @AMD, explained why a very rich ecosystem is necessary to accomplish the full potential of ML and AI, and how heterogeneous platforms on open software must work across the industry. https://t.co/b0MPJJ4dk3",en,Applied Materials
Tue Jul 09 17:17:01 +0000 2019,"Aart de Geus, CEO of @synopsys, kicked off #AIDesignForum with a very insightful presentation on the industry’s foundational role in enabling AI and how the fusion of silicon and software will open up the door to advanced computing. https://t.co/085AgCxuna",en,Applied Materials
Tue Jul 09 15:36:05 +0000 2019,News alert! Today we are excited to launch the most advanced chip-making systems we have ever developed to accelerate emerging memory technologies for IoT and cloud computing in the AI era. https://t.co/eUihcOlN3i,en,Applied Materials
Mon Jul 08 23:14:23 +0000 2019,Looking forward to seeing everyone at #AIDesignForum tomorrow in SF! https://t.co/bepM8sH2kw,en,Applied Materials
Mon Jul 08 21:07:54 +0000 2019,RT @Applied4Good: Check out our latest blog to see how Applied Materials employees are improving the environment around the world! 🌳♻️🚴‍♀️…,en,Applied Materials
Wed Jul 03 22:50:19 +0000 2019,"For new memories to reach high-volume manufacturing, the industry must
enable new process control solutions says Applied’s Niranjan Khasgiwale. Read his latest blog to find out what’s driving the need for new metrology techniques. https://t.co/abI80bOq9k",en,Applied Materials
Wed Jun 26 20:51:54 +0000 2019,Don’t miss the great line up of speakers at #AIDesignForum in SF on July 9. Hear thought-provoking CEO keynotes and tech presentations from leading industry experts. Register now! https://t.co/EFqxVUSkAX https://t.co/wGiWIXt8re,en,Applied Materials
Wed Jun 19 21:14:25 +0000 2019,"#AIDesignForum returns to San Francisco on July 9. Register now to hear the industry’s leading CEOs, including Gary Dickerson of Applied Materials, discuss the future of computing from materials to systems. https://t.co/EFqxVUSkAX https://t.co/g3woONhxDx",en,Applied Materials
Tue Jun 18 21:55:32 +0000 2019,Employees gathered to raise the rainbow flag for LGBTQ+ #PrideMonth and support our culture of inclusion. Innovation only happens if everyone comes to work with their best ideas and a willingness to share and listen to others. #Pride2019 https://t.co/FzNSNRmYpy,en,Applied Materials
Tue Jun 18 18:31:01 +0000 2019,Our CEO Gary Dickerson speaks with @barronsonline about the semiconductor industry after being named one of the World's Best CEOs of 2019. https://t.co/H5AisuApta,en,Applied Materials
Mon Jun 17 21:38:29 +0000 2019,We are honored to be on @IDGWorld @Computerworld’s Best Places to Work in IT for the 10th consecutive year! Thanks to all our employees for your passion in making Applied a great place to work! #CWBestPlaces https://t.co/Z0QA5HCJGO,en,Applied Materials
Fri Jun 14 17:56:23 +0000 2019,"Applied’s Sean SK Kang shares insights from the International Memory Workshop on what it will take to enable emerging memory technologies like #MRAM, #PCRAM and #ReRAM. https://t.co/StHPiiyDmT",en,Applied Materials
Fri Jun 07 18:59:57 +0000 2019,"Read our latest blog about the second annual #AIDesignForum—the only event that covers the industry challenges of the AI Era, from materials to systems! Learn more and register here: https://t.co/2WpUd6vtEp",en,Applied Materials
Tue Jun 04 16:48:38 +0000 2019,"#AIDesignForum is back!📣 Join us in SF on July 9 for thought-provoking keynotes from the CEOs of @AMD, @Applied4Tech, @synopsys and @XilinxInc, plus tech presentations from @Arm, @GoogleAI, @Qualcomm and @EmbeddedVision. Learn more and register today: https://t.co/mYBipP9mpk https://t.co/cARz128PlY",en,Applied Materials
Fri May 10 19:37:50 +0000 2019,"RT @Applied4Good: For #TeacherAppreciationWeek, our employees shared about the amazing teachers who have impacted their lives! https://t.co…",en,Applied Materials
Wed May 08 18:28:53 +0000 2019,Read our latest blog to find out why the AI Era of Computing requires new memories that combine high performance with non-volatility to reduce power in the cloud and edge. https://t.co/iRFceAioT4,en,Applied Materials
Thu May 02 18:02:18 +0000 2019,RT @wieilc: Applied Materials (@Applied4Tech) is excited to once again sponsor the IEEE WIE ILC in Austin May 23-24 and support #WomenInTec…,en,Applied Materials
Fri Apr 19 16:49:31 +0000 2019,"RT @Applied4Good: What's the deal with #AppliedEarthWorks? 

...we're so glad you asked. Check out how we're going green across the globe t…",en,Applied Materials
Thu Apr 18 21:20:45 +0000 2019,"Read how Applied’s new eBeam technology is being used to quickly detect, image and measure defects buried deep within the film layers of advanced chips. https://t.co/BHZxsK7YOR",en,Applied Materials
Fri Apr 12 16:27:32 +0000 2019,RT @AppliedGarage: Excited to announce @applied4tech's Om Nalamasu has joined @CNBC's Technology Executive Council to collaborate with othe…,en,Applied Materials
Tue Apr 09 21:23:55 +0000 2019,Applied Materials is honored to earn 100% on @HRC’s #CorporateEqualityIndex for our LGBTQ+ policies and practices! We are committed to fostering an inclusive and engaging workplace for all our employees. #CEI2019 💯🏳️‍🌈 https://t.co/WI2czuhFOe,en,Applied Materials
Mon Apr 08 20:36:11 +0000 2019,Join us Friday for the @DiversityFirst National #Diversity &amp; #Leadership Conference! Our Head of HR Susan Schmitt will discuss a very different path to inclusion &amp; join a panel of experts to share BKMs on diversity &amp; leveraging male advocates. #NowNotLater https://t.co/NP56G3L3oY https://t.co/Hi0FYhvdeb,en,Applied Materials
Fri Apr 05 23:05:34 +0000 2019,Applied’s Gill Lee examines manufacturing requirements of next-gen memories and explains why variations of even a few atoms can make a very BIG difference. https://t.co/XtfxlUeolI,en,Applied Materials
Sat Mar 30 20:08:07 +0000 2019,"In our latest blog, employees share insights and inspiration from @wtrmrk's #Watermarkconf for women—an empowering read! #WomensHistoryMonth https://t.co/DiQJfaHdph",en,Applied Materials
Fri Mar 29 23:16:03 +0000 2019,"#WomensHistoryMonth may be coming to a close, but we are always appreciative of the many women at Applied who make up our winning team! Today we hear from Liliya, an electrical engineer from our Santa Clara office. https://t.co/WTbGuGX0PN",en,Applied Materials
Fri Mar 29 21:31:21 +0000 2019,RT @AppliedGarage: Congrats to @applied4tech’s Prerna Goradia for receiving the “Women Innovator of the Year” award from the 2019 Indian Bu…,en,Applied Materials
Fri Mar 22 22:59:31 +0000 2019,Congratulations to Christi Marrufo @Cmarrufo60 for being named one of @DiversityFirst's Top 50 Most Powerful Women in Technology! #Top50Tech https://t.co/cZiSpOuXQK https://t.co/gkyLLYYBHn,en,Applied Materials
Thu Mar 14 21:33:05 +0000 2019,"In our latest blog post, Matt Cogorno and Toshihiko Miyashita explain how Applied is using materials engineering to improve performance and power consumption of advanced chips in mobile products. https://t.co/i7ZvPfWjci",en,Applied Materials
Tue Mar 12 18:15:45 +0000 2019,"In honor of #WomensHistoryMonth we are shining a spotlight on some of our talent in the workforce! Today, we hear from Parnika, a new college graduate and process engineer from Silicon Valley. https://t.co/LVx0LEPEza",en,Applied Materials
Fri Mar 08 17:20:22 +0000 2019,Today we celebrate #IWD2019 and honor all the outstanding achievements and contributions of women who are changing the world! #BalanceforBetter https://t.co/gePAY4cLv9,en,Applied Materials
Thu Mar 07 17:46:42 +0000 2019,Honored to announce Applied Materials is recognized among @intel’s 2018 Preferred Quality Supplier (PQS) award winners! #IntelSCQI https://t.co/VWuSc8H0LE,en,Applied Materials
Tue Mar 05 18:28:04 +0000 2019,"RT @Cal_Engineer: As #AI and #BigData transforms industries &amp; global economy, the need 4 advanced #semiconductors has never been greater. A…",en,Applied Materials
Thu Feb 28 16:49:17 +0000 2019,"David Thompson shares the latest work from our collaboration with @Arm, Symetrix and professors from @CUBoulder and @UBC to improve the power efficiency of computing by going beyond the Von Neumann architecture to “in-memory compute.” https://t.co/7K7p8ruDSP",en,Applied Materials
Tue Feb 26 00:11:57 +0000 2019,Proud to sponsor another successful #Watermarkconf where our employees gained valuable insights to grow personally and professionally. Can’t wait for next year! https://t.co/X4e1J2qTfT,en,Applied Materials
Mon Feb 25 21:37:19 +0000 2019,"RT @Applied4Good: We’re looking to tackle gender equity issues from the get-go with #GenerationGirl, the newest initiative of the Applied M…",en,Applied Materials
Fri Feb 22 18:04:10 +0000 2019,"Join us next week at the #SPIE Advanced Lithography symposium. Starting Monday, Applied Materials will present research papers on solutions for patterning, including techniques for minimizing on-device EPE w/ new e-beam imaging technology. See you there! https://t.co/MmdTnPhd5K",en,Applied Materials
Fri Feb 22 17:01:45 +0000 2019,"RT @wtrmrk: Check out the “Pioneering Equity &amp; Diversity in Your Organization” session at 3 PM today to hear a panel of experts, including…",en,Applied Materials
Thu Feb 21 23:06:41 +0000 2019,"Looking forward to tomorrow’s #Watermarkconf! Join us at 3 PM to hear a panel of experts, including our head of HR Susan Schmitt, share best practices on driving diversity and the role we can all play in fostering a more inclusive culture. https://t.co/1eAbdLLlRQ https://t.co/qSjL6escHJ",en,Applied Materials
Wed Feb 20 23:15:53 +0000 2019,RT @TiernanRayTech: One on One Interview with Applied Materials CEO Gary Dickerson and Capital Market Laboratories - 'We've never had a dem…,en,Applied Materials
Thu Feb 07 19:33:35 +0000 2019,"We are excited to expand our long-time partnership with @IBM as a member of the new IBM Research AI Hardware Center, and help accelerate the development of #AI chip technology! https://t.co/gPhRRYE7Ax https://t.co/uWUVHAiXO7",en,Applied Materials
Tue Feb 05 18:29:56 +0000 2019,2019 is the #YearofthePig and we wish everyone a prosperous #LunarNewYear! https://t.co/fJG8dYQvaz,en,Applied Materials
Mon Feb 04 18:56:27 +0000 2019,What kind of emerging memories will be needed for high-performance machine learning and other #AI applications? Ryan Gibson shares his perspective on solving memory challenges as we go through one of the biggest technological inflections of our lifetime. https://t.co/sSE2YbAe1J,en,Applied Materials
Mon Feb 04 18:18:51 +0000 2019,"RT @SemiEngineering: Sanjay Natarajan, corporate VP at Applied Materials talks about variation, Moore’s Law, the impact of new materials su…",en,Applied Materials
Tue Jan 29 17:54:31 +0000 2019,"The emerging #AI and #BigData era promises to be the biggest computing wave yet, and Sanjay Natarajan shares how these inflections are fundamentally disrupting our industry and why it’s time to question long-held assumptions – up and down the AI stack. https://t.co/fh4JExNq6i",en,Applied Materials
Fri Jan 25 17:53:53 +0000 2019,"Why is 2019 a pivotal year for the #semiconductor industry? @SundeepBajikar shares his perspective on the challenges and opportunities of the #AI revolution, and outlines why a new playbook is needed to accelerate the pace of innovation. https://t.co/1xdgtMxBVr",en,Applied Materials
Tue Jan 22 20:30:20 +0000 2019,Applied Materials is honored to rank #3 in the semiconductor industry on @FortuneMagazine's World's #MostAdmired Companies list! This wouldn't be possible without our talented and hardworking employees who make us proud every day. https://t.co/oTp4V8WTbH,en,Applied Materials
Mon Jan 21 22:28:16 +0000 2019,"Reflecting today on the important work of Dr. King, the values he embodied and his legacy. #MLKDay https://t.co/gPwjIYfwzX",en,Applied Materials
Tue Jan 15 20:57:22 +0000 2019,"RT @SEMIconex: Semiconductor Engineering - The Next #Semiconductor Revolution. Four industry experts talk about what’s changing, how quickl…",en,Applied Materials
Mon Jan 14 23:23:08 +0000 2019,"Interested in tech and looking to make a difference? Consider a career in #semiconductors, where today’s innovations pave the way for tech of the future. Our friends @SEMIConex created this fun promo video to show why you should join our industry! https://t.co/AFYRxB4Vef https://t.co/vJlLSRrtBL",en,Applied Materials
Wed Jan 09 22:33:30 +0000 2019,"Congrats to Ellie Yieh, Applied Materials Corporate VP and Fellow, for being selected as this quarter’s Spotlight on @SEMIconex Women honoree! Read more about her trailblazing career, her passion for tech and commitment to mentoring women engineers. https://t.co/tgDvjDLP9y https://t.co/rziRD8wmzq",en,Applied Materials
Wed Jan 09 01:15:18 +0000 2019,AI is here to stay but there's still much to be discovered. Join us tomorrow at #ISS2019 for a panel discussion w/ Applied’s Sanjay Natarajan and other industry experts as they explore “The Next Semiconductor Revolution”! https://t.co/Va7j2R4tmb https://t.co/P7bUDFvUHx,en,Applied Materials
Mon Jan 07 18:26:18 +0000 2019,RT @Cadence: Paul McLellan reviews presentations from @imec_int and @Applied4Tech on future interconnects to replace copper. https://t.co/i…,en,Applied Materials
Fri Dec 21 18:39:51 +0000 2018,Wishing you a wonderful holiday and new year! https://t.co/uc49oWp5So,en,Applied Materials
Thu Dec 20 22:57:40 +0000 2018,"From a revolution in EDA to energy harvesting, read Sanjay Natarajan’s latest blog as he explores the future of tech and what it will take to get there. https://t.co/mqoVkrCNLv",en,Applied Materials
Thu Dec 20 17:46:20 +0000 2018,"@lasserith Hi Moshe, thanks for reading our blog and for your questions. We will DM you with more info!",en,Applied Materials
Tue Dec 18 21:12:08 +0000 2018,"On the heels of @ieee_iedm's #IEDM2018, Applied’s Mehul Naik blogs about how materials innovation improves logic device power and performance as critical dimensions scale—and how Integrated Materials Solutions can accelerate customer success. https://t.co/uC6teuGGqV",en,Applied Materials
Fri Dec 14 20:27:11 +0000 2018,"RT @Applied4Good: In our latest blog post, we reflect on the fun and rewarding season of giving at @Applied4Tech, where employees connect w…",en,Applied Materials
Wed Dec 05 17:12:33 +0000 2018,"RT @ieee_iedm: #IEDM2018 Evening Panel Session topic: ""The Next 25 Years in Electronics"" with panelists Jim Handy, Objective Analysis; Jay…",en,Applied Materials
Thu Nov 22 00:48:22 +0000 2018,RT @Applied4Good: We are #thankful for the innovators around the world who are applying tech to change people’s lives. Read our latest blog…,en,Applied Materials
Thu Nov 15 19:59:03 +0000 2018,"Today we announced plans for the META Center, a first-of-its-kind R&amp;D facility located @sunypolyinst to speed availability of new chipmaking materials and process technologies that can enable breakthroughs in #semiconductor performance, power and cost. https://t.co/TbfIQDGBY5 https://t.co/kOMaWmLDmV",en,Applied Materials
