created_at,full_text,lang,user_name
Mon Apr 27 06:40:17 +0000 2015,"Applied Materials, Inc. and Tokyo Electron Limited Agree to Terminate Business Combination Agreement http://t.co/DB45BdZYc6",en,Applied Materials
Tue Apr 21 23:08:25 +0000 2015,@TheTechMuseum this is exciting news! Congratulations and thank you for all you contribute to the Valley.,en,Applied Materials
Thu Apr 16 23:12:52 +0000 2015,Dr. Randhir Thakur reflects on #MooresLaw50 &amp; #semiconductor innovations past &amp; future http://t.co/1fIEnBdj05 http://t.co/UiWm3yXYOQ,en,Applied Materials
Thu Apr 16 15:23:27 +0000 2015,Celebrating #MooresLaw50 https://t.co/CGctvEc20D,en,Applied Materials
Thu Apr 09 21:49:54 +0000 2015,"“Portable” music in 1965 meant 1 song p/side. Today, the smallest music players  hold 4000+ songs http://t.co/xRpsnPajEA #TBT #MooresLaw50",en,Applied Materials
Thu Apr 02 22:30:05 +0000 2015,"#TBT 50 yrs ago, hard drives stored 1MB of data. Today tiny thumb drives hold 128GB, a 131,000x increase http://t.co/xRpsnPajEA #MooresLaw50",en,Applied Materials
Thu Mar 26 21:30:05 +0000 2015,#TBT Remember when phones only made calls? Today they do so much more! http://t.co/xRpsnPajEA #MooresLaw50 http://t.co/JsIHGTqJCJ,en,Applied Materials
Thu Mar 19 21:04:02 +0000 2015,"Today's tablet runs @ nearly 50,000x the speed of a computer from 1965 http://t.co/xRpsnPajEA #TBT #MooresLaw50 http://t.co/6HWtDx8qLg",en,Applied Materials
Tue Mar 17 19:02:04 +0000 2015,Applied Materials Receives Intel’s Preferred Quality Supplier Award http://t.co/HUrvvvP9dc http://t.co/ZV8jfBSLhQ,en,Applied Materials
Mon Mar 16 21:45:18 +0000 2015,Applied Ventures Invests in RayVio #UVLED #Startup http://t.co/6qxuK7NEE5 #LED #VentureCapital,en,Applied Materials
Mon Mar 16 16:32:20 +0000 2015,Applied Ventures Broadens Portfolio with UV LED Solutions Investment http://t.co/JzhgGEFRpL,en,Applied Materials
Fri Mar 13 23:43:52 +0000 2015,Thanks @SVLeadershipGrp for 10 yrs of @TurkeyTrotSV partnership! Applied is proud to support the work of the beneficiaries. #HealthHopeHome,en,Applied Materials
Fri Mar 13 01:02:05 +0000 2015,#MooresLaw: 50 Years and Still Scaling http://t.co/xRpsnPajEA #MooresLaw50  #Semiconductors,en,Applied Materials
Thu Mar 12 22:45:19 +0000 2015,In 1965 30 #transistors fit in a square inch of an IC; today trillions fit http://t.co/xRpsnOSIg0 #MooresLaw50 http://t.co/aI2Zzz8cvE,en,Applied Materials
Thu Mar 12 15:34:45 +0000 2015,Ofer Adan on the tech innovations of Applied's metrology tool for 3D devices http://t.co/fgHicJOGW9 #Semiconductors http://t.co/1JD0UG73XI,en,Applied Materials
Thu Feb 26 22:32:30 +0000 2015,Quest for More Durable #Displays http://t.co/oC4oRqE6q5 #Smartphones #OLED #Display #Survey http://t.co/kZbY8ZHzK4,en,Applied Materials
Mon Feb 23 21:09:09 +0000 2015,Congratulations @SanJoseRotary: 100 years of service to community &amp; new park accessible to all. Thank you! http://t.co/5oEgdgXiHl,en,Applied Materials
Tue Feb 10 18:10:03 +0000 2015,Applied Materials to Present at Upcoming Investor Conference http://t.co/pXfQjN1AHw,en,Applied Materials
Sat Jan 31 04:00:09 +0000 2015,"As #4K #TV prices continue to fall, we expect adoption rates to more than double in 2015 to nearly 40M – Max McDaniel http://t.co/66UKRlYWPL",en,Applied Materials
Sat Jan 31 02:00:29 +0000 2015,Applied’s Max McDaniel discusses the latest #TV trends #LCD #OLED #4K #QuantumDot http://t.co/63OMZo5ZAN #SuperBowl #Displays #TVs,en,Applied Materials
Fri Jan 30 23:06:40 +0000 2015,Is Now the Time for that New #TV? http://t.co/63OMZo5ZAN #Displays #LCD #OLED #SuperBowl #4K #QuantumDot #TVs,en,Applied Materials
Fri Jan 30 16:01:37 +0000 2015,"Applied Materials to Hold Q1 FY2015 Earnings Webcast on February 11, 2015 at 4:30 p.m. ET http://t.co/QUTrrXMiCJ",en,Applied Materials
Sat Jan 17 03:00:56 +0000 2015,Survey shows consumers want big flat screens http://t.co/5Li6rffWLi #Displays #CES2015 #OLED #LCD #TVs,en,Applied Materials
Fri Jan 16 20:30:31 +0000 2015,Consumer attitudes towards #displays with focus on TV screen sizes &amp; trends out of #CES2015 http://t.co/5Li6rffWLi  #OLED #LCD #TVs,en,Applied Materials
Fri Jan 16 18:42:27 +0000 2015,Consumers Love Big Screens http://t.co/SVyTFpZpQD #Displays #CES2015 #LCD #OLED #TVs http://t.co/X7QEK26nju,en,Applied Materials
Thu Dec 18 20:21:14 +0000 2014,Happy Holidays from Applied Materials http://t.co/48bWKmVbDa,en,Applied Materials
Tue Dec 16 02:53:53 +0000 2014,"“Excited about the #transistor, heartbeat of the electronics industry, &amp; driving the industry forward.” Dr. Randhir Thakur #TransistorPanel",en,Applied Materials
Tue Dec 16 02:41:51 +0000 2014,"To continue supporting #MooresLaw our emphasis &amp; strategy on materials is right. - Dr. Randhir Thakur, Applied Materials #TransistorPanel",en,Applied Materials
Tue Dec 16 02:39:23 +0000 2014,"Q: #Transistor roadmap challenge ahead? ""We can see it continuing at least another 10 years."" – Mark Bohr, Intel #TransistorPanel",en,Applied Materials
Tue Dec 16 02:20:36 +0000 2014,"Our goal with #MooresLaw is to integrate more system functions into a small form factor– Mark Bohr, Intel #TransistorPanel",en,Applied Materials
Tue Dec 16 02:13:20 +0000 2014,"“We are good friends of #MooresLaw. We love #transistors! The more the better.” -John Chen, NVIDIA #TransistorPanel",en,Applied Materials
Tue Dec 16 02:02:14 +0000 2014,"“We will see new innovations in the next few years that create a new kind of #flash technology” - Dipesh Patel, ARM #TransistorPanel",en,Applied Materials
Tue Dec 16 01:56:54 +0000 2014,@ARMCommunity @NVIDIA @Intel Applied Materials discuss the #Transistor - the next era of #mobility #TransistorPanel http://t.co/XLSye03DJA,en,Applied Materials
Tue Dec 16 01:36:32 +0000 2014,#Semiconductor industry leaders discuss the next #transistor revolution. Join the conversation! #TransistorPanel http://t.co/SJsOrGOfbq,en,Applied Materials
Mon Dec 15 23:00:16 +0000 2014,Nearly every #transistor manufactured today is touched by at least one of our systems. http://t.co/jtv4OSf0cN,en,Applied Materials
Mon Dec 15 21:40:44 +0000 2014,Applied Ventures’ Holiday Wish List | The Applied Materials Blog http://t.co/kNIEGBwf3J,en,Applied Materials
Mon Dec 15 21:30:46 +0000 2014,Tomorrow marks 67th anniversary of 1st working #transistor - the most ubiquitous man-made device on the planet http://t.co/XU0EK4za42,en,Applied Materials
Tue Dec 09 18:53:10 +0000 2014,What Consumers Want from Their Displays | The Applied Materials Blog http://t.co/tS20JHFs3D,en,Applied Materials
Mon Dec 08 17:29:05 +0000 2014,Event Advisory: Semiconductor Industry Leaders to Examine Roadmap Beyond 7nm at December 16 Event http://t.co/uEwDKiE0h3 #Semiconductor,en,Applied Materials
Mon Dec 01 21:29:24 +0000 2014,"Ten Years of Trotting! Congrats to all 26,533 trotters helping those in need. http://t.co/lcr7d7cBGv  #SVTurkeyTrot http://t.co/22gv6EmQjj",en,Applied Materials
Mon Dec 01 21:02:36 +0000 2014,Ten Years of Trotting! | The Applied Materials Blog http://t.co/QtE97AITUa #SVTurkeyTrot,en,Applied Materials
Tue Nov 25 17:19:28 +0000 2014,RT @sanjoserealtime: Pizarro: Silicon Valley Turkey Trot takes flight in 10th year: A look back at 10 years of the Applied Materials… http:…,en,Applied Materials
Mon Nov 24 16:47:46 +0000 2014,Applied Materials to Present at Upcoming Investor Conference http://t.co/BNGp1yrDnj,en,Applied Materials
Fri Nov 14 20:03:29 +0000 2014,Congrats Ted Turner &amp; 2014 #TheTechAwards Laureates! Solving humanitarian challenges w/ tech http://t.co/yHkOFRKBNa http://t.co/m4YVsxh09i,en,Applied Materials
Fri Nov 14 04:51:36 +0000 2014,Congratulations to Global Humanitarian Award recipient Ted Turner &amp; 2014 Tech Award Laureates #TheTechAwards #TechnologyBenefitingHumanity,en,Applied Materials
Fri Nov 14 04:02:26 +0000 2014,RT @TheTechAwards: Now to present the 2014 James C. Morgan Global Humanitarian Award is the Executive Chairman of @Applied_Blog Mike Splint…,en,Applied Materials
Thu Nov 13 23:04:50 +0000 2014,"Congrats to Applied’s Hari Jayaram, named to @Computerworld’s #Premier100 IT Leaders for 2015! http://t.co/uulI39Gdl6 http://t.co/emiqoWB0hg",en,Applied Materials
Thu Nov 13 21:52:33 +0000 2014,Applied Materials Announces Fourth Quarter and Fiscal Year 2014 Results http://t.co/CG7f0WiXA7,en,Applied Materials
Tue Nov 11 22:44:39 +0000 2014,Applied Materials among Top 100 Military Friendly Employers http://t.co/NeFAU5iFWR,en,Applied Materials
Mon Nov 10 17:09:23 +0000 2014,Applied Materials Develops Advanced Patterning Solution for Memory Devices http://t.co/ZyHjBCXYvL #Semiconductor,en,Applied Materials
Thu Nov 06 20:25:20 +0000 2014,Celebrating #Diversity in the Workplace | The Applied Materials Blog http://t.co/rW1W2o5cii #STEM #Technology #Semiconductor #Careers,en,Applied Materials
Wed Oct 08 16:49:52 +0000 2014,Congratulations to Applied Materials’ Mike Splinter honored as #Education Champion! http://t.co/v5wkxli4dX #svefpnp http://t.co/5Gw7jiyjLs,en,Applied Materials
Mon Sep 08 23:12:23 +0000 2014,Applied Materials Announces Cash Dividend http://t.co/AGIWhTjlGS,en,Applied Materials
Fri Aug 22 15:45:03 +0000 2014,Applied Materials to Present at Upcoming Investor Conference http://t.co/JX27dwNfiu #Semiconductor,en,Applied Materials
Tue Aug 05 19:41:42 +0000 2014,Applied’s Er-Xuan Ping @FlashMem 6pm today - Is 3D NAND a Disruptive Technology for Flash Storage? http://t.co/lSqIu0bA3X #Semiconductor,en,Applied Materials
Fri Aug 01 16:09:09 +0000 2014,"Applied Materials to Hold Q3 FY2014 Earnings Webcast on August 14, 2014 at 4:30 p.m. ET http://t.co/12lVC42iCY",en,Applied Materials
Thu Jul 31 19:32:00 +0000 2014,The Changing Face of #Semiconductor Investment http://t.co/8bBu8Rump2 #VC,en,Applied Materials
Thu Jul 31 00:12:40 +0000 2014,Applied Materials is recognized by the @EPA for leading #green power use http://t.co/FMwWQfxM98 #EPAGreenPower http://t.co/3c2cAENnaP,en,Applied Materials
Mon Jul 28 15:31:29 +0000 2014,Mike Rosa discusses increasing Endura PVD capabilities for thick AI and AIN: http://t.co/uzymr6vaL3 #Semiconductor,en,Applied Materials
Mon Jul 28 11:02:00 +0000 2014,The voice of the customer drives Applied's continuous improvement initiatives. Learn more http://t.co/dr1IaA8o3B #Semiconductor #Service,en,Applied Materials
Mon Jul 28 07:00:45 +0000 2014,Case study: APF fusion integrates dispatch with simulation. Get the full report here: http://t.co/XBDshjnuWD #Software,en,Applied Materials
Fri Jul 25 23:00:49 +0000 2014,Check out these technology enabled services for fast problem solving http://t.co/iaQTKZiGBR #Semiconductor,en,Applied Materials
Fri Jul 25 16:56:11 +0000 2014,"The Next Big Thing: We’re Ready for It – Charlie Pappis, VP &amp; GM, Applied Global Services: http://t.co/L4IP8gVLk6 #Semiconductors #Service",en,Applied Materials
Tue Jul 22 00:23:26 +0000 2014,The NANOCHIP Fab Solutions Summer 2014 issue is now available. Check it out here: http://t.co/L4IP8gVLk6 #Semiconductors #Service,en,Applied Materials
Fri Jul 18 16:36:53 +0000 2014,"Learn about Applied Materials’ environmental stewardship, sustainable business practices &amp; community investments http://t.co/KbiCDNbT3D #CSR",en,Applied Materials
Thu Jul 17 18:09:25 +0000 2014,Applied Materials 2013 Citizenship Report http://t.co/bdI1wmD0Bo #CSR #Environment #Sustainability,en,Applied Materials
Fri Jul 11 21:44:32 +0000 2014,RT @Applied_VC: Applied’s @EtanghalVC on proliferation of #semiconductor technology into broader industries http://t.co/KvKXvF9XQC #MEMS #S…,en,Applied Materials
Thu Jul 10 22:10:18 +0000 2014,"One 300mm tool @ 20nm can generate 1.5TB data; need to work together to use it, says Applied's Sanjiv Mittal #SEMICONWest #Semiconductor",en,Applied Materials
Thu Jul 10 22:05:39 +0000 2014,Applied's Patrick Martin discussed how to scale while saving cost &amp; adding performance in IC spaces @ #SEMICONWest #Semiconductor,en,Applied Materials
Thu Jul 10 22:04:12 +0000 2014,Applied's Patrick Martin discussed how to scale while saving cost &amp; adding performance in IC spaces @ #SEMICONWest http://t.co/LJ9wa2rByJ,en,Applied Materials
Thu Jul 10 00:30:05 +0000 2014,Elie Rahme: By extending legacy tool capes we’ve shown cust. productivity gains up to 4% #SEMICONWest #Semiconductor http://t.co/K4cMTDDHgE,en,Applied Materials
Wed Jul 09 23:55:54 +0000 2014,Applied’s Steve Moffatt discusses materials &amp; environmental challenges in #Semiconductor manufacturing #SEMICONWest http://t.co/AGz8q9skOB,en,Applied Materials
Wed Jul 09 23:48:55 +0000 2014,RT @mysemicondaily: Applied Materials unveils CVD and CMP systems - http://t.co/bAIxFeitfB #semiconwest,en,Applied Materials
Wed Jul 09 20:38:19 +0000 2014,Applied Materials on next-gen eco-fabs w/ @SEMATECH #IMEC @intel #CNSE http://t.co/KJfzz7Evy8 #SEMICONWest Sustainable Manufacturing Forum,en,Applied Materials
Wed Jul 09 15:37:38 +0000 2014,Missed this week’s analyst &amp; merger briefings? We’ve got you covered. Replays are available at http://t.co/2W5E78ZYFo #Semiconductor,en,Applied Materials
Tue Jul 08 20:53:45 +0000 2014,Applied's @EtanghalVC on investor panel at Silicon Innovation Forum discussing the #semiconductor investment landscape #SEMICONWest,en,Applied Materials
Tue Jul 08 15:26:33 +0000 2014,RT @deantak: Massive chipmakers Applied Materials and Tokyo Electron rebrand themselves as Eteris http://t.co/SfOXpwtLYZ via @VentureBeat,en,Applied Materials
Tue Jul 08 00:18:38 +0000 2014,Tetsuro Higashi &amp; Gary Dickerson excited to unveil the new look of innovation: Eteris http://t.co/btDT9lcJrI http://t.co/EHJtK5yXDc,en,Applied Materials
Tue Jul 08 00:02:04 +0000 2014,CEOs of Applied Materials &amp; Tokyo Electron take the stage to kick off merger briefing. Join web cast http://t.co/2W5E78ZYFo #Semiconductor,en,Applied Materials
Mon Jul 07 23:01:29 +0000 2014,In 1hr a briefing on the Applied Materials/Tokyo Electron merger http://t.co/2W5E78ZYFo #Semiconductor,en,Applied Materials
Mon Jul 07 22:37:16 +0000 2014,"In hyperconnected world, preferred mode of communication is visual. That creates opportunity- Ali Salehpour http://t.co/2W5E78ZYFo #Display",en,Applied Materials
Mon Jul 07 21:41:52 +0000 2014,"We are the precision materials engineering company, enabling the largest inflections- Randhir Thakur http://t.co/2W5E78ZYFo #Semiconductor",en,Applied Materials
Mon Jul 07 20:54:53 +0000 2014,This is the most exciting time @ Applied. We share a tremendous passion to enable customers’ success- Gary Dickerson. http://t.co/fv5cCTjL0m,en,Applied Materials
Mon Jul 07 20:31:16 +0000 2014,Starting NOW Applied Materials 2014 Analyst Briefing http://t.co/2W5E78ZYFo,en,Applied Materials
Mon Jul 07 17:30:28 +0000 2014,Today @ 5pm: briefing on the Applied Materials/Tokyo Electron merger http://t.co/2W5E78ZYFo #Semiconductor,en,Applied Materials
Mon Jul 07 17:01:19 +0000 2014,Beginning @ 1:30pm stream the Applied Materials analyst briefing http://t.co/2W5E78ZYFo #Semiconductor,en,Applied Materials
Mon Jul 07 15:16:57 +0000 2014,New Products Enable High-Volume Manufacturing of 3D Devices http://t.co/PoAJyteTX8 #Semiconductor,en,Applied Materials
Thu Jul 03 18:03:02 +0000 2014,Join us for a briefing on the Applied Materials/Tokyo Electron merger on 7/7 http://t.co/fv5cCTjL0m #Semiconductor,en,Applied Materials
Tue Jul 01 20:35:45 +0000 2014,Applied Materials’ Chris Bencher reviews the evolution &amp; future of self-aligned double patterning in @SPIEtweets vdo http://t.co/4wCPFLGjr1,en,Applied Materials
Tue Jul 01 20:27:02 +0000 2014,Applied Materials’ Chris Bencher reviews the evolution of self-aligned double patterning and looks to its future. http://t.co/rLBoaB3NMH,en,Applied Materials
Mon Jun 30 15:54:00 +0000 2014,Applied Materials Advances Ion Implant Technology for 3D Chip Architectures http://t.co/0rkIjS0NLu #Semiconductor,en,Applied Materials
Fri Jun 27 18:29:45 +0000 2014,STEM²: Connecting Grade Schools with Industry http://t.co/s86vJLqYJJ #Semiconductor,en,Applied Materials
Wed Jun 25 16:09:57 +0000 2014,Applied Materials 2014 Analyst Briefings &amp; SEMICON West Sessions http://t.co/KJfzz7Evy8 #Semiconductor,en,Applied Materials
Tue Jun 24 21:17:09 +0000 2014,Join Us for 2nd Annual Silicon Innovation Forum at #SEMICONWest http://t.co/tU6vSpVd1F,en,Applied Materials
Mon Jun 23 22:43:11 +0000 2014,Applied Materials Announces Stockholder Approval of its Proposed Combination with Tokyo Electron http://t.co/2FL54wvuWD,en,Applied Materials
Mon Jun 23 16:37:16 +0000 2014,"Applied Materials to Host Analyst Briefings on Monday, July 7 http://t.co/XdmgIFI9ZZ",en,Applied Materials
Thu Jun 19 20:09:06 +0000 2014,"Applied Materials will be at SEMICON West and Intersolar NA in San Francisco July 8 – 10, 2014. http://t.co/A4MV7t4zjY #Semiconductor",en,Applied Materials
Wed Jun 18 18:36:26 +0000 2014,Innovating for a Cleaner and Greener Silicon Valley http://t.co/FGIgkfNKJl,en,Applied Materials
Tue Jun 10 17:47:14 +0000 2014,Congratulations to Ted Turner on being honored as the James C. Morgan 2014 Global Humanitarian http://t.co/q3dDNKFEUm http://t.co/R4SbmGqd7k,en,Applied Materials
Mon Jun 09 22:53:59 +0000 2014,Are we seeing a revolution in biotechnology? @Applied_VC thinks so http://t.co/CSSN9RZAF8 #VC #Semiconductor,en,Applied Materials
Mon Jun 09 15:17:16 +0000 2014,Applied Ventures Broadens Portfolio with Strategic Biotechnology Investment http://t.co/za9OsQ92D9,en,Applied Materials
Sat Jun 07 22:19:18 +0000 2014,RT @Applied_VC: Are you attending #BBGNBT on 6/9? Be sure to see @Applied_VC at the Women &amp; Tech Breakfast,en,Applied Materials
Fri Jun 06 17:29:07 +0000 2014,@agrouse89 @CityYearSanJose Enjoy the visit! We have lots of great stuff for you to see and learn about.,en,Applied Materials
Thu Jun 05 22:00:52 +0000 2014,"Success is the ability to “change &amp; pivot with the needs of the market,” Eileen Tanghal GM of @Applied_VC http://t.co/OtqUUBoaCu #VC",en,Applied Materials
Thu Jun 05 19:02:16 +0000 2014,Eileen Tanghal of @Applied_VC counsels start-ups to look for big tides that raise a lot of ships in @IBDinvestors http://t.co/OtqUUBoaCu #VC,en,Applied Materials
Thu Jun 05 16:00:07 +0000 2014,".@IBDinvestors interviews Eileen Tanghal @etanghal75 on @Applied_VC strategy &amp; advancing company, career growth http://t.co/OtqUUBoaCu #VC",en,Applied Materials
Wed Jun 04 16:01:06 +0000 2014,First Metallization Solution for High-Volume Manufacturing of #TSVs http://t.co/6YsJ4IrGUE #Semiconductor,en,Applied Materials
Wed May 28 15:33:07 +0000 2014,Applied Materials Enables Cost-Effective Vertical Integration of 3D Chips http://t.co/WewxfPwEPm #Semiconductor #TSVs http://t.co/8YhUsfScxY,en,Applied Materials
Fri May 16 16:03:06 +0000 2014,Applied Materials to Present at Upcoming Investor Conferences http://t.co/r66VAXROWs,en,Applied Materials
Tue May 13 23:55:25 +0000 2014,New Volta cobalt system extends copper interconnects to future gens of high-performance chips http://t.co/6oTHYY7TYO http://t.co/071unafGFL,en,Applied Materials
Tue May 13 17:01:35 +0000 2014,"RT @donal888: Could the hottest topic in semiconductor fabs turn out to be cobalt? Applied Materials says yes, on @wsjd: http://t.co/L5ZTmm…",en,Applied Materials
Tue May 13 16:01:34 +0000 2014,Applied Materials enables biggest materials change in interconnect tech in 15yrs with Volta CVD Cobalt http://t.co/6oTHYY7TYO #Semiconductor,en,Applied Materials
Wed May 07 15:16:56 +0000 2014,Green Schooling: Unearthing the Next Generation of Environmental Leaders http://t.co/8KpT6ai825,en,Applied Materials
Mon Apr 28 18:28:52 +0000 2014,Can Legacy Fabs Keep Up with #IoT Demand? http://t.co/0T8OXcE8XO #InternetofThings #Semiconductor #Service,en,Applied Materials
Mon Apr 21 18:04:36 +0000 2014,"Happy 24th Anniversary, Endura! http://t.co/gv4r16hAfu #semiconductor",en,Applied Materials
Thu Apr 10 22:35:40 +0000 2014,Applied Materials Receives Intel's Preferred Quality Supplier Award http://t.co/YJmnvRMMEj,en,Applied Materials
Mon Mar 31 17:03:46 +0000 2014,CD-SEM Sees Beyond &lt;10 nanometer Nodes http://t.co/oewMLZo1F9 #Semiconductor,ht,Applied Materials
Tue Mar 25 19:00:24 +0000 2014,"#Service Model Evolution – meeting rigorous manufacturing requirements, advancing the #semiconductor industry http://t.co/oGdCzJ417S",en,Applied Materials
Thu Mar 20 16:22:15 +0000 2014,Applied Materials Honored as a 2014 World's Most Ethical Company by the Ethisphere Institute http://t.co/eHLVPY2F30,en,Applied Materials
Tue Mar 11 16:21:00 +0000 2014,Enabling #Wearable Electronics in the Internet of Things Era http://t.co/pvhL3j2MEd #IoT #tech,en,Applied Materials
Fri Mar 07 18:02:55 +0000 2014,Applied Materials employees help recovery efforts of fire-destroyed state park http://t.co/WxziI6bqao http://t.co/MKZgU3RqRu,en,Applied Materials
Tue Mar 04 16:46:47 +0000 2014,Applied Materials Announces Cash Dividend http://t.co/nDDFf4J3vZ,en,Applied Materials
Mon Feb 24 21:25:38 +0000 2014,Applied Materials and Tokyo Electron Receive CFIUS Clearance for Proposed Combination http://t.co/ZEdbzyiC0k,en,Applied Materials
Fri Feb 21 18:16:15 +0000 2014,"RT @Applied_VC: Samsung, Intel Capital &amp; Applied Materials Fund Inpria to Develop Advanced #Semiconductor #Materials http://t.co/JxpEGPDI0P…",en,Applied Materials
Thu Feb 20 21:55:50 +0000 2014,Engaging Research Institutions to Drive Innovation | The Applied Materials Blog http://t.co/JBgn55OblG,en,Applied Materials
Tue Feb 18 20:39:29 +0000 2014,Applied Materials to Present at 2014 #SPIE Advanced Lithography Conference http://t.co/MKXAwqLx9a @SPIEtweets,en,Applied Materials
Wed Feb 12 21:50:41 +0000 2014,Applied Materials Announces First Quarter Results http://t.co/b0etyw7W50,en,Applied Materials
Thu Feb 06 16:16:25 +0000 2014,Applied Materials to Present at Goldman Sachs Technology and Internet Conference 2014 http://t.co/eYF4ITzJsW,en,Applied Materials
Fri Jan 31 17:06:52 +0000 2014,Happy Lunar New Year from Applied Materials! http://t.co/OmJMe9ShSR,en,Applied Materials
Fri Jan 31 16:19:25 +0000 2014,"Applied Materials to Hold Q1 FY2014 Earnings Webcast on February 12, 2014 at 4:30 p.m. ET http://t.co/KhJmGBuwaO",en,Applied Materials
Thu Jan 30 19:17:25 +0000 2014,Developing Grade-School #STEM Educators http://t.co/Q7GbAPFRFt #semiconductor #careers #science http://t.co/jJqZ9Rr3X9,en,Applied Materials
Mon Jan 27 23:00:10 +0000 2014,Key Inflections for 2014 as outlined by Applied’s Randhir Thakur http://t.co/eEcnX7M6O1  #semiconductor #memory #mobility #outlook,en,Applied Materials
Mon Jan 27 20:02:47 +0000 2014,"Applied’s Randhir Thakur: shift to 20nm designs, FinFET transistors &amp; 3D NAND game-changing in 2014 http://t.co/eEcnX7M6O1 #semiconductor",en,Applied Materials
Mon Jan 27 19:01:03 +0000 2014,#AppliedMaterials’ Executive VP Randhir Thakur shares his outlook for 2014  http://t.co/z3c8O4wlVX #semiconductor http://t.co/gNJjgSrWKm,en,Applied Materials
Mon Jan 27 18:17:11 +0000 2014,Applied Materials Recognizes Top Suppliers at Executive Supplier Forum http://t.co/HwASbgB2Wd #semiconductor,en,Applied Materials
Tue Jan 21 20:03:21 +0000 2014,"@Applied_VC’s latest investments in advanced imaging detection companies Oncoscope, Inc. &amp; Passport Systems Inc. http://t.co/pt30JsTKm7",en,Applied Materials
Tue Jan 21 19:34:35 +0000 2014,RT @Applied_VC: Applied Ventures Expands Portfolio with Strategic Investments in Advanced Imaging Technology Companies http://t.co/XhklQI1h…,en,Applied Materials
Tue Jan 14 19:00:13 +0000 2014,If you're at SEMI ISS this week don't miss Mike Splinter on Wed's CEO Panel at 10:15am http://t.co/mJoLo8A8hB,en,Applied Materials
Fri Jan 10 00:03:00 +0000 2014,Applied Materials Executive Chairman Mike Splinter speaks on CEO panel at SEMI’s ISS next week http://t.co/mJoLo8A8hB #semiconductor,en,Applied Materials
Thu Jan 09 23:30:42 +0000 2014,Applied’s Eric Witherspoon spoke on Inside Silicon Valley about innovating with internal &amp; external collaboration http://t.co/rZiYo3WThr,en,Applied Materials
Thu Jan 09 23:02:02 +0000 2014,Will germanium succeed silicon as the alternative channel material for transistors? @SemiEngineering http://t.co/Fv3oer2FrO,en,Applied Materials
Thu Jan 09 20:01:41 +0000 2014,"#AppliedMaterials attends SEMI’s Industry Strategy Symposium (ISS) next week in Half Moon Bay, CA http://t.co/mJoLo8A8hB #semiconductor",en,Applied Materials
Thu Jan 09 18:09:14 +0000 2014,Should Silicon Valley be called “Innovation Valley” because of its innovation ecosystem? http://t.co/vdm4Rcwq8P http://t.co/KSPiDMapqP,en,Applied Materials
Mon Dec 23 19:29:13 +0000 2013,Happy Holidays from Applied Materials! http://t.co/0md2KklvyV http://t.co/PsziRaAjJt,en,Applied Materials
Mon Dec 23 17:20:43 +0000 2013,View Applied Materials list of ‘Top 10 Blog Post for 2013.’ #semiconductor # display http://t.co/7JWcYyGToj,en,Applied Materials
Fri Dec 20 22:50:50 +0000 2013,This has been an exciting year for Applied Materials! Check out our Top Blog Posts of 2013 #semiconductor # display http://t.co/7JWcYyGToj,en,Applied Materials
Thu Dec 19 19:21:46 +0000 2013,Applied Materials’ Silicon Valley Turkey Trot raises nearly $4.5m for local charities http://t.co/lr3SiUZwqh http://t.co/DidR8lyInn,en,Applied Materials
Tue Dec 17 20:54:21 +0000 2013,#AppliedMaterials distinguished technologists Ron Naftali &amp; Shinichi Kurita named Applied Materials Fellows http://t.co/V9hl24BM7y,en,Applied Materials
Mon Dec 16 20:23:09 +0000 2013,"Today is the 66th anniversary of the first working #transistor, the most ubiquitous man-made device on the planet http://t.co/IGGEabGmuZ",en,Applied Materials
Mon Dec 16 18:15:25 +0000 2013,"Happy 66th, Transistor! http://t.co/IGGEabGmuZ #Semiconductors",en,Applied Materials
Fri Dec 13 23:00:29 +0000 2013,"#AppliedMaterials employees packed 100,000 lbs of food at @2ndharvest for families in need http://t.co/6Lv9YMGlNI",en,Applied Materials
