created_at,full_text,lang,user_name
Fri Jun 03 13:13:15 +0000 2016,Parenteral nutrition helped save &amp; sustain Mikaela and her baby through a traumatic experience &amp; into a positive https://t.co/ogynWhiy8c,en,Baxter International
Wed Jun 01 13:46:13 +0000 2016,Baxter supports @Sightsavers mission to provide critical eye care to those in need https://t.co/EUAurXgOY1 https://t.co/aIGF9qi9ZY,en,Baxter International
Thu May 26 13:53:15 +0000 2016,Smart infusion pumps promote infusion safety. Learn more https://t.co/ESBQ5pZCxY #SmartPump #healthit https://t.co/m1Ev7aK5RZ,en,Baxter International
Wed May 25 20:03:23 +0000 2016,"Baxter employees in Japan introduce treatment options for kidney disease to more than 1,000 students #medtech https://t.co/MCdvwOdiMH",en,Baxter International
Wed May 25 13:07:12 +0000 2016,Baxter showcases new advancements in renal care at #ERAEDTA16 https://t.co/BuMHldlnNy https://t.co/m0xt0JCckG,en,Baxter International
Tue May 24 14:40:02 +0000 2016,Baxter presenting two data posters on the impact of hemostatic agent choice on cardiac and spine surgery costs and outcomes at #ISPORDC G14,en,Baxter International
Tue May 24 12:30:29 +0000 2016,Baxter unveils a new class of dialyser at #ERAEDTA16 #congress #nephrology https://t.co/BuMHldlnNy,en,Baxter International
Mon May 23 18:40:29 +0000 2016,"Baxter data (SP416, MP464) shows efficacy of novel MCO dialysers to expand range of toxin removal; #ERAEDTA16 https://t.co/PxKeZlTbwL",en,Baxter International
Mon May 23 12:18:15 +0000 2016,"RT @sesp_nu: Biotechnology, life science symposium inspires teachers https://t.co/FhQdONiGcN @NorthwesternU @baxter_intl @NU_OSEP https://t…",en,Baxter International
Mon May 23 12:17:58 +0000 2016,RT @EMJNephrology: And the prize for #ERAEDTA16's most futuristic stand goes to... [nsert drumroll here]... @baxter_intl. #nephrology https…,en,Baxter International
Mon May 23 12:09:58 +0000 2016,Baxter presents 24 abstracts @#ERAEDTA16  focused on elevating quality of renal patient care; https://t.co/9V9c7gb8bN #nephrology,en,Baxter International
Mon May 23 09:45:18 +0000 2016,"Optimize renal patient journey:  clinical-economic
outcomes/remote monitoring #ERAEDTA16; May
23, Hall D, 2, 1:30-3 https://t.co/MFHgCCEtVh",en,Baxter International
Sat May 21 12:43:17 +0000 2016,"ICHD symposium #ERAEDTA16: emerging data high
molecular toxins removal for improved renal patient outcomes; May 22,
Hall C, 2, 1:30-2:45",en,Baxter International
Fri May 20 18:23:16 +0000 2016,RT @ChicagoInno: .@ISTCoalition's #STEMChallenge posed real industry problems to high school students. Here's what they came up with: https…,en,Baxter International
Thu May 19 20:29:54 +0000 2016,"RT @ISTCoalition: Students tackling @baxter_intl #STEMChallenge learned design thinking, prototyping, app design https://t.co/OqTHHzqa0K",en,Baxter International
Thu May 19 12:51:09 +0000 2016,"RT @SchweitzerASF: Thx @baxter_intl for marking the CHI Chapter’s 20th anniversary. Your longtime support makes our work possible!
https://…",en,Baxter International
Thu May 19 12:49:43 +0000 2016,"RT @21stShow: Baxter Healthcare's Alan Solomon mentors #ILstudents, gives them hands-on experience w/#STEMChallenges @ISTCoalition #The21st…",en,Baxter International
Wed May 18 16:35:40 +0000 2016,Health Affairs founding editor John K. Iglehart named 2016 recipient of #WilliamBGrahamPrize https://t.co/0q0rKckzdC,en,Baxter International
Wed May 18 13:20:12 +0000 2016,"Study finds higher-risk IV meds are frequently adjusted when administered, introducing many opps for error #INS2016 https://t.co/4rzNHh7dlT",en,Baxter International
Tue May 17 17:23:50 +0000 2016,Baxter mentors help train the next generation of innovators as part of #STEMChallenge https://t.co/jxP8QbtGIK,en,Baxter International
Tue May 17 13:02:14 +0000 2016,"Sharing perspectives on successful collaboration between large and small companies https://t.co/MtsQ9CJ5ga @asissel and Adam Berman, TVA Med",en,Baxter International
Fri May 13 17:04:28 +0000 2016,"Celebrating those supporting the health + wellbeing of their community through compassion, dedication #HospitalWeek https://t.co/k1GLJIkvDd",en,Baxter International
Thu May 12 16:52:40 +0000 2016,RT @ISTCoalition: Students @LMSAEagles present #healthcare #STEMChallenge soln to @baxter_intl mentors: #innovative #dialysis design https:…,en,Baxter International
Mon May 09 20:42:56 +0000 2016,Baxter Highlights Business Strategies and Innovation at 2016 Investor Conference https://t.co/g08ObDJt3O https://t.co/tJ5cUKTLLm,en,Baxter International
Mon May 09 16:53:03 +0000 2016,@A_Safe_Haven improves access to care for Chicago's most vulnerable with health assessments https://t.co/tMGVzo0u8R https://t.co/MgsK4iNDP4,en,Baxter International
Fri May 06 13:30:20 +0000 2016,"In honor of #NationalNursesWeek Baxter recognizes its own nurses, those who make a difference for patients every day https://t.co/7PK0o1hGGF",en,Baxter International
Tue May 03 12:43:07 +0000 2016,Baxter Raises Quarterly Dividend https://t.co/YgL5yjzlsZ,en,Baxter International
Mon May 02 13:50:49 +0000 2016,"From postman to beekeeper, read how one patient’s therapy inspired him to pursue his dreams https://t.co/WMFHBOFbRw https://t.co/EdoGzbTQmV",en,Baxter International
Fri Apr 29 18:45:51 +0000 2016,"With @DirectRelief, Baxter products are able to meet critical care needs for those affected by earthquake in Ecuador https://t.co/KUsSOrCokm",en,Baxter International
Thu Apr 28 21:29:50 +0000 2016,Woman Engineer mag named Baxter Top 50 Employer for creating positive working environment for women in #STEM https://t.co/NXVI7QyebM,en,Baxter International
Thu Apr 28 16:37:51 +0000 2016,RT @Dr_JakeLong: Thank you @baxter_intl for your help in giving our students this opportunity. Thx community support for @FRCTeam16 https:/…,en,Baxter International
Wed Apr 27 13:08:55 +0000 2016,"Wishing our hard-working teams @FRCTeam16, Spencerport and Punabots
good luck at #FIRST championships https://t.co/WQ8V7hLjss",en,Baxter International
Tue Apr 26 18:39:22 +0000 2016,"Baxter named as one of @CR_Mag 100 Best Corporate Citizens for
unwavering commitment to #CSR https://t.co/I8wNM9F4uV https://t.co/7LvetMR5mO",en,Baxter International
Tue Apr 26 16:33:20 +0000 2016,Baxter’s Halit Bander discusses building #STEM talent to advance patient care at 7th Illinois Women’s Conference https://t.co/fzpO9H739g,en,Baxter International
Tue Apr 26 11:10:50 +0000 2016,Baxter Reports First Quarter 2016 Results and Provides Updated Financial Outlook for Full-Year 2016 https://t.co/saQtSRYfZz,en,Baxter International
Thu Apr 21 13:18:26 +0000 2016,"@CommHealthChi recognizes Baxter for advocating access to essential
healthcare for Chicago’s medically vulnerable https://t.co/xg4t2ykHKm",en,Baxter International
Wed Apr 20 13:28:47 +0000 2016,Baxter receives Marketing Authorization in UK &amp; DK for only IV nutrition in 3C bag for vulnerable neonate patients https://t.co/IPvODdag0Q,en,Baxter International
Tue Apr 19 18:49:49 +0000 2016,Baxter launches antibiotic in ready-to-use premixed presentation in U.S. https://t.co/HrjtbScwz2,en,Baxter International
Tue Apr 19 16:27:00 +0000 2016,The 2016 Baxter Young Investigator Awards now open for grad students and post-doc fellows to apply by June 30 https://t.co/Hrryk7u2tX,en,Baxter International
Tue Apr 19 13:12:15 +0000 2016,Baxter has been reconfirmed in the Ethibel #Sustainability Index Excellence Global for outstanding #CSR performance https://t.co/fs3cW1dHbI,en,Baxter International
Mon Apr 18 14:28:29 +0000 2016,"Baxter employees in Brussels volunteer in @green4girls
initiative, inspiring girls of all ages to pursue #STEM https://t.co/RQTSWqipC5",en,Baxter International
Fri Apr 15 18:01:20 +0000 2016,"@SchweitzerASF inspire and serve Chicago’s medically vulnerable, linking young talent and public health programs https://t.co/Hm0a1f5AO6",en,Baxter International
Fri Apr 15 14:45:13 +0000 2016,Baxter recognized for #diversity and inclusion and #CSR initiatives https://t.co/2Gz4TV9T8J https://t.co/n5rHRNIZiM,en,Baxter International
Thu Apr 14 15:50:56 +0000 2016,Baxter and @WVINdia launch mobile #app to improve #health status of young mothers and infants in India https://t.co/2Gz4TV9T8J,en,Baxter International
Tue Apr 12 12:48:20 +0000 2016,"In honor of #NationalVolunteerWeek, thanks to Baxter employees who contributed 49,000 hours in 2015 to help others https://t.co/YMwlDT13kc",en,Baxter International
Mon Apr 11 21:46:36 +0000 2016,"RT @CommHealthChi: We &lt;3 @baxter_intl, Mission Champion &amp; Corporations That Care Award winner #CelebrationOfCare 4/14. TU 4 advocating acce…",en,Baxter International
Tue Apr 05 13:14:03 +0000 2016,Baxter Toongabbie new solar energy system further reduces carbon footprint #sustainability https://t.co/X7yqr1g6QB https://t.co/uwDYGAsukl,en,Baxter International
Fri Apr 01 16:59:30 +0000 2016,RT @AWISNational: Anne Sissel @asissel @baxter_intl We have to be more outcome focused in healthcare which makes digital health a hot trend…,en,Baxter International
Thu Mar 31 13:00:13 +0000 2016,"Home renal patient @SouthendNHS finds secure, 2-way connectivity
allows HCPs to remote monitor, respond
accordingly https://t.co/m8dhmSAxJA",en,Baxter International
Wed Mar 30 14:59:15 +0000 2016,Baxter selected as one of @Forbes America’s Best Employers https://t.co/coeDusy1KA,en,Baxter International
Wed Mar 30 13:12:01 +0000 2016,Recognizing dedicated healthcare pros that help us fulfill our mission to save + sustain lives #NationalDoctorsDay https://t.co/tPWvLYZYsP,en,Baxter International
Tue Mar 29 13:20:54 +0000 2016,Baxter employees in China capture award win for #CSR program designed to advance access to care and education https://t.co/sFEirNGPmO,en,Baxter International
Fri Mar 25 13:13:03 +0000 2016,"Baxter’s Denise Banks honored as @ChiDefender Women of Excellence, inspiring others through vision and leadership https://t.co/Ndn066143H",en,Baxter International
Thu Mar 24 18:09:27 +0000 2016,"Congrats to Baxter’s Meg McKenna, honored @HBAnet Luminary for great mentoring+leadership https://t.co/2hWdi5wZGY https://t.co/VcZTJTjncA",en,Baxter International
Thu Mar 24 14:00:52 +0000 2016,"DC #connectedhealth includes home renal peritoneal
dialysis tech demo: AMIA APD system w/ SHARESOURCE remote connect https://t.co/0IsKlF86mv",ro,Baxter International
Thu Mar 24 12:54:01 +0000 2016,"Baxter completes CE Mark for expanded indication of
surgical patch in European Union https://t.co/wdlwOZhPP3",en,Baxter International
Tue Mar 22 13:35:41 +0000 2016,Baxter recognized by @2020WOB for championing gender #diversity on its board https://t.co/8I9Ka8gxJN,en,Baxter International
Mon Mar 21 20:48:58 +0000 2016,RT @actonline: 2/23 don't miss #connectedhealth demo (https://t.co/2xZamNsQTZ) w/ @AirStripmHealth @AviziaHealth @baxter_intl @Cisco @CareI…,en,Baxter International
Mon Mar 21 14:21:57 +0000 2016,"Part of R&amp;D #STEM Learning Exchange, @LMSAEagles students engage w/ Baxter products + therapies in our learning lab https://t.co/1BNnn39XbW",en,Baxter International
Fri Mar 11 17:32:13 +0000 2016,"Baxter held #SupplierDiversity Fair, advancing pool of diverse suppliers through #education and #mentorship https://t.co/4r8dfKAmbX",en,Baxter International
Thu Mar 10 15:45:19 +0000 2016,High school student and PD patient inspired to become a nephrology nurse #WorldKidneyDay https://t.co/VSszEQvSdk https://t.co/mlZV0AcBGL,en,Baxter International
Tue Mar 08 16:23:35 +0000 2016,Baxter’s Stacie Phillips shares insights on professional development opps for women #IWD2016 https://t.co/mqO2S8fe3A https://t.co/uCJdSxKOc0,en,Baxter International
Thu Mar 03 14:10:23 +0000 2016,RT @smilefoundation: A #health session by Swabhiman Program at a local #school. We thank @baxter_intl for their support to the project. htt…,en,Baxter International
Tue Mar 01 14:14:16 +0000 2016,"Baxter sponsored @westsydunews Ideas Lab, showcasing benefits of treating chronic and acute conditions in the home https://t.co/csu9WwoEKb",en,Baxter International
Mon Feb 29 14:25:30 +0000 2016,RT @WVIndia: Mobile #app launched to enhance #health status of young #mothers &amp; #infants. #MCHN #Bengaluru https://t.co/kegswEN6m6 @Baxter_…,en,Baxter International
Mon Feb 29 13:29:13 +0000 2016,Baxter ranks top 10 in @ideapharma #InnovationIndex for success in delivering innovation to patients https://t.co/yZNd8z7VHz,en,Baxter International
Fri Feb 26 17:45:46 +0000 2016,RT @ChicagoBlueSky: Newest members of #TheBlueNetwork share how networking helped them rise to top. https://t.co/QZGFyliyh8 https://t.co/G1…,en,Baxter International
Fri Feb 26 03:14:56 +0000 2016,"RT @TrevorProject: We thank @baxter_intl  for their grant that ""innovate[s] the ways..we offer lifesaving and life-affirming support""✨ http…",en,Baxter International
Thu Feb 25 17:49:23 +0000 2016,Baxter honored at 6th Hong Kong Outstanding Corporate Citizenship Awards for its distinguished #CSR performance https://t.co/Q6fxfhcAQj,en,Baxter International
Tue Feb 23 19:12:47 +0000 2016,RT @teachbiotech: Ms. Byrne's Princeton HS bio students separating proteins using SDS-PAGE #baxterbox #teachbiotech @baxter_intl https://t.…,en,Baxter International
Sat Feb 20 15:03:40 +0000 2016,Baxter Declares Quarterly Dividend https://t.co/AFq9etwxPN,en,Baxter International
Sat Feb 20 15:03:40 +0000 2016,Baxter Announces Fourth Quarter Results and Provides 2016 Financial Outlook https://t.co/GR77v7rGd5,en,Baxter International
Tue Feb 16 16:37:50 +0000 2016,"With Murcia Health Service, new Baxter dialysis center in Spain uses latest tech in treating chronic kidney disease https://t.co/PJm48HHsjE",en,Baxter International
Fri Feb 12 15:47:26 +0000 2016,Baxter’s BioPharma facility in Germany receives ISPE Facility of the Year Award #FOYA for operational excellence https://t.co/8t0giZ3zkJ,en,Baxter International
Thu Feb 11 18:18:50 +0000 2016,Celebrating #WomenInSTEM who make incredible strides every day in fulfilling our mission to save and sustain lives https://t.co/vEkiIQ9NBh,en,Baxter International
Fri Feb 05 17:23:52 +0000 2016,"RT @teachbiotech: Glowing green GFP chromatography w/BCoE fave Ms. Byrne's students @ Princeton HS, IL! @BioRadEducation @baxter_intl https…",en,Baxter International
Thu Feb 04 14:24:51 +0000 2016,Baxter employees share support and culinary skills with families at @RMHC by Central DuPage Hospital #volunteerism https://t.co/qBlsD58h44,en,Baxter International
Wed Feb 03 17:06:43 +0000 2016,"RT @EBNmagazine: Baxter supports multigenerational workforce, diversity https://t.co/I8J4yNftmJ #HR #employeeengagement",en,Baxter International
Tue Feb 02 20:17:32 +0000 2016,Baxter Announces Fourth Quarter Results and Provides 2016 Financial Outlook https://t.co/hkqdqf06go,en,Baxter International
Mon Jan 25 17:40:49 +0000 2016,RT @QueenValleyMed: Queen of the Valley named finalist for 2015 Foster G. McGraw Prize for exemplary community service #BaxIntFoundation ht…,en,Baxter International
Thu Jan 21 17:50:04 +0000 2016,RT @ThedaCareHealth: We are honored to be a finalist for the 2015 Foster G. McGaw Prize! Learn how we strive to support our community: http…,en,Baxter International
Wed Jan 20 19:19:01 +0000 2016,RT @LGHealth: LG Health is a 2015 Foster G. McGaw Prize for Excellence in Community Service finalist: https://t.co/lawf54NXs8 https://t.co/…,en,Baxter International
Tue Jan 19 14:49:47 +0000 2016,Foster G. McGaw awarded to @MassGeneral for outstanding community service #BaxtIntFoundation https://t.co/AQBRXsmmGR https://t.co/kZZ27137gn,en,Baxter International
Mon Jan 18 21:16:00 +0000 2016,"Honoring Martin Luther King, Jr.’s call for inclusion and equality #MLKDay https://t.co/UvnlPKEgtq",en,Baxter International
Fri Jan 15 17:10:56 +0000 2016,RT @ISTCoalition: We kicked off our RDLE #STEM Learning Exchange Challenge with @BeNoble Muchin College Prep &amp; @baxter_intl yesterday! http…,en,Baxter International
Fri Jan 15 15:24:19 +0000 2016,16 Baxter Philippines employees plant trees and maintain the nursery of seedlings with @GoHaribon #volunteerism https://t.co/wFwLeK7Oil,en,Baxter International
Thu Jan 14 21:14:15 +0000 2016,A Baxter employee feels the impact his work has on HD patients. Read his story https://t.co/2G4maoJd7v https://t.co/afe8lwrzSk,en,Baxter International
Tue Jan 12 19:37:33 +0000 2016,"For 14th consecutive year, Baxter achieves #FTSE4Good Global Index ranking for strong environmental, social and governance practices #CSR",en,Baxter International
Tue Jan 12 14:55:28 +0000 2016,Baxter’s education on parenteral nutrition improves lives of #healthcare pros and patients https://t.co/9zHmam1rJU https://t.co/xwDud2YsCb,en,Baxter International
Fri Jan 08 14:38:33 +0000 2016,Baxter Thailand recognized by @AMCHAMThailand for third consecutive year for exemplary #CSR programs https://t.co/4PSl8LUy2M,en,Baxter International
Wed Jan 06 13:48:25 +0000 2016,"Muchin College Prep students recently visited Baxter’s Round Lake, Ill. facility to learn about #STEM careers https://t.co/X3GCkIelVJ",en,Baxter International
Tue Jan 05 14:54:24 +0000 2016,Baxter product #donations help save lives during medical missions in El Salvador. Learn more https://t.co/3reT3aDBl3 https://t.co/H3SjwztPqO,en,Baxter International
Mon Dec 21 14:59:24 +0000 2015,Baxter delivers the key to the newly built @Habitat_org home – the 11th family receiving a Baxter Habitat home https://t.co/phGk609T5C,en,Baxter International
Wed Dec 16 13:46:48 +0000 2015,Baxter employees share thoughts on working with and benefiting from four different generations in the workplace https://t.co/iutdL3VCp5,en,Baxter International
Tue Dec 15 18:38:21 +0000 2015,RT @chibreakingbiz: About three dozen Illinois businesses receive perfect LGBT rights scores in @HRC survey https://t.co/S3WqG5HPEt https:/…,en,Baxter International
Mon Dec 14 15:31:17 +0000 2015,"When her kids relied on Baxter products, Wendy's commitment to quality care became personal https://t.co/kCdBUWJ4UF https://t.co/E1JOsnQ2CY",en,Baxter International
Thu Dec 10 16:53:12 +0000 2015,"#BaxIntFoundation celebrates 20th Anniversary of @SchweitzerASF, training skilled leaders in health professions https://t.co/Pk6YkNhQaJ",en,Baxter International
Mon Dec 07 16:57:06 +0000 2015,Neurosurgeon Dr. Kim fulfills his childhood dream of saving lives. Read his story https://t.co/nx2vHZEGL9 https://t.co/4EzyTARUwN,en,Baxter International
Wed Dec 02 17:53:45 +0000 2015,"“I would not change anything in my journey with the Baxter family”– Cynthia McCool, 40+ years @ Baxter Cleveland https://t.co/CZKu8HGZ0K",en,Baxter International
Tue Dec 01 16:36:00 +0000 2015,Union Hospital sees improved patient experience with new infusion pump platform https://t.co/rJQTxwfaUb https://t.co/hsFgCSlhF1,en,Baxter International
Wed Nov 25 15:04:33 +0000 2015,Congrats to Baxter Ireland facilities for Occupational Safety Award from National Irish Safety Org. for proactive #safety management,en,Baxter International
Tue Nov 24 20:19:15 +0000 2015,@CDP recognizes Baxter for climate change transparency and awards Baxter position on S&amp;P Climate Disclosure Index https://t.co/AQVNhwEEUF,en,Baxter International
Tue Nov 24 16:50:35 +0000 2015,"Longest Baxter manufacturing operation celebrates 65 years of impact in Cleveland, Miss. https://t.co/CZKu8HGZ0K https://t.co/ITOTrH2LW3",en,Baxter International
Mon Nov 23 14:06:33 +0000 2015,"Baxter is participating in @United CarbonChoice program, effectively allowing its employees to travel #carbonneutral on United",en,Baxter International
Fri Nov 20 14:01:09 +0000 2015,@CradleAdoption recognized Baxter with the Silver Cradle for continued support for employees interested in adoption https://t.co/BFwzAQ2TAZ,en,Baxter International
Thu Nov 19 14:14:24 +0000 2015,Baxter honored today by Women’s Forum of NY @ Breakfast of Corp Champions for outstanding diversity in leadership,en,Baxter International
Wed Nov 18 19:58:48 +0000 2015,"At Baxter, saving and sustaining lives is our mission and the purpose behind our work https://t.co/m18jzGNZFC",en,Baxter International
Wed Nov 18 16:21:50 +0000 2015,Baxter receives perfect score in @HRC #CEI2016 https://t.co/4sWJfMg9v2,en,Baxter International
Tue Nov 17 14:31:05 +0000 2015,@EnvDefenseFund #Climate Corps graduate students help Baxter explore energy efficiency and emissions reduction opps https://t.co/Nqy8RcIGpL,en,Baxter International
Fri Nov 13 14:12:51 +0000 2015,Baxter recognized as first healthcare company in Italy to achieve #LEED Gold for sustainable construction in Rome https://t.co/0CWiIKM9nt,en,Baxter International
Thu Nov 12 13:32:12 +0000 2015,Baxter’s showing Hispanic engineers how they can help save and sustain lives at booth #2218 #SHPE2015,en,Baxter International
Wed Nov 11 16:51:47 +0000 2015,Thanking military veterans for their contributions to our company and country in honor of #VeteransDay https://t.co/ZHkNf9pnLY,en,Baxter International
Tue Nov 10 14:56:16 +0000 2015,Baxter recognized as 2015 @WGEAgency Employer of Choice for outstanding commitment to gender equality #EOCGE https://t.co/VMgQeGdT2V,en,Baxter International
Fri Nov 06 18:08:04 +0000 2015,"Preliminary PDOPPS data show variability among PD practices and patients in U.S., Canada and Japan. Abstract FR-OR032 #KidneyWk",en,Baxter International
Fri Nov 06 16:11:24 +0000 2015,Study shows intensive home HD associated with 45% reduction in mortality. Learn more at booth 729 #KidneyWk,en,Baxter International
Thu Nov 05 20:00:23 +0000 2015,"Learn about home dialysis at “Home Dialysis: Don’t Take ‘No’ for an Answer” session Fri., 11/6 in Room 6C, 4:30 PM-6:30 PM #KidneyWk",en,Baxter International
Thu Nov 05 18:01:14 +0000 2015,"Impact of APD with patient-centric user interface on patient learning &amp; confidence. Abstract TH-PO990 debut Thurs., 11/5 @ 10AM #KidneyWk",en,Baxter International
Wed Nov 04 22:00:17 +0000 2015,How much do you know about frequent home hemodialysis? Learn more at Baxter booth #729. #KidneyWk,en,Baxter International
Wed Nov 04 19:02:35 +0000 2015,Tomorrow Baxter attends the Chicago Hiring Expo @UnitedCenter for #veterans. Stop by Baxter's booth to learn more https://t.co/Fkpaed1mm8,en,Baxter International
Wed Nov 04 17:25:34 +0000 2015,"Baxter recognized as sustainability leader, launches initiatives to help environment, future environmental stewards https://t.co/Nqy8Rcr51b",en,Baxter International
Wed Nov 04 16:00:28 +0000 2015,Demonstration of the only two-way remote connectivity platform for US home PD patients @ Baxter booth 1329 https://t.co/ZnrAjs1dXO #KidneyWk,en,Baxter International
Wed Nov 04 15:04:08 +0000 2015,"After kidney disease diagnosis, patient pursues role as “beacon of light” to motivate others https://t.co/F54t2HqCqP https://t.co/DRZAGLXQYX",en,Baxter International
Mon Nov 02 22:16:25 +0000 2015,Baxter employees’ commitment to save and sustain lives apparent outside office walls https://t.co/9UtWQ3oNiq https://t.co/9VwjQDnb9k,en,Baxter International
Fri Oct 30 12:49:36 +0000 2015,Celebrating #DisabilitiesAwarenessMonth in Northern Ill. with organizations supporting those affected by disability https://t.co/TRQXWxUOUc,en,Baxter International
Thu Oct 29 15:25:06 +0000 2015,Baxter’s Hada Ramirez is helping hospitals in Mexico improve quality of care for patients https://t.co/Q4JenGAQQn https://t.co/gs1MBQFWsS,en,Baxter International
Wed Oct 28 21:36:45 +0000 2015,Baxter Names José Almeida Chairman and CEO https://t.co/z0xLveCVL9 https://t.co/PyDHANw98Z,pt,Baxter International
Tue Oct 20 15:53:51 +0000 2015,@ChgoUnited honors Baxter’s Symeria Hudson as 2015 Business Leader of Color for outstanding public service https://t.co/YYRYbr6diK,en,Baxter International
Fri Oct 16 21:18:56 +0000 2015,Wishing two special girls a happy and healthy first birthday after overcoming early life hurdles. Read their story http://t.co/5jixRjNKcl,en,Baxter International
Fri Oct 16 13:15:46 +0000 2015,"Identifying, encouraging and nurturing young scientists working to resolve medical needs #YoungInvestigatorAwards http://t.co/xPNEIP46E4",en,Baxter International
Tue Oct 13 12:32:50 +0000 2015,Baxter announces FDA clearance of automated #peritonealdialysis system with two-way connectivity for home patients http://t.co/VVOGnOrUAz,en,Baxter International
Wed Oct 07 13:31:36 +0000 2015,Visit Baxter at booth #3118 to learn how you can be a part of our enduring commitment to save and sustain lives #NSHMBA2015,en,Baxter International
Tue Oct 06 16:35:44 +0000 2015,PD therapy allowed Yin Le to return to the childhood she once had. Read her story http://t.co/1QYRWb4qyw http://t.co/TNNwH0Xu6K,en,Baxter International
Mon Oct 05 15:25:20 +0000 2015,"Marcus Schabacker, Baxter’s Chief Scientific Officer, spoke @DiversityInc event on Finding Top #STEM Candidates http://t.co/SwgUT43ivx",en,Baxter International
Fri Oct 02 13:04:52 +0000 2015,Baxter mentors who spend the year coaching young scholars will collaborate at Scientist Mentoring &amp; Diversity Oct 3-7 in San Diego #MedTech,en,Baxter International
Wed Sep 30 19:54:52 +0000 2015,"With PD therapy, Li has an active life and maintains a tangerine plantation. Read his story http://t.co/l9zZKYuOEG http://t.co/ZvrzXSbnEf",en,Baxter International
Thu Sep 24 15:51:26 +0000 2015,Baxter recognized for #sustainability initiatives for 16th consecutive year #DJSI #CSR http://t.co/xZy4p5WFst,en,Baxter International
Wed Sep 23 12:56:58 +0000 2015,Three generations of a family help save and sustain lives at Baxter for more than 16 years http://t.co/GC4wJVVG9t http://t.co/IvwvyeKTrU,en,Baxter International
Tue Sep 22 13:18:03 +0000 2015,We will be at @nbmbaahq career expo booth #1229. Check out current opportunities: http://t.co/kuRBorKUGr  #nbmbaa15,en,Baxter International
