created_at,full_text,lang,user_name
Mon May 01 12:55:58 +0000 2017,"RT @HomeDialysisOrg: Such an incredible event in #Chicago #IL. Thanks to @NAACP, @baxter_intl, @KidneyPatients, panelists and participants…",en,Baxter International
Fri Apr 28 16:44:52 +0000 2017,Baxter’s Amber Williamson makes a difference in #STEM and #manufacturing through @FRCTeams #NVW #BaxterGivesBack https://t.co/8B6RddKnAn,en,Baxter International
Fri Apr 28 14:51:23 +0000 2017,Learn more about the human and #healthcare costs of #malnutrition in U.S. hospitals https://t.co/SNFfEiH5FI https://t.co/9zhA9L28G6,en,Baxter International
Thu Apr 27 16:01:44 +0000 2017,Baxter’s Marc Minkus gives back by working with the next generation of innovators #NVW #BaxterGivesBack https://t.co/1lrF2gb7g5 https://t.co/U8Ea716d0U,en,Baxter International
Wed Apr 26 18:21:20 +0000 2017,ICYMI: This morning we shared 1Q17 financial results; Raised 2017 full-year sales and earnings guidance. Learn more https://t.co/RdZ4rcY4fu,en,Baxter International
Wed Apr 26 16:36:26 +0000 2017,Baxter’s Kristie Zinselmeier’s passion for helping others extends beyond patients to those in her local community #NVW #BaxterGivesBack https://t.co/VDiB14EjO5,en,Baxter International
Wed Apr 26 14:18:18 +0000 2017,"Our guide to building a comprehensive drug library, critical for the safe &amp; effective use of a smart infusion system https://t.co/eeIc3nhgQg https://t.co/nyfvRECTS1",en,Baxter International
Wed Apr 26 12:45:20 +0000 2017,$BAX reports 1Q17 results; See press release for non-GAAP financial metrics used here https://t.co/RdZ4rcY4fu https://t.co/r9fl3RC5nV,en,Baxter International
Wed Apr 26 11:45:40 +0000 2017,$BAX CEO: Delivering on our mission to save and sustain lives https://t.co/RdZ4rcGtnW https://t.co/NZbFUHvgob,en,Baxter International
Wed Apr 26 11:18:09 +0000 2017,"$BAX reports solid 1Q17 financial results, raises 2017 full-year sales and earnings guidance. See release for more https://t.co/RdZ4rcGtnW https://t.co/MTGNtsUmkP",en,Baxter International
Tue Apr 25 20:15:10 +0000 2017,$BAX to host conference call tomorrow morning to share 1Q17 financial results https://t.co/YYrUL2RtMs,en,Baxter International
Tue Apr 25 17:19:55 +0000 2017,"During #NVW, we recognize our employees who lend their time to facilitate positive change in their communities #BaxterGivesBack https://t.co/jBJtLlXuOD",en,Baxter International
Tue Apr 25 16:07:00 +0000 2017,"From postman to beekeeper, see how #peritonealdialysis inspired this patient to pursue his dreams https://t.co/WMFHBOWNg6 https://t.co/FuCQdITPyv",en,Baxter International
Tue Apr 25 13:57:44 +0000 2017,"During #NVW and every week, we work to make a meaningful difference in the communities where we live and work #BaxterGivesBack https://t.co/rOy03CrZIj",en,Baxter International
Mon Apr 24 17:59:07 +0000 2017,2017 Baxter Young Investigator Awards now open for grad students and post-doc fellows. Apply by June 30 https://t.co/Hrryk7cr5n https://t.co/NFphx92fkD,en,Baxter International
Mon Apr 24 13:07:38 +0000 2017,"In honor of #NVW, thank you to all our employees for dedicating 73,000 hours in 2016 to serving our communities #BaxterGivesBack https://t.co/qKTpu38und",en,Baxter International
Sat Apr 22 15:27:42 +0000 2017,Learn more about our commitment to shared sustainability success in new @BizRoundtable report https://t.co/RJkgfAHkdg #EarthDay https://t.co/itusMWqlOK,en,Baxter International
Thu Apr 20 21:01:36 +0000 2017,Baxter was recently named a #100Best Corporate Citizen by @CR_Mag https://t.co/w7H5FSDzoP https://t.co/X4eG4jAjMD,en,Baxter International
Thu Apr 20 13:14:26 +0000 2017,A carefully built smart pump drug library is critical to help I.D. potential infusion errors. Check out our guide https://t.co/eeIc3mZFYI,en,Baxter International
Tue Apr 18 15:37:02 +0000 2017,"Investing in the next gen of STEM talent, Baxter opens 2017 Young Investigator Award for grad students, post-docs https://t.co/Hrryk7u2tX https://t.co/V7iijFKVv8",en,Baxter International
Mon Apr 17 14:03:05 +0000 2017,"From all of us at our North Cove, NC, facility, thank you to the 200+ firefighters battling the Dobson Knob Fire last week https://t.co/191V3ydzL5",en,Baxter International
Fri Apr 14 18:32:22 +0000 2017,Florida legislature resolution encourages adoption of policies increasing access to home #dialysis for minorities https://t.co/2clAlslr3c,en,Baxter International
Fri Apr 14 15:56:12 +0000 2017,"Great work by @NBCSLNews, driving awareness for greater access to home #dialysis care for minorities with #ESRD https://t.co/ak1HpvLom7",en,Baxter International
Fri Apr 14 12:56:45 +0000 2017,"#DYK the often overlooked consequences of disease-related malnutrition? Learn more about the human, healthcare costs https://t.co/SNFfEiH5FI https://t.co/0dJ8vZb97d",en,Baxter International
Thu Apr 13 18:54:31 +0000 2017,We recently asked Dr. James Sloand about his efforts to improve treatment of #kidney disease. Here's what he said https://t.co/rZrAorycbN https://t.co/QDVRnFssCt,en,Baxter International
Thu Apr 13 13:39:56 +0000 2017,Learn how we're continuing to advance #minority business development through @NMSDCHQ #education program https://t.co/tkzGe1nYDs https://t.co/AYylfpVQJY,en,Baxter International
Wed Apr 12 15:38:44 +0000 2017,First-of-kind home #dialysis tech with #telehealth capabilities keeps patient connected to healthcare team. See how https://t.co/ptN3zs1lQi https://t.co/BmCyS6y3AP,en,Baxter International
Tue Apr 11 15:03:58 +0000 2017,#DYK the economic impact of malnourished patients is significant for U.S. #healthcare systems? Learn more https://t.co/SNFfEiH5FI https://t.co/C01OewGmtY,en,Baxter International
Tue Apr 11 13:37:00 +0000 2017,RT @GCHWorkplaces: Learn about our latest Certified #WorkplaceHealth #Employer @baxter_intl awesome #BeWell@Baxter #program https://t.co/lL…,en,Baxter International
Mon Apr 10 15:56:36 +0000 2017,Proud to be recognized by @TaskandPurpose as a company looking to hire veterans for their problem solving skills https://t.co/7Fe54y24kU,en,Baxter International
Mon Apr 10 13:48:40 +0000 2017,See how members of our legal department lend a hand - and counsel - to make a positive impact in the #community https://t.co/Coj0U6OzCk,en,Baxter International
Fri Apr 07 15:27:05 +0000 2017,#DYK the human and economic costs associated with malnourished hospital patients? Learn more https://t.co/SNFfEiH5FI https://t.co/LJcGrlN3Cz,en,Baxter International
Thu Apr 06 16:23:00 +0000 2017,It’s #NationalPublicHealthWeek! Learn how to reduce your risk of #kidney disease with these healthy living tips https://t.co/nBTeCKsBGF https://t.co/DHNm93Y2xL,en,Baxter International
Thu Apr 06 12:47:26 +0000 2017,@CommHealthChi inducts Baxter into Corp Hall of Fame for our collective passion providing essential #healthcare to uninsured in community https://t.co/ta8hKdHbrb,en,Baxter International
Wed Apr 05 13:42:20 +0000 2017,"During #NPHW, learn how you can integrate healthy lifestyle choices to improve your kidney health https://t.co/nBTeCKb0i5 https://t.co/zSGWR8TYd5",en,Baxter International
Tue Apr 04 18:08:38 +0000 2017,Baxter’s Jonathan Giraldo shares his journey from intern to participant in our technical development program https://t.co/hRXRumfYQh,en,Baxter International
Tue Apr 04 14:34:35 +0000 2017,#AORN2017 is underway! Learn more about our new surgical product designs at booth #1129 https://t.co/nY0GLW7Vgj https://t.co/06SVM4rJHA,en,Baxter International
Mon Apr 03 18:00:20 +0000 2017,Baxter is evolving its leading #hemostats and #sealants products. Learn how at #AORN2017 https://t.co/nY0GLW7Vgj,en,Baxter International
Mon Apr 03 14:04:35 +0000 2017,"RT @CommHealthChi: Tonight, we add @athenahealth, @baxter_intl, @NGE_Law, @pfizer, &amp; @WestMonroe to our Corp Hall of Fame. Love to recogniz…",en,Baxter International
Mon Apr 03 12:38:48 +0000 2017,Baxter unveils new designs to prepare and apply FLOSEAL Hemostatic Matrix and TISSEEL Fibrin Sealant at #AORN2017 https://t.co/nY0GLW7Vgj https://t.co/CpkuiiNIzs,en,Baxter International
Fri Mar 31 19:28:01 +0000 2017,"Proud to be honored by @profwomansmag as a #BestoftheBest company in Healthcare, Pharma and Biotech https://t.co/v3KyI4rK4u https://t.co/kKU8q5bTBb",en,Baxter International
Fri Mar 31 17:46:47 +0000 2017,Baxter’s Amber Williamson shares her advice with @SME_MFG for prospective #engineers for #WomeninSTEM https://t.co/jRxP478KBl,en,Baxter International
Fri Mar 31 13:33:02 +0000 2017,#peritonealdialysis patient shows how home therapy gets her back to her life at home and on the road https://t.co/rZrAorycbN https://t.co/WeUlUu2piC,en,Baxter International
Thu Mar 30 20:41:07 +0000 2017,Recognizing Dr. James Sloand on #NationalDoctorsDay for his outstanding dedication to the #kidneydisease community https://t.co/rZrAorycbN https://t.co/dFS0PzFTlo,en,Baxter International
Thu Mar 30 17:13:06 +0000 2017,We’re heading to Boston for #AORN2017! Look forward to discussing our #hemostats and #sealants in booth #1129 https://t.co/2LcRH0qnic,en,Baxter International
Thu Mar 30 15:35:48 +0000 2017,The prevalence of chronic #kidney disease among communities of color is disproportionately high. Learn more https://t.co/Lau1GT9wJ0 https://t.co/064BnODEjw,en,Baxter International
Thu Mar 30 13:10:31 +0000 2017,"In honor of #NationalDoctorsDay, we want to thank all of our employee physicians for their dedication to saving + sustaining patients’ lives",en,Baxter International
Wed Mar 29 14:39:00 +0000 2017,RT @Americares: Poor oral hygiene can impact overall health. We're helping the #uninsured with a program supported by @baxter_intl: https:/…,en,Baxter International
Tue Mar 28 20:59:05 +0000 2017,RT @ASPENWEB: ASPEN Releases New Parenteral Nutrition Recommendations: https://t.co/li0MoOBD2a,en,Baxter International
Tue Mar 28 18:46:14 +0000 2017,Honored with @Chi_Innovation Award for AMIA w/SHARESOURCE #pertionealdialysis system designed to advance patient care https://t.co/6DX9Nj52MV,en,Baxter International
Tue Mar 28 17:30:45 +0000 2017,#DYK malnourished U.S. patients may result in 2X longer hospital stays? Learn more https://t.co/SNFfEiH5FI https://t.co/mBbw7bJwEv,en,Baxter International
Mon Mar 27 21:14:47 +0000 2017,"Our U.S. renal team rings bell @NASDAQ for new standards in patient care, honored with @Chi_Innovation award https://t.co/8uvObOcquQ",en,Baxter International
Mon Mar 27 18:36:21 +0000 2017,Registration closing soon for @ASPENWEB #webinar on proper #parenteralnutrition use in variety of clinical settings https://t.co/CtDn6UmWNb,en,Baxter International
Mon Mar 27 17:47:53 +0000 2017,"During #nationalkidneymonth, learn how you can integrate healthy lifestyle choices to improve your #kidney health https://t.co/nBTeCKb0i5 https://t.co/KhclNVFEAf",en,Baxter International
Mon Mar 27 13:16:07 +0000 2017,"Join us for #parenteralnutrition appropriateness #webinar, part of @ASPENWEB “Best of #CNW17 Series” https://t.co/CtDn6UmWNb",en,Baxter International
Fri Mar 24 14:31:32 +0000 2017,Don’t forget to register for the upcoming #webinar on appropriate use of #parenteralnutrition with @ASPENWEB https://t.co/CtDn6UEybL,en,Baxter International
Fri Mar 24 12:49:58 +0000 2017,"Our commitment to #corporateresponsibility spans 4 decades, creating a remarkable impact across the globe https://t.co/H0AF0bH65Y",en,Baxter International
Thu Mar 23 17:09:05 +0000 2017,Closing the gap in access to home #dialysis services for African Americans #nationalkidneymonth https://t.co/Lau1GTr87A https://t.co/JbzB27mgjj,en,Baxter International
Thu Mar 23 12:47:59 +0000 2017,RT @HoratiosGarden: The brilliant team from @baxter_intl are mulching @HoratiosGarden #Salisbury today. Huge thanks for all your support! h…,en,Baxter International
Wed Mar 22 18:55:36 +0000 2017,"We identified the lack of a safe water supply as an opportunity to give back in Cuernavaca, Mexico #worldwaterday https://t.co/hUV0abvWJv https://t.co/HE98rEMQDn",en,Baxter International
Wed Mar 22 15:17:00 +0000 2017,#DYK prevalence of #kidney disease among communities of color is disproportionately high? #nationalkidneymonth https://t.co/Lau1GTr87A https://t.co/DNuNLf5tbo,en,Baxter International
Wed Mar 22 15:15:11 +0000 2017,RT @JA_Irl: Thank you to all @baxter_intl #Castlebar volunteers who are delivering the @CoremediaIRL sponsored #OurCity programme in #Mayo…,en,Baxter International
Wed Mar 22 13:10:42 +0000 2017,"On #worldwaterday and every day, we help improve the health and well-being of our local communities https://t.co/HL5ab6sz2s",en,Baxter International
Tue Mar 21 20:25:09 +0000 2017,"@NC_Governor, local officials join our North Cove team; together creating economic opportunity in our communities https://t.co/ZdF5xIjQus https://t.co/yJJZdIOiLR",en,Baxter International
Tue Mar 21 19:48:37 +0000 2017,"PD patient shows how home therapy gets her back to her life, at home and on the road #nationalkidneymonth https://t.co/Lau1GTr87A https://t.co/iiPOtCFQJ7",en,Baxter International
Tue Mar 21 18:48:21 +0000 2017,"RT @NC_Governor: Baxter International, a global health care company, plans to add 90 jobs and invest more than $7.4 million at its Marion l…",en,Baxter International
Tue Mar 21 17:57:35 +0000 2017,@NC_Governor and Baxter announce investments in North Carolina #manufacturing #jobs https://t.co/ZdF5xIjQus https://t.co/dMDldSJAs8,en,Baxter International
Tue Mar 21 13:10:25 +0000 2017,#DYK chronic #kidney disease and ESRD are disproportionately high among communities of color? #nationalkidneymonth https://t.co/Lau1GTr87A https://t.co/IBhAuI6hsU,en,Baxter International
Mon Mar 20 18:35:06 +0000 2017,"During #nationalkidneymonth, we share how you can live a healthy lifestyle for healthy kidneys. Learn more https://t.co/nBTeCKsBGF https://t.co/Kjfgi8QNbQ",en,Baxter International
Mon Mar 20 12:24:51 +0000 2017,RT @Americares: Partner @baxter_intl’s employee “incredibly moved” by impact of donations on our #humanitarian trip to El Salvador: https:/…,en,Baxter International
Fri Mar 17 19:32:29 +0000 2017,Baxter employee and patient advocate recognized for improving access to care for individuals with #kidney disease https://t.co/rZrAorycbN https://t.co/cQzsl96BhY,en,Baxter International
Fri Mar 17 18:02:04 +0000 2017,"During #PSAW2017 and every day, Baxter advocates for #patientsafety measures to help prevent medication errors https://t.co/E7TILlXCu8",en,Baxter International
Thu Mar 16 20:04:31 +0000 2017,"#DYK in the U.S., preventable adverse drug events result in as much as $5.1 billion in additional healthcare costs? #PSAW2017 https://t.co/qkCuqQ7R6t",en,Baxter International
Thu Mar 16 16:32:07 +0000 2017,Learn how you can reduce your risk of chronic kidney disease with these healthy living tips #nationalkidneymonth https://t.co/nBTeCKsBGF https://t.co/wiZAh08V51,en,Baxter International
Wed Mar 15 15:43:01 +0000 2017,#DYK 57 bags of our IV solutions are delivered every second to patients around the world? #PSAW2017 https://t.co/IooY5U2vVs,en,Baxter International
Wed Mar 15 13:34:05 +0000 2017,Baxter and @ISMP1 address global medication error prevention with new Intl Safe Medication Management Fellowship https://t.co/sWDcr2qHEu https://t.co/aVH4Qd8JzZ,en,Baxter International
Tue Mar 14 19:26:30 +0000 2017,Every day we work to improve efficiency in the hospital so clinicians can spend more time providing patient care at the bedside #PSAW2017 https://t.co/6wWfLuQxk2,en,Baxter International
Tue Mar 14 14:20:08 +0000 2017,#DYK chronic kidney disease affects 1 in 10 people worldwide? Improve your kidney health #NationalKidneyMonth https://t.co/nBTeCKb0i5 https://t.co/l5kV312Nwz,en,Baxter International
Tue Mar 14 12:25:41 +0000 2017,New data indicates use of Baxter’s FLOSEAL in cardiac &amp; spinal surgeries may be associated with lower hospital cost https://t.co/D2f0Z74A99,en,Baxter International
Mon Mar 13 14:35:59 +0000 2017,Baxter is advocating for #patientsafety measures to help prevent medication errors #PSAW2017 https://t.co/CDMCVKqh1M,en,Baxter International
Fri Mar 10 19:07:57 +0000 2017,We took to the street to learn about perceptions of kidney health. This is what we heard #nationalkidneymonth https://t.co/M27aSzV7zt,en,Baxter International
Thu Mar 09 21:40:28 +0000 2017,"On #worldkidneyday, learn how you can integrate healthy lifestyle choices to improve your kidney health https://t.co/9OpRBJ9QQi https://t.co/GAGA32inqy",en,Baxter International
Thu Mar 09 21:18:52 +0000 2017,#DYK an estimated 26 million Americans have chronic kidney disease? Help improve your kidney health #worldkidneyday https://t.co/9OpRBJ9QQi https://t.co/5KOG2MthvU,en,Baxter International
Thu Mar 09 21:18:22 +0000 2017,RT @worldkidneyday: TODAY IS #worldkidneyday! Take care of your kidneys and celebrate them with us! https://t.co/24HfXe46S7 https://t.co/XI…,en,Baxter International
Thu Mar 09 14:27:44 +0000 2017,"On #worldkidneyday and every day, we are passionate about educating the community on kidney health https://t.co/9OpRBJ9QQi https://t.co/ZtdofEpxVk",en,Baxter International
Wed Mar 08 19:09:13 +0000 2017,"Advancing access to healthcare and other causes across the globe, giving back in 2016 https://t.co/pZTpX0K0aE",en,Baxter International
Wed Mar 08 13:58:16 +0000 2017,Celebrating the women advancing healthcare innovations around the world at Baxter #InternationalWomensDay https://t.co/FXEGiaHeu8,en,Baxter International
Mon Mar 06 19:49:18 +0000 2017,"Curious about perceptions of kidney health and how well we care for them, we took to the street #NationalKidneyMonth https://t.co/M27aSzDwaT",en,Baxter International
Wed Mar 01 16:41:42 +0000 2017,Building on our partnership with @ASUMountainHome providing next gen of #manufacturing workers with high-tech skills https://t.co/O66sUGbLe2 https://t.co/UTKvff7k9p,en,Baxter International
Wed Mar 01 14:06:37 +0000 2017,RT @HomeDialysisOrg: One day till National #KidneyMonth! Keep a look out for more information on our upcoming TownHall in Jackson #MS @NAAC…,en,Baxter International
Tue Feb 28 20:09:59 +0000 2017,"RT @ChicagoHR: Workplace mentoring, virtual teams, web conferencing enhances collaboration and engagement at @Baxter_intl  #HRMAC",en,Baxter International
Tue Feb 28 13:12:53 +0000 2017,Baxter and ScinoPharm Announce Exclusive Strategic Partnership for Generic Oncology Injectables https://t.co/z0qOYNJsjT,en,Baxter International
Mon Feb 27 15:19:55 +0000 2017,Understanding the consequences of disease-related malnutrition with Dr. Paul Wischmeyer https://t.co/F0rYyN97Bh https://t.co/6XxBI0Uv2K,en,Baxter International
Fri Feb 24 15:29:43 +0000 2017,RT @HomeDialysisOrg: Excited to announce our second Town Hall with @NAACP and @baxter_intl will be in #Jackson #Mississippi on March 25th!…,en,Baxter International
Thu Feb 23 16:28:02 +0000 2017,Hear from our life sciences &amp; ops employees as they share how having a flexible workplace improves performance https://t.co/GMywpQPOvO https://t.co/x2h3WxDvYx,en,Baxter International
Wed Feb 22 19:27:24 +0000 2017,RT @Americares: Poor oral hygiene can impact overall health. We're launching a new #OralHealth project w/ support from @baxter_intl: https:…,en,Baxter International
Wed Feb 22 18:57:01 +0000 2017,Dr. Paul Wischmeyer shares perspective on assessing and treating disease-related malnutrition in the hospital https://t.co/F0rYyMRwJJ https://t.co/TirpnCVpkf,en,Baxter International
Tue Feb 21 14:51:40 +0000 2017,Baxter has assisted clinicians in treating patients’ nutrient needs since the 1940s. See what’s new #CNW17 Booth 401 https://t.co/s5ja3vgV03,en,Baxter International
Mon Feb 20 16:13:52 +0000 2017,Recognizing disease-related malnutrition and its effects on patient outcomes https://t.co/F0rYyMRwJJ https://t.co/zJr1J72Jlu,en,Baxter International
Fri Feb 17 19:30:54 +0000 2017,"As #manufacturing processes continue to evolve, Baxter helps employees get the technical training they need https://t.co/O66sUGtm5A https://t.co/59ikFIuJBt",en,Baxter International
Fri Feb 17 15:38:00 +0000 2017,"Safe access to #enteralnutrition, Baxter launches ENFit at #CNW17 to help prevent wrong-route administration https://t.co/s5ja3vywoD https://t.co/wHMIj2cAiw",en,Baxter International
Fri Feb 17 13:43:23 +0000 2017,"Baxter CEO Joe Almeida tours our facility in Arkansas, a part of the Mountain Home community for more than 50 years https://t.co/cMseCQMvdk",en,Baxter International
Thu Feb 16 20:58:16 +0000 2017,#DYK the human and economic costs associated with malnourished hospital patients? Learn more at #CNW17 Baxter Booth 401 https://t.co/YCUtjU1vKz,en,Baxter International
Thu Feb 16 20:22:07 +0000 2017,More than 85 years of healthcare innovations that help save and sustain lives #nationalinnovationday https://t.co/ptN3zs1lQi https://t.co/DAPDUeaAJf,en,Baxter International
Thu Feb 16 16:23:04 +0000 2017,Baxter invests in #technical training program @ASUMountainHome for current and prospective manufacturing employees https://t.co/O66sUGbLe2 https://t.co/jykF3vch2l,en,Baxter International
Thu Feb 16 13:59:55 +0000 2017,"Baxter debuts ENFit @ #CNW17, designed to improve patient safety during #enteralnutrition therapy https://t.co/s5ja3vywoD https://t.co/y9mn17JB8i",en,Baxter International
Wed Feb 15 14:17:30 +0000 2017,#DYK malnourished US patients may result in 2X longer hospital stays? Learn more at #CNW17 Baxter Booth 401 https://t.co/g9j3Ce6Ure https://t.co/VLeEf7BrDv,en,Baxter International
Tue Feb 14 20:42:59 +0000 2017,"RT @DonateLife: Today is #NationalDonorDay! Register your decision to be an organ, eye and tissue donor at https://t.co/sX9arWRhfD #DonateL…",en,Baxter International
Tue Feb 14 15:57:32 +0000 2017,#DYK Econ impact of malnourished patients significant for US healthcare systems; learn more #CNW17 Baxter Booth 401 https://t.co/g9j3CdPj2E https://t.co/p7hXBQWFza,en,Baxter International
Mon Feb 13 13:51:33 +0000 2017,#DYK U.S. hospital readmissions are 54% higher for malnourished patients? Learn more at #CNW17 Baxter Booth 401 https://t.co/RoTz5ETSPw https://t.co/TtCY10XMk9,en,Baxter International
Fri Feb 10 19:38:13 +0000 2017,RT @ISTCoalition: Yesterday we kicked off our #STEMChallenge with @baxter_intl and @Instituto1977 #IHSCA to explore home-based care for #di…,en,Baxter International
Fri Feb 10 19:25:43 +0000 2017,Recognizing Dr. Willem Kolff and his contributions to help shape modern renal care technology #NationalInventorsDay https://t.co/votuQ2fxSA https://t.co/9HBkFdo7db,en,Baxter International
Fri Feb 10 16:04:46 +0000 2017,#DYK Often overlooked consequences of disease-related malnutrition? Learn more at #CNW17 Baxter Booth 401 https://t.co/g9j3Ce6Ure https://t.co/qYNAm3cjSr,en,Baxter International
Fri Feb 10 14:05:53 +0000 2017,Baxter partners with @MedTechAwards to identify the next generation of med tech and digital health innovators https://t.co/iy2LmtkyeR,en,Baxter International
Thu Feb 09 19:29:41 +0000 2017,"RT @HoratiosGarden: Huge thanks to @baxter_intl seen here presenting @HoratiosGarden with £8,000 from their employee fundraising in 2016! h…",en,Baxter International
Thu Feb 09 17:48:08 +0000 2017,Baxter is proud to partner with @MedTechAwards to support 2017 Innovator competition https://t.co/iy2LmtkyeR,en,Baxter International
Wed Feb 08 20:36:59 +0000 2017,"We’re named to @RobecoSAM’s #sustyyearbook2017. Learn about our commitment to #CSR, spanning nearly four decades https://t.co/JEJ4PSeWIl https://t.co/1eE9f5b0u7",en,Baxter International
Wed Feb 08 15:20:05 +0000 2017,Govt of Aragon recognizes Baxter for driving sustainability through #manufacturing operations with 2017 ‘Socially Responsible Company' seal https://t.co/3MLnkRkIef,en,Baxter International
Tue Feb 07 13:50:21 +0000 2017,Baxter sponsorship helps one #MBE supplier create positive change within his #IT firm @KelloggExecEd https://t.co/tkzGe1Fzv0 https://t.co/6T0VlOpbXb,en,Baxter International
Thu Feb 02 18:08:34 +0000 2017,See perspectives from a Baxter employee on structuring successful mentoring relationships in the workplace https://t.co/mqO2S8wOV8 https://t.co/E0L2uz7ixV,en,Baxter International
Wed Feb 01 14:02:01 +0000 2017,$BAX reports 4Q and FY2016 results; See press release for non-GAAP financial metrics used here https://t.co/imeDvhi4V9 https://t.co/aWjxYv7myX,en,Baxter International
Wed Feb 01 13:51:13 +0000 2017,$BAX CEO: Continuing to advance mission to save and sustain lives https://t.co/imeDvhi4V9 https://t.co/it9IbRLjCi,en,Baxter International
Wed Feb 01 12:45:03 +0000 2017,$BAX 2016: solid operational performance fueled by strong sales and disciplined execution https://t.co/imeDvhi4V9,en,Baxter International
Wed Feb 01 12:16:18 +0000 2017,$BAX reports 4Q and FY 2016 results https://t.co/imeDvhi4V9,en,Baxter International
Tue Jan 31 20:27:14 +0000 2017,High school student and #peritonealdialysis patient inspired to become a nephrology nurse. See his story https://t.co/VSszEQegOK https://t.co/AMSaHiHd39,en,Baxter International
Mon Jan 30 19:09:20 +0000 2017,First of kind home dialysis tech with #telehealth capabilities keeps this patient connected to her healthcare team https://t.co/ptN3zsiWHQ https://t.co/L6mcgxZwaq,en,Baxter International
Mon Jan 30 19:04:47 +0000 2017,RT @HomeDialysisOrg: Special thanks to @NAACP and @baxter_intl for hosting the Town Hall in #LA to improve knowledge on #HomeDialysis treat…,en,Baxter International
Mon Jan 30 14:10:32 +0000 2017,See how Baxter International Foundation helps grow @IH_news Foundation's Good for the Neighborhood program https://t.co/UXW8LQzklk https://t.co/qRs2zZYrRp,en,Baxter International
Wed Jan 25 14:22:50 +0000 2017,Hospitals look outside their four walls to improve community health. Learn more https://t.co/XvYbE4wdGY https://t.co/zBqJBNwE2d,en,Baxter International
