created_at,full_text,lang,user_name
Wed May 23 20:36:47 +0000 2018,Our CEO Joe Almeida shares how the company is driving transformation and fueling innovation to deliver enhanced benefits for patients and investors in an article. Read more: https://t.co/JNp0xvqqWv https://t.co/FMdw1rn7eB,en,Baxter International
Wed May 23 14:36:33 +0000 2018,Come see our latest clinical findings at #ERAEDTA18! We are hosting two symposia exploring the benefits of digitalization in #PD and how expanded hemodialysis #HDx can deliver care closer to that of the natural kidney. @ERAEDTA https://t.co/Vv1UqJudxX https://t.co/psBfswJLk4,en,Baxter International
Wed May 23 12:30:32 +0000 2018,Baxter welcomed 50 new interns and co-ops to join us in supporting our mission of saving and sustaining. Find out more about Baxter’s internships and early talent programs here: https://t.co/88K9MS2TSv #BaxterInterns https://t.co/imSALTXswc,en,Baxter International
Tue May 22 19:10:21 +0000 2018,Baxter is proud to support @HFHLakeCounty. We recently broke ground on the 14th Habitat for Humanity home our employees will help build and dedicated our 13th home. #BaxterGivesBack  https://t.co/CCYSF6RPIQ https://t.co/rZ2zXRIuOl,en,Baxter International
Tue May 22 17:08:56 +0000 2018,"Thanks to @adsteel and @DavidWestin at @BloombergTV for hosting CEO Joe Almeida on Daybreak Americas this morning to discuss Baxter’s performance, accelerating growth through innovation and expanding access to care through geographic expansion. #daybreak https://t.co/GOTxhpFLhs https://t.co/p0aHHOk3AN",en,Baxter International
Mon May 21 20:21:51 +0000 2018,"Did you know that 20% of hospitalized patients develop acute kidney injury? We create unique and innovative technology to support nurses and physicians treating critically ill patients when AKI occurs, &amp; are talking about it @AACNme #NTI2018 booth 2055. Stop by to learn more. https://t.co/XT51olyTGg",en,Baxter International
Mon May 21 13:22:01 +0000 2018,At our Investor Conference we highlighted strategies that are transforming Baxter and showcased innovative products &amp; technologies that are advancing patient care and fueling growth. We increased our 2020 financial guidance &amp; provided our outlook for 2023. https://t.co/h1iMx1DSZy,en,Baxter International
Mon May 21 12:49:08 +0000 2018,"CFO Jay Saccaro is sharing our story of financial performance at our 2018 Investor Conference and how our business transformation is fueling growth, R&amp;D reinvestment, returning value to shareholders &amp; providing flexibility to pursue strategic business development opportunities. https://t.co/AQ0Pdn8pLD",en,Baxter International
Mon May 21 12:24:51 +0000 2018,"Our CEO Joe Almeida just kicked off our 2018 Investor Conference, sharing Baxter’s story of business transformation and our commitment to deliver meaningful innovation that will advance patient care around the world: https://t.co/h1iMx1DSZy https://t.co/srpep4JuHO",en,Baxter International
Fri May 18 21:16:51 +0000 2018,"Calling all innovators: Baxter is still accepting nominations for our 2018 Young    Investigator Awards. If you have an idea that you’d like to see come to life, consider applying today: https://t.co/jwFdyROown https://t.co/u95HPjsvUB",en,Baxter International
Fri May 18 17:25:22 +0000 2018,We’re honored to be recognized by the NAIIS with the “Non-Healthcare Employer Campaign” award for our strong commitment to the health of our employees around the world through our seasonal influenza vaccination campaign. https://t.co/zhiZLqUniK,en,Baxter International
Thu May 17 19:25:52 +0000 2018,"RT @IllinoisKidney: Join us tomorrow at @ConsulMexCho from 10-2 for a #free KidneyMobile screening, sponsored by @baxter_intl https://t.co/…",en,Baxter International
Thu May 17 16:10:20 +0000 2018,"Are you ready for #ERAEDTA18? We are! Visit Booth 3.161 @ERAEDTA18 to see our newest therapy options, clinical findings and an experience that shineslight on new renal possibilities. https://t.co/Vv1UqJudxX https://t.co/rO7SzYhMxh",en,Baxter International
Thu May 17 16:06:23 +0000 2018,The Spectrum IQ Infusion System has first-of-its-kind technology to help reduce    programming errors and enhance patient safety. We’re excited about the next    generation of our Spectrum innovations and you can learn more through this    video: https://t.co/uFkDCiRUwt,en,Baxter International
Wed May 16 18:12:30 +0000 2018,"RT @TENandISE: ""We do not know all the answers. We need to draw knowledge from other people for the sake of protecting our organization."" -…",en,Baxter International
Wed May 16 18:12:19 +0000 2018,"RT @TENandISE: ""We as CISOs are not just protecting our organization. We are protecting our nation."" -Nicole Darden Ford, Vice President, I…",en,Baxter International
Wed May 16 16:04:43 +0000 2018,RT @BCSE_NU: Thanks for the shout-out @ChiPubSchools #CPSSTEM! See the press release here: https://t.co/Jmqy6ETe3O @baxter_intl @sesp_nu,en,Baxter International
Wed May 16 15:05:37 +0000 2018,RT @BCSE_NU: Excited to support this work with quality #STEMEd training for #CPS teachers! @ChiPubSchools #CPSSTEM @baxter_intl @LMSAEagles…,en,Baxter International
Tue May 15 16:32:04 +0000 2018,Baxter recognizes National Women’s Health Week and will continue to work with our employee resource groups like the Baxter Women Leaders to encourage our employees to take steps to improve their health and sustain a healthy lifestyle. #NWHW https://t.co/VDgwx31bxz https://t.co/pA4qwrGDhi,en,Baxter International
Mon May 14 19:47:30 +0000 2018,Baxter employees were in Las Vegas to receive an award from @HRC’s #CEI2018. 2018 marks the third consecutive year that we’ve achieved a 100 percent score we’ll continue to create an inclusive and diverse culture at Baxter. https://t.co/ymAO8Lz9D0 https://t.co/roXzfUmpNG,en,Baxter International
Mon May 14 12:48:40 +0000 2018,Baxter Announces U.S. FDA Clearance of New Spectrum IQ Infusion System. Learn more: https://t.co/LVh8sCmFAI,en,Baxter International
Fri May 11 12:14:12 +0000 2018,We’re proud of our standing as a @Forbes America’s Best Large Employer for four consecutive years. We owe it all to our employees and their commitment to   making Baxter a great place to work. https://t.co/8LFS911gW9,en,Baxter International
Thu May 10 18:31:59 +0000 2018,"Congratulations to Nicole Darden Ford, Baxter’s VP of IT Security and CISO, for her selection as keynote speaker at @TENandISE’s Central Executive Forum &amp; Awards on May 16 and nomination for the 2018 Information Security Executive Award. https://t.co/0sYibttxA6 https://t.co/Ad7cJzKhbq",en,Baxter International
Wed May 09 21:33:41 +0000 2018,RT @berniesbookbank: Check out a few photos of the Baxter International employees who joined us for a volunteer session this afternoon! Is…,en,Baxter International
Wed May 09 18:50:36 +0000 2018,"Congratulations to @YNHH, winner of the Foster G. McGaw Prize for Excellence in Community Service, and all the finalists recognized at @AHAHospitals annual meeting. Baxter International Foundation is proud to sponsor this award. https://t.co/xLdib9DAuR #NationalHospitalWeek https://t.co/AzKYJRIgQg",en,Baxter International
Wed May 09 15:12:21 +0000 2018,"If you’re at @ESPGHANSociety’s Congress in Geneva this week, stop by Baxter’s booth #9 to learn more about the innovative work we’re doing to advance parenteral nutrition care for our patients, including newborns: https://t.co/x2WBngsMQl #ESPGHAN18",en,Baxter International
Tue May 08 19:49:37 +0000 2018,"Our employees deliver on our mission to save and sustain lives, advance our impact through innovation and make Baxter a best place to work -- and they’re the reason we’re a @Forbes America’s Best Large Employer four years running. Hear what makes Baxter a great place to work. https://t.co/aNWkf6Qe6G",en,Baxter International
Tue May 08 15:50:11 +0000 2018,"During #NationalNursesWeek, we thank all nurses for their selfless service and the significant difference they make in the lives of patients every day https://t.co/9Xu4DE5rTG https://t.co/bhPCBxB6GJ",en,Baxter International
Tue May 08 13:14:30 +0000 2018,Baxter is proud to be named to #CRMagazine’s 2018 #100BestCC list for the 17th year. This award reflects our commitment to creating healthier communities around the world and making a meaningful difference where we live and work.   https://t.co/myJ4EvZrZR https://t.co/fjwIFHRvrE,en,Baxter International
Fri May 04 21:39:37 +0000 2018,Congrats to Baxter Hong Kong on its recognition by @HRAsiaMagazine as a “Best Company to Work for in Asia!” We're committed to developing a high-performing organization where employees take pride in contributing to our mission of saving &amp; sustaining lives. https://t.co/o6GOIXrhbM https://t.co/FTM1vGNbpK,en,Baxter International
Fri May 04 20:34:35 +0000 2018,Baxter will be at @ISPDVancouver as clinicians share how to harness remote patient management to improve patient-centered #dialysis #ISPD18. Join us in-person or via webcast on Sunday https://t.co/JzCLLqir4g or Monday https://t.co/aXdrPAFvmo. https://t.co/dRUmR7frAq,en,Baxter International
Fri May 04 17:10:53 +0000 2018,"Attending @ESPGHANSociety’s Congress in Geneva next week? We’re hosting a breakfast symposium on 5/10 with industry expert Alexander Lapillone, MD, PhD on the topic of parenteral nutrition audits &amp; what we can learn from the findings. Learn more here: https://t.co/6kCg9M4cXA https://t.co/U9Lmz8XhA5",en,Baxter International
Fri May 04 14:00:13 +0000 2018,"Our dedicated leaders and mentors make Baxter a great place to build a career. We are proud to recognize Anila Lingamneni, VP of Renal R&amp;D, who was named a 2018 @HBAnet Luminary Award winner. #HBAimpact #HBAWOTY18 https://t.co/Qb7pykj60z",en,Baxter International
Thu May 03 17:39:07 +0000 2018,"Last fall, we invited @PLTWorg students from Round Lake High School to Baxter &amp; showed them how real-world STEM applications are driving innovation in the healthcare industry. Here’s a look at the students presenting their projects to Baxter’s engineering team in April: https://t.co/UkMN9CqBHU",en,Baxter International
Thu May 03 14:54:46 +0000 2018,"RT @TENandISE: I am excited to announce that Nicole Darden Ford, VP, IT – Global Information Security &amp; CISO for @baxter_intl, will be the…",en,Baxter International
Wed May 02 19:49:46 +0000 2018,RT @IllinoisKidney: We’re excited to add more members to #TeamBaxter today! #baxtergivesback @baxter_intl https://t.co/EjD6eLP3zZ,en,Baxter International
Wed May 02 18:04:46 +0000 2018,"In 85+ years Baxter has introduced many innovative products &amp; therapies. Our latest, Bivalirudin, is the first &amp; only premix, ready-to-use presentation of this cardiovascular medication. Learn more about Bivalirudin &amp; our premix medications portfolio here: https://t.co/Tc0XbDEMQj",en,Baxter International
Wed May 02 12:46:43 +0000 2018,Baxter and @ISNkidneycare today announced a collaboration to address the growing rate of kidney disease with a focus on #CKD management. Learn more here: https://t.co/MkwN8yg9tM,en,Baxter International
Tue May 01 19:46:09 +0000 2018,"Baxter has been named to @Forbes’ ""America’s Best Large Employers"" list for the fourth consecutive year! Thank you to our employees across the globe who make Baxter a great place to work. https://t.co/o5zjk7mfm4",en,Baxter International
Mon Apr 30 18:35:49 +0000 2018,The Baxter International Foundation recently awarded a grant to @Irishheart to support the organization’s efforts to expand healthcare access through a Mobile Health Unit serving people across Ireland. Learn more: #BaxterGivesBack https://t.co/VmwhJiRLHd https://t.co/NVXjKlozaN,en,Baxter International
Mon Apr 30 14:49:35 +0000 2018,"Through the Baxter Int'l Foundation we are helping communities where our employees live and work around the world. Learn more about @HoratiosGarden, a program that supports patients and their families recovering from spinal injuries. #BaxterGivesBack. https://t.co/E9hg3y56J7 https://t.co/gjZ9BDmBY7",en,Baxter International
Fri Apr 27 20:01:28 +0000 2018,"Visit Baxter’s suite at @HCP_ReverseExpo’s Spring Hospital Pharmacy Conference next week! We’re demonstrating our pharmaceutical innovations including the Arisure Closed System Transfer Device and the 1st presentation of premixed, ready-to-use Bivalirudin. https://t.co/XWv5Mj5LSY",en,Baxter International
Fri Apr 27 15:15:31 +0000 2018,"Baxter’s senior vice president &amp; president, Baxter EMEA, Cristiano Franzi is featured in @medtecheurope and discusses how treatment education and choice are key to better outcomes for kidney disease patients. Read more: https://t.co/mZZFwrD8W5 https://t.co/vDBBxrHrs0",en,Baxter International
Fri Apr 27 13:44:19 +0000 2018,RT @ChiPubSchools: Proud to see our students from across the city joining together as innovators at the #STEMChallenge2018. Teams like @LMS…,en,Baxter International
Fri Apr 27 13:43:53 +0000 2018,RT @BCSE_NU: Proud to partner with @baxter_intl to support @LMSAEagles as they soar! Swoop swoop! https://t.co/JyWrHOmG9j,en,Baxter International
Thu Apr 26 18:01:48 +0000 2018,RT @medtecheurope: Education is key: #KidneyDisease patients suitable for home #dialysis must know about the benefits of this option. Read…,en,Baxter International
Thu Apr 26 16:39:28 +0000 2018,"#ICYMI: Today, we announced strong first-quarter results and raised our financial outlook for full-year 2018. Read about our performance: https://t.co/3ek0zFFDde https://t.co/uhD7jGggq4",en,Baxter International
Thu Apr 26 11:46:01 +0000 2018,Baxter delivered strong results in the first quarter and is raising our financial outlook for the year. Learn more about our performance here: https://t.co/3ek0zFFDde https://t.co/T2TbpBtrhs,en,Baxter International
Wed Apr 25 22:57:26 +0000 2018,Tomorrow we’ll be hosting our Q1 earnings conference call at 7:30 a.m. CDT. Join us and learn about our business transformation and financial performance this year: https://t.co/CPGUq5L5NO,en,Baxter International
Tue Apr 24 18:57:58 +0000 2018,"Baxter’s annual Young Investigator Awards turns 10 years old this year. Through this program, we’ve helped cultivate the next generation of scientists and engineers. Applications are now open and learn more here: https://t.co/QtfwNrsDRH https://t.co/2L9xbqXwH3",en,Baxter International
Tue Apr 24 13:22:29 +0000 2018,Baxter is proud to support STEM education through programs like FIRST Robotics. Congats to @FRCTeam16 on a fine performance in Houston and good luck to @Dist113robotics this week in Detroit. https://t.co/oRosB4taLw https://t.co/o9ycXFR6X0,en,Baxter International
Mon Apr 23 19:15:51 +0000 2018,"As we near the end of Minority Health Month, we're proud to share that Baxter's   Crystal Riley, Senior Manager Healthcare Policy and Reimbursement, PharmD,   MHA, MBA, was recognized as a 40 Under 40 leader by the @NMQF at the 2018 #NMQFSummit. https://t.co/WKrvXV6aKK",en,Baxter International
Fri Apr 20 17:32:09 +0000 2018,"This #EarthDay, we’re proud to sponsor @chicagobotanic’s ‘Unearth Science’ event, which celebrates the importance of conservation and science in nature. Our mission to save and sustain lives goes hand-in-hand with supporting #CSR in our communities: https://t.co/o6dGlhzv13 https://t.co/0EbFlEA0zm",en,Baxter International
Fri Apr 20 13:48:28 +0000 2018,Connecting underserved patients to care requires commitment and focus. Baxter's work with the National Minority Quality Forum is helping to empower people living with #CKD to take control of their health. Thanks to all who participated in @NMQF's #NMQFSummit in Washington D.C.! https://t.co/lJzzs4pR4j,en,Baxter International
Thu Apr 19 18:07:58 +0000 2018,"We opened the new Baxter Ahmedabad office in India, expanding the global presence of our Pharmaceutical business. This office will be home to ~450 employees and will help us bring more generic injectable medicines to patients around the world. https://t.co/aPOYd3VHBz",en,Baxter International
Wed Apr 18 18:55:31 +0000 2018,"We’re proud of our culture of inclusion and diversity within our workforce at Baxter, as it fosters innovation. Hear from our employees why valuing differences is important to them: https://t.co/mlCK1O5Wq8",en,Baxter International
Wed Apr 18 14:10:33 +0000 2018,"In honor of #NVW, we’re proud of the thousands of Baxter employees around the globe who made an impact in the communities where they live and work. Here’s a look at our 2017 efforts. #BaxterGivesBack https://t.co/jYtVXj4ANe",en,Baxter International
Tue Apr 17 18:33:59 +0000 2018,"RT @IllinoisKidney: Join us tomorrow at Arturo Velasquez Institute from 10-2 for a #free KidneyMobile screening, sponsored by @baxter_intl…",en,Baxter International
Tue Apr 17 16:26:44 +0000 2018,"The future of #STEM education for students in the Chicagoland area is in our hands, which is why we’re proud to partner w/ @sesp_nu and @LMSAEagles on the Baxter Center for Science Education. Learn about @BCSE_NU here:  https://t.co/PSdLCLmzd1 https://t.co/mQtIgtm4oc",en,Baxter International
Mon Apr 16 18:05:32 +0000 2018,Baxter products touch millions of patients daily. This inspiring story from Joann   Still shares how our automated peritoneal dialysis therapy gave her the   treatment she needed and empowered her to continue doing the things she   enjoys most. https://t.co/ptN3zs1lQi,en,Baxter International
Mon Apr 16 14:24:51 +0000 2018,It's been almost 25 years since Baxter made home #dialysis practical for kidney patients around the world. We're proud to be innovators in renal care and are sharing our recent #PD work with @ANNAnurses today in Las Vegas! https://t.co/ff3tMWFV7Y #BaxterEmpowers #ANNAsymp18 https://t.co/G7771sNCJU,en,Baxter International
Fri Apr 13 18:45:59 +0000 2018,Innovation is vital to our company's growth and the development of our products. We’re committed to advancing STEM education and through our Young Investigator Awards we’re cultivating the next generation of scientists and engineers: https://t.co/KOOu48nhSn https://t.co/tDnPMb49yl,en,Baxter International
Thu Apr 12 13:59:20 +0000 2018,Hearing the ways in which our products impact the lives of patients fuels our mission to save and sustain lives. This story from Hitoshi Furutachi is an example of our 86 year-old mission:  https://t.co/uZ1L3C1IMO https://t.co/nURubY4EbW,en,Baxter International
Wed Apr 11 20:04:18 +0000 2018,"At Baxter, we’re proud to support events such as @NMQF’s Leadership Summit on Health Disparities during National Minority Healthcare Month. Find out about the importance of partnering across different sectors to advance healthcare equity globally: https://t.co/jONMI1VdoC #NMHM18 https://t.co/d2YvscNyTt",en,Baxter International
Wed Apr 11 14:59:27 +0000 2018,Did you know the number of #PD patients in the U.S. has increased by 48 percent since 2010? We’re at booth 707 @NKFCLINICALS talking about the latest developments in home dialysis. https://t.co/ff3tMWFV7Y #NKFClinicals #BaxterEmpowers https://t.co/ZkADRfmopc,en,Baxter International
Tue Apr 10 21:34:34 +0000 2018,Our CEO Joe Almeida sat down with @DCassak at @SUBiodesign’s #IWB2018 and discussed the importance of a company’s culture to drive growth and innovation. Watch the video here: https://t.co/Nd7sk8xzBs,en,Baxter International
Tue Apr 10 14:59:13 +0000 2018,Baxter Canada joined forces with the @redcrosscanada on a program that helps   patients have a safe and comfortable transition home after a hospital stay. https://t.co/7USYiZ0ZKL #BaxterGivesBack https://t.co/bAPdrzrAw4,en,Baxter International
Mon Apr 09 20:38:46 +0000 2018,Congratulations to @FRCTeam16 and @Dist113robotics robotic teams for qualifying for the FIRST FTC World Championships. Baxter has been a proud sponsor of the FIRST Robotics programs for more than 25 years. https://t.co/pmb2LxIgMS,en,Baxter International
Fri Apr 06 15:36:00 +0000 2018,Baxter employees around the globe are connected by a commitment to save and sustain lives. Our employees develop products used by millions of patients and healthcare providers every day. Hear why it’s important to them to be doing work that matters: https://t.co/eKLW5XSHOd,en,Baxter International
Thu Apr 05 20:47:55 +0000 2018,RT @EngrCareersUIC: @baxter_intl is on campus today! Check out their awesome mobile product demo lab on campus today until 5pm in SELW 4018…,en,Baxter International
Thu Apr 05 17:39:57 +0000 2018,"We are compassionate about our patients and encourage them to celebrate #NPHW to celebrate healthy living. A commitment to fitness, a healthy diet and managing fluid intake are all ways to reduce your risk of #kidney disease. Learn more:  https://t.co/mYSF82rFE1 https://t.co/sm4PjvcQc0",en,Baxter International
Wed Apr 04 19:27:59 +0000 2018,"At Baxter, we're continuing to build a diverse supplier network through events like our annual networking fair held this week. This event reinforces our commitment to inclusion and diversity beyond our workforce. Learn more https://t.co/mAqUvtdbTW https://t.co/f0RTUjnOIR",en,Baxter International
Wed Apr 04 14:13:10 +0000 2018,National Public Health Week is an opportunity to raise awareness and take preventative steps for a healthy lifestyle. We believe it's important for patients to learn how to reduce the risk of #kidney disease and other healthy tips during #NPHW and beyond: https://t.co/mYSF82rFE1 https://t.co/PuNQDur4f9,en,Baxter International
Fri Mar 30 18:33:02 +0000 2018,"On #NationalDoctorsDay, we recognize and thank all physicians for the valuable impact they have on the lives of patients and the differences they make in their communities.",en,Baxter International
Thu Mar 29 14:35:45 +0000 2018,@Spencer4fire Thank you for reaching out. Please contact our Medical Information team at 1-800-933-0303 for answers to your questions.,en,Baxter International
Wed Mar 28 16:59:41 +0000 2018,RT @W_Bevis: @baxter_intl support of @LMSAEagles has been a game changer.  More students than ever are going to top-notch universities to s…,en,Baxter International
Wed Mar 28 16:43:56 +0000 2018,RT @sesp_nu: Learn how Northwestern's ongoing partnership with @BCSE_NU set the stage for today's announcement of a collaboration with Appl…,en,Baxter International
Wed Mar 28 15:30:15 +0000 2018,We’re committed to making a difference in our communities &amp; doing our part to advance STEM education. We launched the Baxter Center for Science Education w/ Chicago's @LMSAEagles in 2009 &amp; we're excited to further collaborate with @sesp_nu: https://t.co/N9q9j1DmGw #RevolutionChi,en,Baxter International
Tue Mar 27 14:41:08 +0000 2018,"At Baxter, we strive to empower our female employees to advance their careers and reach their desired potential. We believe a diverse and inclusive workforce serves our mission to save and sustain lives.#WomensHistoryMonth #PressForProgress https://t.co/q5bKUKxOeG",en,Baxter International
Tue Mar 27 14:18:49 +0000 2018,RT @Americares: Today is #DiabetesAlertDay! DYK in the fall we launched our Americares Diabetes Prevention with Healthy Food Program in par…,en,Baxter International
Mon Mar 26 15:07:19 +0000 2018,"As #NationalKidneyMonth comes to an end, we’re honored to support @IllinoisKidney's Living with Kidney Disease and Transplantation patient education seminars, which funded more than 3,500 ‘KidneyMobile’ screenings to families to aid in the detection of various kidney diseases. https://t.co/alalct6tYg",en,Baxter International
Fri Mar 23 19:08:45 +0000 2018,"At Baxter, we strive to empower our female employees to advance their  careers and reach their desired potential. We believe a diverse and  inclusive workforce serves our mission to save and sustain lives.#WomensHistoryMonth #PressForProgress https://t.co/t65sSeGHvj",en,Baxter International
Thu Mar 22 20:46:13 +0000 2018,"We’re committed to helping the global communities where we operate every day. In 2017, we launched a project near our facility in Guatemala to provide access to clean water to more than 1,500 local families. Learn more in our CSR report: https://t.co/PStcaNNJCy #WorldWaterDay https://t.co/TCZbokceoy",en,Baxter International
Wed Mar 21 14:47:01 +0000 2018,"At Baxter, we strive to empower our female employees to advance their careers and reach their desired potential. We believe a diverse and inclusive workforce serves our mission to save and sustain lives.#WomensHistoryMonth #PressForProgress https://t.co/2hXrfwkW6b",en,Baxter International
Tue Mar 20 23:05:06 +0000 2018,"RT @IllinoisKidney: Join us tomorrow at @DaleyCollege from 10-2 for a #free KidneyMobile screening, sponsored by @baxter_intl https://t.co/…",en,Baxter International
Tue Mar 20 22:59:26 +0000 2018,Our CEO Joe Almeida shares his thoughts on how globalization and its profound impact on the healthcare industry following his appearance at @FortuneMagazine’s #BrainstormHealth. Read his latest post on reaching more patients in “The Borderless World” here: https://t.co/JF1i5WPfJS,en,Baxter International
Tue Mar 20 15:19:39 +0000 2018,RT @MedTechStrat: @DCassak sits down w/ @baxter_intl CEO Joe Almeida tonight #medtech #strategy https://t.co/kpuLtBDAFh,en,Baxter International
Mon Mar 19 23:57:01 +0000 2018,"During the Borderless World panel at @FortuneMagazine's #BrainstormHealth, our CEO Joe Almeida discussed how today’s world is connected on every level – from the spread of disease to supply chain – alongside @CliftonLeaf @cardinalhealth @MilkenInstitute https://t.co/h5TtKle6XT",en,Baxter International
Mon Mar 19 20:28:25 +0000 2018,Be sure to tune in live this afternoon as our CEO Joe Almeida participates in ‘The Borderless World’ panel discussion at @FortuneMagazine’s #BrainstormHealth. Watch the session here:  https://t.co/1v0LUi52Ql,en,Baxter International
