created_at,full_text,lang,user_name
Wed Mar 13 19:29:55 +0000 2019,RT @sophiaamoruso: Did you know that only half (52%) of U.S. women have started to save for retirement. I’m joining @blackrock to let you l…,en,BlackRock
Wed Mar 13 19:29:00 +0000 2019,"The late-cycle deceleration in economic growth casts a shadow on corporate profit margins. Elga Bartsch, our head of economic &amp; market research, explains. https://t.co/4jlJkSzh8T",en,BlackRock
Wed Mar 13 18:52:00 +0000 2019,12 weeks to mastering your finances–are you in? We’re partnering with @GirlBoss to bring you weekly educational content. Sign up here: https://t.co/SuqIKWUXIB,en,BlackRock
Wed Mar 13 17:45:00 +0000 2019,"Fees matter most when selecting an active equity manager? Not always, according to our recent check-in with global institutional investors: https://t.co/pnuGa6Yxcu https://t.co/53ZwafqxtG",en,BlackRock
Wed Mar 13 16:56:00 +0000 2019,"In our latest podcast, our President Rob Kapito discusses how to get more people invested in their retirement, and why he favors #Daenerys #ForTheThrone. https://t.co/zRubSX60gE",en,BlackRock
Wed Mar 13 13:19:18 +0000 2019,Interested in what factor is Andrew Ang’s favorite? Watch our Head of Factor Investing share his favorite factor with @dhmeyers. #DefiningFactors https://t.co/TuVRvwR7lp https://t.co/6isgHsZeg5,en,BlackRock
Tue Mar 12 14:27:52 +0000 2019,"RT @sydneyleroux: Investing for your family’s future can feel overwhelming. Luckily, @BlackRock’s latest #InvestorPulse survey provides sim…",en,BlackRock
Tue Mar 12 14:27:41 +0000 2019,RT @PaulRabil: High performance in the weight room is no different than high performance in the boardroom. @blackrock’s #InvestorPulse surv…,en,BlackRock
Tue Mar 12 11:06:00 +0000 2019,"Small cap #stocks are on a tear, yet we advise caution on chasing the rally–and favor higher-quality large cap shares. Learn more: https://t.co/jBbjJat1PX",en,BlackRock
Mon Mar 11 20:16:36 +0000 2019,"A restaurateur and investment expert compare notes. Watch how experts @dhmeyers &amp; Andrew Ang, BlackRock’s Head of Factor Investing define success and excellence: https://t.co/PArtDKFrnB https://t.co/w1lJ4PJfH7",en,BlackRock
Mon Mar 11 18:54:01 +0000 2019,Small cap stocks tend to be more sensitive to changes in economic activity than large cap counterparts. Find out what this means for the sustainability of the recent small cap rally. https://t.co/WZoDsSbjam https://t.co/zdZjSWF654,en,BlackRock
Mon Mar 11 15:24:41 +0000 2019,Small caps have been on a tear this year. Is this a rally worth chasing? We put the rally in perspective in our weekly commentary. https://t.co/Q1EQYlmnYq https://t.co/atplhDLIpq,en,BlackRock
Sat Mar 09 18:08:00 +0000 2019,"Russ Koesterich, Portfolio Manager, explains the mystery of why #gold is performing surprisingly well while #stocks are rallying. https://t.co/9BEr3Y6atA",en,BlackRock
Fri Mar 08 22:57:50 +0000 2019,Happy #InternationalWomensDay to women everywhere. We celebrate you! #SheInspiresMe https://t.co/gmkhmQapD5,en,BlackRock
Fri Mar 08 21:29:39 +0000 2019,"RT @SGX: In celebration of #IWD2019⁠ ⁠, #SGX and @blackrock have jointly organised a lunchtime panel discussion on #financialenablement, wi…",en,BlackRock
Fri Mar 08 21:29:29 +0000 2019,RT @SGX: .@Blackrock Country Head of Singapore and Head of South East Asia Deborah Ho shares the importance of financial empowerment here a…,en,BlackRock
Fri Mar 08 21:14:54 +0000 2019,"""The future of work calls for radical change. This starts with unbundling the traditional higher education learning model to make it accessible, flexible and personalized for the pursuit of lifelong learning."" @kristiriordan @flatironschool https://t.co/7AGAmYJvUB",en,BlackRock
Fri Mar 08 17:36:56 +0000 2019,Money is ranked the #1 source of stress in people’s lives but it’s also surrounded by taboo. How can we turn this concept into something approachable and part of cultural conversation? https://t.co/rxXuG1lmNR,en,BlackRock
Fri Mar 08 17:27:36 +0000 2019,RT @PaulRabil: Learning the fundamentals of investing has given me a greater sense of overall well-being. I’m partnering with @blackrock to…,en,BlackRock
Fri Mar 08 14:58:10 +0000 2019,"""Bring your authentic self to work everyday."" - Andrea #HerAdvice #IWD2019 For more tips: https://t.co/wTGorjX36p https://t.co/KUEc1XI9EK",en,BlackRock
Thu Mar 07 20:54:24 +0000 2019,"RT @MommasGoneCity: Saving for my retirement is not only to make sure I have a future to look forward to, but one that my kids can too. Hav…",en,BlackRock
Thu Mar 07 19:43:27 +0000 2019,"RT @sophiaamoruso: More than half of US Women say investing is not for “people like me.” When you invest well, money is one of the few thin…",en,BlackRock
Thu Mar 07 17:12:26 +0000 2019,"RT @sydneyleroux: For our growing family, investing in our financial future is more important than ever. @BlackRock’s latest #InvestorPulse…",en,BlackRock
Thu Mar 07 14:53:36 +0000 2019,"""Be proactive and take advantage of any opportunity to get involved."" - Bernadette #HerAdvice #WomensDay For more tips: https://t.co/wTGorjX36p https://t.co/TN3fW1uZe9",en,BlackRock
Wed Mar 06 20:04:52 +0000 2019,"A restaurateur and investment expert compare notes. How are data and technology transforming businesses? @dhmeyer &amp; Andrew Ang, our Head of Factor Investing discuss. #DefiningFactors https://t.co/sA68BEfiRA",en,BlackRock
Wed Mar 06 19:32:00 +0000 2019,"Our financial conditions indicator for G3 economies has recovered sharply this year, confirming our expectation that near-term recession risks remain limited. For more see our macro dashboard: https://t.co/jeGFz6khlW https://t.co/wjmMBFMBrC",en,BlackRock
Wed Mar 06 18:38:36 +0000 2019,"""Never stop learning. You always need to be one step ahead. "" - Jeana #HerAdvice #IWD2019 For more tips: https://t.co/wTGorjX36p https://t.co/r8eudip37S",en,BlackRock
Wed Mar 06 17:57:49 +0000 2019,Honored to have been at the @lesbiantech conference in SF last week. Thank you to everyone who came to our booth to learn more about BlackRock. #LWTSummit https://t.co/cTwyHKL70M,en,BlackRock
Wed Mar 06 14:28:46 +0000 2019,"""Keep pushing forward, it puts you more in control of your day to day."" - Jennifer #HerAdvice #WednesdayWisdom #WomensHistoryMonth For more tips: https://t.co/wTGorjX36p https://t.co/zZ02xzZy75",en,BlackRock
Tue Mar 05 22:00:40 +0000 2019,Our #eurozone Growth GPS still points to downside risks to activity in coming months relative to consensus views. For more see our macro dashboard: https://t.co/x9WJXNgXbI https://t.co/ktiDs9BcwI,en,BlackRock
Tue Mar 05 19:31:36 +0000 2019,"""Do what you do, really well and don't worry about the next job. Excellent execution opens up the next door.""- Anne #HerAdvice #WomensHistoryMonth #IWD2019 For more tips: https://t.co/wTGorjX36p https://t.co/F5Xal9Owte",en,BlackRock
Tue Mar 05 16:37:38 +0000 2019,Check out why we see increasing attraction of inflation-protected U.S. government bonds. https://t.co/OennAOMGrR,en,BlackRock
Tue Mar 05 14:43:49 +0000 2019,"""Understand what's happening out of your immediate network, role and firm to enable you to see more opportunities.""- Maybel #HerAdvice #IWD2019 For more tips: https://t.co/wTGorjX36p https://t.co/wHLzRNPBVM",en,BlackRock
Mon Mar 04 20:45:00 +0000 2019,A @federalreserve on hold + solid economy = Improved prospects for #inflation-protected bonds. Read more in our weekly commentary. https://t.co/rzdrFgwls4 https://t.co/i0YWHShvhr,en,BlackRock
Mon Mar 04 20:08:26 +0000 2019,"""Don't just drive your career straight. Be open to new opportunities and relationships."" Katie shares #heradvice to young professionals. #IWD2019 #BalanceforBetter For more tips: https://t.co/wTGorjX36p https://t.co/xTDdB4ePbl",en,BlackRock
Mon Mar 04 20:01:55 +0000 2019,"RT @dhmeyer: Caught up with Andrew Ang from @BlackRock on a beautiful day @Manhatta_nyc, where we explored the intersection of hospitality…",en,BlackRock
Mon Mar 04 18:00:15 +0000 2019,"There is more in common between fine dining and investing than you think. @dhmeyer, CEO @ushgnyc and Andrew Ang, Head of Factor Investing @blackrock discuss: https://t.co/2YFWcurmtt #DefiningFactors https://t.co/THsBDHsHGk",en,BlackRock
Mon Mar 04 15:42:25 +0000 2019,"""Don't undersell yourself. Be self-confident and don't hesitate to apply for jobs you fancy."" Isabelle shares #heradvice to younger female professionals. #IWD2019 For more tips: https://t.co/wTGorjX36p https://t.co/Ysgw6XkIXg",en,BlackRock
Mon Mar 04 15:40:18 +0000 2019,Where’s U.S. inflation headed in the near term–and what does it mean for #inflation-linked bonds? Read more in our weekly commentary: https://t.co/8CKXTV99QB https://t.co/T4oagQPXhu,en,BlackRock
Mon Mar 04 14:09:30 +0000 2019,"When it comes to gender equality in the workplace, we mean business. In honor of #IWD2019, we asked BlackRock leaders to share their advice for younger professionals. Stay tuned for their top tips. #HerAdvice #WomeninFinance",en,BlackRock
Fri Mar 01 18:37:30 +0000 2019,RT @business: There's more in common between fine dining and investing than you think.,en,BlackRock
Fri Mar 01 18:35:00 +0000 2019,"Sustainable investing is no longer a niche area; it’s something investors should not ignore. Andre Bertolotti, our head of Global Sustainable Research, discusses three key themes driving transformation in this area. https://t.co/QMloGIEqA8",en,BlackRock
Thu Feb 28 15:51:51 +0000 2019,"How is a successful restaurateur like a factor investor? Watch @dhmeyer, CEO @ushgnyc and Andrew Ang, Head of Factor investing @blackrock to learn more: https://t.co/USE6SVAyp0",en,BlackRock
Wed Feb 27 22:23:48 +0000 2019,Are you a sophomore looking to learn about BlackRock and how to kick-start your #career in #technology? Our Find Your Future Forum applications are now open for #NY and #SF. Come explore the exciting world of FinTech! https://t.co/CMVEzRpMqj https://t.co/tuX8ez4Eym,en,BlackRock
Wed Feb 27 21:42:14 +0000 2019,RT @business: What qualities define a great business?,en,BlackRock
Tue Feb 26 21:43:00 +0000 2019,Read more on how market rebounds can create opportunities to tweak a #portfolio. https://t.co/iNw56ENpnU,en,BlackRock
Tue Feb 26 20:44:00 +0000 2019,12 weeks to mastering your finances–are you in? We’re partnering with @GirlBoss to bring you weekly educational content. Sign up here: https://t.co/75O0bvHaVM,en,BlackRock
Tue Feb 26 17:42:00 +0000 2019,We have positioned the Global Allocation fund more defensively to reflect a less benign environment for #risk assets longer-term. Read more: https://t.co/LwfBHXlL4z,en,BlackRock
Tue Feb 26 16:01:56 +0000 2019,"We are positive on #China’s stock market, even after this year’s rally, but favor a selective approach amid growth and trade risks. Richard Turnill, our Chief Investment Strategist, explains. https://t.co/TznakjoXRo",en,BlackRock
Tue Feb 26 13:41:00 +0000 2019,Read more on how the BlackRock Total Return Fund is positioned for today’s bond markets. https://t.co/qu1zsZtoQp,en,BlackRock
Mon Feb 25 23:24:01 +0000 2019,"Chinese #stocks have rallied this year after a tough 2018. Can the turnaround last? We think so, but would be more selective. Read why in our weekly commentary. https://t.co/3M6WFdRzQ3 https://t.co/YOBnzLepYt",en,BlackRock
Mon Feb 25 20:58:29 +0000 2019,"On our latest podcast, our CMO, Frank Cooper discusses why taking small steps to invest for our future can heighten our well-being today. https://t.co/ti6pZLW8sI https://t.co/9jAoojq1Zz",en,BlackRock
Mon Feb 25 19:54:38 +0000 2019,Is there opportunity left in Chinese stocks? They offer less value than before their 2019 rally but still trade at a hefty discount to other EM equities. Read more. https://t.co/YGCgm7oc5K https://t.co/B8U6bZJmVa,en,BlackRock
Mon Feb 25 15:05:00 +0000 2019,"It’s not just #stocks: #bonds and #commodities are up this year as well. Russ Koesterich, Portfolio Manager, discusses whether than can continue. https://t.co/Zr1UpHULmj",en,BlackRock
Fri Feb 22 17:51:27 +0000 2019,"Watch as our President, Rob Kapito, explains how saving for your future retirement can pay immediate emotional dividends today. #InvestorPulse https://t.co/caMVAQNlLB [via @LinkedInEditors]",en,BlackRock
Thu Feb 21 18:50:30 +0000 2019,We expect the European Central Bank to keep rates on hold this year. Read more on why: https://t.co/MCaawQxYcM,en,BlackRock
Thu Feb 21 16:56:31 +0000 2019,"The U.S. #dollar’s outlook depends on your perspective. Richard Turnill, our Chief Investment Strategist, explains in detail. https://t.co/UGsueBg5Yp",en,BlackRock
Wed Feb 20 23:19:29 +0000 2019,"According to our #InvestorPulse survey, money is the main source of stress in people’s lives. But it’s also surrounded by taboo. Our CMO Frank Cooper discusses how we can start the conversation and improve our well-being as a result. https://t.co/BVH5BC2L31",en,BlackRock
Wed Feb 20 22:27:40 +0000 2019,"RT @buildcommwealth: Today, @blackrock announced a $50 million commitment to address the savings crisis. @buildcommwealth, @commoncentslab…",en,BlackRock
Wed Feb 20 17:26:24 +0000 2019,"Read more about our Emergency Savings Initiative in partnership with @buildcommwealth, @commoncentslab and @CFSInnovation. We are committed to expand savings among financially-vulnerable Americans. https://t.co/z0UqQ0CDNT",en,BlackRock
Tue Feb 19 23:37:00 +0000 2019,The U.S. dollar’s outlook depends on your vantage point: developed or emerging markets? Read details in our weekly commentary. https://t.co/2OOTBcVDuP https://t.co/xFEoiNkCQ5,en,BlackRock
Tue Feb 19 20:08:01 +0000 2019,"Surprise, Surprise! The U.S. #dollar has risen against most developed market currencies this year. Read why in our weekly commentary. https://t.co/ep8Cr11W9q https://t.co/Z9lxwkNFhF",en,BlackRock
Tue Feb 19 19:05:01 +0000 2019,Our Growth GPS for the U.S. continued its fall after exceptionally weak December #retailsales. See our new Macro dashboard for more: https://t.co/S0zuewQN7z https://t.co/JG5vkY9TK9,en,BlackRock
Tue Feb 19 17:34:30 +0000 2019,"Our financial conditions indicator (FCI) for G3 economies still suggests that #economicgrowth should slow further in coming months, led by the U.S. https://t.co/hAqdfo4KP1 https://t.co/gPvm4hYDFh",en,BlackRock
Tue Feb 19 14:38:38 +0000 2019,Mick Batyske's passion for music paid for his MBA and launched his career. Anyone can take steps toward a better financial future–and feel good now. View our study of wealth and well-being to find out more about how you can.#InvestorPulse https://t.co/gBdI49l0h7 cc @60SecDocs https://t.co/RLtVFsVRhB,en,BlackRock
Fri Feb 15 17:45:48 +0000 2019,"Orville Rogers, a pilot has given back over $35 million to his community. A small step to invest doesn’t just pay off in the long run–it also improves your well-being today. View our study of wealth and well-being to find out more.#InvestorPulse https://t.co/39QDDjav8L @60SecDocs https://t.co/5wF0bSAgFG",en,BlackRock
Fri Feb 15 15:41:07 +0000 2019,Are you a sophomore looking to learn about BlackRock and how to kick-start your #career in #technology? Our Find Your Future Forum applications are now open for #NY and #SF. Come explore the exciting world of FinTech! https://t.co/IkNBpinYC8 https://t.co/GGA0iVGfkt,en,BlackRock
Thu Feb 14 17:20:20 +0000 2019,"#HappyValentinesDay! Do you and your partner talk about money? Learn here from Anne Ackerley, our Head of U.S. and Canada Defined Contribution, as to why these conversations are so important in any relationship: https://t.co/SK2nQaiYYu cc @girlboss https://t.co/EXkrWxpQ1F",en,BlackRock
Thu Feb 14 14:15:46 +0000 2019,What technologies would help you invest for the future? Check out our #InvestorPulse survey results: https://t.co/9OLbn3xiNc https://t.co/Uy2Bp5PH4T,en,BlackRock
Thu Feb 14 14:13:53 +0000 2019,"Are you a sophomore looking to learn about BlackRock and how to kick-start your #career? Our Find Your Future Forum’s applications are now open for #NewYork, #SanFrancisco, and #Atlanta. Apply here or share this post with anyone who might be interested! https://t.co/f188WHwV1y https://t.co/w5GkLEsq8G",en,BlackRock
Wed Feb 13 20:55:04 +0000 2019,@finsavvylatina uses her experience tackling student debt to teach others how to feel more financially secure. Anyone can take steps toward a better financial future. View our study of wealth and well-being to learn more. #InvestorPulse https://t.co/39QDDiSTKb cc @60SecDocs https://t.co/iVC3uJJrm0,en,BlackRock
Wed Feb 13 19:33:01 +0000 2019,Our #InvestorPulse survey found that a high level of well-being and saving for the future may be closely linked. See the full results: https://t.co/9OLbn3fHVE https://t.co/8svHQHAVXw,en,BlackRock
Wed Feb 13 18:11:05 +0000 2019,Our Growth GPS for #Germany points to more downside for Europe’s largest economy relative to consensus views. See our new Macro dashboard for more: https://t.co/sfPKlbNZCG https://t.co/8RIY0POJxt,en,BlackRock
Wed Feb 13 15:48:31 +0000 2019,#Didyouknow: we’re partnering with @girlboss to provide you with a 12 week newsletter that focuses on mastering your finances! Sign up here: https://t.co/ZZwKJAknll https://t.co/Lhzl13QYtU,en,BlackRock
Wed Feb 13 15:11:05 +0000 2019,Our Growth GPS for #G7 economies points to a sharper pace of growth moderation but still suggests the expansion is intact at more trend-like levels of activity. See our new Macro dashboard of interactive #charts for more: https://t.co/e4epaabJXH https://t.co/LWamlI5Yo9,en,BlackRock
Wed Feb 13 14:57:45 +0000 2019,"According to our #InvestorPulse survey results, money was the biggest source of stress – more than work, family, and health. However, people who proactively plan for retirement tend to be more content with their lives. Full report: https://t.co/9OLbn3xiNc https://t.co/MU1zGXT10X",en,BlackRock
Tue Feb 12 21:41:58 +0000 2019,"@FrugalAthlete helps athletes stay prepared on and off the field. Anyone can take steps toward a better financial future–and feel good as a result. View our study of wealth and well-being to find out more about how you can, too. #InvestorPulse @60SecDocs https://t.co/bk10se3Yqx https://t.co/OpuFzZQzME",en,BlackRock
Tue Feb 12 21:30:23 +0000 2019,We’re excited to be at the #TAGSummit. Proud to be here among our new neighbors and colleagues who are shaping growth in tech in Atlanta. #GrowAtlanta https://t.co/sTD4BH6WlB,en,BlackRock
Tue Feb 12 21:25:23 +0000 2019,Our combined financial conditions indicator for G3 economies suggests that economic data are mostly reflecting the possible downdraft from tightening financial conditions. See our new Macro dashboard featuring our FCIs and GPS indicators. https://t.co/CMCZqLsZMQ https://t.co/J97j8gLR4O,en,BlackRock
Tue Feb 12 15:39:04 +0000 2019,"We would look to buy #emergingmarket debt on any material price dip given a solid near-term outlook. Richard Turnill, our Chief Investment Strategist, explains.  https://t.co/XIY0gLyYW5",en,BlackRock
Tue Feb 12 15:11:00 +0000 2019,"RT @BlackRock_News: Today, more @iShares ETFs are commission-free in more places than ever. This is unequivocally good news for investors,…",en,BlackRock
Tue Feb 12 13:20:04 +0000 2019,"Being diversified across multiple sources of return is our first line of defense against increased #marketvolatility. Read more from Andrew Ang, our Head of Factor Investing, on how to prepare for an unpredictable 2019. https://t.co/cqhBiDmeDr https://t.co/XZmduu0HYX",en,BlackRock
Mon Feb 11 22:39:22 +0000 2019,Check out our Strategic Income Opportunities monthly insights on potential opportunities in #fixedincome in 2019. https://t.co/kfFtlz9cnX https://t.co/THTbQeO7Zg,en,BlackRock
Mon Feb 11 21:34:05 +0000 2019,"Emerging market debt yields have fallen this year, but still appear attractive versus both U.S. investment grade yields and their own history. Read more in our weekly commentary. https://t.co/2az9vrWstL https://t.co/4nXM4b4gZz",en,BlackRock
Mon Feb 11 19:46:04 +0000 2019,"On our latest #podcast, Tom Donilon, Chairman of the BlackRock Investment Institute and former U.S. National Security Advisor, discusses which #geopoliticalrisks he’s watching out for in 2019. https://t.co/QZC0O4RZdo",en,BlackRock
Mon Feb 11 18:46:53 +0000 2019,"Retirees James and Inja Yates have donated over $70k to their community by hosting travelers. By investing early on, they’ve been able to give back in retirement. View our study of wealth and well-being to find out more. #InvestorPulse https://t.co/39QDDjav8L cc @60SecDocs https://t.co/ZZSa9uNOum",en,BlackRock
Mon Feb 11 18:28:03 +0000 2019,"#Emergingmarket debt has sharply rallied this year, bouncing back from a tough 2018. Is now a good time to buy? We explore the opportunity in our weekly commentary. https://t.co/NVggmys5K3 https://t.co/BfdHggEzNI",en,BlackRock
Mon Feb 11 16:48:03 +0000 2019,"Read why we expect economic growth in #China to stabilize this year, helping to cushion a global growth slowdown. https://t.co/2e3V3xYzjJ",en,BlackRock
Mon Feb 11 14:29:04 +0000 2019,Are you confident in your retirement plan? Check out our #InvestorPulse survey results and learn how confidence levels differ between genders: https://t.co/9OLbn3xiNc https://t.co/y4fpXmGQdh,en,BlackRock
Fri Feb 08 20:53:17 +0000 2019,RT @MeghanEMorris: Every survey I read about how little Americans have saved for retirement makes me anxious. @blackrock president Rob Kapi…,en,BlackRock
Fri Feb 08 20:29:03 +0000 2019,"Russ Koesterich, Portfolio Manager, discusses why #energy, despite rallying–and outperforming–this year, still looks like a value. https://t.co/cbgfVukU1R",en,BlackRock
Fri Feb 08 18:59:09 +0000 2019,Where does financial health rank for you in your overall sense overall well-being? See the full survey results here: https://t.co/sAVOpSHkYc #InvestorPulse https://t.co/ABpTIxgUoS,en,BlackRock
Fri Feb 08 14:26:43 +0000 2019,"Can planning for retirement impact your well-being today? Our studies show it can. Of those surveyed, 78% of Americans are more likely to report a higher level of well-being if they have a retirement plan in place: https://t.co/sAVOpSHkYc #InvestorPulse https://t.co/AvhkBIQgxQ",en,BlackRock
Thu Feb 07 21:02:44 +0000 2019,"RT @60SecDocs: “I don’t care what you do for a living. I care what you get to do after.” #WealthToMe 
For more wealth: https://t.co/RhcR1xD…",en,BlackRock
Thu Feb 07 19:00:22 +0000 2019,Nearly half of Americans we surveyed haven’t yet saved for retirement. Have you? https://t.co/sAVOpSHkYc #InvestorPulse https://t.co/V5bYffkq2z,en,BlackRock
Thu Feb 07 16:27:44 +0000 2019,Saving for later pays off today! Find out how to start saving for retirement and build confidence about your future. #InvestorPulse https://t.co/KiCa2cg3mL,en,BlackRock
Thu Feb 07 15:00:44 +0000 2019,"We conducted one of the world’s largest studies on wealth and well-being, and here is what we found: https://t.co/9OLbn3xiNc #InvestorPulse https://t.co/hWJgB3slpS",en,BlackRock
Thu Feb 07 14:12:56 +0000 2019,"RT @CBSThisMorning: ""There’s a connection between wealth and wellbeing. And the number one thing that causes stress amongst people is money…",en,BlackRock
Thu Feb 07 14:12:51 +0000 2019,RT @CBSThisMorning: A new survey by @blackrock suggests tens of millions of Americans still haven't started saving for their retirement. On…,en,BlackRock
Thu Feb 07 13:05:03 +0000 2019,RT @BlackRock_News: Coming up on @CBSThisMorning: How do Americans feel about money? @BlackRock’s Rob Kapito weighs in at 8am w/ a new repo…,en,BlackRock
Wed Feb 06 18:46:07 +0000 2019,"With #geopolitics permeating the news cycle, how can you separate signal from noise? Tom Donilon, Chairman of the BlackRock Investment Institute and former U.S. National Security Advisor, discusses which headlines we should be paying attention to. https://t.co/EZTWeJG3V9 https://t.co/5IaqguaxAu",en,BlackRock
Tue Feb 05 19:35:01 +0000 2019,"We explain what has triggered the rally in #stocks, and how investors could approach it. https://t.co/PGWL9Xm9y4",en,BlackRock
Tue Feb 05 17:11:35 +0000 2019,"RT @RickRieder: In our latest Blog Post, we argue that an evolving policy stance at the Fed is altering the risk/reward calculus for invest…",en,BlackRock
Mon Feb 04 20:56:14 +0000 2019,A dramatic shift in #rate expectations has been a key catalyst of the market comeback. We illustrate in our weekly commentary. https://t.co/zvVIoBGjhP https://t.co/F6C0dYdzEN,en,BlackRock
Mon Feb 04 19:54:59 +0000 2019,#Risk assets have bounced back in early 2019. Does the rally have legs? Read more in our weekly commentary. https://t.co/rQygwMxIU1 https://t.co/DfW8XVHMrU,en,BlackRock
Mon Feb 04 17:17:28 +0000 2019,"We explain why we see a synchronized global slowdown ahead in 2019 and what this means for central bank policies.
  https://t.co/b6FzNuniSE",en,BlackRock
Fri Feb 01 22:32:02 +0000 2019,"Interested in learning more about #sustainableinvesting? In our latest podcast, Brian Deese discusses how better data and technology have improved the way we think about sustainable investing. https://t.co/WDDfKUDGEs",en,BlackRock
Fri Feb 01 16:13:35 +0000 2019,Sustainable investing: no longer a trade-off between value and “values.” Read why in our latest global insights piece. https://t.co/85aMeA7R5K,en,BlackRock
Fri Feb 01 14:03:00 +0000 2019,"RT @60SecDocs: Investing has a new sound. #WealthToMe
For more wealth: https://t.co/RhcR1xDRhw @blackrock @iamMICK #sponsored https://t.co/…",en,BlackRock
Thu Jan 31 20:48:01 +0000 2019,"Markets have bounced back from December’s #selloff. Russ Koesterich, Portfolio Manager, discusses whether investors have shifted sentiment too quickly. https://t.co/9ArwuQQNa6",en,BlackRock
Thu Jan 31 16:38:31 +0000 2019,Read now: Better #data makes #sustainable investing pay by @BlackRock’s Philipp Hildebrand and Brian Deese via @FT.  https://t.co/daSvx0lgXr,en,BlackRock
