created_at,full_text,lang,user_name
Wed Apr 11 13:09:18 +0000 2018,"Despite recent stumbles, we believe #tech #stocks are still a good bet. Learn more. https://t.co/rdK5cD94vL https://t.co/Sr6TaNfXa4",en,BlackRock
Wed Apr 11 13:07:26 +0000 2018,"With improved savings behavior, consistent investing, and guidance on retirement income, future retirees can plan for comfortable living standards. Read more on the resiliency of retirement assets. https://t.co/wSMnamXQAq #retireonyourterms #NRPW https://t.co/sDX77DcNi0",en,BlackRock
Tue Apr 10 18:11:04 +0000 2018,Should #retirees be overly concerned about their health care costs in #retirement? What can current retirees teach us? https://t.co/g6SRukzodN #NRPW https://t.co/3Wy7kjOvED,en,BlackRock
Tue Apr 10 17:00:36 +0000 2018,"RT @RetireOnUrTerms: Seven in 10 baby boomers have $5,000 or less in an emergency fund, creating risk that a significant unplanned expense…",en,BlackRock
Tue Apr 10 16:58:52 +0000 2018,"RT @RetireOnUrTerms: Among Boomers with retirement savings, 43 percent have $250,000 or more saved. 38 percent have less than $100,000 save…",en,BlackRock
Tue Apr 10 14:29:55 +0000 2018,RT @brookeamasters: Have mass shootings made you want to go gun free in your pension fund or 401k ? BlackRock stands ready to help https://…,en,BlackRock
Tue Apr 10 12:37:05 +0000 2018,3 themes we see shaping #economies and #markets in Q2. https://t.co/F8bMgc8CeK https://t.co/eOHejPAywQ,en,BlackRock
Tue Apr 10 12:01:04 +0000 2018,How do you decide whether Roth or pre-tax #401k contributions are right for you? 3 questions to consider now. https://t.co/pkTUBWu3Mk #FinLitMonth https://t.co/xmwurmbFgb,en,BlackRock
Mon Apr 09 20:31:24 +0000 2018,"In honor of #FinLitMonth, check out our recommended #reading list to help you become a better #investor. https://t.co/kNKqXYfO4r https://t.co/6RUq22G7bV",en,BlackRock
Mon Apr 09 15:16:36 +0000 2018,RT @FinancialTimes: Larry Fink identifies China as critical BlackRock priority https://t.co/w9szXN9ibQ,en,BlackRock
Mon Apr 09 13:35:19 +0000 2018,Read now: Larry Fink’s annual letter to shareholders. https://t.co/0rnBn9tvo7 https://t.co/ZiImjH1Siz,en,BlackRock
Fri Apr 06 19:46:29 +0000 2018,3 charts to help illustrate the updated themes we see shaping #economies and #markets in the second quarter. https://t.co/IYt2AiKl8d https://t.co/ZQaaeHR6bE,en,BlackRock
Thu Apr 05 20:20:04 +0000 2018,"3 quantifiable factors that #investors should be focused on when trying to understand recent #volatility, rather than fixating on #Washington. https://t.co/lmh3yhQPFL https://t.co/KIEt6KvZSb",en,BlackRock
Thu Apr 05 15:31:57 +0000 2018,"""In the U.S., we expect that #inflation will reach the 2% target of the #Fed, and slightly above that. ” 

Learn more in our global investment outlook here: https://t.co/MGAOXUOhHN https://t.co/gS3zpg3o01",en,BlackRock
Thu Apr 05 15:00:19 +0000 2018,"Many are pointing a finger at #Washington for the recent spike in #volatility – however, we believe the catalysts lie elsewhere. Learn more: https://t.co/7CjGEflj72 https://t.co/zgGoETXx7S",en,BlackRock
Thu Apr 05 13:45:03 +0000 2018,Markets are now taking the #Fed at its word. Read what this means for risk #assets in our Q2 Global Investment Outlook. https://t.co/FiW1yumnTE https://t.co/uRyJchHGwX,en,BlackRock
Wed Apr 04 21:22:05 +0000 2018,We see heightened macro #uncertainty ahead and the potential for higher #risk premiums across assets. Read our views. https://t.co/RdIOyD6If2 https://t.co/Jg3qiAYeeH,en,BlackRock
Wed Apr 04 20:37:04 +0000 2018,What worries us? We highlight two key #risks to the global expansion and risk assets in our new quarterly outlook. https://t.co/JkA5DrJHcM https://t.co/W3HONb7SQZ,en,BlackRock
Wed Apr 04 14:22:22 +0000 2018,"#Trade is important, but its influence on global growth goes beyond the physical exchange of goods and services. Sentiment also plays an outsize role. Learn more: https://t.co/MI8D0qkhQq https://t.co/CWdQW3YEKj",en,BlackRock
Wed Apr 04 13:33:07 +0000 2018,"2017 was nearly nirvana for diversified #portfolios, but we see a bumpier road ahead for #markets. Read why. https://t.co/GdcbJjdrG3 https://t.co/I4scpzvEHk",en,BlackRock
Tue Apr 03 20:32:05 +0000 2018,"We have updated our 2018 investment themes, including why we see reduced #reward for #risk ahead. https://t.co/BHsb7Uzy2L https://t.co/ZtRbEx0evr",en,BlackRock
Tue Apr 03 16:52:28 +0000 2018,Will the U.S. #growth boost from #fiscal stimulus hasten the expansion’s end? We cover this and more in our Q2 outlook. https://t.co/2qfmkBkEBc https://t.co/Zji7eRjh1l,en,BlackRock
Mon Apr 02 21:52:09 +0000 2018,"Watch as Kate Moore, #BlackRock's Chief Equity Strategist, shares our views for the second quarter. 

Our full #global #investment outlook here: https://t.co/QjsOnJ6Odw https://t.co/U7dakIrmdn",en,BlackRock
Mon Apr 02 20:59:02 +0000 2018,A U.S.-China #trade war is not our base case. What could change this? We cover the triggers in our Weekly commentary. https://t.co/JveMWLmnHQ https://t.co/yVYiCy3BKH,en,BlackRock
Mon Apr 02 17:05:16 +0000 2018,#China has increased #tariffs on U.S. imports. Listen to our take on the potential escalation into a trade war on our most recent #podcast episode of The Bid: https://t.co/CZpPjqQxP0,en,BlackRock
Mon Apr 02 16:11:20 +0000 2018,Integrated global supply chains illustrate the broad economic implications of U.S.-China #trade tensions. Read more. https://t.co/2wiWHyzZP5 https://t.co/2L6q9b5hdg,en,BlackRock
Thu Mar 29 20:57:03 +0000 2018,We see UK earnings #growth trailing its global peers and believe returns will be driven by earnings rather than valuations. Read our take on the new #Brexit deal. https://t.co/vXKIndhC4g https://t.co/RMBCV8j4Ci,en,BlackRock
Thu Mar 29 15:25:18 +0000 2018,"The new #Brexit transition deal removes some uncertainty, but does it offer relief for UK #stocks? Read our take. https://t.co/uV1JAoo0vx https://t.co/I00fbos6P2",en,BlackRock
Thu Mar 29 14:08:06 +0000 2018,The US shift in #trade policy stands in contrast to decades of US-led opening up. Read about the implications in our latest Global Macro Outlook. https://t.co/zYlOgN3sb7 https://t.co/o4VBpbnLKj,en,BlackRock
Wed Mar 28 17:32:14 +0000 2018,"Thank you @powertofly for co-hosting an amazing event with us last night, focused on the intersection of data and design. Over 60 impressive female design and tech professionals joined us for an evening of networking, storytelling and panel discussions. #UX #FreeTheData https://t.co/HTi2wbNher",en,BlackRock
Wed Mar 28 14:04:05 +0000 2018,#Trade protectionism’s threat to growth goes far beyond its direct impact. Business confidence plays a big role. See our latest Global Macro Outlook. https://t.co/BDfGynMi4K https://t.co/IxrqlAaz3m,en,BlackRock
Tue Mar 27 18:40:04 +0000 2018,"In a period of heightened valuations, an optimistic #consumer may be more important for the #stock market than a spendthrift one. https://t.co/7xn7hGYsMA https://t.co/TnZ3LXGUmr",en,BlackRock
Tue Mar 27 14:22:18 +0000 2018,The U.S. #dollar’s swings are tied more to global #risk appetite than yield spreads for now. Read what this means for markets in our latest Global Macro Outlook. https://t.co/iW7CqNQcyI https://t.co/nsMcosZmEL,en,BlackRock
Tue Mar 27 13:57:04 +0000 2018,Need some help this #tax season? Learn whether a Roth or pre-tax #401k is right for you. https://t.co/dWVjdVw4yb https://t.co/7qZzfLNIxW,en,BlackRock
Mon Mar 26 21:04:09 +0000 2018,"3 reasons why #stocks may still thrive when consumers are confident, but frugal. https://t.co/li9UU9myqG https://t.co/ITnRQHhyVk",en,BlackRock
Mon Mar 26 18:45:03 +0000 2018,The new UK-EU agreement removes some #Brexit uncertainty. We cover the #investing takeaways in our Weekly Commentary: https://t.co/ib42g0GrH6 https://t.co/32CBvtrOXU,en,BlackRock
Mon Mar 26 15:21:05 +0000 2018,UK #stocks have been underperforming for years. Will the new #Brexit transition deal offer relief? Read our take: https://t.co/ii6I7Rz9sL https://t.co/UZs4XzitK3,en,BlackRock
Mon Mar 26 14:12:22 +0000 2018,"When faced with the choice between making a pre-tax or Roth #401k contribution, how do you know which one is right for you? 3 questions to consider: https://t.co/DZLncT4HEW https://t.co/S7awExKfXG",en,BlackRock
Sat Mar 24 02:00:00 +0000 2018,Larry Fink at the China Development Forum 2018 @CDRF15 in Beijing today: Individuals across the world are concerned about their financial future #ChinaDevForum,en,BlackRock
Sat Mar 24 01:30:03 +0000 2018,"Larry Fink discusses what role companies can play in delivering long term growth while benefiting society, with @tim_cook at the China Development Forum 2018 @CDRF15 in Beijing today #ChinaDevForum",en,BlackRock
Fri Mar 23 17:16:02 +0000 2018,"How might new #tariffs impact the markets? In our latest #podcast, we speak to Gerardo Rodriguez, BlackRock Portfolio Manager, for his take on tariffs and trade risks. https://t.co/dvQiBqtZXq",en,BlackRock
Thu Mar 22 21:15:13 +0000 2018,"In our latest #podcast, we discuss new steel and aluminum #tariffs, and the potential for a trade war: https://t.co/2IjwyhO9M8 https://t.co/vmxCYWbXX4",en,BlackRock
Thu Mar 22 19:04:35 +0000 2018,RT @iShares: Learn more about how a #smartbeta bond #ETF is similar to your smartphone https://t.co/skCJsjOIRn https://t.co/OVigysO9eD,en,BlackRock
Thu Mar 22 16:15:04 +0000 2018,The growing case for #EmergingMarkets: https://t.co/T0rgSlXGMl https://t.co/RXQZBCcdW9,en,BlackRock
Thu Mar 22 15:27:15 +0000 2018,The return of #volatility requires #investors to up their game in risk management: https://t.co/x9Vmm98cHV https://t.co/Q8Tl5FwIMl,en,BlackRock
Thu Mar 22 14:05:01 +0000 2018,RT @mercycorps: Mercy Corps thanks our partners and supporters including @Walmart @MiamiFoundation and @BlackRock that make our recovery ef…,en,BlackRock
Wed Mar 21 13:21:05 +0000 2018,Emerging Market reform in some countries is fostering a more sustainable #growth path. Learn why #India is one of our favored picks within EM. https://t.co/An15LNBGS8 https://t.co/xf2qfced4D,en,BlackRock
Tue Mar 20 20:48:09 +0000 2018,"A brightening economy in #India is boosting #earnings expectations and, we believe, offers a cushion against potential #trade-related shocks. Learn more. https://t.co/N3zXaPqA1w https://t.co/MQhEXSu9Ou",en,BlackRock
Tue Mar 20 18:00:45 +0000 2018,RT @PeggyJ: Thrilled to be joining the @BlackRock board https://t.co/EyHlnREMO5,en,BlackRock
Tue Mar 20 17:09:06 +0000 2018,We believe valuable opportunities exist in #bonds as global growth continues: https://t.co/ruijx5Zpwv https://t.co/yWjvw07hTe,en,BlackRock
Tue Mar 20 15:20:26 +0000 2018,"#Markets have priced in higher #rates for 2018, but the longer term view is a miss. Learn more: https://t.co/nS3Ynsvy5q https://t.co/BTiTNfmfaN",en,BlackRock
Tue Mar 20 12:43:04 +0000 2018,Short-term #bonds are looking attractive again after years in the doldrums. Read why in our Fixed income #strategy. https://t.co/xmZC6LpNkf https://t.co/0mcqdtHjGn,en,BlackRock
Mon Mar 19 20:25:04 +0000 2018,Rising trade tensions do not shake our confidence in EM #stocks. We explain in our weekly commentary: https://t.co/Wrf4r4CHME https://t.co/UA4DPYgYvc,en,BlackRock
Mon Mar 19 17:59:08 +0000 2018,The market has caught up with the #Fed’s normalization plans. We delve into the #investing implications: https://t.co/7VNEYFPPOg https://t.co/do4jdAJRgd,en,BlackRock
Mon Mar 19 14:34:04 +0000 2018,Trade risks are no match for the good things going for EM equities. India and its reforms offer a case in point. https://t.co/EKJLap1XfE https://t.co/8mfXZ4rzOy,en,BlackRock
Mon Mar 19 14:15:04 +0000 2018,We remain convinced that the higher levels of realized #volatility we’ve experienced recently will be a lasting component of the #investment landscape for the foreseeable future. https://t.co/A0MrE13X40 https://t.co/dGJy9LoWbV,en,BlackRock
Mon Mar 19 13:39:06 +0000 2018,3 reasons why #technology continues to be one of our top sector picks. https://t.co/CEdk5HEPck https://t.co/zPFvirjyP0,en,BlackRock
Fri Mar 16 21:58:44 +0000 2018,"In this year’s Defined Contribution Pulse survey, most #401k investors used positive words to describe how they feel about #retirement. #FunFactFriday https://t.co/RBuqP7dqWV https://t.co/mTYvDzOSIP",en,BlackRock
Fri Mar 16 19:04:04 +0000 2018,"#BlackRock’s @RickRieder discusses the new #volatility regime, why #risk is being misapprehended, and how to navigate these new challenges. https://t.co/XlMd2kXsfW https://t.co/zVQp48s2Jk",en,BlackRock
Fri Mar 16 17:51:47 +0000 2018,"RT @RickRieder: Check out my latest #blog post - the new #volatility regime, why #risk is being misapprehended, and how to navigate these n…",en,BlackRock
Fri Mar 16 17:51:11 +0000 2018,"RT @iMentor: Meet this month's featured mentor. Sue, from our corporate partner @BlackRock​, is an immigrant, and a first-generation colleg…",en,BlackRock
Fri Mar 16 16:55:07 +0000 2018,Learn why potential #growth matters and where we see it heading from here: https://t.co/Bk1Hqfc30J https://t.co/z3idydabje,en,BlackRock
Thu Mar 15 22:56:15 +0000 2018,"RT @bysarahkrouse: After expected election of new BlackRock board members, 1/3 of its independent directors will be women, the highest prop…",en,BlackRock
Wed Mar 14 16:42:16 +0000 2018,RT @iShares: Yesterday’s investment answers no longer meet tomorrow’s needs. See how indexing has reshaped what’s possible. https://t.co/Jl…,en,BlackRock
Wed Mar 14 15:15:04 +0000 2018,How will #trade tensions affect the #markets? Learn more from our experts  https://t.co/ZBgb8nPTF4 https://t.co/zpSDrBgEqA,en,BlackRock
Tue Mar 13 22:05:00 +0000 2018,We see limited #trade actions as unlikely to hurt the #risk-on sentiment. Richard Turnill explains why.  https://t.co/2vUWMIOcB0 https://t.co/6MvlbLeAob,en,BlackRock
Tue Mar 13 20:44:18 +0000 2018,RT @BLKPublicPolicy: Check out BlackRock’s Letter to the Editor of the WSJ on why all share owners should vote their stocks: https://t.co/d…,en,BlackRock
Tue Mar 13 12:45:04 +0000 2018,Will millennials actually get the short end of the stick on #retirement income? Find out more in our 2018 Defined Contribution Pulse Survey: https://t.co/TcDhqaqhBb https://t.co/COjeQ8twGq,en,BlackRock
Mon Mar 12 21:34:26 +0000 2018,Congratulations to #BlackRock's Frank Cooper on being named to @AdWeek's list of 20 executives using #tech to transform the role of CMO: https://t.co/ER6P6fgGCN https://t.co/6K43xx4DUY,en,BlackRock
Mon Mar 12 18:55:13 +0000 2018,"Melanie Manko, who joined us as a summer analyst and now is part of our #tech analyst rotational program, talks about her BlackRock journey, the impact she’s made, and her #advice for women looking to start their careers in #fintech. (via: @wayup) https://t.co/1FOyRQwvkj https://t.co/PoNIEjgl3i",en,BlackRock
Mon Mar 12 18:34:07 +0000 2018,Is #protectionism making a comeback? Read our weekly commentary for our thoughts how #trade risk are likely to play out in markets.  https://t.co/oc0veWPmKv https://t.co/awGgEwsMPL,en,BlackRock
Mon Mar 12 16:30:57 +0000 2018,Who are the winners and losers in #trade conflicts? We offer a short history of #market reactions to trade spats.  https://t.co/c5Jmwv6igA https://t.co/xCSko89HCa,en,BlackRock
Mon Mar 12 15:17:54 +0000 2018,#BlackRock’s Jeff Rosenberg explains the appeal of shorter-term U.S. treasuries: https://t.co/0LZ9LPE9Al https://t.co/QZkYL8bQkw,en,BlackRock
Mon Mar 12 14:30:07 +0000 2018,Why should investors worry less about higher #interest rates and more about #volatility? #BlackRock’s Russ Koesterich explains: https://t.co/UuGRPsRCWG https://t.co/HMCAgCRbYG,en,BlackRock
Fri Mar 09 22:14:05 +0000 2018,"How did #portfolios hold up in the recent #market turmoil? Patrick Nolan, BlackRock’s Portfolio Strategist, discusses our analysis here: https://t.co/6AxtIq7CZI https://t.co/yovdSPX5GR",en,BlackRock
Fri Mar 09 21:40:04 +0000 2018,"How does #AI apply to #investing? Jody Kochansky, BlackRock’s Chief Engineer, explains how we use it to improve the financial wellbeing of our investors https://t.co/WFAa30xBS5 https://t.co/uzRxRvUwv4",en,BlackRock
Fri Mar 09 19:11:01 +0000 2018,"We analyzed 6,500 #advisor models to see how they fared relative to their #benchmarks during the recent market turmoil. Here is what we learned: https://t.co/RUHaWrmAl0 https://t.co/LFlyryx5Id",en,BlackRock
Fri Mar 09 18:29:49 +0000 2018,3 ways we’re using #AI to help address the challenge of financial well-being: https://t.co/wBtdBAvSzZ https://t.co/sQbbA5j5bG,en,BlackRock
Thu Mar 08 18:41:08 +0000 2018,"In celebration of #InternationalWomensDay this year, we’ve asked our employees around the world to share how they’re committing to #PressForProgress https://t.co/OZeBSseg5i",en,BlackRock
Thu Mar 08 18:38:45 +0000 2018,"Samantha Ricciardi, BlackRock Country Head of Mexico, discusses the importance of stepping out of your comfort zone. #InternationalWomensDay #IWD2018 https://t.co/Nv1ciavMYW https://t.co/EvaNemFHOV",en,BlackRock
Thu Mar 08 17:05:48 +0000 2018,We're proud to support @Kiva today and everyday. #IWD2018 #PressforProgress https://t.co/csYVsZFHMh,en,BlackRock
Thu Mar 08 16:56:45 +0000 2018,"Geraldine Buckingham, Head of BlackRock Corporate Strategy, shares the importance of having the confidence to take risks in your career. #InternationalWomensDay #IWD2018 https://t.co/ps1gUflFdu https://t.co/oKKCc0G00H",en,BlackRock
Thu Mar 08 15:20:48 +0000 2018,"Anne Ackerley, BlackRock's Head of U.S. &amp; Canada Defined Contribution, shares how she helped build a powerful community of employees at #BlackRock dedicated to engaging and fostering the full potential of women. #IWD2018 #PressForProgress https://t.co/UKS4EfsNyL https://t.co/AfrjG7Lhh7",en,BlackRock
Thu Mar 08 14:03:03 +0000 2018,"56% of late career females feel they are on track to retire, significantly lower than their male counterparts #InternationalWomensDay #PressForProgress #IWD2018 https://t.co/A8dsqZqbwM https://t.co/hVnazN5bfe",en,BlackRock
Wed Mar 07 20:49:10 +0000 2018,"RT @Kiva: We're taking a stand for gender equality by investing in 10,000 women for #InternationalWomensDay. By supporting a woman-owned #s…",en,BlackRock
Tue Mar 06 14:53:20 +0000 2018,Now is the perfect time for #401k investors to use confidence from recent market performance to build better savings habits. https://t.co/iPbl7EJcwT https://t.co/0QeL18L3YD,en,BlackRock
Tue Mar 06 14:27:07 +0000 2018,"Bumper issuance of Treasury bills and tax-related selling have chased up yields of short-term bonds to attractive levels, in our view. https://t.co/pxQnbzUpn9 https://t.co/rEFZMRbOAV",en,BlackRock
Mon Mar 05 22:53:52 +0000 2018,We’re long on the short end: we see short-maturity bonds now providing more shelter against rate rises than the long-term variety. https://t.co/Fet2wU78Cn https://t.co/hxGkLUkePL,en,BlackRock
Fri Mar 02 17:54:04 +0000 2018,We see the potential for a rare #post-crisis upgrade to potential #growth. This means the global #expansion can last longer. Read more in our Global Macro Outlook. https://t.co/M8uhw0MPet https://t.co/cA8oSp7DDc,en,BlackRock
Fri Mar 02 13:49:04 +0000 2018,A key ingredient of potential #growth – productivity – looks poised for a rebound. We see robust R&amp;D spending resulting in pent-up gains. Read more in our #Global Macro Outlook: https://t.co/dbUZ3KCQeF https://t.co/rBS8ViXB9v,en,BlackRock
Thu Mar 01 22:22:54 +0000 2018,A stronger US #growth outlook should lead to higher #Treasury yields – but risk assets like equities can still do well. Read more in our Global Macro Outlook: https://t.co/zDwn7vtySp https://t.co/QS6d4MGQ91,en,BlackRock
Thu Mar 01 18:36:50 +0000 2018,How to play it safe as market #volatility rises: https://t.co/AcKfiDwcYQ https://t.co/60mAJkWlss,en,BlackRock
Thu Mar 01 18:01:09 +0000 2018,"Cautious on #bitcoin, bullish on #blockchain? Here’s our take: https://t.co/yl03CrI990 https://t.co/DdUye7uVYC",en,BlackRock
Wed Feb 28 20:07:02 +0000 2018,Are #cryptocurrencies coming of age as #investment targets yet? Read our view: https://t.co/Mason0wX8b https://t.co/ietwnql90T,en,BlackRock
Wed Feb 28 15:48:53 +0000 2018,"When economic growth, #inflation and #volatility are all on the rise, #interest rates are sure to follow. Learn more: https://t.co/Rgl76T3hd9 https://t.co/WduR4mpA7t",en,BlackRock
Wed Feb 28 14:48:00 +0000 2018,"Our team continues to favor high-income producing assets, including structured products and emerging market debt, to drive returns. Learn more here: https://t.co/VDaT0Wrmso https://t.co/PB0kRUyx3I",en,BlackRock
Wed Feb 28 00:15:03 +0000 2018,"Momentum was dented in the early February #stock market swoon, but we believe its moment isn’t over. Learn more: https://t.co/nFBREaI9XW https://t.co/BeoFnK4g1G",en,BlackRock
Tue Feb 27 18:36:05 +0000 2018,The magnitude of the rise in #volatility is unlikely to last. Learn more in our global allocation monthly insight: https://t.co/fl7bn31lIi https://t.co/zB9cQUsXVy,en,BlackRock
Tue Feb 27 15:57:48 +0000 2018,Learn why we see potential for #momentum to #outperform over the next 3-6 months. https://t.co/vJTvqWJnwp https://t.co/xBiFccIu2s,en,BlackRock
Mon Feb 26 15:54:07 +0000 2018,3 reasons why #bond yields are rising quickly: https://t.co/yviuPOsPY5 https://t.co/DSX33ioXQ9,en,BlackRock
Mon Feb 26 15:48:50 +0000 2018,"Are #cryptocurrencies coming of age for mainstream investors? Not yet, we think. Read why in our weekly commentary.  https://t.co/rrpVRuxEzt https://t.co/nxF0q1KldG",en,BlackRock
Fri Feb 23 21:31:54 +0000 2018,"Jeff Rosenberg, BlackRock Chief Investment Strategist for Fixed Income, explains why #bond #yields are rising quickly: https://t.co/QWOP1miUHu https://t.co/pb66AITdW1",en,BlackRock
Thu Feb 22 20:10:52 +0000 2018,"RT @SFBusinessTimes: Now @blackrock creates #PaloAlto lab focused on artificial intelligence 
https://t.co/WYYbr8heeJ #AI #fintech #robots…",en,BlackRock
Wed Feb 21 18:58:04 +0000 2018,What’s behind recent rapid rate rises? We see more factors than just markets waking up to the #inflation comeback. https://t.co/tJ5R6vxSoG https://t.co/3p9fqRQZ4q,en,BlackRock
Wed Feb 21 17:42:14 +0000 2018,RT @iMentor: Mentor Spotlight: Meet Davendra! Davendra is a mentor from our corporate partner @blackrock and he has been passionately suppo…,en,BlackRock
Wed Feb 21 17:09:54 +0000 2018,"The impact of spiking U.S. equity vol rippled across #global credit #markets, highlighting some lessons for investors.  https://t.co/5fq9lswiml https://t.co/nrGfxQmp7f",en,BlackRock
Wed Feb 21 15:12:02 +0000 2018,"Russ Koesterich, BlackRock Portfolio Manager, explains why we think #interest rates and #stock prices can rise together in current market conditions. Read more: https://t.co/8KPxPI60GR https://t.co/BL9fOzf8tw",en,BlackRock
Tue Feb 20 19:44:04 +0000 2018,We’ve upgraded our view of U.S. #stocks and shifted to neutral on European equities. BlackRock’s Richard Turnill explains why here: https://t.co/4jdFMkbLk2 https://t.co/wxfnbrmEh4,en,BlackRock
Tue Feb 20 16:21:54 +0000 2018,RT @FinancialTimes: The world's biggest investment group BlackRock is now creating an artificial intelligence research centre. Asset manage…,en,BlackRock
Tue Feb 20 16:11:04 +0000 2018,RT @iShares: 5 ways to help navigate choppy markets https://t.co/hq9vfeOAhL https://t.co/wW1oqfIOiq,en,BlackRock
Mon Feb 19 18:32:03 +0000 2018,We have upgraded U.S. stocks to overweight and shifted European equities to neutral. Read why in our weekly commentary: https://t.co/GgkoGmgIy5 https://t.co/BUyZYZ4zyh,en,BlackRock
Mon Feb 19 15:30:04 +0000 2018,Fiscal stimulus is supercharging U.S. earnings growth expectations. Read about the implications for U.S. equities. https://t.co/2jXxNZSyCL https://t.co/k8OrsXDM35,en,BlackRock
Fri Feb 16 16:45:46 +0000 2018,"The new #tax code is complicated, and while highly taxed companies appear early winners (on paper), the top line hides great detail below. BlackRock's Kate Moore, Chief Equity Strategist, explains. https://t.co/glyrYiNv6w https://t.co/FwtRNctFZI",en,BlackRock
Thu Feb 15 20:19:04 +0000 2018,Smart planning can help ensure that you and your family are prepared for any kind of emergency. Here are 5 items for your financial “go-bag”: https://t.co/GoxlOCLCZ3 https://t.co/hAg1Uz7Rj4,en,BlackRock
Thu Feb 15 15:47:55 +0000 2018,5 ways to enhance financial readiness in case of an emergency: https://t.co/zoaKdQBj5q https://t.co/T1dUfV8D9i,en,BlackRock
Tue Feb 13 22:44:47 +0000 2018,A bout of volatility shook global equity markets last week. BlackRock's Richard Turnill explains why investors should look past near-term dislocations and focus on the fundamentals. https://t.co/i3Jtlc0Am2 https://t.co/rZidm5v90C,en,BlackRock
Mon Feb 12 22:07:06 +0000 2018,#Markets have woken up to higher U.S. growth and deficits. We explain the implications for investors: https://t.co/1NEszXRY9Y https://t.co/HtzJGujEiI,en,BlackRock
Mon Feb 12 19:34:54 +0000 2018,Last week’s #equity market #volatility was off the charts. Read our take on it in our Weekly Commentary: https://t.co/a0lu5SWiD4 https://t.co/p7BwqvHrac,en,BlackRock
Fri Feb 09 17:14:47 +0000 2018,"After the selloff, what’s changed? Not much: https://t.co/Frcp8aT3Em https://t.co/kKCX3u759m",en,BlackRock
Fri Feb 09 15:22:21 +0000 2018,"RT @iShares: Mistaken identities should be reserved for the movies, not the exchange-traded products (ETP) market.  Head of U.S. iShares Ma…",en,BlackRock
Thu Feb 08 16:43:49 +0000 2018,Read our take on this month's #stock swoon here: https://t.co/TZCCUUp8gK https://t.co/WV8uEWKYpM,en,BlackRock
Wed Feb 07 23:14:45 +0000 2018,Are bonds the cure for market #volatility jitters? #BlackRock's Jeff Rosenberg explains how fixed income can help mitigate portfolio risk in our latest #podcast:  https://t.co/vD7AU4hXxo https://t.co/CeATop6zka,en,BlackRock
