created_at,full_text,lang,user_name
Sat Feb 09 15:30:33 +0000 2019,"“We’re proud of the wonderful relationship we enjoy with local farmers, many of which are landowners that have children who participate in the PA Farm Show and auction each year.” https://t.co/YDCTZzFdzF https://t.co/7HOK65g38X",en,Cabot Oil & Gas Corp
Fri Feb 08 14:30:26 +0000 2019,"Former student, Ben Whitaker, describes his journey going back to school at the @LCMarcellusPNG and how it helped him build a successful career in the #naturalgas industry. #LookingBackMovingForward https://t.co/RztZ0yk1wg https://t.co/EtkyaBTFQe",en,Cabot Oil & Gas Corp
Thu Feb 07 19:30:40 +0000 2019,"“This was my second Farm Show, and I was really excited that Cabot bought my market hog,” said Blue Ridge High School senior Tom Gudykunst, who is in a dual enrollment program at @LCMarcellusPNG https://t.co/YDCTZzFdzF https://t.co/to88FfVtZ8",en,Cabot Oil & Gas Corp
Wed Feb 06 15:30:20 +0000 2019,"If you like variety, working inside or outside, and are detail oriented, then you may be interested in a diesel mechanic position in the oil &amp; #naturalgas industry. Learn more via the video from @OOGEEP &amp; @powerimpossible  #WorkforceWednesday https://t.co/zj2O04hVKY https://t.co/RZ0qnIGed1",en,Cabot Oil & Gas Corp
Tue Feb 05 20:01:29 +0000 2019,"Ben Whitaker, Cabot production foreman, describes his experience at the @LCMarcellusPNG and how it prepared him for his current responsibilities working for Cabot. #LookingBackMovingForward https://t.co/RztZ0yk1wg https://t.co/Q5AsH8s5Tt",en,Cabot Oil & Gas Corp
Tue Feb 05 17:44:12 +0000 2019,"“We look forward to working with the legislature and the administration on policies that build on Pennsylvania’s successes, rather than the same tired ideas that will only pull us in the wrong direction.” via @APIenergy https://t.co/jEUOO0X4DA",en,Cabot Oil & Gas Corp
Mon Feb 04 18:35:12 +0000 2019,A recent @APIenergy Workplace Safety Report highlights the industry's commitment to safety citing that employees of the #naturalgas and oil industry experience injuries and illnesses at a lower rate than the private sector. Read more here https://t.co/trpRpxsmar https://t.co/EBS5sTN7xa,en,Cabot Oil & Gas Corp
Mon Feb 04 15:10:11 +0000 2019,"#ICYMI: On the latest @shalegasradio this past weekend @WdesRosiers &amp; Rusty Fender welcomed Dan Kish, Senior Fellow with the Institute for Energy Research and Frank Scavo, CEO of Scavo Investment Properties as guests. https://t.co/bQ2yHyQ22b 
https://t.co/jP5DSfQxou",en,Cabot Oil & Gas Corp
Sun Feb 03 21:30:18 +0000 2019,"As you get ready for the #SuperBowl today, remember that #naturalgas helps make the game, your parties and fanfare possible. Read more about the connection https://t.co/jFfmT4S5lp. https://t.co/Qc57TS8xbY",en,Cabot Oil & Gas Corp
Sun Feb 03 17:10:13 +0000 2019,In need of a quick appetizer for today’s #SuperBowl celebrations? Check out some last minute game day snacks made easy with #naturalgas https://t.co/yS13fHIyZd https://t.co/aMHUxpeDdu,en,Cabot Oil & Gas Corp
Fri Feb 01 23:30:23 +0000 2019,"Not to worry, if #PunxsutawneyPhil sees his shadow tomorrow and there are 6 more weeks of #winter, we’ll keep you warm with affordable &amp; reliable #naturalgas. https://t.co/b8zqUEKPdN",en,Cabot Oil & Gas Corp
Fri Feb 01 20:30:30 +0000 2019,"Whether you'll be watching @SuperBowl 53 from the couch, planning a tailgate, or headed off into the big game itself, oil and #naturalgas have you covered this weekend. https://t.co/4SI5GHb1xk https://t.co/s5LWrz43RA",en,Cabot Oil & Gas Corp
Fri Feb 01 18:28:41 +0000 2019,"RT @PAChamber: Pa.'s future depends on the continued growth, diversification of its #energy portfolio. Read our joint op/ed with @PAManufac…",en,Cabot Oil & Gas Corp
Fri Feb 01 18:00:07 +0000 2019,Jonathan Fritz talks about the Act 13 #ImpactFee funding and the direct benefits his district has seen throughout the years. #LookingBackMovingForward  https://t.co/iJLr6POTOv https://t.co/a0Iqk7O9z7,en,Cabot Oil & Gas Corp
Fri Feb 01 15:02:24 +0000 2019,"#ICYMI: This past summer the #SusquehannaCounty Commissioners provided a $10,000 check to local first responders made possible by #ImpactFee funds from the oil &amp; #naturalgas industry. https://t.co/VHBAukEjce https://t.co/as6Y0BDFcp",en,Cabot Oil & Gas Corp
Thu Jan 31 18:30:12 +0000 2019,"Our work with the @CEOWeinbergFB &amp; the Fill a Glass with Hope program has been extremely rewarding and we cherish the opportunity to help make fresh fruits, vegetables and milk available to every school in #SusquehannaCounty! https://t.co/EV06FfYcML https://t.co/3JBvHePTvr",en,Cabot Oil & Gas Corp
Thu Jan 31 15:30:37 +0000 2019,"#ICYMI: Earlier this month, PA Governor Tom Wolf joined the @KDKARadio Morning News to discuss several topics, including #naturalgas pipelines. Listen here https://t.co/mtNZkjzdLU https://t.co/m1KIDW7oo3",en,Cabot Oil & Gas Corp
Wed Jan 30 18:00:37 +0000 2019,"Do you like solving complex problems using chemistry, physics, and math? A chemical engineer career in the #naturalgas industry may be the right fit for you. Watch the video below via @OOGEEP &amp; @powerimpossible and read more here https://t.co/zj2O04hVKY #WorkforceWednesday https://t.co/w1Aaufy2lD",en,Cabot Oil & Gas Corp
Wed Jan 30 16:30:34 +0000 2019,"From the turf to the uniforms, oil &amp; #naturalgas has been powering #football players &amp; changing history since the beginning. Read more about how the energy industry has improved the game, making it safer &amp; more efficient leading up to @SuperBowl 53. https://t.co/xpYSAqjYWd https://t.co/xI1Sa6NDd5",en,Cabot Oil & Gas Corp
Wed Jan 30 14:40:08 +0000 2019,Stay safe &amp; warm with the extreme cold temperatures covering much of the country this week. Check on neighbors and family - and don’t forget about pets &amp; animals. Wear warm clothing &amp; cover exposed skin. #PolarVortex https://t.co/utmCwfi0JP https://t.co/OxSRDz5GX8,en,Cabot Oil & Gas Corp
Tue Jan 29 22:23:41 +0000 2019,"RT @MarcellusGas: ""For the first time since the 1950s, the U.S. will export more energy than it imports by 2020 as increases in crude oil,…",en,Cabot Oil & Gas Corp
Tue Jan 29 19:00:49 +0000 2019,"Cabot is proud to support the #SusquehannaCounty Ag Day and its goal of educating the region about the importance of agriculture. Register today for this FREE event on March 1 to enjoy workshops, vendor exhibits &amp; the highly anticipated pie auction! https://t.co/zowiWdkOS4 https://t.co/L6a4LKeJUc",en,Cabot Oil & Gas Corp
Tue Jan 29 15:40:12 +0000 2019,"In addition to supplying the resources required to make the game possible, #naturalgas aids in cooking delicious appetizers for all of your @SuperBowl celebrations. Read about some of our favorite recipes here https://t.co/yS13fHqXAD https://t.co/wfITE0A0Mq",en,Cabot Oil & Gas Corp
Mon Jan 28 19:30:30 +0000 2019,"The 2018 #football season went by fast! @SuperBowl 53 is debuting this Sunday, and before the Patriots &amp; Rams face off, we look back at the @ProFootballHOF game, NFL history, and the relationship football has with oil &amp; #naturalgas. https://t.co/uIGISc2WG4 https://t.co/0f8rzVnkz1",en,Cabot Oil & Gas Corp
Mon Jan 28 18:01:07 +0000 2019,"“Our roads are better now than they have ever been,” explains state representative Jonathan Fritz when asked about the changes that the #naturalgas industry has brought to #NEPA #LookingBackMovingForward https://t.co/iJLr6POTOv https://t.co/Kyf9AL1qMy",en,Cabot Oil & Gas Corp
Mon Jan 28 15:00:21 +0000 2019,"#ICYMI: The latest @shalegasradio features @WdesRosiers discussing recent #energy industry news. Read more here https://t.co/H7FMUBTrwq
https://t.co/CEHJ8mDbP8",en,Cabot Oil & Gas Corp
Thu Jan 24 18:00:35 +0000 2019,Jonathan Fritz speaks about the connection between the #naturalgas industry and local tourism in #NEPA: “When you have a region that is doing well economically the people there are happy.” #LookingBackMovingForward https://t.co/iJLr6POTOv https://t.co/wqY9faFd7v,en,Cabot Oil & Gas Corp
Thu Jan 24 16:09:20 +0000 2019,"""Natural gas experiences the largest production increase of all fossil fuels during the projection period across all cases, driven by continued development of lower-cost shale gas and tight oil resources."" https://t.co/Bv6TjpAdlv",en,Cabot Oil & Gas Corp
Thu Jan 24 14:56:40 +0000 2019,"CNG, or compressed #naturalgas, is a safe, clean-burning alternative fuel source that can save you money and reduce your carbon footprint. #NaturalGas101 https://t.co/GwtGVzuobZ https://t.co/IlV2mZsWuT",en,Cabot Oil & Gas Corp
Wed Jan 23 15:00:22 +0000 2019,RT @CareerKeystone: Attention:  Keystone College Business Majors!  Check this out!  The oil and natural gas industry is an exciting careeer…,en,Cabot Oil & Gas Corp
Wed Jan 23 14:16:49 +0000 2019,"Are you an analytical thinker, have excellent communication skills &amp; good at developing relationships? A career in business admin. in the oil &amp; #naturalgas industry may be right for you. Watch the video via @OOGEEP &amp; @powerimpossible https://t.co/zj2O04hVKY #WorkforceWednesday https://t.co/rS6dehyImb",en,Cabot Oil & Gas Corp
Tue Jan 22 20:10:09 +0000 2019,"""As the nation’s second largest #naturalgas producer, Pennsylvania is at the forefront of leveraging this clean fuel source to enhance air quality and stimulate enormous economic growth."" https://t.co/XD2WL9fI3k",en,Cabot Oil & Gas Corp
Tue Jan 22 15:01:14 +0000 2019,"As the State Representative for the 111th district for #Susquehanna and #Wayne counties, Jonathan Fritz, talk about the positive changes he has seen come to his district due to the #naturalgas industry. #LookingBackMovingForward Read more here https://t.co/iJLr6POTOv https://t.co/TZwLNU8yGp",en,Cabot Oil & Gas Corp
Mon Jan 21 18:00:57 +0000 2019,"#Naturalgas doesn’t just cook dinner, it fuels our lives, fosters innovation and advances #technology. Read more about @powerimpossible here https://t.co/iod8L6iUHP https://t.co/P2w9FgM3kU",en,Cabot Oil & Gas Corp
Mon Jan 21 15:00:21 +0000 2019,"#ICYMI: The lastest @shalegasradio features @WdesRosiers discussing the Lackawanna Energy Center going online, how #naturalgas plays a role in reducing carbon dioxide emissions,
and other recent industry news. Read more here https://t.co/MxtCg5mU3W https://t.co/HlblZ2ruCb",en,Cabot Oil & Gas Corp
Fri Jan 18 18:01:14 +0000 2019,"For greater safety, reliability and resiliency (and to fuel the region’s economy), new #naturalgas #pipelines must be part of #NewYork and #NewEngland’s energy future. #energylink https://t.co/VVJx2bFRU1 https://t.co/fUgIfxLHjx",en,Cabot Oil & Gas Corp
Thu Jan 17 20:07:32 +0000 2019,"RT @APIenergy: America’s Generation Energy has the skill, the technological expertise and the drive to make our future safer, cleaner and b…",en,Cabot Oil & Gas Corp
Thu Jan 17 18:10:25 +0000 2019,"#ICYMI: Another successful PA Farm Show ended this past weekend. As always, Cabot was excited to attend and support the #Pennsylvania agriculture industry and the people who make it thrive. Read more here https://t.co/QytOYgltHo #PAFS19 https://t.co/WfbbMxM8bH",en,Cabot Oil & Gas Corp
Thu Jan 17 15:00:29 +0000 2019,"Dale Howell explains that the “roads are one of the biggest improvements they have made” when referencing the benefits of #naturalgas development in the region #LookingBackMovingForward 
https://t.co/5FBCsPqnG8 https://t.co/qyCzDuzwbe",en,Cabot Oil & Gas Corp
Wed Jan 16 20:01:47 +0000 2019,"Cabot is excited to see the progress on making #naturalgas available to families and businesses in Tunkhannock, Pa. We are pleased to help supply the community with local low-cost natural gas in the core area of our operations. More at https://t.co/NTvf8gFzXp https://t.co/dLuUFhXAqR",en,Cabot Oil & Gas Corp
Wed Jan 16 17:52:45 +0000 2019,Learn more about a career as an I&amp;E Technician in oil &amp; #naturalgas industry by watching the video below via @OOGEEP &amp; @powerimpossible https://t.co/zj2O04hVKY #WorkforceWednesday https://t.co/b59ZBjKENc,en,Cabot Oil & Gas Corp
Wed Jan 16 15:26:51 +0000 2019,"We’re pleased to fuel the state-of-the-art 1,480 megawatt @InvenergyLLC Lackawanna Energy Center - another step forward in reducing U.S. power sector emissions while helping to serve #naturalgas demand in Northeast Pennsylvania.
https://t.co/idDIzJlayN https://t.co/rIJjY0MvHQ",en,Cabot Oil & Gas Corp
Tue Jan 15 20:40:34 +0000 2019,Wishing @GovernorTomWolf all the best for his next term. We look forward to working together to continue helping grow PA’s economy through the ongoing safe and responsible development of #naturalgas. https://t.co/qd6slOYjkP,en,Cabot Oil & Gas Corp
Tue Jan 15 20:00:22 +0000 2019,"“They treated me with respect and they treated my property with respect” explains Dale Howell, #SusquehennaCounty landowner, on working with Cabot over the past 10 years #LookingBackMovingForward More here 
https://t.co/5FBCsPqnG8 https://t.co/sqI1LAWpSo",en,Cabot Oil & Gas Corp
Tue Jan 15 14:45:12 +0000 2019,"“Many years have passed, and the reality is that #shale production has surpassed all expectations namely through the constant advance of technologies and improvement of operations.” Read more here https://t.co/OxuREEctgB via @Forbes",en,Cabot Oil & Gas Corp
Mon Jan 14 19:45:11 +0000 2019,"#ICYMI: Watch the full @APIenergy #SOAE2019 presentation to learn how America’s Generation Energy supplies the foundation for modern life by providing the fuel, power and products that make us safer, healthier &amp; more comfortable. https://t.co/YfLqXsrbga https://t.co/vureaPdSMp",en,Cabot Oil & Gas Corp
Mon Jan 14 19:17:52 +0000 2019,"@ENERGY: ""nearly half of all U.S. households use natural gas to heat their homes""
Read about how Cabot contributes here https://t.co/utmCwfi0JP https://t.co/2zr6n4IVSG",en,Cabot Oil & Gas Corp
Mon Jan 14 16:00:22 +0000 2019,Natural gas pipelines are the essential #energylink to keeping you and your home warm this winter. #LeidySouth #AtlanticSunrise https://t.co/GPZJmoHPWK https://t.co/cgsOAS9os2,en,Cabot Oil & Gas Corp
Mon Jan 14 14:00:20 +0000 2019,"#ICYMI: The latest @shalegasradio features @WdesRosiers discussing his experience at the 103rd PA Farm Show, some of Cabot’s recent philanthropic efforts in #NEPA, and as always, some industry news. Read more here https://t.co/0Q6lrLSGLn https://t.co/RGSld0WrAO",en,Cabot Oil & Gas Corp
Fri Jan 11 16:26:43 +0000 2019,RT @APIenergy: America’s energy abundance has produced lower energy costs for consumers and increased household disposable income. https://…,en,Cabot Oil & Gas Corp
Fri Jan 11 15:50:25 +0000 2019,"As a landowner with four #naturalgas wells on his property, Dale Howell explains how his royalty payments have been put to good use. #LookingBackMovingForward 
https://t.co/5FBCsPqnG8 https://t.co/jtz2AyFx0D",en,Cabot Oil & Gas Corp
Thu Jan 10 18:00:52 +0000 2019,#ICYMI: The Fill a Glass with Hope kick-off event was a success at the PA Farm Show! Cabot is proud to support this @FeedingPA @padairymens program as they begin their 5th year. Learn more about the event &amp; the program here https://t.co/7TmHYAmRR0 https://t.co/XdH1SwZKIH,en,Cabot Oil & Gas Corp
Thu Jan 10 15:50:11 +0000 2019,"Households that use #naturalgas for heating, cooking, and clothes drying save an average of $874 per year compared to homes using electricity. #CutYourEnergyCostsDay More at https://t.co/B9wc7A1ghK via @aga_naturalgas https://t.co/DqxUutpT2k",en,Cabot Oil & Gas Corp
Thu Jan 10 13:14:44 +0000 2019,"RT @MarcellusGas: Many of our members take part in #PAFS19, highlighting the important relationship between Pa. agriculture &amp; energy. #natg…",en,Cabot Oil & Gas Corp
Wed Jan 09 18:30:44 +0000 2019,Are you a great organizer and a team player? Learn more about careers in office administration in the oil &amp; #naturalgas industry via @OOGEEP &amp; @powerimpossible for this #WorkforceWednesday https://t.co/zj2O04hVKY https://t.co/vmHDim5atx,en,Cabot Oil & Gas Corp
Wed Jan 09 16:20:09 +0000 2019,"“Having reduced energy costs, thanks to the natural gas production in Pennsylvania, helps lower bills and keeps our farmers farming.” - Chris Herr, Executive Vice President of PennAg Industries Association via @CEAorg #PAFS19 https://t.co/HtaYzJD3ca",en,Cabot Oil & Gas Corp
Wed Jan 09 13:05:15 +0000 2019,#ICYMI: Make sure to listen to the first show of 2019 from @shalegasradio as @WdesRosiers and the legendary Rusty Fender discuss #naturalgas regulation among other news relevant to the industry. Read more here https://t.co/UeyMVud1YZ  https://t.co/WyQxzkgxcR,en,Cabot Oil & Gas Corp
Tue Jan 08 21:36:50 +0000 2019,RT @APIenergy: New on the Blog: Never stronger -- the State of American Energy. API annual event highlights opportunities for US economic g…,en,Cabot Oil & Gas Corp
Tue Jan 08 21:10:44 +0000 2019,Cabot was happy to support the livestock auction at the @FarmShowComplex today! We were excited to bid on &amp; purchase 4 pigs raised by #SusquehannaCounty youth. #PAFS19 https://t.co/A7gliOjF7h,en,Cabot Oil & Gas Corp
Tue Jan 08 14:10:29 +0000 2019,"Dale Howell continues with our #LookingBackMovingForward series, as he talks about his experience working with Cabot as a landowner, royalties, road maintenance, and in this video, the industry's effect on local wildlife &amp; hunting. More here https://t.co/5FBCsPqnG8 https://t.co/ECr4lFvHvw",en,Cabot Oil & Gas Corp
Mon Jan 07 13:01:22 +0000 2019,Winter Safety: Heed the advice from @NSCsafety when it comes to carbon monoxide. “Winter can be a prime time for carbon monoxide poisoning as people turn on their heating systems and mistakenly warm their cars in garages.” https://t.co/kK3zH9yDBj https://t.co/wLOULnmCTr,en,Cabot Oil & Gas Corp
Fri Jan 04 22:57:32 +0000 2019,RT @FeedingPA: Thank you @CabotOG for being such great supporters of our Fill a Glass with Hope program! https://t.co/htuxXnHpKv,en,Cabot Oil & Gas Corp
Fri Jan 04 16:53:06 +0000 2019,Cabot is proud to support @FeedingPA and their Fill a Glass with Hope® program. Join us at today's kickoff event at the PA Farm Show to get your hands on a delicious @padairymens milkshake! Learn more about the program &amp; how to donate here https://t.co/YSeQHJ2m7Z #Shakes4Hope https://t.co/UO1PpWNEHe,en,Cabot Oil & Gas Corp
Fri Jan 04 13:01:30 +0000 2019,"If you haven’t checked out https://t.co/tsEzWKYSmK in a while, you’re missing out! Check out recent posts highlighting philanthropy, industry career opportunities, 2018/19 winter outlook and more. Keep an eye out for more posts and updates in #2019 https://t.co/py3N2vR8QG",en,Cabot Oil & Gas Corp
Fri Jan 04 00:50:16 +0000 2019,RT @FeedingPA: The big day is tomorrow! We hope to see you at our Fill a Glass with Hope® kickoff at the Farm Show! We will be opening the…,en,Cabot Oil & Gas Corp
Thu Jan 03 19:01:30 +0000 2019,#ICYMI: Both Montrose &amp; Elk Lake School districts in #SusquehannaCounty realized significant savings in just two years after switching over to reliable and cost-effective #naturalgas. Read more here https://t.co/dEcPM4rCb4 https://t.co/oLwVM175lQ,en,Cabot Oil & Gas Corp
Thu Jan 03 18:14:20 +0000 2019,"RT @FeedingPA: Shout out to all of our sponsors that generously donated to our Fill a Glass with Hope® program, donating a total of $136,30…",en,Cabot Oil & Gas Corp
Wed Jan 02 18:00:22 +0000 2019,Looking for a career change in 2019? @OOGEEP &amp; @APIenergy teamed up to highlight the 75+ career opportunities available in the oil &amp; #naturalgas industry using an in-depth video campaign. Read more here https://t.co/zj2O04hVKY #WorkforceWednesday https://t.co/8jIa3WHYGO,en,Cabot Oil & Gas Corp
Tue Jan 01 13:40:12 +0000 2019,Welcome 2019! We look forward to helping families and businesses enjoy a prosperous new year thanks to affordable American #energy. https://t.co/iTYJHBEBC2,en,Cabot Oil & Gas Corp
Tue Jan 01 02:35:04 +0000 2019,"Best wishes for a #HappyNewYear filled with health, happiness and abundant opportunities. https://t.co/xCUTunxOAh",en,Cabot Oil & Gas Corp
Fri Dec 28 18:01:40 +0000 2018,"#ICYMI: Diaz Companies generously donated enough hats, gloves, and shoes to outfit students in Montrose, PA as they head into winter. Read more about the endeavor here https://t.co/weza85MDvT https://t.co/PZSiLQV7KW",en,Cabot Oil & Gas Corp
Thu Dec 27 18:35:09 +0000 2018,"In #naturalgas extraction, a Christmas tree, or ""tree"", is an assembly of valves, spools, and fittings used to regulate the flow of pipes in a gas well. https://t.co/eCDJkixvL3",en,Cabot Oil & Gas Corp
Thu Dec 27 17:13:06 +0000 2018,"RT @APIenergy: ""When it comes to using natural gas for electric generation, the fuel is replacing coal. And that is helping to drive down C…",en,Cabot Oil & Gas Corp
Wed Dec 26 16:35:11 +0000 2018,Cindy Beeman talks about growing up in #SusquehannaCounty and describes some of the positive changes she has seen for local farmers since the #naturalgas industry began their operations in the area. #LookingBackMovingForward https://t.co/0exbv5BvrG https://t.co/t5iRkzhgPV,en,Cabot Oil & Gas Corp
Tue Dec 25 14:35:15 +0000 2018,"From all of us here at Cabot, we wish you and yours a very #MerryChristmas. https://t.co/kWvwBuGlCZ",en,Cabot Oil & Gas Corp
Mon Dec 24 22:35:07 +0000 2018,Merry Christmas Eve and to all a good night! https://t.co/tXZqc8mX2D,en,Cabot Oil & Gas Corp
Sun Dec 23 18:20:06 +0000 2018,"Listen to our external affairs director @starkgeorge on yesterday’s @shalegasradio discuss Cabot’s community toy drive, #naturalgas exports, and the importance of infrastructure.
https://t.co/SIiP7V7k8D",en,Cabot Oil & Gas Corp
Sun Dec 23 13:00:50 +0000 2018,Join us in #givingback this holiday season. Read more about Cabot's annual toy drive benefiting @SCPA_Interfaith here https://t.co/Yra6INuTtQ https://t.co/lm694wdkSg,en,Cabot Oil & Gas Corp
Fri Dec 21 15:35:12 +0000 2018,It’s that time of year again - winter has officially arrived. We’ll continue doing our part to keep families warm and businesses powering through the cold these next few months. #FirstDayOfWinter More at https://t.co/utmCwfi0JP https://t.co/fKrIiS3tQ3,en,Cabot Oil & Gas Corp
Thu Dec 20 18:35:11 +0000 2018,"Cabot delivered over $17,000 in toys, clothing, and monetary donations from many generous sponsors to the #SusquehannaCounty &amp; #WyomingCounty Interfaith offices to benefit local families in need this holiday season. Read more here https://t.co/Yra6INuTtQ https://t.co/ygq87uZGcB",en,Cabot Oil & Gas Corp
Wed Dec 19 18:15:11 +0000 2018,"Cindy Beeman explains that the Susquehanna County Interfaith was able to move to a bigger location due, in part to the savings afforded with heat generated from #naturalgas #LookingBackMovingForward https://t.co/0exbv5BvrG https://t.co/NECRkARAay",en,Cabot Oil & Gas Corp
Tue Dec 18 16:00:44 +0000 2018,The holidays are coming up quickly! Join us in #givingback this season. https://t.co/3VjTGPLAF3,en,Cabot Oil & Gas Corp
Mon Dec 17 18:30:09 +0000 2018,"Each year, #naturalgas brings families together to support holiday traditions from fueling your travels to powering your natural gas stove and much more. Read more here https://t.co/hds2wHWj3K https://t.co/1uxmE3FpsR",en,Cabot Oil & Gas Corp
Fri Dec 14 18:45:20 +0000 2018,"#ICYMI: Students from @MariettaCollege hosted the 2nd annual Oil &amp; Gas Technical Expo on Nov. 9, featuring equipment from drill bits to cranes and much more. Learn more about this can’t-miss event at https://t.co/80lb42AAs4 #MCOGTE2018 https://t.co/JPWWTb4w2N",en,Cabot Oil & Gas Corp
Thu Dec 13 15:50:12 +0000 2018,Listen to this past Saturday’s “Shale Gas News” featuring our very own @WdesRosiers. Make sure to tune-in each and every Saturday for @shalegasradio’s weekly updates on the latest #energy news. https://t.co/MJGK9k6SAd,en,Cabot Oil & Gas Corp
Wed Dec 12 20:35:16 +0000 2018,"#NCAA bowl games start this weekend and the #SuperBowl is less than 8 weeks away. You might be surprised to know that oil &amp; #naturalgas helps make many aspects of the game possible. Read more on the topic from @OOGEEP Executive Director, Rhonda Reda, here https://t.co/jFfmT4S5lp https://t.co/gX1pwt4GVY",en,Cabot Oil & Gas Corp
Tue Dec 11 19:00:10 +0000 2018,"#Naturalgas fuels our #economy, and #pipelines are the safest means of delivery. From project planning through construction to operation, pipeline companies consider safety every step of the way. #EnergyLink https://t.co/nnMENYJXOk https://t.co/9WWs2eX8Rv",en,Cabot Oil & Gas Corp
Mon Dec 10 18:45:48 +0000 2018,The holidays are coming up quickly! Join us in #givingback this season by donating to your local charitable organization. Read more about Cabot's partnership with @SCPA_Interfaith here https://t.co/0exbv5BvrG https://t.co/As1TmJ4DUK,en,Cabot Oil & Gas Corp
Mon Dec 10 14:40:14 +0000 2018,As you plan parties and decorate your homes and businesses for the #holidayseason remember some important energy-related safety tips found here https://t.co/S9JADdY8Tm via @UGI_Utilities https://t.co/GPt8OlTQZn,en,Cabot Oil & Gas Corp
Fri Dec 07 18:55:13 +0000 2018,"The #FirstDayofWinter is two weeks out! If you haven’t already, it’s time to get your gas-fueled lawn equipment ready for storage. Whether it’s from @TheToroCompany @HusqvarnaUSA or @HondaPE_USA - a little maintenance goes a long way! 
https://t.co/02SM60qRFb via @CEAorg https://t.co/mKXErSbFDC",en,Cabot Oil & Gas Corp
Thu Dec 06 19:45:19 +0000 2018,"As the cold days continue to roll in, Cabot is proud to be doing our part to make sure that America’s #naturalgas is steadily flowing into towns and neighborhoods to keep you and your family warm this winter. Read more here https://t.co/DeAphWhkoS https://t.co/6fQtaloisN",en,Cabot Oil & Gas Corp
Thu Dec 06 17:31:01 +0000 2018,The Appalachian Basin has its own MOLU for #STEM #education read more here https://t.co/saqNafgQ8P,en,Cabot Oil & Gas Corp
