created_at,full_text,lang,user_name
Wed Dec 18 20:58:56 +0000 2019,"RT @starkgeorge: Proud to host ⁦@AXPC_US⁩ new CEO, Anne Bradbury, on a field visit as part of her onboarding. 
First-hand education is the…",en,Cabot Oil & Gas Corp
Wed Dec 18 20:50:07 +0000 2019,"Welding is one of the most in-demand careers in the #oilandgas industry.  If you're looking for a hands-on career with great pay, a welding job might be for you! #WorkforceWednesday @OOGEEP 

https://t.co/xyZB2xnwVd",en,Cabot Oil & Gas Corp
Wed Dec 18 20:36:15 +0000 2019,@LehighCTI It is a lovely picture featuring some snazzy clothes - purple blazer and bowtie included!,en,Cabot Oil & Gas Corp
Wed Dec 18 20:05:09 +0000 2019,"The 2019 schedule of @Energy_Briefing wrapped up last week in State College and Fogelsville with conversations led by @RepSchweyer @LehighCTI @PennCollege @CBICC @SWN_R2 @glenn_inc @DawoodEngineers
#ThinkAboutEnergy
https://t.co/gQt2JNVIsk",en,Cabot Oil & Gas Corp
Tue Dec 17 14:10:10 +0000 2019,"""The natural gas and oil industry in the US supports 10.3 million jobs and accounts for nearly 8% of the gross domestic product.""  https://t.co/Ko3jaXDfvN?",en,Cabot Oil & Gas Corp
Sun Dec 15 21:25:02 +0000 2019,"PA Representative @peter_schweyer:
""These are real, outstanding careers and we really just want to make sure that Allentown kids &amp; kids throughout Pennsylvania know that they're available to them.""
https://t.co/HTeFiWacSp",en,Cabot Oil & Gas Corp
Sat Dec 14 15:15:15 +0000 2019,"Thanks to Cabot’s $15,000 contribution, students at @ParkwayWestCTC can now purchase the uniforms, certifications, and other supplies they need to succeed in school. More at https://t.co/aJY3ILQLaL",en,Cabot Oil & Gas Corp
Fri Dec 13 14:53:46 +0000 2019,"RT @IERenergy: George Stark, the director of external affairs at @CabotOG, joined the Plugged In podcast to discuss how American natural ga…",en,Cabot Oil & Gas Corp
Thu Dec 12 14:02:18 +0000 2019,RT @SenJohnYudichak: Future engineers and energy engineers will be coming out of the @shine123_abc and @SHINE_Luzerne after school program.…,en,Cabot Oil & Gas Corp
Thu Dec 12 13:40:43 +0000 2019,RT @Energy_Briefing: Getting ready to kick off an exciting #ThinkAboutEnergy briefing in Fogelsville! @CabotOG @PennCollege @LehighCTI http…,en,Cabot Oil & Gas Corp
Wed Dec 11 19:45:14 +0000 2019,Join us tomorrow for another chance to learn about the positive political and industrial implications of America’s natural gas revolution at the Fogelsville @Energy_Briefing. https://t.co/XxMkqUlnOt,en,Cabot Oil & Gas Corp
Wed Dec 11 15:45:16 +0000 2019,Did you know that there is a shortage in CDL truck drivers? Learn more from @OOGEEP and @powerimposslbe #WorkforceWednesday https://t.co/LhrFEtG5CL,en,Cabot Oil & Gas Corp
Tue Dec 10 21:05:12 +0000 2019,Cabot is proud to sponsor the next @Energy_Briefing in Fogelsville on Dec. 12 at Madeline’s. This educational event will feature keynote speaker PA Rep. @peter_schweyer. Register here: https://t.co/XxMkqUlnOt,en,Cabot Oil & Gas Corp
Tue Dec 10 18:30:07 +0000 2019,"Now in its sixth year, the annual collaboration between Cabot and Susquehanna Interfaith (@SCPA_Interfaith) surpassed previous efforts with more than $20,000 in donations.
https://t.co/YElHY5VNab",en,Cabot Oil & Gas Corp
Tue Dec 10 13:34:00 +0000 2019,RT @WdesRosiers: @starkgeorge welcoming the crowd to @Energy_Briefing State College for a discussion on responsible #energy development. @C…,en,Cabot Oil & Gas Corp
Tue Dec 10 13:15:13 +0000 2019,This morning's @Energy_Briefing in State College features keynote speaker @JakeCorman who will discuss emerging opportunities in the natural gas industry. #ThinkAboutEnergy https://t.co/1L47ZfrXou,en,Cabot Oil & Gas Corp
Thu Dec 05 19:35:08 +0000 2019,"Heading out for Pennsylvania's 2019 statewide firearms deer season? Don't forget you can help fight hunger in the Commonwealth by making a donation through the Hunters Sharing the Harvest (@ShareDeerPA) program. #ShareDeer

https://t.co/UdwSP09btL",en,Cabot Oil & Gas Corp
Tue Dec 03 16:50:09 +0000 2019,The Dennis Farm Charitable Land Trust is working to raise $1.2 million from its community to restore its farmhouse into a museum. Make your donation today in honor of #GivingTuesday https://t.co/JVQNAUULP2 https://t.co/1c6OyQ8aRA,en,Cabot Oil & Gas Corp
Tue Dec 03 14:05:11 +0000 2019,"Today is #GivingTuesday, a worldwide event for true generosity. We are pleased to spotlight one of our partners - @CommunityFDN which assists with over 100 different funds, endowments, grants, and scholarships throughout the community https://t.co/lRXlKxbkKo",en,Cabot Oil & Gas Corp
Sun Dec 01 22:35:04 +0000 2019,"While renewable energy resources are growing as part of our electric supply, weather conditions may prevent them from working to their full capability. Natural gas is a great companion to renewables like wind and solar.

https://t.co/rma018aKkG",en,Cabot Oil & Gas Corp
Fri Nov 29 17:25:08 +0000 2019,"Cabot's partnership with Susquehanna County Career and Tech has helped students pursue lifetime careers across many industries. #FilmFriday #NationalScholarshipMonth

https://t.co/3WJpwyM2uL",en,Cabot Oil & Gas Corp
Thu Nov 28 20:40:07 +0000 2019,"This Thanksgiving, Cabot is proud to have helped bring dinners to Susquehanna County households in need at the Feed-a-Friend Food Drive. https://t.co/x3Rp3c4aHz",en,Cabot Oil & Gas Corp
Wed Nov 27 17:54:35 +0000 2019,RT @IERenergy: On the latest episode of the Plugged In podcast @WdesRosiers of at @CabotOG joined the show to talk about how the shale revo…,en,Cabot Oil & Gas Corp
Wed Nov 27 16:05:11 +0000 2019,"Since 2010, Cabot has committed more than $1.7 million to education in Susquehanna County through approximately 1,300 scholarships. #NationalScholarshipMonth https://t.co/zFZHeVWRRz",en,Cabot Oil & Gas Corp
Wed Nov 27 14:00:25 +0000 2019,"Are you good with writing, speaking, and creating meaningful professional relationships? If so, a career in Communications could be for you. See how these types of careers are important in the oil and gas industry. #WorkforceWednesday @OOGEEP 

https://t.co/B9nithzzoi",en,Cabot Oil & Gas Corp
Tue Nov 26 16:05:16 +0000 2019,"As the temperature continues to drop, many are reaching for their thermostats.  Natural gas is the leading method of home heating, but let's take a look at all the other ways natural gas is helping us this winter via @APIenergy https://t.co/k1I7MbqU8G",en,Cabot Oil & Gas Corp
Mon Nov 25 19:20:07 +0000 2019,.@EIAgov Reports the United States saw record highs of increased natural gas production in 2018. Pennsylvania showed largest year-over-year increase of 2 billion cubic feet per day via @TribLIVE https://t.co/QfXXDkOBun,en,Cabot Oil & Gas Corp
Mon Nov 25 14:10:09 +0000 2019,"“Cabot’s large donation will enable Trehab to stabilize this community effort to serve those who are in need of food for this year and years to come.” - Edlyn Flannery, Trehab Administrator  https://t.co/x3Rp3c4aHz",en,Cabot Oil & Gas Corp
Fri Nov 22 16:35:09 +0000 2019,Cabot is proud to have helped sponsor the new medical center for Endless Mountains Healthcare System. #FilmFriday #powerofrural https://t.co/cJxmONeQGa,en,Cabot Oil & Gas Corp
Thu Nov 21 19:05:14 +0000 2019,"Do you know how many of your everyday items are made using oil and natural gas? Window frames, thermal insulations, and exterior paints are just a few as shown by this graphic by @IOGP_News https://t.co/h8EeSyLzjV",en,Cabot Oil & Gas Corp
Thu Nov 21 15:10:07 +0000 2019,"We are pleased to spotlight our partnership with the Endless Mountains Health Systems hospital in Montrose, Pennsylvania and look at how rural communities have unique healthcare needs https://t.co/OOPCH3sehN #powerofrural",en,Cabot Oil & Gas Corp
Wed Nov 20 14:25:07 +0000 2019,"Careers in #oilandgas stretch far and wide. This week on #WorkforceWednesday, @OOGEEP and @powerimpossible explain what a career in Human Resources in our industry is like https://t.co/rsOWy13Cd5",en,Cabot Oil & Gas Corp
Tue Nov 19 15:40:08 +0000 2019,"Natural gas pipelines are the most efficient, reliable, and safest way to move gas. https://t.co/XiBKKq6n34",en,Cabot Oil & Gas Corp
Mon Nov 18 18:25:05 +0000 2019,"In northeastern PA, one in five children are not getting enough to eat. Cabot’s work with @CEOWeinbergFB strives to improve the lives of those in need and end hunger in NEPA. Learn more at https://t.co/txKlyCAxZm",en,Cabot Oil & Gas Corp
Fri Nov 15 18:20:07 +0000 2019,Today we are celebrating National Recycling Day. Learn more about our work with @ComtechInd and Fluid Recovery Services to recycle nearly 100% of our wastewater: https://t.co/KcZ2NXQ3N9,en,Cabot Oil & Gas Corp
Wed Nov 13 21:28:23 +0000 2019,"Well tenders are responsible for making sure oil and gas wells are operating safely and efficiently in the field, and is one of the many possible career options in our industry. Check out this video from @OOGEEP #WorkforceWednesday https://t.co/GlnNJQmM8z",en,Cabot Oil & Gas Corp
Mon Nov 11 20:40:06 +0000 2019,"According to @SenJohnYudichak, natural gas is an important part of the road to clean energy: https://t.co/SFcwBBFTay",en,Cabot Oil & Gas Corp
Mon Nov 11 18:55:04 +0000 2019,"In honor of Veterans Day, we're working with @veterans_voices to celebrate the story of a Buffalo Soldier. Find the full story at https://t.co/m0OCFqN485",en,Cabot Oil & Gas Corp
Fri Nov 08 19:25:05 +0000 2019,"Today we celebrate #NationalSTEMDay and the importance of highlighting job opportunities around science, technology, engineering &amp; mathematics https://t.co/UjLQqZy2aa",en,Cabot Oil & Gas Corp
Wed Nov 06 19:35:04 +0000 2019,".@SenJohnYudichak highlights the positive impacts that natural gas has on our nation. “Recognizing the value of clean, low-cost and reliable natural gas will help pave the way for a clean, low-carbon future in the years ahead.” Read more: https://t.co/SFcwBBFTay",en,Cabot Oil & Gas Corp
Tue Nov 05 21:55:18 +0000 2019,It’s #ElectionDay - and there's still time to vote! “Nobody will ever deprive the American people of the right to vote except the American people themselves and the only way they could do this is by not voting.” - Franklin D. Roosevelt https://t.co/chpduBs1fW,en,Cabot Oil & Gas Corp
Fri Nov 01 18:00:24 +0000 2019,"Welcome November! For our #NEPA friends, check out what's on the horizon this month via the team at @DiscoverNEPA https://t.co/2ItuJ72ens And remember: Daylight Saving Time ends this Sunday, Nov. 3, which means clocks turn back one hour at 2 a.m. https://t.co/5iRBYRpfAW",en,Cabot Oil & Gas Corp
Thu Oct 31 13:45:10 +0000 2019,"Wishing all our followers, families, colleagues and friends in the communities where we live and work a safe and fun #Halloween🎃! And for those families that heat with #naturalgas, we’re pleased to help warm you up after a brisk/damp night of trick-or-treating. https://t.co/5YBnsCWiv9",en,Cabot Oil & Gas Corp
Wed Oct 30 20:19:27 +0000 2019,"From costumes to decorations, #naturalgas, oil and petrochemicals are essential to a #HappyHalloween🎃. https://t.co/UQhBU8qIpa",en,Cabot Oil & Gas Corp
Wed Oct 30 15:39:31 +0000 2019,Do you like to work with your hands while using complex equipment? A career as a mechanical technician in the #naturalgas industry could be the job for you! @OOGEEP @powerimpossible https://t.co/zj2O04hVKY #WorkforceWednesday https://t.co/3eHE1hungV,en,Cabot Oil & Gas Corp
Wed Oct 30 12:00:35 +0000 2019,We’re pleased to support West Side Career and Technology Center and help prepare our next generation for “opportunities that are truly transformational.” #EITC #Jobs - Read more at https://t.co/Icu0NoGC5U https://t.co/KL9ULDIKMV,en,Cabot Oil & Gas Corp
Tue Oct 29 19:00:28 +0000 2019,"“Well said” @ChamberPHL President &amp; CEO Rob Wonderling: ""Projects, like @PennEast, are essential to continue facilitating the development of energy-intensive #manufacturing in the greater #Philadelphia region.” https://t.co/aTXp6xhEva https://t.co/8FVOaCLGB0",en,Cabot Oil & Gas Corp
Mon Oct 28 17:30:08 +0000 2019,"Pennsylvania friends, tomorrow (Tuesday, Oct. 29) is the deadline to submit your absentee ballot application for next Tuesday’s election. Apply online at https://t.co/s41PQPhNmH #yourvotematters https://t.co/VZmt9mD1x9",en,Cabot Oil & Gas Corp
Mon Oct 28 16:15:14 +0000 2019,"This #NationalFirstRespondersDay, we thank the brave men and women who make great sacrifices every day to protect and serve our communities. More at https://t.co/I8WNtwTNc6 https://t.co/TJPKK9Tx3b",en,Cabot Oil & Gas Corp
Sat Oct 26 15:45:18 +0000 2019,"It’s College GameDay🏈! Each year the technology surrounding #football gets better and better. Improvements to equipment make the game safer, thanks in part, to oil and #naturalgas. #EnergyAwarenessMonth https://t.co/xpYSAqjYWd. https://t.co/6Jnr7tjCb6",en,Cabot Oil & Gas Corp
Fri Oct 25 17:45:06 +0000 2019,"Generating #electricity requires an energy source and #naturalgas is a clean, reliable and affordable source. Learn more at: https://t.co/oUoddCWhlz #EnergyAwarenessMonth https://t.co/ibiv1HfXsy",en,Cabot Oil & Gas Corp
Wed Oct 23 16:00:31 +0000 2019,"If the idea of working outside sounds exciting, then a career in production operations in the #naturalgas industry may be right for you! @OOGEEP @powerimpossible https://t.co/zj2O04hVKY #WorkforceWednesday #jobs https://t.co/0KJBX7iTAr",en,Cabot Oil & Gas Corp
Tue Oct 22 22:20:06 +0000 2019,"“Since its inception over 10 year ago, GDS has grown exponentially, supplying job opportunities to hundreds of local people.” -- Phil Stalnaker, Cabot Oil &amp; Gas Corporation’s North Region VP. Read more at https://t.co/qTbxwLBWpw https://t.co/XWP2qcHIFM",en,Cabot Oil & Gas Corp
Mon Oct 21 20:37:18 +0000 2019,Please watch this week's @PAManufacturers Perspective highlighting the unprecedented growth in #Pennsylvania #naturalgas production and the resulting economic and environmental benefits being realized in the Commonwealth and across the country. https://t.co/u2edvZ6s6s,en,Cabot Oil & Gas Corp
Tue Oct 15 12:25:13 +0000 2019,"Did you know that 35% of electricity in the United States is produced using #naturalgas? For #EnergyAwarenessMonth, we explain how natural gas is turned into the energy each and every American uses every day in the video below. #TriviaTuesday https://t.co/9t2bhQzpqX",en,Cabot Oil & Gas Corp
Mon Oct 14 14:25:06 +0000 2019,"#ICYMI: At an Oct. 2 @Energy_Briefing sponsored by the Greater Hazleton Chamber of Commerce, business leaders and elected officials were abuzz about the next phase of Pennsylvania’s #naturalgas boom and how they can benefit from it. #ThinkAboutEnergy https://t.co/UQtiOYRM3y https://t.co/lZRy82oANN",en,Cabot Oil & Gas Corp
Mon Oct 14 13:38:12 +0000 2019,"#ICYMI: The Dennis Farm announced a campaign to raise $1.2 million to unlock a $400,000 grant offered by the National Endowment for the Humanities during their Seventh Annual Symposium at Keystone College on Oct. 10. https://t.co/iiDyzbA2De https://t.co/SLv2hFfq8J",en,Cabot Oil & Gas Corp
Mon Oct 14 12:25:09 +0000 2019,"Cabot and GDS are committed to minimizing our environmental impact. #DidYouKnow: GDS recycles 100% of its fleet’s used engine oil -- totalling roughly 8,000 gallons of oil in 2018. https://t.co/6DjWzKMHxA",en,Cabot Oil & Gas Corp
Sat Oct 12 14:20:09 +0000 2019,"Thank you to America’s farmers! We’re pleased to work so many farming families, like the Clarks in Susquehanna County https://t.co/1zPq70HB33 #NationalFarmersDay https://t.co/aXKg44Re46",en,Cabot Oil & Gas Corp
Fri Oct 11 15:30:00 +0000 2019,"#ICYMI: Have you seen the 'Cabot is..."" commercial on @wbrewyou yet? If not, check it out below #FilmFriday https://t.co/AU2JXHrkZR",en,Cabot Oil & Gas Corp
Fri Oct 11 13:20:04 +0000 2019,"On Sept. 20 at the Wyoming County Emergency Operations Center (EOC), Commissioners from three northeast PA counties gathered with state representatives and the president of the @MarcellusGas to tout the effectiveness of #Act13 #FilmFriday https://t.co/vDXYfNRLA6 https://t.co/ACxrWin867",en,Cabot Oil & Gas Corp
Thu Oct 10 17:00:33 +0000 2019,#ICYMI: GDS operations manager Chad Gorman explained at the GDS Open House on Sept. 25th that they need 30 more CDL drivers and maintenance personnel by the end of the year. Read more about the open house https://t.co/qrRgn9OcD8 and at https://t.co/ieDFq6slzC https://t.co/qzy8iTn3TB,en,Cabot Oil & Gas Corp
Thu Oct 10 16:59:32 +0000 2019,"RT @starkgeorge: So Honored &amp; Proud to represent @CabotOG at this year’s 7th Annual Dennis Farm Symposium. 
Historic Treasure right here in…",en,Cabot Oil & Gas Corp
Thu Oct 10 14:20:15 +0000 2019,"#FirePreventionWeek continues: add testing your smoke alarms to your upcoming weekend to-do list. Smoke alarms should be in every bedroom, outside of each sleeping area and on every level of your home, including the basement. @NFPA https://t.co/Wf2R0TmLDE",en,Cabot Oil & Gas Corp
Wed Oct 09 14:50:53 +0000 2019,"#ICYMI: Cabot donated $15,000 towards scholarships for @LehighCTI students who need help covering the cost of uniforms and supplies for their career and technical #education programs. More at https://t.co/KECqV5tQjl https://t.co/JYDlAuoLc1",en,Cabot Oil & Gas Corp
Wed Oct 09 13:08:44 +0000 2019,"RT @LehighCTI: Thanks to the support of @CabotOG LCTI students who need help paying for required uniforms, tools and other materials can ap…",en,Cabot Oil & Gas Corp
Tue Oct 08 19:25:07 +0000 2019,The Dennis Farm has been a valued partner at Cabot for several years &amp; we are pleased to attend the Seventh Annual Dennis Farm Symposium this Thursday at @KeystoneCollege Take the time to read about the Dennis Farm &amp; its historical importance on our blog: https://t.co/OgMCIW4fUJ https://t.co/RVtWFjDfe4,en,Cabot Oil & Gas Corp
Tue Oct 08 17:20:15 +0000 2019,"Born &amp; raised in Susquehanna County, Shealynn Shave, NTIEC exec. director, has seen businesses come to the community and invest. She remembers a time when they were leaving, though, and the arrival of the #naturalgas industry helped turn it around. https://t.co/yQSAlSq55a https://t.co/4hnftfW6sO",en,Cabot Oil & Gas Corp
Tue Oct 08 16:00:49 +0000 2019,"“Welding requires a very high level of skill and the fact that they have an unlimited amount of pipe allows them to practice nonstop,” Inglaglio explained when asked about Cabot’s pipe donation and its benefits to SCCTC students. #LookingBackMovingForward https://t.co/MZLHf8x07u https://t.co/2hkmO5j04O",en,Cabot Oil & Gas Corp
Tue Oct 08 14:20:18 +0000 2019,"It’s #NationalPizzaMonth -- made hot and delicious by #naturalgas. #NEPA friends, check out @DiscoverNEPA’s pizza info &amp; deals https://t.co/4cPp1lmQxf and the “NePizzA Festival” this Saturday https://t.co/oU8Sw9RFO1 https://t.co/OC3lEwJsxm",en,Cabot Oil & Gas Corp
Mon Oct 07 17:20:13 +0000 2019,Yesterday kicked off Public Natural Gas Week #pngw. We thank the 700+ @APGA members for helping countless communities enjoy the environmental and economic benefits of abundant #naturalgas. https://t.co/jZp87mcxMh,en,Cabot Oil & Gas Corp
Mon Oct 07 16:07:35 +0000 2019,"RT @Energy_Briefing: For the new @PAManufacturers PMA Perspective, Carl A. Marrara heads to the Pennsylvania Capitol to cover the recent #E…",en,Cabot Oil & Gas Corp
Mon Oct 07 15:20:05 +0000 2019,"It’s Fire Prevention Week. “In a typical home fire, you may have as little as one to two minutes to escape safely from the time the smoke alarm sounds” - @NFPA. Take a minute to watch the video below to help you plan your home fire escape. https://t.co/U0Ur336KKX",en,Cabot Oil & Gas Corp
Mon Oct 07 13:20:14 +0000 2019,"October means football, pumpkin foods and drinks, #Halloween, and many other fun seasonal changes. While we’re excited for all things autumn, Cabot is welcoming October to celebrate #EnergyAwarenessMonth! Get some helpful energy saving tips here: https://t.co/V8jvbBW7Cf https://t.co/vJN41fn6dZ",en,Cabot Oil & Gas Corp
Sat Oct 05 12:20:08 +0000 2019,Thank you teachers!! This #WorldTeachersDay we offer our most sincere gratitude to all educators. https://t.co/VifNdZaKN4,en,Cabot Oil & Gas Corp
Fri Oct 04 15:44:07 +0000 2019,"#ICYMI: Students &amp; administrators from the @LCMarcellusPNG hosted over 150 shooters for the annual Sporting Clay Tournament at Houseman’s Hidden Hollow sporting club near Friendsville, PA on Sept. 26. https://t.co/iSDsXwtvBE",en,Cabot Oil & Gas Corp
Fri Oct 04 13:20:16 +0000 2019,"It’s #MFGDay! We’re pleased to support America’s manufacturers today and all year long by providing an affordable and reliable supply of #naturalgas -- helping U.S. manufacturers lower costs, create jobs and grow our economy! #FilmFriday @PAManufacturers https://t.co/QXzEFkv5Oq https://t.co/tOQ29Q6SeP",en,Cabot Oil & Gas Corp
Thu Oct 03 18:20:26 +0000 2019,"Ingaglio cited Cabot’s donation of four tractor-trailer loads of pipe as one example of their partnership. “Most high school-level welding programs do not offer pipe welding due to the expensive materials,” he stated. #LookingBackMovingForward https://t.co/MZLHf8x07u https://t.co/JxHLjdUycY",en,Cabot Oil & Gas Corp
Thu Oct 03 14:20:11 +0000 2019,"Cabot, @PAManufacturers, the Northeast PA Manufacturers &amp; Employers Association and the Greater Hazleton Chamber of Commerce hosted a #ThinkAboutEnergy Briefing yesterday featuring keynote speaker @RepTurzai https://t.co/EHefRoutMy",en,Cabot Oil & Gas Corp
Thu Oct 03 12:20:10 +0000 2019,"Tomorrow is Manufacturing Day! For our #Pennsylvania friends (especially students), check out the more than 100 events scheduled across the Commonwealth tomorrow and all month long in celebration of #MFGDay @PAManufacturers #STEM https://t.co/wyoKWRwthm https://t.co/xqA3SJOwmF",en,Cabot Oil & Gas Corp
Wed Oct 02 18:15:42 +0000 2019,RT @RepTurzai: Increases in natural gas use &amp; production help America maintain global leadership in emission reductions and in growth of re…,en,Cabot Oil & Gas Corp
Wed Oct 02 17:20:12 +0000 2019,"#ICYMI: GasSearch Drilling Services (GDS) held a ceremonial ribbon cutting for their new maintenance facility in Lenox Twp., PA last Wednesday. Read more about the event from The Citizens’ Voice: https://t.co/t6ZnfxeEn2 https://t.co/arOlEye2Zw",en,Cabot Oil & Gas Corp
Wed Oct 02 17:03:34 +0000 2019,RT @Energy_Briefing: @hazletonchamber @PAManufacturers @RepToohil @starkgeorge @CabotOG @RepTurzai Thanks to @RepTurzai for attending today…,en,Cabot Oil & Gas Corp
Wed Oct 02 16:20:08 +0000 2019,"Today, as we #ThinkAboutEnergy in Sugarloaf, Pa., we encourage families and businesses to also think about #energyefficiency this #EEDay2019. Simple steps like weatherization and turning off the lights saves money and resources. https://t.co/G5NzdXRG2W",en,Cabot Oil & Gas Corp
Wed Oct 02 14:11:00 +0000 2019,"This morning, we are pleased to join @PAManufacturers @hazletonchamber and #PAHouse Speaker @RepTurzai along with @RepToohil Rep. Aaron Kaufer, and Tom Gellrich of Topline Analytics for the latest #ThinkAboutEnergy Briefing in Sugarloaf, PA. https://t.co/ZeLEVBon69 https://t.co/za2GNTdHiy",en,Cabot Oil & Gas Corp
Wed Oct 02 00:45:35 +0000 2019,"RT @MarcellusGas: New natural gas power plant in northeastern Pa. generates reliable, affordable electricity for 900k homes. 🏠💡🔌

“Our plan…",en,Cabot Oil & Gas Corp
Tue Oct 01 20:32:25 +0000 2019,"RT @EnergyEdFund: We are excited to be at the the Williamsport/Lycoming Chamber of Commerce in Williamsport, PA from 5:00 - 6:30 pm tonight…",en,Cabot Oil & Gas Corp
Tue Oct 01 17:15:05 +0000 2019,"Ray Ingaglio, chief welding instructor at Susq. County Career &amp; Technology Center, had left teaching &amp; started his own business. When the #naturalgas industry came to town and required skilled workers, he came back to teach them. #LookingBackMovingForward https://t.co/hIQnNLZriR https://t.co/nVX75sSsic",en,Cabot Oil & Gas Corp
Mon Sep 30 22:09:51 +0000 2019,"RT @MarcellusGas: Thanks to revenues from the #natgas impact tax, ""we are doing things in our county that we never could before,” Susquehan…",en,Cabot Oil & Gas Corp
Mon Sep 30 19:33:32 +0000 2019,"RT @EnergyEdFund: The #MOLU will be at another happy hour event tomorrow at the Williamsport/Lycoming Chamber of Commerce in Williamsport,…",en,Cabot Oil & Gas Corp
Mon Sep 30 18:06:29 +0000 2019,"RT @Energy_Briefing: ""We will continue to produce #naturalgas, the pipeline will get it to market, but the market should be here in #Pennsy…",en,Cabot Oil & Gas Corp
Mon Sep 30 17:47:18 +0000 2019,@PAManufacturers @hazletonchamber @RepTurzai @RepToohil @PennEast Learn more about the Oct. 2 #ThinkAboutEnergy Briefing in Hazleton on the website: https://t.co/ZeLEVBon69,en,Cabot Oil & Gas Corp
Mon Sep 30 17:46:33 +0000 2019,"@PAManufacturers @hazletonchamber @RepTurzai @RepToohil The last time the #ThinkAboutEnergy Briefing was in Hazleton, in April 2016, Allen Coleman of UGI Energy Services discussed value of the @PennEast pipeline, infrastructure development, lower #energy prices and reliability. https://t.co/0pPyPMmBCR",en,Cabot Oil & Gas Corp
Mon Sep 30 17:38:03 +0000 2019,"Join us, the @PAManufacturers &amp; the @hazletonchamber to welcome #PAHouse Speaker @RepTurzai along with @RepToohil Rep. Aaron Kaufer, and Tom Gellrich of Topline Analytics for the #ThinkAboutEnergy Briefing THIS Wednesday, October 2nd https://t.co/Bsp5QZAoTI",en,Cabot Oil & Gas Corp
Fri Sep 27 18:05:11 +0000 2019,"The United States is expected to account for more than half of the global #naturalgas supply growth through 2035, McKinsey &amp; Company said in a new report. https://t.co/VyQJFEBxuG",en,Cabot Oil & Gas Corp
Fri Sep 27 17:07:01 +0000 2019,“The most important thing you can do as a community member is to register to vote and take that opportunity when you have it to make your voice heard.”,en,Cabot Oil & Gas Corp
