created_at,full_text,lang,user_name
Thu Dec 19 16:34:27 +0000 2019,"@DukeRealty associates took their development &amp; construction skills to a whole new level in our recent gingerbread house competition. Now that we've wowed you with our capabilities, let us build a warehouse for your company! #chicago #stlouis #indianapolis #southflorida https://t.co/f8rPLLgB3n",en,Duke Realty
Thu Dec 19 14:47:27 +0000 2019,"@DukeRealty appreciates our subcontractors! To show our thanks, our PA/NJ team hosted a special lunch for everyone working on a 2-building, 1.2 million-square-foot project for one of our valued tenants in New Jersey. https://t.co/XsGxpMG8o7",en,Duke Realty
Wed Dec 18 16:56:12 +0000 2019,RT @mbalexan: Huge thank you to @DukeRealty and @JLLNashville for the @patagonia fleece. It came in handy for an extra cold industrial tour…,en,Duke Realty
Tue Dec 17 13:50:51 +0000 2019,"What are users in Northern California looking for? Chris Burns, EVP of @DukeRealty Western and Central Regions along with other panelists at Bisnow’s Northern California Industrial and Logistics Summit, pointed to ample parking as a top priority. https://t.co/qTLbiTaHQQ",en,Duke Realty
Mon Dec 16 22:23:14 +0000 2019,"St. Joseph University held its annual Real Estate &amp; Construction Christmas Luncheon. The successful event was co-chaired by alumna Cait English, who is now an @DukeRealty Leasing Representative in PA and NJ. https://t.co/ilN3jBDEaQ",en,Duke Realty
Fri Dec 13 15:42:52 +0000 2019,Thanks @miamiwarehousebroker for using your charity gift card from @DukeRealty to make a donation to a cause that’s important to you. #share #happyholidays #givingback https://t.co/EGGgxEHaQh,en,Duke Realty
Thu Dec 12 16:28:35 +0000 2019,"Branded! @DukeRealty logo is now at the top of our new HQ building, identifying it as the official home of our company. Moving into our new digs in early February 2020. #excited #8711RiverCrossingBlvd https://t.co/cymnFOsVpy",en,Duke Realty
Tue Dec 10 20:57:26 +0000 2019,A longtime @DukeRealty tradition continues! We're wishing everyone Happy Holidays by placing a Christmas tree at the top of our new headquarters which we’ll be moving into in February 2020. #newbuilding #holiday https://t.co/k2FmcP6vpR,en,Duke Realty
Mon Dec 09 18:44:52 +0000 2019,"Outstanding! The @DukeRealty Chicago property management team proudly accepted the Outstanding Building of the Year award from BOMA Suburban Chicago for Butterfield 4000, a 242,700 SF building in Aurora. #industrial #propertymanagement https://t.co/y5K7WlkTOx",en,Duke Realty
Mon Dec 09 14:34:27 +0000 2019,’Tis the season for volunteering! @DukeRealty associates around the country are helping make the holidays merrier for people in their communities. #Indianapolis #Pennsylvania #DC #Houston #SalvationArmy #foodpantries #HabitatforHumanity https://t.co/wG2dzPjlPR,en,Duke Realty
Wed Dec 04 20:52:42 +0000 2019,Food is a universal language &amp; a great way to understand different cultures. Our @DukeRealty Atlanta team used our Cultural Appreciation Day to familiarize themselves with Japanese culture and learn about preparing and enjoying sushi. #diversity #inclusion https://t.co/zVaaqV6hlO,en,Duke Realty
Wed Dec 04 18:02:49 +0000 2019,Almost ready to hang! @DukeRealty logo will soon adorn the top of our nearly complete new corporate headquarters at 8711 River Crossing Blvd. in Indianapolis. Excited to be in our new home in early February 2020. https://t.co/czqxqIwZex,en,Duke Realty
Wed Dec 04 13:09:44 +0000 2019,"RT @NAIOP_MN: .@DukeRealty has supported @NAIOP_MN as a chapter sponsor for the last 17 years. We thank you for your involvement, loyalty a…",en,Duke Realty
Mon Dec 02 18:55:11 +0000 2019,"Now underway! @DukeRealty new, 165,921 SF warehouse in Garner, NC. Located at the I-40/Highway 70 xchange, Greenfield North 1201 is within minutes of downtown Raleigh, RDU Intl Airport &amp; the I-440 Beltline. Read more at https://t.co/Baklyzsntx https://t.co/IPzv8BTq0K",en,Duke Realty
Tue Nov 26 12:09:51 +0000 2019,"We’re having terrific discussions about diversity in the workforce at our @DukeRealty #Women's Network “Podcasts and Pastries” morning get-togethers in our offices. Listening, learning and sharing are sweet! https://t.co/d4omGKFaoq",en,Duke Realty
Mon Nov 25 13:30:46 +0000 2019,Congratulations to our Pennsylvania office for being named the second best place to work among large-sized companies in the state. @DukeRealty continues to set the bar for creating a culture where associates thrive and enjoy their work.,en,Duke Realty
Fri Nov 22 14:13:45 +0000 2019,Thanks for the recognition. Being a great place to work is something for strive for every day. https://t.co/q1BwlqJ4mF,en,Duke Realty
Thu Nov 21 15:18:55 +0000 2019,"We’re just a few months away from moving into our new corporate headquarters, and things are really coming together. Thanks to @whalinsky23 for this drone footage of @DukeRealty soon-to-be new home at 8711 River Crossing Boulevard in Indianapolis, IN. https://t.co/VnoQNY2eOP",en,Duke Realty
Thu Nov 21 14:01:07 +0000 2019,"@DukeRealty Natalie Tyler Martin shares her insights on freight traffic in Aerotropolis, a neighborhood she knows well. https://t.co/7Yb7L0rPsP",en,Duke Realty
Thu Nov 21 13:28:29 +0000 2019,"Infrastructure’s impact on warehouse efficiency was one of the topics @DukeRealty Scott Henderson, VP of Leasing &amp; Development in Pennsylvania, discussed during Bisnow's Philadelphia Industrial and Logistics Summit. https://t.co/7fsFaSN1xz #industrial #scotthenderson https://t.co/XJEolDwobw",en,Duke Realty
Wed Nov 20 12:24:21 +0000 2019,"Investment analysts had the chance to learn more about @DukeRealty and its Southern California assets during a property tour, including an inside-the-building look at one of our valued tenant's operations, before the start of REITWorld. #industrial #SouthernCalifornia #investors https://t.co/6asZ0E2R4i",en,Duke Realty
Tue Nov 19 11:35:44 +0000 2019,We’re serious about sustainability! Our recently issued $400 million ‘green bond’ will be used to finance or refinance @DukeRealty ‘Eligible Green’ projects.”  https://t.co/nz2VhrAY6R #sustainability #corporateresponsibility #ethical,en,Duke Realty
Mon Nov 18 13:22:20 +0000 2019,Our long-term commitment &amp; effective workplace policies and programs have earned @DukeRealty &amp; our CEO Jim Connor Nareit’s Gold Corporate and Individual Dividends Through Diversity &amp; Inclusion Awards. #JimConnor #HealthpeakProperties #CamdenPropertyTrust #diversity #inclusion https://t.co/vNeeoWSMcw,en,Duke Realty
Fri Nov 15 12:46:26 +0000 2019,"Retention of labor is putting amenities at the forefront of requirements by industrial users per Chris Brown, @DukeRealty SVP, Southeast Region, during Bisnow’s Southeast Logistics &amp; Industrial Summit. #ChrisBrown  #industrial #RealEstate https://t.co/UBtFjm2Xv9",en,Duke Realty
Thu Nov 14 13:03:43 +0000 2019,"Nothing like learning about industrial real estate from someone who’s in the business. Students in the 2019 Fall Project REAP class in Dallas benefited from listening to Jeff Thornton, @DukeRealty’s SVP managing our Texas operations. #jeffthornton https://t.co/S5NMMjQqZ4",en,Duke Realty
Mon Nov 11 20:08:47 +0000 2019,"Thanks to @DukeRealty DREAM scholarships, Chase Morris &amp; Drakia Wilkins earned MBAs from the Marshall Bennett Institute of Real Estate at Roosevelt Univ. &amp; landed their dream jobs as Project Developer for Mercy Housing Lakefront &amp; Associate Development Manager with LendLease. https://t.co/8XDpYOboHV",en,Duke Realty
Mon Nov 11 18:17:03 +0000 2019,"Things are happening for @DukeRealty in SoCal! Prelease of 1.0M SF facility &amp; start of another building in Perris plus tour of our IE West, San Gabriel Valley &amp; Mid-Counties submarket properties for analysts in town for REITWorld. https://t.co/k9N3y0QJd7 https://t.co/DzxNOejDYF",en,Duke Realty
Mon Nov 11 16:15:45 +0000 2019,Hear @DukeRealty Southeast Region SVP Chris Brown’s thoughts on what the future holds for industrial real estate in the market during Bisnow’s Industrial SE Investment and Logistics Summit tomorrow. https://t.co/vHmgptU1Wm https://t.co/ByutAZobFi,en,Duke Realty
Fri Nov 08 21:14:39 +0000 2019,"RT @REjournals: @DukeRealty's 154,000-SF spec warehouse in O’Hare submarket nearing completion 

https://t.co/n0T7MqHgWM https://t.co/qmjva…",en,Duke Realty
Thu Nov 07 21:50:34 +0000 2019,Always happy to help in our communities. https://t.co/zgEOc9TygE,en,Duke Realty
Fri Nov 01 17:37:12 +0000 2019,"Michael Chukwueke, VP of Acquisitions &amp; Development for @DukeRealty, participated on an industrial investment market panel during Lee &amp; Associates Broker Summit, sharing his thoughts on pricing, cap rates and future activity. https://t.co/J0pOj53iqn",en,Duke Realty
Thu Oct 31 14:25:34 +0000 2019,Learn about @DukeRealty’s 3rd quarter performance in our earnings release. Then plan to listen to our call today at 3:00 PM ET. https://t.co/fK3CidDFl8,en,Duke Realty
Tue Oct 29 13:31:42 +0000 2019,Third quarter operating results for @DukeRealty are coming up. Watch for our earnings release on 10/30 after market close and then listen to our call on 10/31 at 3:00 PM ET.,en,Duke Realty
Mon Oct 28 15:26:55 +0000 2019,"@DukeRealty’s construction site in Perris, CA is ‘golden’ when it comes to safety as evidenced by the Golden Gate Safety Award we received from the California OSHA Consultative Service Branch. Currently only 90 sites in California have attained this prestigious honor. https://t.co/UYPPg1EQiM",en,Duke Realty
Mon Oct 28 13:51:59 +0000 2019,"What’s driving industrial development in New Jersey? Sam O’Briant, EVP for @DukeRealty’s East Region, shared his thoughts during a discussion panel at Bisnow’s NJ Industrial Summit last week. https://t.co/KrwDLoKhoU",en,Duke Realty
Mon Oct 28 13:34:42 +0000 2019,It’s all about the fit! @DukeRealty’s Chicago team hosted a broker open house at 1835 W. Jefferson to show how the building can fit many of their customers’ needs and invited them try on &amp; select a perfectly fitting jacket in appreciation for their time and support. https://t.co/TdG3TN3TsW,en,Duke Realty
Mon Oct 28 12:00:32 +0000 2019,RT @MaryJoReed1: Grateful to work for @DukeRealty who recognizes and commits resources to give back to the community! #habitatforhumanity #…,en,Duke Realty
Fri Oct 25 12:30:04 +0000 2019,@DukeRealty is glad Cait heeded this advice and joined our team! https://t.co/xBrWKN0bux,en,Duke Realty
Wed Oct 23 13:49:49 +0000 2019,"Congrats to Josh Budish, @DukeRealty VP of Leasing &amp; Development, for making it into the Minnesota 500 for the 2nd consecutive year, a recognition given to the 500 most powerful and influential leaders in Minnesota across more than 60 industries. https://t.co/AVyhJ0W3eP",en,Duke Realty
Tue Oct 22 19:59:30 +0000 2019,"What’s the outlook for SoCal industrial? Find out from @DukeRealty VP of Leasing &amp; Development Jake Smith &amp; other panelists during RENTV’s 4th Annual South Bay/Long Beach State of the Market Conference Thurs., 10/24 https://t.co/gLy9UY2Uf7 https://t.co/58nsTuhTEm",en,Duke Realty
Tue Oct 22 19:59:09 +0000 2019,RT @cb_inc: @DukeRealty brought in an awesome group of volunteers.  They worked hard organizing the donation room and putting together shel…,en,Duke Realty
Tue Oct 22 13:50:58 +0000 2019,"RT @IndyIntlAffairs: Kicking off a great season at the @IndyChamberOrch with Immigrants and the Golden Age of Hollywood, highlighting the c…",en,Duke Realty
Thu Oct 17 13:41:38 +0000 2019,One of @DukeRealty's best! Looking forward to Cait's participation on the panel discussion 10/24. https://t.co/NobBdsOevU,en,Duke Realty
Tue Oct 15 15:03:58 +0000 2019,Congratulations to @DukeRealty’s Indy Wellness Committee for leading associates down a healthier path and securing the #4 spot in the ranking of Indiana’s Healthiest Employers. #wellness https://t.co/qGWbx2jwaa,en,Duke Realty
Wed Oct 09 19:45:14 +0000 2019,"Chesapeake Commerce Center 6000, @DukeRealty’s seventh building in this 2.3 million SF logistics hub, is nearly under roof. This 182,000 SF BTS facility, scheduled for completion in early 2020, is going up on our last available site in the development. https://t.co/9e1QtA8Hn2",en,Duke Realty
Wed Oct 09 17:56:47 +0000 2019,"September was a busy month for the @DukeRealty Chicago team. Transactions during the month totaled 860,300 SF and included four new leases and a renewal, which took three buildings to full occupancy. https://t.co/MPIzxrv3to",en,Duke Realty
Tue Oct 08 20:23:18 +0000 2019,"Always a pleasure to help our tenants celebrate a new facility with a ribbon-cutting ceremony. Welcome Grace Kennedy to 5 Ethel Avenue in Wood-Ridge, NJ. @DukeRealty wishes you many years of success. https://t.co/i9Tvd4msH4",en,Duke Realty
Mon Oct 07 17:39:44 +0000 2019,"During a recent visit by U.S. Congressman Steve Stivers, @DukeRealty had the opportunity to show off its Rickenbacker Global Logistics Park properties, the tenants they’ve attracted and how the local economy has benefited. https://t.co/vt314AG4va",en,Duke Realty
Mon Oct 07 14:25:02 +0000 2019,Watch the clip to see what Jim Cramer had to say about @DukeRealty during CNBC’s Mad Money. https://t.co/TC7MAWsd2H,en,Duke Realty
Mon Oct 07 12:33:46 +0000 2019,@DukeRealty once again was proud to partner with SIOR Chicago for their 9th annual Ada S. McKinley College-Bound Trunk Scholarship. First-year students received $500 of supplies to help ensure they are prepared as they continue their education. https://t.co/jepLFdrVrr,en,Duke Realty
Thu Oct 03 19:41:45 +0000 2019,"Karen London, @DukeRealty construction project manager in Dallas, recently completed the National Black MBA Association’s (NBMBAA) 3-day Diversity and Inclusion (D&amp;I) Certificate Course: Recognizing and Disrupting Unconscious Bias during its 41st annual conference in Houston. https://t.co/hiIQf8zrrY",en,Duke Realty
Wed Oct 02 16:05:49 +0000 2019,Read about @DukeRealty’s partnership with the American Red Cross in the latest issue of REIT magazine. https://t.co/TV4PIiDiP0,en,Duke Realty
Mon Sep 30 16:11:28 +0000 2019,"RT @TheRealDarcie: Great group of can-do #womeninrealestate-  including past , present and future ⁦@NAIOPSouthFL⁩  presidents-
gather for b…",en,Duke Realty
Fri Sep 27 14:43:16 +0000 2019,"@DukeRealty is proud to support Working Scholars in Perris, CA where 200+ local, prospective students came to learn more about debt-free higher education. https://t.co/tUqn7kDLYK",en,Duke Realty
Fri Sep 27 14:22:20 +0000 2019,RT @cb_inc: @DukeRealty is the grill sponsor for @rachelbogle and @AlexaGreenNews at the upcoming Celebrity Cook-Off. @DEEMFIRST is sponsor…,en,Duke Realty
Fri Sep 27 12:55:39 +0000 2019,Our late night happy hour during the Colliers Industrial Conference in San Diego gave us the perfect opportunity to spend time with our valuable broker partners. Thanks for working with the @DukeRealty team! https://t.co/1e6YfIATcC,en,Duke Realty
Thu Sep 26 13:01:14 +0000 2019,"The best there is! Congratulations to @DukeRealty Minneapolis/St. Paul for taking home NAIOP Minnesota’s Award of Excellence for Arbor Lakes 10501, our build-to-suit for Illume, in Maple Grove. https://t.co/JExlyjA8Er",en,Duke Realty
Tue Sep 24 19:07:02 +0000 2019,"Good things come in 3’s! 3 tenants ink deals in Q3 @DukeRealty Greenfield North Business Center in Raleigh. High-quality, functional space and an exceptional location. https://t.co/kWKUH84rgG https://t.co/2FuQIEe66f",en,Duke Realty
Mon Sep 23 16:56:19 +0000 2019,@DukeRealty is proud to be one of 750+ businesses and the first REIT advancing diversity and inclusion in the workplace as part of @CEOAction. https://t.co/miWFNfp7AS #CEOAction.com https://t.co/JzeN4Wv1KZ,en,Duke Realty
Mon Sep 23 11:49:30 +0000 2019,"Incorporating sustainability in industrial buildings is becoming increasingly important. @DukeRealty’s Chris Whalen, along with Prologis and Clarion, discussed this topic as well as logistics buildings’ role in social equity and workforce development at ULI’s Fall Conference. https://t.co/hf7APdcXfa",en,Duke Realty
Thu Sep 19 15:41:03 +0000 2019,"@DukeRealty Women’s Network recently spearheaded a drive to collect donations for women’s shelters in the markets where we operate. $11,000+ in goods was presented across the country including Atlanta where our team’s donations went to Rainbow Village. https://t.co/dJ52CSQhgl",en,Duke Realty
Thu Sep 19 12:44:16 +0000 2019,Grateful for the training. You can never be too prepared! https://t.co/jvKSlH1hDS,en,Duke Realty
Wed Sep 18 16:12:29 +0000 2019,Thanks for working with us on this project. https://t.co/wRIB4sbmB5,en,Duke Realty
Mon Sep 16 19:53:10 +0000 2019,"Open for business! With the snip of a ribbon Design Within Reach officially opened its new 617,760 SF built-to-suit, omni-channel distribution center east of Cincinnati. @DukeRealty is so pleased that we were selected to deliver your customized building for you. https://t.co/AiEO4gBlcC",en,Duke Realty
Fri Sep 13 16:39:37 +0000 2019,"Nick Anthony, @DukeRealty CIO, moderated a panel on ‘Food Storage: Growth and Opportunities during NAIOP’s I.CON East Conference. https://t.co/BUu6QJovBX",en,Duke Realty
Fri Sep 13 16:05:59 +0000 2019,Our team is glad to help out! https://t.co/kRc1QCb1MX,en,Duke Realty
Fri Sep 13 16:05:24 +0000 2019,RT @EarlyLearningIN: One shed down and a new one coming up thanks to our @moralesgroupinc and @DukeRealty volunteers at Park 100. Stay tune…,en,Duke Realty
Fri Sep 13 12:04:08 +0000 2019,"RT @whalinsky23: Representing @DukeRealty attending the 2019 GRESB North American Real Estate Results Event in NYC, hosted by Alexandria Re…",en,Duke Realty
Mon Sep 09 12:10:55 +0000 2019,"Our development capabilities help make us strong! Read why @DukeRealty’s pipeline of projects, along with other strong performance indicators, point to a favorable outlook this year and beyond. https://t.co/yzzMNja3Qd https://t.co/4ljE1RG6OD",en,Duke Realty
Wed Sep 04 17:42:48 +0000 2019,Congratulations to Steve Schnur! @DukeRealty’s new Executive Vice President and Chief Operating Officer. https://t.co/D98GyFZvqh https://t.co/kyVV0cT4Nw,en,Duke Realty
Tue Sep 03 15:51:08 +0000 2019,Our team rocks! @DukeRealty went head-to-head with other area businesses in the Indiana Sports Corporate Challenge and placed second in the real estate industry category and fourth our division. Thanks for representing our company! https://t.co/phrDwI1QVa,en,Duke Realty
Thu Aug 29 19:15:07 +0000 2019,@DukeRealty’s Atlanta team has been busy this year! 1.5 million SF in leases signed and 1.2 million SF in new development through June 30. Find out the details: https://t.co/wxYQVLpoKF https://t.co/SGNyvSaYEZ,en,Duke Realty
Wed Aug 28 16:32:09 +0000 2019,Thanks to Midwest RE News for the recognition! https://t.co/c6Bl3nrrND,en,Duke Realty
Mon Aug 26 12:43:45 +0000 2019,"Nancy Shultz, SVP of @DukeRealty’s Southern California office, was recognized as an Orange County Power Woman and joined panelists on discussing the importance of finding work-life balance while building your career. https://t.co/xrAPtv7xlc",en,Duke Realty
Mon Aug 19 12:19:00 +0000 2019,RT @thereitwire: Duke Realty’s James Connor Says Industrial Fundamentals are Balanced @DukeRealty #REIT #RealEstate #Investing #CRE #Commer…,en,Duke Realty
Fri Aug 16 11:53:08 +0000 2019,RT @goldiescholars: Thank you @DukeRealty for becoming a new sponsor of the 2019 Goldie Gala. We're confident you will leave the Gala feeli…,en,Duke Realty
Thu Aug 15 12:04:08 +0000 2019,Pleasure to work with you! https://t.co/Tc6qWbAZVQ,en,Duke Realty
Wed Aug 14 15:54:26 +0000 2019,"RT @SeanBleilerCRE: 349,012 SF state-of-the-art #logistics facility in the heart of the #lehighvalley, PA.  162,340 SF remaining for lease.…",en,Duke Realty
Fri Aug 09 17:42:04 +0000 2019,"Our SoCal broker partners like doing deals with @DukeRealty and hitting the links! So when they attended a recent open house at our 210 W. Baywood warehouse in Orange, we made sure to have the TravisMathew minibus on site. https://t.co/J0WfC5tIh1",en,Duke Realty
Fri Aug 09 12:51:05 +0000 2019,"Fully built out in just three years! Last two preleased warehouses under development in @DukeRealty  Turnpike Crossing in West Palm Beach. Only 36,370 SF left to lease in this well-located industrial hub. https://t.co/mtENb9Q38Z https://t.co/GpUM8XQTas",en,Duke Realty
Thu Aug 08 12:52:53 +0000 2019,@DukeRealty gets praise as a solid investment in another article by Brett Owens in Forbes magazine. Read what he has to say. https://t.co/ZtoJINQMMN,en,Duke Realty
Mon Aug 05 17:54:30 +0000 2019,"Good news all around! Our 3 Lockport buildings in Chicago’s I-55 submarket are fully leased following 48forty Solutions 83,720 SF lease. But we have availability nearby in our recently delivered 543,780 SF Airport Logistics Center I building. https://t.co/FK2zh2qo7Y",en,Duke Realty
Fri Aug 02 13:15:37 +0000 2019,Our ongoing efforts to support the advancement of women in our company &amp; industry have gained the attention of @GwinnettChamber. They’ve named @DukeRealty a finalist in the Enlightened Employer category of their new #MoxieAwards! https://t.co/NQwTYptNUL,en,Duke Realty
Thu Aug 01 12:58:29 +0000 2019,The results are in. Check out @DukeRealty financial performance for Q2 2019 and then tune into our earnings call today at 3 PM ET for our executives’ take on our accomplishments and expectations for the rest of the year. https://t.co/UTK2bLxnRp,en,Duke Realty
Wed Jul 31 12:41:49 +0000 2019,Looking for a good forever investment? Read Forbes article “3 Top REIT Buys for the Next 55 Years” and find out why @DukeRealty is on the list. https://t.co/bGQODcMFAq,en,Duke Realty
Tue Jul 30 12:40:12 +0000 2019,"RT @rtv6: MonoSol broke ground in early 2018 on its $72 million, 150,000-square-foot manufacturing facility in the Duke Realty Lebanon Busi…",en,Duke Realty
Mon Jul 29 17:08:20 +0000 2019,"Look for @DukeRealty’s 2nd quarter financial results on Wednesday, July 31 after market close, then listen to our earnings call on Thursday, August 1 at 3:00 p.m. ET. https://t.co/z7mHmmxNmb",en,Duke Realty
Thu Jul 25 11:59:49 +0000 2019,"Listen to our CEO Jim Connor’s interview during REITweek where he talked about @DukeRealty’s take on being a responsible corporate citizen, our sustainability initiatives and the quality of our portfolio. https://t.co/hq8QPxsXaj",en,Duke Realty
Mon Jul 22 15:58:12 +0000 2019,"Proud to partner with @INRedCross to help meet this critical need. North side of @DukeRealty office, 600 N. 96th Street. https://t.co/T7CIvBD6fC",en,Duke Realty
Fri Jul 19 13:56:56 +0000 2019,"Need to be near our nation’s capital and Dulles Int’l Airport? Act now while we still have 42,580 SF available in our TransDulles industrial properties. https://t.co/rkHaINd5Nd https://t.co/5JC8quoY1k",en,Duke Realty
Tue Jul 16 19:30:02 +0000 2019,Nothing conveys satisfaction more than when a tenant renews &amp; expands in your building. Thank you to Acer Service Corporation for choosing &amp; growing with @DukeRealty! https://t.co/CjTK5Yo4bo https://t.co/FNElsMiG6A,en,Duke Realty
Tue Jul 16 14:48:21 +0000 2019,"RT @REjournals: .@ColliersChicago reps @Acer computer service center in 50,000-SF expansion in Lockport, with @CushWakeCHICAGO representing…",en,Duke Realty
Mon Jul 15 17:23:03 +0000 2019,"St. Louis brokers got a chance to beat the heat, enjoy a delicious Bar-B-Que lunch and take home some hot weather essentials, while getting a first-hand look at Premier 370 1001 during our Summertime Shindig. https://t.co/IT3BKIhhzn",en,Duke Realty
Wed Jul 10 16:37:28 +0000 2019,"Nothing like being on an actual job site to learn about construction careers. @DukeRealty gave STEM Yes! students a tour of its new, under-construction headquarters and talked to them one-on-one about opportunities in STEM fields. #DirectEmployersInstitute https://t.co/NnrIzkZncd",en,Duke Realty
Mon Jul 08 18:45:56 +0000 2019,We’re proud to be an Indiana business that cares about Diversity &amp; Inclusion. https://t.co/0UoTrnATVq,en,Duke Realty
Mon Jul 08 15:34:29 +0000 2019,"Coming soon! @DukeRealty’s new 154,512 SF logistics building in the O’Hare submarket near the north cargo gate &amp; within minutes of I-90 &amp; I-290/355 interchanges. https://t.co/smjI2EVnEp https://t.co/KceHBa1G8U",en,Duke Realty
Mon Jul 08 15:19:24 +0000 2019,What an honor! @DukeRealty’s SoCal office was named the 4th best place to work among large companies by the Orange County Business Journal. https://t.co/Ja07H6PW3B,en,Duke Realty
Tue Jul 02 15:51:08 +0000 2019,"Making an impact in logistics real estate. Congratulations to Stephanie Rodriguez, @DukeRealty VP of Leasing &amp; Development in South Florida! She’s been named an Industrial Influencer by GlobeSt. Real Estate Forum. https://t.co/McHqvGWPWK https://t.co/QbY5rG9bjn",en,Duke Realty
Tue Jul 02 15:50:23 +0000 2019,"RT @REjournals: Five #Midwest properties honored at 2019 #TOBY awards

https://t.co/vuUMiUWirn https://t.co/whf6ad9s1M",en,Duke Realty
Tue Jul 02 11:58:52 +0000 2019,RT @loaves_fishes: Congrats to @DukeRealty for being named #1 medium-sized company to work for! Thanks for your support to @loaves_fishes!!…,en,Duke Realty
Fri Jun 28 14:54:27 +0000 2019,"@DukeRealty is proud to be the developer of this project.

Missouri's first Amazon fulfillment center to open in St. Peters:  https://t.co/bi0Dua3ydJ",en,Duke Realty
Thu Jun 27 17:26:02 +0000 2019,"Minneapolis brokers got a fresh look at Park 81 and Arbor Lakes 10500, along with a free pair of sunglasses, during a recent event. Here’s hoping they’ll don those glasses during summer's sunny days &amp; bring a space-seeking client to these great @DukeRealty developments! https://t.co/aV56GfVUlW",en,Duke Realty
