created_at,full_text,lang,user_name
Sun Nov 04 20:02:15 +0000 2018,"@CecilioAlvarez_ Hi Cecilio, thanks for your note. This is a good question for our team in your area. Here is the phone number for our team in the Philippines, please call and they will assist: (632-8222688)",en,Abbott
Sun Nov 04 20:00:25 +0000 2018,"@Luna_Dorata Hi Luna, thanks for your note. We are making every effort to make the app available for Android as quickly as possible.",en,Abbott
Sun Nov 04 17:27:18 +0000 2018,"RT @AbbottGlobal: Congratulations to Lelisa Desisa, the men’s #TCSNYCMarathon champ! 🥇🏃🏾‍♂️#AbbottWMM #NYCMarathon https://t.co/cZRvdCD2nc",en,Abbott
Sun Nov 04 17:27:08 +0000 2018,"RT @AbbottGlobal: Congrats to Mary Keitany, the women’s #TCSNYCMarathon champ! 🥇🏃🏾‍♀️#AbbottWMM #NYCMarathon https://t.co/edTeSo1WrF",en,Abbott
Sun Nov 04 15:53:05 +0000 2018,"ICYMI: Our app for FreeStyle Libre is now approved for compatible iPhones in the U.S.: https://t.co/122pBvLHjg

Imp safety info: https://t.co/OOFU18xqF4 https://t.co/uOZ0iATJud",en,Abbott
Sat Nov 03 22:00:10 +0000 2018,"Managing #diabetes just got easier. 

FreeStyle LibreLink app for compatible iPhones is now approved in the US. 

Imp safety info: https://t.co/Dlbit4fF9C 

Learn more here ---&gt; https://t.co/PfnTLCuh9B https://t.co/mI2y9qhIML",en,Abbott
Sat Nov 03 18:51:35 +0000 2018,"@Southern4eva Hi Renee, thanks for your feedback and we're sorry to hear this. This is something our Diabetes Care team can help with. Here is the number for our team in the US, please call and they'll assist: 1-888-522-5226",en,Abbott
Sat Nov 03 18:41:04 +0000 2018,"RT if you are ready for 26.2 miles through 5 boroughs with 50,000 of your closest friends. #TCSNYCMarathon #AbbottWMM https://t.co/IRFGaWCCMW",en,Abbott
Sat Nov 03 17:11:37 +0000 2018,RT @AbbottGlobal: What a race! Thanks to everyone who participated in the #AbbottDash5k &amp; USATF 5K Championship 🙌🏼 https://t.co/0xPUHz01uC,en,Abbott
Sat Nov 03 17:11:30 +0000 2018,RT @AbbottGlobal: The Abbott Dash to the Finish Line 5k and the 2018 USATF 5K Championships got off to a strong start! 💪🏼 #AbbottDash5K htt…,en,Abbott
Sat Nov 03 17:11:12 +0000 2018,"RT @AbbottGlobal: And they’re off! Proud to sponsor the Abbott Dash to the Finish Line 5k, the setting for the 2018 USATF 5K Championships.…",en,Abbott
Sat Nov 03 14:07:05 +0000 2018,5 tips to go from running 5Ks to running marathons: https://t.co/Mbb2wMRrwj #AbbottDash5K #AbbottWMM https://t.co/oN5bden2YM,en,Abbott
Sat Nov 03 13:48:07 +0000 2018,"ICYMI: Our app for FreeStyle Libre is now approved for compatible iPhones in the U.S.: https://t.co/2RA7W3Dej6

Imp safety info: https://t.co/SzEy0dyB7R https://t.co/NU40OPZG2a",en,Abbott
Sat Nov 03 03:17:52 +0000 2018,"@marym_carlson Hi Mary, thanks for note. Don't lose hope! Keep up the great work and we'll be there to cheer you on every step of the way.",en,Abbott
Fri Nov 02 21:30:11 +0000 2018,"Managing #diabetes just got easier. 

FreeStyle LibreLink app for compatible iPhones is now approved in the US. 

Imp safety info: https://t.co/zVO6tm3TmY 

Learn more here ---&gt; https://t.co/7JdhwXk0nX https://t.co/OMJUKJeyVY",en,Abbott
Fri Nov 02 20:03:05 +0000 2018,How to make your move from 5Ks to marathons: https://t.co/5I11KXBp1M #AbbottDash5K https://t.co/ibf8dfayma,en,Abbott
Fri Nov 02 19:19:15 +0000 2018,"RT @USGLC: Despite being one of the world’s leading dairy producers, many of India’s farmers don’t have access to training or resources to…",en,Abbott
Fri Nov 02 18:37:05 +0000 2018,You get out of your body what you put in -- fuel it well with these 7 tips: https://t.co/AaoOUa9FW0 #AbbottWMM #TCSNYCMarathon https://t.co/oDFC9KMoqc,en,Abbott
Fri Nov 02 18:19:21 +0000 2018,RT @AbbottGlobal: Who’s excited for the Abbott Dash to the Finish Line 5K and USATF 5K Championships tomorrow? 🙌🏼  See you there! #AbbottDa…,en,Abbott
Fri Nov 02 15:36:43 +0000 2018,"Race weekend is here! New York City is ramping up for the Abbott Dash to the Finish Line 5K, 2018 USATF 5K Championships, and the #TCSNYCMarathon. https://t.co/nYf9L8HsaW",en,Abbott
Fri Nov 02 12:43:06 +0000 2018,"ICYMI: Our app for FreeStyle Libre is now approved for compatible iPhones in the U.S.: https://t.co/v7lFaIGSkN

Imp safety info: https://t.co/EnTb0De6yw https://t.co/uBPMcPJUfN",en,Abbott
Fri Nov 02 02:18:38 +0000 2018,"@nlmaville Hi Nicole, thanks for your kind words and we're sorry to hear this. Please send us a DM so we can assist you further.",en,Abbott
Thu Nov 01 21:00:21 +0000 2018,"Managing #diabetes just got easier. 

FreeStyle LibreLink app for compatible iPhones is now approved in the US. 

Imp safety info: https://t.co/kyBQwYQnOB 

Learn more here ---&gt; https://t.co/Do9TT0330W https://t.co/BqvWCRVEjX",en,Abbott
Thu Nov 01 19:24:40 +0000 2018,@amjo1121 😀,und,Abbott
Thu Nov 01 19:24:06 +0000 2018,@raheelaganwar Thank you 😊,en,Abbott
Thu Nov 01 19:22:06 +0000 2018,@Enea77 We understand your frustration. We are making every effort to make the app available for Android as quickly as possible.,en,Abbott
Thu Nov 01 16:39:15 +0000 2018,"Our FreeStyle LibreLink app: where cutting-edge health tech meets every day needs. 

Imp safety info: https://t.co/iKWyI9NGf0 

Now available in the U.S. for compatible iPhones ---&gt; https://t.co/VxeK5gqgGC https://t.co/d6NDau5NzU",en,Abbott
Thu Nov 01 13:20:52 +0000 2018,"@Omairnganai Hi Omair, thanks for your note and we're sorry to hear this. Please send us a DM with more details so we can assist you further.",en,Abbott
Thu Nov 01 13:11:35 +0000 2018,"BREAKING NEWS: FreeStyle LibreLink mobile app is now FDA approved! 

People with #diabetes using the FreeStyle Libre and FreeStyle Libre 14 day system in the U.S. can get their glucose data directly on their compatible iPhone: https://t.co/4HGfqOmcAb

ISI: https://t.co/iKWyI9NGf0 https://t.co/gBdK9UcQNn",en,Abbott
Wed Oct 31 00:55:53 +0000 2018,"We're thrilled our life-changing #diabetes technology #FreeStyleLibre, which has removed the need for fingersticks to monitor glucose for more than 1MM people, is the 2018 @Chi_Innovation award winner for healthcare innovation.

Safety information: https://t.co/V1jdsEGdSo https://t.co/4qYOF7uivR",en,Abbott
Tue Oct 30 21:06:44 +0000 2018,"🌍65,000 hours of support from our experts
🌍60,000 people receive emergency care every year
🌍23 high-tech labs across the country

Thousands of lives have been saved thanks to our work with the Abbott Fund and the Government in #Tanzania.

Learn more: https://t.co/wDptFQNbi0 https://t.co/lZRMFuV4Tg",en,Abbott
Mon Oct 29 18:24:07 +0000 2018,"#Flu season is coming. 

With our new rapid point-of-care molecular flu test, your doctor will know within 13 minutes or less if it’s the flu. That means faster diagnosis and treatment, and getting people feeling better sooner. 

Learn more: https://t.co/6hsSnXY5Yu https://t.co/1L5mN5uZfm",en,Abbott
Mon Oct 29 15:54:20 +0000 2018,"@Tejindar @abt Hi Tejindar, thanks for your note and we're sorry to hear this. If you'd like, please send us a DM with your contact information and we can have a member of our Diabetes Care team contact you directly to assist.",en,Abbott
Fri Oct 26 20:05:32 +0000 2018,"Molecular results in mere minutes! 

Abbott unveils fastest-ever molecular point of care influenza A &amp; B and Strep A detection tests cleared by the FDA and CLIA waived. 

https://t.co/GQx3GhbIoW https://t.co/bDRK0oQ3fk",en,Abbott
Fri Oct 26 19:24:11 +0000 2018,"Scientists like Udo Hoss, who worked on our revolutionary technology for people with diabetes, have named us a top place to work for the 15th year. 

@ScienceCareers #TopEmployer 

https://t.co/PYvtbim1TK https://t.co/MwOxl71TBK",en,Abbott
Fri Oct 26 16:33:06 +0000 2018,"Start feeling better sooner. 

Our fastest-ever molecular point-of-care test detects the #flu in 13 minutes or less, helping healthcare providers make treatment decisions during a single patient visit. 

https://t.co/GQx3GhbIoW https://t.co/oWqU72rhze",en,Abbott
Fri Oct 26 15:35:54 +0000 2018,"Prep for #surgery like you'd prep for a marathon. 

Here are 10 tips from @RCastanedaUSN at @USNewsHealth to speed up #recovery: https://t.co/YGVgFVCVJv https://t.co/r6pzN16aGz",en,Abbott
Thu Oct 25 20:01:33 +0000 2018,"Virus hunters. App developers. Data gurus. 

They all helped vote us into @ScienceCareers #TopEmployer list for the 15th year. 

https://t.co/PYvtbim1TK https://t.co/o3TTqLx3a7",en,Abbott
Thu Oct 25 18:52:11 +0000 2018,"The results are in - we're proud to be named to @ScienceCareers Top Company list for the 15th year. #TopEmployer 

https://t.co/PYvtbim1TK https://t.co/nIQkf5EHtJ",en,Abbott
Thu Oct 25 18:44:34 +0000 2018,"3x faster than the closest competitor. 

Our ID NOW Strep A 2 rapid molecular point-of-care test receives FDA clearance and CLIA waiver, enabling healthcare providers to give informed, real-time treatment decisions. 

https://t.co/GQx3GhbIoW https://t.co/PSJ2DQSWF9",en,Abbott
Thu Oct 25 15:02:08 +0000 2018,"#Flu season is coming. 

With our new rapid point-of-care molecular flu test, your doctor will know within 13 minutes or less if it’s the flu. That means faster diagnosis and treatment, and getting people feeling better sooner. 

Learn more:https://t.co/lUxY8Kd3Gh https://t.co/G9SyV14iQb",en,Abbott
Wed Oct 24 19:47:57 +0000 2018,"@CyndiThomas95 Thanks for sharing Cynthia, we're so happy to hear it!",en,Abbott
Wed Oct 24 18:46:31 +0000 2018,"@cxz20121 Hi Christina, thanks for your note. We secured CE Mark for FreeStyle Libre 2 very recently. We will share details on launch timing for additional countries when we have that information available.",en,Abbott
Wed Oct 24 16:56:16 +0000 2018,"FreeStyle Libre now has more than 1 million users across the globe, revolutionizing how people manage their diabetes. #3Q18 $ABT #FreeStyleLibre https://t.co/BVOkKpkm0Z",en,Abbott
Tue Oct 23 17:19:47 +0000 2018,@kimtheweiner HI Kim. We’re sorry to tell you that Curate Snacks have been discontinued. We would welcome the opportunity to discuss our ZonePerfect brand and the wide range of delicious flavors that we offer. We’re sorry for the inconvenience and appreciate your support of the brand.,en,Abbott
Tue Oct 23 16:24:06 +0000 2018,"ICYMI: The #HeartMate3 LVAD is a new, improved heart pump for people with advanced heart failure. https://t.co/4lJG9D8HGm 

Important safety info: https://t.co/kMJbHx1CaA https://t.co/Dom66ga8qc",en,Abbott
Mon Oct 22 20:34:17 +0000 2018,"A young girl’s dream to become an emergency room doctor is transforming care. Today, she helps lead a modern ER that is changing the lives of over 60,000 people each year in Tanzania.
 
Meet Dr. George, one of the first woman emergency medical doctors in #Tanzania.
 
#ItAllAddsUp https://t.co/jCmgMisjIC",en,Abbott
Mon Oct 22 15:12:05 +0000 2018,"Our HeartMate 3 heart pump, now FDA approved, offers significant advancements, including a pump designed to reduce complications while improving quality of life: https://t.co/qtLHGb6cGw 

Important safety info: https://t.co/2XDSoQJtkX https://t.co/2ZPPvdinHv",en,Abbott
Mon Oct 22 13:15:59 +0000 2018,"@MrMulatto1986 Hi Jon, thanks for your note and your patience. Yes, we continue to manufacture vascular devices in Temecula.",en,Abbott
Sun Oct 21 16:44:17 +0000 2018,"A young girl’s dream to become an emergency room doctor is transforming care. Today, she helps lead a modern ER that is changing the lives of over 60,000 people each year in Tanzania.
 
Meet Dr. George, one of the first woman emergency medical doctors in #Tanzania.
 
#ItAllAddsUp https://t.co/Eeugyd8Djg",en,Abbott
Fri Oct 19 19:56:05 +0000 2018,"Our annual Employee Giving Campaign is going on now. 

$30 million has been given to 5000+ charities over past 5 years – supporting causes that make an impact in our communities. #AbbottGives #ItAllAddsUp https://t.co/S87aHNkfV5",en,Abbott
Fri Oct 19 18:02:06 +0000 2018,"With the FDA approval of our HeartMate3 heart pump, more people will be given time and a second chance: https://t.co/kc18aGs4YO 

Important safety info: https://t.co/zA20KZZXZ7 https://t.co/SCFrxSxbAh",en,Abbott
Fri Oct 19 17:00:35 +0000 2018,"A young girl’s dream to become an emergency room doctor is transforming care. Today, she helps lead a modern ER that is changing the lives of over 60,000 people each year in Tanzania.
 
Meet Dr. George, one of the first woman emergency medical doctors in #Tanzania.
 
#ItAllAddsUp https://t.co/H30hcE2b6R",en,Abbott
Fri Oct 19 15:10:39 +0000 2018,"RT @devex: No single country can claim that all of its citizens have full access to reproductive rights at all times, according to a recent…",en,Abbott
Fri Oct 19 15:09:48 +0000 2018,"RT @OAFLA: Read here: https://t.co/con2qwZJvZ
Op-ed by Damain Halloran from @AbbottNews that was published on @devex  on the role of the pr…",en,Abbott
Fri Oct 19 14:46:30 +0000 2018,"@siyesfree Hi there, thanks for your note. We intend to make the FreeStyle Libre system available globally however timing depends on regulatory requirements by country.",en,Abbott
Fri Oct 19 14:44:05 +0000 2018,"More than 5.7 million Americans suffer from heart failure. 

For people with advanced heart failure, our HeartMate 3 LVAD heart pump is a life-changer: https://t.co/hR7ViZKiXk 

Important safety info: https://t.co/Kj1RyhIRqX https://t.co/u0ZZegtbzl",en,Abbott
Fri Oct 19 14:43:46 +0000 2018,"@siyesfree Hi there, thanks for your note. We intend to make the FreeStyle Libre system available globally however timing depends on regulatory requirements by country.",en,Abbott
Fri Oct 19 13:26:27 +0000 2018,"THIS JUST IN: Our HeartMate 3 heart pump now FDA approved for people not eligible for a transplant: https://t.co/w43Ld3CJzK 

Important safety info: https://t.co/fpWGYL6eZl https://t.co/vx1FZRrDoN",en,Abbott
Thu Oct 18 16:43:16 +0000 2018,Watch Now: CEO Miles White on another quarter of strong sales and double-digit EPS growth. https://t.co/dnObUytz6h $ABT #earnings https://t.co/4CLQMUkuuB,en,Abbott
Thu Oct 18 16:24:04 +0000 2018,"Our annual Employee Giving Campaign is going on now, where our employees support causes they care about most.

The result? 

$30 million given to 5000+ charities over 5 years – we look forward to building stronger communities again this year. 

#AbbottGives #ItAllAddsUp https://t.co/6pTrIijOfF",en,Abbott
Wed Oct 17 14:24:04 +0000 2018,@Kristiannevb This is great to hear! Thanks for sharing and we're so happy we were there to cheer them both on along the way to an incredible accomplishment!,en,Abbott
Wed Oct 17 13:53:03 +0000 2018,$ABT CEO Miles White on executing our strategy to deliver #3Q18 earnings growth: https://t.co/VsgKDSlbAI https://t.co/fHnRdK0f5q,en,Abbott
Wed Oct 17 13:34:00 +0000 2018,"FreeStyle Libre now has more than 1 million users across the globe, revolutionizing how people manage their diabetes. #3Q18 $ABT #FreeStyleLibre https://t.co/c63RsfMdka",en,Abbott
Wed Oct 17 13:26:10 +0000 2018,"We’ve made important advancements in Diabetes Care, Structural Heart and Diagnostics to help improve lives: https://t.co/S0VsDDJiHu $ABT #earnings https://t.co/1R8MTlch0u",en,Abbott
Wed Oct 17 13:16:28 +0000 2018,All four of our core businesses contributed to growth in #3Q18: https://t.co/72XruE8Knz $ABT #earnings https://t.co/1RawSCp3XB,en,Abbott
Wed Oct 17 13:05:06 +0000 2018,It’s not too late to join! The $ABT earnings call just started. Click here for call details: https://t.co/A3ULXIEDNz https://t.co/4FyZvP8Dai,en,Abbott
Wed Oct 17 12:55:12 +0000 2018,"Hear from our CEO, CFO and head of IR in just a few minutes for all the details on $ABT 3Q18 earnings: https://t.co/Ic0eJg4vEY https://t.co/gGnMPFta2j",en,Abbott
Wed Oct 17 12:20:13 +0000 2018,$ABT #3Q18 sales were up 7.8% on an organic basis: https://t.co/v5MImOALx3 https://t.co/pJos3obV40,en,Abbott
Wed Oct 17 11:45:45 +0000 2018,$ABT 3Q results are in! We delivered impressive sales and double-digit earnings-per-share growth: https://t.co/TioZAB9MOR https://t.co/DvyFyoJtZc,en,Abbott
Tue Oct 16 21:47:48 +0000 2018,Thrilled to be named to this list of great marketers for our thought leadership and #innovation. #FBIndex2018 https://t.co/1DofqpjOHz,en,Abbott
Tue Oct 16 16:49:12 +0000 2018,"On #WorldFoodDay and every day, we're working to address malnutrition around the world. 

One example: It’s not just better rice. It’s Ultra Rice. And it’s improving the nutrition of nearly half a million kids, every day. 

#WFD2018 #ItAllAddsUp https://t.co/QhUg9A42hs",en,Abbott
Tue Oct 16 13:33:18 +0000 2018,"@mikeconnolly Hi Mike, thanks for your note and we're sorry to hear it. This is something our Similac Care team can help with. Here is the phone number for our team in the US, please call and they'll be able to assist: 800-515-7677",en,Abbott
Thu Oct 11 17:53:50 +0000 2018,"Science doesn’t have gender. 

Our science rock stars inspire the inventors of tomorrow.

#DayoftheGirl #ItAllAddsUp https://t.co/B4Km8c3Ept",en,Abbott
Thu Oct 11 15:23:51 +0000 2018,"@AbbottGlobal @meganjb1985 Our Similac team would love to send you some coupons to show our appreciation for your patience with these changes. Feel free to DM us your full name, mailing address, telephone number and email and we'll make sure they are sent out right away.",en,Abbott
Tue Oct 09 20:26:56 +0000 2018,"@KhushwahaNadita Hi Nadita, thank you for sharing and we're very sorry to see this. If you could, please send us a DM so we can assist you further.",en,Abbott
Sun Oct 07 20:39:44 +0000 2018,"RT @AbbottGlobal: Crossing the finish line is defining. But the journey along the way: life-changing. 

Thanks to the Bank of America Chica…",en,Abbott
Sun Oct 07 20:39:39 +0000 2018,"RT @AbbottGlobal: As you reach for your best life, we’re here to give you a hand. #lifetothefullest #ChicagoMarathon #ProudSponsor https://…",en,Abbott
Sun Oct 07 15:07:31 +0000 2018,"Congratulations to Brigid Kosgei, 2018 Bank of America #ChicagoMarathon women’s champ! #AbbottWMM https://t.co/SIa5OaDAo4",en,Abbott
Sun Oct 07 14:43:44 +0000 2018,"Congratulations to Mo Farah, 2018 Bank of America #ChicagoMarathon men’s champ! #AbbottWMM https://t.co/Hum8geEL3t",en,Abbott
Sun Oct 07 13:27:16 +0000 2018,"RT @AbbottGlobal: Believe in yourself. Create your own story. Take those first steps. 

The Bank of America #ChicagoMarathon is on! #lifeto…",en,Abbott
Sun Oct 07 12:19:54 +0000 2018,"Almost go time! Let’s do this, Chicago. #lifetothefullest #ChicagoMarathon https://t.co/ckbHXkcPZg",en,Abbott
Sat Oct 06 19:27:05 +0000 2018,Our i-STAT point-of-care analyzer is transforming how the Bank of America Chicago Marathon keeps its race participants healthy for 26.2: https://t.co/BY8F8mLIRk https://t.co/EmXYMcA3GZ,en,Abbott
Sat Oct 06 18:17:09 +0000 2018,"RT @WMMajors: Tomorrow, thousands more stars will be up for grabs @chimarathon. Make sure you have your profile ready to go on https://t.co…",en,Abbott
Sat Oct 06 18:16:08 +0000 2018,"A full heart = a full life. That’s one of the reasons we sponsor the Abbott World Marathon Majors – and one of the reasons we’re donating $25,000 to the American Heart Association. Share the ❤ #runwithheart #lifetothefullest #AbbottWMM #ChicagoMarathon https://t.co/PAw0BZNI1X",en,Abbott
Sat Oct 06 17:47:20 +0000 2018,"Our employees running the Bank of America #ChicagoMarathon tomorrow get tips from one of the best, Joan Benoit Samuelson. #lifetothefullest https://t.co/G2l8122mV4",en,Abbott
Sat Oct 06 15:22:16 +0000 2018,"Tomorrow, the Bank of America #ChicagoMarathon. Today, the International Chicago 5k! #lifetothefullest https://t.co/nq7w5WRE56",en,Abbott
Fri Oct 05 20:00:21 +0000 2018,"RT @WMMajors: .@AbbottGlobal's Chris Miller | ""We also must celebrate our #SixStarFinishers. We will have 175 of them finish on Sunday."" #R…",en,Abbott
Fri Oct 05 19:18:59 +0000 2018,"1,500 medical volunteers will be at the Bank of America #ChicagoMarathon. 

i-STAT will be there too – making a difference on race day: https://t.co/YwPqplmdHD https://t.co/rWL3AQwNIK",en,Abbott
Fri Oct 05 15:57:35 +0000 2018,"The heartbeat of innovation and the pulse of heart health—that’s where you’ll find us. Also, at the Abbott Health &amp; Fitness expo, gearing up for the Bank of America #ChicagoMarathon and a $25,000 donation to the American Heart Association. Join us! #runwithheart #lifetothefullest https://t.co/5mI5E4JlcF",en,Abbott
Fri Oct 05 14:12:36 +0000 2018,The Abbott Health &amp; Fitness expo is officially open! #ChicagoMarathon #AbbottWMM https://t.co/Ln6n8IYMWR,en,Abbott
Thu Oct 04 21:17:05 +0000 2018,"We’re committed to help you #runwithheart. Visit the Abbott Health and Fitness expo, visualize your heartbeat, and be part of our gift to the American Heart Association. #lifetothefullest https://t.co/I8dXXwCrwf",en,Abbott
Thu Oct 04 20:47:12 +0000 2018,"RT @AbbottGlobal: “The places I’ve seen. 
The people I’ve been able to meet. 
How it makes me feel. 
The things I’ve been able to achieve t…",en,Abbott
Thu Oct 04 19:20:36 +0000 2018,"@parisholloway_x Hi Paris, thanks for your note. We secured CE Mark for FreeStyle Libre 2 very recently. We will share details on launch timing for additional countries when we have that information available.",en,Abbott
Tue Oct 02 21:12:12 +0000 2018,"The most personal technology is technology with the power to change your life. FreeStyle Libre system is exactly that. 

Learn more: https://t.co/ADQ7lIwGc3

Important safety info: https://t.co/0neRoUDJj8 https://t.co/AGMScATPFj",en,Abbott
Tue Oct 02 20:35:17 +0000 2018,"RT @ACEP_IEM: Want to be inspired by a real success story. Watch ""Pioneering Emergency Medicine in Tanzania"" on YouTube - https://t.co/sLGf…",en,Abbott
Tue Oct 02 19:45:18 +0000 2018,"When you can’t be with your doctor, Abbott’s Confirm Rx ICM can be with you, tracking your heart’s performance. 

Learn more: https://t.co/jVi6wnleJg

#EverydayInnovators https://t.co/OZIOqQzvqc",en,Abbott
Tue Oct 02 13:23:39 +0000 2018,"@laeghtz Hi Paulo, thanks for your note. The FreeStyle Libre 2 system will initially launch in Germany in the coming weeks. It will then be rolled out to additional EU countries so that people living with diabetes who need glucose alarms can benefit from them.",en,Abbott
Mon Oct 01 20:36:16 +0000 2018,"Revolutionizing the way you can manage your diabetes. That’s what life-changing technology is all about. 

Learn more: https://t.co/4fBnVSysF8 https://t.co/4bzvh0KIqs",en,Abbott
Mon Oct 01 18:50:59 +0000 2018,"We continuously work to provide life-changing tech to help people live fuller, healthier lives. 

The #FreeStyleLibre2 system will help people living in Europe with #diabetes who need glucose alarms: https://t.co/XtAbz7S0gI #lifetothefullest https://t.co/Y6fT91Me00",en,Abbott
Mon Oct 01 15:24:20 +0000 2018,@arson_as Thanks for the kind words Arek!,en,Abbott
Mon Oct 01 12:42:03 +0000 2018,"Say hello to our #FreeStyleLibre2 – now with optional glucose alarms. 

FreeStyle Libre 2 system will be available to people living with diabetes in Europe: https://t.co/XtAbz7S0gI",en,Abbott
Sun Sep 30 16:44:05 +0000 2018,"With so many options, here’s what to look for in your next protein bar: 

https://t.co/V0ZDXT6Dcf https://t.co/VsyPcateCc",en,Abbott
Sat Sep 29 23:02:04 +0000 2018,"3 continents. 8 countries. Thousands of food boxes packed for food banks.

Part of our year-round work with @FeedingAmerica and @foodbanking to help families in need, around the world. #ItAllAddsUp #AbbottGives #HungerActionMonth https://t.co/pAXIH6eeds",en,Abbott
Sat Sep 29 21:35:22 +0000 2018,This blood test can help people take control of their heart health: https://t.co/73rDWbmlnz #WorldHeartDay https://t.co/U6dqezSsNg,en,Abbott
Sat Sep 29 13:35:11 +0000 2018,"When you can’t be with your doctor, Abbott’s Confirm Rx ICM can be with you, tracking your heart’s performance. 

Learn more: https://t.co/Mx6adkRbX3

#EverydayInnovators #WorldHeartDay https://t.co/VQYlIJ9eA9",en,Abbott
Fri Sep 28 21:46:04 +0000 2018,"3 continents. 8 countries. Thousands of food boxes packed for food banks.

Part of our year-round work with @FeedingAmerica and @foodbanking to help families in need, around the world. #ItAllAddsUp #AbbottGives #HungerActionMonth https://t.co/8DWnonuHA7",en,Abbott
Fri Sep 28 14:44:42 +0000 2018,"What if your doctor could better predict your chances of having a heart attack? 

Our technology is making that possible: https://t.co/9J27SoHQ7c #WorldHeartDay https://t.co/mUuslCY4sA",en,Abbott
Fri Sep 28 13:30:15 +0000 2018,"When you can’t be with your doctor, Abbott’s Confirm Rx ICM can be with you, tracking your heart’s performance. 

Learn more: https://t.co/kFLlPYZ5Zd

#EverydayInnovators #WorldHeartDay https://t.co/3z3RtiIaLV",en,Abbott
Fri Sep 28 01:02:12 +0000 2018,"When you can’t be with your doctor, Abbott’s Confirm Rx ICM can be with you, tracking your heart’s performance. #EverydayInnovators #WorldHeartDay 

Learn more: https://t.co/akjKP4MmXr https://t.co/MlIm4RIE68",en,Abbott
Thu Sep 27 21:20:39 +0000 2018,"We’re revolutionizing how people with #diabetes can live their lives. 

Learn how here: https://t.co/Hg5EbiDpn0 https://t.co/wlTYY3Y2qW",en,Abbott
Thu Sep 27 19:42:18 +0000 2018,A topic that is close to our heart -- quite literally. Our blood test can help predict the chance of a heart attack or cardiac event: https://t.co/HNh50p2rsA #WorldHeartDay https://t.co/mJfWVuhTeE,en,Abbott
Thu Sep 27 19:28:05 +0000 2018,"These healthy snacking tips can help you work more energy boosting snacks into your diet:

https://t.co/PW7GaREDAg https://t.co/yUImK3pFWN",en,Abbott
Thu Sep 27 16:08:07 +0000 2018,@Holt1Lee Thanks for the kind words William! We're so happy to hear it.,en,Abbott
Thu Sep 27 14:30:25 +0000 2018,"Revolutionizing the way you can manage your diabetes. That’s what life-changing technology is all about. 

Learn more: https://t.co/qEOOjlC66i https://t.co/hMujwHLOyl",en,Abbott
