created_at,full_text,lang,user_name
Thu Dec 19 18:33:19 +0000 2019,"@snoleezey801 Hi there, thanks for your note and we're sorry to hear this. If you'd like, please send us a DM with more details so we can assist.",en,Abbott
Wed Dec 18 23:24:19 +0000 2019,"Roadside drug testing tools are needed to help keep roads and communities safe and our #SoToxa roadside drug testing device is being recognized by @PopSci as a 2019 ""Best of What's New"" tech innovation: https://t.co/hhulJNfAPK https://t.co/HyI2HrG4jg",en,Abbott
Wed Dec 18 17:31:57 +0000 2019,RT @Shape_Magazine: A new study sheds light on how cold and flu viruses interact. https://t.co/hDimbudKsW,en,Abbott
Wed Dec 18 14:12:04 +0000 2019,"With flu season in full force, here’s how you can help protect yourself: https://t.co/OptAfW9qoR #fluprevention https://t.co/G01YMnVFzb",en,Abbott
Tue Dec 17 16:45:12 +0000 2019,RT @TDOnline: Police can deter drugged driving with roadside tests | Opinion https://t.co/slTXLWLBo8,en,Abbott
Tue Dec 17 16:24:04 +0000 2019,"What happens when nutrition is prioritized before, during and after a hospital stay? 

Our own, Hakim Bouzamondo explains in @FierceHealth: https://t.co/N59KJ4ccoa",en,Abbott
Tue Dec 17 16:04:15 +0000 2019,Nutrition is the missing ingredient in home healthcare. https://t.co/divZNqhSyo,en,Abbott
Tue Dec 17 16:02:41 +0000 2019,"@remingtontonar Hi Remington, thanks for your note and we're sorry to see this. Please send us a DM so we can assist you further.",en,Abbott
Mon Dec 16 22:46:10 +0000 2019,"Creating the future of health is no small task. 

Here’s how it starts: https://t.co/pynMeFod5C https://t.co/VxeSYVYkPx",en,Abbott
Mon Dec 16 22:46:10 +0000 2019,"Creating the future of health is no small task. 

Here’s how it starts: https://t.co/wYfKOh7Aad https://t.co/7WidHjdDo7",en,Abbott
Mon Dec 16 16:07:09 +0000 2019,"1+ million babies are born with serious heart defects each year. 90% are living in countries without access to the specialized care they need to survive. 

Our #LittleHeroes initiative aims to give them the chance to grow up and reach their full potential: https://t.co/0BdzDFuC1s https://t.co/c1gzY5BDPi",en,Abbott
Mon Dec 16 15:41:04 +0000 2019,"ICYMI: We’re increasing our quarterly dividend 12.5%.
 
This is the 384th consecutive quarterly dividend paid since 1924: https://t.co/LRmadTOQDD #DividendAristocrat https://t.co/VDanztjROA",en,Abbott
Mon Dec 16 14:52:07 +0000 2019,"@ung1817 Hi Manish, please ensure you're calling during our regular business hours Monday through Friday from 830am - 5pm so a team member is there to assist.",en,Abbott
Mon Dec 16 14:50:48 +0000 2019,"@EmmyDjihad Hi Ntihemuka, thanks for asking! Click the link in our post to read about the foods that support immunity.",en,Abbott
Mon Dec 16 14:12:03 +0000 2019,"According to the CDC, #Chronicpain is one of the most common reasons adults seek medical care. 

Here’s how, with our #ProclaimXR neurostimulator device: https://t.co/HQMVEDigsx
 
Important safety info: https://t.co/vXlpYbREOu",en,Abbott
Sun Dec 15 19:27:03 +0000 2019,"Impaired driving can lead to tragic consequences, read why one man is so passionate about stopping drug-impaired drivers and keeping roads safe. #EndImpairedDriving https://t.co/GxPuO5yyNm",en,Abbott
Sun Dec 15 17:08:04 +0000 2019,Ask the expert – which foods support immunity? https://t.co/t8rkhpNCta https://t.co/TWpwKYdUAO,en,Abbott
Fri Dec 13 21:24:03 +0000 2019,Dividend Aristocrat – A company that has increased dividends annually for at least 25 consecutive years: https://t.co/0ZLAqNao0t https://t.co/Juw3bsPEgJ,en,Abbott
Fri Dec 13 19:26:47 +0000 2019,This @USATODAY article is a great reminder about the dangers of driving impaired. Roadside drug testing tools can help keep roadways safe. #EndImpairedDriving https://t.co/rpRcKk44vT,en,Abbott
Fri Dec 13 19:03:04 +0000 2019,We’ve declared our 384th consecutive quarterly dividend paid since 1924: https://t.co/KDf1dXlyA2 #DividendAristocrat https://t.co/hcBCaXedu6,en,Abbott
Fri Dec 13 17:16:50 +0000 2019,We’re increasing our dividend payout for the 48th consecutive year: https://t.co/p50FziVj8x #DividendAristocrat https://t.co/eL69Y5fhBE,en,Abbott
Fri Dec 13 16:18:46 +0000 2019,We’re raising our quarterly dividend payout to 36 cents per share – a 12.5% increase: https://t.co/PON4eMT0kn #DividendAristocrat https://t.co/57HT7XS1ff,en,Abbott
Thu Dec 12 22:56:04 +0000 2019,"With flu season in full force, here’s how you can help protect yourself: https://t.co/wGIvnaINnp #fluprevention https://t.co/mdFMpq0v5i",en,Abbott
Thu Dec 12 18:54:04 +0000 2019,"According to the CDC, #Chronicpain is one of the most common reasons adults seek medical care. 

Here’s how, with our #ProclaimXR neurostimulator device: https://t.co/aAtISD3hUR
 
Important safety info: https://t.co/6btnUuPjAr",en,Abbott
Thu Dec 12 14:52:04 +0000 2019,"@metalmatchmaker Hi, thanks so much for sharing and we’re so happy to hear about your experience.",en,Abbott
Wed Dec 11 19:37:47 +0000 2019,"@kathleenusa2018 Hi Sadie, thanks for your note. We've responded to your initial tweet to assist with your questions regarding Similac.",en,Abbott
Wed Dec 11 18:16:58 +0000 2019,See how we’re supporting organizations treating children with congenital heart disease in countries without access to specialized care: https://t.co/Ul10iIu2fX https://t.co/LKhLAnvAe3,en,Abbott
Wed Dec 11 18:07:51 +0000 2019,"@kathleenusa2018 Hi Kathleen, thanks for your note. If you'd like, please send us a private message with your full name, mailing address, email and telephone number and we will be happy to see what we can do to help. Thanks, and we hope to hear back from you soon!",en,Abbott
Wed Dec 11 16:08:20 +0000 2019,"What does innovation look like in the future? 

This is what we’re doing today to get there: https://t.co/cxaRq1n1de https://t.co/Hcvx7fOxpI",en,Abbott
Wed Dec 11 15:44:04 +0000 2019,"@julieegrau Hi Julie, thank you for your question and patience. Some cognitive changes have been reported after receiving a DBS device. Talk with your doctor if you have concerns or questions about DBS.",en,Abbott
Wed Dec 11 14:12:09 +0000 2019,"#SoToxa, our life-changing law enforcement solution used to detect and deter drug-impaired driving, was recognized as a 2019 ""Best of What's New"" tech innovation from @PopSci: https://t.co/IGu5AvvSSy https://t.co/8aBwceJZlA",en,Abbott
Mon Dec 09 20:18:20 +0000 2019,"Roadside drug testing tools are needed to help keep roads and communities safe and our #SoToxa roadside drug testing device is being recognized by @PopSci as a 2019 ""Best of What's New"" tech innovation: https://t.co/poN1II9rJP https://t.co/aFCdeUm3zR",en,Abbott
Mon Dec 09 19:19:28 +0000 2019,"@patinoernesto Hi Ernesto, thanks for your question. We can only speak to our test being able to detect this new strain, which is why we’re making this new subtype available to the research community to evaluate its impact on diagnostic testing, treatments and potential vaccines.",en,Abbott
Mon Dec 09 18:44:12 +0000 2019,"@rjustinfreeman Hi Justin, we’re sorry to hear this. You’ve reached our Twitter page for residents of the US. We’ve passed your concern to our Canadian affiliates, and hope you’ll reach out to them directly here: https://t.co/V0LE9ftD8H",en,Abbott
Mon Dec 09 17:11:25 +0000 2019,"@medina_andr Hi Andre, thanks for your note. Can you please send us a DM letting us know what country you live in?",en,Abbott
Mon Dec 09 14:13:32 +0000 2019,"@Imriaylde Hi Jennifer, thank you for sharing and we're so sorry to see this. Please send us a DM with the country you live in and your phone number so we can have a team member reach out to you directly to assist.",en,Abbott
Fri Dec 06 15:14:05 +0000 2019,"@mumChandra Hi Chandra, thank you for the update and we're happy to hear one of our Nutrition experts was able to help. If you need anything else, please let us know.",en,Abbott
Thu Dec 05 17:07:58 +0000 2019,"@DayanidhiBiswa8 Hi Dayanidhi, we're sorry for the frustration. What country do you live in?",en,Abbott
Thu Dec 05 16:39:09 +0000 2019,"@mumChandra Hi Chandra, thanks for your note and we're sorry to hear this. Please send us a DM letting us know what country you live in so we can assist.",en,Abbott
Thu Dec 05 14:14:20 +0000 2019,"Roadside drug testing tools are needed to help keep roads and communities safe and our #SoToxa roadside drug testing device is being recognized by @PopSci as a 2019 ""Best of What's New"" tech innovation: https://t.co/at9bs4LK7T https://t.co/0rFpEcTdrr",en,Abbott
Thu Dec 05 13:51:04 +0000 2019,"Kids with good health habits grow into healthy adults. Our employees are teaming up with schools in the U.S., Mexico and Ireland to help kids make better choices today for a healthier tomorrow: https://t.co/p5WZVPEjdO #FutureWellKids #IVD2019 https://t.co/PW7wwT3P3u",en,Abbott
Wed Dec 04 21:04:00 +0000 2019,We’re on a mission to bring accessible and affordable healthcare to rural communities in Rwanda. We’re excited to celebrate that process this week at #ICASA2019 with our health post experience. https://t.co/fn58d6nEVD,en,Abbott
Wed Dec 04 17:44:07 +0000 2019,"@DayanidhiBiswa8 Hi Dayanidhi, thanks for your note and we're sorry for the frustration. Please send us a DM letting us know what country you live in.",en,Abbott
Wed Dec 04 15:45:13 +0000 2019,"@metalmatchmaker Hi there, thanks for sharing! We're happy to hear it. Please let us know how your trail goes as we'd love to hear updates.",en,Abbott
Tue Dec 03 22:35:49 +0000 2019,"#SoToxa, our life-changing law enforcement solution used to detect and deter drug-impaired driving, was recognized as a 2019 ""Best of What's New"" tech innovation from @PopSci https://t.co/pNdDB1b41i https://t.co/V6eHLEy5i7",en,Abbott
Tue Dec 03 18:57:13 +0000 2019,@RSabhesan Thanks for reaching out to us with your concerns. Please send us a DM and we can look into this for you.,en,Abbott
Tue Dec 03 18:17:20 +0000 2019,"Creating the future of health is no small task. 

Here’s how it starts: https://t.co/gXfhrxZjJb https://t.co/WNxUJfXwWN",en,Abbott
Mon Dec 02 15:57:20 +0000 2019,"RT @jo_da123: On World AIDS Day, a researcher with ""virus hunting"" skills explains why it's important to keep looking for new strains ...""w…",en,Abbott
Sat Nov 30 15:57:07 +0000 2019,"@R1vka_M Hi Hevanna, thanks for your note and we're sorry to hear this. Please send us a DM letting us know which specific product you're referring to so we can best assist.",en,Abbott
Sat Nov 30 15:42:02 +0000 2019,"@gotobednerd Hi there, thanks for your note. Can you let us know what country you live in?",en,Abbott
Sat Nov 30 05:02:20 +0000 2019,"@cmhd2001 We're sorry to hear about this, Carlo. Could you please send us a DM so that we can better assist you?",en,Abbott
Wed Nov 27 14:34:50 +0000 2019,"@mkh059 Hi Manish, please ensure you're calling during regular business hours Monday through Friday from 8am - 530pm local time so a team member is there to assist.",en,Abbott
Tue Nov 26 20:12:03 +0000 2019,10 strategies for maintaining a keto eating regimen during Thanksgiving: https://t.co/UsHV6pTLdM via @usnews,en,Abbott
Tue Nov 26 14:57:08 +0000 2019,@steinypeter Thanks for sharing Peter.,en,Abbott
Mon Nov 25 23:11:04 +0000 2019,This is why rapid testing matters: https://t.co/kI2vOt0V3I #AntibioticsAwarenessWeek https://t.co/JCORPpa3F4,en,Abbott
Mon Nov 25 15:11:10 +0000 2019,"@mkh059 Hi Manish, we're sorry to hear this is the case. Our team in India can help. Please call them at 1800-22-0046.",en,Abbott
Mon Nov 25 15:03:34 +0000 2019,"@hagopinath Hi Gopinath, you can also reach our Diabetes Care team in India by phone or email and they will be able to assist once you're home. 
Phone: 000 800 100 5780
Email: ADC.CS.ID@abbott.com",en,Abbott
Sun Nov 24 23:32:01 +0000 2019,"RT @LeoBurnett: .@LeoBurnettIndia and @AbbottNews launched their #StrongerTogether campaign, capturing a modern-day couple facing the decli…",en,Abbott
Sun Nov 24 23:24:32 +0000 2019,"@hagopinath Hi Gopinath, we're sorry to hear about your uncertainty and our Diabetes Care team would like to address those concerns. Please call our team in the US as they will be able to best assist: 1-888-522-5226",en,Abbott
Sun Nov 24 18:31:23 +0000 2019,"@hagopinath Hi Gopinath, unfortunately, the FreeStyle Libre is not yet available in India. We intend to make the FreeStyle Libre system available globally however timing depends on regulatory requirements by country. If you'd like help while still in the US, please call: 1-888-522-5226",en,Abbott
Sun Nov 24 06:51:03 +0000 2019,"@hagopinath Hi Gopinath, thanks for your note and we're sorry to hear this. Please send us a DM letting us know what country you live in so we can assist.",en,Abbott
Sat Nov 23 16:06:41 +0000 2019,"Today, Kolton is doing everything they thought he couldn’t do. 

This is his story: https://t.co/oDf27uyE8y https://t.co/hDhX8BQmon",en,Abbott
Fri Nov 22 23:52:20 +0000 2019,"What does innovation look like in the future? 

This is what we’re doing today to get there: https://t.co/2gqjc9BMVg https://t.co/Q6CdBunYX6",en,Abbott
Thu Nov 21 18:47:43 +0000 2019,"@213_erik Thanks Erik, we're happy our response was able to help answer your question as well.",en,Abbott
Thu Nov 21 16:12:20 +0000 2019,"Creating the future of health is no small task. 

Here’s how it starts: https://t.co/KvKSriKSn1 https://t.co/wkhALUHOvB",en,Abbott
Thu Nov 21 00:47:09 +0000 2019,"A baby born sooner than expected needs a special amount of care. That’s why we created Similac Human Milk Fortifiers, so that new parents can nourish their young one with peace of mind. #WorldChildrensDay https://t.co/C5f2qBtEYl",en,Abbott
Wed Nov 20 23:47:10 +0000 2019,"For kids like Irie, life can start anew with the help of our Amplatzer Piccolo Occluder. This #WorldChildrensDay, we celebrate the lives of children around the world and the #healthtech that supports them: https://t.co/fwPZLXZxE0

Important safety info: https://t.co/9vGOw4lTn5 https://t.co/XszmFYEkVq",en,Abbott
Wed Nov 20 22:47:10 +0000 2019,"Kids need proper hydration to run and play, which is why we’ve developed products like Pedialyte—to help rehydrate kids battling illnesses and help get them back to feeling good. #WorldChildrensDay https://t.co/xWJlqvD0gr",en,Abbott
Wed Nov 20 21:46:46 +0000 2019,"When it comes to diagnosing illness, the quicker you know, the better. 

Our Rapid Molecular Flu Test helps doctors and families make decisions earlier, so kids can get back to being kids. #WorldChildrensDay https://t.co/RLuRIjFpT8",en,Abbott
Wed Nov 20 21:05:38 +0000 2019,"Children have a special way of interpreting the medical world, which is why we’re celebrating the advancements we’ve made this #WorldChildrensDay. 

What kind of stories do your kids have surrounding their healthcare devices, medicine, or moments? https://t.co/uPRIoeeABQ https://t.co/tIJq5qDl2x",en,Abbott
Wed Nov 20 20:46:05 +0000 2019,"“Abbott believes in me, not just for what I do as a professional, but also my financial and mental well-being.” – Shannon Ramirez, who trains new employees. 

She can pay her #studentloans and save for #retirement through our Freedom 2 Save program: https://t.co/7Bu0z4L82n https://t.co/uDQY8NMlAr",en,Abbott
Wed Nov 20 18:59:11 +0000 2019,"For kids who need a little extra help in the growth department, PediaSure supplies essential nutrients they need. We dedicate this #WorldChildrensDay to the millions of children we’ve supported over the years: https://t.co/eBCEcXbrZn https://t.co/u30TgtJAwa",en,Abbott
Wed Nov 20 18:02:18 +0000 2019,"For #WorldChildrensDay, we’re celebrating kids like Sadie, and the millions more whose lives are made better through our dedication to children’s health. We can’t wait to see what’s in store for 2020. https://t.co/Xf6p6o8ZdW

Important safety info: https://t.co/7wuci3r5wB https://t.co/t1Zbyua2aR",en,Abbott
Tue Nov 19 23:27:04 +0000 2019,"Our guiding principles for developing an innovative continuous glucose monitor? 

Revolutionary. 
Affordable.
User-friendly.  
Accessible. 
#CNBCEvolve https://t.co/Ny36NcOAsR",en,Abbott
Tue Nov 19 23:07:04 +0000 2019,"Our Amplatzer Piccolo Occluder device could help 1 in 5 premature babies born with a life-threatening opening in their heart that requires urgent treatment to survive. 

Read more: https://t.co/KVwm8akyH4 #CNBCEvolve
 
Important Safety Info: https://t.co/NTjjynxOwB https://t.co/l1fZc3v9fk",en,Abbott
Tue Nov 19 22:21:33 +0000 2019,"Small solutions with big impacts. 

New medical technology helps treat premature babies’ biggest health concerns: https://t.co/frsiM5Aohb #healthtech #CNBCEvolve https://t.co/RPqg7etdxE",en,Abbott
Tue Nov 19 22:11:46 +0000 2019,Millions of people around the world are impacted by diabetes. But we’re focused on transforming the standard of care—and it will potentially change their lives. #CNBCEvolve https://t.co/a25D4CSvlJ,en,Abbott
Tue Nov 19 21:56:17 +0000 2019,"It’s only the size of a pea, but our tiniest device has huge potential.

Learn more about our device for #preemies in need - the Amplatzer Piccolo Occluder: https://t.co/iPxjOzZzcK #CNBCEvolve

Important Safety Info: https://t.co/X3htlEv7Bu https://t.co/gTEEiOENzs",en,Abbott
Tue Nov 19 21:18:29 +0000 2019,How deep brain stimulation therapy helps patients take control of Parkinson's disease: https://t.co/ITIczxX8xF #healthtech #CNBCEvolve https://t.co/Jc9FESaQkb,en,Abbott
Tue Nov 19 20:53:40 +0000 2019,Delivering life-changing technology to transform diabetes care. It’s just one of the things we’re doing to evolve health care. #CNBCEvolve https://t.co/3kpZzsxdVK,en,Abbott
Tue Nov 19 20:02:26 +0000 2019,Evolve. Create. This is what it means to shape the future of health and improve quality of life. #CNBCEvolve https://t.co/CR2bVr0s0R,en,Abbott
Tue Nov 19 19:34:55 +0000 2019,"@CrankyLinuxUser Hi Josh, thanks for your patience. Proclaim XR does not have remote programming or remote monitoring capabilities. If you have a cybersecurity concern regarding your Proclaim XR device, we recommend having a conversation with your doctor.",en,Abbott
Tue Nov 19 19:32:43 +0000 2019,"@1alanelkins Hi Alan, thank you for your question. Proclaim XR is for patients with chronic pain and does not currently have a Huntington’s Disease indication. Patients should talk to their healthcare professional to discuss treatment options.",en,Abbott
Tue Nov 19 19:25:25 +0000 2019,"“For global companies like Abbott, we balance delivering on our promises today while keeping an eye down the road for the next obstacles, no matter where they may come from.” - Julie Tyler, Divisional Vice President, Global Marketing, Vascular #CNBCEvolve https://t.co/kDwmNWEkOQ",en,Abbott
Tue Nov 19 18:10:43 +0000 2019,"“Today we’ll hear from leaders about new ways to approach changes in technology, customer experiences, branding, and leadership. And how resilience plays a role when companies are facing challenges."" - Julie Tyler, Divisional Vice President, Global Marketing, Vascular #CNBCEvolve https://t.co/PGXyHPE2vn",en,Abbott
Tue Nov 19 18:08:00 +0000 2019,RT @AbbottGlobal: How can businesses and brands evolve and win in an age of disruption? We’re at #CNBCEvolve today to discuss this question…,en,Abbott
Tue Nov 19 17:43:04 +0000 2019,"“We’ve taken important strategic steps to put the company in the right markets at the right time to remain relevant to what’s happening in science and medicine.” - Julie Tyler, Divisional Vice President, Global Marketing, Vascular #CNBCEvolve https://t.co/8QQhavhs0K",en,Abbott
Tue Nov 19 16:58:47 +0000 2019,"@juliehallboston Hi Julie, thank you so much for the kind words and for sharing our video. We're so happy to hear it resonated with you.",en,Abbott
Tue Nov 19 15:14:52 +0000 2019,"@CharanGrover Hi Charanpreet, thanks for your note.  We’ve been working through some minor production delays, but this has been resolved now and we have resumed full production. For more information on product availability, you can reach our Nutrition team in India here: 1800-22-0046",en,Abbott
Tue Nov 19 14:44:01 +0000 2019,"@mkh059 Hi Manish, thanks for your note.  We’ve been working through some minor production delays, but this has been resolved now and we have resumed full production. For more information on product availability, you can reach our Nutrition team in India here: 1800-22-0046",en,Abbott
Mon Nov 18 23:17:04 +0000 2019,#CNBCEvolve features iconic global companies and executives who are embracing change and transforming for the future. You can find us there tomorrow; stay tuned. https://t.co/SZ9LGHmlPo,en,Abbott
Mon Nov 18 22:11:22 +0000 2019,Small solutions with big impacts. New medical technology helps treat premature babies’ biggest health concerns: https://t.co/DD1C3G2cix https://t.co/7XMeZYMfld,en,Abbott
Mon Nov 18 21:18:42 +0000 2019,"In an era of rapid technological advances and demographic change, how do longstanding companies adapt, innovate and evolve? We’ll be at #CNBCEvolve tomorrow to talk about it. https://t.co/NQUWpwQD9X",en,Abbott
Sun Nov 17 21:14:24 +0000 2019,How science-based nutrition can help premature infants defy the odds: https://t.co/PYXbqv4QbM #WorldPrematurityDay https://t.co/ntGMdECUzi,en,Abbott
Sun Nov 17 17:14:19 +0000 2019,Our groundbreaking Freedom 2 Save program is changing the #retirement savings formula for our employees who have #studentloans – so they can save for retirement while time is on their side. https://t.co/8IEE7pbwux,en,Abbott
Fri Nov 15 21:22:00 +0000 2019,"An estimated 50 million people in the U.S. live with chronic pain. With our Proclaim™ XR SCS system, they'll have another option for relief. #ASRAFall19

Important safety info: https://t.co/vXlpYbREOu https://t.co/Caf6GYRuC1",en,Abbott
Thu Nov 14 21:02:04 +0000 2019,RT @KevinLive5: WATCH: Today is #WorldDiabetesDay which means a lot to former #Gamecocks K @elliott_fry22 who's been dealing with the disea…,en,Abbott
Thu Nov 14 20:36:52 +0000 2019,RT @FreeStyleDiabet: Today is #WDD. Meet @elliott_fry22 . Hashtag #TeamFreeStyleLibre &amp; tag @FreeStyleDiabet by Nov. 17 to feature* your st…,en,Abbott
Thu Nov 14 20:07:47 +0000 2019,"@david_t_macknet Hi David, we're sorry you’re frustrated and our Glucerna team would like to speak with you to learn more. Please give them a call at 800-850-7677, M-F from 8:30am-5pm, EST &amp; reference customer# 03707080. Thanks, and they hope to hear from you soon.",en,Abbott
Thu Nov 14 19:14:20 +0000 2019,"Achievement. Adventure. Aspiration. 

These are things that make one feel alive. But it’s the people we share it with that make it meaningful. #WorldDiabetesDay #lifetothefullest https://t.co/ojHp9CxVbC",en,Abbott
Thu Nov 14 19:12:23 +0000 2019,"RT @FreeStyleDiabet: Today is #WorldDiabetesDay, an initiative founded to promote diabetes care, prevention, and a cure. To learn more abou…",en,Abbott
Thu Nov 14 17:30:56 +0000 2019,"🌎This #WorldDiabetesDay is dedicated to everyone around the world living with #diabetes, and to everyone in their family and support systems that help them live their best life. #lifetothefullest🌎 https://t.co/WJtYlBH5rw",en,Abbott
Thu Nov 14 13:44:04 +0000 2019,"Our employees’ student loans shouldn’t stop them from living their fullest lives. 

That’s why we make contributions to their 401(k)s when they pay down that debt. Here’s what @WSJ had to say about our pioneering program https://t.co/twVYGBRWWq",en,Abbott
Wed Nov 13 20:43:11 +0000 2019,"@sanganita13 Hi Ana, thanks for your note. Please send us a Direct Message so we can assist.",en,Abbott
Wed Nov 13 19:14:19 +0000 2019,"ICYMI: Miles White, our iconic Chairman &amp; CEO, will step down as CEO at the end of March and remain Executive Chairman. Robert Ford, a 23-year Abbott veteran and current President &amp; COO, will take over as CEO at that time. https://t.co/np6zROXlIx https://t.co/i7opTOSKTY",en,Abbott
Wed Nov 13 16:25:45 +0000 2019,"Miles White will be stepping down as CEO on March 31, 2020, after a remarkable 21-year tenure. He will remain Executive Chairman. Miles has strategically reshaped Abbott into the world’s leading health tech company, helping countless people along the way. https://t.co/E0L3LGfUpL https://t.co/3dDUAO2GAh",en,Abbott
Wed Nov 13 13:27:39 +0000 2019,"Breaking News: Miles White, our iconic Chairman &amp; CEO, will step down as CEO at the end of March and remain Executive Chairman. Robert Ford, a 23-year Abbott veteran and current President &amp; COO, will take over as CEO at that time. https://t.co/np6zROXlIx https://t.co/8PX07JjmqY",en,Abbott
Tue Nov 12 19:37:28 +0000 2019,RT @PopSci: This ‘new’ strain of HIV is actually a good thing https://t.co/s80DWn5u6C https://t.co/c2LWrn0hjD,en,Abbott
Tue Nov 12 19:19:31 +0000 2019,RT @WebMD: Scientists report they have discovered a new strain of HIV for the first time in almost two decades. https://t.co/FLtzeEhEMn htt…,en,Abbott
Tue Nov 12 19:17:15 +0000 2019,"@Beellyboi Wow, thank you so much for the kind words of support!",en,Abbott
Tue Nov 12 15:25:53 +0000 2019,"@dream17q3 Hi there, thanks for your message. Our fourth generation ARCHITECT HIV Ag-Ab test does detect this subtype. We are making this new strain available to the research community to evaluate its impact on diagnostic testing, treatments and potential vaccines.",en,Abbott
Mon Nov 11 21:38:05 +0000 2019,"“Freedom 2 Save has been a life-changer for me.” – Harvir Humpal, who works on life-saving cardiac devices. 

He can pay his #studentloans and save for #retirement through our first-of-its-kind program: https://t.co/MKMoL5cJLF https://t.co/0HeSnTWEbU",en,Abbott
Sun Nov 10 18:16:54 +0000 2019,"@krnlpanik Hi Eric, thanks for your note and we're sorry to hear this. If you could, please send us a DM with your contact information and we will have a team member reach out to you directly to assist.",en,Abbott
