created_at,full_text,lang,user_name
Fri Jun 07 17:59:54 +0000 2019,"How are visual storytelling and #diabetes management related? 

We kicked off #ADA2019 with an educational Diabetes Exchange and Experience event with our own Mahmood Kazemi, M.D., Dan Archer from @empatheticmedia, and Hannah Bianchini from @Microsoft #dX2SanFrancisco https://t.co/44h20YYC0t",en,Abbott
Fri Jun 07 15:11:38 +0000 2019,"“Our continuous innovation on the sensing platform will remain focused on scale, affordability and ease of use.” - Marc Taub, Ph.D. Divisional Vice President, Product Development, Diabetes Care, Abbott #MusingsUnderTheMoon #ADA2019 @diaTribeNews https://t.co/Zs7jomSIv5",en,Abbott
Fri Jun 07 03:54:54 +0000 2019,RT @diaTribeNews: Dr. Marc Taub of @AbbottNews on the hardest design challenges in new #diabetes technology: “Innovation without access is…,en,Abbott
Fri Jun 07 01:09:11 +0000 2019,"One of our leaders in diabetes innovation, Marc Taub, Ph.D., will be joining a powerhouse panel at @diaTribeNews' #MusingsUnderTheMoon to speak about our diabetes sensing tech and the future of the field: https://t.co/mDDE6LscFt #ADA2019",en,Abbott
Thu Jun 06 21:38:21 +0000 2019,"CALLING ALL ANDROID USERS: This just in - FreeStyle LibreLink app for Android users is now available in the U.S. #healthtech 

Important safety info: https://t.co/x086hoGtVO #healthtech https://t.co/mJS7gfIhQN",en,Abbott
Thu Jun 06 19:02:54 +0000 2019,Proud to have recently been named on the 150 Top Places to Work in Healthcare 2019 list by @BeckersHR: https://t.co/HPTTdao4uv https://t.co/Lyo6aSYrPU,en,Abbott
Thu Jun 06 17:45:49 +0000 2019,Cutting-edge care where a person’s options are expanded by therapy instead of limited by it. That’s what Infinity DBS does for people with Parkinson’s disease. We’re sharing more about this #healthtech at the @WorldPDCongress. #WPC2019 https://t.co/DfaG3BJGlg,en,Abbott
Thu Jun 06 17:20:02 +0000 2019,@MedTechResearch Thanks for joining us as we continue to innovate technology with the power to change your life! #healthtech,en,Abbott
Thu Jun 06 15:51:59 +0000 2019,"@yugandhar56 Hi Shreyas, thank you for your note and patience. Our team would like to reach out to you directly to assist. Please send us a DM with your contact information so we can assist.",en,Abbott
Thu Jun 06 15:04:05 +0000 2019,"Thanks to @RWJF and @justcapital_  for highlighting the importance of investing in employees and community health. 

We’re honored to be among the Top 10 U.S. Companies Supporting Healthy Families and Communities: https://t.co/R6TD36Sr9U",en,Abbott
Wed Jun 05 23:21:13 +0000 2019,"Promoting diversity within the workforce, employee engagement and professional growth – those are a few of the reasons that we landed on @BeckersHR's 150 Top Places to Work in Healthcare list for 2019: https://t.co/RUsFbq8f0q https://t.co/fgvycbTO8A",en,Abbott
Wed Jun 05 17:24:01 +0000 2019,How can we improve life for people with Parkinson’s disease? We’re at the 5th @WorldPDCongress this week in Kyoto to answer that exact question. Stop by our booth to learn more. #healthtech #WPC2019 https://t.co/sZALBvSQsG,en,Abbott
Wed Jun 05 16:34:04 +0000 2019,"There’s currently $1.57 trillion in student loan debt in America. 

We’re here to help carry some of that burden for our affected employees. 

Learn more about our Freedom 2 Save student loan program: https://t.co/PWkA7jfyJH https://t.co/peBeALBK84",en,Abbott
Tue Jun 04 22:09:14 +0000 2019,The World Parkinson’s Congress provides a forum for dialogue on the latest scientific discoveries related to Parkinson’s disease. So we’re here to discuss what’s next in treatment and the role our Infinity DBS system will play. #healthtech #WPC2019 https://t.co/DlTOj86M1n,en,Abbott
Tue Jun 04 20:14:03 +0000 2019,"Student loan debt continues to burden Americans. 

We’re here to help carry some of that burden for our affected employees. 

Learn more about our Freedom 2 Save student loan program: https://t.co/mH1wvQ1xBj https://t.co/wEZigGUOKE",en,Abbott
Tue Jun 04 18:17:17 +0000 2019,"@beccacaddy @USBrainAlliance We’re also excited for what neuroscience research can uncover. #healthtech collaborations, like ours with @USBrainAlliance, help move us forward: https://t.co/ctOxizLDWj",en,Abbott
Tue Jun 04 16:58:05 +0000 2019,"Over 40? Age-related muscle loss can happen to any of us, but here are some tips to help protect muscle as we age.
 
One of our experts weighs in on the importance of protein for older adults to support healthy muscles via @ChannelNewsAsia: https://t.co/a4h75OXjA8 https://t.co/wmIy3Z8XXs",en,Abbott
Tue Jun 04 15:42:12 +0000 2019,"@IrieLuehen Hi Irie, thanks for sharing and we're so sorry to hear this. If you'd like, please send us a DM letting us know what country you live in so we can best assist.",en,Abbott
Mon Jun 03 20:17:31 +0000 2019,"@adrianom Hi Adriano, thanks for your note and we're sorry to hear this. If you'd like, please send us a DM with more details about what you're referring to so we can best assist.",en,Abbott
Mon Jun 03 14:36:41 +0000 2019,"@aniket_mehta Hi Aniket, thanks for your note. Please send us a DM with a few more details regarding your question so we can help connect you with the correct team.",en,Abbott
Fri May 31 17:02:06 +0000 2019,"You’re at your best when you’re healthy. 

That’s why we value our employees and their health. @justcapital_ and @RWJF recognized 100 companies that treat their employees and communities best, and we’re proud to be in the top 10 on the list via @Forbes: https://t.co/h20DCs8YBi https://t.co/VPHSB2i36h",en,Abbott
Fri May 31 16:02:35 +0000 2019,"RT @USATODAY: Many job seekers are also eager to work for companies that help them whittle down their student loan obligations.  
 https://…",en,Abbott
Fri May 31 14:37:42 +0000 2019,We’re honored to be No. 6 on the list: https://t.co/VkMwLVovbL,en,Abbott
Fri May 31 13:42:29 +0000 2019,"@heartmercantile Hi there, we share your concern and our thoughts are with everyone affected by the Dayton area tornadoes. We're monitoring the situation closely and working through our businesses and with our longstanding humanitarian relief partners to assess needs and find out how we can help.",en,Abbott
Fri May 31 13:33:37 +0000 2019,"RT @feedhopenow: No stranger to hurricanes, Central Florida knows how critical it is to prepare for a storm. Today, more than 50 @AbbottNew…",en,Abbott
Fri May 31 13:28:04 +0000 2019,Thanks to @RWJF and @justcapital_  for highlighting the importance of investing in employees and community health. We’re honored to be among the Top 10 U.S. Companies Supporting Healthy Families and Communities: https://t.co/UxFioSplq8,en,Abbott
Fri May 31 01:28:06 +0000 2019,Thanks to @RWJF and @justcapital_  for highlighting the importance of investing in employees and community health. We’re honored to be among the Top 10 U.S. Companies Supporting Healthy Families and Communities: https://t.co/nWumlOh0aI,en,Abbott
Thu May 30 15:34:05 +0000 2019,"We prioritize health. For you, for our employees and our communities. 

Proud to be among @justcapital_’s Top 10 U.S. Companies Supporting Healthy Communities and Families via @FastCompany: https://t.co/emo0EBCn7G",en,Abbott
Wed May 29 22:22:13 +0000 2019,"Water? ✔ 
Food? ✔ 
First aid supplies? ✔ 

The time to prepare for a hurricane is now. Our employees have been helping communities in Florida, Louisiana, Texas and Puerto Rico get prepared for hurricane season for the past 14 years. 

Learn more here: https://t.co/vzoY0Y0Gih https://t.co/oOcbqpBphF",en,Abbott
Wed May 29 16:44:04 +0000 2019,"Keto your way, every day. 

Introducing the all-new ZonePerfect Keto shakes: https://t.co/m9eAKpATqY 

#trueketo #ketogenicdiet #keto #zoneperfectketo https://t.co/NHJ1jlz3H7",en,Abbott
Wed May 29 14:43:59 +0000 2019,"@missdmharding Hi Danielle, thanks for your note and we're sorry to hear this. We have responded to your DM to assist.",en,Abbott
Wed May 29 14:43:45 +0000 2019,"@missdmharding Hi Danielle, thanks for your note and we're sorry to hear this. We have responded to your DM to assist.",en,Abbott
Wed May 29 13:27:29 +0000 2019,@sacjai Compelling article. Thanks for sharing your thoughts and we look forward to hearing more in the future!,en,Abbott
Wed May 29 13:26:59 +0000 2019,@RasuShrestha @AtriumHealth @GiveAtrium @wakehealth @WakeForest @LevineCancer @LevineChildrens @HIMSS @JohnNosta @HealthITNews What a great mindset to approaching patient care. Congratulations to all involved in #BestCareForAll – what a great program.,en,Abbott
Tue May 28 21:14:04 +0000 2019,"Keto your way, every day. 

Introducing the all-new ZonePerfect Keto shakes: https://t.co/37UvCVfq2o 

#trueketo #ketogenicdiet #keto #zoneperfectketo https://t.co/W2O4E1B245",en,Abbott
Tue May 28 13:25:59 +0000 2019,"@KillicillinArt Hi there, thanks for the kind words and your patience! We are making every effort to make the app available for Android as quickly as possible.",en,Abbott
Mon May 27 19:44:05 +0000 2019,"The quicker the test, the faster decisions can be made. 

Our i-STAT, a portable blood testing analyzer, provides fast, accurate diagnostics results in minutes, when it counts the most. https://t.co/s1V9mcxePj #EmergencyMedicineDay https://t.co/CFtrRwNpHf",en,Abbott
Sun May 26 18:51:13 +0000 2019,"What do we see for the future of neuromodulation?
 
Improved access, better data, lower therapy burden, and better long-term outcomes. #INS2019 #HealthTech https://t.co/CW4V3SRlFV",en,Abbott
Sun May 26 17:02:22 +0000 2019,"When it comes to #neuromodulation, less is more. We’ve tried to eliminate the the need to recharge, the presence of wires, and the appearance of the device. So people can focus on their lives instead of chronic pain. #INS2019 #HealthTech https://t.co/DmttwfdOQn",en,Abbott
Fri May 24 20:24:26 +0000 2019,"⚡️ “WSJ Future of Everything” 

We wrapped up an exciting week at the @WSJ Future of Everything Festival where we discussed what’s possible with innovative #healthtech. And we’ll keep working to deliver on it every day. #WSJFuture 

https://t.co/cLOfk6dMyk",en,Abbott
Fri May 24 14:59:43 +0000 2019,"We’re making strides in advancing minimally invasive therapies and investigating the potential of #tricuspidvalve repair* to treat people without open-heart surgery.  

Learn more from our TRILUMINATE study: https://t.co/EWUcEHUexh #EuroPCR #TTVR *Investigational use only",en,Abbott
Fri May 24 00:04:59 +0000 2019,Can diagnostic testing go beyond diagnosis and into prevention? #WSJFuture #healthtech https://t.co/Ch9csqeof5,en,Abbott
Thu May 23 22:40:17 +0000 2019,Dr. Okonkwo hits on the connection between health and humanity—and exactly why health is so important. #WSJFuture https://t.co/d8b7mRMiis,en,Abbott
Thu May 23 16:25:33 +0000 2019,"@JohnNosta Hi John, thanks for your note. We agree, there are many new exciting treatments being investigated to treat chronic neurological disorders.  We are living in an exciting time of neuroscience discovery!",en,Abbott
Thu May 23 15:22:04 +0000 2019,5 tips for taking charge of your health: https://t.co/pifOT2zvLw https://t.co/QTxHwfsHq8,en,Abbott
Thu May 23 12:17:36 +0000 2019,@keithwjr92 @keithwjr92 it was so nice to meet you on Tuesday. Good luck with your public health endeavors!,en,Abbott
Thu May 23 00:58:02 +0000 2019,"We asked Div, one of the @WSJ Future of Everything attendees, what innovation could have an important impact on day-to-day health in the future. #WSJFuture #diabetes https://t.co/LLUjHYMohL",en,Abbott
Wed May 22 20:56:41 +0000 2019,Data from the TRILUMINATE study of our investigational tricuspid valve repair system* presented at #EuroPCR show it reduced #tricuspidregurgitation at 30 days: https://t.co/FkGmHXj6w9 *Investigational use only,en,Abbott
Wed May 22 20:37:37 +0000 2019,"As we look to the future of healthcare and medical innovation, what would make the biggest impact for you? #WSJFuture https://t.co/OTEwNzpQui",en,Abbott
Wed May 22 19:46:08 +0000 2019,Which technology do you think has the power to most change the healthcare landscape? #WSJFuture https://t.co/827Goe1Tca,en,Abbott
Wed May 22 18:11:15 +0000 2019,We're working on solving some of the world's greatest healthcare challenges. Here's how we're revolutionizing healthcare in Rwanda and beyond. #WSJFuture https://t.co/ygJkFyJMQk,en,Abbott
Wed May 22 15:52:31 +0000 2019,Which breakthrough innovations will redefine a life well-lived? We asked Lucie (@luciemcmonster) to share her thoughts with us. #WSJFuture https://t.co/mLM70XDiDT,en,Abbott
Wed May 22 15:07:21 +0000 2019,Half of all concussions go undetected. Here's how we're revolutionizing brain injury detection. #WSJFuture https://t.co/xPUTyERuq0,en,Abbott
Wed May 22 14:32:13 +0000 2019,Where will the world see the biggest breakthroughs in health technology? #WSJFuture,en,Abbott
Wed May 22 14:07:21 +0000 2019,We’re asking @WSJ Future of Everything attendees what they think has the power to most change the healthcare landscape. David shares his thoughts on the future of health. #WSJFuture https://t.co/Swo0jFZayC,en,Abbott
Wed May 22 13:53:23 +0000 2019,Making connections with connected data. It’s one of the main health trends being discussed here at the Future of Everything Festival. #WSJFuture #AI #healthtech https://t.co/uzfCZVBBK4,en,Abbott
Wed May 22 13:17:29 +0000 2019,"Welcome to the @WSJ Future of Everything Festival, day 3! Come on in and have a look around. #WSJFuture https://t.co/Gz5OC4GaUx",en,Abbott
Tue May 21 22:08:09 +0000 2019,Ideas that are advancing technology and society—they are front and center here at the @WSJ Future of Everything Festival. We’re bringing them to the front and center of your Twitter feed. #WSJFuture https://t.co/W9rqnmoxry,en,Abbott
Tue May 21 21:45:48 +0000 2019,"Are we on the cusp of a health revolution? We think so. 

So does Chloe who shared her thoughts with us here at the WSJ Future of Everything Festival. #WSJFuture https://t.co/5SjHNLrCT2",en,Abbott
Tue May 21 21:07:11 +0000 2019,@robmtaub In New York City!,en,Abbott
Tue May 21 20:47:09 +0000 2019,Which breakthrough innovations will redefine a life well-lived? We asked Michelle to share her thoughts with us. #WSJFuture https://t.co/ZgNrxgK14Q,en,Abbott
Tue May 21 20:20:43 +0000 2019,Everything is happening at the @WSJ Future of Everything Festival. Stop by our space to learn about the health revolution. #WSJFuture #healthtech https://t.co/0yyPT3cCSJ,en,Abbott
Tue May 21 19:51:10 +0000 2019,What do you think is most important when considering what the future of health will be like? #WSJFuture https://t.co/hNuc43SXZp,en,Abbott
Tue May 21 18:10:13 +0000 2019,"Humans. Tech. In the future can one exist without the other?

Carmen shares what she thinks #healthtech has in store. #WSJFuture https://t.co/PCFKTxwg2t",en,Abbott
Tue May 21 16:04:51 +0000 2019,Day 2 of the @WSJ Future of Everything Festival — discussing big ideas in healthcare and medical innovation. #WSJHealth https://t.co/NTUD2AOMi1,en,Abbott
Tue May 21 15:42:03 +0000 2019,"Our innovative pipeline and focused execution continues to produce results. 

We’re positioned for sustained success thanks to key products in diagnostics, diabetes care and structural heart along with a robust pipeline across all of our businesses: https://t.co/QJUn9D0N9m $ABT https://t.co/yNe96GfW8O",en,Abbott
Tue May 21 15:25:05 +0000 2019,"We’ve executed a deliberate strategy of shaping, while continuing to invest internally across the company. 

The result – we’ve never been better positioned in terms of leadership presence and scale: https://t.co/JR1x6wHUT0 #healthtech $ABT https://t.co/R9b0zQd4OP",en,Abbott
Tue May 21 15:08:04 +0000 2019,"It’s an exciting time for us and #healthtech. 

Our diversified portfolio is grounded in a process of continuous shaping to remain relevant for the people we serve around the world: https://t.co/emFddqsPSw $ABT https://t.co/VNyekRgpvh",en,Abbott
Tue May 21 15:04:34 +0000 2019,@ajvc23 Nice work Adrian! 💪,en,Abbott
Tue May 21 15:01:08 +0000 2019,Join us live now for our presentation at the UBS Global Healthcare Conference: https://t.co/riNc9vxXuF $ABT https://t.co/PqbnPqVvKX,en,Abbott
Tue May 21 14:37:16 +0000 2019,"@emily_cerciello @sacjai @sacjai Emily, thanks for highlighting a number of compelling points on emerging #healthtech shifts, needs and challenges all companies need to get right.",en,Abbott
Tue May 21 14:01:10 +0000 2019,"With more than 10 key product developments in the first quarter, our #healthtech is making a big impact for people around the world. 

Learn more when we present today at the UBS Global Healthcare Conference: https://t.co/mGoVO3Kgim $ABT https://t.co/qBOXGXK37r",en,Abbott
Tue May 21 01:50:12 +0000 2019,@kimlast @imogenheap @Trevornoah @TheDailyShow @alexisohanian @TedLeonsis @richkleiman @sterling7 Day 1 was great; can’t wait for tomorrow!,en,Abbott
Tue May 21 01:48:59 +0000 2019,We’ve asked @WSJ Future of Everything attendees what they think has the power to most change the healthcare landscape. Ethan shares his thoughts on the future of health. #WSJFuture https://t.co/fdsd3qQNC7,en,Abbott
Mon May 20 22:29:25 +0000 2019,"Can the future be predicted? 

Hear from Sharon and Anthony on how health could be redefined. #WSJFuture https://t.co/FgGvtWemRH",en,Abbott
Mon May 20 20:39:33 +0000 2019,Future thinkers are exchanging ideas and sharing insights on the impact of health tech. Check out these thoughts from Asher. #WSJFuture https://t.co/MG1NaC3cI9,en,Abbott
Mon May 20 20:14:37 +0000 2019,"Big ideas. Brilliant minds. We’re asking @WSJ Future of Everything attendees to share their thoughts on what the future of health looks like. 

What do you think? #WSJFuture https://t.co/8uFFLZXf5D",en,Abbott
Mon May 20 20:14:04 +0000 2019,"9 out of 10 U.S. college students with #studentloans say they want to find a company that will help them pay them off faster. 

But only 4% of companies (including us!) currently offer a student loan employee benefit: https://t.co/5Fztu5Mqqq https://t.co/OnV5SDN4U6",en,Abbott
Mon May 20 19:30:29 +0000 2019,"Over 70% of treatment decisions are based on test results, and testing is usually reliant on a physician.

But what does the future of diagnostics have in store? We explore this and other big ideas at the @WSJ Future of Everything Festival. #WSJFuture #healthtech https://t.co/wuqiLo2trt",en,Abbott
Mon May 20 17:24:43 +0000 2019,"Test results at your fingertips; it could be closer than you think. 

This morning we’re discussing what the future of diagnostics looks like and the impact it could have on healthcare. #WSJFuture https://t.co/MPMn1ET2uC",en,Abbott
Mon May 20 14:53:40 +0000 2019,"@jack_kananian Hi Jack, thanks for your response. Here is the phone number for our Similac Care team in the US. Please call and they'll be able to assist: 800-515-7677",en,Abbott
Mon May 20 14:47:30 +0000 2019,"@jack_kananian Hi Jack, thanks for your note. This is a good question for our Nutrition team in your area. Can you let us know what country you live in?",en,Abbott
Mon May 20 13:00:29 +0000 2019,"@17_kajal Hi Enrique, thanks for your note. This event is taking place in New York City. You can learn more about the event here: https://t.co/TF0tw3Q4Bg",en,Abbott
Mon May 20 11:39:44 +0000 2019,Innovative technology that can change someone’s life. That’s why we’re here. Want to learn more? We’ll be tweeting from the @WSJ Future of Everything Festival; stay tuned! #WSJFuture https://t.co/ofHNm1Q96W,en,Abbott
Sun May 19 15:31:09 +0000 2019,"@17_kajal Hi Enrique, it will be held in New York City starting tomorrow.",en,Abbott
Sun May 19 15:23:32 +0000 2019,"What happens next? Which breakthroughs really matter? 

Over the next few days, we’ll be at the @WSJ Future of Everything Festival to discuss these questions and beyond. #WSJFuture https://t.co/7TIVS45oiT",en,Abbott
Sat May 18 15:42:14 +0000 2019,Technology is transforming healthcare. And we’re transforming health tech. More to come on this at the WSJ Future of Everything Festival next week. #WSJFuture https://t.co/O59Daj8wqS,en,Abbott
Fri May 17 16:11:04 +0000 2019,Got student debt? We've got you: https://t.co/p1abyvDCku #Freedom2Save https://t.co/K3rRsNHIRl,en,Abbott
Thu May 16 16:38:51 +0000 2019,"Student loan debt – affecting 1 in 4 Americans and topping $1.5 trillion – is one of the most pressing concerns of students graduating college this spring. That’s why we put our groundbreaking student loan program, Freedom 2 Save, in place: https://t.co/kdltcWVLUJ https://t.co/UZmByCQbXi",en,Abbott
Wed May 15 21:22:07 +0000 2019,"Every day, we work to help people build better lives and stronger communities. 

For the 11th year in a row our work was recognized by Corporate Responsibility Magazine, which named us one of the 100 Best Corporate Citizens. 

#ItAllAddsUp #100BestCC https://t.co/iEfKs1Eghu",en,Abbott
Wed May 15 20:53:23 +0000 2019,"We'll be checking out this new show #Brainchild by @netflix that helps show women and minorities that science is not only cool, but something they can succeed in. 

Nice story by @RuthUmohNews #STEMsisters #girlpower https://t.co/iuJ7f1S4aI",en,Abbott
Wed May 15 19:40:13 +0000 2019,"This just in: For the 11th consecutive year, we were named one of the 100 Best Corporate Citizens by Corporate Responsibility Magazine.
 
We work to earn it every day – find out more: https://t.co/v6x9Pmwvqa

#Sustainability #ItAllAddsUp #100BestCC https://t.co/7mUq7gBtOe",en,Abbott
Wed May 15 18:33:11 +0000 2019,This is why we don’t do #studentloan benefits like everyone else – so we can have maximum impact for our employees like Harvir. #Freedom2Save https://t.co/YLONlMmFSr,en,Abbott
Wed May 15 14:28:27 +0000 2019,9 out of 10 U.S. college students with #studentloans say they want to find a company that will help them pay them off faster. But only 4% of companies (including us!) currently offer a student loan employee benefit: https://t.co/6fIyWuVgVA https://t.co/GVqSG1ZUBw,en,Abbott
Tue May 14 18:47:05 +0000 2019,"100+ million people in the U.S. experience at least one neurological disorder.

We’re joining forces with the National Institutes of Health (@NIH) to accelerate advancements in neuroscience research: https://t.co/ckvHTOGqQp",en,Abbott
Tue May 14 14:40:32 +0000 2019,ANNOUNCING: We're partnering with the National Institutes of Health (@NIH) to bring together the brightest minds and improve the treatment and prevention of brain disorders. https://t.co/6AbeJKgeWS https://t.co/TUctj6xQeV,en,Abbott
Mon May 13 21:38:38 +0000 2019,5 tips for taking charge of your health: https://t.co/2z9HdsuyWh https://t.co/W1Lxew0Clq,en,Abbott
Mon May 13 15:38:52 +0000 2019,"@biotechno85 Excellent advise we can all follow, thanks so much for sharing Patrick!",en,Abbott
Sun May 12 21:53:02 +0000 2019,@biotechno85 We couldn’t agree more!,en,Abbott
Sun May 12 21:52:46 +0000 2019,@robmtaub @FreeStyleDiabet This warms our 💙. Thank you so much for sharing.,en,Abbott
Sun May 12 15:52:05 +0000 2019,"Happy Mother’s Day!
 
Momspiration: mom’s best advice. She wants you to live your best, healthiest life, and so do we. What’s the best advice your mom ever gave you, your Momspiration? 

#momspiration #MothersDay https://t.co/HtwVKQla0p",en,Abbott
Fri May 10 17:57:25 +0000 2019,"New data in @CircAHA found our blood test can help predict cardiac events in adults with no known heart disease. 

@BusInsiderSG revealed how this test could help empower people to take control of their heart health: https://t.co/mJxVhwJ335",en,Abbott
Fri May 10 14:20:57 +0000 2019,"@annmicheles Hi Am, thanks for your note and we're sorry to hear this. We'll be sure to pass your feedback along to our Ensure Care team.",en,Abbott
Fri May 10 13:39:43 +0000 2019,"@chrissyfarr Great question! As we develop apps, collaboration between physician advisors, developers &amp; regulatory partners is critical to understanding what we can &amp; can’t do. Then we need to continually learn about impact &amp; its improvement for users. We’d love to hear what others are doing.",en,Abbott
Thu May 09 19:17:04 +0000 2019,"Our hearts are designed to beat more than 3 billion times.

We’re leading the way in electrophysiology, with #healthtech that equips doctors with the right tools to diagnose problems, map the inside of hearts and deliver the right therapies: https://t.co/jx1gUnGdpm #HRS2019 https://t.co/H6W8vXkPUJ",en,Abbott
Thu May 09 18:45:56 +0000 2019,"@Mom2019Time Hi Gris, thanks for your note. We take all concerns about product quality and safety seriously and have confirmed with our Nutrition team that they’ve been in contact with you. Please continue to work with them as they will be able to best assist.",en,Abbott
Thu May 09 15:03:04 +0000 2019,The heart has its own rhythm. Discover how we’re helping it keep the beat and changing lives at #HRS2019: https://t.co/hjXXYVGH68 #healthtech https://t.co/EPBZXvYL0I,en,Abbott
Thu May 09 14:57:03 +0000 2019,@mikeandmattn That's what we love to hear! Hope it was a great morning gym session and you have an even better day 💪,en,Abbott
Thu May 09 13:34:04 +0000 2019,"Research could lead to the first point-of-care blood test of its kind to help evaluate #concussions within minutes: https://t.co/oxeKqoTbBG

#braininjury #TBI https://t.co/pQpRbLkBpw",en,Abbott
Wed May 08 21:54:14 +0000 2019,"""To sustain a business, and prosper, for 130 years, you have to understand the value of diversity at a fundamental level,"" – our EVP of Human Resources, Steve Fussell. 

Proud to be a @DiversityInc Top 50 Company for Diversity #DITop50 https://t.co/mDlml8JcLD https://t.co/orsHpZTt4a",en,Abbott
Wed May 08 19:02:04 +0000 2019,Solving abnormal heart rhythms with the right tools: https://t.co/mrbDMTynpS #HRS2019 https://t.co/YYiWHv3xQR,en,Abbott
