created_at,full_text,lang,user_name
Thu Mar 29 19:51:04 +0000 2018,"What happens when our best nutrition scientists join forces with @PATHtweets scientists and, with help from the Abbott Fund, take on a global health challenge? #UltraRice, a better way to combat to fortify diets and fight malnourishment. https://t.co/9VMeM1tyWa https://t.co/SdGtvv9FQh",en,Abbott
Thu Mar 29 13:43:38 +0000 2018,"@RV180181 Hi Rajesh, thanks for your note and we're sorry to hear this. This is something that our team in India can help with. Here is their phone number, please call and they will be able to assist: (91 22) 6736 7000",en,Abbott
Wed Mar 28 19:46:06 +0000 2018,"What happens when our best nutrition scientists join forces with @PATHtweets scientists and, with help from the Abbott Fund, take on a global health challenge? #UltraRice, a better way to combat to fortify diets and fight malnourishment. https://t.co/dJiWlen4Q1 https://t.co/yzIklAGuRt",en,Abbott
Wed Mar 28 19:26:10 +0000 2018,"530 million LinkedIn users have spoken: They want to work at Abbott: https://t.co/EdzHLbPP9u 
 
Hear from our top engineer on what it means to work here.
 
#LinkedInTopCompanies https://t.co/kVUDi0urL8",en,Abbott
Wed Mar 28 16:07:07 +0000 2018,What’s your concussion IQ? Take a few minutes to learn the facts: https://t.co/Z550kyhVHI  #BrainInjuryAwarenessMonth https://t.co/MKpbiP4vOj,en,Abbott
Tue Mar 27 17:14:12 +0000 2018,"530 million LinkedIn users have spoken: They want to work at Abbott: https://t.co/v7xATUOLoH 
 
Hear from our top engineer on what it means to work here.
 
#LinkedInTopCompanies https://t.co/UQ7evdV0oW",en,Abbott
Tue Mar 27 14:25:04 +0000 2018,"@benny02k Hi Benny, thanks for your note. We are working with all relevant authorities to make the app available in all of our launched FreeStyle Libre countries. Different countries have different requirements and registration timelines. Thanks for your patience.",en,Abbott
Tue Mar 27 14:19:58 +0000 2018,@MsCurlyPops Thanks for sharing! Please let us know what you think of your #FreeStyleLibre system!,en,Abbott
Mon Mar 26 20:09:17 +0000 2018,"530 million LinkedIn users have spoken: They want to work at Abbott: https://t.co/ba64AxAqZQ 
 
Hear from our top engineer on what it means to work here.
 
#LinkedInTopCompanies https://t.co/sHwmAFYWVu",en,Abbott
Mon Mar 26 20:03:05 +0000 2018,"March is #BrainInjuryAwarenessMonth, and we're separating fact from fiction on common concussion myths you may have heard: https://t.co/MJ6QnJo5vU https://t.co/pmD9ELidrw",en,Abbott
Mon Mar 26 19:03:53 +0000 2018,"It’s not just better rice. It’s Ultra Rice. And it’s improving the nutrition of nearly half a million kids, every day. See how: https://t.co/aTcLUGam9r",en,Abbott
Fri Mar 23 20:03:06 +0000 2018,What’s your concussion IQ? Take a few minutes to learn the facts: https://t.co/OiiFoG6ypv  #BrainInjuryAwarenessMonth https://t.co/1f13svaJ2o,en,Abbott
Fri Mar 23 15:11:11 +0000 2018,"We are one of 50 that made LinkedIn’s Top Companies list. 

Here’s why: https://t.co/BtxbTRnd83

#LinkedInTopCompanies https://t.co/dascX9Lp2t",en,Abbott
Fri Mar 23 14:39:22 +0000 2018,RT @FortuneMagazine: Abbott's FreeStyle Libre is a game-changer for people living with diabetes. #ad https://t.co/w3ooT9V0G7 https://t.co/0…,en,Abbott
Fri Mar 23 14:13:05 +0000 2018,"We turned one product setback into a diabetes care revolution. Find out more about our new, life-changing technology here: https://t.co/VwNb377e8X https://t.co/qL01qQQj74",en,Abbott
Thu Mar 22 19:22:03 +0000 2018,"Working with @projectwet, we've helped communities save 11 million gallons of water. #WorldWaterDay #italladdsup https://t.co/SL2djzigox",en,Abbott
Thu Mar 22 18:07:06 +0000 2018,"Billions of actions from more than 530 million people on LinkedIn determine the 50 top companies where people want to work in the U.S. every year. 

We are proud to be one of them: https://t.co/WJOGPyS1aN  #LinkedInTopCompanies https://t.co/5CZOfhQwnz",en,Abbott
Thu Mar 22 16:34:05 +0000 2018,Water is key to a healthy life. We’re using technology and innovation to reduce our water use 30% by 2020: https://t.co/tjLKLurZme #WorldWaterDay #italladdsup https://t.co/TtKethS3OL,en,Abbott
Thu Mar 22 14:33:05 +0000 2018,"March is #BrainInjuryAwarenessMonth, and we're separating fact from fiction on common concussion myths you may have heard: https://t.co/iHSG3Jg4rl https://t.co/hgcbzjg0PU",en,Abbott
Thu Mar 22 14:08:06 +0000 2018,Find out what we’re doing to save water around the world: https://t.co/PqufzWDrGg #WorldWaterDay #italladdsup https://t.co/wAqG1YjEIp,en,Abbott
Thu Mar 22 13:27:04 +0000 2018,"We set out on a mission to find a better solution for the millions of people living with diabetes globally. 

Find out how we did it here: https://t.co/Dg2Rj5iWJ8 https://t.co/QXITBecKTq",en,Abbott
Wed Mar 21 20:34:23 +0000 2018,We're looking forward to sharing results of our #sharedvalue work to empower dairy farmers at the @ChicagoCouncil Global Food Security Symposium tomorrow: https://t.co/fiiWwz3jXn #globalag @GlobalAgDev https://t.co/qE0P4siWoB,en,Abbott
Wed Mar 21 20:07:07 +0000 2018,"We turned one product setback into a diabetes care revolution. Find out more about our new, life-changing technology here: https://t.co/mX2d9Gtw7Z https://t.co/wu8EvdCoxm",en,Abbott
Wed Mar 21 19:03:12 +0000 2018,"We are one of 50 that made LinkedIn’s Top Companies list. 

Here’s why: https://t.co/geGly6BfRz

#LinkedInTopCompanies https://t.co/V4KZPfZ9AI",en,Abbott
Wed Mar 21 18:11:49 +0000 2018,It's #NationalNutritionMonth - join us in DC or tune in to the @ChicagoCouncil Global Food Security Symposium today/tomorrow to discuss the future of food and nutrition. https://t.co/A8f8Cxqh92,en,Abbott
Wed Mar 21 16:00:57 +0000 2018,"We’re announcing our first-quarter 2018 financial results on Wednesday, April 18, 2018: https://t.co/qNHv8OrPv1 https://t.co/Uhn3CBU9Ve",en,Abbott
Wed Mar 21 15:09:57 +0000 2018,"@CaptainKirk1087 Thanks for sharing James! Let us know what you think, and we hope you love the #FreeStyleLibre system as much as we do!",en,Abbott
Wed Mar 21 14:33:01 +0000 2018,"Billions of actions from more than 530 million people on LinkedIn determine the 50 top companies where people want to work in the U.S. every year. 

We are proud to be one of them: https://t.co/lICm41xo5W  #LinkedInTopCompanies https://t.co/3nQGxKf9S3",en,Abbott
Tue Mar 20 21:28:17 +0000 2018,"Our own Jared Watkin discusses the importance of building affordability into product development at the early stages: ""It can’t be an afterthought."" #brainstormhealth",en,Abbott
Tue Mar 20 21:12:10 +0000 2018,"""It’s about connecting things together, making them simple and easy to use, and then delivering them to a lot of people."" - Jeffrey Brewer @BigfootBiomed #brainstormhealth",en,Abbott
Tue Mar 20 20:53:56 +0000 2018,Jared Watkin challenges industry to rethink pricing based on unmet need vs. maximum profit. #brainstormhealth https://t.co/yZfk6eR9eC,en,Abbott
Tue Mar 20 20:27:04 +0000 2018,"Hello from #brainstormhealth! Follow along live as Jared Watkin joins @bigfoot_CEO, @tobycosgroveMD, and Dr. Jiren Liu to talk about medical innovation at half the cost. https://t.co/LrtqoYWsCJ",en,Abbott
Tue Mar 20 18:26:22 +0000 2018,"During our first day at #brainstormhealth we celebrated what great health technology can make possible. More to come today when we talk ""Medical Ingenuity – at Half the Cost.""",en,Abbott
Tue Mar 20 18:23:41 +0000 2018,"We set out on a mission to find a better solution for the millions of people living with diabetes globally. 

Find out how we did it here: https://t.co/uoB3MoK0AI https://t.co/KTRILAJvK8",en,Abbott
Tue Mar 20 15:47:27 +0000 2018,What’s your concussion IQ? Take a few minutes to learn the facts: https://t.co/qxz3DW5xE9 #BrainInjuryAwarenessDay https://t.co/JgRnlc7H59,en,Abbott
Tue Mar 20 13:03:40 +0000 2018,"@safekeeper465 Hi there, thanks for your note and we're very sorry to hear this. We have responded to your other tweet, please send us a DM.",en,Abbott
Tue Mar 20 01:18:15 +0000 2018,"RT @bstormhealth: ""With a new innovation, you’re not always going to get it right the first time. That's what being a scientist is about—lo…",en,Abbott
Sun Mar 18 18:47:24 +0000 2018,@RoCMH We're sorry to see this. Please send us a direct message so we can help. Thanks.,en,Abbott
Sat Mar 17 14:21:17 +0000 2018,"Planning what beverages you’ll drink for #StPatricksDay? Think green… smoothies! Just for the health of it.
 
Get the full recipe here: https://t.co/TXRaHIoyzO https://t.co/No4gsLOFzA",en,Abbott
Fri Mar 16 23:17:17 +0000 2018,"Planning what beverages you’ll drink this #StPatricksDay? Think green… smoothies! Just for the health of it.
 
Get the full recipe here: https://t.co/DyHNqnElDb https://t.co/0OWYhiHeY4",en,Abbott
Fri Mar 16 20:30:13 +0000 2018,"It’s never too late to make your dreams come true. We teamed up with 8 seniors to help them realize theirs. 
https://t.co/Fb1KWfTTFr  #lifetothefullest #NationalNutritionMonth https://t.co/IkIIsXdKhe",en,Abbott
Fri Mar 16 15:40:46 +0000 2018,"Planning what beverages you’ll drink this #StPatricksDay? Think green… smoothies! Just for the health of it.
 
Get the full recipe here: https://t.co/CUyZk3IOk4 https://t.co/bsZVkXD6vU",en,Abbott
Thu Mar 15 16:53:09 +0000 2018,"It’s never too late to make your dreams come true. We teamed up with 8 seniors to help them realize theirs. 
https://t.co/omYfbuPmcK  #lifetothefullest #NationalNutritionMonth https://t.co/HcNkRDIYmi",en,Abbott
Thu Mar 15 16:46:56 +0000 2018,"@ralakhani Hi Rafiq, we intend to make the FreeStyle Libre system available globally however timing depends on regulatory requirements by country.",en,Abbott
Thu Mar 15 16:34:13 +0000 2018,"What’s life-changing technology? FreeStyle Libre system is. And we’re confident diabetes management will never be the same: https://t.co/u2jb2NsED3 #TechKnowledge #liberation #freestylelibre 

Important Safety Information: https://t.co/40Gzq11pIk https://t.co/DijoihqwDw",en,Abbott
Wed Mar 14 17:56:25 +0000 2018,"@CardiacConsult Hi there, instructions for Use state that DAPT for the Abbott GraftMaster stent should be individualized according to patient characteristics. Refer to the IFU for complete instructions.",en,Abbott
Wed Mar 14 16:48:07 +0000 2018,"It’s never too late to make your dreams come true. We teamed up with 8 seniors to help them realize theirs. 
https://t.co/r1taZql4qW  #lifetothefullest #NationalNutritionMonth https://t.co/u21FCHF2w0",en,Abbott
Wed Mar 14 14:33:11 +0000 2018,Life-changing tech — it’s what we do. See how our tech knowledge helps people live their fullest lives every single day: https://t.co/n1MF4CrVrR #TechKnowledge #Neuromodulation https://t.co/4yf0lBHmuS,en,Abbott
Tue Mar 13 19:50:16 +0000 2018,We’re honoring our past by delivering the future. One that’s filled with life-changing technology. Join us to see how: https://t.co/USUm0rdX4N #TechKnowledge #Abbott https://t.co/ARGvcsv2aF,en,Abbott
Tue Mar 13 16:35:45 +0000 2018,@rworshiper Yes of course! Feel free to send us a DM and we can assist you from there as well.,en,Abbott
Tue Mar 13 16:25:12 +0000 2018,"@rworshiper Hi Shraddha, thanks for your note. This is something our Diabetes team can help with. Please let us know what country you live in so we can connect you with your local team.",en,Abbott
Mon Mar 12 17:00:43 +0000 2018,ICYMI: Late-breaking clinical trial on Abbott’s HeartMate 3™ heart pump presented at #ACC18: https://t.co/plIIuGCz8D  #Cardiology #HeartFailure,en,Abbott
Mon Mar 12 15:11:36 +0000 2018,"@Moises_Avilez Hi Moises, thanks for your note. Abbott completed the sale of its vision care business to Johnson &amp; Johnson in February 2017. Please contact J&amp;J with your questions, you can reach them here: https://t.co/l7EpWfMi1J",en,Abbott
Mon Mar 12 13:27:21 +0000 2018,"@TinsleyWarren Hi Tinsley, thanks for your note and you're patience. We're very sorry to hear this. If you'd like, please send us a DM so our team can remove you from the mailing list.",en,Abbott
Mon Mar 12 13:12:59 +0000 2018,"@monaahgnis Hi Mona, thanks for your note and we're very sorry to hear this. Please send us a DM letting us know what country you live in so that we can assist you further.",en,Abbott
Mon Mar 12 00:03:00 +0000 2018,New England Journal of Medicine (@NEJM) publishes new long-term data on Abbott heart pump: https://t.co/UrOx3f3lbw #ACC18 #Cardiology #HeartFailure,en,Abbott
Sun Mar 11 16:01:42 +0000 2018,Late-breaking clinical trial on Abbott’s HeartMate 3™ heart pump presented at #ACC18: https://t.co/pZIYvD8Pzs #Cardiology #HeartFailure,en,Abbott
Sat Mar 10 17:07:20 +0000 2018,"Other babies like Sadie will have access to our latest breakthrough, the world’s smallest mechanical heart valve. It saved Sadie’s life: https://t.co/kE71EVm98s

For U.S. Important Safety Information: https://t.co/zJlkG17WjS https://t.co/qW95kZ6Oun",en,Abbott
Fri Mar 09 20:43:07 +0000 2018,"@martell_sincere Hi there, thanks for your note and we're sorry for the frustration. These are good questions for our Glucerna team. Here is their phone number, please call and they will assist: 877-745-8237",en,Abbott
Fri Mar 09 17:00:09 +0000 2018,"This #NationalNutritionMonth, make small changes that make healthy eating easy: https://t.co/JpTdYPRs1H https://t.co/3afc1qhKMl",en,Abbott
Fri Mar 09 15:19:58 +0000 2018,"@BSVarcho @Abbott_Labs Hi Beth, You may find it helpful to use other products to support adhesion. Everyone’s skin is different. Refer to the FreeStyle Libre system Sensor Adhesion Guide at https://t.co/hQW7FNBfZY for details. If your sensor falls off early, please call us at 1-855-632-8658. Thank you.",en,Abbott
Thu Mar 08 21:47:06 +0000 2018,ICYMI: We made the 2018 @_NAFE_ Top Companies for Executive Women list for the 10th year in a row! https://t.co/oUAjAqkZT7 #InternationalWomensDay https://t.co/S2fAYVp6qa,en,Abbott
Thu Mar 08 20:41:23 +0000 2018,"This #InternationalWomensDay, find out about a #SharedValue dairy farming program that is helping women like Savita in India. #italladdsup https://t.co/EfaAghARKz",en,Abbott
Thu Mar 08 19:39:05 +0000 2018,"We love seeing women at our company thrive. Karmin was a tour guide 34 years ago, but today is DVP of Corporate Relations. Don’t ever challenge her to an Abbott history showdown. She will win. https://t.co/Qby5alfuFS #TopCompanyForWomenExecutives #NAFETop #InternationalWomensDay https://t.co/BFT81EfkGs",en,Abbott
Thu Mar 08 18:41:50 +0000 2018,"RT @chicagotribune: FDA approves world's smallest mechanical heart valve, made by North Chicago company Abbott Laboratories, for use in inf…",en,Abbott
Thu Mar 08 18:10:09 +0000 2018,"Women have been an integral part of our success for 130 years. On #InternationalWomensDay and every day, we’re proud to celebrate our colleagues and all of their breakthrough work. #womeninscience https://t.co/giWtua1mXT",en,Abbott
Thu Mar 08 16:14:23 +0000 2018,"On #InternationalWomensDay, we celebrate women like Savita. Through dairy farming, she empowers her family and community. #italladdsup https://t.co/ubsEXGCpFy",en,Abbott
Thu Mar 08 14:27:13 +0000 2018,"@fahadaziz532 Hi Fahad, thanks for your response. Here is the phone number for our Nutrition team in Pakistan. Please call during regular business hours and they will be able to advise: 92-21-32799018-19",en,Abbott
Thu Mar 08 14:05:16 +0000 2018,"@fahadaziz532 Hi Fahad, thanks for your note. This is a great question for our Nutrition team. Let us know what country you live in and we'd be happy to connect.",en,Abbott
Thu Mar 08 14:01:00 +0000 2018,"@Zimmedl Hi Dennis, thank you so much for the kind words. We're so happy to hear that #FreeStyleLibre is making a positive difference in your wife's life!",en,Abbott
Thu Mar 08 13:58:20 +0000 2018,"What’s life-changing technology? FreeStyle Libre system is. And we’re confident diabetes management will never be the same: https://t.co/d4S2J321OF #TechKnowledge #liberation #freestylelibre

Important Safety Information: https://t.co/RpR3CC17Ux https://t.co/m7eN62Il0Y",en,Abbott
Thu Mar 08 01:04:11 +0000 2018,"What’s life-changing technology? FreeStyle Libre system is. And we’re confident diabetes management will never be the same: https://t.co/Jg9M2bNH6x #TechKnowledge #liberation #freestylelibre

Important Safety Information: https://t.co/zRDnQNM1Qe https://t.co/KdHtr8drwT",en,Abbott
Wed Mar 07 22:24:12 +0000 2018,"What’s life-changing technology? FreeStyle Libre system is. And we’re confident diabetes management will never be the same: https://t.co/oLtRI74q65 #TechKnowledge #liberation #freestylelibre 

Important Safety Information: https://t.co/1hJxWVRsy4 https://t.co/3JAYkbtJ5n",en,Abbott
Wed Mar 07 16:58:33 +0000 2018,"Thanks to our breakthrough pediatric mechanical heart valve, Sadie now has a life ahead of her, a bright one. For U.S. Important Safety Information: https://t.co/nSBTg7g0YP #hearthealth https://t.co/NuqkG6PscL",en,Abbott
Wed Mar 07 15:46:59 +0000 2018,RT @CNBC: Heart monitor links patients to doctors using the one thing they're unlikely to forget: Their phones https://t.co/oSrhmHaWjx,en,Abbott
Tue Mar 06 23:18:08 +0000 2018,"When her parents heard about a breakthrough pediatric mechanical heart valve, baby Sadie’s life changed in an instant: https://t.co/dJzlAoTnlc

For U.S. Important Safety Information: https://t.co/nDPnoA7LIu https://t.co/yB3X2V1Kzf",en,Abbott
Tue Mar 06 16:59:37 +0000 2018,We made the 2018 @_NAFE_ Top Companies for Executive Women list for the 10th year in a row! https://t.co/XuEUXwyTsn #NAFETop https://t.co/gHwdtlsL1w,en,Abbott
Mon Mar 05 23:22:12 +0000 2018,Life-changing tech — it’s what we do. See how our tech knowledge helps people live their fullest lives every single day: https://t.co/X9pVCs8eN8 #TechKnowledge #Neuromodulation https://t.co/UzywMnkFtW,en,Abbott
Mon Mar 05 19:38:11 +0000 2018,Life-changing tech — it’s what we do. See how our tech knowledge helps people live their fullest lives every single day: https://t.co/naK89d4XGG #TechKnowledge #Neuromodulation https://t.co/e3x7kxfQKx,en,Abbott
Mon Mar 05 16:52:11 +0000 2018,Life-changing tech — it’s what we do. See how our tech knowledge helps people live their fullest lives every single day: https://t.co/fnoj1XS1Ri #TechKnowledge #Neuromodulation https://t.co/p6vt1IRmmH,en,Abbott
Sun Mar 04 23:14:41 +0000 2018,"@Kruder77 Hi Kruder, thanks for your note and we're sorry to see this. Please call our Nutrition team in Canada at this phone number and they will be able to assist: 800-699-9948",en,Abbott
Sun Mar 04 22:32:16 +0000 2018,We’re honoring our past by delivering the future. One that’s filled with life-changing technology. Join us to see how: https://t.co/WVV1vVuot7 #TechKnowledge #Abbott https://t.co/3pS8FfJhz6,en,Abbott
Sat Mar 03 19:28:10 +0000 2018,We’re honoring our past by delivering the future. One that’s filled with life-changing technology. Join us to see how: https://t.co/FjdyPybhdb #TechKnowledge #Abbott https://t.co/pyQ4FNANNX,en,Abbott
Fri Mar 02 22:56:11 +0000 2018,We’re honoring our past by delivering the future. One that’s filled with life-changing technology. Join us to see how: https://t.co/IYGEqnfHdY #TechKnowledge #Abbott https://t.co/59zCyOCDo8,en,Abbott
Fri Mar 02 20:01:27 +0000 2018,"@hockeygal4ever Hi Beverly, thanks for your note. This is something that our Glucerna care team can help with. Here is their phone number, please call and they will assist: 877-745-8237",en,Abbott
Fri Mar 02 00:02:06 +0000 2018,Nothing like a behind-the-scenes tour as a welcome to the team! Join Lorena as she learns the ins and outs of how we’re creating life-changing technology every single day. #TechKnowledge #Abbott #lifetothefullest https://t.co/9g3x47Hqi9,en,Abbott
Thu Mar 01 21:30:08 +0000 2018,"@dhowick Hi David, sorry for the confusion. You'll be able to follow Lorena's tour through our video series that is premiering tomorrow! Keep an eye out for the tweets and you'll be able to follow along in the comfort of your own home.",en,Abbott
Thu Mar 01 21:22:57 +0000 2018,"@dhowick Hi David, thanks for your note and your interest in Abbott. Here is the link to our careers webpage where you can find and apply for all of our current opportunities: https://t.co/ztXKOBu3Zb",en,Abbott
Thu Mar 01 18:16:05 +0000 2018,Nothing like a behind-the-scenes tour as a welcome to the team! Join Lorena as she learns the ins and outs of how we’re creating life-changing technology every single day. #TechKnowledge #Abbott #lifetothefullest https://t.co/kXlsfMPIo7,en,Abbott
Thu Mar 01 17:48:05 +0000 2018,Nothing like a behind-the-scenes tour as a welcome to the team! Join Lorena as she learns the ins and outs of how we’re creating life-changing technology every single day. #TechKnowledge #Abbott #lifetothefullest https://t.co/4VTtIupLzT,en,Abbott
Thu Mar 01 15:08:05 +0000 2018,Dr. Mary Rodgers reveals our powerful resource for designing robust #HIV and #Hepatitis diagnostic tests: https://t.co/jUIprz1uQ7 via @staronline @shiowchin,en,Abbott
Wed Feb 28 21:55:59 +0000 2018,"ICYMI: A year after we acquired St. Jude Medical, it’s clear that we’re even better together. Learn why: https://t.co/Tzj14HExyJ https://t.co/7SXyNbELMm",en,Abbott
Wed Feb 28 15:03:07 +0000 2018,ICYMI: Abbott and Surmodics Announce Agreement for Next-Generation Drug-Coated Balloon. https://t.co/Kp5lxCBRyx,en,Abbott
Tue Feb 27 21:11:14 +0000 2018,Four long minutes. That’s how long Bob Quick’s heart stopped beating in 2004 on a day he calls the best of his life. #HeartHealthMonth #HeartSmart https://t.co/i249JfIFqi,en,Abbott
Tue Feb 27 16:34:05 +0000 2018,$ABT agreement with $SRDX enhances our fast-growing endovascular portfolio and gives physicians more options to help patients with peripheral artery disease live better lives. https://t.co/qN3uG5Zkjp,en,Abbott
Tue Feb 27 14:42:31 +0000 2018,#Abbott is collaborating with Surmodics to bring next-generation drug-coated balloon technology to physicians to treat peripheral artery disease. https://t.co/7VChW41oql,en,Abbott
Mon Feb 26 20:36:30 +0000 2018,"This is what a full life looks like. With health, anything is possible. #lifetothefullest #TokyoMarathon #AbbottWMM https://t.co/Y2E2NF60qo",en,Abbott
Sun Feb 25 10:02:25 +0000 2018,"RT @AbbottGlobal: What does it feel like to run one of the Abbott World Marathon Majors?

You know it when you see it.

#lifetothefullest #…",en,Abbott
Sun Feb 25 08:20:09 +0000 2018,"RT @AbbottGlobal: To be a part of something bigger than yourself is truly empowering. And it all starts right here, right now. Tokyo, let’s…",en,Abbott
Sat Feb 24 17:04:04 +0000 2018,#Fluseasonfact: Dehydration is a major culprit when you or your kiddos are trying to beat the flu. Check out our best flu recovery practices via @Momtrends https://t.co/MtqRTilf4l,en,Abbott
Fri Feb 23 17:11:06 +0000 2018,"DYK: Estrogen could help HDL cholesterol level in women, slowing onset of coronary heart disease. https://t.co/tMgTnJfxDf #HeartHealthMonth #HeartSmart https://t.co/lA2LRiY08b",en,Abbott
Fri Feb 23 15:34:04 +0000 2018,"We’ve remained steadfast in our commitment to deliver innovative, life-changing technologies. And now we’re stronger than ever: https://t.co/ctLrN2WUSY https://t.co/74TaGkDAbz",en,Abbott
Fri Feb 23 06:59:52 +0000 2018,Tokyo is ramping up for the first Abbott World Marathon Majors race of 2018. We're ready for a weekend of pushing what’s possible. #lifetothefullest #TokyoMarathon #AbbottWMM https://t.co/ciIwzGS7GX,en,Abbott
Thu Feb 22 21:37:05 +0000 2018,"DYK: Estrogen could help HDL cholesterol level in women, slowing onset of coronary heart disease. https://t.co/8gkoqVjh4G #HeartHealthMonth #HeartSmart https://t.co/p9l1ZDdUDf",en,Abbott
Thu Feb 22 14:34:06 +0000 2018,"A year after we acquired St. Jude Medical, it’s clear that we’re even better together. Learn why: https://t.co/iZVhISK1CV https://t.co/dMWHx1apj7",en,Abbott
Thu Feb 22 13:14:42 +0000 2018,"@Creagancarach HI Mairi, thanks for your note and we're sorry to hear this. Please send us a DM letting us know what country you live in so that we can assist.",en,Abbott
Wed Feb 21 22:45:05 +0000 2018,"Last year, we grew our leadership in cardiovascular, with No. 1 and No. 2 positions in nearly every segment of the more than $30 billion market. Here’s a little background on how: https://t.co/BI3wsSatir https://t.co/E79WFSSEJY",en,Abbott
Wed Feb 21 21:03:05 +0000 2018,Setting your child on a healthy path early in life can help them avoid cardiovascular disease and other issues as an adult: https://t.co/zJxeqbhmAU #HeartHealthMonth #HeartSmart https://t.co/jR71h8krqV,en,Abbott
Wed Feb 21 20:32:21 +0000 2018,"A year after the biggest acquisition in company history, it’s clear we’re even better together. Here’s why: https://t.co/WZrWUqiAtf https://t.co/fbvfLlCNj4",en,Abbott
Tue Feb 20 18:46:13 +0000 2018,"@BrocsBookcase Hi there, thanks for your note and we're sorry for the frustration. This is something our Diabetes team in the UK can help with. Here is their phone number, please call and they'll assist: 01628 774620",en,Abbott
Tue Feb 20 18:39:38 +0000 2018,Setting your child on a healthy path early in life can help them avoid cardiovascular disease and other issues as an adult: https://t.co/RODCDHZhe5 #HeartHealthMonth #HeartSmart https://t.co/7XROh5zJBg,en,Abbott
Mon Feb 19 20:02:05 +0000 2018,"How #HIV evades detection: our scientist, Dr. Mary Rodgers, talks to @shiowchin on why new viral strains are just a plane ride away and what we’re doing to help stay ahead: https://t.co/mubeSq434O via @staronline",en,Abbott
Mon Feb 19 14:30:58 +0000 2018,"@FrenettMarco Hi Frenett, this is a question for our Nutrition team. Here is their phone number, please call and they'll advise: (800) 551-5838",en,Abbott
