created_at,full_text,lang,user_name
Thu Dec 19 20:25:14 +0000 2019,A new federal rule threatens progress made by states to combat #ClimateChange and reduce air pollution. How? By artificially inflating the cost of clean energy in 13 states &amp; D.C. and requiring customers to pay billions more in higher electricity bills. https://t.co/EE5HiaYhjZ,en,Exelon Corporation
Thu Dec 19 18:03:30 +0000 2019,"What are you passionate about? Our employees are deeply involved in their communities. Shanna, an @ExelonGen systems engineer, spends her time educating others on the benefits of #nuclear energy. https://t.co/u3ljDVQIdd",en,Exelon Corporation
Wed Dec 18 16:02:23 +0000 2019,"We need the earth and today, it needs us. We are grateful for employees dedicated to causes that combat #climatechange. Siobhan, an @ExelonGen chemistry manager, has been a passionate advocate throughout her career. #Nuclear https://t.co/VIrj3hHIl2",en,Exelon Corporation
Tue Dec 17 20:32:10 +0000 2019,"From high school valedictorian, to college graduate, to a career as an @ExelonGen chemistry manager. Meet Amber and see how her academic background helps power the future. #Nuclear https://t.co/pZVR0HTwP6",en,Exelon Corporation
Mon Dec 16 14:18:13 +0000 2019,"RT @PepcoConnect: Let it glow with Pepco!🌟Enjoy tasty winter treats, bright lights, and more during #DCZooLights at @NationalZoo. Make memo…",en,Exelon Corporation
Fri Dec 13 15:31:52 +0000 2019,"RT @NEI: At Calvert Cliffs Nuclear Power Plant in Maryland, a new risk-informed program ensures plant workers can prioritize both safety an…",en,Exelon Corporation
Thu Dec 12 18:52:03 +0000 2019,Thank you to Melissa and everyone else who helped make #ExelonSTEMyouth possible in 2019. These academies are developing tomorrow's leaders! https://t.co/Qhlx9aTA9j,en,Exelon Corporation
Wed Dec 11 22:14:04 +0000 2019,Way to go @MyBGE. We couldn't be prouder! https://t.co/ATjCtNiR2G,en,Exelon Corporation
Wed Dec 11 19:55:08 +0000 2019,RT @ThirdWayEnergy: Broad agreement from @UCSUSA @The_UWUA and @Exelon that we need to use every zero carbon resource to eliminate climate…,en,Exelon Corporation
Wed Dec 11 16:37:16 +0000 2019,"Congratulations to @TIME’s Person of the Year, @GretaThunberg. Her fight against #ClimateChange sends a powerful message about the importance of pushing for meaningful change to protect our planet. https://t.co/K5G9XjaaRG",en,Exelon Corporation
Wed Dec 11 15:34:30 +0000 2019,"RT @ExelonGen: #Nuclear energy helps to power our communities with reliable zero-carbon electricity, even in extreme weather conditions. ht…",en,Exelon Corporation
Fri Dec 06 21:00:50 +0000 2019,"Our #Exelon customers inspire us every day, and thanks to the collaboration with ""smart community"" Bronzeville, IL, we’re moving to a greener, cleaner future. Watch our story, via @nowthisnews . #PowerForward https://t.co/auRIUa8PbR",en,Exelon Corporation
Fri Dec 06 15:27:16 +0000 2019,"Congratulations to Maggie FitzPatrick; @Exelon Senior Vice President for Corporate Affairs, Philanthropy and Customer Engagement; on being named to the 2019 @WBJonline’s C-Suite Award Class and to @PRNews’ 2019 Top Women in PR honoree list. https://t.co/6mUDuDbjKf https://t.co/pICtFZdR2X",en,Exelon Corporation
Thu Dec 05 18:00:19 +0000 2019,"Congrats to Erica Tsypin, an entrepreneur named in the energy category of the @Forbes Under 30 List for 2020. Erika is a cofounder of Steer, an Exelon venture that is accelerating the adoption of electric vehicles through month-to-month subscriptions. https://t.co/CSKQbrALTG",en,Exelon Corporation
Wed Dec 04 21:44:04 +0000 2019,"We're pleased to announce that Calvin G. Butler Jr. has been appointed senior executive vice president of @Exelon &amp; CEO of Exelon Utilities. Carim Khouzami will replace Butler as CEO of @MyBGE . Learn more about Calvin, Carim and their new roles here: https://t.co/I8Eot8eaMU https://t.co/eauH0bgIsQ",en,Exelon Corporation
Tue Dec 03 19:35:11 +0000 2019,Share some of the ways you contribute on #GivingTuesday ~ here's how our employees made a difference in others' lives this past November. https://t.co/KlqYC2O2Lh,en,Exelon Corporation
Tue Dec 03 15:16:09 +0000 2019,You don't want to miss #PepcoZooLights at the @NationalZoo! https://t.co/Ll4IT0rVBB,en,Exelon Corporation
Mon Dec 02 16:53:16 +0000 2019,RT @ComEd: Come visit us at @lincolnparkzoo and get festive under the glow of over 2.5 million #HolidayLights! https://t.co/2hGgMEjywt,en,Exelon Corporation
Thu Nov 28 15:30:10 +0000 2019,What are you thankful for? We're thankful for the customers and communities we serve and for our employees who work all year long to power a brighter and cleaner future. #HappyThanksgiving from all of us at Exelon! https://t.co/MkrBud7EII,en,Exelon Corporation
Tue Nov 26 17:28:49 +0000 2019,@ladydi1279 It sure was! And the moderation was on point! :),en,Exelon Corporation
Tue Nov 26 16:38:22 +0000 2019,This sale will help preserve NJ's largest concentration of endangered species and reduce the harmful effects of climate change. https://t.co/nyBmd0cPEs,en,Exelon Corporation
Mon Nov 25 19:28:01 +0000 2019,"RT @cleanjobspa: Do you know where America’s clean carbon-free energy comes from?  

Nuclear️ 55%  
Hydro 20%  
Wind 19%  
Solar and Geothe…",en,Exelon Corporation
Mon Nov 25 18:24:01 +0000 2019,"RT @ACElecConnect: As a part of our commitment to our communities &amp; to protecting and preserving the environment, today we agreed to sell o…",en,Exelon Corporation
Mon Nov 25 16:05:16 +0000 2019,"Neena Hemmady, VP Enterprise Risk Mgmt, Susan Korn, @ExelonGen VP Nuclear Project Mgmt, Mike Koehler, SVP CIO &amp; moderator Diana Sharpe, @ComEd VP Economic Dev, emphasize, ""Know what success looks like when you take on that next challenge,"" to Network of Exelon Women participants. https://t.co/aC9YuByPCD",en,Exelon Corporation
Fri Nov 22 16:00:29 +0000 2019,RT @ConstellationEG: Giving back to the communities where we work and live is ingrained in our culture. Look no further than our annual bui…,en,Exelon Corporation
Thu Nov 21 19:45:07 +0000 2019,"As cities work to reduce air pollution and greenhouse gas #emissions, electric transportation is increasingly viewed as a key part of the solution. Read how Steer is making it easy for consumers switch to an #electricvehicle or hybrid: https://t.co/G5Tym3GhQy #EV #steerwithus https://t.co/eEf7VbHaUH",en,Exelon Corporation
Thu Nov 21 18:11:09 +0000 2019,"RT @DelmarvaConnect: Today, we are launching the Sustainable Communities Grant Program to fund open space, #environmental, and #resiliency…",en,Exelon Corporation
Thu Nov 21 15:11:37 +0000 2019,"#TBT 5,500+ employees attended the Innovation Expo in person or through viewing parties &amp; 93% learned something they could apply to their role. Innovation enables us to embrace change to build a better tomorrow. It's who we are and the foundation of everything we do. #ExelonIdeas https://t.co/cWzs1NMov6",en,Exelon Corporation
Wed Nov 20 20:54:59 +0000 2019,@AaronKoos @MyBGE Wise words!,en,Exelon Corporation
Tue Nov 19 21:29:47 +0000 2019,@ConstellationEG @ExelonGen Tomorrow's leaders!,en,Exelon Corporation
Tue Nov 19 21:29:10 +0000 2019,"RT @ConstellationEG: We’re awarding $460,000 in Energy to Educate grants to support 18 hands-on STEM projects reaching 19,000+ students gra…",en,Exelon Corporation
Mon Nov 18 21:08:35 +0000 2019,Watch the full discussion on consumers pushing companies to address #ClimateChange and the importance of innovative solutions on #GettingToZero with Kenneth W. Cornew of @ExelonGen and @BobPerch  of@C2ES_org https://t.co/gFvHPEWA93,en,Exelon Corporation
Mon Nov 18 21:06:34 +0000 2019,"Exelon is acting to advance clean energy. “93% of our customers acknowledge that climate change is a real problem. 60% said we need to do something now &amp; you as our energy provider need to take action,” @ExelonGen CEO Ken Cornew recently at #GettingToZero by @C2ES_org https://t.co/5AcHAec22N",en,Exelon Corporation
Fri Nov 15 19:40:51 +0000 2019,"We’re honored to be #27 in @Forbes #Just100 list, “Companies doing right by America.” We couldn’t agree more that ‘shareholder returns mean nothing if a company's workers, customers, communities and environments aren't considered, too.’ https://t.co/jDbYMpBxEW",en,Exelon Corporation
Thu Nov 14 18:41:50 +0000 2019,@GenePark https://t.co/fQb3YjhjfG,und,Exelon Corporation
Thu Nov 14 14:00:05 +0000 2019,RT @ExelonGen: Not ready for the super cold weather yet? Our Illinois #nuclear plants are! Ten of our 11 reactors operated at full power ea…,en,Exelon Corporation
Thu Nov 14 00:56:02 +0000 2019,"RT @ComEd: Congratulations to Erica Borggren, our VP of customer solutions, for being named as one of Chicago’s ‘40 Under 40!’
https://t.co…",en,Exelon Corporation
Tue Nov 12 22:19:56 +0000 2019,"Tomorrow morning at 9:30 am EST, tune-in for a discussion at @C2ES_org about how we can reduce carbon emissions with @ExelonGen’s Kenneth Cornew &amp; @BobPerch at https://t.co/scVOVzRERn #ClimateChange #GettingToZero https://t.co/DKNO5JpNcQ",en,Exelon Corporation
Tue Nov 12 20:34:26 +0000 2019,"Our core values are built on a foundation of trust, and that’s why we support all Exelon employees regardless of gender, race or sexual orientation. When our employees can be their authentic selves, we thrive. https://t.co/4SeFzQ5oZT",en,Exelon Corporation
Tue Nov 12 15:15:55 +0000 2019,"RT @DelmarvaConnect: Our natural gas storage tank has been repainted with an inspiring new mural by John Dickinson High School student, Sam…",en,Exelon Corporation
Mon Nov 11 18:28:10 +0000 2019,"Those who serve in the military embody the leadership, teamwork, integrity &amp; commitment to excellence we seek. We are proud that almost 3,500 employees (more than 10% of our workforce) have served or are currently serving in the armed forces. #VeteransDay https://t.co/LAanmwXcdC",en,Exelon Corporation
Mon Nov 11 17:15:23 +0000 2019,"RT @MyBGE: BGE salutes America’s veterans, including more than 600 vets who work with us. To honor your service, BGE sponsors the training…",en,Exelon Corporation
Mon Nov 11 16:30:30 +0000 2019,RT @ExelonGen: About 1/3 of our workforce are veterans. We’re proud to support them and all who have served. Joe Enman served 8 years in th…,en,Exelon Corporation
Mon Nov 11 15:36:19 +0000 2019,"Amy Best, Exelon SVP / Chief HR Officer, &amp; Ann Randazzo, CEWD Executive Director @GetIntoEnergy share in Electric Light&amp;Power that those who serve in the military exemplify the leadership &amp;integrity the energy industry needs. Read more from @powergridintl: https://t.co/u6c8eZcPfH",en,Exelon Corporation
Fri Nov 08 19:50:03 +0000 2019,"As part of the @chicagobiennial, @Exelon sponsored the “Confronting Climate Change"" forum earlier this week. Panelists discussed a multi-disciplinary approach to addressing #ClimateChange through architecture, urban planning, engineering and avenues to engage communities. https://t.co/zfPwylSUAz",en,Exelon Corporation
Fri Nov 08 15:37:52 +0000 2019,"RT @PECOconnect: “I always tell young women, if you have a dream, go after it. You can do things just as good as men, sometimes even better…",en,Exelon Corporation
Fri Nov 08 15:29:30 +0000 2019,A trailblazer for today's working women and living legend. #RosietheRiveter https://t.co/B6fksZ7xzZ,en,Exelon Corporation
Fri Nov 08 15:25:52 +0000 2019,@PECOconnect So amazing. Mae Krier is a living legend!,en,Exelon Corporation
Thu Nov 07 22:04:27 +0000 2019,Learn more about the new @Exelon &amp; Exelon Foundation philanthropic initiative to stem the impact of #ClimateChange. #PowerForward https://t.co/98lErz3Qve,en,Exelon Corporation
Thu Nov 07 15:25:03 +0000 2019,RT @PECOconnect: See how we're working with @Exelon and @EPRINews on an innovative pilot project to test the use of drones to help protect…,en,Exelon Corporation
Wed Nov 06 21:20:38 +0000 2019,Hear how Constellation is supporting the development of the @NatlAquarium's expanded Waterfront Campus. https://t.co/OttXvYPU3L,en,Exelon Corporation
Wed Nov 06 21:17:41 +0000 2019,"RT @ConstellationEG: We're proud to support @NatlAquarium's Waterfront Campus, a network of floating wetlands that will improve water quali…",en,Exelon Corporation
Wed Nov 06 20:20:04 +0000 2019,"Transportation is the largest source of global greenhouse gas emissions, accounting for 28% of all emissions. Ken Cornew, President and CEO of @ExelonGen, shares how his team is working to advance electrification of the transportation sector. https://t.co/67yVX1rvAx",en,Exelon Corporation
Wed Nov 06 14:24:16 +0000 2019,"RT @NEI: “Without action to provide more support for nuclear power, global efforts to transition to a cleaner energy system will become dra…",en,Exelon Corporation
Tue Nov 05 17:06:38 +0000 2019,In Chicago tonight? There’s still time to attend the @chicagobiennial panel tonight on the relationship between architecture and the environment. The event is FREE. Click to learn more and RSVP: https://t.co/k7Pv80dOM8,en,Exelon Corporation
Fri Nov 01 21:36:01 +0000 2019,RT @ExelonGen: Exelon Generation CEO Ken Cornew talks about why he drives an #electricvehicle and how our company is investing in programs…,en,Exelon Corporation
Fri Nov 01 20:21:19 +0000 2019,"Don’t forget to RSVP for the ""Confronting #ClimateChange"" panel discussion on Tuesday. https://t.co/YGW5b3FqLh",en,Exelon Corporation
Fri Nov 01 14:30:05 +0000 2019,"Our employees are as diverse as the communities we serve, but we also choose to work with professional partners and suppliers with their own diverse workforce. https://t.co/7l5kij3Sd8",en,Exelon Corporation
Fri Nov 01 13:49:04 +0000 2019,Exelon (Nasdaq: EXC) declares a regular quarterly #dividend of $0.3625 per share. See dividend payout timing: https://t.co/zHiJgCNNLY #ExelonEarnings,en,Exelon Corporation
Thu Oct 31 14:15:06 +0000 2019,PA @GovernorTomWolf issued an executive order beginning the process for PA to join the Regional Greenhouse Gas Initiative (RGGI) allowing PA to meet its climate goals while helping to preserve the state's zero-carbon nuclear plants. https://t.co/rsj7L3VtRU #ExelonEarnings,en,Exelon Corporation
Thu Oct 31 14:14:05 +0000 2019,".@ExelonGen's historic settlement agreement with the State of MD will protect the long-term health of the Chesapeake Bay and preserve MD’s largest source of renewable energy, the @ConowingoDam. https://t.co/CEprS4sc3J #ExelonEarnings https://t.co/A9uGq6Ay8E",en,Exelon Corporation
Thu Oct 31 14:13:10 +0000 2019,Combating climate change is going to require new thinking. That’s why the Exelon Foundation and Exelon announced the $20 million Climate Change Investment Initiative to support startups working on innovative tech solutions. https://t.co/PStP2uSUUo #ExelonEarnings https://t.co/EsthzmOHDH,en,Exelon Corporation
Thu Oct 31 14:12:09 +0000 2019,This past quarter we were named to the Dow Jones Sustainability Index for the 14th straight year and of all North American companies - in all industries - we are in the top 20%. https://t.co/781LlRjGTL #ExelonEarnings,en,Exelon Corporation
Thu Oct 31 13:45:07 +0000 2019,Join us at 9:00am CT for our Q3 earnings call: https://t.co/TGEUYbGOhT #ExelonEarnings https://t.co/j4R4YMZemj,en,Exelon Corporation
Thu Oct 31 11:05:06 +0000 2019,"Just released - Q3 2019 results (Nasdaq: EXC). We continue to fund grid modernization &amp; resiliency efforts to provide clean, affordable &amp; reliable power for customers. Learn more about #ExelonEarnings: https://t.co/IiZkSdeE21 https://t.co/pVsgB3RjTF",en,Exelon Corporation
Wed Oct 30 21:51:27 +0000 2019,"RT @PECOconnect: At PECO, we are committed to advancing the communities we serve, including engaging local diverse suppliers to support our…",en,Exelon Corporation
Wed Oct 30 20:05:51 +0000 2019,"Next Tuesday in Chicago, learn about the relationship between architecture &amp; the environment at ""Confronting #ClimateChange."" The @chicagobiennial panel discussion will address the relationship between architecture &amp; the environment. 
It is free to attend https://t.co/ZUFKRzrmtQ https://t.co/vOG2ngcN2R",en,Exelon Corporation
Wed Oct 30 15:30:27 +0000 2019,"Diversity powers our success. At our annual Diversity and Inclusion Partnership Forum, we honor our professional partners who embrace this vision with their own diverse workforce. See why this is an important part of what we do. https://t.co/8YvEtlB06w",en,Exelon Corporation
Wed Oct 30 14:07:22 +0000 2019,@PepcoConnect Our commitment to diversity and inclusion extends beyond our immediate workforce. We also choose to do business with minority-owned companies.,en,Exelon Corporation
Tue Oct 29 18:00:45 +0000 2019,RT @ExelonGen: Today we reached an historic settlement agreement with the State of MD that will protect the long-term health of the Chesape…,en,Exelon Corporation
Tue Oct 29 17:00:24 +0000 2019,"In 2018, Atlantic City Electric spent $71 million partnering with diverse, local suppliers. https://t.co/hx0fgxQGFa",en,Exelon Corporation
Tue Oct 29 14:47:53 +0000 2019,@MyBGE We believe in partnering with companies that are as diverse as the communities we serve.,en,Exelon Corporation
Mon Oct 28 13:31:39 +0000 2019,"Diverse &amp; inclusive teams that allow different perspectives are more successful. At our D&amp;I Partnership Forum, we honor firms we work with who live into this vision through their own workforce. See why we're committed to D&amp;I and expect it of the companies with whom we partner. https://t.co/51OO9fjgv2",en,Exelon Corporation
Mon Oct 28 01:47:25 +0000 2019,"RT @wmata: Reminder! Metro will run late service until 1AM tonight, sponsored by Pepco. Trains even later from Navy Yard if needed (“flex”…",en,Exelon Corporation
Fri Oct 25 22:04:39 +0000 2019,"RT @wmata: REMINDER: Metro runs until 1AM Friday &amp; Saturday with good service on all lines (no track work). If Game 5 needed, #wmata will r…",en,Exelon Corporation
Fri Oct 25 16:02:19 +0000 2019,Such a great way to spend your day. Join us tomorrow! https://t.co/E49lueFYiU,en,Exelon Corporation
Fri Oct 25 14:45:33 +0000 2019,"Steer, an Exelon venture in D.C., is accelerating the adoption of electric vehicles w/ flexible month-to-month subscriptions on all-electric &amp; hybrid vehicles. In 5 months, members have offset approx 40 metric tons of carbon. Here's how: https://t.co/BYCj29syqk #steerwithus https://t.co/V5193jLoZs",en,Exelon Corporation
Fri Oct 25 13:18:24 +0000 2019,Today is the deadline to apply for an award from the new $20 million Climate Change Investment Initiative (by Exelon Foundation &amp; Corp)! Are you working on new technology for a cleaner future? We can help turn your ideas into #ClimateChange solutions. https://t.co/i64QiiHZlf,en,Exelon Corporation
Thu Oct 24 22:23:42 +0000 2019,#STAYINTHEFIGHT https://t.co/ywOizLiwj9,und,Exelon Corporation
Wed Oct 23 21:17:34 +0000 2019,@SenatorBraun @ChrisCoons Learn more about the new Senate Climate Solutions Caucus: https://t.co/JMwKGnqxLu  #ClimateChange,en,Exelon Corporation
Wed Oct 23 18:11:59 +0000 2019,"Thank you @SenatorBraun and @ChrisCoons for launching a Senate Climate Solutions Caucus. #ClimateChange affects us all and Sen. Braun's call to ""take the politics out of this important issue"" is a great first step.",en,Exelon Corporation
Wed Oct 23 17:00:24 +0000 2019,#ClimateChange is in need of innovative solutions. That’s why we announced the $20 million Climate Change Investment Initiative (by Exelon Foundation &amp; Corp) to support startups working on new tech to address climate change. Learn more &amp; apply by 10/25. https://t.co/aybvY63lEg,en,Exelon Corporation
Tue Oct 22 18:45:05 +0000 2019,"The U.S. infrastructure industry (incl energy) is growing fast. Many jobs remain unfilled, but D.C.'s @MayorBowser, along w/ Exelon &amp; @PepcoConnect, are making sure everyone has a chance to succeed. Watch more in our csr: https://t.co/UmVb2U465q #PoweringCommunities https://t.co/0ruhjVXrQj",en,Exelon Corporation
Fri Oct 18 19:00:27 +0000 2019,"“We felt we, as a company, needed to make a stand and make it clear that we support our employees. This is part of how we’re embracing the future.” ~ Neena Hemmady, Vice President Enterprise Risk Management at #OESummit https://t.co/NB66eL6tWS",en,Exelon Corporation
Fri Oct 18 17:20:12 +0000 2019,"“If, as a leader, I can’t create an environment of inclusive diversity and maximizing talent, I’m not doing my job.” ~ Kristopher Keys, Vice President &amp; Deputy General Counsel, Chief Compliance and Ethics Officer, Exelon Corporation at the #OESummit https://t.co/QcO9cJQiYs",en,Exelon Corporation
Fri Oct 18 16:10:04 +0000 2019,"Inspiring tomorrow's workforce! @VonSteubenMSC &amp; @illinoistech hosted the 1st @VEXRobotics competition in Chicago last year and through our @Opt4STEM partnership, our employees served as coaches, refs &amp; judges. Learn more: https://t.co/NWwkmt2604 #PoweringCommunities https://t.co/h6zNEGJhVL",en,Exelon Corporation
Fri Oct 18 02:48:08 +0000 2019,"6 things we like

✨Safety 
✨Innovating for our customers
✨Our communities
✨Reliable, clean and affordable energy
✨Our incredible employees
✨Our family of companies: @ACElecConnect  @MyBGE  @ComEd @ConstellationEG @ExelonGen @DelmarvaConnect @PECOconnect @PepcoConnect",en,Exelon Corporation
Fri Oct 18 02:35:05 +0000 2019,"""The things we stake bold actions on align with our stakeholders' expectations. For us, that’s #ClimateChange."" -@fitzmag @PRWeekUS #PRDecoded today. The Exelon Foundation Climate Change Investment Initiative represents our purpose in action. Learn more at https://t.co/zKmx0DvRxU https://t.co/Zkrip37fNI",en,Exelon Corporation
Thu Oct 17 22:00:12 +0000 2019,"How do leading companies make purpose a central part of their business and community strategies? SVP of Corporate Affairs, Philanthropy and Customer Engagement @fitzmag joins @aflac's @CHBlades, @GM's Tony Cervone and @PRWeekUS at #PRDecoded to discuss. https://t.co/BH9miSSrlt https://t.co/ytOL62E2Ov",en,Exelon Corporation
Wed Oct 16 21:54:52 +0000 2019,"With other clean energy companies, @Exelon stands with the environmental groups calling on businesses to adopt a science-based climate policy agenda that is aligned with the recommendations of the @IPCC_CH. Learn more: https://t.co/j2vXDpSpAl #TimeisNow #ClimateChange",en,Exelon Corporation
Wed Oct 16 17:40:35 +0000 2019,"RT @MeganClarkPHI: “I am proud to be an Ally. Thank you for including me. Together, we are all stronger.” -Bill Von Hoene @Exelon #OESummit…",en,Exelon Corporation
Wed Oct 16 15:50:30 +0000 2019,We applaud @MDEnvironment committing to 100 percent clean energy and advancing Maryland’s goal to achieve a 40 percent reduction in emissions by 2030. https://t.co/B2VxpLu5ah #climatechange #powerforward,en,Exelon Corporation
Wed Oct 16 14:45:04 +0000 2019,The electric power grid is over a century old and the most complex machine ever designed and built — yet how people use it is changing. See our corporate sustainability report to learn how we’re creating the electric system the future needs. https://t.co/sY7mnHgFME https://t.co/RhcDADaX34,en,Exelon Corporation
Tue Oct 15 16:50:08 +0000 2019,"According to the @ENERGY Dept, the cost of going solar has dropped every year since 2009. We believe everyone should have access to clean energy. See how we’re making it easier for individuals &amp; businesses to go solar in our corporate sustainability rpt. https://t.co/I6nhEaQlWl https://t.co/0WOXMhEc6z",en,Exelon Corporation
Tue Oct 15 16:00:36 +0000 2019,"Our Innovation Expo was a complete success. The speakers, panels and employee displays encouraged attendees across the organization to consider ways to bring fresh thinking to their own #ExelonIdeas. Read more from @TechnicallyDC. https://t.co/WYQjcFF4jW",en,Exelon Corporation
Mon Oct 14 17:24:49 +0000 2019,"Thank you! We're excited to be on @Nasdaq with others focused on a cleaner, brighter future and combating #ClimateChange. Our Climate Change Investment Initiative will invest $20 million in startups innovating to stem the impact of climate change. #PowerForward https://t.co/qD6BLLovhw",en,Exelon Corporation
Mon Oct 14 14:00:30 +0000 2019,"We’re proud to be a sponsor for Out &amp; Equal, the largest LGBTQ workplace summit in the U.S. for the second year in a row. At Exelon, bringing our authentic selves to work is core to who we are as a team. https://t.co/GlhOJhXRTK",en,Exelon Corporation
Fri Oct 11 22:22:05 +0000 2019,"A big thank you on this International #DayOfTheGirl to @smithmegan, the first female U.S. Chief Technology Officer, for encouraging our STEM Innovation Leadership Academy participants at the 2019 Innovation Expo. #ExelonIdeas #ExelonSTEMyouth https://t.co/IicXUhwIr6",en,Exelon Corporation
Fri Oct 11 18:58:38 +0000 2019,"A carbon tax is ‘single most powerful’ way to combat #ClimateChange according to an @IMFNews report. If the carbon tax plan proposed by the @TheCLCouncil (@exelon is a founding member) were implemented in 2021, there would be a 50% CO2 reduction by 2035. https://t.co/nhfoHx0jYA",en,Exelon Corporation
Fri Oct 11 15:00:09 +0000 2019,"For meaningful change to happen in CO2 emissions reduction, the energy industry must curb its own emissions &amp; lead efforts to eliminate carbon from all sectors of our economy. CEO Chris Crane explains why. Read more in our corporate sustainability report. https://t.co/6BHYEFVY7k https://t.co/UFeZc1EuVC",en,Exelon Corporation
Thu Oct 10 20:44:05 +0000 2019,Such an inspiring day with many innovative ideas being shared but also generating so many more. We can’t wait hear about the new #ExelonIdeas this day has powered. https://t.co/Khi04MXjek,en,Exelon Corporation
