created_at,full_text,lang,user_name
Mon Nov 12 16:05:12 +0000 2018,"""Veterans make great employees in... management positions within Exelon."" ~ Anne Pramaggiore, Senior Executive VP &amp; CEO of Exelon Utilities shared at the recent @EnergyVeterans' CEO panel #VeteransInEnergy #VeteransDay https://t.co/4rw8O57PgJ",en,Exelon Corporation
Mon Nov 12 14:05:06 +0000 2018,"We are proud to be named a Top 50 Company for Diversity &amp; Top 5 Company for Veterans by @DiversityInc! Our focus on #diversity and inclusion is reflected in our efforts to hire, retain &amp; promote employees from a variety of backgrounds. #VeteransDay https://t.co/U6qz5o1d6X https://t.co/cGJHdSrSx6",en,Exelon Corporation
Sun Nov 11 21:36:01 +0000 2018,"RT @ExelonGen: This #VeteransDay, we honor and celebrate the brave women and men who have served in our armed forces. Exelon Generation is…",en,Exelon Corporation
Sun Nov 11 21:35:50 +0000 2018,RT @PepcoConnect: Our colleagues' dedication to our nation makes us proud this veterans day and every day. We proudly support our country's…,en,Exelon Corporation
Sun Nov 11 21:35:40 +0000 2018,"RT @MyBGE: Taking time to say ""Thank You"" to those who have served our country and those who continue to fight for our freedom. Happy Veter…",en,Exelon Corporation
Sun Nov 11 21:35:30 +0000 2018,"RT @PECOconnect: This #VeteransDay and every day, PECO salutes all who have served in the United States Armed Forces at home and abroad. Ea…",en,Exelon Corporation
Sun Nov 11 21:35:21 +0000 2018,RT @ComEd: We’re proud to employ veterans to create a more diverse and inclusive culture! One of the best ways to honor those who have serv…,en,Exelon Corporation
Sun Nov 11 16:28:45 +0000 2018,RT @brentgleeson: @Exelon Thank you for including me in your Veterans Day program this week at the Clinton Power Station! You have an amazi…,en,Exelon Corporation
Fri Nov 09 17:07:26 +0000 2018,"RT @Edison_Electric: What do @SharkTankABC's @TheSharkDaymond and @Exelon have in common?

@TheSharkDaymond recently participated on panel…",en,Exelon Corporation
Fri Nov 09 15:17:54 +0000 2018,"RT @ConstellationEG: In advance of Veterans Day, honoring our employees with a pinning tradition that goes back more than a decade. To the…",en,Exelon Corporation
Fri Nov 09 15:15:06 +0000 2018,"#ICYMI: Powering our communities is just the beginning. It's our responsibility to improve the quality of life for people in the communities where we live, work &amp; serve. Thanks @ChicagolandCmbr for bestowing Chris Crane w/ the Daniel H. Burnham Award for Distinguished Leadership. https://t.co/A4T2Haxbpr",en,Exelon Corporation
Fri Nov 09 02:58:56 +0000 2018,"RT @ChicagolandCmbr: The 27th Daniel Burnham Award Honoree, Chris Crane, President &amp; CEO of @Exelon. https://t.co/aPDaGYn4C8",en,Exelon Corporation
Fri Nov 09 02:34:07 +0000 2018,"Powering our communities is just the beginning. It's our responsibility to improve the quality of life for people in the communities where we live, work &amp; serve. Thank you @ChicagolandCmbr for bestowing Chris Crane w/ the 27th Daniel H. Burnham Award for Distinguished Leadership. https://t.co/zgwpmaEvwz",en,Exelon Corporation
Fri Nov 09 02:25:59 +0000 2018,"Are you @HeForShe? This past summer, Exelon conducted two successful week-long sessions of our #HeForShe #STEM Innovation Leadership Academy for teen girls, aimed at advancing #GenderEquality and developing future leaders in STEM-related fields. https://t.co/xQ9p97MpzZ",en,Exelon Corporation
Fri Nov 09 02:21:07 +0000 2018,"RT @ChicagolandCmbr: Burnham Honoree Chris Crane watches Saniya Drake and Cynthia Rivas, #STEM students from CPS’s Lindblom Math &amp; Science…",en,Exelon Corporation
Fri Nov 09 02:15:05 +0000 2018,"""Since the [Opt for STEM] program’s inception three years ago, 87% of Von Steuben students have participated in at least one Opt for #STEM activity,"" explains Exelon CEO &amp; 2018 Daniel H. Burnham Award recipient, Chris Crane, at the @ChicagolandCmbr. #Chicago https://t.co/egqsBVgLCK",en,Exelon Corporation
Fri Nov 09 02:14:04 +0000 2018,"""Energizing Student Potential is a #STEM-focused program for students... that provides the tools &amp; resources necessary for teachers &amp; students to explore energy technology,"" Exelon CEO &amp; 2018 Daniel H. Burnham Award recipient, Chris Crane, shares at the @ChicagolandCmbr. https://t.co/44H4bDohiv",en,Exelon Corporation
Fri Nov 09 02:12:04 +0000 2018,"""With @WITSchicago, Exelon employees provide weekly tutoring to 35 students in 3rd-5th grade from the Lozano School. We started that work in 2012. Today Lozano is a CPS 1+ school,"" Exelon CEO &amp; 2018 Daniel H. Burnham Award recipient, Chris Crain, shares at the @ChicagolandCmbr. https://t.co/GBPX1XW1MT",en,Exelon Corporation
Fri Nov 09 02:10:06 +0000 2018,"""Our business cannot thrive if our communities do not thrive,"" emphasizes Exelon CEO &amp; recipient of the 2018 Daniel H. Burnham Award for Distinguished Leadership, Chris Crane, at the @ChicagolandCmbr. #Chicago https://t.co/yCZ7b2IiW9",en,Exelon Corporation
Fri Nov 09 02:05:05 +0000 2018,"STEM programs are an essential part of developing a qualified workforce for the future. In a few moments, two young women who participated in our summer #STEM Innovation Leadership Academy will present the @ChicagolandCmbr 2018 Daniel H. Burnham Award to our CEO, Chris Crane. https://t.co/nzZqTrytCm",en,Exelon Corporation
Fri Nov 09 00:40:37 +0000 2018,"RT @ChicagolandCmbr: Our #BurnhamAward Honoree Chris Crane with our Chairman, our Pres./CEO and two #CPS Lindblom Math &amp; Science Academy ST…",en,Exelon Corporation
Thu Nov 08 23:43:55 +0000 2018,"RT @ChicagolandCmbr: Our 2018 Burnham Award Honoree Christopher Crane, President &amp; CEO of ⁦@Exelon⁩ with Chamber Chair Bruce Lubin and our…",en,Exelon Corporation
Thu Nov 08 21:15:21 +0000 2018,".@UCSUSA's report provides further evidence that preserving #nuclear plants is essential to a #cleanenergy future. We support their call for a price on carbon, which would efficiently reduce emissions &amp; deliver value back to customers. https://t.co/2nc09dvAol",en,Exelon Corporation
Thu Nov 08 19:15:10 +0000 2018,"TONIGHT! Please join us in honoring this year's Daniel H. Burnham Award recipient, Exelon President &amp; CEO, Chris Crane, created by the Board of Directors of the @ChicagolandCmbr for distinguished leadership. https://t.co/h0guieM0kH https://t.co/iMJXVoAOx8",en,Exelon Corporation
Thu Nov 08 16:12:51 +0000 2018,"RT @Kathleen_Barron: UCS:  To prevent climate change, preserve existing nuclear plants and invest in new sources of clean energy.  How coul…",en,Exelon Corporation
Tue Nov 06 19:35:13 +0000 2018,"For more than 6 years, @ExelonGen, Bob Paikidis has been contributing to Clinton AMVETS Post 14, to help meet the needs of our country’s #veterans through moral, financial, citizenship &amp; family support. Read why Bob is an #ExelonVolunteers award winner https://t.co/53LiaYSX0w https://t.co/5wKRd8w05g",en,Exelon Corporation
Tue Nov 06 02:54:29 +0000 2018,RT @BillGates: A compelling look at how advocates and energy sector leaders are working together to tackle the real drivers of climate chan…,en,Exelon Corporation
Sat Nov 03 15:30:10 +0000 2018,"“...we believe that coalitions of companies - public, private coalitions coming together - can drive &amp; make change. I can tell you as an operator of utilities, the climate is changing."" Read more from our CEO, Chris Crane at a recent @BrookingsInst event. https://t.co/0POEdCke12",en,Exelon Corporation
Fri Nov 02 16:32:43 +0000 2018,"RT @StanfordEnergy: Anne Pramaggiore, CEO @Exelon at #StanfordGEF: As an integrated utility, we can coexist with the distributed model to g…",en,Exelon Corporation
Fri Nov 02 14:36:15 +0000 2018,"Today, Anne Pramaggiore, Senior Executive VP &amp; CEO of Exelon Utilities will join Doug Kimmelman of Energy Capital Partners &amp; Thad Hill of Calpine Corporation at the @Stanford Global Energy Forum's 'Changing US Electricity Landscape' panel. https://t.co/bBCDlPSIqe https://t.co/p8CHrVENrC",en,Exelon Corporation
Fri Nov 02 14:05:08 +0000 2018,"ICYMI: For the past 15 quarters, Exelon has met or exceeded the mid-point of our projected #earnings over 85% of the time. Read how once again, we surpassed this past quarter's projections and the positive trend continues! #ExelonEarnings https://t.co/3DXoNh81pc https://t.co/q1WYGspV0F",en,Exelon Corporation
Thu Nov 01 22:05:06 +0000 2018,"We must work together to solve #climatechange, including considering all energy options that accelerate our transition toward a #lowcarbon economy &amp; quickly reducing CO2 from burning fossil fuels. Learn more in @TIME from @macfound &amp; Exelon's Chris Crane: https://t.co/sXe5qnJLk7 https://t.co/9sUlbqXEZj",en,Exelon Corporation
Thu Nov 01 21:35:05 +0000 2018,"""The #climate challenge is so dire that we need to consider every single energy option that accelerates our transition toward a low-carbon economy and continue the use of low cost, safe and secure zero-carbon #nuclear energy."" ~ Exelon CEO, Chris Crane @BrookingsInst @BrookingsFP https://t.co/jcx4na1hOG",en,Exelon Corporation
Thu Nov 01 21:05:22 +0000 2018,"Are you @HeForShe? This past summer, Exelon concluded our successful #STEM Innovation Leadership Academy for teen girls, aimed at advancing #GenderEquality &amp; developing future leaders. #ExelonEarnings https://t.co/0S6vdmKcNc",en,Exelon Corporation
Thu Nov 01 19:35:06 +0000 2018,"With a 93.6% Nuclear Capacity Factor this past quarter, our best-in-class @ExelonGen #nuclear fleet continues to provide #energy safely and reliably. #ExelonEarnings Learn more: https://t.co/14IpFWKx6k https://t.co/B8UhTGFm89",en,Exelon Corporation
Thu Nov 01 18:20:05 +0000 2018,"Delivering on our #smartgrid promise takes an extraordinary act of collaboration. Not only was @ComEd’s smart meter installation was completed 3 years ahead of its original schedule, it was more than $20 million under budget. #ExelonEarnings https://t.co/C6vNfMfeM9",en,Exelon Corporation
Thu Nov 01 16:15:17 +0000 2018,"#DYK: In our continued commitment to address #climatechange, we joined the @CLCouncil. Without action, this issue will significantly impact our 10 million utility customers and 2 million retail customers in the years to come. #ExelonEarnings @Kathleen_Barron explains: https://t.co/obqt3tsKVK",en,Exelon Corporation
Thu Nov 01 15:30:09 +0000 2018,"An #inclusive culture, harnessing all perspectives, ideas &amp; skills, is critical to fulfill our purpose of powering a cleaner &amp; brighter future. We joined the @HRC’s Business Coalition in pledging to support passage of the Equality Act. https://t.co/drUCPQrVkV #ExelonEarnings https://t.co/LZX6Is8opO",en,Exelon Corporation
Thu Nov 01 14:52:07 +0000 2018,"We hope you enjoyed following along. If you’d like more information about our Q3 earnings call, view the presentation at https://t.co/ABVPitS10Z #ExelonEarnings https://t.co/ZCXzsMhis5",en,Exelon Corporation
Thu Nov 01 14:27:04 +0000 2018,"Looking at cost savings since 2015, we have now reduced O&amp;M by over $900 million. It's due to the hard work of our employees who strive every day to run the company more efficiently, while adhering to our commitments to safety, reliability &amp; community stewardship. #ExelonEarnings https://t.co/THSTklUlre",en,Exelon Corporation
Thu Nov 01 14:25:04 +0000 2018,"We're announcing another round of O&amp;M cost reductions as part of our continual efforts to evaluate our work practices, looking for ways to be more efficient, eliminate redundancies and better incorporate innovation and technology. #ExelonEarnings",en,Exelon Corporation
Thu Nov 01 14:22:03 +0000 2018,"Smart meter installation allows @ComEd customers to be better informed about their energy consumption &amp; helps them save $. It also drives over $100 million in annual operational savings, mainly from increased efficiencies like meter reading &amp; avoided truck rolls. #ExelonEarnings",en,Exelon Corporation
Thu Nov 01 14:22:03 +0000 2018,"Early completion of @ComEd's $920 million smart meter installation program, installing 4 million+ smart meters in just over 7 yrs, 3 yrs ahead of orig schedule &amp; more than $20 million under budget. Team installed an average 2,400 smart meters/day over 7-year span. #ExelonEarnings",en,Exelon Corporation
Thu Nov 01 14:21:03 +0000 2018,The utilities &amp; their regulatory teams are doing a lot of work to improve reliability &amp; performance for our customers &amp; fostering a supportive regulatory backdrop that in turn is helping to lift ROEs toward their allowed levels across the Exelon Utilities family. #ExelonEarnings https://t.co/HJoYhLBuA2,en,Exelon Corporation
Thu Nov 01 14:21:03 +0000 2018,We invested $1.4 billion of capital at the utilities during Q3 and are at $3.9 billion year to date. We remain confident in our ability to meet our $5.5 billion capital budget for 2018. #ExelonEarnings,en,Exelon Corporation
Thu Nov 01 14:18:04 +0000 2018,"Our overall earned ROEs for Exelon Utilities were modestly higher than last quarter at 9.6%, well within our earned ROE target of 9-10%. We are pleased with our overall utility performance. #ExelonEarnings https://t.co/nw07sIh7rl",en,Exelon Corporation
Thu Nov 01 14:15:05 +0000 2018,"We had another strong quarter financially, delivering adjusted non-GAAP operating earnings of $0.88 per share, which is at the upper end of our guidance range of $0.80 - $0.90 per share and is $0.03 per share higher than Q3 2017. #ExelonEarnings",en,Exelon Corporation
Thu Nov 01 14:14:04 +0000 2018,We are pleased to have filed as part of a coalition that supports states' rights to advance their clean energy goals. #ExelonEarnings https://t.co/Wdf4WeKpAA,en,Exelon Corporation
Thu Nov 01 14:12:04 +0000 2018,"On the federal #energy policy front, we think that FERC's June order took an important step forward by empowering states to continue prioritizing zero-carbon energy through state-led procurements outside of the PJM capacity market. #ExelonEarnings",en,Exelon Corporation
Thu Nov 01 14:11:03 +0000 2018,"We are announcing a $200 million reduction to our run-rate 2021 costs, of which $150 million will reach the bottom line at @ExelonGen. #ExelonEarnings",en,Exelon Corporation
Thu Nov 01 14:10:06 +0000 2018,"@ExelonGen's gas &amp; hydro fleet performed well, but below plan, primarily a result of our CCGTs at Colorado Bend and Wolf Hollow being offline due to the turbine blade defect. Blades have been replaced &amp; Wolf Hollow was back in service late Sept. #ExelonEarnings https://t.co/S4qTBt0hf7",en,Exelon Corporation
Thu Nov 01 14:10:05 +0000 2018,"At @ExelonGen, we performed at a 96.7% capacity factor and avoided 33 million metric tonnes of carbon during the 4th hottest summer in nearly 125 years. #ExelonEarnings https://t.co/HnNpy2cvVL",en,Exelon Corporation
Thu Nov 01 14:10:05 +0000 2018,One unit at Colorado Bend returned to service in Oct &amp; the other will be back in service in early Nov. We used this outage time to perform normal maintenance that would have been done next spring. #ExelonEarnings,en,Exelon Corporation
Thu Nov 01 14:09:04 +0000 2018,Each of our utilities achieved top quartile reliability performance in SAIFI (outage frequency) and CAIDI (outage duration) and @ComEd and @PepcoConnect performed in the top decile for CAIDI. #ExelonEarnings https://t.co/fxe0FTr5Rc,en,Exelon Corporation
Thu Nov 01 14:09:04 +0000 2018,Safety remains our highest priority and our metrics have continued to improve since the beginning of the year. #ExelonEarnings,en,Exelon Corporation
Thu Nov 01 14:09:04 +0000 2018,Our customer metrics are strong. @MyBGE and @ComEd are in the top decile for customer satisfaction and @PepcoConnect is in the top decile for service level. #ExelonEarnings,en,Exelon Corporation
Thu Nov 01 14:08:04 +0000 2018,Our utilities continue to perform at high levels across key customer satisfaction and operating metrics. The investments we're making in technology &amp; infrastructure continue to improve reliability. #ExelonEarnings https://t.co/bKhqKRlTyK,en,Exelon Corporation
Thu Nov 01 14:08:04 +0000 2018,"@PECOconnect &amp; @MyBGE improved their @JDPower residential gas &amp; electric scores over last year, with PECO receiving its highest ranking ever. #ExelonEarnings",en,Exelon Corporation
Thu Nov 01 14:07:05 +0000 2018,We delivered another strong quarter with #ExelonEarnings again at the upper end of our range. Utilities performed well with strong earned ROEs &amp; largely first quartile operations. https://t.co/f0r4Vn3vvE,en,Exelon Corporation
Thu Nov 01 14:07:04 +0000 2018,"Our focus on costs continues, identifying an add'l $200 million of gross savings, with $150 million flowing to the bottom line -- brining our 6 year total savings to more than $900 million. #ExelonEarnings",en,Exelon Corporation
Thu Nov 01 14:04:03 +0000 2018,We’re kicking off our #earnings call and will keep you in-the-know! #ExelonEarnings,en,Exelon Corporation
Thu Nov 01 13:45:05 +0000 2018,Follow us at 9:00am CT and we’ll share highlights from our Q3 earnings call. #ExelonEarnings https://t.co/NFCj2vQgt6,en,Exelon Corporation
Thu Nov 01 10:58:05 +0000 2018,"In the past 15 quarters, Exelon has met or exceeded the mid-point of our projected #earnings over 85% of the time. Read how once again, we surpassed this past quarter's projections, continuing the positive trend. #ExelonEarnings https://t.co/hRKXD0UkGt https://t.co/s831SVE6AU",en,Exelon Corporation
Tue Oct 30 18:30:16 +0000 2018,Ken Mosca @ACElecConnect &amp; his wife founded @FACESautism in 2001 after their son was diagnosed. The organization provides autism education &amp; resources to families &amp; educators in South Jersey. Read why Ken is an #ExelonVolunteers award winner: https://t.co/9VTODL7YBF https://t.co/lbkAUzwIxB,en,Exelon Corporation
Tue Oct 30 14:08:37 +0000 2018,"RT @TheCRCL: Last Friday, we had a wonderful time with volunteers from @Exelon. While volunteering, they took a tour of our 2929 site, met…",en,Exelon Corporation
Thu Oct 25 19:35:04 +0000 2018,"“We need to be focused on what is the [climate change] message that we can provide with a much larger voice by 2020 and try to make those changes.” Shared by Chris Crane, Exelon CEO, at the @BrookingsInst event earlier this week. Read more in @TIME: https://t.co/qdYnhwWss4",en,Exelon Corporation
Thu Oct 25 18:30:14 +0000 2018,"An #inclusive culture is critical to harnessing all perspectives, ideas &amp; skills needed to fulfill our purpose of powering a cleaner &amp; brighter future. In our commitment to inclusiveness, we joined the Human Rights Campaign’s Business Coalition. https://t.co/nnOlLw5oAi",en,Exelon Corporation
Thu Oct 25 15:42:11 +0000 2018,@C2ES_org explains that preserving the existing U.S. nuclear fleet is a critical element in the transition to a low-carbon future. https://t.co/6UEwowAUll https://t.co/oBCb2IqQkq,en,Exelon Corporation
Thu Oct 25 14:35:59 +0000 2018,RT @DaveVelazquez: There’s a crucial conversation happening this morning about how we must expand EV charging access across the District an…,en,Exelon Corporation
Thu Oct 25 13:47:21 +0000 2018,RT @Edison_Electric: “DC is at the forefront of transportation electrification. We are creating access to affordable and safe transit”- @Pe…,en,Exelon Corporation
Thu Oct 25 13:11:17 +0000 2018,"RT @Kathleen_Barron: Kevin McIntyre’s perseverance in the face of difficult health challenges is an inspiration, and his decision reflects…",en,Exelon Corporation
Wed Oct 24 21:30:06 +0000 2018,"We want to keep our waterways healthy &amp; beautiful. On Sat., hundreds of Exelon and MD state employees, family, friends &amp; neighbors will participate in 3 clean-up events to help #PreSERVEtheBay. Join us! https://t.co/bvZNhaCYra https://t.co/GZHw6FIvoD",en,Exelon Corporation
Wed Oct 24 20:30:26 +0000 2018,"Courageous communications is a critical factor in brands being able to act and respond to a changing world in an agile manner. @fitzmag shared her perspective at today's @holmesreport's Global PR Summit, #PRovoke18. Read more: https://t.co/Bt62i5Ykw4' https://t.co/8iRyf4FF9P",en,Exelon Corporation
Wed Oct 24 17:51:16 +0000 2018,RT @C2ES_org: NEW on our website: @JudiGreenwald &amp; our @DPVine have several #electricity market options and federal programs that could hel…,en,Exelon Corporation
Wed Oct 24 15:34:20 +0000 2018,"RT @NEI: It's Time for #Environmentalists and the Energy Industry to Work Together

Read this powerful opinion piece by Chris Crane of @Exe…",en,Exelon Corporation
Wed Oct 24 15:15:05 +0000 2018,".@holmesreport, thank you for making Exelon part of today's #PRovoke18 Global PR Summit! @fitzmag had a great time talking with David Kamenetzky of @abinbev and @MargeryKraus of @apcoworldwide. https://t.co/JkpIN4myVk",en,Exelon Corporation
Wed Oct 24 14:45:04 +0000 2018,"""We view #purpose to be central to everything we do [at Exelon],"" @fitzmag shares at the @holmesreport #PRovoke18.",en,Exelon Corporation
Wed Oct 24 14:38:14 +0000 2018,"RT @holmesreport: ""Increasingly our team is looking at, how can have a more diverse bench? How can we get the best minds at the table?"" - @…",en,Exelon Corporation
Wed Oct 24 14:37:26 +0000 2018,"RT @holmesreport: We're looking at more at small, agile agencies — they are so proud to be working with a Fortune 100 company.  - @fitzmag…",en,Exelon Corporation
Wed Oct 24 14:36:27 +0000 2018,RT @holmesreport: Consolidation is powerful but I do think we lose something - and that's the agility. -- @fitzmag #PRovoke18 #quotes,en,Exelon Corporation
Wed Oct 24 14:31:57 +0000 2018,"Our very own @fitzmag is speaking on the Role of Communications as an Agent of Change at #PRovoke18, The @holmesreport’s Global PR Summit. Tune in now to Facebook Live: https://t.co/ARHevzWLfV https://t.co/T5xFoPSipy",en,Exelon Corporation
Wed Oct 24 14:22:05 +0000 2018,"""You cannot have #agility without courage...You need people in your organization to take a stand...You have to build systems in companies that allows you to be fast but also thoughtful,"" @fitzmag shares at the @holmesreport #PRovoke18. https://t.co/NVCfc87Gde",en,Exelon Corporation
Wed Oct 24 14:09:57 +0000 2018,"RT @PepcoConnect: Our very own @fitzmag will be speaking on the Role of Communications as an Agent of Change at PRovoke ‘18, the @holmesrep…",en,Exelon Corporation
Wed Oct 24 13:59:02 +0000 2018,"We're ready for #PRovoke18! In just a few moments, @fitzmag will be speaking with David Kamenetzky of @abinbev moderated by @MargeryKraus of @apcoworldwide. They will discuss key factors that helps assess a company's ability to thrive! Learn more: https://t.co/FSuyR3vtbG https://t.co/VRmPLWTMdM",en,Exelon Corporation
Tue Oct 23 15:30:15 +0000 2018,"Last year, @MyBGE Field Support Assistant, Val Jenkins founded Hug Don't Shoot, a Baltimore nonprofit that seeks to bring a sense of peace to the community “One Hug at a Time.” Read more about this #ExelonVolunteers award winner: https://t.co/lAxlDdPnos https://t.co/4XgVeaxnC2",en,Exelon Corporation
Mon Oct 22 19:30:14 +0000 2018,"That's a wrap! @BrookingsFP, thank you for making Exelon part of today's panel: The new dynamics of global energy and climate. https://t.co/DUpZ0WwOqX",en,Exelon Corporation
Mon Oct 22 19:07:37 +0000 2018,"""Customers are demanding clean power. My emerging workforce wants to work for a company that produces clean power. That’s what we intend to provide. That is Exelon’s future,"" Exelon, President &amp; CEO Chris Crane shares at @BrookingsFP. https://t.co/oRh8og3O8C",en,Exelon Corporation
Mon Oct 22 18:45:05 +0000 2018,#DYK: Exelon is analyzing how the U.S. economy could achieve an 80% reduction in greenhouse gas emissions by 2050? Our business imperative is to better understand the long-term risks &amp; opportunities presented by #climatechange. Learn more: https://t.co/IHeX9aiiUe https://t.co/tEKszbyp9D,en,Exelon Corporation
Mon Oct 22 18:29:06 +0000 2018,"""The #climate challenge is so dire that we need to consider every single energy option that accelerates our transition toward a low-carbon economy and continue the use of low cost, safe and secure zero-carbon #nuclear energy,"" Exelon, CEO, Chris Crane shares. @BrookingsFP https://t.co/bfsivfpSsN",en,Exelon Corporation
Mon Oct 22 18:16:20 +0000 2018,"RT @BrookingsFP: HAPPENING NOW: @Exelon CEO Chris Crane is at @BrookingsInst to discuss the roles of nuclear, renewables, and energy storag…",en,Exelon Corporation
Mon Oct 22 18:10:41 +0000 2018,"""The impacts of #climatechange are irrefutable, &amp; starkly clear. It is past time not just for government, but for every business, most particularly energy, along with their customers and stakeholders, to take action to solve it,"" Exelon, CEO, Chris Crane shares. @BrookingsInst https://t.co/Ojy0LbHPiS",en,Exelon Corporation
Mon Oct 22 16:00:19 +0000 2018,#DYK: Exelon is one of the few remaining hybrid utility businesses with the largest fleet of clean generation &amp; the largest family of utility companies in the country? Learn more: https://t.co/0StTjgzXwT https://t.co/dKTGj56p50,en,Exelon Corporation
Mon Oct 22 14:30:13 +0000 2018,"Today, at 2pm ET @BrookingsFP will host our president &amp; CEO Chris Crane to discuss the future of energy companies &amp; the role of #nuclear, renewables, and energy storage in a lower carbon electricity future. Read more: https://t.co/5il1UstBGx https://t.co/JKNiRewSjb",en,Exelon Corporation
Mon Oct 22 13:30:06 +0000 2018,"#ICYMI: @macfound &amp; Exelon, the largest producer of emissions-free energy in the US, are united in our belief that environmentalists &amp; the #energy industry must work together to solve the #climatechange crisis before it's too late. Read more in @TIME: https://t.co/8H8a2oLkfe https://t.co/tsdRKjVsRh",en,Exelon Corporation
