created_at,full_text,lang,user_name
Mon Mar 18 14:01:25 +0000 2019,We’re committed to empowering women to find freedom from #heavyperiods – so we teamed up with @WomensHealthMag to educate their readers about #periodsymptoms that should prompt a visit to the #doctor: https://t.co/2FZeeocO3z,en,Hologic
Mon Mar 18 08:00:56 +0000 2019,"Have you discovered the latest longitudinal data for the Aptima HPV assay yet? Don't miss your chance, click here now: https://t.co/gpzNAPJd9F
(References on file) #AptimaGoldStandard https://t.co/cgywRLerD6",en,Hologic
Fri Mar 15 17:01:08 +0000 2019,Do you have symptoms of #endometriosis? This article from @goodhealth breaks down what to do if you think you have this condition: https://t.co/6L4ER5wb2D. #EndometriosisAwareness,en,Hologic
Fri Mar 15 16:01:36 +0000 2019,"In this article from @Coveteur, two dermatology experts break down laser treatment for women of color and how our technology can help: https://t.co/gxf6gOKwEa.",en,Hologic
Thu Mar 14 18:00:55 +0000 2019,"#DYK engaging in regular exercise and stretching can help your joints and prevent #osteoarthritis? For more health secrets every woman over 50 should know, check out this article from @readersdigest: https://t.co/CVRePW1nFD.",en,Hologic
Thu Mar 14 16:02:22 +0000 2019,"Explore Hologic’s GYN Surgical Division’s offerings through our https://t.co/7g9HENsjq4 portal. Access product information, videos and marketing resources today. https://t.co/NQ81qqmDiR",en,Hologic
Thu Mar 14 13:00:58 +0000 2019,Moving GYN procedures from OR to office? Discover the #Nitronox Inhalation Analgesia System for in-office pain and anxiety relief: https://t.co/eFdGB8IAZW https://t.co/2KluZPOyVo,en,Hologic
Wed Mar 13 16:01:07 +0000 2019,"For more than a year, our team has been working tirelessly to educate China’s immense population about the importance of #mammography and #cervicalcancer screening. For this campaign, we're proud to share that we received the Golden Flag Award for Corporate Social Responsibility. https://t.co/Swdc9MtGDr",en,Hologic
Wed Mar 13 14:00:43 +0000 2019,Interested in joining our organization? Hear from our employees why they chose Hologic and what motivates them to come to work each day: https://t.co/EWMXM2KWEf. #WhyHologic https://t.co/KfGFK1ZnM4,en,Hologic
Wed Mar 13 08:00:50 +0000 2019,"Did you know that introducing the Aptima HPV assay to your lab can improve your patients' experience of #cervicalscreening? Find out how here: https://t.co/gpzNAPJd9F
(References on file) #AptimaGoldStandard https://t.co/4jc3RRc1TM",en,Hologic
Mon Mar 11 13:01:58 +0000 2019,"As a leading innovator in #womenshealth, it's our mission to put the patient and their needs first. Hear from Jennifer as she shares #WhyHologic. https://t.co/5dTBrG12AJ https://t.co/qxl3wgoAH2",en,Hologic
Mon Mar 11 13:01:22 +0000 2019,Our CFO Karleen Oberton will present at the @CowenResearch Health Care Conference tomorrow at 8:40a.m. ET.  You can listen live here:  https://t.co/QQUaeoXCMr $HOLX https://t.co/4ScwUGMjqg,en,Hologic
Mon Mar 11 08:00:17 +0000 2019,"The Aptima HPV assay is fast becoming the new Gold Standard in #cervicalscreening. Have you introduced it to your lab yet? 
https://t.co/gpzNAPJd9F 
(References on file) #AptimaGoldStandard https://t.co/72eEEYS2xE",en,Hologic
Sun Mar 10 17:00:55 +0000 2019,Our Change the Cycle community aims to provide resources and an online network of support for women facing below-the-belt health issues. Follow along @ChangetheCycle. https://t.co/ANLI4AOMPr,en,Hologic
Sun Mar 10 13:01:03 +0000 2019,"Currently, there are 1.1 million people in the U.S. living with #HIV, and nearly 25% of them are women. In support of #NWGHAAD, we are raising awareness about the importance of testing. Learn more: https://t.co/VPvH5cPeR5. #ICanStopHIV https://t.co/Da7Vc0x90U",en,Hologic
Fri Mar 08 23:00:57 +0000 2019,Thanks for following along to meet some of our amazing colleagues during #IWD2019. We hope to continue to share our passion for #womenshealth throughout the year. https://t.co/CEmc6tjvAR,en,Hologic
Fri Mar 08 22:00:33 +0000 2019,"Laura, our Senior Administrative Assistant, shares how our organization's passion for #womenshealth and wellbeing makes her job meaningful and rewarding. #IWD2019 https://t.co/FjmgyxiAaG",en,Hologic
Fri Mar 08 21:00:15 +0000 2019,"Employees in San Diego, Marlborough and France are also joining in on our support for #IWD2019! To learn more our commitment to #womenshealth, visit: https://t.co/aK2ZHBWtM4. #IWD2019 https://t.co/cZrZtc3MnE",en,Hologic
Fri Mar 08 20:00:54 +0000 2019,"As the Global Digital Marketing Manager for our GYN Surgical Solutions division, Lashika shares how she raises awareness about different #womenshealth conditions. #IWD2019 https://t.co/3qvooGj4yx",en,Hologic
Fri Mar 08 19:30:36 +0000 2019,Katia highlights how #IWD2019 serves as a day of reflection as well as motivation to confront current #womenshealth challenges. https://t.co/9hoU0UdZvf,en,Hologic
Fri Mar 08 19:00:59 +0000 2019,"You heard it from Carmel, our VP of Human Resources, first! Every day is #InternationalWomensDay for our organization. But she shares why today is especially special. #IWD2019 https://t.co/3Kb4xuqvBP",en,Hologic
Fri Mar 08 18:15:19 +0000 2019,"Marilyn shares how she embraces the pillars of our organization: purpose, passion and promise. Learn more: https://t.co/aK2ZHBWtM4. #IWD2019 https://t.co/sINyrMcpez",en,Hologic
Fri Mar 08 17:45:17 +0000 2019,"Our Director of Research and Development, Sangeetha, discusses how our mission as an innovative #womenshealth company has a profound impact on her work. #IWD2019 https://t.co/LHwxBbMFhW",en,Hologic
Fri Mar 08 16:57:01 +0000 2019,RT @LoveSTEMSD: Sangeetha Nair on working at @BiocomCA member @Hologic: “Most researchers never see the impact of work they do. With Hologi…,en,Hologic
Fri Mar 08 16:54:35 +0000 2019,RT @JennnyCG: Happy #IWD19 from the crazy @Hologic ManchesterHR crew! For us everyday is all about the ladies but today even more so! https…,en,Hologic
Fri Mar 08 16:15:18 +0000 2019,Have you tried our #IWD2019 camera effect yet? Join us on Facebook to celebrate women around the world today: https://t.co/diVxzR7OF3. https://t.co/fdAxXLtT7n,en,Hologic
Fri Mar 08 15:45:18 +0000 2019,"Meet Paola from our Costa Rica site! This #IWD2019, she tells us how she brings our organization's mission to life. https://t.co/197JynG9pS",en,Hologic
Fri Mar 08 15:00:52 +0000 2019,"Today on #InternationalWomensDay and everyday, we are committed to improving the health and quality of life for the 3.7 billion women around the world. Learn more about our mission: https://t.co/aK2ZHBWtM4. #IWD2019 https://t.co/wvzGX4sQ7K",en,Hologic
Fri Mar 08 14:15:18 +0000 2019,"As a global champion for #womenshealth, our employees like Monica have a personal connection to the work they do each day. #IWD2019 https://t.co/CsfZwWjvMV",en,Hologic
Fri Mar 08 13:45:16 +0000 2019,"On #IWD2019, Michelle shares why she chose work for a leading #womenshealth company. Learn more about our organization: https://t.co/aK2ZHBWtM4. https://t.co/9oP2dH9F6D",en,Hologic
Fri Mar 08 12:01:00 +0000 2019,Kylie who is based in our Australia office tells us how she embodies our mission to advance #womenshealth around the world. #IWD2019 https://t.co/0MdMMSe148,en,Hologic
Fri Mar 08 10:00:37 +0000 2019,"#DYK we are a global #womenshealth company? Meet Ying from our China office! This #IWD2019, she shares how the impact of her work at Hologic extends beyond the workplace. https://t.co/vlL1yAeuSJ",en,Hologic
Fri Mar 08 09:00:35 +0000 2019,"What does #IWD2019 mean to you? On her 14th anniversary with our organization, Michelle discusses the importance of today. https://t.co/lSfr4x2QHL",en,Hologic
Fri Mar 08 08:00:35 +0000 2019,"Today on #IWD2019, we're proud to celebrate the women within our organization who work to enable healthier lives everywhere, everyday. Follow us throughout the day to meet some of these women. Learn more: https://t.co/aK2ZHBESnu. https://t.co/wD1pUjZjH4",en,Hologic
Thu Mar 07 16:30:13 +0000 2019,"We're raising a flag for women around the world this #InternationalWomensDay! As a global champion of #womenshealth, join us tomorrow to learn more about the incredible women within our organization: https://t.co/aK2ZHBWtM4. #IWD2019 https://t.co/7G1qejpcnS",en,Hologic
Thu Mar 07 14:01:47 +0000 2019,The #Omni hysteroscope is designed to allow you to take #seeandtreat to the next level. Discover the transformative features of our new three-in-one scope today. https://t.co/obCjHhvoXa https://t.co/WR7MsjIoUd,en,Hologic
Wed Mar 06 22:14:50 +0000 2019,"Reporting from this year’s @NFL Combine, Sports Illustrated describes how DXA data output generated insights regarding player assessments and changes in muscle and fat mass ideal for a player’s on-field position: https://t.co/jrBPPEhsY3",en,Hologic
Wed Mar 06 17:01:37 +0000 2019,Did you know an osteoporotic fracture occurs every 3 seconds worldwide? Visit https://t.co/LJsLhTUNPJ to learn how you can stay healthy and osteoporosis-free.,en,Hologic
Wed Mar 06 14:00:41 +0000 2019,"In advance of #IWD2019, Veerle shares what this day means to her personally. Join us this Friday as we celebrate the women within our organization and their invaluable work to advance women's health around the world. https://t.co/4TR4KALexd",en,Hologic
Wed Mar 06 09:00:55 +0000 2019,"Would you like to reduce the number of false positive #cervicalscreening results in your lab? Visit: https://t.co/gpzNAPJd9F to discover how.
(References on file) #AptimaGoldStandard https://t.co/08q7113AYx",en,Hologic
Tue Mar 05 18:01:05 +0000 2019,We are a proud supporter of the 2030 UNAIDS 95-95-95 treatment target to help end the #AIDS epidemic. Learn more about how we're working to achieve this through our Global Access Initiative: https://t.co/2Y4j5Vlgnz. https://t.co/PEoPGWMKc4,en,Hologic
Tue Mar 05 15:30:39 +0000 2019,"#DYK #endometriosis may affect more than 11% of American women aged 15 to 44? In support of  #EndometriosisAwareness Month, we are raising awareness about this condition and those it affects. Learn more here: https://t.co/e7YWgwbF8P. https://t.co/luyrLRloQb",en,Hologic
Tue Mar 05 15:17:41 +0000 2019,"The Aptima HPV assay is fast becoming the new Gold Standard in #cervicalscreening. 
(References on file) #AptimaGoldStandard",en,Hologic
Tue Mar 05 15:01:56 +0000 2019,The Fluent® system is inspired by input from #healthcareprofessionals who have endured the complexities of fluid management firsthand. Hear why #OBGYNs are excited about our new solution: https://t.co/Ifhv4JBX5p,en,Hologic
Mon Mar 04 20:01:04 +0000 2019,We are honored to receive the Customer Relationship Management Institute LLC’s 2018 NorthFace ScoreBoard Award which recognizes excellence in customer service in the area of Technical Support and Field Service. Learn more: https://t.co/hCFi0GMjdT https://t.co/q81uvQU3d6,en,Hologic
Mon Mar 04 16:19:19 +0000 2019,It was great too see so many of you at #ecr2019 and we hope you got home safely!  If you have any outstanding questions please contact us at iims@hologic.com https://t.co/gybV6faCH3,en,Hologic
Mon Mar 04 14:00:49 +0000 2019,"Every hour, 1 woman in the U.S. is diagnosed with #cervicalcancer. In support of #HPVAwarenessDay, we encourage you speak with you doctor and #AskAboutHPV to learn about the virus, prevention, screening and treatment. Learn more: https://t.co/de2MW6qYOF https://t.co/6oBSYF7Gwx",en,Hologic
Sun Mar 03 08:00:24 +0000 2019,"It's the last day of #ecr2019. It's been great to see so many people and have the opportunity to share our latest innovations in #mammography, breast surgery and #musculoskeletal. If you haven't visited us yet, we hope to see you on our booths X2/2111 and X5/521 https://t.co/vxwnaENjlk",en,Hologic
Sat Mar 02 21:08:25 +0000 2019,We love STEM even in the rain! Come create your own DNA necklace today at the San Diego Festival of Science &amp; Engineering EXPO Day at our booth# P70 at Park at the Park at Petco Park! https://t.co/RXT1SLUb8g,en,Hologic
Sat Mar 02 19:58:15 +0000 2019,RT @BiocomCA: Our members are bringing some incredible science to @PetcoPark! Take home some of your own #DNA at the @Hologic tent. #loveST…,en,Hologic
Sat Mar 02 17:33:19 +0000 2019,We're proud to empower children of all ages to get interested in #STEM. Come see us at our booth at this year's San Diego Festival of Science &amp; Engineering EXPO Day! @LoveSTEMSD https://t.co/XKiwDgbder,en,Hologic
Sat Mar 02 17:08:29 +0000 2019,@JFalschung @WBUR  it's fFn find out more here: https://t.co/5c4j72E1ue,en,Hologic
Sat Mar 02 09:00:47 +0000 2019,Are you a breast surgeon attending #ecr2019? Visit our booths X2-211/X5-521 to learn about our #breastsurgery solutions• Achieving precision in breast lesion localization • Dedicated/specimen cabinets for instant verification •  future of surgical site marking and 3D filling https://t.co/9uObMm9fBM,en,Hologic
Sat Mar 02 07:00:25 +0000 2019,"We're hosting our final seven workshops today at #ecr2019. If you haven't registered, go to the workshop area next to rooms -2.84/-2.85 (Lower Level). We look forward to seeing you there!  

To find out more visit https://t.co/1mkbjyDD6W. #mammography https://t.co/bPxN323f4c",en,Hologic
Sat Mar 02 00:08:49 +0000 2019,Research shows that early exposure to #STEM has positive impacts across the entire spectrum of learning. Hope to see you tomorrow at EXPO Day at the San Diego Festival of Science &amp; Engineering! Learn more: https://t.co/blvLqEVQio @LoveSTEMSD https://t.co/AINMSlFRto,en,Hologic
Fri Mar 01 17:01:18 +0000 2019,"In honor of #EmployeeAppreciationDay today, we want to thank all members of our organization for the work they do to make a positive difference in #womenshealth and people’s lives everywhere, every day. https://t.co/GDFZL5oHnL",en,Hologic
Fri Mar 01 14:00:41 +0000 2019,"Today kicks off #WomensHistoryMonth. This month, we recognize and celebrate the important contributions of women to history, culture and society, including our colleagues who support women throughout their #health journey. https://t.co/t1TswyYeA2",en,Hologic
Fri Mar 01 09:00:17 +0000 2019,"Our medical education programme at #ecr2019 continues today with six workshops. To register go to the workshop area next to rooms -2.84/-2.85 (Lower Level). We look forward to seeing you there!  

To find out more visit https://t.co/1mkbjyDD6W #breastsurgery https://t.co/vlpQ5R6qBj",en,Hologic
Fri Mar 01 07:00:11 +0000 2019,"It's second day of the #ecr2019 exhibition. If you haven't visited us yet on our booths X2/211 and X5/521, come and find out what’s NEW in:

•Breast Imaging
•Breast Surgery
•Breast Pathology
•#Musculoskeletal Imaging

#breastsurgery https://t.co/uTo1a6W2Z9",en,Hologic
Thu Feb 28 17:01:34 +0000 2019,"In 2016, we set an ambitious goal of reducing our greenhouse gas emissions by 10% by 2021. Learn how we're working to achieve this: https://t.co/Q1VAdYI8sU. https://t.co/Hf78SoAVBd",en,Hologic
Thu Feb 28 09:01:04 +0000 2019,Our #ecr2019 symposium will feature experts sharing their clinical experiences on the implementation of new technologies in the area of contrast enhanced digital mammography (CEDM). We look forward to seeing you there. #mammography https://t.co/sHwiAxnc8g,en,Hologic
Thu Feb 28 07:00:57 +0000 2019,The exhibition at #ecr2019 opens today. Come to booth X2-211 and find out how our artificial intelligence can help you improve your clinical practice NOW (and in the future!) #AI #mammography https://t.co/je2rpXU0rQ,en,Hologic
Wed Feb 27 16:02:01 +0000 2019,The exhibition at #ecr2019 opens tomorrow. Both our stands (X2-211 &amp; X5-521) are ready and we're looking forward to sharing our latest innovations across the breast health continuum with you. #mammography #breastsurgery https://t.co/P36bzqhXXV,en,Hologic
Wed Feb 27 09:00:46 +0000 2019,Join us on the path to defeating cervical disease by choosing the HPV assay which is fast becoming the new Gold Standard in #cervicalscreening. https://t.co/gpzNAPJd9F (References on file) #AptimaGoldStandard https://t.co/Kv0DO04AUE,en,Hologic
Wed Feb 27 07:00:48 +0000 2019,Our #ecr2019 medical education programme starts today. Come and find out more and register in the workshops area next to rooms -2.84/-2.85 (lower level). #mammography #breastsurgery https://t.co/Xolqe71MhL,en,Hologic
Tue Feb 26 16:01:49 +0000 2019,"There are a number of risk factors for #osteoporosis, including being age 50 or older. However, there are some things that can help reduce your risk of developing this condition. Learn more via @EverydayHealth: https://t.co/e6U6fnLN4Y. https://t.co/DOZ0uZcgcv",en,Hologic
Tue Feb 26 14:02:18 +0000 2019,Caring for a loved one who may be suffering from #fibroids? Help them begin their journey to freedom from heavy bleeding by finding a local doctor who can help: https://t.co/k2k2jtC17e https://t.co/Wsyhm5x4tU,en,Hologic
Tue Feb 26 07:00:49 +0000 2019,"Our medical education programme at #ecr2019 in Vienna starts tomorrow. Registration opens at 8.30am in the workshop area next to rooms -2.84/-2.85 (Lower Level). We look forward to seeing you there!  

To find out more visit https://t.co/1mkbjyDD6W https://t.co/r4Tm0CFYjM",en,Hologic
Mon Feb 25 19:01:43 +0000 2019,"Thanks to the insightful data and actionable solutions from Unifi™ Analytics, mammography administrators can stay on target to meet productivity and accuracy goals, avoid costly downtime and maintain their high standard of care. https://t.co/86tiXC3MJb",en,Hologic
Mon Feb 25 17:02:11 +0000 2019,Have questions about osteoporosis and your bone health? Check out these insights and recommendations from Dr. Andrea Singer https://t.co/liAnMpHBip,en,Hologic
Mon Feb 25 14:01:28 +0000 2019,Why should physicians consider #endometrialablation as an alternative to #hysterectomy for treating abnormal uterine bleeding? Check out this @ReachMD video to get the facts: https://t.co/lFnjxaeyN6,en,Hologic
Mon Feb 25 09:01:17 +0000 2019,Have you seen the new data showing that the Aptima HPV assay offers significantly improved specificity vs #HPV DNA testing? Discover what this means for your patients here: https://t.co/gpzNAPJd9F (References on file) #AptimaGoldStandard https://t.co/d9fbNlYhDe,en,Hologic
Fri Feb 22 17:01:08 +0000 2019,"If you're currently undergoing treatment for #breastcancer, it's important to understand what healthy eating means. Here are some tips from experts via @Breastcancerorg: https://t.co/0Nq3ZAbl2c.",en,Hologic
Thu Feb 21 20:18:46 +0000 2019,"Athletic programs are training better athletes using Dexalytics:TEAMS cloud-based software that can use our Horizon® DXA system to transform clinical data into manageable athlete scores. University of Minnesota’s Donald Dengel, Ph.D. explains how: https://t.co/GPYPvS6GNx",en,Hologic
Thu Feb 21 16:30:47 +0000 2019,Hologic’s #Omni hysteroscope is designed to allow physicians to #seeandtreat. Discover our new three-in-one scope: https://t.co/obCjHhvoXa https://t.co/khjk5LrUCc,en,Hologic
Thu Feb 21 16:01:39 +0000 2019,Interested in joining our organization? Find out how you can join our mission to enable healthier lives for women: https://t.co/wxHrLqSnKE. https://t.co/XbLbYIMstt,en,Hologic
Wed Feb 20 19:04:45 +0000 2019,"Every 2 hours, 1 woman dies of #cervicalcancer. @ErinAndrews and @JShepherd_MD spoke to @TheTalkCBS about how Pap+HPV testing can help #ChangeThisSTAT: https://t.co/LUzmfgyKPr.",en,Hologic
Wed Feb 20 09:01:06 +0000 2019,"Does your cervical screening solution detect the #HPV type which poses the largest threat? Don't compromise, choose the assay which is fast becoming the new Gold Standard in cervical screening: https://t.co/gpzNAPJd9F (References on file) #AptimaGoldStandard https://t.co/QSihCefAxo",en,Hologic
Wed Feb 20 07:00:48 +0000 2019,"Come and join us at the European Congress of Radiology in Vienna on booth X2-211 to find out how Hologic’s #AI can help you improve your clinical practice NOW (and in the future!) #ecr2019 #mammography

To find out more visit https://t.co/1mkbjym1Im https://t.co/QhBAz3mdRQ",en,Hologic
Tue Feb 19 22:23:52 +0000 2019,Watch this @etnow video to hear how @ErinAndrews decided to share her #cervicalcervical cancer story and encourage women to get tested: https://t.co/6CpGYq7qyC. #ChangeThisSTAT,en,Hologic
Tue Feb 19 17:55:25 +0000 2019,Don't miss @ErinAndrews and @JShepherd_MD on @TheTalkCBS today to encourage women to get to the doctor and ask about Pap+HPV testing to protect against #cervicalcancer. Tune in to CBS at 2p ET / 1p PT/CT. https://t.co/Ae88xBz3MZ,en,Hologic
Tue Feb 19 17:30:45 +0000 2019,"When it comes to body composition, not all weight is the same. See how a #DXA scan can differentiate between different types of mass, and how they affect individual responses to weight loss and nutrition plans https://t.co/jAgsmjFP90 https://t.co/9iETj2fEQ3",en,Hologic
Tue Feb 19 14:02:05 +0000 2019,"Our commitment to improving women’s lives extends beyond product innovations. Learn more about @ChangetheCycle, a community devoted to women seeking resources for below-the-belt health issues. https://t.co/7YQDqxPyah https://t.co/z8DUpRQtXQ",en,Hologic
Mon Feb 18 16:01:50 +0000 2019,Unanticipated tube failures can lead to costly downtime for mammography facilities. Unifi™ Analytics can predict these occurrences and alert facilities to proactively address the issue.  Find out more here:  https://t.co/SFdiMUCyXa https://t.co/ADHZRRnmsg,en,Hologic
Mon Feb 18 09:00:50 +0000 2019,"Would you like to know more about how the Aptima HPV assay is helping to reduce colposcopy referrals, unnecessary overtreatment and patient anxiety? Contact us to find out more: https://t.co/gpzNAPJd9F 
(References on file) #AptimaGoldStandard https://t.co/6nTdrtIwSc",en,Hologic
Mon Feb 18 07:00:37 +0000 2019,"In response to demand, we are running more workshops at #ecr2019 covering a diverse range of topics. Registration is on site only. To find out more visit https://t.co/1mkbjyDD6W #mammography #breastsurgery https://t.co/4oVfmivRte",en,Hologic
Fri Feb 15 20:01:48 +0000 2019,Are you ready to regain your freedom from heavy periods? Here are some tips to start the conversation with your #OBGYN at your next appointment: https://t.co/mdd2XzXW0p https://t.co/ZmQ4CJhRmm,en,Hologic
Fri Feb 15 18:02:07 +0000 2019,Viva Las Vegas! Today's your last chance to stop by and talk to us about the importance of #fFN testing and how it can improve patient care and save costs. Exhibits close at 5:30pm. #SMFM19 https://t.co/4ukCFnQkaj,en,Hologic
Fri Feb 15 16:02:09 +0000 2019,Spend your lunch break with Dr. Michael Ruma as he breaks down the current standard of care for #preterm labor. He will wrap up by sharing news about how innovative tests and research are improving patient care for mom and baby. #SMFM19 https://t.co/UT8HPrI5gs,en,Hologic
Fri Feb 15 14:02:08 +0000 2019,"We're committed to making quality diagnostic testing and viral-load monitoring for the most prevalent viral diseases accessible everywhere, for everyone. Learn how we're working to improve care in resource-limited settings: https://t.co/2Y4j5Vlgnz. https://t.co/C5Pd5uT7Fc",en,Hologic
Thu Feb 14 20:01:36 +0000 2019,"#DYK it's #NationalCondomWeek? To learn how condoms can reduce  the risk of #STDs and other diseases, visit @Healthline: https://t.co/CMkhaIUYe3. https://t.co/jIrXMcT71K",en,Hologic
Thu Feb 14 18:01:59 +0000 2019,Improve your preterm labor triage. Head over to our booth to find out how using #fFN testing together with transvaginal ultrasound dramatically increases preterm labor prediction. #SMFM19. https://t.co/h4MP5wuF0z,en,Hologic
Thu Feb 14 16:02:19 +0000 2019,"All you need is love… and #fFN testing. A negative Rapid fFN test result is valid after sex, but a positive result may not be and should be confirmed after 24 hours. Visit our booth to learn more. #SMFM19 https://t.co/xwBqJeAe1F",en,Hologic
Thu Feb 14 15:30:06 +0000 2019,Today we announced our Aptima® HIV-1 Quant Dx Assay received two CE Marks in Europe.  It is now the first and only dual-claim assay for both viral load and early infant diagnosis. https://t.co/WNaRgppl91 https://t.co/OdcYIdCNq3,en,Hologic
Thu Feb 14 14:01:48 +0000 2019,"This #ValentinesDay, we encourage you to take control of your #sexualhealth to protect yourself and your partners. Learn more via @CDCgov: https://t.co/cDhtz8zBJe. https://t.co/StIKVqSBlP",en,Hologic
Thu Feb 14 07:00:14 +0000 2019,We believe in continually innovating to provide our customers with cutting-edge technologies to support them in developing their clinical practice. Find out what we'll be sharing at the European Congress of Radiology on booths X2-211 &amp; X5-521 on https://t.co/1mkbjyDD6W #ecr2019 https://t.co/Fc2UaUSgaE,en,Hologic
Wed Feb 13 21:12:49 +0000 2019,".@realself community members have spoken and rate our @SculpSure as ""Most Worth IT"" body contouring/weight loss product! https://t.co/uZ8Pyvciw8",en,Hologic
Wed Feb 13 20:01:41 +0000 2019,80% of symptomatic patients will get a negative #fFN result. Come visit our booth at #SMFM19 to learn how fFN testing can help rule out 80% of patients with symptoms of preterm labor. https://t.co/WevltiB0yY,en,Hologic
Wed Feb 13 18:30:37 +0000 2019,"Get the most out of your mammography investment with Unifi™ Analytics, a business intelligence tool that gives your practice the power to benchmark its performance.  Learn more:   
https://t.co/oLJqOlUwZS",en,Hologic
Wed Feb 13 17:02:36 +0000 2019,Direct visualization via #hysteroscopic procedures offers physicians a more precise and accurate alternative to blind biopsy and D&amp;C. Get the facts here: https://t.co/rwBwmBdx1J https://t.co/uXdctPg25l,en,Hologic
Wed Feb 13 16:02:07 +0000 2019,Find out today how #fFN testing can help you differentiate between true preterm labor and a false alarm. The #SMFM19 exhibit hall opens this evening at 6pm. https://t.co/YbCoHAbVSV,en,Hologic
