created_at,full_text,lang,user_name
Tue Jun 13 15:01:06 +0000 2017,We’ve had a great time speaking with lab partners at #APHL 2017 and would love to see you today at Booth 421! https://t.co/uEllL6nvE4,en,Hologic
Tue Jun 13 13:00:49 +0000 2017,What do you know about #fibroids?  Take our @HealthyWomen survey here:  https://t.co/1jhWfELdeO,en,Hologic
Tue Jun 13 10:00:58 +0000 2017,Are you going to @BASHH_UK annual conference in Belfast? Looking forward to see you at Stand 15! #BASHH17,en,Hologic
Mon Jun 12 16:19:23 +0000 2017,#APHL 2017 continues today in Providence. Stop at Booth 421 to discuss challenges &amp; solutions in public health labs. https://t.co/QTDj6lLtUB,en,Hologic
Mon Jun 12 16:01:21 +0000 2017,We're helping defeat cancer at the @PanMass Challenge. Read more about why we'll be biking across #Massachusetts: https://t.co/2NkuwYJnbI https://t.co/78tNCDQkJe,en,Hologic
Mon Jun 12 14:25:28 +0000 2017,RT @SherylCrow: Congrats @Hologic on the news that @US_FDA has approved #Genius3DMammographyExam as the only mammo superior for women with…,en,Hologic
Sun Jun 11 15:01:15 +0000 2017,Join us at Booth 421 at the 2017 #APHL annual meeting. We would love to discuss advances in lab workflow and capabilities. https://t.co/gxMPhPUuzW,en,Hologic
Fri Jun 09 15:01:15 +0000 2017,Discover your summer beauty. Get ready for warm weather with confidence. https://t.co/AUavZbgrwt https://t.co/zXVIuMhsOq,en,Hologic
Thu Jun 08 13:00:50 +0000 2017,"Congrats to our Belgian Cycling Team who participated in ""The 1000 km for Fight against Cancer” charity cycling race for the sixth year. https://t.co/aYSeV40zib",en,Hologic
Wed Jun 07 15:00:56 +0000 2017,#DYK that there is no definitive cause to uterine polyps? They can range in size from a few centimeters to the size of a golf ball! https://t.co/EiEy1tkl9i,en,Hologic
Wed Jun 07 12:14:50 +0000 2017,The #FDA has approved our Genius 3D Mammography exam as the only mammogram superior for women with dense breasts https://t.co/0j84U0gvUO https://t.co/uvm8BHVV7Z,en,Hologic
Tue Jun 06 12:00:40 +0000 2017,$HOLX CFO Bob McMahon will be presenting at various upcoming investor conferences. Tune into the webcasts: https://t.co/4tUt2hJ27H https://t.co/IF8L7t53m0,en,Hologic
Mon Jun 05 22:00:17 +0000 2017,Join a passionate team dedicated to women's health. See our open positions: https://t.co/H4QdwRBCS3 https://t.co/BB0Ncmtn2d,en,Hologic
Mon Jun 05 15:58:51 +0000 2017,RT @iasociety: Four researchers who have dedicated their lives to HIV share their perspectives on the evolution of research https://t.co/oF…,en,Hologic
Mon Jun 05 15:57:48 +0000 2017,"RT @iasociety: On the anniversary of the first report of AIDS, IAS Members share their stories of living with #HIV – then and now: https://…",en,Hologic
Sun Jun 04 15:00:41 +0000 2017,"It's your last chance to see the Panther Fusion system at #ASMicrobe 2017, Booth 2725. https://t.co/UqWJW16Wob",en,Hologic
Sat Jun 03 15:01:19 +0000 2017,The Panther Fusion system optimizes lab workflow and consolidates your testing with our expanding menu. See it at Booth 2725. #ASMicrobe https://t.co/GSJiuDxxlY,en,Hologic
Fri Jun 02 19:29:04 +0000 2017,The exhibit hall opens today at #ASMicrobe 2017. Stop by Booth 2725 to see the Panther Fusion system! https://t.co/1keVhOrUWp,en,Hologic
Fri Jun 02 17:01:10 +0000 2017,Don't forget to attend our symposium today at #ASMicrobe at 1:15 in Theater B. https://t.co/AuApPtOHo0,en,Hologic
Thu Jun 01 22:36:59 +0000 2017,#NationalOsteoporosisMonth is over but that doesn’t mean you should stop caring about your bones! https://t.co/VNnMDwFLMe,en,Hologic
Thu Jun 01 15:01:24 +0000 2017,#ASMicrobe opens tomorrow in New Orleans. Add our symposium to your calendar and stop by Booth 2725. https://t.co/xAgEErAfuk,en,Hologic
Wed May 31 16:00:33 +0000 2017,When should you get a DXA scan? Dr. Gruen from @StamfordHosp shares his recommendations #NationalOsteoporosisMonth. https://t.co/lWO5zayhcI,en,Hologic
Wed May 31 13:01:02 +0000 2017,Interested in helping make people's lives healthier? Join the Hologic team! https://t.co/QLOXbxNAsL https://t.co/2721ffkJds,en,Hologic
Tue May 30 17:45:09 +0000 2017,Pete Valenti hopes to transform and make a difference in the world of healthcare. Learn more: https://t.co/Qp3c2wDkJF https://t.co/v6NPUEYcE3,en,Hologic
Fri May 26 13:01:36 +0000 2017,#DYK heavy periods affect 1 in 5 women? @Jshepherd_MD shares more with @ChangetheCycle https://t.co/wClqYNk9VY https://t.co/6OdpBf8oyj,en,Hologic
Thu May 25 22:00:23 +0000 2017,We were proud to be honored at the @komengreaternyc #Impact Awards this week. We’re committed to continuing to champion women’s health. https://t.co/3Km832vG7H,en,Hologic
Thu May 25 20:55:09 +0000 2017,"RT @Blavity: Anyone saying ""yes"" to sex should also say ""yes"" to STD testing #CommunitySubmitted https://t.co/zhiIHxOcWO https://t.co/NtRya…",en,Hologic
Thu May 25 20:54:54 +0000 2017,RT @CDCSTD: Getting tested for #STDs is part of staying healthy. Yes to sex? #YESmeansTEST via @infoASHA. More: https://t.co/Cd67tfO6ol. ht…,en,Hologic
Thu May 25 20:54:17 +0000 2017,"RT @CDCSTD: If you’re having sex, #STDs can happen. Know how testing can keep you safe &amp; healthy with #YESmeansTEST -&gt; https://t.co/Cd67tfO…",en,Hologic
Thu May 25 20:00:39 +0000 2017,It’s #NationalOsteoporosisMonth &amp; Dr. Misra from Stamford Health shares why good bone health is important year-round https://t.co/Javp4UqGEF,en,Hologic
Thu May 25 17:27:42 +0000 2017,RT @CDCSTD: Why should Yes to Sex mean Yes to Test? It's a simple way to protect you &amp; your partner's health!  https://t.co/Cd67tfO6ol #Yes…,en,Hologic
Thu May 25 16:01:44 +0000 2017,We're so pleased to have visited with #ACNM attendees during this stimulating week in Chicago. See you next year! https://t.co/EoO4OT2Wio,en,Hologic
Wed May 24 14:01:25 +0000 2017,Today is the last day to chat w/ us about fFN testing for determining preterm birth risk at Booth 417. #ACNM https://t.co/vdYu57YpAv,en,Hologic
Tue May 23 14:24:46 +0000 2017,#HOLX’s CFO will present at the UBS Global Healthcare Conference today at 11:30 AM ET.  Join us and listen here: https://t.co/OzLZP3Xd2q https://t.co/FejTHpbbpj,en,Hologic
Tue May 23 14:01:03 +0000 2017,Learn about the value of standardization at Booth 417 after the opening meetings today. #ACNM https://t.co/BrawQny3Sg,en,Hologic
Mon May 22 20:37:51 +0000 2017,Visit us at Booth 417 during the #ACNM exhibit hall grand opening today in Chicago! https://t.co/NxzZIVef1L,en,Hologic
Mon May 22 17:23:31 +0000 2017,"We're at #ACNM 2017, meeting with nurse-midwives from across the US to discuss advances in the field. See us at Booth 417.",en,Hologic
Fri May 19 20:01:16 +0000 2017,"This Women's Health Week, make your health a priority and take steps to being a healthier version of you! #NWHW https://t.co/PCXxbvSYsV https://t.co/UNb07Kd706",en,Hologic
Fri May 19 14:01:37 +0000 2017,New trend: mothers and daughters are bonding over cosmetic procedures. Via @NYPost https://t.co/ez2tAcOTj9 https://t.co/ggt7Pp9YM8,en,Hologic
Thu May 18 18:05:43 +0000 2017,Join @OsteoporosisNOF’s  Jumping Jack challenge during #NationalOsteoporosisMonth https://t.co/QQCWHmEv2T,en,Hologic
Thu May 18 17:00:01 +0000 2017,Build your child’s “bone bank” account by investing in healthy habits now! #OsteoporosisAwarenessMonth https://t.co/rhYYcdE1Rd,en,Hologic
Thu May 18 16:01:32 +0000 2017,"Whether you're 25 or 90, your health is important. Learn more at https://t.co/Q2o6UNPkaS #NWHW via @womenshealth https://t.co/kISSgqUgSl",en,Hologic
Wed May 17 19:01:18 +0000 2017,Congratulations to our Meg Eckenroad who was recognized by @BeckersHR as one of the top women in #medtech in 2017! https://t.co/8ZtjD3Eijl https://t.co/bpTlajUjsT,en,Hologic
Wed May 17 16:01:14 +0000 2017,Only have an hour? Here are 8 unexpected beauty treatments you can get on your lunch break from @ReadersDigest: https://t.co/SvBD6cjnHT,en,Hologic
Wed May 17 14:01:30 +0000 2017,Learn how physicians are using the MyoSure® REACH device to care for patients: https://t.co/XNlsLztuWi https://t.co/MyzaawOBaw,en,Hologic
Tue May 16 20:24:32 +0000 2017,We are thrilled to welcome Charles Dockendorff to our Board of Directors. https://t.co/vGgWzNwF8g https://t.co/YRhGXzmDqj,en,Hologic
Tue May 16 14:00:58 +0000 2017,"Hologic is celebrating National Women's Health Week. Global VP, Tracy Accardi shares what inspires her to help support women’s health. #NWHW https://t.co/2iqmzzlj1N",en,Hologic
Sun May 14 14:01:20 +0000 2017,"Today we celebrate moms. At Hologic, we are proud to champion women's health and well-being. https://t.co/j9DT99sGKq",en,Hologic
Fri May 12 13:01:19 +0000 2017,#ScienceFriday: Screenings and mammograms may help detect breast cancer early. #BCSM https://t.co/m08LRz1dLn https://t.co/F46PrKAktM,en,Hologic
Thu May 11 14:48:43 +0000 2017,"Our CEO, Steve MacMillan, spoke with @CNBC  about our transformational quarter, helping drive sustainable growth. https://t.co/ekz57AL7ND https://t.co/8Zc1JTqtnz",en,Hologic
Thu May 11 13:01:37 +0000 2017,"If you missed our Q2 #earnings call yesterday, you can listen to the replay here:  https://t.co/3E9fQlp2II $HOLX",en,Hologic
Wed May 10 20:15:19 +0000 2017,Tune into our Q2 #earnings conference call and webcast starting at 4:30pm ET. $HOLX https://t.co/dcWjaiXcba,en,Hologic
Wed May 10 20:06:33 +0000 2017,We reported Q2 financial results with revenues and EPS exceeding our guidance. See full press release: https://t.co/LayVQyp9Bq $HOLX https://t.co/ye2FArvM4G,en,Hologic
Tue May 09 14:01:47 +0000 2017,#ASMCVS attendees: Visit Booth 423 today to see the Tomcat instrument &amp; Panther Fusion system in action.,en,Hologic
Mon May 08 21:01:11 +0000 2017,Thanks to all who attended our symposium at #ASMCVS. Let's continue the discussion in Booth 423. https://t.co/dSmDF20dCP,en,Hologic
Mon May 08 20:59:10 +0000 2017,Our management team will be presenting at five upcoming investor conferences. See press release for more details: https://t.co/59IZvXdzX8,en,Hologic
Mon May 08 18:01:28 +0000 2017,ACOG recommends Pap+HPV Together testing for women ages 30-65. Visit Booth 615 for more. #ACOG17 https://t.co/RUW7LU82TX,en,Hologic
Mon May 08 17:01:32 +0000 2017,"Following our Panther Fusion symposium, stay put in Grand Ballroom Salon A for our Aptima symposium at 3 pm! https://t.co/4USTdcvNP1",en,Hologic
Mon May 08 16:30:45 +0000 2017,ACOG recommends screening women ages 30-65 with Pap+HPV Together (co-testing). Learn more at Booth 615. #ACOG17 https://t.co/hi0r984L0X,en,Hologic
Mon May 08 16:00:58 +0000 2017,"MonaLisa Touch is a life changing laser treatment for the painful symptoms of menopause, #ACOG17 Booth #1337 https://t.co/qX8g2WOZeA https://t.co/wGroRYEd01",en,Hologic
Mon May 08 15:01:37 +0000 2017,Our symposium on the Panther Fusion kicks off in Grand Ballroom Salon A at 1:15. #ASMCVS https://t.co/g6QmDLxg6a,en,Hologic
Mon May 08 14:01:17 +0000 2017,Attention #ACOG17 attendees: Be sure to stop by the @Hologic Booth 615 to see our proven AUB treatments in action. https://t.co/znc8WtfrbM,en,Hologic
Mon May 08 13:30:35 +0000 2017,May is #NationalOsteoporosisMonth. Visit us in Booth #615 at the @ACOG_AM to learn more about the role DXA plays in diagnosing #osteoporosis https://t.co/TZWdSJx1Nj,en,Hologic
Mon May 08 13:01:16 +0000 2017,"It's the final exhibitor day of #ACOG17. Stop by Booth 615 to learn how we're delivering proof, not promises. https://t.co/uloLGMocj2",en,Hologic
Sun May 07 21:00:30 +0000 2017,Universal Screening for certain groups of sexually active women can help control CT/NG growth rates. Learn more at Booth 615. #ACOG17 https://t.co/wiIRnHNxoD,en,Hologic
Sun May 07 20:30:19 +0000 2017,"We're a proud supporter of #ACOG17. Stop by Booth 615 and experience firsthand how we deliver not only performance, but proof. https://t.co/pKyhyZyqQu",en,Hologic
Sun May 07 20:00:46 +0000 2017,Visit Booth 615 to see how @Hologic is delivering surgical products to address debilitating gynecologic conditions. #ACOG2017. https://t.co/2EtTmxeSA7,en,Hologic
Sun May 07 19:00:36 +0000 2017,Join us in booth #615 at the @ACOG_AM to learn why the #Genius3Dexam has greater accuracy than 2D mammo for women of all breast densities https://t.co/wcv91J302x,en,Hologic
Sun May 07 18:00:41 +0000 2017,"Fetal fibronectin testing provides a clinically proven predictive value for preterm labor. Let’s talk fFN testing at #ACOG17, Booth 615. https://t.co/oyJkDtjIXH",en,Hologic
Sun May 07 17:30:27 +0000 2017,We're hosting a second symposium tomorrow at #ASMCVS. https://t.co/f98plOV72C,en,Hologic
Sun May 07 17:01:01 +0000 2017,Add our symposium to your schedule at #ASMCVS tomorrow. https://t.co/Vjbj0YMhSs,en,Hologic
Sun May 07 17:00:44 +0000 2017,"Learn more about co-testing with the ThinPrep Pap test and Aptima HPV assays at #ACOG17, Booth 615. https://t.co/2FRTKLEfEe",en,Hologic
Sun May 07 16:00:48 +0000 2017,See why we support a Universal Screening Strategy in women younger than 25 and certain other at-risk groups at Booth 615. #ACOG17 https://t.co/d4Ul46SzLe,en,Hologic
Sun May 07 14:00:52 +0000 2017,Welcome to the first day of #ACOG17. Get hands on experience with our proven AUB treatments at the Hologic Booth #615. https://t.co/P5kgbBfDx3,en,Hologic
Sun May 07 13:00:56 +0000 2017,"The 33rd annual Clinical Virology Symposium kicks off in Savannah, GA, today. See you at Booth 423. #ASMCVS https://t.co/ySnwajJxMa",en,Hologic
Sat May 06 22:00:28 +0000 2017,Excited to speak with top minds in OBGYN starting tomorrow at #ACOG17. Let’s talk about co-testing for cervical health at Booth 615. https://t.co/k5Ztdvfz5P,en,Hologic
Sat May 06 15:00:36 +0000 2017,See how ffN testing provides peace of mind as a predictor for preterm labor risk.  Visit Booth 615 at #ACOG17 starting tomorrow https://t.co/UZpfJAkfiF,en,Hologic
Sat May 06 14:26:15 +0000 2017,"At @MassScienceFair? Estefi Alvarez, a senior scientist @Hologic, will talk to students about #STEM careers at 10:15 a.m. https://t.co/6hQCAIf7U3",en,Hologic
Sat May 06 14:00:33 +0000 2017,Today is the start of #ACOG17. We look forward to hearing about the latest developments in women's health.  Visit us at Booth 615. https://t.co/mVDrUKMD1e,en,Hologic
Fri May 05 22:17:24 +0000 2017,.@Hologic  will be at #ACOG2017 showcasing the #NovaSure and #MyoSure devices. Come visit us at Booth 615. https://t.co/Od0l0a1XjX,en,Hologic
Fri May 05 21:35:41 +0000 2017,Will you be at #ACOG2017 this year? Visit  @Hologic at Booth 615 for the latest from our GYN Surgical Solutions team! https://t.co/R8dyV38v5G,en,Hologic
Fri May 05 16:01:59 +0000 2017,Have you seen our latest addition to our Aptima assays? Come to Booth 241 to see our recently approved #Aptima assays for HBV and HCV. https://t.co/pReyRgXFeX,en,Hologic
Fri May 05 13:30:29 +0000 2017,We are proud to sponsor the @MassScienceFair to help advance #STEM education. https://t.co/G4Aj5u1C6f,en,Hologic
Fri May 05 13:01:42 +0000 2017,We're in the #CACMID2017 Exhibition Hall again today at Booth 241. Come and talk to us about our latest innovations. #pantherfusion #aptima https://t.co/a9EIIkqKuy,en,Hologic
Fri May 05 12:30:29 +0000 2017,Chlamydia was first discovered in 1907 by Stanislaus VonProwazek in Berlin. #ScienceFriday https://t.co/nKIio7hThL,en,Hologic
Thu May 04 17:01:33 +0000 2017,Can we help you consolidate your infectious disease testing? Learn how at Booth 241 #CACMID2017 #pantherfusion #aptima https://t.co/SOcWbI7itc,en,Hologic
Thu May 04 13:01:45 +0000 2017,Good to see you at our #CACMID2017 accredited symposium this morning! To find out more about STI testing come and talk to us at Booth 241. https://t.co/SI78uwERTQ,en,Hologic
Wed May 03 21:01:11 +0000 2017,The #CACMID2017 Exhibit Hall opens tomorrow. Come to Booth 241 &amp; learn how to expand your testing capabilities with our new innovations. https://t.co/jhK1fnaTZv,en,Hologic
Wed May 03 16:02:28 +0000 2017,Mark your calendars for our Q2 financial results next week on 5/10. Find out more on the conference call here: https://t.co/pgMPPXFPyQ $HOLX,en,Hologic
Wed May 03 13:01:39 +0000 2017,Welcome to #CACMID2017 day 1. Are you registered for tomorrow's  symposium 'Changing Landscape of STIs in Canada'? https://t.co/e0dxXuZhrc https://t.co/BYZiT5Lzn5,en,Hologic
Tue May 02 16:00:35 +0000 2017,May is #NationalOsteoporosisMonth. Visit https://t.co/HBVGGVB1tR to take a Bone Health IQ quiz and get tips on how to prevent the disease. https://t.co/wnZvfufNqf,en,Hologic
Tue May 02 13:01:01 +0000 2017,Are you going to #CACMID2017? Don't forget to register for our accredited symposium https://t.co/e0dxXuZhrc. We look forward to seeing you! https://t.co/4N7lPqUwiG,en,Hologic
Mon May 01 20:02:54 +0000 2017,Are you attending #ACOG17? Find us during the conference at Booth 615 to learn how we're making the Science of Sure a priority. https://t.co/RupuO5bbnL,en,Hologic
Mon May 01 13:01:03 +0000 2017,Tom West shares the importance of the Science of Sure in relation to diagnostics at Hologic.  https://t.co/DCFt4bLwtf,en,Hologic
Sun Apr 30 14:30:47 +0000 2017,We're dedicated to helping cytotechs work smarter with advanced testing and automated instrumentation. #ASCT 2017 https://t.co/0QV7rUNKb5,en,Hologic
Sat Apr 29 14:01:21 +0000 2017,We can't wait to talk with you about our instrumentation for lab automation and precision Pap testing at our booth. #ASCT https://t.co/lt2tnUmIFU,en,Hologic
Fri Apr 28 22:00:35 +0000 2017,Are you registered for our #CACMID2017 symposium? Come learn about the changing landscape of STI diagnosis in Canada https://t.co/e0dxXuZhrc https://t.co/bJtuQXTSGQ,en,Hologic
Fri Apr 28 19:01:38 +0000 2017,Thank you for helping us to raise awareness around the importance of STI screening this #STIAwarenessMonth. #STDMonth17 https://t.co/K1KQvZRHiH,en,Hologic
Fri Apr 28 17:47:41 +0000 2017,Thank you @GoMHSDukes for a successful Career Pathways Fair. https://t.co/zpknxI38LY,en,Hologic
Fri Apr 28 17:01:47 +0000 2017,.@HelloGiggles helps smash #STD stigmas during #STDMonth17 #YesMeansTest https://t.co/c5npsF1t0z,en,Hologic
Fri Apr 28 16:02:15 +0000 2017,Laboratorians are the foundation of diagnostic medicine. Thanks to all who help healtchare providers Be Sure. #LabWeek https://t.co/OODOuitCDE,en,Hologic
Fri Apr 28 13:00:53 +0000 2017,"Are you going to #CACMID2017? Come and see us, we'll be sharing our latest Aptima #viral load assays for #HIV-1, #HBV and #HCV at booth 241. https://t.co/GCyzHkIp6v",en,Hologic
Wed Apr 26 15:02:24 +0000 2017,#LabWeek first began in 1975 to honor those who dedicate their lives to laboratory science. Thanks to our lab partners globally. https://t.co/klfqdcEUvU,en,Hologic
Tue Apr 25 19:01:49 +0000 2017,Laboratorians play a key role in detecting disease so patients get much-needed treatment. #LabWeek #Lab4Life https://t.co/7r1dvY5Obq,en,Hologic
Tue Apr 25 16:02:25 +0000 2017,Thank you to everyone at #ECCMID2017. It was great to see new and familiar faces. See you again next year. https://t.co/PEnbY1blxg,en,Hologic
Tue Apr 25 14:02:06 +0000 2017,Being diagnosed early means you have more options for breast cancer treatment. Develop a treatment plan. https://t.co/ic1AcKEMjp https://t.co/baNNUN3p0i,en,Hologic
Tue Apr 25 07:00:58 +0000 2017,"It's the last day at #ECCMID2017. If you haven't talked to us about how we can help you expand your testing capabilities, come to Booth 7 https://t.co/NRaAsylr0S",en,Hologic
Mon Apr 24 20:00:30 +0000 2017,Interested in our history? See how we've innovated over the years. https://t.co/wTZxsdsRTL https://t.co/j8YLFualCJ,en,Hologic
Mon Apr 24 17:14:29 +0000 2017,RT @JShepherd_MD: .@Hologic sharing the importance of #papsmear screening for #cervicalcancer today after premiere of @hbo @Oprah #HENRIETT…,en,Hologic
Mon Apr 24 16:02:05 +0000 2017,"Thank you to everyone who joined us for our symposium at #ECCMID2017. If you have any questions, come and visit us in Booth 7. https://t.co/9lxjCuIMR7",en,Hologic
Mon Apr 24 13:31:06 +0000 2017,Is there a Purr-fect combination of science and technology? Find out at our #ECCMID2017 symposium starting in 30 minutes. See you soon! https://t.co/xdJShOMo1q,en,Hologic
Mon Apr 24 12:01:33 +0000 2017,"This week, we celebrate laboratorians who play a vital role in the diagnosis and prevention of disease. #LabWeek https://t.co/wQxBPmmLtu",en,Hologic
Mon Apr 24 10:30:45 +0000 2017,Could a fully automated system help you? Book a demo of our new Panther Fusion system (in development) on booth 7 and find out? #ECCMID2017 https://t.co/wAX8931GDT,en,Hologic
Mon Apr 24 07:00:54 +0000 2017,Welcome to day 3 at #ECCMID. Our symposium 'Clinical Management and Molecular Diagnosis of Respiratory Viruses' is taking place at 16.00hr https://t.co/XC0GfzxHCE,en,Hologic
Sun Apr 23 16:01:38 +0000 2017,It's the end of day 2 at #ECCMID2017. We're looking forward to seeing you again tomorrow &amp; sharing exciting new information at our symposium https://t.co/shwpsDW6zK,en,Hologic
Sun Apr 23 13:30:44 +0000 2017,"Interested in consolidating your STI, Viral, Respiratory, Cervical Health &amp; LDT testing on one system? Visit booth 7 to see how #ECCMID2017 https://t.co/Vo7F2qnbqO",en,Hologic
Sun Apr 23 13:01:15 +0000 2017,#DYK that Hologic now has a medical aesthetics division? Learn more about @Cynosure_Lasers:  https://t.co/uaKJfg1Y98,en,Hologic
Sun Apr 23 07:01:07 +0000 2017,"It’s Day 2 at #ECCMID2017. To find out more about our portfolio of Aptima viral load monitoring assays for HIV-1, HBV &amp; HCV come to booth 7 https://t.co/GVAbYITVwG",en,Hologic
Sat Apr 22 13:01:36 +0000 2017,Happy Earth Day! https://t.co/TAqUQXhShT,en,Hologic
Sat Apr 22 10:30:42 +0000 2017,Can you expand your testing capabilities with Panther Fusion (in development) &amp; our new Aptima assays? Book a demo. Booth 7 #ECCMID2017 https://t.co/DM6rJi1Add,en,Hologic
Sat Apr 22 07:00:51 +0000 2017,Welcome to the first day of #ECCMID2017.  We look forward to meeting you at Booth 7 and helping you build your knowledge. https://t.co/1e54qyr4s0,en,Hologic
Fri Apr 21 16:02:12 +0000 2017,Universal screening for #chlamydia has many benefits including reduction in prevalence. #STDMonth17 #STIAwarenessMonth https://t.co/vffzBwC3ky,en,Hologic
Fri Apr 21 15:01:53 +0000 2017,.@Whitneycummings talks to millennials to break down stigmas surrounding STI testing  .@InfoASHA https://t.co/5Z4FMSs6DW #STDMonth17,en,Hologic
Fri Apr 21 11:01:38 +0000 2017,#ECCMID2017 starts tomorrow. We're here in Vienna getting ready to help you expand your testing capabilities and sharing our new assays. https://t.co/jBUWND5lAV,en,Hologic
Thu Apr 20 15:14:34 +0000 2017,"This Volunteer Recognition Day, we salute our employees who are doing incredible volunteer work within their communities. https://t.co/cGxs7SvKAG",en,Hologic
Thu Apr 20 07:00:53 +0000 2017,Going to #ECCMID2017? Join us at our symposium to learn more about Clinical Management and Molecular Diagnosis of Respiratory Viruses. https://t.co/h5inoBGCvc,en,Hologic
Wed Apr 19 20:30:39 +0000 2017,Learn the facts about Mycoplasma genitalium and how to treat this #STI from @InfoASHA: https://t.co/4QZcPt9dX7 https://t.co/OuyWNr4QpW,en,Hologic
Wed Apr 19 15:01:52 +0000 2017,We value our partnerships with the healthcare providers that work tirelessly to deliver the best care to patients. https://t.co/TqMdrm9pCo,en,Hologic
Wed Apr 19 14:40:28 +0000 2017,"RT @carmenansotegui: Joao Malagueira de @Hologic: ""el diagnóstico es una de las áreas más importantes para la #sostenibilidad del sistema s…",es,Hologic
Wed Apr 19 14:29:50 +0000 2017,RT @InfoASHA: We agree with @USATODAY:STD testing is front page news.Stop by https://t.co/HtvLVUsquh to find more facts and a clinic.  #YES…,en,Hologic
Wed Apr 19 14:01:30 +0000 2017,.@EbonyMag emphasizes the importance of African Americans getting tested for STDs. https://t.co/wQ6v3pBtrT #YesMeansTest #STDMonth17,en,Hologic
Wed Apr 19 00:00:54 +0000 2017,Love diagnostics? Consider a job at Hologic. https://t.co/ogn7MOMVg6 https://t.co/GD1rtFJt0q,en,Hologic
Tue Apr 18 20:37:09 +0000 2017,#Cynosure has been awarded best medical equipment site in the Internet Advertising Competition. Congrats! https://t.co/NqcBGLk0bW,en,Hologic
Tue Apr 18 16:57:19 +0000 2017,"Congratulations, Eric. https://t.co/lI0GsmONMe",ro,Hologic
Tue Apr 18 14:01:25 +0000 2017,We’ll be at the @SusanGKoman Race for the Cure in Savannah on 4/22. Learn more about our screening and diagnosis services there.,en,Hologic
Tue Apr 18 10:01:04 +0000 2017,Going to #ECCMID2017? Sign up for a demo of our new Panther Fusion system (in development) https://t.co/RzMJhJcSmu https://t.co/hGf9o2MMRz,en,Hologic
Mon Apr 17 21:01:16 +0000 2017,New study finds that the birth control pill may prevent some #cancers. https://t.co/XuVJ0Gisev https://t.co/HC0ox9smKc,en,Hologic
Mon Apr 17 19:00:32 +0000 2017,#DYK that Hispanics are twice as likely to get chlamydia and gonorrhea? https://t.co/oTmRnJ1B5X #YesMeansTest @InfoASHA #STDMonth17,en,Hologic
Mon Apr 17 17:00:33 +0000 2017,"At Hologic, we’re proud to unite our efforts towards one goal: advancing women’s health. https://t.co/38E7xI40Aa",en,Hologic
Mon Apr 17 15:15:47 +0000 2017,Let’s support @InfoASHA as they shatter the stigma around STD testing. #STDMonth17 https://t.co/bzw9mKDy0z,en,Hologic
Fri Apr 14 18:38:40 +0000 2017,RT @soulpancake: NEW VIDEO NEW VIDEO NEW VIDEO! We partnered with @infoASHA and @WhitneyCummings to declare that #YESmeansTEST https://t.co…,en,Hologic
Fri Apr 14 14:01:39 +0000 2017,#DYK trichomoniasis can lead to preterm delivery and increase risk of #HIV transmission #ScienceFriday #STDMonth17 https://t.co/3Sc3ZiPHvr https://t.co/qkrLRqAWXY,en,Hologic
Thu Apr 13 18:29:24 +0000 2017,We’re proud to have @SculpSure listed in the 2017 @NewBeauty Awards. https://t.co/5eW71cyvy4,en,Hologic
Thu Apr 13 10:01:02 +0000 2017,Just over two weeks to go to #ECCMID2017. Are you ready to join the evolution? Come &amp; visit us on Booth 7 https://t.co/RzMJhJcSmu https://t.co/3AoqsE0jF5,en,Hologic
