created_at,full_text,lang,user_name
Sun Jun 24 14:44:33 +0000 2018,"Our event continues to have a packed house at the Montage Beverly Hills, CA. Dr. Mulholland demonstrates our newest technology for #skintightening - TempSure Envi. Find out more about TemSure Envi here: https://t.co/uvYXO4uNnT https://t.co/Rp8pxQdZAj",en,Hologic
Sat Jun 23 16:00:20 +0000 2018,"We had the pleasure of hosting a fantastic event yesterday at the Montage Beverly Hills, CA to a packed house. Steven A. Rabin, M.D. and Dr. Kathy Anderson presented the latest Cynosure innovations including MonaLisa Touch. https://t.co/2l8f6IUc7n",en,Hologic
Fri Jun 22 12:01:30 +0000 2018,"When Karen’s heavy periods started to get in the way of her fun-loving, active lifestyle, she knew it was time to take action. Learn how Karen found relief from #heavyperiods: https://t.co/TdpLuSmeTc https://t.co/7Llmenbxbv",en,Hologic
Thu Jun 21 17:00:46 +0000 2018,Kudos to our Danbury team for giving back to the community by partnering with @HomeFront to help local families in need. https://t.co/0dGPYNbOuU,en,Hologic
Thu Jun 21 14:30:32 +0000 2018,"At Hologic, we're proud that our employees constantly strive to challenge one another to do their best work. Matt shares  #WhyHologic https://t.co/SIkn5jbEhC https://t.co/lEAvzzQAKE",en,Hologic
Thu Jun 21 03:05:22 +0000 2018,"According to @AmericanCancer, maintaing a healthy diet and incorporating regular exercise into one's daily routine may help lower the risk of #breastcancer. Learn more: https://t.co/X9S0DrWHP7. https://t.co/jRUvhvZQuy",en,Hologic
Tue Jun 19 16:15:24 +0000 2018,#FACT Only 30% of those infected with STI Trichomonas experience symptoms?  Read @Refinary29 everything you need to know about #Trich  and when to get tested. https://t.co/XCi8G7c3uz,en,Hologic
Tue Jun 19 16:01:38 +0000 2018,"#DYK why some women have #heavyperiods? Common causes include fibroids, polyps and hormonal imbalances. To learn more about  potential symptoms and treatment options, visit: https://t.co/qCu3nVxYRp. https://t.co/lza6WuLxFY",en,Hologic
Tue Jun 19 12:01:26 +0000 2018,"In support of this year’s #NationalSafetyMonth, we’re proud to continue our commitment to providing a safe and healthy work environment for all our employees. @NSCsafety #No1GetsHurt https://t.co/esx8UgHrtl",en,Hologic
Mon Jun 18 16:56:55 +0000 2018,We’re excited to share that @Tommys_baby has launched a new digital tool to give women all the information they need to know before pregnancy as part of its #AreYouReady campaign. Check out the tool here: https://t.co/vYeT4mnpwp. https://t.co/bHL0srklpt,en,Hologic
Mon Jun 18 15:01:29 +0000 2018,"As a global champion of #womenshealth, we're proud to be comprised of passionate and dedicated thinkers. Explore how you can join our team today: https://t.co/QPivZcBUEr. https://t.co/V5mxolnKYE",en,Hologic
Mon Jun 18 14:35:37 +0000 2018,Health Canada approves Hologic’s Panther Fusion® system and PCR-based respiratory virus. https://t.co/OOKDlzUbPG,en,Hologic
Mon Jun 18 12:01:22 +0000 2018,Looking to speak with a physician about #fibroid or #polyp removal? Use our ‘Find a Physician’ tool to locate a doctor in your area: https://t.co/k2k2jtC17e https://t.co/xdKW05Xxg4,en,Hologic
Sun Jun 17 14:30:34 +0000 2018,"Happy Father's Day! Today, take time to celebrate the men in your life and let them know what they mean to you. https://t.co/aviZrLQ7P5",en,Hologic
Fri Jun 15 19:00:54 +0000 2018,"We are proud of our Danbury, CT employees who participated together in the  @AmericanCancer Relay for Life to remember loved ones lost, honor survivors of all cancers, and raise money to help make a global impact on cancer. https://t.co/GM2127g576",en,Hologic
Fri Jun 15 17:01:36 +0000 2018,"TempSure Envi can give your patients an easy, gentle way to maintain younger-looking skin without invasive procedures or downtime, no matter what their skin type or time of year! Learn more today! https://t.co/VmwRsFOXNb",en,Hologic
Fri Jun 15 15:30:39 +0000 2018,"Have you scheduled your screening yet? This #CervicalScreeningAwarenessWeek, we’re highlighting the importance of regular screening. #SmearTestsSaveLives https://t.co/6s3fuFk4yc",en,Hologic
Fri Jun 15 14:30:40 +0000 2018,Can’t get the number to budge on the scale? You might be monitoring the wrong number. It’s time to understand your body composition: https://t.co/y0VSAkbmJj. https://t.co/s0OsOmFzjt,en,Hologic
Fri Jun 15 13:01:49 +0000 2018,Have you heard of our SculpSure treatment? Check out this article from @Health which shares one patient's experience: https://t.co/fncOAYpBzP.,en,Hologic
Thu Jun 14 20:45:11 +0000 2018,"What do men really want to know about #periods? @Cindy_Basinski and @FamilyCircleMag answer their burning questions:
Link: https://t.co/tAVRUGbgWG #WeHateHeavyPeriods",en,Hologic
Thu Jun 14 16:01:54 +0000 2018,"The number of cervical cancer cases has been cut in half over the last 40 years. If every woman committed to an annual exam, that number could be closer to zero. It starts with you. https://t.co/mD9DYHsi2I https://t.co/l9fZ0Cg5bZ",en,Hologic
Thu Jun 14 15:07:17 +0000 2018,"In support of #CervicalScreeningAwarenessWeek, we’re raising awareness about the importance of regular screening to reduce one’s risk of developing #cervicalcancer. #SmearTestsSaveLives https://t.co/senmavfR6h",en,Hologic
Thu Jun 14 12:01:25 +0000 2018,$HOLX CEO Steve MacMillan will present at the @GoldmanSachs Healthcare Conference today at 8:40am PT. You can listen to the live presentation here: https://t.co/v9zXAVFakw,en,Hologic
Wed Jun 13 16:02:00 +0000 2018,It's important that women take a proactive approach to their health - even busy moms!  Here are the 4 appointments that should always be on your calendar: https://t.co/CTYDeVlW5s. @MomBlogSociety,en,Hologic
Wed Jun 13 15:30:43 +0000 2018,"We’re excited to welcome our 2018 summer interns to Hologic sites across the country, including Marlborough, MA, as they learn about our business and culture and apply their talents to meaningful projects in #womenshealth. https://t.co/IpkfrapZNu",en,Hologic
Wed Jun 13 08:00:51 +0000 2018,Thank you to all attendees at European Congress of #Cytology 2018 for visiting our Booth 15 &amp; 16 and our satellite lunch symposium. https://t.co/twm8MYz67O,en,Hologic
Tue Jun 12 20:01:08 +0000 2018,Do you know everything you need to know about HPV? @WomensHealth lists all the facts you need to know about #HPV.  Make sure you are informed and get tested. https://t.co/uH2BVbhoVN,en,Hologic
Tue Jun 12 18:00:23 +0000 2018,"Interested in women's health? Hear from our employee, Jennifer, as she shares her experience working for Hologic and visit our career openings here: https://t.co/dBKJQbbf6J https://t.co/gOsW680d2s",en,Hologic
Tue Jun 12 14:30:41 +0000 2018,"We're hiring! As a leading women's health company, we're looking for dedicated and passionate employees to join our team. Explore our openings today: https://t.co/nJ8o566iHP. https://t.co/gbx34fAx10",en,Hologic
Tue Jun 12 11:01:02 +0000 2018,"Experience the future of #cytology, visit us on Booth 15 &amp; 16 to find out more at European Congress of #Cytology 2018. https://t.co/vaO0FlEfjD",en,Hologic
Tue Jun 12 08:00:47 +0000 2018,Remember to join us today for our satellite lunch symposium in Room Castilla at 14.00 at the European Congress of #Cytology 2018. https://t.co/oHtbFsYC5Y,en,Hologic
Mon Jun 11 18:01:12 +0000 2018,Check out the latest on the #MyoSure MANUAL device: https://t.co/5lTWHMTHLr https://t.co/WmgDigm6YX,en,Hologic
Mon Jun 11 16:01:30 +0000 2018,"It’s time for you to regain your freedom from #heavyperiods. Visit https://t.co/ge02vp919w for helpful resources, and to learn more about potential treatment options. https://t.co/KHNJswQ7IP",en,Hologic
Mon Jun 11 13:00:15 +0000 2018,Our employee Sonal shares what makes her proud to work for a leading women's healthcare company: Hear other employees here: https://t.co/SIkn5jbEhC. #WhyHologic https://t.co/M6ej4CIPE6,en,Hologic
Mon Jun 11 08:30:21 +0000 2018,Learn how our tests and automated solutions can address your #cervical screening needs today &amp; into the future. Booth 15 &amp; 16 at European Congress of #Cytology 2018. https://t.co/e1til454oo,en,Hologic
Mon Jun 11 08:00:45 +0000 2018,"Visit Hologic Booth 15 &amp; 16 and see ThinPrep Integrated Imager &amp; ThinPrep Genesis system* in action at European Congress of #Cytology 2018. (*In development, not available for sale) https://t.co/N7sn8zaadX",en,Hologic
Sun Jun 10 17:00:53 +0000 2018,Learn more about exciting additions to the Panther technology you’ve come to trust. Check out a live demo of the Panther Fusion system during the final exhibit hours at #ASMicrobe. https://t.co/kGyt2CL0Zh,en,Hologic
Sun Jun 10 13:30:22 +0000 2018,"Explore the full menu of Aptima and Panther Fusion assays, including new viral-load and respiratory assays, today at Booth 2417. #ASMicrobe https://t.co/5me0KuBngH",en,Hologic
Sun Jun 10 08:00:33 +0000 2018,Learn about our latest innovations for #cervical health screening and future of #cytology on Booth 15 &amp; 16 at European Congress of #Cytology 2018. https://t.co/Tp73unwAI7,en,Hologic
Sat Jun 09 14:01:07 +0000 2018,Stop by Booth 2417 today to learn more about the combination of PCR and TMA technologies on the Panther Fusion system and see a live demo. #ASMicrobe https://t.co/XxDmtY0EVf,en,Hologic
Fri Jun 08 20:27:23 +0000 2018,"#ISSNClearwater conference attendees, check out our booth to learn more about how Dexalytics:TEAMSTM technology can inform your sports nutrition strategies. https://t.co/D7jt6pMKRX",en,Hologic
Fri Jun 08 18:00:23 +0000 2018,#DYK there are other non-common places on your body you can contract an STD?  @Health lists the other places to be aware of https://t.co/dbnarsMR2s #GetTested,en,Hologic
Fri Jun 08 17:00:53 +0000 2018,TempSure Envi is a radiofrequency treatment that safely delivers consistent and reliable skin tightening* and tissue heating through its unique time and temperature control capability: Learn more: https://t.co/VmwRsFOXNb.,en,Hologic
Fri Jun 08 14:01:46 +0000 2018,"#ASMicrobe attendees: Join us today at Booth 2417 when the exhibit hall opens to discover how the Panther and Panther Fusion systems consolidate your STI, virology and respiratory testing portfolios. https://t.co/60AlzHReJ6",en,Hologic
Thu Jun 07 18:00:19 +0000 2018,Check out this @RadiologyToday story spotlighting our partnership with @DEXalytics to offer groundbreaking #bodycomposition analysis software and what it means for athletes https://t.co/KJiMcxjjIF,en,Hologic
Thu Jun 07 16:01:23 +0000 2018,Aesthetics is a massive industry and continues to grow. Looking to join in? Learn about how you can expand your aesthetic treatment menu with a single device. The Icon Aesthetic System. https://t.co/2fyU3R0TkR https://t.co/WbQnyyd7Q4,en,Hologic
Thu Jun 07 13:01:32 +0000 2018,"If you experience #heavyperiod symptoms that affect your quality of life, it may be time to talk to a doctor. Use our ‘Find a Physician’ tool to locate a physician in your area: https://t.co/XHH0OuhDv2. https://t.co/XA612oadv1",en,Hologic
Wed Jun 06 17:01:34 +0000 2018,"Every stride taken in the gym, every weight lifted, and every distance covered can be attributed to your body composition. DXA BodyLogic™ scan provides the most accurate and in depth measurements of your body in three minutes. https://t.co/LoeUDGubkG",en,Hologic
Wed Jun 06 08:00:47 +0000 2018,"We are hosting a satellite lunch symposium at the European Congress of #Cytology 2018, 12 June at 14:00 in Room Castilla. Join us! https://t.co/1MOYt5xJij",en,Hologic
Mon Jun 04 17:01:18 +0000 2018,"In an interview with @WomensHealthMag, Cindy Basinski, MD (@cindy_basinski) explains what is considered a normal vs. abnormal #period and when it’s time to talk to your doctor: https://t.co/mzE1CdXVZa",en,Hologic
Mon Jun 04 14:30:36 +0000 2018,We're proud to sponsor today's Awards Breakfast at @APHL 2018 and celebrate our colleagues' achievements and innovation in public health. Visit us after at Booth 415/514. https://t.co/Vt4d4sLGRc,en,Hologic
Mon Jun 04 08:00:44 +0000 2018,"We will be at the European Congress of #Cytology, 10-13 June in Madrid. Come and visit our Booth 15 &amp; 16 to see our comprehensive cytology solution! https://t.co/1Uyn8IZWTN https://t.co/dmoAbt2pf4",en,Hologic
Mon Jun 04 04:00:22 +0000 2018,"SculpSure submental offers a new, innovative way to sculpt and define the chin area. View our latest webcast to learn more about SculpSure's latest advancement to treat the submental area: https://t.co/m2dqEgBPwY. https://t.co/scSbzpbP89",en,Hologic
Sun Jun 03 16:01:00 +0000 2018,"Hologic is a leader in diagnostic testing for diseases that pose a serious threat to public health. Visit us at Booth 415/514 to talk about consolidated virology, STI and respiratory testing and see a live demo of the Panther Fusion system. https://t.co/CApaA2b68n",en,Hologic
Sun Jun 03 16:00:59 +0000 2018,"This National Cancer @SurvivorsDay, we're celebrating life and raising awareness on early detection saves lives. #NCSD2018 https://t.co/1Bjwh4IeMJ",en,Hologic
Sat Jun 02 16:00:49 +0000 2018,Come and explore our growing assay menu - including our latest Panther Fusion Respiratory assays for syndromic respiratory testing - and experience a live demo of the Panther Fusion system. @APHL https://t.co/BBhNsCVAfy,en,Hologic
Fri Jun 01 14:30:37 +0000 2018,"Learn more about the device backed by over 85 publications and industry presentations, including 10 at ASLMS 2018. PicoSure - world's first, worlds ahead: https://t.co/9EgTSDEsdz. https://t.co/8VQ6g7Wtro",en,Hologic
Fri Jun 01 14:30:37 +0000 2018,"While BMI (body mass index) measures body fat in comparison to height and weight, body composition, more importantly, gauges the muscle to fat ratios in your body: https://t.co/niHMP8jikG. https://t.co/92A4bWdeVF",en,Hologic
Thu May 31 13:01:31 +0000 2018,"Allison Bebo, our SVP of HR, shares how Hologic employees are driven by our purpose to enable healthier lives everywhere, every day. Read more: https://t.co/e5rd1VBKU9",en,Hologic
Wed May 30 23:19:21 +0000 2018,"Thank you @RepScottPeters for visiting our campus today and sharing your work on healthcare, life sciences and other topics important to San Diego. https://t.co/fzEf2zXFdo",en,Hologic
Wed May 30 16:00:22 +0000 2018,"How are current fluid management systems presenting challenges to nurses in the OR? Mary Johnston, RN shares more about the implications of fluid management systems for nurses in this Becker’s Hospital Review article. Read more here: https://t.co/L8QYiZC0WR https://t.co/wxjo6SUMxA",en,Hologic
Wed May 30 12:01:20 +0000 2018,Our team at Hologic is full of people like Rhonda who are driven to empower people to live healthy lives everywhere every day. Apply to join our team today: https://t.co/220PA8efjM. https://t.co/TtwdIpsuBu,en,Hologic
Tue May 29 19:00:26 +0000 2018,"How are current #fluidmanagement systems presenting challenges to #nurses in the OR? Mary Johnston, RN shares more about the implications of fluid management systems for nurses in this @BeckersHR article. Read more here: https://t.co/L8QYiZC0WR https://t.co/PTkhD0G10P",en,Hologic
Tue May 29 16:01:20 +0000 2018,We whisper it because we’re embarrassed.” Great to see @AmySchumer getting real about #periodtalk on @NBCSNL #WeHateHeavyPeriods https://t.co/bjF23FgqF5,en,Hologic
Tue May 29 14:01:36 +0000 2018,"While #osteoperosis is more likely to occur as you get older, it's not inevitable. For more myths about the condition, check out this article from @healthline: https://t.co/ycelHmX0A9.
#NationalOsteoporosisMonth",en,Hologic
Mon May 28 13:02:20 +0000 2018,"This Memorial Day, we remember those who have served and given their all for our country. #MemorialDay https://t.co/TXtguQZsBS",en,Hologic
Fri May 25 13:01:51 +0000 2018,"According to the @CDC, certain #STIs are on the rise among young adults ages 15 to 24. Check out this article from @Refinery29 on the importance of sex education: https://t.co/2KMfpfHQL0.",en,Hologic
Thu May 24 18:07:39 +0000 2018,It’s time to talk #menopause! Dr. Mickey Karram discusses the importance of speaking with your physician on post-menopausal symptoms and figuring out the best treatment option for you. https://t.co/PE6q7aEgBA,en,Hologic
Thu May 24 16:02:09 +0000 2018,We want every woman to discover their own beautiful. Visit our site to see how we can help: https://t.co/fZNAGg1CMX. https://t.co/veE84prtIy,en,Hologic
Thu May 24 13:01:04 +0000 2018,"#TBT Our employee Estefi, had a great time judging this year’s @MassScienceFair at @MIT attended by over 300 MA high school students who presented their projects on scientific research &amp; engineering design. Congrats to all the participants! https://t.co/UMB613QYl0",en,Hologic
Wed May 23 16:02:08 +0000 2018,SculpSure is now FDA-cleared to treat fat under the chin - providing a slimmer appearance of the face and neck. Check out more great results at https://t.co/zEcTC1fgLV https://t.co/U5B00SoW1B,en,Hologic
Wed May 23 13:01:48 +0000 2018,Looking to make a career move? Apply to join one of the world's leading women's healthcare companies today: https://t.co/220PA8efjM. https://t.co/rkNyFibbKa,en,Hologic
Tue May 22 15:01:45 +0000 2018,Don’t miss your chance to talk to us about fFN testing and studies that show its benefits during preterm labor evaluation during #ACNM2018 at Booth 201. https://t.co/zrjNNhsTNH,en,Hologic
Mon May 21 15:01:35 +0000 2018,The exhibit hall opens today at #ACNM2018. Visit us at Booth 201 this evening to learn about a new study that shows fFN testing + transvaginal ultrasound is better than TVUS alone. https://t.co/5b2MYlbeQR,en,Hologic
Sun May 20 15:01:06 +0000 2018,"We’re in Savannah, GA, for #ACNM2018. Visit us starting tomorrow at Booth 201 to learn about the value of adding #fFN testing to your preterm labor evaluations. https://t.co/AZQ3WQX2Dq",en,Hologic
Fri May 18 16:01:39 +0000 2018,"No matter your age, it's never too early or late to prioritize your health. This #NWHW, visit @womenshealth for tips on what you can do at each stage of life to better your health: https://t.co/g0efdEHon1. https://t.co/MZkbgORArK",en,Hologic
Fri May 18 13:01:50 +0000 2018,Are you looking for a #minimallyinvasive treatment option for fibroids? Head over to https://t.co/4ucMNInyuq to find a local physician who can help. https://t.co/4KJmbe4bUc,en,Hologic
Thu May 17 19:29:49 +0000 2018,"Today, Hologic employees cycled to work in support of Bike to Work Day, which aims to raise awareness for daily commutes as a healthy and safe alternative to driving.  #biketowork https://t.co/h5IkiByGY1",en,Hologic
Thu May 17 16:45:17 +0000 2018,Watch how one of our products impacted the life of Australian patient Lucy via @tendailyau: https://t.co/2St6gAb7za,en,Hologic
Thu May 17 14:30:41 +0000 2018,Proper fluid management is a component part of successful #hysteroscopy. @DrRandell shares his thoughts on the implications of fluid management for an #OBGYN here: https://t.co/7GY7UCu055 https://t.co/JT2oK83o05,en,Hologic
Thu May 17 14:30:33 +0000 2018,"At Hologic, we're proud that our employees see firsthand the impact their work has on women and their families everywhere. Yvonie shares  #WhyHologic https://t.co/SIkn5jbEhC https://t.co/gH660GHw9t",en,Hologic
Wed May 16 19:01:43 +0000 2018,This week is  #NWHW and we're empowering women across the country to make their health a priority. Learn more about making small changes for a healthier you: https://t.co/TOGYq4Gmf6. https://t.co/ZItn9DTYqQ,en,Hologic
Wed May 16 16:01:45 +0000 2018,Are you ready to take control of your #heavyperiod symptoms? Let us help. Use our ‘Find a Physician’ tool to locate an #OBGYN near you: https://t.co/hsUgVGxWHw https://t.co/D5QGDOU6Kh,en,Hologic
Wed May 16 13:01:44 +0000 2018,"As a global champion of women's health, we are dedicated to improving people's lives through early detection and proactive treatment. Learn more here: https://t.co/PcAmLWcP9O. https://t.co/5eeKPlMuQd",en,Hologic
Tue May 15 16:01:29 +0000 2018,"#ICYMI: Check out this article published in @WomensHealthMag to learn more about heavy periods, and how to know if you experience them: https://t.co/hJKMGxwFGG",en,Hologic
Tue May 15 14:26:21 +0000 2018,"RT @TIME: STDs reached a record high in California last year, according to state health authorities https://t.co/u7moVPR1Ic",en,Hologic
Tue May 15 13:01:52 +0000 2018,"Today, CEO Steve MacMillan will present at the @BankofAmericaMerrillLynch Healthcare Conference in Las Vegas. Listen live here: https://t.co/2NLF6Iyav0 https://t.co/TDCv1AGY5u",en,Hologic
Mon May 14 16:01:14 +0000 2018,"Looking to make a career move? Hear from Elizabeth as she shares how Hologic empowers employees in the workplace. To learn more about our opportunities, visit: https://t.co/074zcCHz6s https://t.co/TbBdFtAynJ",en,Hologic
Mon May 14 13:01:33 +0000 2018,"It's National Women's Check-up Day! Check out this article from @Healthline highlighting the physicians every woman should see, including the gynecologist: https://t.co/RaLMpM1UEm. #NWHW",en,Hologic
Sun May 13 16:01:27 +0000 2018,"Happy #MothersDay! Today, take time to celebrate the women in your life with appreciation and love. https://t.co/JwdXmMeb1H",en,Hologic
Fri May 11 20:28:19 +0000 2018,"Final day at the @theCSCCa national conference, final chance to see how the Dexalytics:TEAMS technology can help coaches train better athletes. https://t.co/PAZVprQWSr",en,Hologic
Fri May 11 18:55:51 +0000 2018,Thank you for advocating for #cervicalcancer screening @ErinAndrews! #ChangeThisStat https://t.co/CewIaxiHkv,en,Hologic
Fri May 11 16:01:31 +0000 2018,HPV is common—that’s why getting tested with both Pap + HPV together is important for women ages 30-65. Learn all about the importance of regular testing at https://t.co/81Ochflfzt https://t.co/sZvlGpTrws,en,Hologic
Fri May 11 00:00:54 +0000 2018,We are excited to attend #RadiologyAsia2018 in Singapore on May 11-13. Come visit us at Booth# G02 to learn more about our medical imaging system innovations! https://t.co/09gDx7cp5v,en,Hologic
Thu May 10 18:44:39 +0000 2018,"Dr. Cindy Basinski, OBGYN, talks all things #heavyperiods in this new @WomensHealthMag piece.  Find the full article here: https://t.co/mzE1CdXVZa #WeHateHeavyPeriods",en,Hologic
Thu May 10 14:30:40 +0000 2018,Next week is National Women's Health Week! We want women everywhere to take control of their health. Visit @womenshealth to learn more: https://t.co/TOGYq4Gmf6 #NWHW https://t.co/La6rHwlPHE,en,Hologic
Wed May 09 16:00:30 +0000 2018,Excited to announce results of the NovaSure/Minerva retrospective study: https://t.co/NG6g2oNna0,en,Hologic
Wed May 09 13:01:50 +0000 2018,"Studies show that heavy periods can mean much more than heavy bleeding -- they can affect you in a number of ways. To read more on this, visit: https://t.co/nNzfPS7hIW. https://t.co/NcmdbxKH4d",en,Hologic
Wed May 09 12:00:55 +0000 2018,"Today, $HOLX CFO Bob McMahon will present at the @DeutscheBank 43rd Annual Health Care Conference in Boston.  Listen live here: https://t.co/pWFotNRd9O https://t.co/yiO6WhNCwF",en,Hologic
Tue May 08 16:00:24 +0000 2018,"It’s the last day to visit Booth 201 in the exhibit hall today during the Clinical Virology Symposium. Learn more about our viral targets, including HSV 1 &amp; 2, HIV-1, HBV, HCV, HPV, HSV, parainfluenza, Adv/hMPV/RV and flu A/B/RSV. https://t.co/hNZfeyp0oL",en,Hologic
Mon May 07 16:01:05 +0000 2018,Don’t miss our workshops on the future of respiratory and viral testing today and be sure to visit with us in the exhibit hall at Booth 201. #ASMCVS https://t.co/xIMpVximn8,en,Hologic
Mon May 07 13:01:08 +0000 2018,"Join Dr. Lizellen La Follette as she shares her experience on expanding her practice with the Icon™ Aesthetic Platform on Thursday, May 17th at 8pm. https://t.co/9gTDn1xc4q",en,Hologic
Sun May 06 18:00:44 +0000 2018,The exhibit hall opens today at the Clinical Virology Symposium. Visit Booth 201 to talk about the Panther Fusion Respiratory assays for personalized patient care. #ASMCVS https://t.co/kPDFWgvi0I,en,Hologic
Sun May 06 16:01:01 +0000 2018,Learn more about the Aptima® HBV Quant assay and the rest of the viral-load portfolio from Hologic at Booth 201 during the Clinical Virology Symposium. #ASMCVS https://t.co/qo50FwUb5s,en,Hologic
Sun May 06 16:00:26 +0000 2018,It was great to see so many people at #CACMID2018 and to share our latest innovations. Get in touch if you didn't have time to see us! info-canada@hologic.com https://t.co/ugozPrhxIX,en,Hologic
Sun May 06 13:00:36 +0000 2018,It's National Nurses Day! Thank you to nurses everywhere for their important role in caring for patients day after day. https://t.co/eB4f235sDD,en,Hologic
Sat May 05 14:01:17 +0000 2018,Join Dr. Mulholland in Michigan on May 19-20 for the next stop on the Aesthetic Innovation Tour! Dr. Mulholland will give you the know-how and confidence you need to succeed. Register today! https://t.co/CNDyGxYmgc https://t.co/xTQLUzSzoI,en,Hologic
Sat May 05 13:01:10 +0000 2018,We’re here at the Clinical Virology Symposium! You don’t want to miss our workshops on Monday. #ASMCVS https://t.co/wADGeIGJwf,en,Hologic
Fri May 04 16:01:09 +0000 2018,#DYK HPV is the #1 cause of #cervicalcancer? Check out this article from @NFCR for 6 must-know facts about this condition: https://t.co/TQN3jczoMY. #ScienceFriday https://t.co/rRk1vV0vKW,en,Hologic
Fri May 04 13:01:07 +0000 2018,Wondering how SculpSure works? See SculpSure's feature in NEWBEAUTY with Dr. Wattenberg (NYC Dermatologist) discussing this non-invasive laser technology. https://t.co/khO6ZGH589,en,Hologic
Fri May 04 11:01:01 +0000 2018,Conference delegates are invited to register for our AMMI-Canada Cacmid accredited symposium.&lt;&lt;https://t.co/nhkZrAGfoe &gt;&gt; Sheraton Vancouver Wall Centre 7:15 am  #CACMID https://t.co/9kr7mZ0mHx,en,Hologic
